"No.","Time","Source","Destination","Protocol","Length","Info"
"1","0.000000000","fe80::d8da:95ff:fec1:6de5","ff02::2","ICMPv6","70","Router Solicitation from da:da:95:c1:6d:e5"
"2","0.511094914","fe80::6cd1:43ff:fead:975a","ff02::2","ICMPv6","70","Router Solicitation from 6e:d1:43:ad:97:5a"
"3","0.511270138","fe80::a03e:74ff:fe26:ebfb","ff02::2","ICMPv6","70","Router Solicitation from a2:3e:74:26:eb:fb"
"4","0.511949444","fe80::a4e1:aaff:fe29:2a15","ff02::2","ICMPv6","70","Router Solicitation from a6:e1:aa:29:2a:15"
"5","0.512049036","fe80::e0a2:14ff:fe9f:8e34","ff02::2","ICMPv6","70","Router Solicitation from e2:a2:14:9f:8e:34"
"6","0.816316825","fe80::493f:17d2:bdb8:fde3","ff02::2","ICMPv6","62","Router Solicitation"
"7","1.534658643","fe80::d0d8:28ff:fea5:3759","ff02::2","ICMPv6","70","Router Solicitation from d2:d8:28:a5:37:59"
"8","1.535014394","fe80::3c5b:8bff:fea6:dffb","ff02::2","ICMPv6","70","Router Solicitation from 3e:5b:8b:a6:df:fb"
"9","2.114824586","fe80::493f:17d2:bdb8:fde3","ff02::fb","MDNS","203","Standard query 0x0000 PTR _nfs._tcp.local, ""QM"" question PTR _ipp._tcp.local, ""QM"" question PTR _ipps._tcp.local, ""QM"" question PTR _ftp._tcp.local, ""QM"" question PTR _webdav._tcp.local, ""QM"" question PTR _webdavs._tcp.local, ""QM"" question PTR _sftp-ssh._tcp.local, ""QM"" question PTR _smb._tcp.local, ""QM"" question PTR _afpovertcp._tcp.local, ""QM"" question"
"10","3.275022270","0.0.0.0","255.255.255.255","DHCP","334","DHCP Discover - Transaction ID 0xa3555a83"
"11","7.547430152","d2:d8:28:a5:37:59","Broadcast","ARP","42","Who has 10.0.0.7? Tell 10.0.0.1"
"12","7.548262219","a6:e1:aa:29:2a:15","Broadcast","ARP","42","Who has 10.0.0.7? Tell 10.0.0.3"
"13","7.548464987","a2:3e:74:26:eb:fb","Broadcast","ARP","42","Who has 10.0.0.7? Tell 10.0.0.4"
"14","7.549060810","e2:a2:14:9f:8e:34","d2:d8:28:a5:37:59","ARP","42","10.0.0.7 is at e2:a2:14:9f:8e:34"
"15","7.549080561","10.0.0.1","10.0.0.7","TCP","74","38228  >  5201 [SYN] Seq=0 Win=42340 Len=0 MSS=1460 SACK_PERM TSval=2451333113 TSecr=0 WS=512"
"16","7.550125738","10.0.0.7","10.0.0.1","TCP","74","5201  >  38228 [SYN, ACK] Seq=0 Ack=1 Win=43440 Len=0 MSS=1460 SACK_PERM TSval=2179447439 TSecr=2451333113 WS=512"
"17","7.550152479","10.0.0.1","10.0.0.7","TCP","66","38228  >  5201 [ACK] Seq=1 Ack=1 Win=42496 Len=0 TSval=2451333116 TSecr=2179447439"
"18","7.550242394","10.0.0.1","10.0.0.7","iPerf3","103","38228  >  5201 Cookie: ""7zfbt63yev5diomafvzelj34ixq6qrjas24v"""
"19","7.550286830","10.0.0.7","10.0.0.1","TCP","66","5201  >  38228 [ACK] Seq=1 Ack=38 Win=43520 Len=0 TSval=2179447439 TSecr=2451333116"
"20","7.550317299","10.0.0.7","10.0.0.1","iPerf3","67","5201  >  38228 PARAM_EXCHANGE(9)"
"21","7.550325444","10.0.0.1","10.0.0.7","TCP","66","38228  >  5201 [ACK] Seq=38 Ack=2 Win=42496 Len=0 TSval=2451333116 TSecr=2179447439"
"22","7.550367298","10.0.0.1","10.0.0.7","iPerf3","70","38228  >  5201 Next message is JSON of this length: 172"
"23","7.550384398","10.0.0.1","10.0.0.7","iPerf3/JSON","238","38228  >  5201 {""tcp"":true,""omit"":0,""time"":150,""num"":0,""blockcount"":0,""parallel"":10,""len"":131072,""bandwidth"":10000000,""pacing_timer"":1000,""congestion"":""highspeed"",""client_version"":""3.16""}, JSON"
"24","7.550407654","10.0.0.7","10.0.0.1","TCP","66","5201  >  38228 [ACK] Seq=2 Ack=214 Win=43520 Len=0 TSval=2179447439 TSecr=2451333116"
"25","7.550475496","10.0.0.7","10.0.0.1","iPerf3","67","5201  >  38228 CREATE_STREAMS(10)"
"26","7.550557012","10.0.0.1","10.0.0.7","TCP","74","38236  >  5201 [SYN] Seq=0 Win=42340 Len=0 MSS=1460 SACK_PERM TSval=2451333117 TSecr=0 WS=512"
"27","7.550589700","10.0.0.7","10.0.0.1","TCP","74","5201  >  38236 [SYN, ACK] Seq=0 Ack=1 Win=43440 Len=0 MSS=1460 SACK_PERM TSval=2179447440 TSecr=2451333117 WS=512"
"28","7.550602554","10.0.0.1","10.0.0.7","TCP","66","38236  >  5201 [ACK] Seq=1 Ack=1 Win=42496 Len=0 TSval=2451333117 TSecr=2179447440"
"29","7.550628691","10.0.0.1","10.0.0.7","iPerf3","103","38236  >  5201 Cookie: ""7zfbt63yev5diomafvzelj34ixq6qrjas24v"""
"30","7.550643640","10.0.0.7","10.0.0.1","TCP","66","5201  >  38236 [ACK] Seq=1 Ack=38 Win=43520 Len=0 TSval=2179447440 TSecr=2451333117"
"31","7.551764581","10.0.0.1","10.0.0.7","TCP","74","38242  >  5201 [SYN] Seq=0 Win=42340 Len=0 MSS=1460 SACK_PERM TSval=2451333118 TSecr=0 WS=512"
"32","7.551797031","10.0.0.7","10.0.0.1","TCP","74","5201  >  38242 [SYN, ACK] Seq=0 Ack=1 Win=43440 Len=0 MSS=1460 SACK_PERM TSval=2179447441 TSecr=2451333118 WS=512"
"33","7.551808136","10.0.0.1","10.0.0.7","TCP","66","38242  >  5201 [ACK] Seq=1 Ack=1 Win=42496 Len=0 TSval=2451333118 TSecr=2179447441"
"34","7.551829068","10.0.0.1","10.0.0.7","iPerf3","103","38242  >  5201 Cookie: ""7zfbt63yev5diomafvzelj34ixq6qrjas24v"""
"35","7.551843835","10.0.0.7","10.0.0.1","TCP","66","5201  >  38242 [ACK] Seq=1 Ack=38 Win=43520 Len=0 TSval=2179447441 TSecr=2451333118"
"36","7.552817052","10.0.0.1","10.0.0.7","TCP","74","38256  >  5201 [SYN] Seq=0 Win=42340 Len=0 MSS=1460 SACK_PERM TSval=2451333119 TSecr=0 WS=512"
"37","7.552839902","10.0.0.7","10.0.0.1","TCP","74","5201  >  38256 [SYN, ACK] Seq=0 Ack=1 Win=43440 Len=0 MSS=1460 SACK_PERM TSval=2179447442 TSecr=2451333119 WS=512"
"38","7.552848086","10.0.0.1","10.0.0.7","TCP","66","38256  >  5201 [ACK] Seq=1 Ack=1 Win=42496 Len=0 TSval=2451333119 TSecr=2179447442"
"39","7.552865484","10.0.0.1","10.0.0.7","iPerf3","103","38256  >  5201 Cookie: ""7zfbt63yev5diomafvzelj34ixq6qrjas24v"""
"40","7.552879245","10.0.0.7","10.0.0.1","TCP","66","5201  >  38256 [ACK] Seq=1 Ack=38 Win=43520 Len=0 TSval=2179447442 TSecr=2451333119"
"41","7.553821956","10.0.0.1","10.0.0.7","TCP","74","38260  >  5201 [SYN] Seq=0 Win=42340 Len=0 MSS=1460 SACK_PERM TSval=2451333120 TSecr=0 WS=512"
"42","7.553844666","10.0.0.7","10.0.0.1","TCP","74","5201  >  38260 [SYN, ACK] Seq=0 Ack=1 Win=43440 Len=0 MSS=1460 SACK_PERM TSval=2179447443 TSecr=2451333120 WS=512"
"43","7.553852339","10.0.0.1","10.0.0.7","TCP","66","38260  >  5201 [ACK] Seq=1 Ack=1 Win=42496 Len=0 TSval=2451333120 TSecr=2179447443"
"44","7.553869374","10.0.0.1","10.0.0.7","iPerf3","103","38260  >  5201 Cookie: ""7zfbt63yev5diomafvzelj34ixq6qrjas24v"""
"45","7.553882927","10.0.0.7","10.0.0.1","TCP","66","5201  >  38260 [ACK] Seq=1 Ack=38 Win=43520 Len=0 TSval=2179447443 TSecr=2451333120"
"46","7.554769456","10.0.0.1","10.0.0.7","TCP","74","38276  >  5201 [SYN] Seq=0 Win=42340 Len=0 MSS=1460 SACK_PERM TSval=2451333121 TSecr=0 WS=512"
"47","7.554776704","10.0.0.7","10.0.0.1","TCP","74","5201  >  38276 [SYN, ACK] Seq=0 Ack=1 Win=43440 Len=0 MSS=1460 SACK_PERM TSval=2179447444 TSecr=2451333121 WS=512"
"48","7.554779435","10.0.0.1","10.0.0.7","TCP","66","38276  >  5201 [ACK] Seq=1 Ack=1 Win=42496 Len=0 TSval=2451333121 TSecr=2179447444"
"49","7.554785081","10.0.0.1","10.0.0.7","iPerf3","103","38276  >  5201 Cookie: ""7zfbt63yev5diomafvzelj34ixq6qrjas24v"""
"50","7.554789449","10.0.0.7","10.0.0.1","TCP","66","5201  >  38276 [ACK] Seq=1 Ack=38 Win=43520 Len=0 TSval=2179447444 TSecr=2451333121"
"51","7.555115237","10.0.0.1","10.0.0.7","TCP","74","38290  >  5201 [SYN] Seq=0 Win=42340 Len=0 MSS=1460 SACK_PERM TSval=2451333121 TSecr=0 WS=512"
"52","7.555122954","10.0.0.7","10.0.0.1","TCP","74","5201  >  38290 [SYN, ACK] Seq=0 Ack=1 Win=43440 Len=0 MSS=1460 SACK_PERM TSval=2179447444 TSecr=2451333121 WS=512"
"53","7.555125174","10.0.0.1","10.0.0.7","TCP","66","38290  >  5201 [ACK] Seq=1 Ack=1 Win=42496 Len=0 TSval=2451333121 TSecr=2179447444"
"54","7.555130399","10.0.0.1","10.0.0.7","iPerf3","103","38290  >  5201 Cookie: ""7zfbt63yev5diomafvzelj34ixq6qrjas24v"""
"55","7.555134812","10.0.0.7","10.0.0.1","TCP","66","5201  >  38290 [ACK] Seq=1 Ack=38 Win=43520 Len=0 TSval=2179447444 TSecr=2451333121"
"56","7.555464420","10.0.0.1","10.0.0.7","TCP","74","38296  >  5201 [SYN] Seq=0 Win=42340 Len=0 MSS=1460 SACK_PERM TSval=2451333121 TSecr=0 WS=512"
"57","7.555472315","10.0.0.7","10.0.0.1","TCP","74","5201  >  38296 [SYN, ACK] Seq=0 Ack=1 Win=43440 Len=0 MSS=1460 SACK_PERM TSval=2179447444 TSecr=2451333121 WS=512"
"58","7.555474732","10.0.0.1","10.0.0.7","TCP","66","38296  >  5201 [ACK] Seq=1 Ack=1 Win=42496 Len=0 TSval=2451333121 TSecr=2179447444"
"59","7.555480742","10.0.0.1","10.0.0.7","iPerf3","103","38296  >  5201 Cookie: ""7zfbt63yev5diomafvzelj34ixq6qrjas24v"""
"60","7.555485021","10.0.0.7","10.0.0.1","TCP","66","5201  >  38296 [ACK] Seq=1 Ack=38 Win=43520 Len=0 TSval=2179447444 TSecr=2451333121"
"61","7.555808157","10.0.0.1","10.0.0.7","TCP","74","38306  >  5201 [SYN] Seq=0 Win=42340 Len=0 MSS=1460 SACK_PERM TSval=2451333122 TSecr=0 WS=512"
"62","7.555814926","10.0.0.7","10.0.0.1","TCP","74","5201  >  38306 [SYN, ACK] Seq=0 Ack=1 Win=43440 Len=0 MSS=1460 SACK_PERM TSval=2179447445 TSecr=2451333122 WS=512"
"63","7.555817613","10.0.0.1","10.0.0.7","TCP","66","38306  >  5201 [ACK] Seq=1 Ack=1 Win=42496 Len=0 TSval=2451333122 TSecr=2179447445"
"64","7.555823024","10.0.0.1","10.0.0.7","iPerf3","103","38306  >  5201 Cookie: ""7zfbt63yev5diomafvzelj34ixq6qrjas24v"""
"65","7.555827372","10.0.0.7","10.0.0.1","TCP","66","5201  >  38306 [ACK] Seq=1 Ack=38 Win=43520 Len=0 TSval=2179447445 TSecr=2451333122"
"66","7.556179141","10.0.0.1","10.0.0.7","TCP","74","38320  >  5201 [SYN] Seq=0 Win=42340 Len=0 MSS=1460 SACK_PERM TSval=2451333122 TSecr=0 WS=512"
"67","7.556194504","10.0.0.7","10.0.0.1","TCP","74","5201  >  38320 [SYN, ACK] Seq=0 Ack=1 Win=43440 Len=0 MSS=1460 SACK_PERM TSval=2179447445 TSecr=2451333122 WS=512"
"68","7.556199303","10.0.0.1","10.0.0.7","TCP","66","38320  >  5201 [ACK] Seq=1 Ack=1 Win=42496 Len=0 TSval=2451333122 TSecr=2179447445"
"69","7.556211742","10.0.0.1","10.0.0.7","iPerf3","103","38320  >  5201 Cookie: ""7zfbt63yev5diomafvzelj34ixq6qrjas24v"""
"70","7.556216280","10.0.0.7","10.0.0.1","TCP","66","5201  >  38320 [ACK] Seq=1 Ack=38 Win=43520 Len=0 TSval=2179447445 TSecr=2451333122"
"71","7.556551503","10.0.0.1","10.0.0.7","TCP","74","38334  >  5201 [SYN] Seq=0 Win=42340 Len=0 MSS=1460 SACK_PERM TSval=2451333123 TSecr=0 WS=512"
"72","7.556558969","10.0.0.7","10.0.0.1","TCP","74","5201  >  38334 [SYN, ACK] Seq=0 Ack=1 Win=43440 Len=0 MSS=1460 SACK_PERM TSval=2179447446 TSecr=2451333123 WS=512"
"73","7.556562265","10.0.0.1","10.0.0.7","TCP","66","38334  >  5201 [ACK] Seq=1 Ack=1 Win=42496 Len=0 TSval=2451333123 TSecr=2179447446"
"74","7.556568435","10.0.0.1","10.0.0.7","iPerf3","103","38334  >  5201 Cookie: ""7zfbt63yev5diomafvzelj34ixq6qrjas24v"""
"75","7.556572836","10.0.0.7","10.0.0.1","TCP","66","5201  >  38334 [ACK] Seq=1 Ack=38 Win=43520 Len=0 TSval=2179447446 TSecr=2451333123"
"76","7.558242030","10.0.0.7","10.0.0.1","iPerf3","67","5201  >  38228 TEST_START(1)"
"77","7.558264722","10.0.0.7","10.0.0.1","iPerf3","67","5201  >  38228 TEST_RUNNING(2)"
"78","7.558302401","10.0.0.1","10.0.0.7","TCP","66","38228  >  5201 [ACK] Seq=214 Ack=5 Win=42496 Len=0 TSval=2451333124 TSecr=2179447439"
"79","7.558400147","10.0.0.1","10.0.0.7","TCP","7306","38236  >  5201 [PSH, ACK] Seq=38 Ack=1 Win=42496 Len=7240 TSval=2451333124 TSecr=2179447440"
"80","7.558410420","10.0.0.1","10.0.0.7","TCP","7306","38236  >  5201 [PSH, ACK] Seq=7278 Ack=1 Win=42496 Len=7240 TSval=2451333124 TSecr=2179447440"
"81","7.558424869","10.0.0.1","10.0.0.7","TCP","7306","38242  >  5201 [PSH, ACK] Seq=38 Ack=1 Win=42496 Len=7240 TSval=2451333124 TSecr=2179447441"
"82","7.558434582","10.0.0.1","10.0.0.7","TCP","7306","38242  >  5201 [PSH, ACK] Seq=7278 Ack=1 Win=42496 Len=7240 TSval=2451333124 TSecr=2179447441"
"83","7.558455681","10.0.0.1","10.0.0.7","TCP","7306","38256  >  5201 [PSH, ACK] Seq=38 Ack=1 Win=42496 Len=7240 TSval=2451333124 TSecr=2179447442"
"84","7.558468121","10.0.0.1","10.0.0.7","TCP","7306","38256  >  5201 [PSH, ACK] Seq=7278 Ack=1 Win=42496 Len=7240 TSval=2451333124 TSecr=2179447442"
"85","7.558532056","10.0.0.1","10.0.0.7","TCP","7306","38276  >  5201 [PSH, ACK] Seq=38 Ack=1 Win=42496 Len=7240 TSval=2451333125 TSecr=2179447444"
"86","7.558540899","10.0.0.1","10.0.0.7","TCP","7306","38276  >  5201 [PSH, ACK] Seq=7278 Ack=1 Win=42496 Len=7240 TSval=2451333125 TSecr=2179447444"
"87","7.558545037","10.0.0.1","10.0.0.7","TCP","7306","38260  >  5201 [PSH, ACK] Seq=38 Ack=1 Win=42496 Len=7240 TSval=2451333125 TSecr=2179447443"
"88","7.558555698","10.0.0.1","10.0.0.7","TCP","7306","38260  >  5201 [PSH, ACK] Seq=7278 Ack=1 Win=42496 Len=7240 TSval=2451333125 TSecr=2179447443"
"89","7.558578618","10.0.0.1","10.0.0.7","TCP","7306","38290  >  5201 [PSH, ACK] Seq=38 Ack=1 Win=42496 Len=7240 TSval=2451333125 TSecr=2179447444"
"90","7.558584907","10.0.0.1","10.0.0.7","TCP","7306","38290  >  5201 [PSH, ACK] Seq=7278 Ack=1 Win=42496 Len=7240 TSval=2451333125 TSecr=2179447444"
"91","7.558588654","10.0.0.1","10.0.0.7","TCP","7306","38296  >  5201 [PSH, ACK] Seq=38 Ack=1 Win=42496 Len=7240 TSval=2451333125 TSecr=2179447444"
"92","7.558595755","10.0.0.1","10.0.0.7","TCP","7306","38296  >  5201 [PSH, ACK] Seq=7278 Ack=1 Win=42496 Len=7240 TSval=2451333125 TSecr=2179447444"
"93","7.558605735","10.0.0.1","10.0.0.7","TCP","7306","38306  >  5201 [PSH, ACK] Seq=38 Ack=1 Win=42496 Len=7240 TSval=2451333125 TSecr=2179447445"
"94","7.558615633","10.0.0.1","10.0.0.7","TCP","7306","38306  >  5201 [PSH, ACK] Seq=7278 Ack=1 Win=42496 Len=7240 TSval=2451333125 TSecr=2179447445"
"95","7.558629761","10.0.0.1","10.0.0.7","TCP","7306","38320  >  5201 [PSH, ACK] Seq=38 Ack=1 Win=42496 Len=7240 TSval=2451333125 TSecr=2179447445"
"96","7.558634810","10.0.0.1","10.0.0.7","TCP","7306","38320  >  5201 [PSH, ACK] Seq=7278 Ack=1 Win=42496 Len=7240 TSval=2451333125 TSecr=2179447445"
"97","7.558651867","10.0.0.1","10.0.0.7","TCP","7306","38334  >  5201 [PSH, ACK] Seq=38 Ack=1 Win=42496 Len=7240 TSval=2451333125 TSecr=2179447446"
"98","7.558659206","10.0.0.1","10.0.0.7","TCP","7306","38334  >  5201 [PSH, ACK] Seq=7278 Ack=1 Win=42496 Len=7240 TSval=2451333125 TSecr=2179447446"
"99","7.561524369","10.0.0.1","10.0.0.7","TCP","1514","38242  >  5201 [ACK] Seq=14518 Ack=1 Win=42496 Len=1448 TSval=2451333128 TSecr=2179447441"
"100","7.561528603","10.0.0.1","10.0.0.7","TCP","1514","38236  >  5201 [ACK] Seq=14518 Ack=1 Win=42496 Len=1448 TSval=2451333128 TSecr=2179447440"
"101","7.561599997","10.0.0.7","10.0.0.1","TCP","67","[TCP Keep-Alive] 5201  >  38228 [PSH, ACK] Seq=4 Ack=214 Win=43520 Len=1 TSval=2179447451 TSecr=2451333116"
"102","7.561610767","10.0.0.1","10.0.0.7","TCP","78","[TCP Keep-Alive ACK] 38228  >  5201 [ACK] Seq=214 Ack=5 Win=42496 Len=0 TSval=2451333128 TSecr=2179447451 SLE=4 SRE=5"
"103","7.561636143","10.0.0.1","10.0.0.7","TCP","1514","38256  >  5201 [ACK] Seq=14518 Ack=1 Win=42496 Len=1448 TSval=2451333128 TSecr=2179447442"
"104","7.562517941","10.0.0.1","10.0.0.7","TCP","1514","38296  >  5201 [ACK] Seq=14518 Ack=1 Win=42496 Len=1448 TSval=2451333129 TSecr=2179447444"
"105","7.562519184","10.0.0.1","10.0.0.7","TCP","1514","38260  >  5201 [ACK] Seq=14518 Ack=1 Win=42496 Len=1448 TSval=2451333129 TSecr=2179447443"
"106","7.562520634","10.0.0.1","10.0.0.7","TCP","1514","38320  >  5201 [ACK] Seq=14518 Ack=1 Win=42496 Len=1448 TSval=2451333129 TSecr=2179447445"
"107","7.562524507","10.0.0.1","10.0.0.7","TCP","1514","38306  >  5201 [ACK] Seq=14518 Ack=1 Win=42496 Len=1448 TSval=2451333129 TSecr=2179447445"
"108","7.562525318","10.0.0.1","10.0.0.7","TCP","1514","38276  >  5201 [ACK] Seq=14518 Ack=1 Win=42496 Len=1448 TSval=2451333129 TSecr=2179447444"
"109","7.562525720","10.0.0.1","10.0.0.7","TCP","1514","38334  >  5201 [ACK] Seq=14518 Ack=1 Win=42496 Len=1448 TSval=2451333129 TSecr=2179447446"
"110","7.562526191","10.0.0.1","10.0.0.7","TCP","1514","38290  >  5201 [ACK] Seq=14518 Ack=1 Win=42496 Len=1448 TSval=2451333129 TSecr=2179447444"
"111","7.619430367","10.0.0.7","10.0.0.1","TCP","66","5201  >  38236 [ACK] Seq=1 Ack=7278 Win=56832 Len=0 TSval=2179447508 TSecr=2451333124"
"112","7.619440513","10.0.0.1","10.0.0.7","TCP","10202","38236  >  5201 [PSH, ACK] Seq=15966 Ack=1 Win=42496 Len=10136 TSval=2451333185 TSecr=2179447508"
"113","7.621845784","10.0.0.7","10.0.0.1","TCP","66","5201  >  38236 [ACK] Seq=1 Ack=14518 Win=70656 Len=0 TSval=2179447511 TSecr=2451333124"
"114","7.621851933","10.0.0.1","10.0.0.7","TCP","10202","38236  >  5201 [PSH, ACK] Seq=26102 Ack=1 Win=42496 Len=10136 TSval=2451333188 TSecr=2179447511"
"115","7.624269168","10.0.0.7","10.0.0.1","TCP","66","5201  >  38242 [ACK] Seq=1 Ack=7278 Win=56832 Len=0 TSval=2179447513 TSecr=2451333124"
"116","7.624274616","10.0.0.1","10.0.0.7","TCP","10202","38242  >  5201 [PSH, ACK] Seq=15966 Ack=1 Win=42496 Len=10136 TSval=2451333190 TSecr=2179447513"
"117","7.626693714","10.0.0.7","10.0.0.1","TCP","66","5201  >  38242 [ACK] Seq=1 Ack=14518 Win=70656 Len=0 TSval=2179447516 TSecr=2451333124"
"118","7.626701764","10.0.0.1","10.0.0.7","TCP","10202","38242  >  5201 [PSH, ACK] Seq=26102 Ack=1 Win=42496 Len=10136 TSval=2451333193 TSecr=2179447516"
"119","7.631293855","10.0.0.7","10.0.0.1","TCP","66","5201  >  38256 [ACK] Seq=1 Ack=7278 Win=56832 Len=0 TSval=2179447520 TSecr=2451333124"
"120","7.631300132","10.0.0.1","10.0.0.7","TCP","10202","38256  >  5201 [PSH, ACK] Seq=15966 Ack=1 Win=42496 Len=10136 TSval=2451333197 TSecr=2179447520"
"121","7.633715034","10.0.0.7","10.0.0.1","TCP","66","5201  >  38256 [ACK] Seq=1 Ack=14518 Win=64000 Len=0 TSval=2179447523 TSecr=2451333124"
"122","7.633723425","10.0.0.1","10.0.0.7","TCP","10202","38256  >  5201 [PSH, ACK] Seq=26102 Ack=1 Win=42496 Len=10136 TSval=2451333200 TSecr=2179447523"
"123","7.640984121","10.0.0.7","10.0.0.1","TCP","66","5201  >  38276 [ACK] Seq=1 Ack=7278 Win=56832 Len=0 TSval=2179447530 TSecr=2451333125"
"124","7.640991060","10.0.0.1","10.0.0.7","TCP","10202","38276  >  5201 [PSH, ACK] Seq=15966 Ack=1 Win=42496 Len=10136 TSval=2451333207 TSecr=2179447530"
"125","7.645223643","10.0.0.7","10.0.0.1","TCP","66","5201  >  38276 [ACK] Seq=1 Ack=14518 Win=70656 Len=0 TSval=2179447534 TSecr=2451333125"
"126","7.645231312","10.0.0.1","10.0.0.7","TCP","10202","38276  >  5201 [PSH, ACK] Seq=26102 Ack=1 Win=42496 Len=10136 TSval=2451333211 TSecr=2179447534"
"127","7.645830403","10.0.0.7","10.0.0.1","TCP","66","5201  >  38260 [ACK] Seq=1 Ack=7278 Win=56832 Len=0 TSval=2179447535 TSecr=2451333125"
"128","7.645836595","10.0.0.1","10.0.0.7","TCP","10202","38260  >  5201 [PSH, ACK] Seq=15966 Ack=1 Win=42496 Len=10136 TSval=2451333212 TSecr=2179447535"
"129","7.650065740","10.0.0.7","10.0.0.1","TCP","66","5201  >  38260 [ACK] Seq=1 Ack=14518 Win=70656 Len=0 TSval=2179447539 TSecr=2451333125"
"130","7.650072565","10.0.0.1","10.0.0.7","TCP","10202","38260  >  5201 [PSH, ACK] Seq=26102 Ack=1 Win=42496 Len=10136 TSval=2451333216 TSecr=2179447539"
"131","7.652491136","10.0.0.7","10.0.0.1","TCP","66","5201  >  38290 [ACK] Seq=1 Ack=7278 Win=56832 Len=0 TSval=2179447541 TSecr=2451333125"
"132","7.652496530","10.0.0.1","10.0.0.7","TCP","10202","38290  >  5201 [PSH, ACK] Seq=15966 Ack=1 Win=42496 Len=10136 TSval=2451333218 TSecr=2179447541"
"133","7.653092624","10.0.0.7","10.0.0.1","TCP","66","5201  >  38290 [ACK] Seq=1 Ack=14518 Win=64000 Len=0 TSval=2179447542 TSecr=2451333125"
"134","7.653099603","10.0.0.1","10.0.0.7","TCP","10202","38290  >  5201 [PSH, ACK] Seq=26102 Ack=1 Win=42496 Len=10136 TSval=2451333219 TSecr=2179447542"
"135","7.653706781","10.0.0.7","10.0.0.1","TCP","66","5201  >  38296 [ACK] Seq=1 Ack=7278 Win=56832 Len=0 TSval=2179447543 TSecr=2451333125"
"136","7.653712266","10.0.0.1","10.0.0.7","TCP","10202","38296  >  5201 [PSH, ACK] Seq=15966 Ack=1 Win=42496 Len=10136 TSval=2451333220 TSecr=2179447543"
"137","7.655035946","10.0.0.7","10.0.0.1","TCP","66","5201  >  38296 [ACK] Seq=1 Ack=14518 Win=64000 Len=0 TSval=2179447544 TSecr=2451333125"
"138","7.655042998","10.0.0.1","10.0.0.7","TCP","10202","38296  >  5201 [PSH, ACK] Seq=26102 Ack=1 Win=42496 Len=10136 TSval=2451333221 TSecr=2179447544"
"139","7.655644665","10.0.0.7","10.0.0.1","TCP","66","5201  >  38306 [ACK] Seq=1 Ack=7278 Win=56832 Len=0 TSval=2179447545 TSecr=2451333125"
"140","7.655650233","10.0.0.1","10.0.0.7","TCP","10202","38306  >  5201 [PSH, ACK] Seq=15966 Ack=1 Win=42496 Len=10136 TSval=2451333222 TSecr=2179447545"
"141","7.656247393","10.0.0.7","10.0.0.1","TCP","66","5201  >  38306 [ACK] Seq=1 Ack=14518 Win=64000 Len=0 TSval=2179447545 TSecr=2451333125"
"142","7.656254453","10.0.0.1","10.0.0.7","TCP","10202","38306  >  5201 [PSH, ACK] Seq=26102 Ack=1 Win=42496 Len=10136 TSval=2451333222 TSecr=2179447545"
"143","7.656856182","10.0.0.7","10.0.0.1","TCP","66","5201  >  38320 [ACK] Seq=1 Ack=7278 Win=56832 Len=0 TSval=2179447546 TSecr=2451333125"
"144","7.656862021","10.0.0.1","10.0.0.7","TCP","10202","38320  >  5201 [PSH, ACK] Seq=15966 Ack=1 Win=42496 Len=10136 TSval=2451333223 TSecr=2179447546"
"145","7.657579281","10.0.0.7","10.0.0.1","TCP","66","5201  >  38320 [ACK] Seq=1 Ack=14518 Win=64000 Len=0 TSval=2179447547 TSecr=2451333125"
"146","7.657586677","10.0.0.1","10.0.0.7","TCP","10202","38320  >  5201 [PSH, ACK] Seq=26102 Ack=1 Win=42496 Len=10136 TSval=2451333224 TSecr=2179447547"
"147","7.658189579","10.0.0.7","10.0.0.1","TCP","66","5201  >  38334 [ACK] Seq=1 Ack=7278 Win=56832 Len=0 TSval=2179447547 TSecr=2451333125"
"148","7.658195796","10.0.0.1","10.0.0.7","TCP","10202","38334  >  5201 [PSH, ACK] Seq=15966 Ack=1 Win=42496 Len=10136 TSval=2451333224 TSecr=2179447547"
"149","7.658792651","10.0.0.7","10.0.0.1","TCP","66","5201  >  38334 [ACK] Seq=1 Ack=14518 Win=64000 Len=0 TSval=2179447548 TSecr=2451333125"
"150","7.658800188","10.0.0.1","10.0.0.7","TCP","10202","38334  >  5201 [PSH, ACK] Seq=26102 Ack=1 Win=42496 Len=10136 TSval=2451333225 TSecr=2179447548"
"151","7.662305781","10.0.0.7","10.0.0.1","TCP","66","5201  >  38242 [ACK] Seq=1 Ack=15966 Win=73216 Len=0 TSval=2179447551 TSecr=2451333128"
"152","7.662428234","10.0.0.7","10.0.0.1","TCP","66","5201  >  38236 [ACK] Seq=1 Ack=15966 Win=73216 Len=0 TSval=2179447551 TSecr=2451333128"
"153","7.662560276","10.0.0.7","10.0.0.1","TCP","66","5201  >  38256 [ACK] Seq=1 Ack=15966 Win=67072 Len=0 TSval=2179447552 TSecr=2451333128"
"154","7.662675563","10.0.0.7","10.0.0.1","TCP","66","5201  >  38296 [ACK] Seq=1 Ack=15966 Win=67072 Len=0 TSval=2179447552 TSecr=2451333129"
"155","7.662795427","10.0.0.7","10.0.0.1","TCP","66","5201  >  38260 [ACK] Seq=1 Ack=15966 Win=73216 Len=0 TSval=2179447552 TSecr=2451333129"
"156","7.662917079","10.0.0.7","10.0.0.1","TCP","66","5201  >  38320 [ACK] Seq=1 Ack=15966 Win=67072 Len=0 TSval=2179447552 TSecr=2451333129"
"157","7.663037768","10.0.0.7","10.0.0.1","TCP","66","5201  >  38306 [ACK] Seq=1 Ack=15966 Win=67072 Len=0 TSval=2179447552 TSecr=2451333129"
"158","7.663159040","10.0.0.7","10.0.0.1","TCP","66","5201  >  38276 [ACK] Seq=1 Ack=15966 Win=73216 Len=0 TSval=2179447552 TSecr=2451333129"
"159","7.663291486","10.0.0.7","10.0.0.1","TCP","66","5201  >  38290 [ACK] Seq=1 Ack=15966 Win=67072 Len=0 TSval=2179447552 TSecr=2451333129"
"160","7.663405691","10.0.0.7","10.0.0.1","TCP","66","5201  >  38334 [ACK] Seq=1 Ack=15966 Win=67072 Len=0 TSval=2179447552 TSecr=2451333129"
"161","7.699697868","10.0.0.7","10.0.0.1","TCP","66","5201  >  38236 [ACK] Seq=1 Ack=26102 Win=68096 Len=0 TSval=2179447589 TSecr=2451333185"
"162","7.699707574","10.0.0.1","10.0.0.7","TCP","10202","38236  >  5201 [PSH, ACK] Seq=36238 Ack=1 Win=42496 Len=10136 TSval=2451333266 TSecr=2179447589"
"163","7.699711259","10.0.0.1","10.0.0.7","TCP","11650","38236  >  5201 [PSH, ACK] Seq=46374 Ack=1 Win=42496 Len=11584 TSval=2451333266 TSecr=2179447589"
"164","7.703464959","10.0.0.7","10.0.0.1","TCP","66","5201  >  38236 [ACK] Seq=1 Ack=36238 Win=93696 Len=0 TSval=2179447592 TSecr=2451333188"
"165","7.703483952","10.0.0.1","10.0.0.7","TCP","21786","38236  >  5201 [PSH, ACK] Seq=57958 Ack=1 Win=42496 Len=21720 TSval=2451333269 TSecr=2179447592"
"166","7.704300671","10.0.0.7","10.0.0.1","TCP","66","5201  >  38242 [ACK] Seq=1 Ack=26102 Win=68096 Len=0 TSval=2179447593 TSecr=2451333190"
"167","7.704311681","10.0.0.1","10.0.0.7","TCP","10202","38242  >  5201 [PSH, ACK] Seq=36238 Ack=1 Win=42496 Len=10136 TSval=2451333270 TSecr=2179447593"
"168","7.704315488","10.0.0.1","10.0.0.7","TCP","11650","38242  >  5201 [PSH, ACK] Seq=46374 Ack=1 Win=42496 Len=11584 TSval=2451333270 TSecr=2179447593"
"169","7.705170378","10.0.0.7","10.0.0.1","TCP","66","5201  >  38242 [ACK] Seq=1 Ack=36238 Win=93696 Len=0 TSval=2179447594 TSecr=2451333193"
"170","7.705195922","10.0.0.1","10.0.0.7","TCP","21786","38242  >  5201 [PSH, ACK] Seq=57958 Ack=1 Win=42496 Len=21720 TSval=2451333271 TSecr=2179447594"
"171","7.706006285","10.0.0.7","10.0.0.1","TCP","66","5201  >  38256 [ACK] Seq=1 Ack=26102 Win=68096 Len=0 TSval=2179447595 TSecr=2451333197"
"172","7.706018139","10.0.0.1","10.0.0.7","TCP","10202","38256  >  5201 [PSH, ACK] Seq=36238 Ack=1 Win=42496 Len=10136 TSval=2451333272 TSecr=2179447595"
"173","7.706021392","10.0.0.1","10.0.0.7","TCP","11650","38256  >  5201 [PSH, ACK] Seq=46374 Ack=1 Win=42496 Len=11584 TSval=2451333272 TSecr=2179447595"
"174","7.706843644","10.0.0.7","10.0.0.1","TCP","66","5201  >  38256 [ACK] Seq=1 Ack=36238 Win=88064 Len=0 TSval=2179447596 TSecr=2451333200"
"175","7.706861244","10.0.0.1","10.0.0.7","TCP","21786","38256  >  5201 [PSH, ACK] Seq=57958 Ack=1 Win=42496 Len=21720 TSval=2451333273 TSecr=2179447596"
"176","7.707705511","10.0.0.7","10.0.0.1","TCP","66","5201  >  38276 [ACK] Seq=1 Ack=26102 Win=68096 Len=0 TSval=2179447597 TSecr=2451333207"
"177","7.707721875","10.0.0.1","10.0.0.7","TCP","10202","38276  >  5201 [PSH, ACK] Seq=36238 Ack=1 Win=42496 Len=10136 TSval=2451333274 TSecr=2179447597"
"178","7.707727990","10.0.0.1","10.0.0.7","TCP","11650","38276  >  5201 [PSH, ACK] Seq=46374 Ack=1 Win=42496 Len=11584 TSval=2451333274 TSecr=2179447597"
"179","7.708577578","10.0.0.7","10.0.0.1","TCP","66","5201  >  38276 [ACK] Seq=1 Ack=36238 Win=58880 Len=0 TSval=2179447598 TSecr=2451333211"
"180","7.708624117","10.0.0.1","10.0.0.7","TCP","21786","38276  >  5201 [PSH, ACK] Seq=57958 Ack=1 Win=42496 Len=21720 TSval=2451333275 TSecr=2179447598"
"181","7.710790255","10.0.0.7","10.0.0.1","TCP","66","5201  >  38260 [ACK] Seq=1 Ack=26102 Win=68096 Len=0 TSval=2179447600 TSecr=2451333212"
"182","7.710803310","10.0.0.1","10.0.0.7","TCP","10202","38260  >  5201 [PSH, ACK] Seq=36238 Ack=1 Win=42496 Len=10136 TSval=2451333277 TSecr=2179447600"
"183","7.710806133","10.0.0.1","10.0.0.7","TCP","11650","38260  >  5201 [PSH, ACK] Seq=46374 Ack=1 Win=42496 Len=11584 TSval=2451333277 TSecr=2179447600"
"184","7.711630898","10.0.0.7","10.0.0.1","TCP","66","5201  >  38260 [ACK] Seq=1 Ack=36238 Win=93696 Len=0 TSval=2179447601 TSecr=2451333216"
"185","7.711645104","10.0.0.1","10.0.0.7","TCP","21786","38260  >  5201 [PSH, ACK] Seq=57958 Ack=1 Win=42496 Len=21720 TSval=2451333278 TSecr=2179447601"
"186","7.761413796","10.0.0.7","10.0.0.1","TCP","66","5201  >  38290 [ACK] Seq=1 Ack=26102 Win=68096 Len=0 TSval=2179447650 TSecr=2451333218"
"187","7.761423216","10.0.0.1","10.0.0.7","TCP","10202","38290  >  5201 [PSH, ACK] Seq=36238 Ack=1 Win=42496 Len=10136 TSval=2451333327 TSecr=2179447650"
"188","7.761426771","10.0.0.1","10.0.0.7","TCP","11650","38290  >  5201 [PSH, ACK] Seq=46374 Ack=1 Win=42496 Len=11584 TSval=2451333327 TSecr=2179447650"
"189","7.762253963","10.0.0.7","10.0.0.1","TCP","66","5201  >  38290 [ACK] Seq=1 Ack=36238 Win=58880 Len=0 TSval=2179447651 TSecr=2451333219"
"190","7.762263696","10.0.0.1","10.0.0.7","TCP","21786","38290  >  5201 [PSH, ACK] Seq=57958 Ack=1 Win=42496 Len=21720 TSval=2451333328 TSecr=2179447651"
"191","7.770870169","10.0.0.7","10.0.0.1","TCP","66","5201  >  38296 [ACK] Seq=1 Ack=26102 Win=68096 Len=0 TSval=2179447660 TSecr=2451333220"
"192","7.770881981","10.0.0.1","10.0.0.7","TCP","10202","38296  >  5201 [PSH, ACK] Seq=36238 Ack=1 Win=42496 Len=10136 TSval=2451333337 TSecr=2179447660"
"193","7.770885552","10.0.0.1","10.0.0.7","TCP","11650","38296  >  5201 [PSH, ACK] Seq=46374 Ack=1 Win=42496 Len=11584 TSval=2451333337 TSecr=2179447660"
"194","7.779243009","10.0.0.7","10.0.0.1","TCP","66","5201  >  38296 [ACK] Seq=1 Ack=36238 Win=88064 Len=0 TSval=2179447668 TSecr=2451333221"
"195","7.779265410","10.0.0.1","10.0.0.7","TCP","21786","38296  >  5201 [PSH, ACK] Seq=57958 Ack=1 Win=42496 Len=21720 TSval=2451333345 TSecr=2179447668"
"196","7.780080699","10.0.0.7","10.0.0.1","TCP","66","5201  >  38306 [ACK] Seq=1 Ack=26102 Win=68096 Len=0 TSval=2179447669 TSecr=2451333222"
"197","7.780098284","10.0.0.1","10.0.0.7","TCP","10202","38306  >  5201 [PSH, ACK] Seq=36238 Ack=1 Win=42496 Len=10136 TSval=2451333346 TSecr=2179447669"
"198","7.780101978","10.0.0.1","10.0.0.7","TCP","11650","38306  >  5201 [PSH, ACK] Seq=46374 Ack=1 Win=42496 Len=11584 TSval=2451333346 TSecr=2179447669"
"199","7.786363239","10.0.0.7","10.0.0.1","TCP","66","5201  >  38306 [ACK] Seq=1 Ack=36238 Win=88064 Len=0 TSval=2179447675 TSecr=2451333222"
"200","7.786376588","10.0.0.1","10.0.0.7","TCP","21786","38306  >  5201 [PSH, ACK] Seq=57958 Ack=1 Win=42496 Len=21720 TSval=2451333352 TSecr=2179447675"
"201","7.787206519","10.0.0.7","10.0.0.1","TCP","66","5201  >  38320 [ACK] Seq=1 Ack=26102 Win=68096 Len=0 TSval=2179447676 TSecr=2451333223"
"202","7.787212933","10.0.0.1","10.0.0.7","TCP","10202","38320  >  5201 [PSH, ACK] Seq=36238 Ack=1 Win=42496 Len=10136 TSval=2451333353 TSecr=2179447676"
"203","7.787216743","10.0.0.1","10.0.0.7","TCP","11650","38320  >  5201 [PSH, ACK] Seq=46374 Ack=1 Win=42496 Len=11584 TSval=2451333353 TSecr=2179447676"
"204","7.792434541","10.0.0.7","10.0.0.1","TCP","66","5201  >  38320 [ACK] Seq=1 Ack=36238 Win=88064 Len=0 TSval=2179447681 TSecr=2451333224"
"205","7.792449611","10.0.0.1","10.0.0.7","TCP","21786","38320  >  5201 [PSH, ACK] Seq=57958 Ack=1 Win=42496 Len=21720 TSval=2451333358 TSecr=2179447681"
"206","7.793263973","10.0.0.7","10.0.0.1","TCP","66","5201  >  38334 [ACK] Seq=1 Ack=26102 Win=68096 Len=0 TSval=2179447682 TSecr=2451333224"
"207","7.793269820","10.0.0.1","10.0.0.7","TCP","7306","38334  >  5201 [PSH, ACK] Seq=36238 Ack=1 Win=42496 Len=7240 TSval=2451333359 TSecr=2179447682"
"208","7.793271978","10.0.0.1","10.0.0.7","TCP","14546","38334  >  5201 [PSH, ACK] Seq=43478 Ack=1 Win=42496 Len=14480 TSval=2451333359 TSecr=2179447682"
"209","7.794109188","10.0.0.7","10.0.0.1","TCP","66","5201  >  38334 [ACK] Seq=1 Ack=36238 Win=88064 Len=0 TSval=2179447683 TSecr=2451333225"
"210","7.794117878","10.0.0.1","10.0.0.7","TCP","21786","38334  >  5201 [PSH, ACK] Seq=57958 Ack=1 Win=42496 Len=21720 TSval=2451333360 TSecr=2179447683"
"211","7.860277886","10.0.0.7","10.0.0.1","TCP","66","5201  >  38236 [ACK] Seq=1 Ack=46374 Win=114176 Len=0 TSval=2179447749 TSecr=2451333266"
"212","7.861118418","10.0.0.7","10.0.0.1","TCP","66","5201  >  38236 [ACK] Seq=1 Ack=57958 Win=137216 Len=0 TSval=2179447750 TSecr=2451333266"
"213","7.861127067","10.0.0.1","10.0.0.7","TCP","7306","38236  >  5201 [PSH, ACK] Seq=79678 Ack=1 Win=42496 Len=7240 TSval=2451333427 TSecr=2179447750"
"214","7.861133288","10.0.0.1","10.0.0.7","TCP","27578","38236  >  5201 [PSH, ACK] Seq=86918 Ack=1 Win=42496 Len=27512 TSval=2451333427 TSecr=2179447750"
"215","7.862086430","10.0.0.7","10.0.0.1","TCP","66","5201  >  38236 [ACK] Seq=1 Ack=79678 Win=174080 Len=0 TSval=2179447751 TSecr=2451333269"
"216","7.862094652","10.0.0.1","10.0.0.7","TCP","36266","38236  >  5201 [PSH, ACK] Seq=114430 Ack=1 Win=42496 Len=36200 TSval=2451333428 TSecr=2179447751"
"217","7.864576784","10.0.0.7","10.0.0.1","TCP","66","5201  >  38242 [ACK] Seq=1 Ack=46374 Win=114176 Len=0 TSval=2179447754 TSecr=2451333270"
"218","7.865423126","10.0.0.7","10.0.0.1","TCP","66","5201  >  38242 [ACK] Seq=1 Ack=57958 Win=137216 Len=0 TSval=2179447754 TSecr=2451333270"
"219","7.865430129","10.0.0.1","10.0.0.7","TCP","7306","38242  >  5201 [PSH, ACK] Seq=79678 Ack=1 Win=42496 Len=7240 TSval=2451333431 TSecr=2179447754"
"220","7.865435232","10.0.0.1","10.0.0.7","TCP","27578","38242  >  5201 [PSH, ACK] Seq=86918 Ack=1 Win=42496 Len=27512 TSval=2451333431 TSecr=2179447754"
"221","7.866392309","10.0.0.7","10.0.0.1","TCP","66","5201  >  38242 [ACK] Seq=1 Ack=79678 Win=174080 Len=0 TSval=2179447755 TSecr=2451333271"
"222","7.866400799","10.0.0.1","10.0.0.7","TCP","36266","38242  >  5201 [PSH, ACK] Seq=114430 Ack=1 Win=42496 Len=36200 TSval=2451333432 TSecr=2179447755"
"223","7.868210840","10.0.0.7","10.0.0.1","TCP","66","5201  >  38256 [ACK] Seq=1 Ack=46374 Win=108544 Len=0 TSval=2179447757 TSecr=2451333272"
"224","7.869056600","10.0.0.7","10.0.0.1","TCP","66","5201  >  38256 [ACK] Seq=1 Ack=57958 Win=131584 Len=0 TSval=2179447758 TSecr=2451333272"
"225","7.869061921","10.0.0.1","10.0.0.7","TCP","7306","38256  >  5201 [PSH, ACK] Seq=79678 Ack=1 Win=42496 Len=7240 TSval=2451333435 TSecr=2179447758"
"226","7.869066077","10.0.0.1","10.0.0.7","TCP","24682","38256  >  5201 [PSH, ACK] Seq=86918 Ack=1 Win=42496 Len=24616 TSval=2451333435 TSecr=2179447758"
"227","7.917478202","10.0.0.7","10.0.0.1","TCP","66","5201  >  38256 [ACK] Seq=1 Ack=79678 Win=174080 Len=0 TSval=2179447806 TSecr=2451333273"
"228","7.917499515","10.0.0.1","10.0.0.7","TCP","33370","38256  >  5201 [PSH, ACK] Seq=111534 Ack=1 Win=42496 Len=33304 TSval=2451333483 TSecr=2179447806"
"229","7.919282869","10.0.0.7","10.0.0.1","TCP","66","5201  >  38276 [ACK] Seq=1 Ack=46374 Win=93696 Len=0 TSval=2179447808 TSecr=2451333274"
"230","7.932487911","10.0.0.7","10.0.0.1","TCP","66","5201  >  38276 [ACK] Seq=1 Ack=57958 Win=116736 Len=0 TSval=2179447821 TSecr=2451333274"
"231","7.932502402","10.0.0.1","10.0.0.7","TCP","7306","38276  >  5201 [PSH, ACK] Seq=79678 Ack=1 Win=42496 Len=7240 TSval=2451333498 TSecr=2179447821"
"232","7.932522250","10.0.0.1","10.0.0.7","TCP","27578","38276  >  5201 [PSH, ACK] Seq=86918 Ack=1 Win=42496 Len=27512 TSval=2451333498 TSecr=2179447821"
"233","7.933455630","10.0.0.7","10.0.0.1","TCP","66","5201  >  38276 [ACK] Seq=1 Ack=79678 Win=160256 Len=0 TSval=2179447822 TSecr=2451333275"
"234","7.933466612","10.0.0.1","10.0.0.7","TCP","36266","38276  >  5201 [PSH, ACK] Seq=114430 Ack=1 Win=42496 Len=36200 TSval=2451333499 TSecr=2179447822"
"235","7.935273451","10.0.0.7","10.0.0.1","TCP","66","5201  >  38260 [ACK] Seq=1 Ack=46374 Win=114176 Len=0 TSval=2179447824 TSecr=2451333277"
"236","7.948478067","10.0.0.7","10.0.0.1","TCP","66","5201  >  38260 [ACK] Seq=1 Ack=57958 Win=137216 Len=0 TSval=2179447837 TSecr=2451333277"
"237","7.948489320","10.0.0.1","10.0.0.7","TCP","7306","38260  >  5201 [PSH, ACK] Seq=79678 Ack=1 Win=42496 Len=7240 TSval=2451333514 TSecr=2179447837"
"238","7.948494947","10.0.0.1","10.0.0.7","TCP","27578","38260  >  5201 [PSH, ACK] Seq=86918 Ack=1 Win=42496 Len=27512 TSval=2451333514 TSecr=2179447837"
"239","7.949440751","10.0.0.7","10.0.0.1","TCP","66","5201  >  38260 [ACK] Seq=1 Ack=79678 Win=163840 Len=0 TSval=2179447838 TSecr=2451333278"
"240","7.949457577","10.0.0.1","10.0.0.7","TCP","36266","38260  >  5201 [PSH, ACK] Seq=114430 Ack=1 Win=42496 Len=36200 TSval=2451333515 TSecr=2179447838"
"241","7.951268488","10.0.0.7","10.0.0.1","TCP","66","5201  >  38290 [ACK] Seq=1 Ack=46374 Win=88064 Len=0 TSval=2179447840 TSecr=2451333327"
"242","7.957558260","10.0.0.7","10.0.0.1","TCP","66","5201  >  38290 [ACK] Seq=1 Ack=57958 Win=111616 Len=0 TSval=2179447847 TSecr=2451333327"
"243","7.957565371","10.0.0.1","10.0.0.7","TCP","7306","38290  >  5201 [PSH, ACK] Seq=79678 Ack=1 Win=42496 Len=7240 TSval=2451333524 TSecr=2179447847"
"244","7.957570015","10.0.0.1","10.0.0.7","TCP","24682","38290  >  5201 [PSH, ACK] Seq=86918 Ack=1 Win=42496 Len=24616 TSval=2451333524 TSecr=2179447847"
"245","7.958523902","10.0.0.7","10.0.0.1","TCP","66","5201  >  38290 [ACK] Seq=1 Ack=79678 Win=154624 Len=0 TSval=2179447848 TSecr=2451333328"
"246","7.958536431","10.0.0.1","10.0.0.7","TCP","33370","38290  >  5201 [PSH, ACK] Seq=111534 Ack=1 Win=42496 Len=33304 TSval=2451333525 TSecr=2179447848"
"247","7.960343642","10.0.0.7","10.0.0.1","TCP","66","5201  >  38296 [ACK] Seq=1 Ack=46374 Win=108544 Len=0 TSval=2179447849 TSecr=2451333337"
"248","7.961187131","10.0.0.7","10.0.0.1","TCP","66","5201  >  38296 [ACK] Seq=1 Ack=57958 Win=131584 Len=0 TSval=2179447850 TSecr=2451333337"
"249","7.961192858","10.0.0.1","10.0.0.7","TCP","7306","38296  >  5201 [PSH, ACK] Seq=79678 Ack=1 Win=42496 Len=7240 TSval=2451333527 TSecr=2179447850"
"250","7.961200910","10.0.0.1","10.0.0.7","TCP","24682","38296  >  5201 [PSH, ACK] Seq=86918 Ack=1 Win=42496 Len=24616 TSval=2451333527 TSecr=2179447850"
"251","7.980691589","10.0.0.7","10.0.0.1","TCP","66","5201  >  38296 [ACK] Seq=1 Ack=79678 Win=174080 Len=0 TSval=2179447870 TSecr=2451333345"
"252","7.980704079","10.0.0.1","10.0.0.7","TCP","33370","38296  >  5201 [PSH, ACK] Seq=111534 Ack=1 Win=42496 Len=33304 TSval=2451333547 TSecr=2179447870"
"253","7.982505724","10.0.0.7","10.0.0.1","TCP","66","5201  >  38306 [ACK] Seq=1 Ack=46374 Win=108544 Len=0 TSval=2179447871 TSecr=2451333346"
"254","7.983358330","10.0.0.7","10.0.0.1","TCP","66","5201  >  38306 [ACK] Seq=1 Ack=57958 Win=131584 Len=0 TSval=2179447872 TSecr=2451333346"
"255","7.983368227","10.0.0.1","10.0.0.7","TCP","7306","38306  >  5201 [PSH, ACK] Seq=79678 Ack=1 Win=42496 Len=7240 TSval=2451333549 TSecr=2179447872"
"256","7.983372915","10.0.0.1","10.0.0.7","TCP","24682","38306  >  5201 [PSH, ACK] Seq=86918 Ack=1 Win=42496 Len=24616 TSval=2451333549 TSecr=2179447872"
"257","7.984320266","10.0.0.7","10.0.0.1","TCP","66","5201  >  38306 [ACK] Seq=1 Ack=79678 Win=174080 Len=0 TSval=2179447873 TSecr=2451333352"
"258","7.984333695","10.0.0.1","10.0.0.7","TCP","33370","38306  >  5201 [PSH, ACK] Seq=111534 Ack=1 Win=42496 Len=33304 TSval=2451333550 TSecr=2179447873"
"259","7.998501104","10.0.0.7","10.0.0.1","TCP","66","5201  >  38320 [ACK] Seq=1 Ack=46374 Win=108544 Len=0 TSval=2179447887 TSecr=2451333353"
"260","7.999384710","10.0.0.7","10.0.0.1","TCP","66","5201  >  38320 [ACK] Seq=1 Ack=57958 Win=131584 Len=0 TSval=2179447888 TSecr=2451333353"
"261","7.999405684","10.0.0.1","10.0.0.7","TCP","7306","38320  >  5201 [PSH, ACK] Seq=79678 Ack=1 Win=42496 Len=7240 TSval=2451333565 TSecr=2179447888"
"262","7.999417100","10.0.0.1","10.0.0.7","TCP","24682","38320  >  5201 [PSH, ACK] Seq=86918 Ack=1 Win=42496 Len=24616 TSval=2451333565 TSecr=2179447888"
"263","8.000317805","10.0.0.7","10.0.0.1","TCP","66","5201  >  38320 [ACK] Seq=1 Ack=79678 Win=163840 Len=0 TSval=2179447889 TSecr=2451333358"
"264","8.000335854","10.0.0.1","10.0.0.7","TCP","33370","38320  >  5201 [PSH, ACK] Seq=111534 Ack=1 Win=42496 Len=33304 TSval=2451333566 TSecr=2179447889"
"265","8.002142841","10.0.0.7","10.0.0.1","TCP","66","5201  >  38334 [ACK] Seq=1 Ack=43478 Win=102912 Len=0 TSval=2179447891 TSecr=2451333359"
"266","8.002740224","10.0.0.7","10.0.0.1","TCP","66","5201  >  38334 [ACK] Seq=1 Ack=57958 Win=131584 Len=0 TSval=2179447892 TSecr=2451333359"
"267","8.002749319","10.0.0.1","10.0.0.7","TCP","7306","38334  >  5201 [PSH, ACK] Seq=79678 Ack=1 Win=42496 Len=7240 TSval=2451333569 TSecr=2179447892"
"268","8.002755278","10.0.0.1","10.0.0.7","TCP","24682","38334  >  5201 [PSH, ACK] Seq=86918 Ack=1 Win=42496 Len=24616 TSval=2451333569 TSecr=2179447892"
"269","8.003953204","10.0.0.7","10.0.0.1","TCP","66","5201  >  38334 [ACK] Seq=1 Ack=79678 Win=174080 Len=0 TSval=2179447893 TSecr=2451333360"
"270","8.003968999","10.0.0.1","10.0.0.7","TCP","31922","38334  >  5201 [PSH, ACK] Seq=111534 Ack=1 Win=42496 Len=31856 TSval=2451333570 TSecr=2179447893"
"271","8.137855867","10.0.0.7","10.0.0.1","TCP","66","5201  >  38236 [ACK] Seq=1 Ack=86918 Win=187392 Len=0 TSval=2179448027 TSecr=2451333427"
"272","8.143928409","10.0.0.7","10.0.0.1","TCP","66","5201  >  38236 [ACK] Seq=1 Ack=114430 Win=194560 Len=0 TSval=2179448033 TSecr=2451333427"
"273","8.143956833","10.0.0.1","10.0.0.7","TCP","23234","38236  >  5201 [PSH, ACK] Seq=150630 Ack=1 Win=42496 Len=23168 TSval=2451333710 TSecr=2179448033"
"274","8.146206023","10.0.0.7","10.0.0.1","TCP","66","5201  >  38236 [ACK] Seq=1 Ack=150630 Win=186880 Len=0 TSval=2179448035 TSecr=2451333428"
