"No.","Time","Source","Destination","Protocol","Length","Info"
"1","0.000000000","fe80::8c9b:24ff:fe56:c618","ff02::2","ICMPv6","70","Router Solicitation from 8e:9b:24:56:c6:18"
"2","0.000121202","fe80::c0e2:8bff:fe29:9b9d","ff02::2","ICMPv6","70","Router Solicitation from c2:e2:8b:29:9b:9d"
"3","0.000150287","fe80::4d2:bbff:fe93:11f7","ff02::2","ICMPv6","70","Router Solicitation from 06:d2:bb:93:11:f7"
"4","0.000631177","fe80::a47f:94ff:fe2f:f1ba","ff02::2","ICMPv6","70","Router Solicitation from a6:7f:94:2f:f1:ba"
"5","0.592534317","fe80::493f:17d2:bdb8:fde3","ff02::2","ICMPv6","62","Router Solicitation"
"6","1.023717749","fe80::ace2:9cff:fe09:3d49","ff02::2","ICMPv6","70","Router Solicitation from ae:e2:9c:09:3d:49"
"7","1.536265500","fe80::98f8:aff:fe1a:586c","ff02::2","ICMPv6","70","Router Solicitation from 9a:f8:0a:1a:58:6c"
"8","1.938562256","fe80::493f:17d2:bdb8:fde3","ff02::fb","MDNS","203","Standard query 0x0000 PTR _nfs._tcp.local, ""QM"" question PTR _ipp._tcp.local, ""QM"" question PTR _ipps._tcp.local, ""QM"" question PTR _ftp._tcp.local, ""QM"" question PTR _webdav._tcp.local, ""QM"" question PTR _webdavs._tcp.local, ""QM"" question PTR _sftp-ssh._tcp.local, ""QM"" question PTR _smb._tcp.local, ""QM"" question PTR _afpovertcp._tcp.local, ""QM"" question"
"9","2.047569010","fe80::1014:2ff:fef9:2f85","ff02::2","ICMPv6","70","Router Solicitation from 12:14:02:f9:2f:85"
"10","2.534522180","0.0.0.0","255.255.255.255","DHCP","334","DHCP Discover - Transaction ID 0x5cfa06d0"
"11","8.828421431","9a:f8:0a:1a:58:6c","Broadcast","ARP","42","Who has 10.0.0.7? Tell 10.0.0.1"
"12","8.828736469","12:14:02:f9:2f:85","Broadcast","ARP","42","Who has 10.0.0.7? Tell 10.0.0.2"
"13","8.829038687","a6:7f:94:2f:f1:ba","9a:f8:0a:1a:58:6c","ARP","42","10.0.0.7 is at a6:7f:94:2f:f1:ba"
"14","8.829045493","10.0.0.1","10.0.0.7","TCP","74","50820  >  5201 [SYN] Seq=0 Win=42340 Len=0 MSS=1460 SACK_PERM TSval=2448808186 TSecr=0 WS=512"
"15","8.829285830","10.0.0.7","10.0.0.1","TCP","74","5201  >  50820 [SYN, ACK] Seq=0 Ack=1 Win=43440 Len=0 MSS=1460 SACK_PERM TSval=2176922509 TSecr=2448808186 WS=512"
"16","8.829303333","10.0.0.1","10.0.0.7","TCP","66","50820  >  5201 [ACK] Seq=1 Ack=1 Win=42496 Len=0 TSval=2448808187 TSecr=2176922509"
"17","8.829322434","10.0.0.1","10.0.0.7","iPerf3","103","50820  >  5201 Cookie: ""pk3j3ftk55w32msqsakkuxzroduzvlkq3lea"""
"18","8.829335038","10.0.0.7","10.0.0.1","TCP","66","5201  >  50820 [ACK] Seq=1 Ack=38 Win=43520 Len=0 TSval=2176922510 TSecr=2448808187"
"19","8.829399815","10.0.0.7","10.0.0.1","iPerf3","67","5201  >  50820 PARAM_EXCHANGE(9)"
"20","8.829410859","10.0.0.1","10.0.0.7","TCP","66","50820  >  5201 [ACK] Seq=38 Ack=2 Win=42496 Len=0 TSval=2448808187 TSecr=2176922510"
"21","8.829441068","10.0.0.1","10.0.0.7","iPerf3","70","50820  >  5201 Next message is JSON of this length: 172"
"22","8.829457517","10.0.0.1","10.0.0.7","iPerf3/JSON","238","50820  >  5201 {""tcp"":true,""omit"":0,""time"":150,""num"":0,""blockcount"":0,""parallel"":10,""len"":131072,""bandwidth"":10000000,""pacing_timer"":1000,""congestion"":""highspeed"",""client_version"":""3.16""}, JSON"
"23","8.829479604","10.0.0.7","10.0.0.1","TCP","66","5201  >  50820 [ACK] Seq=2 Ack=214 Win=43520 Len=0 TSval=2176922510 TSecr=2448808187"
"24","8.829530713","10.0.0.7","10.0.0.1","iPerf3","67","5201  >  50820 CREATE_STREAMS(10)"
"25","8.829580230","10.0.0.1","10.0.0.7","TCP","74","50830  >  5201 [SYN] Seq=0 Win=42340 Len=0 MSS=1460 SACK_PERM TSval=2448808187 TSecr=0 WS=512"
"26","8.829603816","10.0.0.7","10.0.0.1","TCP","74","5201  >  50830 [SYN, ACK] Seq=0 Ack=1 Win=43440 Len=0 MSS=1460 SACK_PERM TSval=2176922510 TSecr=2448808187 WS=512"
"27","8.829615542","10.0.0.1","10.0.0.7","TCP","66","50830  >  5201 [ACK] Seq=1 Ack=1 Win=42496 Len=0 TSval=2448808187 TSecr=2176922510"
"28","8.829635546","10.0.0.1","10.0.0.7","iPerf3","103","50830  >  5201 Cookie: ""pk3j3ftk55w32msqsakkuxzroduzvlkq3lea"""
"29","8.829648409","10.0.0.7","10.0.0.1","TCP","66","5201  >  50830 [ACK] Seq=1 Ack=38 Win=43520 Len=0 TSval=2176922510 TSecr=2448808187"
"30","8.830746685","10.0.0.1","10.0.0.7","TCP","74","50836  >  5201 [SYN] Seq=0 Win=42340 Len=0 MSS=1460 SACK_PERM TSval=2448808188 TSecr=0 WS=512"
"31","8.830781700","10.0.0.7","10.0.0.1","TCP","74","5201  >  50836 [SYN, ACK] Seq=0 Ack=1 Win=43440 Len=0 MSS=1460 SACK_PERM TSval=2176922511 TSecr=2448808188 WS=512"
"32","8.830796408","10.0.0.1","10.0.0.7","TCP","66","50836  >  5201 [ACK] Seq=1 Ack=1 Win=42496 Len=0 TSval=2448808188 TSecr=2176922511"
"33","8.830825689","10.0.0.1","10.0.0.7","iPerf3","103","50836  >  5201 Cookie: ""pk3j3ftk55w32msqsakkuxzroduzvlkq3lea"""
"34","8.830857696","10.0.0.7","10.0.0.1","TCP","66","5201  >  50836 [ACK] Seq=1 Ack=38 Win=43520 Len=0 TSval=2176922511 TSecr=2448808188"
"35","8.831468026","10.0.0.1","10.0.0.7","TCP","74","50848  >  5201 [SYN] Seq=0 Win=42340 Len=0 MSS=1460 SACK_PERM TSval=2448808189 TSecr=0 WS=512"
"36","8.831490180","10.0.0.7","10.0.0.1","TCP","74","5201  >  50848 [SYN, ACK] Seq=0 Ack=1 Win=43440 Len=0 MSS=1460 SACK_PERM TSval=2176922512 TSecr=2448808189 WS=512"
"37","8.831498629","10.0.0.1","10.0.0.7","TCP","66","50848  >  5201 [ACK] Seq=1 Ack=1 Win=42496 Len=0 TSval=2448808189 TSecr=2176922512"
"38","8.831511146","10.0.0.1","10.0.0.7","iPerf3","103","50848  >  5201 Cookie: ""pk3j3ftk55w32msqsakkuxzroduzvlkq3lea"""
"39","8.831518342","10.0.0.7","10.0.0.1","TCP","66","5201  >  50848 [ACK] Seq=1 Ack=38 Win=43520 Len=0 TSval=2176922512 TSecr=2448808189"
"40","8.832030501","10.0.0.1","10.0.0.7","TCP","74","50852  >  5201 [SYN] Seq=0 Win=42340 Len=0 MSS=1460 SACK_PERM TSval=2448808189 TSecr=0 WS=512"
"41","8.832044341","10.0.0.7","10.0.0.1","TCP","74","5201  >  50852 [SYN, ACK] Seq=0 Ack=1 Win=43440 Len=0 MSS=1460 SACK_PERM TSval=2176922512 TSecr=2448808189 WS=512"
"42","8.832049085","10.0.0.1","10.0.0.7","TCP","66","50852  >  5201 [ACK] Seq=1 Ack=1 Win=42496 Len=0 TSval=2448808189 TSecr=2176922512"
"43","8.832059465","10.0.0.1","10.0.0.7","iPerf3","103","50852  >  5201 Cookie: ""pk3j3ftk55w32msqsakkuxzroduzvlkq3lea"""
"44","8.832074132","10.0.0.7","10.0.0.1","TCP","66","5201  >  50852 [ACK] Seq=1 Ack=38 Win=43520 Len=0 TSval=2176922512 TSecr=2448808189"
"45","8.833218557","10.0.0.1","10.0.0.7","TCP","74","50866  >  5201 [SYN] Seq=0 Win=42340 Len=0 MSS=1460 SACK_PERM TSval=2448808190 TSecr=0 WS=512"
"46","8.833276520","10.0.0.7","10.0.0.1","TCP","74","5201  >  50866 [SYN, ACK] Seq=0 Ack=1 Win=43440 Len=0 MSS=1460 SACK_PERM TSval=2176922514 TSecr=2448808190 WS=512"
"47","8.833295009","10.0.0.1","10.0.0.7","TCP","66","50866  >  5201 [ACK] Seq=1 Ack=1 Win=42496 Len=0 TSval=2448808191 TSecr=2176922514"
"48","8.833456359","10.0.0.1","10.0.0.7","iPerf3","103","50866  >  5201 Cookie: ""pk3j3ftk55w32msqsakkuxzroduzvlkq3lea"""
"49","8.833525777","10.0.0.7","10.0.0.1","TCP","66","5201  >  50866 [ACK] Seq=1 Ack=38 Win=43520 Len=0 TSval=2176922514 TSecr=2448808191"
"50","8.834848464","10.0.0.1","10.0.0.7","TCP","74","50872  >  5201 [SYN] Seq=0 Win=42340 Len=0 MSS=1460 SACK_PERM TSval=2448808192 TSecr=0 WS=512"
"51","8.834894518","10.0.0.7","10.0.0.1","TCP","74","5201  >  50872 [SYN, ACK] Seq=0 Ack=1 Win=43440 Len=0 MSS=1460 SACK_PERM TSval=2176922515 TSecr=2448808192 WS=512"
"52","8.834911746","10.0.0.1","10.0.0.7","TCP","66","50872  >  5201 [ACK] Seq=1 Ack=1 Win=42496 Len=0 TSval=2448808192 TSecr=2176922515"
"53","8.834941589","10.0.0.1","10.0.0.7","iPerf3","103","50872  >  5201 Cookie: ""pk3j3ftk55w32msqsakkuxzroduzvlkq3lea"""
"54","8.834958818","10.0.0.7","10.0.0.1","TCP","66","5201  >  50872 [ACK] Seq=1 Ack=38 Win=43520 Len=0 TSval=2176922515 TSecr=2448808192"
"55","8.836059192","10.0.0.1","10.0.0.7","TCP","74","50882  >  5201 [SYN] Seq=0 Win=42340 Len=0 MSS=1460 SACK_PERM TSval=2448808193 TSecr=0 WS=512"
"56","8.836091185","10.0.0.7","10.0.0.1","TCP","74","5201  >  50882 [SYN, ACK] Seq=0 Ack=1 Win=43440 Len=0 MSS=1460 SACK_PERM TSval=2176922516 TSecr=2448808193 WS=512"
"57","8.836102385","10.0.0.1","10.0.0.7","TCP","66","50882  >  5201 [ACK] Seq=1 Ack=1 Win=42496 Len=0 TSval=2448808193 TSecr=2176922516"
"58","8.836124267","10.0.0.1","10.0.0.7","iPerf3","103","50882  >  5201 Cookie: ""pk3j3ftk55w32msqsakkuxzroduzvlkq3lea"""
"59","8.836141078","10.0.0.7","10.0.0.1","TCP","66","5201  >  50882 [ACK] Seq=1 Ack=38 Win=43520 Len=0 TSval=2176922516 TSecr=2448808193"
"60","8.837199712","10.0.0.1","10.0.0.7","TCP","74","50894  >  5201 [SYN] Seq=0 Win=42340 Len=0 MSS=1460 SACK_PERM TSval=2448808194 TSecr=0 WS=512"
"61","8.837229587","10.0.0.7","10.0.0.1","TCP","74","5201  >  50894 [SYN, ACK] Seq=0 Ack=1 Win=43440 Len=0 MSS=1460 SACK_PERM TSval=2176922517 TSecr=2448808194 WS=512"
"62","8.837247639","10.0.0.1","10.0.0.7","TCP","66","50894  >  5201 [ACK] Seq=1 Ack=1 Win=42496 Len=0 TSval=2448808195 TSecr=2176922517"
"63","8.837269633","10.0.0.1","10.0.0.7","iPerf3","103","50894  >  5201 Cookie: ""pk3j3ftk55w32msqsakkuxzroduzvlkq3lea"""
"64","8.837284901","10.0.0.7","10.0.0.1","TCP","66","5201  >  50894 [ACK] Seq=1 Ack=38 Win=43520 Len=0 TSval=2176922518 TSecr=2448808195"
"65","8.838373508","10.0.0.1","10.0.0.7","TCP","74","50898  >  5201 [SYN] Seq=0 Win=42340 Len=0 MSS=1460 SACK_PERM TSval=2448808196 TSecr=0 WS=512"
"66","8.838403404","10.0.0.7","10.0.0.1","TCP","74","5201  >  50898 [SYN, ACK] Seq=0 Ack=1 Win=43440 Len=0 MSS=1460 SACK_PERM TSval=2176922519 TSecr=2448808196 WS=512"
"67","8.838415094","10.0.0.1","10.0.0.7","TCP","66","50898  >  5201 [ACK] Seq=1 Ack=1 Win=42496 Len=0 TSval=2448808196 TSecr=2176922519"
"68","8.838436394","10.0.0.1","10.0.0.7","iPerf3","103","50898  >  5201 Cookie: ""pk3j3ftk55w32msqsakkuxzroduzvlkq3lea"""
"69","8.838453664","10.0.0.7","10.0.0.1","TCP","66","5201  >  50898 [ACK] Seq=1 Ack=38 Win=43520 Len=0 TSval=2176922519 TSecr=2448808196"
"70","8.839343685","10.0.0.1","10.0.0.7","TCP","74","50908  >  5201 [SYN] Seq=0 Win=42340 Len=0 MSS=1460 SACK_PERM TSval=2448808197 TSecr=0 WS=512"
"71","8.839371259","10.0.0.7","10.0.0.1","TCP","74","5201  >  50908 [SYN, ACK] Seq=0 Ack=1 Win=43440 Len=0 MSS=1460 SACK_PERM TSval=2176922520 TSecr=2448808197 WS=512"
"72","8.839380961","10.0.0.1","10.0.0.7","TCP","66","50908  >  5201 [ACK] Seq=1 Ack=1 Win=42496 Len=0 TSval=2448808197 TSecr=2176922520"
"73","8.839401006","10.0.0.1","10.0.0.7","iPerf3","103","50908  >  5201 Cookie: ""pk3j3ftk55w32msqsakkuxzroduzvlkq3lea"""
"74","8.839416825","10.0.0.7","10.0.0.1","TCP","66","5201  >  50908 [ACK] Seq=1 Ack=38 Win=43520 Len=0 TSval=2176922520 TSecr=2448808197"
"75","8.840817368","10.0.0.7","10.0.0.1","iPerf3","67","5201  >  50820 TEST_START(1)"
"76","8.840868331","10.0.0.7","10.0.0.1","iPerf3","67","5201  >  50820 TEST_RUNNING(2)"
"77","8.840907601","10.0.0.1","10.0.0.7","TCP","66","50820  >  5201 [ACK] Seq=214 Ack=4 Win=42496 Len=0 TSval=2448808198 TSecr=2176922510"
"78","8.841292556","10.0.0.1","10.0.0.7","TCP","7306","50830  >  5201 [PSH, ACK] Seq=38 Ack=1 Win=42496 Len=7240 TSval=2448808199 TSecr=2176922510"
"79","8.841325908","10.0.0.1","10.0.0.7","TCP","7306","50836  >  5201 [PSH, ACK] Seq=38 Ack=1 Win=42496 Len=7240 TSval=2448808199 TSecr=2176922511"
"80","8.841356775","10.0.0.7","10.0.0.1","TCP","66","5201  >  50830 [ACK] Seq=1 Ack=7278 Win=56832 Len=0 TSval=2176922522 TSecr=2448808199"
"81","8.841361162","10.0.0.1","10.0.0.7","TCP","7306","50836  >  5201 [PSH, ACK] Seq=7278 Ack=1 Win=42496 Len=7240 TSval=2448808199 TSecr=2176922511"
"82","8.841386887","10.0.0.1","10.0.0.7","TCP","7306","50830  >  5201 [PSH, ACK] Seq=7278 Ack=1 Win=42496 Len=7240 TSval=2448808199 TSecr=2176922510"
"83","8.841389156","10.0.0.1","10.0.0.7","TCP","7306","50848  >  5201 [PSH, ACK] Seq=38 Ack=1 Win=42496 Len=7240 TSval=2448808199 TSecr=2176922512"
"84","8.841418006","10.0.0.1","10.0.0.7","TCP","7306","50848  >  5201 [PSH, ACK] Seq=7278 Ack=1 Win=42496 Len=7240 TSval=2448808199 TSecr=2176922512"
"85","8.841474705","10.0.0.1","10.0.0.7","TCP","10202","50830  >  5201 [PSH, ACK] Seq=14518 Ack=1 Win=42496 Len=10136 TSval=2448808199 TSecr=2176922522"
"86","8.841489182","10.0.0.1","10.0.0.7","TCP","7306","50852  >  5201 [PSH, ACK] Seq=38 Ack=1 Win=42496 Len=7240 TSval=2448808199 TSecr=2176922512"
"87","8.841516279","10.0.0.1","10.0.0.7","TCP","7306","50852  >  5201 [PSH, ACK] Seq=7278 Ack=1 Win=42496 Len=7240 TSval=2448808199 TSecr=2176922512"
"88","8.841541811","10.0.0.1","10.0.0.7","TCP","7306","50866  >  5201 [PSH, ACK] Seq=38 Ack=1 Win=42496 Len=7240 TSval=2448808199 TSecr=2176922514"
"89","8.841561934","10.0.0.1","10.0.0.7","TCP","7306","50866  >  5201 [PSH, ACK] Seq=7278 Ack=1 Win=42496 Len=7240 TSval=2448808199 TSecr=2176922514"
"90","8.841597302","10.0.0.1","10.0.0.7","TCP","7306","50872  >  5201 [PSH, ACK] Seq=38 Ack=1 Win=42496 Len=7240 TSval=2448808199 TSecr=2176922515"
"91","8.841610539","10.0.0.1","10.0.0.7","TCP","7306","50872  >  5201 [PSH, ACK] Seq=7278 Ack=1 Win=42496 Len=7240 TSval=2448808199 TSecr=2176922515"
"92","8.841676646","10.0.0.1","10.0.0.7","TCP","7306","50882  >  5201 [PSH, ACK] Seq=38 Ack=1 Win=42496 Len=7240 TSval=2448808199 TSecr=2176922516"
"93","8.841688944","10.0.0.1","10.0.0.7","TCP","7306","50882  >  5201 [PSH, ACK] Seq=7278 Ack=1 Win=42496 Len=7240 TSval=2448808199 TSecr=2176922516"
"94","8.841795452","10.0.0.1","10.0.0.7","TCP","7306","50894  >  5201 [PSH, ACK] Seq=38 Ack=1 Win=42496 Len=7240 TSval=2448808199 TSecr=2176922518"
"95","8.841804724","10.0.0.1","10.0.0.7","TCP","7306","50894  >  5201 [PSH, ACK] Seq=7278 Ack=1 Win=42496 Len=7240 TSval=2448808199 TSecr=2176922518"
"96","8.841896102","10.0.0.1","10.0.0.7","TCP","7306","50898  >  5201 [PSH, ACK] Seq=38 Ack=1 Win=42496 Len=7240 TSval=2448808199 TSecr=2176922519"
"97","8.841913530","10.0.0.1","10.0.0.7","TCP","7306","50898  >  5201 [PSH, ACK] Seq=7278 Ack=1 Win=42496 Len=7240 TSval=2448808199 TSecr=2176922519"
"98","8.842055305","10.0.0.1","10.0.0.7","TCP","7306","50908  >  5201 [PSH, ACK] Seq=38 Ack=1 Win=42496 Len=7240 TSval=2448808199 TSecr=2176922520"
"99","8.842069799","10.0.0.1","10.0.0.7","TCP","7306","50908  >  5201 [PSH, ACK] Seq=7278 Ack=1 Win=42496 Len=7240 TSval=2448808199 TSecr=2176922520"
"100","8.842324221","10.0.0.7","10.0.0.1","TCP","66","5201  >  50836 [ACK] Seq=1 Ack=7278 Win=56832 Len=0 TSval=2176922523 TSecr=2448808199"
"101","8.842351845","10.0.0.1","10.0.0.7","TCP","10202","50836  >  5201 [PSH, ACK] Seq=14518 Ack=1 Win=42496 Len=10136 TSval=2448808200 TSecr=2176922523"
"102","8.843497971","10.0.0.7","10.0.0.1","TCP","66","5201  >  50836 [ACK] Seq=1 Ack=14518 Win=70656 Len=0 TSval=2176922524 TSecr=2448808199"
"103","8.843512847","10.0.0.1","10.0.0.7","TCP","11650","50836  >  5201 [PSH, ACK] Seq=24654 Ack=1 Win=42496 Len=11584 TSval=2448808201 TSecr=2176922524"
"104","8.844698083","10.0.0.7","10.0.0.1","TCP","66","5201  >  50830 [ACK] Seq=1 Ack=14518 Win=70656 Len=0 TSval=2176922525 TSecr=2448808199"
"105","8.844705585","10.0.0.1","10.0.0.7","TCP","11650","50830  >  5201 [PSH, ACK] Seq=24654 Ack=1 Win=42496 Len=11584 TSval=2448808202 TSecr=2176922525"
"106","8.845245285","10.0.0.1","10.0.0.7","TCP","1514","50894  >  5201 [ACK] Seq=14518 Ack=1 Win=42496 Len=1448 TSval=2448808203 TSecr=2176922518"
"107","8.845250457","10.0.0.1","10.0.0.7","TCP","1514","50872  >  5201 [ACK] Seq=14518 Ack=1 Win=42496 Len=1448 TSval=2448808203 TSecr=2176922515"
"108","8.845251644","10.0.0.1","10.0.0.7","TCP","1514","50848  >  5201 [ACK] Seq=14518 Ack=1 Win=42496 Len=1448 TSval=2448808203 TSecr=2176922512"
"109","8.845274166","10.0.0.1","10.0.0.7","TCP","1514","50908  >  5201 [ACK] Seq=14518 Ack=1 Win=42496 Len=1448 TSval=2448808203 TSecr=2176922520"
"110","8.845276140","10.0.0.1","10.0.0.7","TCP","1514","50852  >  5201 [ACK] Seq=14518 Ack=1 Win=42496 Len=1448 TSval=2448808203 TSecr=2176922512"
"111","8.845283805","10.0.0.1","10.0.0.7","TCP","1514","50866  >  5201 [ACK] Seq=14518 Ack=1 Win=42496 Len=1448 TSval=2448808203 TSecr=2176922514"
"112","8.845284206","10.0.0.1","10.0.0.7","TCP","1514","50882  >  5201 [ACK] Seq=14518 Ack=1 Win=42496 Len=1448 TSval=2448808203 TSecr=2176922516"
"113","8.845915178","10.0.0.7","10.0.0.1","TCP","66","5201  >  50848 [ACK] Seq=1 Ack=7278 Win=56832 Len=0 TSval=2176922526 TSecr=2448808199"
"114","8.845925733","10.0.0.1","10.0.0.7","TCP","10202","50848  >  5201 [PSH, ACK] Seq=15966 Ack=1 Win=42496 Len=10136 TSval=2448808203 TSecr=2176922526"
"115","8.846238951","10.0.0.1","10.0.0.7","TCP","1514","50898  >  5201 [ACK] Seq=14518 Ack=1 Win=42496 Len=1448 TSval=2448808204 TSecr=2176922519"
"116","8.847124711","10.0.0.7","10.0.0.1","TCP","66","5201  >  50848 [ACK] Seq=1 Ack=14518 Win=70656 Len=0 TSval=2176922527 TSecr=2448808199"
"117","8.847134881","10.0.0.1","10.0.0.7","TCP","10202","50848  >  5201 [PSH, ACK] Seq=26102 Ack=1 Win=42496 Len=10136 TSval=2448808204 TSecr=2176922527"
"118","8.848236346","10.0.0.1","10.0.0.7","TCP","7306","50836  >  5201 [PSH, ACK] Seq=36238 Ack=1 Win=42496 Len=7240 TSval=2448808206 TSecr=2176922524"
"119","8.848237405","10.0.0.1","10.0.0.7","TCP","7306","50830  >  5201 [PSH, ACK] Seq=36238 Ack=1 Win=42496 Len=7240 TSval=2448808206 TSecr=2176922525"
"120","8.848328059","10.0.0.7","10.0.0.1","TCP","66","5201  >  50830 [ACK] Seq=1 Ack=24654 Win=68096 Len=0 TSval=2176922529 TSecr=2448808199"
"121","8.848334056","10.0.0.1","10.0.0.7","TCP","14546","50830  >  5201 [PSH, ACK] Seq=43478 Ack=1 Win=42496 Len=14480 TSval=2448808206 TSecr=2176922529"
"122","8.850036099","10.0.0.7","10.0.0.1","TCP","66","5201  >  50852 [ACK] Seq=1 Ack=7278 Win=56832 Len=0 TSval=2176922530 TSecr=2448808199"
"123","8.850046338","10.0.0.1","10.0.0.7","TCP","10202","50852  >  5201 [PSH, ACK] Seq=15966 Ack=1 Win=42496 Len=10136 TSval=2448808207 TSecr=2176922530"
"124","8.851245177","10.0.0.7","10.0.0.1","TCP","66","5201  >  50852 [ACK] Seq=1 Ack=14518 Win=70656 Len=0 TSval=2176922532 TSecr=2448808199"
"125","8.851249856","10.0.0.1","10.0.0.7","TCP","10202","50852  >  5201 [PSH, ACK] Seq=26102 Ack=1 Win=42496 Len=10136 TSval=2448808209 TSecr=2176922532"
"126","8.852465194","10.0.0.7","10.0.0.1","TCP","66","5201  >  50866 [ACK] Seq=1 Ack=7278 Win=56832 Len=0 TSval=2176922533 TSecr=2448808199"
"127","8.852478459","10.0.0.1","10.0.0.7","TCP","10202","50866  >  5201 [PSH, ACK] Seq=15966 Ack=1 Win=42496 Len=10136 TSval=2448808210 TSecr=2176922533"
"128","8.853677371","10.0.0.7","10.0.0.1","TCP","66","5201  >  50866 [ACK] Seq=1 Ack=14518 Win=70656 Len=0 TSval=2176922534 TSecr=2448808199"
"129","8.853692588","10.0.0.1","10.0.0.7","TCP","10202","50866  >  5201 [PSH, ACK] Seq=26102 Ack=1 Win=42496 Len=10136 TSval=2448808211 TSecr=2176922534"
"130","8.854884563","10.0.0.7","10.0.0.1","TCP","66","5201  >  50872 [ACK] Seq=1 Ack=7278 Win=56832 Len=0 TSval=2176922535 TSecr=2448808199"
"131","8.854892603","10.0.0.1","10.0.0.7","TCP","10202","50872  >  5201 [PSH, ACK] Seq=15966 Ack=1 Win=42496 Len=10136 TSval=2448808212 TSecr=2176922535"
"132","8.856093891","10.0.0.7","10.0.0.1","TCP","66","5201  >  50872 [ACK] Seq=1 Ack=14518 Win=70656 Len=0 TSval=2176922536 TSecr=2448808199"
"133","8.856100851","10.0.0.1","10.0.0.7","TCP","10202","50872  >  5201 [PSH, ACK] Seq=26102 Ack=1 Win=42496 Len=10136 TSval=2448808213 TSecr=2176922536"
"134","8.857305435","10.0.0.7","10.0.0.1","TCP","66","5201  >  50882 [ACK] Seq=1 Ack=7278 Win=56832 Len=0 TSval=2176922538 TSecr=2448808199"
"135","8.857312699","10.0.0.1","10.0.0.7","TCP","10202","50882  >  5201 [PSH, ACK] Seq=15966 Ack=1 Win=42496 Len=10136 TSval=2448808215 TSecr=2176922538"
"136","8.858522750","10.0.0.7","10.0.0.1","TCP","66","5201  >  50882 [ACK] Seq=1 Ack=14518 Win=70656 Len=0 TSval=2176922539 TSecr=2448808199"
"137","8.858530732","10.0.0.1","10.0.0.7","TCP","10202","50882  >  5201 [PSH, ACK] Seq=26102 Ack=1 Win=42496 Len=10136 TSval=2448808216 TSecr=2176922539"
"138","8.863372040","10.0.0.7","10.0.0.1","TCP","66","5201  >  50894 [ACK] Seq=1 Ack=7278 Win=56832 Len=0 TSval=2176922544 TSecr=2448808199"
"139","8.863387118","10.0.0.1","10.0.0.7","TCP","10202","50894  >  5201 [PSH, ACK] Seq=15966 Ack=1 Win=42496 Len=10136 TSval=2448808221 TSecr=2176922544"
"140","8.864572293","10.0.0.7","10.0.0.1","TCP","66","5201  >  50894 [ACK] Seq=1 Ack=14518 Win=70656 Len=0 TSval=2176922545 TSecr=2448808199"
"141","8.864584605","10.0.0.1","10.0.0.7","TCP","10202","50894  >  5201 [PSH, ACK] Seq=26102 Ack=1 Win=42496 Len=10136 TSval=2448808222 TSecr=2176922545"
"142","8.869420623","10.0.0.7","10.0.0.1","TCP","66","5201  >  50898 [ACK] Seq=1 Ack=7278 Win=56832 Len=0 TSval=2176922550 TSecr=2448808199"
"143","8.869435801","10.0.0.1","10.0.0.7","TCP","10202","50898  >  5201 [PSH, ACK] Seq=15966 Ack=1 Win=42496 Len=10136 TSval=2448808227 TSecr=2176922550"
"144","8.870633607","10.0.0.7","10.0.0.1","TCP","66","5201  >  50898 [ACK] Seq=1 Ack=14518 Win=70656 Len=0 TSval=2176922551 TSecr=2448808199"
"145","8.870647894","10.0.0.1","10.0.0.7","TCP","10202","50898  >  5201 [PSH, ACK] Seq=26102 Ack=1 Win=42496 Len=10136 TSval=2448808228 TSecr=2176922551"
"146","8.876685068","10.0.0.7","10.0.0.1","TCP","66","5201  >  50908 [ACK] Seq=1 Ack=7278 Win=56832 Len=0 TSval=2176922557 TSecr=2448808199"
"147","8.876691237","10.0.0.1","10.0.0.7","TCP","10202","50908  >  5201 [PSH, ACK] Seq=15966 Ack=1 Win=42496 Len=10136 TSval=2448808234 TSecr=2176922557"
"148","8.877895299","10.0.0.7","10.0.0.1","TCP","66","5201  >  50908 [ACK] Seq=1 Ack=14518 Win=64000 Len=0 TSval=2176922558 TSecr=2448808199"
"149","8.877903223","10.0.0.1","10.0.0.7","TCP","10202","50908  >  5201 [PSH, ACK] Seq=26102 Ack=1 Win=42496 Len=10136 TSval=2448808235 TSecr=2176922558"
"150","8.881243329","10.0.0.1","10.0.0.7","TCP","66","50820  >  5201 [ACK] Seq=214 Ack=5 Win=42496 Len=0 TSval=2448808239 TSecr=2176922521"
"151","8.887589836","10.0.0.7","10.0.0.1","TCP","66","5201  >  50836 [ACK] Seq=1 Ack=24654 Win=68096 Len=0 TSval=2176922568 TSecr=2448808200"
"152","8.887598396","10.0.0.1","10.0.0.7","TCP","14546","50836  >  5201 [PSH, ACK] Seq=43478 Ack=1 Win=42496 Len=14480 TSval=2448808245 TSecr=2176922568"
"153","8.892918532","10.0.0.7","10.0.0.1","TCP","66","5201  >  50836 [ACK] Seq=1 Ack=36238 Win=57856 Len=0 TSval=2176922573 TSecr=2448808201"
"154","8.892924984","10.0.0.1","10.0.0.7","TCP","21786","50836  >  5201 [PSH, ACK] Seq=57958 Ack=1 Win=42496 Len=21720 TSval=2448808250 TSecr=2176922573"
"155","8.894853846","10.0.0.7","10.0.0.1","TCP","66","5201  >  50830 [ACK] Seq=1 Ack=36238 Win=93696 Len=0 TSval=2176922575 TSecr=2448808202"
"156","8.894862313","10.0.0.1","10.0.0.7","TCP","21786","50830  >  5201 [PSH, ACK] Seq=57958 Ack=1 Win=42496 Len=21720 TSval=2448808252 TSecr=2176922575"
"157","8.897032504","10.0.0.7","10.0.0.1","TCP","66","5201  >  50894 [ACK] Seq=1 Ack=15966 Win=73216 Len=0 TSval=2176922577 TSecr=2448808203"
"158","8.897517038","10.0.0.7","10.0.0.1","TCP","66","5201  >  50872 [ACK] Seq=1 Ack=15966 Win=73216 Len=0 TSval=2176922578 TSecr=2448808203"
"159","8.897758629","10.0.0.7","10.0.0.1","TCP","66","5201  >  50848 [ACK] Seq=1 Ack=15966 Win=73216 Len=0 TSval=2176922578 TSecr=2448808203"
"160","8.898000398","10.0.0.7","10.0.0.1","TCP","66","5201  >  50908 [ACK] Seq=1 Ack=15966 Win=67072 Len=0 TSval=2176922578 TSecr=2448808203"
"161","8.898486708","10.0.0.7","10.0.0.1","TCP","66","5201  >  50852 [ACK] Seq=1 Ack=15966 Win=73216 Len=0 TSval=2176922579 TSecr=2448808203"
"162","8.899695878","10.0.0.7","10.0.0.1","TCP","66","5201  >  50882 [ACK] Seq=1 Ack=15966 Win=73216 Len=0 TSval=2176922580 TSecr=2448808203"
"163","8.899939292","10.0.0.7","10.0.0.1","TCP","66","5201  >  50866 [ACK] Seq=1 Ack=15966 Win=73216 Len=0 TSval=2176922580 TSecr=2448808203"
"164","8.900197396","10.0.0.7","10.0.0.1","TCP","66","5201  >  50848 [ACK] Seq=1 Ack=26102 Win=66560 Len=0 TSval=2176922580 TSecr=2448808203"
"165","8.900203355","10.0.0.1","10.0.0.7","TCP","10202","50848  >  5201 [PSH, ACK] Seq=36238 Ack=1 Win=42496 Len=10136 TSval=2448808257 TSecr=2176922580"
"166","8.900205248","10.0.0.1","10.0.0.7","TCP","11650","50848  >  5201 [PSH, ACK] Seq=46374 Ack=1 Win=42496 Len=11584 TSval=2448808257 TSecr=2176922580"
"167","8.902133627","10.0.0.7","10.0.0.1","TCP","66","5201  >  50898 [ACK] Seq=1 Ack=15966 Win=73216 Len=0 TSval=2176922582 TSecr=2448808204"
"168","8.902855813","10.0.0.7","10.0.0.1","TCP","66","5201  >  50848 [ACK] Seq=1 Ack=36238 Win=93696 Len=0 TSval=2176922583 TSecr=2448808204"
"169","8.902864744","10.0.0.1","10.0.0.7","TCP","21786","50848  >  5201 [PSH, ACK] Seq=57958 Ack=1 Win=42496 Len=21720 TSval=2448808260 TSecr=2176922583"
"170","8.904553962","10.0.0.7","10.0.0.1","TCP","66","5201  >  50830 [ACK] Seq=1 Ack=43478 Win=108032 Len=0 TSval=2176922585 TSecr=2448808206"
"171","8.904562066","10.0.0.1","10.0.0.7","TCP","21786","50830  >  5201 [PSH, ACK] Seq=79678 Ack=1 Win=42496 Len=21720 TSval=2448808262 TSecr=2176922585"
"172","8.905764196","10.0.0.7","10.0.0.1","TCP","66","5201  >  50836 [ACK] Seq=1 Ack=43478 Win=84992 Len=0 TSval=2176922586 TSecr=2448808206"
"173","8.905770078","10.0.0.1","10.0.0.7","TCP","21786","50836  >  5201 [PSH, ACK] Seq=79678 Ack=1 Win=42496 Len=21720 TSval=2448808263 TSecr=2176922586"
"174","8.906975673","10.0.0.7","10.0.0.1","TCP","66","5201  >  50830 [ACK] Seq=1 Ack=57958 Win=137216 Len=0 TSval=2176922587 TSecr=2448808206"
"175","8.909402905","10.0.0.7","10.0.0.1","TCP","66","5201  >  50852 [ACK] Seq=1 Ack=26102 Win=68096 Len=0 TSval=2176922590 TSecr=2448808207"
"176","8.909412893","10.0.0.1","10.0.0.7","TCP","10202","50852  >  5201 [PSH, ACK] Seq=36238 Ack=1 Win=42496 Len=10136 TSval=2448808267 TSecr=2176922590"
"177","8.909415399","10.0.0.1","10.0.0.7","TCP","11650","50852  >  5201 [PSH, ACK] Seq=46374 Ack=1 Win=42496 Len=11584 TSval=2448808267 TSecr=2176922590"
"178","8.911094212","10.0.0.7","10.0.0.1","TCP","66","5201  >  50852 [ACK] Seq=1 Ack=36238 Win=93696 Len=0 TSval=2176922591 TSecr=2448808209"
"179","8.911101466","10.0.0.1","10.0.0.7","TCP","21786","50852  >  5201 [PSH, ACK] Seq=57958 Ack=1 Win=42496 Len=21720 TSval=2448808268 TSecr=2176922591"
"180","8.912790873","10.0.0.7","10.0.0.1","TCP","66","5201  >  50866 [ACK] Seq=1 Ack=26102 Win=68096 Len=0 TSval=2176922593 TSecr=2448808210"
"181","8.912796466","10.0.0.1","10.0.0.7","TCP","10202","50866  >  5201 [PSH, ACK] Seq=36238 Ack=1 Win=42496 Len=10136 TSval=2448808270 TSecr=2176922593"
"182","8.912798070","10.0.0.1","10.0.0.7","TCP","11650","50866  >  5201 [PSH, ACK] Seq=46374 Ack=1 Win=42496 Len=11584 TSval=2448808270 TSecr=2176922593"
"183","8.914482960","10.0.0.7","10.0.0.1","TCP","66","5201  >  50866 [ACK] Seq=1 Ack=36238 Win=58880 Len=0 TSval=2176922595 TSecr=2448808211"
"184","8.914488966","10.0.0.1","10.0.0.7","TCP","21786","50866  >  5201 [PSH, ACK] Seq=57958 Ack=1 Win=42496 Len=21720 TSval=2448808272 TSecr=2176922595"
"185","8.916182687","10.0.0.7","10.0.0.1","TCP","66","5201  >  50872 [ACK] Seq=1 Ack=26102 Win=68096 Len=0 TSval=2176922596 TSecr=2448808212"
"186","8.916190151","10.0.0.1","10.0.0.7","TCP","10202","50872  >  5201 [PSH, ACK] Seq=36238 Ack=1 Win=42496 Len=10136 TSval=2448808273 TSecr=2176922596"
"187","8.916193186","10.0.0.1","10.0.0.7","TCP","11650","50872  >  5201 [PSH, ACK] Seq=46374 Ack=1 Win=42496 Len=11584 TSval=2448808273 TSecr=2176922596"
"188","8.917873623","10.0.0.7","10.0.0.1","TCP","66","5201  >  50872 [ACK] Seq=1 Ack=36238 Win=58880 Len=0 TSval=2176922598 TSecr=2448808213"
"189","8.917879433","10.0.0.1","10.0.0.7","TCP","21786","50872  >  5201 [PSH, ACK] Seq=57958 Ack=1 Win=42496 Len=21720 TSval=2448808275 TSecr=2176922598"
"190","8.919572472","10.0.0.7","10.0.0.1","TCP","66","5201  >  50882 [ACK] Seq=1 Ack=26102 Win=68096 Len=0 TSval=2176922600 TSecr=2448808215"
"191","8.919578388","10.0.0.1","10.0.0.7","TCP","10202","50882  >  5201 [PSH, ACK] Seq=36238 Ack=1 Win=42496 Len=10136 TSval=2448808277 TSecr=2176922600"
"192","8.919580591","10.0.0.1","10.0.0.7","TCP","11650","50882  >  5201 [PSH, ACK] Seq=46374 Ack=1 Win=42496 Len=11584 TSval=2448808277 TSecr=2176922600"
"193","8.921267155","10.0.0.7","10.0.0.1","TCP","66","5201  >  50882 [ACK] Seq=1 Ack=36238 Win=93696 Len=0 TSval=2176922602 TSecr=2448808216"
"194","8.921273478","10.0.0.1","10.0.0.7","TCP","21786","50882  >  5201 [PSH, ACK] Seq=57958 Ack=1 Win=42496 Len=21720 TSval=2448808279 TSecr=2176922602"
"195","8.928050650","10.0.0.7","10.0.0.1","TCP","66","5201  >  50894 [ACK] Seq=1 Ack=26102 Win=68096 Len=0 TSval=2176922608 TSecr=2448808221"
"196","8.928056921","10.0.0.1","10.0.0.7","TCP","10202","50894  >  5201 [PSH, ACK] Seq=36238 Ack=1 Win=42496 Len=10136 TSval=2448808285 TSecr=2176922608"
"197","8.928062173","10.0.0.1","10.0.0.7","TCP","11650","50894  >  5201 [PSH, ACK] Seq=46374 Ack=1 Win=42496 Len=11584 TSval=2448808285 TSecr=2176922608"
"198","8.929750244","10.0.0.7","10.0.0.1","TCP","66","5201  >  50894 [ACK] Seq=1 Ack=36238 Win=68096 Len=0 TSval=2176922610 TSecr=2448808222"
"199","8.929762695","10.0.0.1","10.0.0.7","TCP","21786","50894  >  5201 [PSH, ACK] Seq=57958 Ack=1 Win=42496 Len=21720 TSval=2448808287 TSecr=2176922610"
"200","8.936538721","10.0.0.7","10.0.0.1","TCP","66","5201  >  50898 [ACK] Seq=1 Ack=26102 Win=68096 Len=0 TSval=2176922617 TSecr=2448808227"
"201","8.936554909","10.0.0.1","10.0.0.7","TCP","10202","50898  >  5201 [PSH, ACK] Seq=36238 Ack=1 Win=42496 Len=10136 TSval=2448808294 TSecr=2176922617"
"202","8.936562031","10.0.0.1","10.0.0.7","TCP","11650","50898  >  5201 [PSH, ACK] Seq=46374 Ack=1 Win=42496 Len=11584 TSval=2448808294 TSecr=2176922617"
"203","8.938222769","10.0.0.7","10.0.0.1","TCP","66","5201  >  50898 [ACK] Seq=1 Ack=36238 Win=58880 Len=0 TSval=2176922618 TSecr=2448808228"
"204","8.938228897","10.0.0.1","10.0.0.7","TCP","21786","50898  >  5201 [PSH, ACK] Seq=57958 Ack=1 Win=42496 Len=21720 TSval=2448808295 TSecr=2176922618"
"205","8.946723413","10.0.0.7","10.0.0.1","TCP","66","5201  >  50908 [ACK] Seq=1 Ack=26102 Win=68096 Len=0 TSval=2176922627 TSecr=2448808234"
"206","8.946730766","10.0.0.1","10.0.0.7","TCP","10202","50908  >  5201 [PSH, ACK] Seq=36238 Ack=1 Win=42496 Len=10136 TSval=2448808304 TSecr=2176922627"
"207","8.946733785","10.0.0.1","10.0.0.7","TCP","11650","50908  >  5201 [PSH, ACK] Seq=46374 Ack=1 Win=42496 Len=11584 TSval=2448808304 TSecr=2176922627"
"208","8.948415108","10.0.0.7","10.0.0.1","TCP","66","5201  >  50908 [ACK] Seq=1 Ack=36238 Win=88064 Len=0 TSval=2176922629 TSecr=2448808235"
"209","8.948426055","10.0.0.1","10.0.0.7","TCP","21786","50908  >  5201 [PSH, ACK] Seq=57958 Ack=1 Win=42496 Len=21720 TSval=2448808306 TSecr=2176922629"
"210","8.961975188","10.0.0.7","10.0.0.1","TCP","66","5201  >  50836 [ACK] Seq=1 Ack=57958 Win=114176 Len=0 TSval=2176922642 TSecr=2448808245"
"211","8.969492956","10.0.0.7","10.0.0.1","TCP","66","5201  >  50836 [ACK] Seq=1 Ack=79678 Win=157184 Len=0 TSval=2176922650 TSecr=2448808250"
"212","8.969508002","10.0.0.1","10.0.0.7","TCP","1514","50836  >  5201 [ACK] Seq=101398 Ack=1 Win=42496 Len=1448 TSval=2448808327 TSecr=2176922650"
"213","8.973135079","10.0.0.7","10.0.0.1","TCP","66","5201  >  50830 [ACK] Seq=1 Ack=79678 Win=152576 Len=0 TSval=2176922653 TSecr=2448808252"
"214","8.973148901","10.0.0.1","10.0.0.7","TCP","5858","50830  >  5201 [PSH, ACK] Seq=101398 Ack=1 Win=42496 Len=5792 TSval=2448808330 TSecr=2176922653"
"215","8.973155811","10.0.0.1","10.0.0.7","TCP","46402","50830  >  5201 [PSH, ACK] Seq=107190 Ack=1 Win=42496 Len=46336 TSval=2448808330 TSecr=2176922653"
"216","8.976755764","10.0.0.7","10.0.0.1","TCP","66","5201  >  50848 [ACK] Seq=1 Ack=46374 Win=114176 Len=0 TSval=2176922657 TSecr=2448808257"
"217","8.978480229","10.0.0.7","10.0.0.1","TCP","66","5201  >  50848 [ACK] Seq=1 Ack=57958 Win=137216 Len=0 TSval=2176922659 TSecr=2448808257"
"218","8.978497044","10.0.0.1","10.0.0.7","TCP","7306","50848  >  5201 [PSH, ACK] Seq=79678 Ack=1 Win=42496 Len=7240 TSval=2448808336 TSecr=2176922659"
"219","8.978508415","10.0.0.1","10.0.0.7","TCP","27578","50848  >  5201 [PSH, ACK] Seq=86918 Ack=1 Win=42496 Len=27512 TSval=2448808336 TSecr=2176922659"
"220","8.980386446","10.0.0.7","10.0.0.1","TCP","66","5201  >  50848 [ACK] Seq=1 Ack=79678 Win=174080 Len=0 TSval=2176922661 TSecr=2448808260"
"221","8.980399789","10.0.0.1","10.0.0.7","TCP","46402","50848  >  5201 [PSH, ACK] Seq=114430 Ack=1 Win=42496 Len=46336 TSval=2448808338 TSecr=2176922661"
"222","8.984033486","10.0.0.7","10.0.0.1","TCP","66","5201  >  50830 [ACK] Seq=1 Ack=101398 Win=196096 Len=0 TSval=2176922664 TSecr=2448808262"
"223","8.987672820","10.0.0.7","10.0.0.1","TCP","66","5201  >  50836 [ACK] Seq=1 Ack=101398 Win=200704 Len=0 TSval=2176922668 TSecr=2448808263"
"224","8.987690434","10.0.0.1","10.0.0.7","TCP","11650","50836  >  5201 [PSH, ACK] Seq=102846 Ack=1 Win=42496 Len=11584 TSval=2448808345 TSecr=2176922668"
"225","8.987700033","10.0.0.1","10.0.0.7","TCP","42058","50836  >  5201 [PSH, ACK] Seq=114430 Ack=1 Win=42496 Len=41992 TSval=2448808345 TSecr=2176922668"
"226","8.987709967","10.0.0.1","10.0.0.7","TCP","42058","50836  >  5201 [PSH, ACK] Seq=156422 Ack=1 Win=42496 Len=41992 TSval=2448808345 TSecr=2176922668"
"227","8.991303975","10.0.0.7","10.0.0.1","TCP","66","5201  >  50852 [ACK] Seq=1 Ack=46374 Win=114176 Len=0 TSval=2176922672 TSecr=2448808267"
"228","8.993003554","10.0.0.7","10.0.0.1","TCP","66","5201  >  50852 [ACK] Seq=1 Ack=57958 Win=137216 Len=0 TSval=2176922673 TSecr=2448808267"
"229","8.993017469","10.0.0.1","10.0.0.7","TCP","7306","50852  >  5201 [PSH, ACK] Seq=79678 Ack=1 Win=42496 Len=7240 TSval=2448808350 TSecr=2176922673"
"230","8.993034435","10.0.0.1","10.0.0.7","TCP","27578","50852  >  5201 [PSH, ACK] Seq=86918 Ack=1 Win=42496 Len=27512 TSval=2448808350 TSecr=2176922673"
"231","8.994919334","10.0.0.7","10.0.0.1","TCP","66","5201  >  50852 [ACK] Seq=1 Ack=79678 Win=174080 Len=0 TSval=2176922675 TSecr=2448808268"
"232","8.994929725","10.0.0.1","10.0.0.7","TCP","46402","50852  >  5201 [PSH, ACK] Seq=114430 Ack=1 Win=42496 Len=46336 TSval=2448808352 TSecr=2176922675"
"233","8.998566404","10.0.0.7","10.0.0.1","TCP","66","5201  >  50866 [ACK] Seq=1 Ack=46374 Win=93696 Len=0 TSval=2176922679 TSecr=2448808270"
"234","9.000262812","10.0.0.7","10.0.0.1","TCP","66","5201  >  50866 [ACK] Seq=1 Ack=57958 Win=116736 Len=0 TSval=2176922681 TSecr=2448808270"
"235","9.000276367","10.0.0.1","10.0.0.7","TCP","7306","50866  >  5201 [PSH, ACK] Seq=79678 Ack=1 Win=42496 Len=7240 TSval=2448808358 TSecr=2176922681"
"236","9.000285349","10.0.0.1","10.0.0.7","TCP","27578","50866  >  5201 [PSH, ACK] Seq=86918 Ack=1 Win=42496 Len=27512 TSval=2448808358 TSecr=2176922681"
"237","9.002191413","10.0.0.7","10.0.0.1","TCP","66","5201  >  50866 [ACK] Seq=1 Ack=79678 Win=160256 Len=0 TSval=2176922682 TSecr=2448808272"
"238","9.002201287","10.0.0.1","10.0.0.7","TCP","36266","50866  >  5201 [PSH, ACK] Seq=114430 Ack=1 Win=42496 Len=36200 TSval=2448808359 TSecr=2176922682"
"239","9.005830518","10.0.0.7","10.0.0.1","TCP","66","5201  >  50872 [ACK] Seq=1 Ack=46374 Win=93696 Len=0 TSval=2176922686 TSecr=2448808273"
"240","9.007515784","10.0.0.7","10.0.0.1","TCP","66","5201  >  50872 [ACK] Seq=1 Ack=57958 Win=116736 Len=0 TSval=2176922688 TSecr=2448808273"
"241","9.007522403","10.0.0.1","10.0.0.7","TCP","7306","50872  >  5201 [PSH, ACK] Seq=79678 Ack=1 Win=42496 Len=7240 TSval=2448808365 TSecr=2176922688"
"242","9.007534026","10.0.0.1","10.0.0.7","TCP","27578","50872  >  5201 [PSH, ACK] Seq=86918 Ack=1 Win=42496 Len=27512 TSval=2448808365 TSecr=2176922688"
"243","9.009482697","10.0.0.7","10.0.0.1","TCP","66","5201  >  50872 [ACK] Seq=1 Ack=79678 Win=160256 Len=0 TSval=2176922690 TSecr=2448808275"
"244","9.009516486","10.0.0.1","10.0.0.7","TCP","36266","50872  >  5201 [PSH, ACK] Seq=114430 Ack=1 Win=42496 Len=36200 TSval=2448808367 TSecr=2176922690"
"245","9.013095370","10.0.0.7","10.0.0.1","TCP","66","5201  >  50882 [ACK] Seq=1 Ack=46374 Win=114176 Len=0 TSval=2176922693 TSecr=2448808277"
"246","9.014782853","10.0.0.7","10.0.0.1","TCP","66","5201  >  50882 [ACK] Seq=1 Ack=57958 Win=137216 Len=0 TSval=2176922695 TSecr=2448808277"
"247","9.014788250","10.0.0.1","10.0.0.7","TCP","7306","50882  >  5201 [PSH, ACK] Seq=79678 Ack=1 Win=42496 Len=7240 TSval=2448808372 TSecr=2176922695"
"248","9.014791697","10.0.0.1","10.0.0.7","TCP","27578","50882  >  5201 [PSH, ACK] Seq=86918 Ack=1 Win=42496 Len=27512 TSval=2448808372 TSecr=2176922695"
"249","9.016722021","10.0.0.7","10.0.0.1","TCP","66","5201  >  50882 [ACK] Seq=1 Ack=79678 Win=174080 Len=0 TSval=2176922697 TSecr=2448808279"
"250","9.016734546","10.0.0.1","10.0.0.7","TCP","46402","50882  >  5201 [PSH, ACK] Seq=114430 Ack=1 Win=42496 Len=46336 TSval=2448808374 TSecr=2176922697"
"251","9.031257293","10.0.0.7","10.0.0.1","TCP","66","5201  >  50894 [ACK] Seq=1 Ack=46374 Win=68096 Len=0 TSval=2176922712 TSecr=2448808285"
"252","9.032951403","10.0.0.7","10.0.0.1","TCP","66","5201  >  50894 [ACK] Seq=1 Ack=57958 Win=96768 Len=0 TSval=2176922713 TSecr=2448808285"
"253","9.032956908","10.0.0.1","10.0.0.7","TCP","7306","50894  >  5201 [PSH, ACK] Seq=79678 Ack=1 Win=42496 Len=7240 TSval=2448808390 TSecr=2176922713"
"254","9.032961515","10.0.0.1","10.0.0.7","TCP","27578","50894  >  5201 [PSH, ACK] Seq=86918 Ack=1 Win=42496 Len=27512 TSval=2448808390 TSecr=2176922713"
"255","9.034887954","10.0.0.7","10.0.0.1","TCP","66","5201  >  50894 [ACK] Seq=1 Ack=79678 Win=139776 Len=0 TSval=2176922715 TSecr=2448808287"
"256","9.034895404","10.0.0.1","10.0.0.7","TCP","36266","50894  >  5201 [PSH, ACK] Seq=114430 Ack=1 Win=42496 Len=36200 TSval=2448808392 TSecr=2176922715"
"257","9.049427135","10.0.0.7","10.0.0.1","TCP","66","5201  >  50898 [ACK] Seq=1 Ack=46374 Win=93696 Len=0 TSval=2176922730 TSecr=2448808294"
"258","9.051119895","10.0.0.7","10.0.0.1","TCP","66","5201  >  50898 [ACK] Seq=1 Ack=57958 Win=116736 Len=0 TSval=2176922731 TSecr=2448808294"
"259","9.051156015","10.0.0.1","10.0.0.7","TCP","7306","50898  >  5201 [PSH, ACK] Seq=79678 Ack=1 Win=42496 Len=7240 TSval=2448808408 TSecr=2176922731"
"260","9.051177924","10.0.0.1","10.0.0.7","TCP","27578","50898  >  5201 [PSH, ACK] Seq=86918 Ack=1 Win=42496 Len=27512 TSval=2448808408 TSecr=2176922731"
"261","9.053073540","10.0.0.7","10.0.0.1","TCP","66","5201  >  50898 [ACK] Seq=1 Ack=79678 Win=160256 Len=0 TSval=2176922733 TSecr=2448808295"
"262","9.053089837","10.0.0.1","10.0.0.7","TCP","36266","50898  >  5201 [PSH, ACK] Seq=114430 Ack=1 Win=42496 Len=36200 TSval=2448808410 TSecr=2176922733"
"263","9.071228723","10.0.0.7","10.0.0.1","TCP","66","5201  >  50908 [ACK] Seq=1 Ack=46374 Win=108544 Len=0 TSval=2176922751 TSecr=2448808304"
"264","9.072920631","10.0.0.7","10.0.0.1","TCP","66","5201  >  50908 [ACK] Seq=1 Ack=57958 Win=131584 Len=0 TSval=2176922753 TSecr=2448808304"
"265","9.072926866","10.0.0.1","10.0.0.7","TCP","7306","50908  >  5201 [PSH, ACK] Seq=79678 Ack=1 Win=42496 Len=7240 TSval=2448808430 TSecr=2176922753"
"266","9.072930785","10.0.0.1","10.0.0.7","TCP","24682","50908  >  5201 [PSH, ACK] Seq=86918 Ack=1 Win=42496 Len=24616 TSval=2448808430 TSecr=2176922753"
"267","9.074858307","10.0.0.7","10.0.0.1","TCP","66","5201  >  50908 [ACK] Seq=1 Ack=79678 Win=174080 Len=0 TSval=2176922755 TSecr=2448808306"
"268","9.074870448","10.0.0.1","10.0.0.7","TCP","33370","50908  >  5201 [PSH, ACK] Seq=111534 Ack=1 Win=42496 Len=33304 TSval=2448808432 TSecr=2176922755"
"269","9.114831820","10.0.0.7","10.0.0.1","TCP","66","5201  >  50836 [ACK] Seq=1 Ack=102846 Win=203776 Len=0 TSval=2176922795 TSecr=2448808327"
"270","9.115077926","10.0.0.7","10.0.0.1","TCP","66","5201  >  50830 [ACK] Seq=1 Ack=107190 Win=207360 Len=0 TSval=2176922795 TSecr=2448808330"
"271","9.115095073","10.0.0.1","10.0.0.7","TCP","18890","50830  >  5201 [PSH, ACK] Seq=153526 Ack=1 Win=42496 Len=18824 TSval=2448808472 TSecr=2176922795"
"272","9.115103347","10.0.0.1","10.0.0.7","TCP","56538","50830  >  5201 [PSH, ACK] Seq=172350 Ack=1 Win=42496 Len=56472 TSval=2448808472 TSecr=2176922795"
"273","9.116038791","10.0.0.7","10.0.0.1","TCP","66","5201  >  50830 [ACK] Seq=1 Ack=153526 Win=230912 Len=0 TSval=2176922796 TSecr=2448808330"
"274","9.123794865","10.0.0.7","10.0.0.1","TCP","66","5201  >  50848 [ACK] Seq=1 Ack=86918 Win=187392 Len=0 TSval=2176922804 TSecr=2448808336"
