"No.","Time","Source","Destination","Protocol","Length","Info"
"1","0.000000000","fe80::14e3:8ff:fe06:5c1","ff02::2","ICMPv6","70","Router Solicitation from 16:e3:08:06:05:c1"
"2","0.000695052","fe80::fcdf:a0ff:fe11:b7d6","ff02::2","ICMPv6","70","Router Solicitation from fe:df:a0:11:b7:d6"
"3","0.000799316","fe80::eca6:f2ff:fe59:c53f","ff02::2","ICMPv6","70","Router Solicitation from ee:a6:f2:59:c5:3f"
"4","1.024337237","fe80::44b5:6eff:fefe:1144","ff02::2","ICMPv6","70","Router Solicitation from 46:b5:6e:fe:11:44"
"5","1.535954506","fe80::5c1e:d5ff:fea5:af24","ff02::2","ICMPv6","70","Router Solicitation from 5e:1e:d5:a5:af:24"
"6","1.535894633","fe80::54c1:d7ff:fedf:66d2","ff02::2","ICMPv6","70","Router Solicitation from 56:c1:d7:df:66:d2"
"7","1.536054039","fe80::9ca4:1ff:fe97:6318","ff02::2","ICMPv6","70","Router Solicitation from 9e:a4:01:97:63:18"
"8","4.281183637","56:c1:d7:df:66:d2","Broadcast","ARP","42","Who has 10.0.0.7? Tell 10.0.0.3"
"9","4.281700018","fe:df:a0:11:b7:d6","Broadcast","ARP","42","Who has 10.0.0.7? Tell 10.0.0.1"
"10","4.282037118","46:b5:6e:fe:11:44","56:c1:d7:df:66:d2","ARP","42","10.0.0.7 is at 46:b5:6e:fe:11:44"
"11","4.282046841","10.0.0.3","10.0.0.7","TCP","74","43242  >  5202 [SYN] Seq=0 Win=42340 Len=0 MSS=1460 SACK_PERM TSval=3233678851 TSecr=0 WS=512"
"12","4.282717965","10.0.0.7","10.0.0.3","TCP","74","5202  >  43242 [SYN, ACK] Seq=0 Ack=1 Win=43440 Len=0 MSS=1460 SACK_PERM TSval=3469907488 TSecr=3233678851 WS=512"
"13","4.282757892","10.0.0.3","10.0.0.7","TCP","66","43242  >  5202 [ACK] Seq=1 Ack=1 Win=42496 Len=0 TSval=3233678853 TSecr=3469907488"
"14","4.282832569","10.0.0.3","10.0.0.7","TCP","103","43242  >  5202 [PSH, ACK] Seq=1 Ack=1 Win=42496 Len=37 TSval=3233678853 TSecr=3469907488"
"15","4.282865840","10.0.0.7","10.0.0.3","TCP","66","5202  >  43242 [ACK] Seq=1 Ack=38 Win=43520 Len=0 TSval=3469907489 TSecr=3233678853"
"16","4.282907495","10.0.0.7","10.0.0.3","TCP","67","5202  >  43242 [PSH, ACK] Seq=1 Ack=38 Win=43520 Len=1 TSval=3469907489 TSecr=3233678853"
"17","4.282922313","10.0.0.3","10.0.0.7","TCP","66","43242  >  5202 [ACK] Seq=38 Ack=2 Win=42496 Len=0 TSval=3233678853 TSecr=3469907489"
"18","4.282957093","10.0.0.3","10.0.0.7","TCP","70","43242  >  5202 [PSH, ACK] Seq=38 Ack=2 Win=42496 Len=4 TSval=3233678853 TSecr=3469907489"
"19","4.282980982","10.0.0.3","10.0.0.7","TCP","238","43242  >  5202 [PSH, ACK] Seq=42 Ack=2 Win=42496 Len=172 TSval=3233678853 TSecr=3469907489"
"20","4.283014973","10.0.0.7","10.0.0.3","TCP","66","5202  >  43242 [ACK] Seq=2 Ack=214 Win=43520 Len=0 TSval=3469907489 TSecr=3233678853"
"21","4.283090221","10.0.0.7","10.0.0.3","TCP","67","5202  >  43242 [PSH, ACK] Seq=2 Ack=214 Win=43520 Len=1 TSval=3469907489 TSecr=3233678853"
"22","4.283162521","10.0.0.3","10.0.0.7","TCP","74","43248  >  5202 [SYN] Seq=0 Win=42340 Len=0 MSS=1460 SACK_PERM TSval=3233678853 TSecr=0 WS=512"
"23","4.283198645","10.0.0.7","10.0.0.3","TCP","74","5202  >  43248 [SYN, ACK] Seq=0 Ack=1 Win=43440 Len=0 MSS=1460 SACK_PERM TSval=3469907489 TSecr=3233678853 WS=512"
"24","4.283216208","10.0.0.3","10.0.0.7","TCP","66","43248  >  5202 [ACK] Seq=1 Ack=1 Win=42496 Len=0 TSval=3233678853 TSecr=3469907489"
"25","4.283248381","10.0.0.3","10.0.0.7","TCP","103","43248  >  5202 [PSH, ACK] Seq=1 Ack=1 Win=42496 Len=37 TSval=3233678853 TSecr=3469907489"
"26","4.283275651","10.0.0.7","10.0.0.3","TCP","66","5202  >  43248 [ACK] Seq=1 Ack=38 Win=43520 Len=0 TSval=3469907489 TSecr=3233678853"
"27","4.284592516","10.0.0.3","10.0.0.7","TCP","74","43262  >  5202 [SYN] Seq=0 Win=42340 Len=0 MSS=1460 SACK_PERM TSval=3233678854 TSecr=0 WS=512"
"28","4.284632524","10.0.0.7","10.0.0.3","TCP","74","5202  >  43262 [SYN, ACK] Seq=0 Ack=1 Win=43440 Len=0 MSS=1460 SACK_PERM TSval=3469907490 TSecr=3233678854 WS=512"
"29","4.284664260","10.0.0.3","10.0.0.7","TCP","66","43262  >  5202 [ACK] Seq=1 Ack=1 Win=42496 Len=0 TSval=3233678854 TSecr=3469907490"
"30","4.284703448","10.0.0.3","10.0.0.7","TCP","103","43262  >  5202 [PSH, ACK] Seq=1 Ack=1 Win=42496 Len=37 TSval=3233678855 TSecr=3469907490"
"31","4.284725635","10.0.0.7","10.0.0.3","TCP","66","5202  >  43262 [ACK] Seq=1 Ack=38 Win=43520 Len=0 TSval=3469907491 TSecr=3233678855"
"32","4.286101728","10.0.0.3","10.0.0.7","TCP","74","43276  >  5202 [SYN] Seq=0 Win=42340 Len=0 MSS=1460 SACK_PERM TSval=3233678856 TSecr=0 WS=512"
"33","4.286138336","10.0.0.7","10.0.0.3","TCP","74","5202  >  43276 [SYN, ACK] Seq=0 Ack=1 Win=43440 Len=0 MSS=1460 SACK_PERM TSval=3469907492 TSecr=3233678856 WS=512"
"34","4.286155395","10.0.0.3","10.0.0.7","TCP","66","43276  >  5202 [ACK] Seq=1 Ack=1 Win=42496 Len=0 TSval=3233678856 TSecr=3469907492"
"35","4.286190472","10.0.0.3","10.0.0.7","TCP","103","43276  >  5202 [PSH, ACK] Seq=1 Ack=1 Win=42496 Len=37 TSval=3233678856 TSecr=3469907492"
"36","4.286211103","10.0.0.7","10.0.0.3","TCP","66","5202  >  43276 [ACK] Seq=1 Ack=38 Win=43520 Len=0 TSval=3469907492 TSecr=3233678856"
"37","4.287563379","10.0.0.3","10.0.0.7","TCP","74","43288  >  5202 [SYN] Seq=0 Win=42340 Len=0 MSS=1460 SACK_PERM TSval=3233678857 TSecr=0 WS=512"
"38","4.287599358","10.0.0.7","10.0.0.3","TCP","74","5202  >  43288 [SYN, ACK] Seq=0 Ack=1 Win=43440 Len=0 MSS=1460 SACK_PERM TSval=3469907493 TSecr=3233678857 WS=512"
"39","4.287614925","10.0.0.3","10.0.0.7","TCP","66","43288  >  5202 [ACK] Seq=1 Ack=1 Win=42496 Len=0 TSval=3233678857 TSecr=3469907493"
"40","4.287646474","10.0.0.3","10.0.0.7","TCP","103","43288  >  5202 [PSH, ACK] Seq=1 Ack=1 Win=42496 Len=37 TSval=3233678857 TSecr=3469907493"
"41","4.287677674","10.0.0.7","10.0.0.3","TCP","66","5202  >  43288 [ACK] Seq=1 Ack=38 Win=43520 Len=0 TSval=3469907494 TSecr=3233678857"
"42","4.288912358","10.0.0.3","10.0.0.7","TCP","74","43296  >  5202 [SYN] Seq=0 Win=42340 Len=0 MSS=1460 SACK_PERM TSval=3233678859 TSecr=0 WS=512"
"43","4.288943456","10.0.0.7","10.0.0.3","TCP","74","5202  >  43296 [SYN, ACK] Seq=0 Ack=1 Win=43440 Len=0 MSS=1460 SACK_PERM TSval=3469907495 TSecr=3233678859 WS=512"
"44","4.288956284","10.0.0.3","10.0.0.7","TCP","66","43296  >  5202 [ACK] Seq=1 Ack=1 Win=42496 Len=0 TSval=3233678859 TSecr=3469907495"
"45","4.288978672","10.0.0.3","10.0.0.7","TCP","103","43296  >  5202 [PSH, ACK] Seq=1 Ack=1 Win=42496 Len=37 TSval=3233678859 TSecr=3469907495"
"46","4.288988841","10.0.0.7","10.0.0.3","TCP","66","5202  >  43296 [ACK] Seq=1 Ack=38 Win=43520 Len=0 TSval=3469907495 TSecr=3233678859"
"47","4.289821839","10.0.0.3","10.0.0.7","TCP","74","43300  >  5202 [SYN] Seq=0 Win=42340 Len=0 MSS=1460 SACK_PERM TSval=3233678860 TSecr=0 WS=512"
"48","4.289838662","10.0.0.7","10.0.0.3","TCP","74","5202  >  43300 [SYN, ACK] Seq=0 Ack=1 Win=43440 Len=0 MSS=1460 SACK_PERM TSval=3469907496 TSecr=3233678860 WS=512"
"49","4.289845380","10.0.0.3","10.0.0.7","TCP","66","43300  >  5202 [ACK] Seq=1 Ack=1 Win=42496 Len=0 TSval=3233678860 TSecr=3469907496"
"50","4.289859042","10.0.0.3","10.0.0.7","TCP","103","43300  >  5202 [PSH, ACK] Seq=1 Ack=1 Win=42496 Len=37 TSval=3233678860 TSecr=3469907496"
"51","4.289867429","10.0.0.7","10.0.0.3","TCP","66","5202  >  43300 [ACK] Seq=1 Ack=38 Win=43520 Len=0 TSval=3469907496 TSecr=3233678860"
"52","4.290497923","10.0.0.3","10.0.0.7","TCP","74","43312  >  5202 [SYN] Seq=0 Win=42340 Len=0 MSS=1460 SACK_PERM TSval=3233678860 TSecr=0 WS=512"
"53","4.290509855","10.0.0.7","10.0.0.3","TCP","74","5202  >  43312 [SYN, ACK] Seq=0 Ack=1 Win=43440 Len=0 MSS=1460 SACK_PERM TSval=3469907496 TSecr=3233678860 WS=512"
"54","4.290514510","10.0.0.3","10.0.0.7","TCP","66","43312  >  5202 [ACK] Seq=1 Ack=1 Win=42496 Len=0 TSval=3233678860 TSecr=3469907496"
"55","4.290524244","10.0.0.3","10.0.0.7","TCP","103","43312  >  5202 [PSH, ACK] Seq=1 Ack=1 Win=42496 Len=37 TSval=3233678860 TSecr=3469907496"
"56","4.290531389","10.0.0.7","10.0.0.3","TCP","66","5202  >  43312 [ACK] Seq=1 Ack=38 Win=43520 Len=0 TSval=3469907496 TSecr=3233678860"
"57","4.291369031","10.0.0.3","10.0.0.7","TCP","74","43324  >  5202 [SYN] Seq=0 Win=42340 Len=0 MSS=1460 SACK_PERM TSval=3233678861 TSecr=0 WS=512"
"58","4.291378882","10.0.0.7","10.0.0.3","TCP","74","5202  >  43324 [SYN, ACK] Seq=0 Ack=1 Win=43440 Len=0 MSS=1460 SACK_PERM TSval=3469907497 TSecr=3233678861 WS=512"
"59","4.291382952","10.0.0.3","10.0.0.7","TCP","66","43324  >  5202 [ACK] Seq=1 Ack=1 Win=42496 Len=0 TSval=3233678861 TSecr=3469907497"
"60","4.291390905","10.0.0.3","10.0.0.7","TCP","103","43324  >  5202 [PSH, ACK] Seq=1 Ack=1 Win=42496 Len=37 TSval=3233678861 TSecr=3469907497"
"61","4.291397394","10.0.0.7","10.0.0.3","TCP","66","5202  >  43324 [ACK] Seq=1 Ack=38 Win=43520 Len=0 TSval=3469907497 TSecr=3233678861"
"62","4.291970820","10.0.0.3","10.0.0.7","TCP","74","43326  >  5202 [SYN] Seq=0 Win=42340 Len=0 MSS=1460 SACK_PERM TSval=3233678862 TSecr=0 WS=512"
"63","4.291991873","10.0.0.7","10.0.0.3","TCP","74","5202  >  43326 [SYN, ACK] Seq=0 Ack=1 Win=43440 Len=0 MSS=1460 SACK_PERM TSval=3469907498 TSecr=3233678862 WS=512"
"64","4.292000281","10.0.0.3","10.0.0.7","TCP","66","43326  >  5202 [ACK] Seq=1 Ack=1 Win=42496 Len=0 TSval=3233678862 TSecr=3469907498"
"65","4.292016939","10.0.0.3","10.0.0.7","TCP","103","43326  >  5202 [PSH, ACK] Seq=1 Ack=1 Win=42496 Len=37 TSval=3233678862 TSecr=3469907498"
"66","4.292028666","10.0.0.7","10.0.0.3","TCP","66","5202  >  43326 [ACK] Seq=1 Ack=38 Win=43520 Len=0 TSval=3469907498 TSecr=3233678862"
"67","4.292690129","10.0.0.3","10.0.0.7","TCP","74","43334  >  5202 [SYN] Seq=0 Win=42340 Len=0 MSS=1460 SACK_PERM TSval=3233678863 TSecr=0 WS=512"
"68","4.292701016","10.0.0.7","10.0.0.3","TCP","74","5202  >  43334 [SYN, ACK] Seq=0 Ack=1 Win=43440 Len=0 MSS=1460 SACK_PERM TSval=3469907499 TSecr=3233678863 WS=512"
"69","4.292705155","10.0.0.3","10.0.0.7","TCP","66","43334  >  5202 [ACK] Seq=1 Ack=1 Win=42496 Len=0 TSval=3233678863 TSecr=3469907499"
"70","4.292713562","10.0.0.3","10.0.0.7","TCP","103","43334  >  5202 [PSH, ACK] Seq=1 Ack=1 Win=42496 Len=37 TSval=3233678863 TSecr=3469907499"
"71","4.292719713","10.0.0.7","10.0.0.3","TCP","66","5202  >  43334 [ACK] Seq=1 Ack=38 Win=43520 Len=0 TSval=3469907499 TSecr=3233678863"
"72","4.293482970","10.0.0.7","10.0.0.3","TCP","67","5202  >  43242 [PSH, ACK] Seq=3 Ack=214 Win=43520 Len=1 TSval=3469907499 TSecr=3233678853"
"73","4.293499822","10.0.0.7","10.0.0.3","TCP","67","5202  >  43242 [PSH, ACK] Seq=4 Ack=214 Win=43520 Len=1 TSval=3469907499 TSecr=3233678853"
"74","4.293501632","10.0.0.3","10.0.0.7","TCP","66","43242  >  5202 [ACK] Seq=214 Ack=4 Win=42496 Len=0 TSval=3233678863 TSecr=3469907489"
"75","4.293669350","10.0.0.3","10.0.0.7","TCP","7306","43248  >  5202 [PSH, ACK] Seq=38 Ack=1 Win=42496 Len=7240 TSval=3233678864 TSecr=3469907489"
"76","4.293689516","10.0.0.3","10.0.0.7","TCP","7306","43276  >  5202 [PSH, ACK] Seq=38 Ack=1 Win=42496 Len=7240 TSval=3233678864 TSecr=3469907492"
"77","4.293699120","10.0.0.3","10.0.0.7","TCP","7306","43262  >  5202 [PSH, ACK] Seq=38 Ack=1 Win=42496 Len=7240 TSval=3233678864 TSecr=3469907491"
"78","4.293702580","10.0.0.7","10.0.0.3","TCP","66","5202  >  43248 [ACK] Seq=1 Ack=7278 Win=56832 Len=0 TSval=3469907500 TSecr=3233678864"
"79","4.293704615","10.0.0.3","10.0.0.7","TCP","7306","43276  >  5202 [PSH, ACK] Seq=7278 Ack=1 Win=42496 Len=7240 TSval=3233678864 TSecr=3469907492"
"80","4.293716319","10.0.0.3","10.0.0.7","TCP","7306","43248  >  5202 [PSH, ACK] Seq=7278 Ack=1 Win=42496 Len=7240 TSval=3233678864 TSecr=3469907489"
"81","4.293717796","10.0.0.3","10.0.0.7","TCP","7306","43262  >  5202 [PSH, ACK] Seq=7278 Ack=1 Win=42496 Len=7240 TSval=3233678864 TSecr=3469907491"
"82","4.293773011","10.0.0.3","10.0.0.7","TCP","10202","43248  >  5202 [PSH, ACK] Seq=14518 Ack=1 Win=42496 Len=10136 TSval=3233678864 TSecr=3469907500"
"83","4.293806911","10.0.0.3","10.0.0.7","TCP","7306","43288  >  5202 [PSH, ACK] Seq=38 Ack=1 Win=42496 Len=7240 TSval=3233678864 TSecr=3469907494"
"84","4.293813190","10.0.0.3","10.0.0.7","TCP","7306","43296  >  5202 [PSH, ACK] Seq=38 Ack=1 Win=42496 Len=7240 TSval=3233678864 TSecr=3469907495"
"85","4.293822153","10.0.0.3","10.0.0.7","TCP","7306","43288  >  5202 [PSH, ACK] Seq=7278 Ack=1 Win=42496 Len=7240 TSval=3233678864 TSecr=3469907494"
"86","4.293826187","10.0.0.3","10.0.0.7","TCP","7306","43296  >  5202 [PSH, ACK] Seq=7278 Ack=1 Win=42496 Len=7240 TSval=3233678864 TSecr=3469907495"
"87","4.293876970","10.0.0.3","10.0.0.7","TCP","7306","43300  >  5202 [PSH, ACK] Seq=38 Ack=1 Win=42496 Len=7240 TSval=3233678864 TSecr=3469907496"
"88","4.293895253","10.0.0.3","10.0.0.7","TCP","7306","43300  >  5202 [PSH, ACK] Seq=7278 Ack=1 Win=42496 Len=7240 TSval=3233678864 TSecr=3469907496"
"89","4.293996761","10.0.0.3","10.0.0.7","TCP","7306","43324  >  5202 [PSH, ACK] Seq=38 Ack=1 Win=42496 Len=7240 TSval=3233678864 TSecr=3469907497"
"90","4.294008993","10.0.0.3","10.0.0.7","TCP","7306","43324  >  5202 [PSH, ACK] Seq=7278 Ack=1 Win=42496 Len=7240 TSval=3233678864 TSecr=3469907497"
"91","4.294019479","10.0.0.3","10.0.0.7","TCP","7306","43312  >  5202 [PSH, ACK] Seq=38 Ack=1 Win=42496 Len=7240 TSval=3233678864 TSecr=3469907496"
"92","4.294037815","10.0.0.3","10.0.0.7","TCP","7306","43312  >  5202 [PSH, ACK] Seq=7278 Ack=1 Win=42496 Len=7240 TSval=3233678864 TSecr=3469907496"
"93","4.294083749","10.0.0.3","10.0.0.7","TCP","7306","43334  >  5202 [PSH, ACK] Seq=38 Ack=1 Win=42496 Len=7240 TSval=3233678864 TSecr=3469907499"
"94","4.294092355","10.0.0.3","10.0.0.7","TCP","7306","43334  >  5202 [PSH, ACK] Seq=7278 Ack=1 Win=42496 Len=7240 TSval=3233678864 TSecr=3469907499"
"95","4.294119540","10.0.0.3","10.0.0.7","TCP","7306","43326  >  5202 [PSH, ACK] Seq=38 Ack=1 Win=42496 Len=7240 TSval=3233678864 TSecr=3469907498"
"96","4.294138581","10.0.0.3","10.0.0.7","TCP","7306","43326  >  5202 [PSH, ACK] Seq=7278 Ack=1 Win=42496 Len=7240 TSval=3233678864 TSecr=3469907498"
"97","4.294687633","10.0.0.7","10.0.0.3","TCP","66","5202  >  43276 [ACK] Seq=1 Ack=7278 Win=56832 Len=0 TSval=3469907501 TSecr=3233678864"
"98","4.294703166","10.0.0.3","10.0.0.7","TCP","10202","43276  >  5202 [PSH, ACK] Seq=14518 Ack=1 Win=42496 Len=10136 TSval=3233678865 TSecr=3469907501"
"99","4.295852981","10.0.0.7","10.0.0.3","TCP","66","5202  >  43262 [ACK] Seq=1 Ack=7278 Win=56832 Len=0 TSval=3469907502 TSecr=3233678864"
"100","4.295858260","10.0.0.3","10.0.0.7","TCP","10202","43262  >  5202 [PSH, ACK] Seq=14518 Ack=1 Win=42496 Len=10136 TSval=3233678866 TSecr=3469907502"
"101","4.297090856","10.0.0.7","10.0.0.3","TCP","66","5202  >  43276 [ACK] Seq=1 Ack=14518 Win=70656 Len=0 TSval=3469907503 TSecr=3233678864"
"102","4.297098073","10.0.0.3","10.0.0.7","TCP","11650","43276  >  5202 [PSH, ACK] Seq=24654 Ack=1 Win=42496 Len=11584 TSval=3233678867 TSecr=3469907503"
"103","4.297656529","10.0.0.3","10.0.0.7","TCP","1514","43334  >  5202 [ACK] Seq=14518 Ack=1 Win=42496 Len=1448 TSval=3233678868 TSecr=3469907499"
"104","4.297668995","10.0.0.3","10.0.0.7","TCP","1514","43300  >  5202 [ACK] Seq=14518 Ack=1 Win=42496 Len=1448 TSval=3233678868 TSecr=3469907496"
"105","4.297715029","10.0.0.3","10.0.0.7","TCP","1514","43324  >  5202 [ACK] Seq=14518 Ack=1 Win=42496 Len=1448 TSval=3233678868 TSecr=3469907497"
"106","4.297719873","10.0.0.3","10.0.0.7","TCP","1514","43288  >  5202 [ACK] Seq=14518 Ack=1 Win=42496 Len=1448 TSval=3233678868 TSecr=3469907494"
"107","4.297767294","10.0.0.3","10.0.0.7","TCP","1514","43312  >  5202 [ACK] Seq=14518 Ack=1 Win=42496 Len=1448 TSval=3233678868 TSecr=3469907496"
"108","4.297770137","10.0.0.3","10.0.0.7","TCP","1514","43326  >  5202 [ACK] Seq=14518 Ack=1 Win=42496 Len=1448 TSval=3233678868 TSecr=3469907498"
"109","4.297780169","10.0.0.3","10.0.0.7","TCP","1514","43296  >  5202 [ACK] Seq=14518 Ack=1 Win=42496 Len=1448 TSval=3233678868 TSecr=3469907495"
"110","4.298277037","10.0.0.7","10.0.0.3","TCP","66","5202  >  43248 [ACK] Seq=1 Ack=14518 Win=70656 Len=0 TSval=3469907504 TSecr=3233678864"
"111","4.298282246","10.0.0.3","10.0.0.7","TCP","11650","43248  >  5202 [PSH, ACK] Seq=24654 Ack=1 Win=42496 Len=11584 TSval=3233678868 TSecr=3469907504"
"112","4.299482146","10.0.0.7","10.0.0.3","TCP","66","5202  >  43262 [ACK] Seq=1 Ack=14518 Win=70656 Len=0 TSval=3469907505 TSecr=3233678864"
"113","4.299485093","10.0.0.3","10.0.0.7","TCP","11650","43262  >  5202 [PSH, ACK] Seq=24654 Ack=1 Win=42496 Len=11584 TSval=3233678869 TSecr=3469907505"
"114","4.300692335","10.0.0.7","10.0.0.3","TCP","66","5202  >  43248 [ACK] Seq=1 Ack=24654 Win=68096 Len=0 TSval=3469907507 TSecr=3233678864"
"115","4.300697865","10.0.0.3","10.0.0.7","TCP","18890","43248  >  5202 [PSH, ACK] Seq=36238 Ack=1 Win=42496 Len=18824 TSval=3233678871 TSecr=3469907507"
"116","4.300698632","10.0.0.3","10.0.0.7","TCP","2962","43248  >  5202 [PSH, ACK] Seq=55062 Ack=1 Win=42496 Len=2896 TSval=3233678871 TSecr=3469907507"
"117","4.302388597","10.0.0.7","10.0.0.3","TCP","66","5202  >  43288 [ACK] Seq=1 Ack=7278 Win=56832 Len=0 TSval=3469907508 TSecr=3233678864"
"118","4.302393477","10.0.0.3","10.0.0.7","TCP","10202","43288  >  5202 [PSH, ACK] Seq=15966 Ack=1 Win=42496 Len=10136 TSval=3233678872 TSecr=3469907508"
"119","4.302653655","10.0.0.3","10.0.0.7","TCP","7306","43276  >  5202 [PSH, ACK] Seq=36238 Ack=1 Win=42496 Len=7240 TSval=3233678873 TSecr=3469907503"
"120","4.303601387","10.0.0.7","10.0.0.3","TCP","66","5202  >  43296 [ACK] Seq=1 Ack=7278 Win=56832 Len=0 TSval=3469907509 TSecr=3233678864"
"121","4.303605119","10.0.0.3","10.0.0.7","TCP","10202","43296  >  5202 [PSH, ACK] Seq=15966 Ack=1 Win=42496 Len=10136 TSval=3233678873 TSecr=3469907509"
"122","4.304810794","10.0.0.7","10.0.0.3","TCP","66","5202  >  43288 [ACK] Seq=1 Ack=14518 Win=70656 Len=0 TSval=3469907511 TSecr=3233678864"
"123","4.304813999","10.0.0.3","10.0.0.7","TCP","10202","43288  >  5202 [PSH, ACK] Seq=26102 Ack=1 Win=42496 Len=10136 TSval=3233678875 TSecr=3469907511"
"124","4.305651347","10.0.0.3","10.0.0.7","TCP","7306","43262  >  5202 [PSH, ACK] Seq=36238 Ack=1 Win=42496 Len=7240 TSval=3233678876 TSecr=3469907505"
"125","4.306021677","10.0.0.7","10.0.0.3","TCP","66","5202  >  43296 [ACK] Seq=1 Ack=14518 Win=70656 Len=0 TSval=3469907512 TSecr=3233678864"
"126","4.306024100","10.0.0.3","10.0.0.7","TCP","10202","43296  >  5202 [PSH, ACK] Seq=26102 Ack=1 Win=42496 Len=10136 TSval=3233678876 TSecr=3469907512"
"127","4.306651950","10.0.0.3","10.0.0.7","TCP","5858","43248  >  5202 [PSH, ACK] Seq=57958 Ack=1 Win=42496 Len=5792 TSval=3233678877 TSecr=3469907507"
"128","4.307265075","10.0.0.7","10.0.0.3","TCP","66","5202  >  43300 [ACK] Seq=1 Ack=7278 Win=56832 Len=0 TSval=3469907513 TSecr=3233678864"
"129","4.307269150","10.0.0.3","10.0.0.7","TCP","10202","43300  >  5202 [PSH, ACK] Seq=15966 Ack=1 Win=42496 Len=10136 TSval=3233678877 TSecr=3469907513"
"130","4.308456928","10.0.0.7","10.0.0.3","TCP","66","5202  >  43300 [ACK] Seq=1 Ack=14518 Win=70656 Len=0 TSval=3469907514 TSecr=3233678864"
"131","4.308459741","10.0.0.3","10.0.0.7","TCP","10202","43300  >  5202 [PSH, ACK] Seq=26102 Ack=1 Win=42496 Len=10136 TSval=3233678878 TSecr=3469907514"
"132","4.309669323","10.0.0.7","10.0.0.3","TCP","66","5202  >  43324 [ACK] Seq=1 Ack=7278 Win=56832 Len=0 TSval=3469907516 TSecr=3233678864"
"133","4.309674445","10.0.0.3","10.0.0.7","TCP","10202","43324  >  5202 [PSH, ACK] Seq=15966 Ack=1 Win=42496 Len=10136 TSval=3233678880 TSecr=3469907516"
"134","4.310879446","10.0.0.7","10.0.0.3","TCP","66","5202  >  43324 [ACK] Seq=1 Ack=14518 Win=70656 Len=0 TSval=3469907517 TSecr=3233678864"
"135","4.310884065","10.0.0.3","10.0.0.7","TCP","10202","43324  >  5202 [PSH, ACK] Seq=26102 Ack=1 Win=42496 Len=10136 TSval=3233678881 TSecr=3469907517"
"136","4.312091452","10.0.0.7","10.0.0.3","TCP","66","5202  >  43312 [ACK] Seq=1 Ack=7278 Win=56832 Len=0 TSval=3469907518 TSecr=3233678864"
"137","4.312095859","10.0.0.3","10.0.0.7","TCP","10202","43312  >  5202 [PSH, ACK] Seq=15966 Ack=1 Win=42496 Len=10136 TSval=3233678882 TSecr=3469907518"
"138","4.313301731","10.0.0.7","10.0.0.3","TCP","66","5202  >  43312 [ACK] Seq=1 Ack=14518 Win=70656 Len=0 TSval=3469907519 TSecr=3233678864"
"139","4.313306073","10.0.0.3","10.0.0.7","TCP","10202","43312  >  5202 [PSH, ACK] Seq=26102 Ack=1 Win=42496 Len=10136 TSval=3233678883 TSecr=3469907519"
"140","4.314513835","10.0.0.7","10.0.0.3","TCP","66","5202  >  43334 [ACK] Seq=1 Ack=7278 Win=56832 Len=0 TSval=3469907520 TSecr=3233678864"
"141","4.314519021","10.0.0.3","10.0.0.7","TCP","10202","43334  >  5202 [PSH, ACK] Seq=15966 Ack=1 Win=42496 Len=10136 TSval=3233678884 TSecr=3469907520"
"142","4.315725062","10.0.0.7","10.0.0.3","TCP","66","5202  >  43334 [ACK] Seq=1 Ack=14518 Win=70656 Len=0 TSval=3469907522 TSecr=3233678864"
"143","4.315731263","10.0.0.3","10.0.0.7","TCP","10202","43334  >  5202 [PSH, ACK] Seq=26102 Ack=1 Win=42496 Len=10136 TSval=3233678886 TSecr=3469907522"
"144","4.316936614","10.0.0.7","10.0.0.3","TCP","66","5202  >  43326 [ACK] Seq=1 Ack=7278 Win=56832 Len=0 TSval=3469907523 TSecr=3233678864"
"145","4.316941654","10.0.0.3","10.0.0.7","TCP","10202","43326  >  5202 [PSH, ACK] Seq=15966 Ack=1 Win=42496 Len=10136 TSval=3233678887 TSecr=3469907523"
"146","4.318146745","10.0.0.7","10.0.0.3","TCP","66","5202  >  43326 [ACK] Seq=1 Ack=14518 Win=70656 Len=0 TSval=3469907524 TSecr=3233678864"
"147","4.318152443","10.0.0.3","10.0.0.7","TCP","10202","43326  >  5202 [PSH, ACK] Seq=26102 Ack=1 Win=42496 Len=10136 TSval=3233678888 TSecr=3469907524"
"148","4.319357610","10.0.0.7","10.0.0.3","TCP","66","5202  >  43276 [ACK] Seq=1 Ack=24654 Win=68096 Len=0 TSval=3469907525 TSecr=3233678865"
"149","4.319361286","10.0.0.3","10.0.0.7","TCP","14546","43276  >  5202 [PSH, ACK] Seq=43478 Ack=1 Win=42496 Len=14480 TSval=3233678889 TSecr=3469907525"
"150","4.321053688","10.0.0.7","10.0.0.3","TCP","66","5202  >  43262 [ACK] Seq=1 Ack=24654 Win=68096 Len=0 TSval=3469907527 TSecr=3233678866"
"151","4.321056919","10.0.0.3","10.0.0.7","TCP","14546","43262  >  5202 [PSH, ACK] Seq=43478 Ack=1 Win=42496 Len=14480 TSval=3233678891 TSecr=3469907527"
"152","4.322748216","10.0.0.7","10.0.0.3","TCP","66","5202  >  43276 [ACK] Seq=1 Ack=36238 Win=93696 Len=0 TSval=3469907529 TSecr=3233678867"
"153","4.322753894","10.0.0.3","10.0.0.7","TCP","21786","43276  >  5202 [PSH, ACK] Seq=57958 Ack=1 Win=42496 Len=21720 TSval=3233678893 TSecr=3469907529"
"154","4.324687470","10.0.0.7","10.0.0.3","TCP","66","5202  >  43334 [ACK] Seq=1 Ack=15966 Win=73216 Len=0 TSval=3469907531 TSecr=3233678868"
"155","4.324928264","10.0.0.7","10.0.0.3","TCP","66","5202  >  43300 [ACK] Seq=1 Ack=15966 Win=73216 Len=0 TSval=3469907531 TSecr=3233678868"
"156","4.325171679","10.0.0.7","10.0.0.3","TCP","66","5202  >  43324 [ACK] Seq=1 Ack=15966 Win=73216 Len=0 TSval=3469907531 TSecr=3233678868"
"157","4.325413079","10.0.0.7","10.0.0.3","TCP","66","5202  >  43288 [ACK] Seq=1 Ack=15966 Win=73216 Len=0 TSval=3469907531 TSecr=3233678868"
"158","4.325656081","10.0.0.7","10.0.0.3","TCP","66","5202  >  43312 [ACK] Seq=1 Ack=15966 Win=73216 Len=0 TSval=3469907532 TSecr=3233678868"
"159","4.325898598","10.0.0.7","10.0.0.3","TCP","66","5202  >  43326 [ACK] Seq=1 Ack=15966 Win=73216 Len=0 TSval=3469907532 TSecr=3233678868"
"160","4.326139356","10.0.0.7","10.0.0.3","TCP","66","5202  >  43296 [ACK] Seq=1 Ack=15966 Win=73216 Len=0 TSval=3469907532 TSecr=3233678868"
"161","4.326381854","10.0.0.7","10.0.0.3","TCP","66","5202  >  43248 [ACK] Seq=1 Ack=36238 Win=93696 Len=0 TSval=3469907532 TSecr=3233678868"
"162","4.326385108","10.0.0.3","10.0.0.7","TCP","15994","43248  >  5202 [PSH, ACK] Seq=63750 Ack=1 Win=42496 Len=15928 TSval=3233678896 TSecr=3469907532"
"163","4.328320298","10.0.0.7","10.0.0.3","TCP","66","5202  >  43262 [ACK] Seq=1 Ack=36238 Win=69120 Len=0 TSval=3469907534 TSecr=3233678869"
"164","4.328325865","10.0.0.3","10.0.0.7","TCP","21786","43262  >  5202 [PSH, ACK] Seq=57958 Ack=1 Win=42496 Len=21720 TSval=3233678898 TSecr=3469907534"
"165","4.330257454","10.0.0.7","10.0.0.3","TCP","66","5202  >  43248 [ACK] Seq=1 Ack=55062 Win=131584 Len=0 TSval=3469907536 TSecr=3233678871"
"166","4.330265612","10.0.0.3","10.0.0.7","TCP","27578","43248  >  5202 [PSH, ACK] Seq=79678 Ack=1 Win=42496 Len=27512 TSval=3233678900 TSecr=3469907536"
"167","4.333408748","10.0.0.7","10.0.0.3","TCP","66","5202  >  43248 [ACK] Seq=1 Ack=57958 Win=137216 Len=0 TSval=3469907539 TSecr=3233678871"
"168","4.333652642","10.0.0.3","10.0.0.7","TCP","66","43242  >  5202 [ACK] Seq=214 Ack=5 Win=42496 Len=0 TSval=3233678904 TSecr=3469907499"
"169","4.333891192","10.0.0.7","10.0.0.3","TCP","66","5202  >  43288 [ACK] Seq=1 Ack=26102 Win=68096 Len=0 TSval=3469907540 TSecr=3233678872"
"170","4.333895661","10.0.0.3","10.0.0.7","TCP","10202","43288  >  5202 [PSH, ACK] Seq=36238 Ack=1 Win=42496 Len=10136 TSval=3233678904 TSecr=3469907540"
"171","4.333897632","10.0.0.3","10.0.0.7","TCP","11650","43288  >  5202 [PSH, ACK] Seq=46374 Ack=1 Win=42496 Len=11584 TSval=3233678904 TSecr=3469907540"
"172","4.335586903","10.0.0.7","10.0.0.3","TCP","66","5202  >  43276 [ACK] Seq=1 Ack=43478 Win=108032 Len=0 TSval=3469907541 TSecr=3233678873"
"173","4.335592834","10.0.0.3","10.0.0.7","TCP","21786","43276  >  5202 [PSH, ACK] Seq=79678 Ack=1 Win=42496 Len=21720 TSval=3233678905 TSecr=3469907541"
"174","4.336797828","10.0.0.7","10.0.0.3","TCP","66","5202  >  43296 [ACK] Seq=1 Ack=26102 Win=68096 Len=0 TSval=3469907543 TSecr=3233678873"
"175","4.336800992","10.0.0.3","10.0.0.7","TCP","10202","43296  >  5202 [PSH, ACK] Seq=36238 Ack=1 Win=42496 Len=10136 TSval=3233678907 TSecr=3469907543"
"176","4.336802766","10.0.0.3","10.0.0.7","TCP","11650","43296  >  5202 [PSH, ACK] Seq=46374 Ack=1 Win=42496 Len=11584 TSval=3233678907 TSecr=3469907543"
"177","4.338493420","10.0.0.7","10.0.0.3","TCP","66","5202  >  43288 [ACK] Seq=1 Ack=36238 Win=68096 Len=0 TSval=3469907544 TSecr=3233678875"
"178","4.338498585","10.0.0.3","10.0.0.7","TCP","21786","43288  >  5202 [PSH, ACK] Seq=57958 Ack=1 Win=42496 Len=21720 TSval=3233678908 TSecr=3469907544"
"179","4.340189244","10.0.0.7","10.0.0.3","TCP","66","5202  >  43262 [ACK] Seq=1 Ack=43478 Win=73216 Len=0 TSval=3469907546 TSecr=3233678876"
"180","4.340193827","10.0.0.3","10.0.0.7","TCP","21786","43262  >  5202 [PSH, ACK] Seq=79678 Ack=1 Win=42496 Len=21720 TSval=3233678910 TSecr=3469907546"
"181","4.341400354","10.0.0.7","10.0.0.3","TCP","66","5202  >  43296 [ACK] Seq=1 Ack=36238 Win=93696 Len=0 TSval=3469907547 TSecr=3233678876"
"182","4.341405381","10.0.0.3","10.0.0.7","TCP","21786","43296  >  5202 [PSH, ACK] Seq=57958 Ack=1 Win=42496 Len=21720 TSval=3233678911 TSecr=3469907547"
"183","4.343095951","10.0.0.7","10.0.0.3","TCP","66","5202  >  43248 [ACK] Seq=1 Ack=63750 Win=148480 Len=0 TSval=3469907549 TSecr=3233678877"
"184","4.343101080","10.0.0.3","10.0.0.7","TCP","23234","43248  >  5202 [PSH, ACK] Seq=107190 Ack=1 Win=42496 Len=23168 TSval=3233678913 TSecr=3469907549"
"185","4.344078955","10.0.0.7","10.0.0.3","TCP","66","5202  >  43300 [ACK] Seq=1 Ack=26102 Win=68096 Len=0 TSval=3469907550 TSecr=3233678877"
"186","4.344083171","10.0.0.3","10.0.0.7","TCP","10202","43300  >  5202 [PSH, ACK] Seq=36238 Ack=1 Win=42496 Len=10136 TSval=3233678914 TSecr=3469907550"
"187","4.344085311","10.0.0.3","10.0.0.7","TCP","11650","43300  >  5202 [PSH, ACK] Seq=46374 Ack=1 Win=42496 Len=11584 TSval=3233678914 TSecr=3469907550"
"188","4.345807422","10.0.0.7","10.0.0.3","TCP","66","5202  >  43300 [ACK] Seq=1 Ack=36238 Win=93696 Len=0 TSval=3469907552 TSecr=3233678878"
"189","4.345814212","10.0.0.3","10.0.0.7","TCP","21786","43300  >  5202 [PSH, ACK] Seq=57958 Ack=1 Win=42496 Len=21720 TSval=3233678916 TSecr=3469907552"
"190","4.347500371","10.0.0.7","10.0.0.3","TCP","66","5202  >  43324 [ACK] Seq=1 Ack=26102 Win=68096 Len=0 TSval=3469907553 TSecr=3233678880"
"191","4.347506897","10.0.0.3","10.0.0.7","TCP","10202","43324  >  5202 [PSH, ACK] Seq=36238 Ack=1 Win=42496 Len=10136 TSval=3233678917 TSecr=3469907553"
"192","4.347508593","10.0.0.3","10.0.0.7","TCP","11650","43324  >  5202 [PSH, ACK] Seq=46374 Ack=1 Win=42496 Len=11584 TSval=3233678917 TSecr=3469907553"
"193","4.349192210","10.0.0.7","10.0.0.3","TCP","66","5202  >  43324 [ACK] Seq=1 Ack=36238 Win=93696 Len=0 TSval=3469907555 TSecr=3233678881"
"194","4.349200998","10.0.0.3","10.0.0.7","TCP","21786","43324  >  5202 [PSH, ACK] Seq=57958 Ack=1 Win=42496 Len=21720 TSval=3233678919 TSecr=3469907555"
"195","4.350901332","10.0.0.7","10.0.0.3","TCP","66","5202  >  43312 [ACK] Seq=1 Ack=26102 Win=68096 Len=0 TSval=3469907557 TSecr=3233678882"
"196","4.350909582","10.0.0.3","10.0.0.7","TCP","10202","43312  >  5202 [PSH, ACK] Seq=36238 Ack=1 Win=42496 Len=10136 TSval=3233678921 TSecr=3469907557"
"197","4.350912200","10.0.0.3","10.0.0.7","TCP","11650","43312  >  5202 [PSH, ACK] Seq=46374 Ack=1 Win=42496 Len=11584 TSval=3233678921 TSecr=3469907557"
"198","4.352617686","10.0.0.7","10.0.0.3","TCP","66","5202  >  43312 [ACK] Seq=1 Ack=36238 Win=93696 Len=0 TSval=3469907558 TSecr=3233678883"
"199","4.352636074","10.0.0.3","10.0.0.7","TCP","21786","43312  >  5202 [PSH, ACK] Seq=57958 Ack=1 Win=42496 Len=21720 TSval=3233678922 TSecr=3469907558"
"200","4.354304896","10.0.0.7","10.0.0.3","TCP","66","5202  >  43334 [ACK] Seq=1 Ack=26102 Win=68096 Len=0 TSval=3469907560 TSecr=3233678884"
"201","4.354317335","10.0.0.3","10.0.0.7","TCP","10202","43334  >  5202 [PSH, ACK] Seq=36238 Ack=1 Win=42496 Len=10136 TSval=3233678924 TSecr=3469907560"
"202","4.354319910","10.0.0.3","10.0.0.7","TCP","11650","43334  >  5202 [PSH, ACK] Seq=46374 Ack=1 Win=42496 Len=11584 TSval=3233678924 TSecr=3469907560"
"203","4.355986835","10.0.0.7","10.0.0.3","TCP","66","5202  >  43334 [ACK] Seq=1 Ack=36238 Win=58880 Len=0 TSval=3469907562 TSecr=3233678886"
"204","4.355997047","10.0.0.3","10.0.0.7","TCP","21786","43334  >  5202 [PSH, ACK] Seq=57958 Ack=1 Win=42496 Len=21720 TSval=3233678926 TSecr=3469907562"
"205","4.357684391","10.0.0.7","10.0.0.3","TCP","66","5202  >  43326 [ACK] Seq=1 Ack=26102 Win=68096 Len=0 TSval=3469907564 TSecr=3233678887"
"206","4.357692837","10.0.0.3","10.0.0.7","TCP","10202","43326  >  5202 [PSH, ACK] Seq=36238 Ack=1 Win=42496 Len=10136 TSval=3233678928 TSecr=3469907564"
"207","4.357695095","10.0.0.3","10.0.0.7","TCP","11650","43326  >  5202 [PSH, ACK] Seq=46374 Ack=1 Win=42496 Len=11584 TSval=3233678928 TSecr=3469907564"
"208","4.359375696","10.0.0.7","10.0.0.3","TCP","66","5202  >  43326 [ACK] Seq=1 Ack=36238 Win=93696 Len=0 TSval=3469907565 TSecr=3233678888"
"209","4.359384420","10.0.0.3","10.0.0.7","TCP","21786","43326  >  5202 [PSH, ACK] Seq=57958 Ack=1 Win=42496 Len=21720 TSval=3233678929 TSecr=3469907565"
"210","4.361070806","10.0.0.7","10.0.0.3","TCP","66","5202  >  43276 [ACK] Seq=1 Ack=57958 Win=137216 Len=0 TSval=3469907567 TSecr=3233678889"
"211","4.363511561","10.0.0.7","10.0.0.3","TCP","66","5202  >  43262 [ACK] Seq=1 Ack=57958 Win=66560 Len=0 TSval=3469907569 TSecr=3233678891"
"212","4.365941842","10.0.0.7","10.0.0.3","TCP","66","5202  >  43276 [ACK] Seq=1 Ack=79678 Win=152576 Len=0 TSval=3469907572 TSecr=3233678893"
"213","4.365955205","10.0.0.3","10.0.0.7","TCP","1514","43276  >  5202 [ACK] Seq=101398 Ack=1 Win=42496 Len=1448 TSval=3233678936 TSecr=3469907572"
"214","4.369573082","10.0.0.7","10.0.0.3","TCP","66","5202  >  43248 [ACK] Seq=1 Ack=79678 Win=157696 Len=0 TSval=3469907575 TSecr=3233678896"
"215","4.372216658","10.0.0.7","10.0.0.3","TCP","66","5202  >  43262 [ACK] Seq=1 Ack=79678 Win=59904 Len=0 TSval=3469907578 TSecr=3233678898"
"216","4.372224046","10.0.0.3","10.0.0.7","TCP","13098","43262  >  5202 [PSH, ACK] Seq=101398 Ack=1 Win=42496 Len=13032 TSval=3233678942 TSecr=3469907578"
"217","4.375848536","10.0.0.7","10.0.0.3","TCP","66","5202  >  43248 [ACK] Seq=1 Ack=107190 Win=147456 Len=0 TSval=3469907582 TSecr=3233678900"
"218","4.375851046","10.0.0.3","10.0.0.7","TCP","818","43248  >  5202 [PSH, ACK] Seq=130358 Ack=1 Win=42496 Len=752 TSval=3233678946 TSecr=3469907582"
"219","4.380462258","10.0.0.7","10.0.0.3","TCP","66","5202  >  43288 [ACK] Seq=1 Ack=46374 Win=68096 Len=0 TSval=3469907586 TSecr=3233678904"
"220","4.382157439","10.0.0.7","10.0.0.3","TCP","66","5202  >  43288 [ACK] Seq=1 Ack=57958 Win=96768 Len=0 TSval=3469907588 TSecr=3233678904"
"221","4.382161950","10.0.0.3","10.0.0.7","TCP","7306","43288  >  5202 [PSH, ACK] Seq=79678 Ack=1 Win=42496 Len=7240 TSval=3233678952 TSecr=3469907588"
"222","4.382165841","10.0.0.3","10.0.0.7","TCP","27578","43288  >  5202 [PSH, ACK] Seq=86918 Ack=1 Win=42496 Len=27512 TSval=3233678952 TSecr=3469907588"
"223","4.384095499","10.0.0.7","10.0.0.3","TCP","66","5202  >  43276 [ACK] Seq=1 Ack=101398 Win=152576 Len=0 TSval=3469907590 TSecr=3233678905"
"224","4.384100649","10.0.0.3","10.0.0.7","TCP","11650","43276  >  5202 [PSH, ACK] Seq=102846 Ack=1 Win=42496 Len=11584 TSval=3233678954 TSecr=3469907590"
"225","4.384105275","10.0.0.3","10.0.0.7","TCP","16746","43276  >  5202 [PSH, ACK] Seq=114430 Ack=1 Win=42496 Len=16680 TSval=3233678954 TSecr=3469907590"
"226","4.387730722","10.0.0.7","10.0.0.3","TCP","66","5202  >  43296 [ACK] Seq=1 Ack=46374 Win=114176 Len=0 TSval=3469907594 TSecr=3233678907"
"227","4.389423986","10.0.0.7","10.0.0.3","TCP","66","5202  >  43296 [ACK] Seq=1 Ack=57958 Win=137216 Len=0 TSval=3469907595 TSecr=3233678907"
"228","4.389428326","10.0.0.3","10.0.0.7","TCP","7306","43296  >  5202 [PSH, ACK] Seq=79678 Ack=1 Win=42496 Len=7240 TSval=3233678959 TSecr=3469907595"
"229","4.389433170","10.0.0.3","10.0.0.7","TCP","27578","43296  >  5202 [PSH, ACK] Seq=86918 Ack=1 Win=42496 Len=27512 TSval=3233678959 TSecr=3469907595"
"230","4.391364775","10.0.0.7","10.0.0.3","TCP","66","5202  >  43288 [ACK] Seq=1 Ack=79678 Win=139776 Len=0 TSval=3469907597 TSecr=3233678908"
"231","4.394995973","10.0.0.7","10.0.0.3","TCP","66","5202  >  43262 [ACK] Seq=1 Ack=101398 Win=59904 Len=0 TSval=3469907601 TSecr=3233678910"
"232","4.395001733","10.0.0.3","10.0.0.7","TCP","16746","43262  >  5202 [PSH, ACK] Seq=114430 Ack=1 Win=42496 Len=16680 TSval=3233678965 TSecr=3469907601"
"233","4.398608238","10.0.0.3","10.0.0.7","TCP","57986","43276  >  5202 [PSH, ACK] Seq=131110 Ack=1 Win=42496 Len=57920 TSval=3233678968 TSecr=3469907590"
"234","4.398656700","10.0.0.3","10.0.0.7","TCP","60882","43248  >  5202 [PSH, ACK] Seq=131110 Ack=1 Win=42496 Len=60816 TSval=3233678968 TSecr=3469907582"
"235","4.398635846","10.0.0.7","10.0.0.3","TCP","66","5202  >  43296 [ACK] Seq=1 Ack=79678 Win=174080 Len=0 TSval=3469907604 TSecr=3233678911"
"236","4.398669469","10.0.0.3","10.0.0.7","TCP","30258","[TCP Window Full] 43262  >  5202 [PSH, ACK] Seq=131110 Ack=1 Win=42496 Len=30192 TSval=3233678968 TSecr=3469907601"
"237","4.398690912","10.0.0.3","10.0.0.7","TCP","46402","43288  >  5202 [PSH, ACK] Seq=114430 Ack=1 Win=42496 Len=46336 TSval=3233678968 TSecr=3469907597"
"238","4.402263885","10.0.0.7","10.0.0.3","TCP","66","5202  >  43248 [ACK] Seq=1 Ack=130358 Win=151040 Len=0 TSval=3469907608 TSecr=3233678913"
"239","4.402275609","10.0.0.3","10.0.0.7","TCP","65226","43248  >  5202 [PSH, ACK] Seq=191926 Ack=1 Win=42496 Len=65160 TSval=3233678972 TSecr=3469907608"
"240","4.406143393","10.0.0.7","10.0.0.3","TCP","66","5202  >  43300 [ACK] Seq=1 Ack=46374 Win=114176 Len=0 TSval=3469907612 TSecr=3233678914"
"241","4.407835142","10.0.0.7","10.0.0.3","TCP","66","5202  >  43300 [ACK] Seq=1 Ack=57958 Win=137216 Len=0 TSval=3469907614 TSecr=3233678914"
"242","4.407838941","10.0.0.3","10.0.0.7","TCP","7306","43300  >  5202 [PSH, ACK] Seq=79678 Ack=1 Win=42496 Len=7240 TSval=3233678978 TSecr=3469907614"
"243","4.407843478","10.0.0.3","10.0.0.7","TCP","27578","43300  >  5202 [PSH, ACK] Seq=86918 Ack=1 Win=42496 Len=27512 TSval=3233678978 TSecr=3469907614"
"244","4.409802702","10.0.0.7","10.0.0.3","TCP","66","5202  >  43300 [ACK] Seq=1 Ack=79678 Win=174080 Len=0 TSval=3469907616 TSecr=3233678916"
"245","4.409809888","10.0.0.3","10.0.0.7","TCP","46402","43300  >  5202 [PSH, ACK] Seq=114430 Ack=1 Win=42496 Len=46336 TSval=3233678980 TSecr=3469907616"
"246","4.413438171","10.0.0.7","10.0.0.3","TCP","66","5202  >  43324 [ACK] Seq=1 Ack=46374 Win=114176 Len=0 TSval=3469907619 TSecr=3233678917"
"247","4.415130699","10.0.0.7","10.0.0.3","TCP","66","5202  >  43324 [ACK] Seq=1 Ack=57958 Win=137216 Len=0 TSval=3469907621 TSecr=3233678917"
"248","4.415136981","10.0.0.3","10.0.0.7","TCP","7306","43324  >  5202 [PSH, ACK] Seq=79678 Ack=1 Win=42496 Len=7240 TSval=3233678985 TSecr=3469907621"
"249","4.415140412","10.0.0.3","10.0.0.7","TCP","27578","43324  >  5202 [PSH, ACK] Seq=86918 Ack=1 Win=42496 Len=27512 TSval=3233678985 TSecr=3469907621"
"250","4.417067931","10.0.0.7","10.0.0.3","TCP","66","5202  >  43324 [ACK] Seq=1 Ack=79678 Win=174080 Len=0 TSval=3469907623 TSecr=3233678919"
"251","4.417077559","10.0.0.3","10.0.0.7","TCP","46402","43324  >  5202 [PSH, ACK] Seq=114430 Ack=1 Win=42496 Len=46336 TSval=3233678987 TSecr=3469907623"
"252","4.420701675","10.0.0.7","10.0.0.3","TCP","66","5202  >  43312 [ACK] Seq=1 Ack=46374 Win=114176 Len=0 TSval=3469907627 TSecr=3233678921"
"253","4.422396038","10.0.0.7","10.0.0.3","TCP","66","5202  >  43312 [ACK] Seq=1 Ack=57958 Win=137216 Len=0 TSval=3469907628 TSecr=3233678921"
"254","4.422399847","10.0.0.3","10.0.0.7","TCP","7306","43312  >  5202 [PSH, ACK] Seq=79678 Ack=1 Win=42496 Len=7240 TSval=3233678992 TSecr=3469907628"
"255","4.422404732","10.0.0.3","10.0.0.7","TCP","27578","43312  >  5202 [PSH, ACK] Seq=86918 Ack=1 Win=42496 Len=27512 TSval=3233678992 TSecr=3469907628"
"256","4.424334880","10.0.0.7","10.0.0.3","TCP","66","5202  >  43312 [ACK] Seq=1 Ack=79678 Win=174080 Len=0 TSval=3469907630 TSecr=3233678922"
"257","4.424344535","10.0.0.3","10.0.0.7","TCP","46402","43312  >  5202 [PSH, ACK] Seq=114430 Ack=1 Win=42496 Len=46336 TSval=3233678994 TSecr=3469907630"
"258","4.427968503","10.0.0.7","10.0.0.3","TCP","66","5202  >  43334 [ACK] Seq=1 Ack=46374 Win=93696 Len=0 TSval=3469907634 TSecr=3233678924"
"259","4.429665204","10.0.0.7","10.0.0.3","TCP","66","5202  >  43334 [ACK] Seq=1 Ack=57958 Win=116736 Len=0 TSval=3469907636 TSecr=3233678924"
"260","4.429670467","10.0.0.3","10.0.0.7","TCP","7306","43334  >  5202 [PSH, ACK] Seq=79678 Ack=1 Win=42496 Len=7240 TSval=3233679000 TSecr=3469907636"
"261","4.429675324","10.0.0.3","10.0.0.7","TCP","27578","43334  >  5202 [PSH, ACK] Seq=86918 Ack=1 Win=42496 Len=27512 TSval=3233679000 TSecr=3469907636"
"262","4.431603060","10.0.0.7","10.0.0.3","TCP","66","5202  >  43334 [ACK] Seq=1 Ack=79678 Win=160256 Len=0 TSval=3469907637 TSecr=3233678926"
"263","4.431611128","10.0.0.3","10.0.0.7","TCP","36266","43334  >  5202 [PSH, ACK] Seq=114430 Ack=1 Win=42496 Len=36200 TSval=3233679001 TSecr=3469907637"
"264","4.435237607","10.0.0.7","10.0.0.3","TCP","66","5202  >  43326 [ACK] Seq=1 Ack=46374 Win=114176 Len=0 TSval=3469907641 TSecr=3233678928"
"265","4.436932341","10.0.0.7","10.0.0.3","TCP","66","5202  >  43326 [ACK] Seq=1 Ack=57958 Win=137216 Len=0 TSval=3469907643 TSecr=3233678928"
"266","4.436938005","10.0.0.3","10.0.0.7","TCP","7306","43326  >  5202 [PSH, ACK] Seq=79678 Ack=1 Win=42496 Len=7240 TSval=3233679007 TSecr=3469907643"
"267","4.436941834","10.0.0.3","10.0.0.7","TCP","27578","43326  >  5202 [PSH, ACK] Seq=86918 Ack=1 Win=42496 Len=27512 TSval=3233679007 TSecr=3469907643"
"268","4.438870089","10.0.0.7","10.0.0.3","TCP","66","5202  >  43326 [ACK] Seq=1 Ack=79678 Win=174080 Len=0 TSval=3469907645 TSecr=3233678929"
"269","4.438880027","10.0.0.3","10.0.0.7","TCP","46402","43326  >  5202 [PSH, ACK] Seq=114430 Ack=1 Win=42496 Len=46336 TSval=3233679009 TSecr=3469907645"
"270","4.442504914","10.0.0.7","10.0.0.3","TCP","66","5202  >  43276 [ACK] Seq=1 Ack=102846 Win=155136 Len=0 TSval=3469907648 TSecr=3233678936"
"271","4.442747031","10.0.0.7","10.0.0.3","TCP","66","5202  >  43262 [ACK] Seq=1 Ack=114430 Win=98816 Len=0 TSval=3469907649 TSecr=3233678942"
"272","4.442756321","10.0.0.3","10.0.0.7","TCP","36266","43262  >  5202 [PSH, ACK] Seq=161302 Ack=1 Win=42496 Len=36200 TSval=3233679013 TSecr=3469907649"
