"No.","Time","Source","Destination","Protocol","Length","Info"
"1","0.000000000","fe80::18df:41ff:fe28:184c","ff02::2","ICMPv6","70","Router Solicitation from 1a:df:41:28:18:4c"
"2","0.511281731","fe80::ec63:80ff:fe39:bc80","ff02::2","ICMPv6","70","Router Solicitation from ee:63:80:39:bc:80"
"3","1.022816742","fe80::f44e:e0ff:fe2a:2b69","ff02::2","ICMPv6","70","Router Solicitation from f6:4e:e0:2a:2b:69"
"4","1.024047573","fe80::d852:9fff:fec5:3b5d","ff02::2","ICMPv6","70","Router Solicitation from da:52:9f:c5:3b:5d"
"5","7.240783983","3a:ab:05:9c:cc:e3","Broadcast","ARP","42","Who has 10.0.0.7? Tell 10.0.0.2"
"6","7.240919489","f6:4e:e0:2a:2b:69","Broadcast","ARP","42","Who has 10.0.0.7? Tell 10.0.0.1"
"7","7.242192391","6a:a5:40:1c:ca:d1","3a:ab:05:9c:cc:e3","ARP","42","10.0.0.7 is at 6a:a5:40:1c:ca:d1"
"8","7.242210842","10.0.0.2","10.0.0.7","TCP","74","54644  >  5202 [SYN] Seq=0 Win=42340 Len=0 MSS=1460 SACK_PERM TSval=3125675305 TSecr=0 WS=512"
"9","7.243440062","10.0.0.7","10.0.0.2","TCP","74","5202  >  54644 [SYN, ACK] Seq=0 Ack=1 Win=43440 Len=0 MSS=1460 SACK_PERM TSval=2758125867 TSecr=3125675305 WS=512"
"10","7.243484820","10.0.0.2","10.0.0.7","TCP","66","54644  >  5202 [ACK] Seq=1 Ack=1 Win=42496 Len=0 TSval=3125675308 TSecr=2758125867"
"11","7.243583153","10.0.0.2","10.0.0.7","TCP","103","54644  >  5202 [PSH, ACK] Seq=1 Ack=1 Win=42496 Len=37 TSval=3125675308 TSecr=2758125867"
"12","7.243625527","10.0.0.7","10.0.0.2","TCP","66","5202  >  54644 [ACK] Seq=1 Ack=38 Win=43520 Len=0 TSval=2758125868 TSecr=3125675308"
"13","7.243739346","10.0.0.7","10.0.0.2","TCP","67","5202  >  54644 [PSH, ACK] Seq=1 Ack=38 Win=43520 Len=1 TSval=2758125868 TSecr=3125675308"
"14","7.243795717","10.0.0.2","10.0.0.7","TCP","66","54644  >  5202 [ACK] Seq=38 Ack=2 Win=42496 Len=0 TSval=3125675308 TSecr=2758125868"
"15","7.243956325","10.0.0.2","10.0.0.7","TCP","70","54644  >  5202 [PSH, ACK] Seq=38 Ack=2 Win=42496 Len=4 TSval=3125675309 TSecr=2758125868"
"16","7.243998380","10.0.0.2","10.0.0.7","TCP","232","54644  >  5202 [PSH, ACK] Seq=42 Ack=2 Win=42496 Len=166 TSval=3125675309 TSecr=2758125868"
"17","7.244025453","10.0.0.7","10.0.0.2","TCP","66","5202  >  54644 [ACK] Seq=2 Ack=208 Win=43520 Len=0 TSval=2758125869 TSecr=3125675309"
"18","7.244094252","10.0.0.7","10.0.0.2","TCP","67","5202  >  54644 [PSH, ACK] Seq=2 Ack=208 Win=43520 Len=1 TSval=2758125869 TSecr=3125675309"
"19","7.244150928","10.0.0.2","10.0.0.7","TCP","74","54658  >  5202 [SYN] Seq=0 Win=42340 Len=0 MSS=1460 SACK_PERM TSval=3125675309 TSecr=0 WS=512"
"20","7.244184716","10.0.0.7","10.0.0.2","TCP","74","5202  >  54658 [SYN, ACK] Seq=0 Ack=1 Win=43440 Len=0 MSS=1460 SACK_PERM TSval=2758125869 TSecr=3125675309 WS=512"
"21","7.244200355","10.0.0.2","10.0.0.7","TCP","66","54658  >  5202 [ACK] Seq=1 Ack=1 Win=42496 Len=0 TSval=3125675309 TSecr=2758125869"
"22","7.244288270","10.0.0.2","10.0.0.7","TCP","103","54658  >  5202 [PSH, ACK] Seq=1 Ack=1 Win=42496 Len=37 TSval=3125675309 TSecr=2758125869"
"23","7.244303416","10.0.0.7","10.0.0.2","TCP","66","5202  >  54658 [ACK] Seq=1 Ack=38 Win=43520 Len=0 TSval=2758125869 TSecr=3125675309"
"24","7.245319743","10.0.0.2","10.0.0.7","TCP","74","54662  >  5202 [SYN] Seq=0 Win=42340 Len=0 MSS=1460 SACK_PERM TSval=3125675310 TSecr=0 WS=512"
"25","7.245345537","10.0.0.7","10.0.0.2","TCP","74","5202  >  54662 [SYN, ACK] Seq=0 Ack=1 Win=43440 Len=0 MSS=1460 SACK_PERM TSval=2758125870 TSecr=3125675310 WS=512"
"26","7.245354387","10.0.0.2","10.0.0.7","TCP","66","54662  >  5202 [ACK] Seq=1 Ack=1 Win=42496 Len=0 TSval=3125675310 TSecr=2758125870"
"27","7.245372906","10.0.0.2","10.0.0.7","TCP","103","54662  >  5202 [PSH, ACK] Seq=1 Ack=1 Win=42496 Len=37 TSval=3125675310 TSecr=2758125870"
"28","7.245387608","10.0.0.7","10.0.0.2","TCP","66","5202  >  54662 [ACK] Seq=1 Ack=38 Win=43520 Len=0 TSval=2758125870 TSecr=3125675310"
"29","7.246332750","10.0.0.2","10.0.0.7","TCP","74","54674  >  5202 [SYN] Seq=0 Win=42340 Len=0 MSS=1460 SACK_PERM TSval=3125675311 TSecr=0 WS=512"
"30","7.246354155","10.0.0.7","10.0.0.2","TCP","74","5202  >  54674 [SYN, ACK] Seq=0 Ack=1 Win=43440 Len=0 MSS=1460 SACK_PERM TSval=2758125871 TSecr=3125675311 WS=512"
"31","7.246362033","10.0.0.2","10.0.0.7","TCP","66","54674  >  5202 [ACK] Seq=1 Ack=1 Win=42496 Len=0 TSval=3125675311 TSecr=2758125871"
"32","7.246380075","10.0.0.2","10.0.0.7","TCP","103","54674  >  5202 [PSH, ACK] Seq=1 Ack=1 Win=42496 Len=37 TSval=3125675311 TSecr=2758125871"
"33","7.246394312","10.0.0.7","10.0.0.2","TCP","66","5202  >  54674 [ACK] Seq=1 Ack=38 Win=43520 Len=0 TSval=2758125871 TSecr=3125675311"
"34","7.247350287","10.0.0.2","10.0.0.7","TCP","74","54690  >  5202 [SYN] Seq=0 Win=42340 Len=0 MSS=1460 SACK_PERM TSval=3125675312 TSecr=0 WS=512"
"35","7.247370920","10.0.0.7","10.0.0.2","TCP","74","5202  >  54690 [SYN, ACK] Seq=0 Ack=1 Win=43440 Len=0 MSS=1460 SACK_PERM TSval=2758125872 TSecr=3125675312 WS=512"
"36","7.247379002","10.0.0.2","10.0.0.7","TCP","66","54690  >  5202 [ACK] Seq=1 Ack=1 Win=42496 Len=0 TSval=3125675312 TSecr=2758125872"
"37","7.247397161","10.0.0.2","10.0.0.7","TCP","103","54690  >  5202 [PSH, ACK] Seq=1 Ack=1 Win=42496 Len=37 TSval=3125675312 TSecr=2758125872"
"38","7.247411348","10.0.0.7","10.0.0.2","TCP","66","5202  >  54690 [ACK] Seq=1 Ack=38 Win=43520 Len=0 TSval=2758125872 TSecr=3125675312"
"39","7.248359590","10.0.0.2","10.0.0.7","TCP","74","54704  >  5202 [SYN] Seq=0 Win=42340 Len=0 MSS=1460 SACK_PERM TSval=3125675313 TSecr=0 WS=512"
"40","7.248380341","10.0.0.7","10.0.0.2","TCP","74","5202  >  54704 [SYN, ACK] Seq=0 Ack=1 Win=43440 Len=0 MSS=1460 SACK_PERM TSval=2758125873 TSecr=3125675313 WS=512"
"41","7.248387704","10.0.0.2","10.0.0.7","TCP","66","54704  >  5202 [ACK] Seq=1 Ack=1 Win=42496 Len=0 TSval=3125675313 TSecr=2758125873"
"42","7.248406274","10.0.0.2","10.0.0.7","TCP","103","54704  >  5202 [PSH, ACK] Seq=1 Ack=1 Win=42496 Len=37 TSval=3125675313 TSecr=2758125873"
"43","7.248421577","10.0.0.7","10.0.0.2","TCP","66","5202  >  54704 [ACK] Seq=1 Ack=38 Win=43520 Len=0 TSval=2758125873 TSecr=3125675313"
"44","7.249358181","10.0.0.2","10.0.0.7","TCP","74","54716  >  5202 [SYN] Seq=0 Win=42340 Len=0 MSS=1460 SACK_PERM TSval=3125675314 TSecr=0 WS=512"
"45","7.249378138","10.0.0.7","10.0.0.2","TCP","74","5202  >  54716 [SYN, ACK] Seq=0 Ack=1 Win=43440 Len=0 MSS=1460 SACK_PERM TSval=2758125874 TSecr=3125675314 WS=512"
"46","7.249385452","10.0.0.2","10.0.0.7","TCP","66","54716  >  5202 [ACK] Seq=1 Ack=1 Win=42496 Len=0 TSval=3125675314 TSecr=2758125874"
"47","7.249402528","10.0.0.2","10.0.0.7","TCP","103","54716  >  5202 [PSH, ACK] Seq=1 Ack=1 Win=42496 Len=37 TSval=3125675314 TSecr=2758125874"
"48","7.249417975","10.0.0.7","10.0.0.2","TCP","66","5202  >  54716 [ACK] Seq=1 Ack=38 Win=43520 Len=0 TSval=2758125874 TSecr=3125675314"
"49","7.250365930","10.0.0.2","10.0.0.7","TCP","74","54718  >  5202 [SYN] Seq=0 Win=42340 Len=0 MSS=1460 SACK_PERM TSval=3125675315 TSecr=0 WS=512"
"50","7.250386617","10.0.0.7","10.0.0.2","TCP","74","5202  >  54718 [SYN, ACK] Seq=0 Ack=1 Win=43440 Len=0 MSS=1460 SACK_PERM TSval=2758125875 TSecr=3125675315 WS=512"
"51","7.250394349","10.0.0.2","10.0.0.7","TCP","66","54718  >  5202 [ACK] Seq=1 Ack=1 Win=42496 Len=0 TSval=3125675315 TSecr=2758125875"
"52","7.250410734","10.0.0.2","10.0.0.7","TCP","103","54718  >  5202 [PSH, ACK] Seq=1 Ack=1 Win=42496 Len=37 TSval=3125675315 TSecr=2758125875"
"53","7.250426022","10.0.0.7","10.0.0.2","TCP","66","5202  >  54718 [ACK] Seq=1 Ack=38 Win=43520 Len=0 TSval=2758125875 TSecr=3125675315"
"54","7.251373300","10.0.0.2","10.0.0.7","TCP","74","54726  >  5202 [SYN] Seq=0 Win=42340 Len=0 MSS=1460 SACK_PERM TSval=3125675316 TSecr=0 WS=512"
"55","7.251394061","10.0.0.7","10.0.0.2","TCP","74","5202  >  54726 [SYN, ACK] Seq=0 Ack=1 Win=43440 Len=0 MSS=1460 SACK_PERM TSval=2758125876 TSecr=3125675316 WS=512"
"56","7.251401278","10.0.0.2","10.0.0.7","TCP","66","54726  >  5202 [ACK] Seq=1 Ack=1 Win=42496 Len=0 TSval=3125675316 TSecr=2758125876"
"57","7.251417874","10.0.0.2","10.0.0.7","TCP","103","54726  >  5202 [PSH, ACK] Seq=1 Ack=1 Win=42496 Len=37 TSval=3125675316 TSecr=2758125876"
"58","7.251433170","10.0.0.7","10.0.0.2","TCP","66","5202  >  54726 [ACK] Seq=1 Ack=38 Win=43520 Len=0 TSval=2758125876 TSecr=3125675316"
"59","7.252364689","10.0.0.2","10.0.0.7","TCP","74","54742  >  5202 [SYN] Seq=0 Win=42340 Len=0 MSS=1460 SACK_PERM TSval=3125675317 TSecr=0 WS=512"
"60","7.252384853","10.0.0.7","10.0.0.2","TCP","74","5202  >  54742 [SYN, ACK] Seq=0 Ack=1 Win=43440 Len=0 MSS=1460 SACK_PERM TSval=2758125877 TSecr=3125675317 WS=512"
"61","7.252391849","10.0.0.2","10.0.0.7","TCP","66","54742  >  5202 [ACK] Seq=1 Ack=1 Win=42496 Len=0 TSval=3125675317 TSecr=2758125877"
"62","7.252408373","10.0.0.2","10.0.0.7","TCP","103","54742  >  5202 [PSH, ACK] Seq=1 Ack=1 Win=42496 Len=37 TSval=3125675317 TSecr=2758125877"
"63","7.252423573","10.0.0.7","10.0.0.2","TCP","66","5202  >  54742 [ACK] Seq=1 Ack=38 Win=43520 Len=0 TSval=2758125877 TSecr=3125675317"
"64","7.253358942","10.0.0.2","10.0.0.7","TCP","74","54750  >  5202 [SYN] Seq=0 Win=42340 Len=0 MSS=1460 SACK_PERM TSval=3125675318 TSecr=0 WS=512"
"65","7.253379208","10.0.0.7","10.0.0.2","TCP","74","5202  >  54750 [SYN, ACK] Seq=0 Ack=1 Win=43440 Len=0 MSS=1460 SACK_PERM TSval=2758125878 TSecr=3125675318 WS=512"
"66","7.253386458","10.0.0.2","10.0.0.7","TCP","66","54750  >  5202 [ACK] Seq=1 Ack=1 Win=42496 Len=0 TSval=3125675318 TSecr=2758125878"
"67","7.253403690","10.0.0.2","10.0.0.7","TCP","103","54750  >  5202 [PSH, ACK] Seq=1 Ack=1 Win=42496 Len=37 TSval=3125675318 TSecr=2758125878"
"68","7.253418928","10.0.0.7","10.0.0.2","TCP","66","5202  >  54750 [ACK] Seq=1 Ack=38 Win=43520 Len=0 TSval=2758125878 TSecr=3125675318"
"69","7.254380147","10.0.0.7","10.0.0.2","TCP","67","5202  >  54644 [PSH, ACK] Seq=3 Ack=208 Win=43520 Len=1 TSval=2758125879 TSecr=3125675309"
"70","7.254414966","10.0.0.7","10.0.0.2","TCP","67","5202  >  54644 [PSH, ACK] Seq=4 Ack=208 Win=43520 Len=1 TSval=2758125879 TSecr=3125675309"
"71","7.254507553","10.0.0.2","10.0.0.7","TCP","66","54644  >  5202 [ACK] Seq=208 Ack=5 Win=42496 Len=0 TSval=3125675319 TSecr=2758125869"
"72","7.254755657","10.0.0.2","10.0.0.7","TCP","7306","54658  >  5202 [PSH, ACK] Seq=38 Ack=1 Win=42496 Len=7240 TSval=3125675319 TSecr=2758125869"
"73","7.254762692","10.0.0.2","10.0.0.7","TCP","7306","54662  >  5202 [PSH, ACK] Seq=38 Ack=1 Win=42496 Len=7240 TSval=3125675319 TSecr=2758125870"
"74","7.254777165","10.0.0.2","10.0.0.7","TCP","7306","54662  >  5202 [PSH, ACK] Seq=7278 Ack=1 Win=42496 Len=7240 TSval=3125675319 TSecr=2758125870"
"75","7.254778432","10.0.0.2","10.0.0.7","TCP","7306","54658  >  5202 [PSH, ACK] Seq=7278 Ack=1 Win=42496 Len=7240 TSval=3125675319 TSecr=2758125869"
"76","7.254877588","10.0.0.2","10.0.0.7","TCP","7306","54674  >  5202 [PSH, ACK] Seq=38 Ack=1 Win=42496 Len=7240 TSval=3125675319 TSecr=2758125871"
"77","7.254893952","10.0.0.2","10.0.0.7","TCP","7306","54674  >  5202 [PSH, ACK] Seq=7278 Ack=1 Win=42496 Len=7240 TSval=3125675319 TSecr=2758125871"
"78","7.254920809","10.0.0.2","10.0.0.7","TCP","7306","54690  >  5202 [PSH, ACK] Seq=38 Ack=1 Win=42496 Len=7240 TSval=3125675320 TSecr=2758125872"
"79","7.254936127","10.0.0.2","10.0.0.7","TCP","7306","54690  >  5202 [PSH, ACK] Seq=7278 Ack=1 Win=42496 Len=7240 TSval=3125675320 TSecr=2758125872"
"80","7.255033187","10.0.0.2","10.0.0.7","TCP","7306","54704  >  5202 [PSH, ACK] Seq=38 Ack=1 Win=42496 Len=7240 TSval=3125675320 TSecr=2758125873"
"81","7.255054695","10.0.0.2","10.0.0.7","TCP","7306","54704  >  5202 [PSH, ACK] Seq=7278 Ack=1 Win=42496 Len=7240 TSval=3125675320 TSecr=2758125873"
"82","7.255066804","10.0.0.2","10.0.0.7","TCP","7306","54716  >  5202 [PSH, ACK] Seq=38 Ack=1 Win=42496 Len=7240 TSval=3125675320 TSecr=2758125874"
"83","7.255079362","10.0.0.2","10.0.0.7","TCP","7306","54716  >  5202 [PSH, ACK] Seq=7278 Ack=1 Win=42496 Len=7240 TSval=3125675320 TSecr=2758125874"
"84","7.255118613","10.0.0.2","10.0.0.7","TCP","7306","54718  >  5202 [PSH, ACK] Seq=38 Ack=1 Win=42496 Len=7240 TSval=3125675320 TSecr=2758125875"
"85","7.255133023","10.0.0.2","10.0.0.7","TCP","7306","54718  >  5202 [PSH, ACK] Seq=7278 Ack=1 Win=42496 Len=7240 TSval=3125675320 TSecr=2758125875"
"86","7.255214281","10.0.0.2","10.0.0.7","TCP","7306","54726  >  5202 [PSH, ACK] Seq=38 Ack=1 Win=42496 Len=7240 TSval=3125675320 TSecr=2758125876"
"87","7.255223653","10.0.0.2","10.0.0.7","TCP","7306","54726  >  5202 [PSH, ACK] Seq=7278 Ack=1 Win=42496 Len=7240 TSval=3125675320 TSecr=2758125876"
"88","7.255332951","10.0.0.2","10.0.0.7","TCP","7306","54742  >  5202 [PSH, ACK] Seq=38 Ack=1 Win=42496 Len=7240 TSval=3125675320 TSecr=2758125877"
"89","7.255348184","10.0.0.2","10.0.0.7","TCP","7306","54750  >  5202 [PSH, ACK] Seq=38 Ack=1 Win=42496 Len=7240 TSval=3125675320 TSecr=2758125878"
"90","7.255355045","10.0.0.2","10.0.0.7","TCP","7306","54742  >  5202 [PSH, ACK] Seq=7278 Ack=1 Win=42496 Len=7240 TSval=3125675320 TSecr=2758125877"
"91","7.255357701","10.0.0.2","10.0.0.7","TCP","7306","54750  >  5202 [PSH, ACK] Seq=7278 Ack=1 Win=42496 Len=7240 TSval=3125675320 TSecr=2758125878"
"92","7.257918721","10.0.0.2","10.0.0.7","TCP","1514","54662  >  5202 [ACK] Seq=14518 Ack=1 Win=42496 Len=1448 TSval=3125675323 TSecr=2758125870"
"93","7.257971812","10.0.0.2","10.0.0.7","TCP","1514","54658  >  5202 [ACK] Seq=14518 Ack=1 Win=42496 Len=1448 TSval=3125675323 TSecr=2758125869"
"94","7.258916816","10.0.0.2","10.0.0.7","TCP","1514","54718  >  5202 [ACK] Seq=14518 Ack=1 Win=42496 Len=1448 TSval=3125675324 TSecr=2758125875"
"95","7.258919350","10.0.0.2","10.0.0.7","TCP","1514","54750  >  5202 [ACK] Seq=14518 Ack=1 Win=42496 Len=1448 TSval=3125675324 TSecr=2758125878"
"96","7.258920156","10.0.0.2","10.0.0.7","TCP","1514","54690  >  5202 [ACK] Seq=14518 Ack=1 Win=42496 Len=1448 TSval=3125675324 TSecr=2758125872"
"97","7.258922204","10.0.0.2","10.0.0.7","TCP","1514","54726  >  5202 [ACK] Seq=14518 Ack=1 Win=42496 Len=1448 TSval=3125675324 TSecr=2758125876"
"98","7.258927173","10.0.0.2","10.0.0.7","TCP","1514","54716  >  5202 [ACK] Seq=14518 Ack=1 Win=42496 Len=1448 TSval=3125675324 TSecr=2758125874"
"99","7.258948358","10.0.0.2","10.0.0.7","TCP","1514","54704  >  5202 [ACK] Seq=14518 Ack=1 Win=42496 Len=1448 TSval=3125675324 TSecr=2758125873"
"100","7.258949299","10.0.0.2","10.0.0.7","TCP","1514","54674  >  5202 [ACK] Seq=14518 Ack=1 Win=42496 Len=1448 TSval=3125675324 TSecr=2758125871"
"101","7.258974702","10.0.0.2","10.0.0.7","TCP","1514","54742  >  5202 [ACK] Seq=14518 Ack=1 Win=42496 Len=1448 TSval=3125675324 TSecr=2758125877"
"102","7.263187070","10.0.0.7","10.0.0.2","TCP","66","5202  >  54658 [ACK] Seq=1 Ack=7278 Win=56832 Len=0 TSval=2758125888 TSecr=3125675319"
"103","7.263205247","10.0.0.2","10.0.0.7","TCP","10202","54658  >  5202 [PSH, ACK] Seq=15966 Ack=1 Win=42496 Len=10136 TSval=3125675328 TSecr=2758125888"
"104","7.265613373","10.0.0.7","10.0.0.2","TCP","66","5202  >  54662 [ACK] Seq=1 Ack=7278 Win=56832 Len=0 TSval=2758125890 TSecr=3125675319"
"105","7.265628241","10.0.0.2","10.0.0.7","TCP","10202","54662  >  5202 [PSH, ACK] Seq=15966 Ack=1 Win=42496 Len=10136 TSval=3125675330 TSecr=2758125890"
"106","7.266815392","10.0.0.7","10.0.0.2","TCP","66","5202  >  54662 [ACK] Seq=1 Ack=14518 Win=70656 Len=0 TSval=2758125891 TSecr=3125675319"
"107","7.266832463","10.0.0.2","10.0.0.7","TCP","10202","54662  >  5202 [PSH, ACK] Seq=26102 Ack=1 Win=42496 Len=10136 TSval=3125675331 TSecr=2758125891"
"108","7.268026556","10.0.0.7","10.0.0.2","TCP","66","5202  >  54658 [ACK] Seq=1 Ack=14518 Win=70656 Len=0 TSval=2758125893 TSecr=3125675319"
"109","7.268039101","10.0.0.2","10.0.0.7","TCP","10202","54658  >  5202 [PSH, ACK] Seq=26102 Ack=1 Win=42496 Len=10136 TSval=3125675333 TSecr=2758125893"
"110","7.270446109","10.0.0.7","10.0.0.2","TCP","66","5202  >  54674 [ACK] Seq=1 Ack=7278 Win=56832 Len=0 TSval=2758125895 TSecr=3125675319"
"111","7.270455729","10.0.0.2","10.0.0.7","TCP","10202","54674  >  5202 [PSH, ACK] Seq=15966 Ack=1 Win=42496 Len=10136 TSval=3125675335 TSecr=2758125895"
"112","7.271655396","10.0.0.7","10.0.0.2","TCP","66","5202  >  54674 [ACK] Seq=1 Ack=14518 Win=70656 Len=0 TSval=2758125896 TSecr=3125675319"
"113","7.271663116","10.0.0.2","10.0.0.7","TCP","10202","54674  >  5202 [PSH, ACK] Seq=26102 Ack=1 Win=42496 Len=10136 TSval=3125675336 TSecr=2758125896"
"114","7.274080918","10.0.0.7","10.0.0.2","TCP","66","5202  >  54690 [ACK] Seq=1 Ack=7278 Win=56832 Len=0 TSval=2758125899 TSecr=3125675320"
"115","7.274090526","10.0.0.2","10.0.0.7","TCP","10202","54690  >  5202 [PSH, ACK] Seq=15966 Ack=1 Win=42496 Len=10136 TSval=3125675339 TSecr=2758125899"
"116","7.276518364","10.0.0.7","10.0.0.2","TCP","66","5202  >  54690 [ACK] Seq=1 Ack=14518 Win=70656 Len=0 TSval=2758125901 TSecr=3125675320"
"117","7.276547685","10.0.0.2","10.0.0.7","TCP","10202","54690  >  5202 [PSH, ACK] Seq=26102 Ack=1 Win=42496 Len=10136 TSval=3125675341 TSecr=2758125901"
"118","7.280146266","10.0.0.7","10.0.0.2","TCP","66","5202  >  54704 [ACK] Seq=1 Ack=7278 Win=56832 Len=0 TSval=2758125905 TSecr=3125675320"
"119","7.280170819","10.0.0.2","10.0.0.7","TCP","10202","54704  >  5202 [PSH, ACK] Seq=15966 Ack=1 Win=42496 Len=10136 TSval=3125675345 TSecr=2758125905"
"120","7.281368860","10.0.0.7","10.0.0.2","TCP","66","5202  >  54704 [ACK] Seq=1 Ack=14518 Win=70656 Len=0 TSval=2758125906 TSecr=3125675320"
"121","7.281391499","10.0.0.2","10.0.0.7","TCP","10202","54704  >  5202 [PSH, ACK] Seq=26102 Ack=1 Win=42496 Len=10136 TSval=3125675346 TSecr=2758125906"
"122","7.282605100","10.0.0.7","10.0.0.2","TCP","66","5202  >  54716 [ACK] Seq=1 Ack=7278 Win=56832 Len=0 TSval=2758125907 TSecr=3125675320"
"123","7.282630894","10.0.0.2","10.0.0.7","TCP","10202","54716  >  5202 [PSH, ACK] Seq=15966 Ack=1 Win=42496 Len=10136 TSval=3125675347 TSecr=2758125907"
"124","7.283817216","10.0.0.7","10.0.0.2","TCP","66","5202  >  54716 [ACK] Seq=1 Ack=14518 Win=64000 Len=0 TSval=2758125908 TSecr=3125675320"
"125","7.283856379","10.0.0.2","10.0.0.7","TCP","10202","54716  >  5202 [PSH, ACK] Seq=26102 Ack=1 Win=42496 Len=10136 TSval=3125675348 TSecr=2758125908"
"126","7.285005536","10.0.0.7","10.0.0.2","TCP","66","5202  >  54718 [ACK] Seq=1 Ack=7278 Win=56832 Len=0 TSval=2758125910 TSecr=3125675320"
"127","7.285031269","10.0.0.2","10.0.0.7","TCP","10202","54718  >  5202 [PSH, ACK] Seq=15966 Ack=1 Win=42496 Len=10136 TSval=3125675350 TSecr=2758125910"
"128","7.286207586","10.0.0.7","10.0.0.2","TCP","66","5202  >  54718 [ACK] Seq=1 Ack=14518 Win=70656 Len=0 TSval=2758125911 TSecr=3125675320"
"129","7.286227401","10.0.0.2","10.0.0.7","TCP","10202","54718  >  5202 [PSH, ACK] Seq=26102 Ack=1 Win=42496 Len=10136 TSval=3125675351 TSecr=2758125911"
"130","7.289841567","10.0.0.7","10.0.0.2","TCP","66","5202  >  54726 [ACK] Seq=1 Ack=7278 Win=56832 Len=0 TSval=2758125914 TSecr=3125675320"
"131","7.289857265","10.0.0.2","10.0.0.7","TCP","10202","54726  >  5202 [PSH, ACK] Seq=15966 Ack=1 Win=42496 Len=10136 TSval=3125675354 TSecr=2758125914"
"132","7.291046034","10.0.0.7","10.0.0.2","TCP","66","5202  >  54726 [ACK] Seq=1 Ack=14518 Win=64000 Len=0 TSval=2758125916 TSecr=3125675320"
"133","7.291065250","10.0.0.2","10.0.0.7","TCP","10202","54726  >  5202 [PSH, ACK] Seq=26102 Ack=1 Win=42496 Len=10136 TSval=3125675356 TSecr=2758125916"
"134","7.297107403","10.0.0.7","10.0.0.2","TCP","66","5202  >  54742 [ACK] Seq=1 Ack=7278 Win=56832 Len=0 TSval=2758125922 TSecr=3125675320"
"135","7.297122127","10.0.0.2","10.0.0.7","TCP","10202","54742  >  5202 [PSH, ACK] Seq=15966 Ack=1 Win=42496 Len=10136 TSval=3125675362 TSecr=2758125922"
"136","7.298317234","10.0.0.7","10.0.0.2","TCP","66","5202  >  54750 [ACK] Seq=1 Ack=7278 Win=56832 Len=0 TSval=2758125923 TSecr=3125675320"
"137","7.298332598","10.0.0.2","10.0.0.7","TCP","10202","54750  >  5202 [PSH, ACK] Seq=15966 Ack=1 Win=42496 Len=10136 TSval=3125675363 TSecr=2758125923"
"138","7.299523843","10.0.0.7","10.0.0.2","TCP","66","5202  >  54742 [ACK] Seq=1 Ack=14518 Win=64000 Len=0 TSval=2758125924 TSecr=3125675320"
"139","7.299544105","10.0.0.2","10.0.0.7","TCP","10202","54742  >  5202 [PSH, ACK] Seq=26102 Ack=1 Win=42496 Len=10136 TSval=3125675364 TSecr=2758125924"
"140","7.300739116","10.0.0.7","10.0.0.2","TCP","66","5202  >  54750 [ACK] Seq=1 Ack=14518 Win=70656 Len=0 TSval=2758125925 TSecr=3125675320"
"141","7.300757275","10.0.0.2","10.0.0.7","TCP","10202","54750  >  5202 [PSH, ACK] Seq=26102 Ack=1 Win=42496 Len=10136 TSval=3125675365 TSecr=2758125925"
"142","7.309946018","10.0.0.7","10.0.0.2","TCP","66","5202  >  54662 [ACK] Seq=1 Ack=15966 Win=73216 Len=0 TSval=2758125935 TSecr=3125675323"
"143","7.310668208","10.0.0.7","10.0.0.2","TCP","66","5202  >  54658 [ACK] Seq=1 Ack=15966 Win=73216 Len=0 TSval=2758125935 TSecr=3125675323"
"144","7.310920176","10.0.0.7","10.0.0.2","TCP","66","5202  >  54718 [ACK] Seq=1 Ack=15966 Win=73216 Len=0 TSval=2758125935 TSecr=3125675324"
"145","7.311156327","10.0.0.7","10.0.0.2","TCP","66","5202  >  54750 [ACK] Seq=1 Ack=15966 Win=73216 Len=0 TSval=2758125936 TSecr=3125675324"
"146","7.311400334","10.0.0.7","10.0.0.2","TCP","66","5202  >  54690 [ACK] Seq=1 Ack=15966 Win=73216 Len=0 TSval=2758125936 TSecr=3125675324"
"147","7.312848361","10.0.0.7","10.0.0.2","TCP","66","5202  >  54726 [ACK] Seq=1 Ack=15966 Win=67072 Len=0 TSval=2758125937 TSecr=3125675324"
"148","7.313332724","10.0.0.7","10.0.0.2","TCP","66","5202  >  54716 [ACK] Seq=1 Ack=15966 Win=67072 Len=0 TSval=2758125938 TSecr=3125675324"
"149","7.313818397","10.0.0.7","10.0.0.2","TCP","66","5202  >  54674 [ACK] Seq=1 Ack=15966 Win=73216 Len=0 TSval=2758125938 TSecr=3125675324"
"150","7.314060973","10.0.0.7","10.0.0.2","TCP","66","5202  >  54704 [ACK] Seq=1 Ack=15966 Win=73216 Len=0 TSval=2758125939 TSecr=3125675324"
"151","7.314791300","10.0.0.7","10.0.0.2","TCP","66","5202  >  54742 [ACK] Seq=1 Ack=15966 Win=67072 Len=0 TSval=2758125939 TSecr=3125675324"
"152","7.322538847","10.0.0.7","10.0.0.2","TCP","66","5202  >  54658 [ACK] Seq=1 Ack=26102 Win=68096 Len=0 TSval=2758125947 TSecr=3125675328"
"153","7.322553143","10.0.0.2","10.0.0.7","TCP","10202","54658  >  5202 [PSH, ACK] Seq=36238 Ack=1 Win=42496 Len=10136 TSval=3125675387 TSecr=2758125947"
"154","7.322557624","10.0.0.2","10.0.0.7","TCP","11650","54658  >  5202 [PSH, ACK] Seq=46374 Ack=1 Win=42496 Len=11584 TSval=3125675387 TSecr=2758125947"
"155","7.325933234","10.0.0.7","10.0.0.2","TCP","66","5202  >  54662 [ACK] Seq=1 Ack=26102 Win=68096 Len=0 TSval=2758125951 TSecr=3125675330"
"156","7.325947956","10.0.0.2","10.0.0.7","TCP","10202","54662  >  5202 [PSH, ACK] Seq=36238 Ack=1 Win=42496 Len=10136 TSval=3125675391 TSecr=2758125951"
"157","7.325952578","10.0.0.2","10.0.0.7","TCP","11650","54662  >  5202 [PSH, ACK] Seq=46374 Ack=1 Win=42496 Len=11584 TSval=3125675391 TSecr=2758125951"
"158","7.327629424","10.0.0.7","10.0.0.2","TCP","66","5202  >  54662 [ACK] Seq=1 Ack=36238 Win=93696 Len=0 TSval=2758125952 TSecr=3125675331"
"159","7.327643859","10.0.0.2","10.0.0.7","TCP","21786","54662  >  5202 [PSH, ACK] Seq=57958 Ack=1 Win=42496 Len=21720 TSval=3125675392 TSecr=2758125952"
"160","7.329319402","10.0.0.7","10.0.0.2","TCP","66","5202  >  54658 [ACK] Seq=1 Ack=36238 Win=93696 Len=0 TSval=2758125954 TSecr=3125675333"
"161","7.329334790","10.0.0.2","10.0.0.7","TCP","21786","54658  >  5202 [PSH, ACK] Seq=57958 Ack=1 Win=42496 Len=21720 TSval=3125675394 TSecr=2758125954"
"162","7.332712730","10.0.0.7","10.0.0.2","TCP","66","5202  >  54674 [ACK] Seq=1 Ack=26102 Win=68096 Len=0 TSval=2758125957 TSecr=3125675335"
"163","7.332726160","10.0.0.2","10.0.0.7","TCP","10202","54674  >  5202 [PSH, ACK] Seq=36238 Ack=1 Win=42496 Len=10136 TSval=3125675397 TSecr=2758125957"
"164","7.332730247","10.0.0.2","10.0.0.7","TCP","11650","54674  >  5202 [PSH, ACK] Seq=46374 Ack=1 Win=42496 Len=11584 TSval=3125675397 TSecr=2758125957"
"165","7.334407234","10.0.0.7","10.0.0.2","TCP","66","5202  >  54674 [ACK] Seq=1 Ack=36238 Win=93696 Len=0 TSval=2758125959 TSecr=3125675336"
"166","7.334421080","10.0.0.2","10.0.0.7","TCP","21786","54674  >  5202 [PSH, ACK] Seq=57958 Ack=1 Win=42496 Len=21720 TSval=3125675399 TSecr=2758125959"
"167","7.337798997","10.0.0.7","10.0.0.2","TCP","66","5202  >  54690 [ACK] Seq=1 Ack=26102 Win=68096 Len=0 TSval=2758125962 TSecr=3125675339"
"168","7.337820403","10.0.0.2","10.0.0.7","TCP","10202","54690  >  5202 [PSH, ACK] Seq=36238 Ack=1 Win=42496 Len=10136 TSval=3125675402 TSecr=2758125962"
"169","7.337824627","10.0.0.2","10.0.0.7","TCP","11650","54690  >  5202 [PSH, ACK] Seq=46374 Ack=1 Win=42496 Len=11584 TSval=3125675402 TSecr=2758125962"
"170","7.341190704","10.0.0.7","10.0.0.2","TCP","66","5202  >  54690 [ACK] Seq=1 Ack=36238 Win=93696 Len=0 TSval=2758125966 TSecr=3125675341"
"171","7.341204200","10.0.0.2","10.0.0.7","TCP","21786","54690  >  5202 [PSH, ACK] Seq=57958 Ack=1 Win=42496 Len=21720 TSval=3125675406 TSecr=2758125966"
"172","7.346276422","10.0.0.7","10.0.0.2","TCP","66","5202  >  54704 [ACK] Seq=1 Ack=26102 Win=68096 Len=0 TSval=2758125971 TSecr=3125675345"
"173","7.346290764","10.0.0.2","10.0.0.7","TCP","10202","54704  >  5202 [PSH, ACK] Seq=36238 Ack=1 Win=42496 Len=10136 TSval=3125675411 TSecr=2758125971"
"174","7.346295875","10.0.0.2","10.0.0.7","TCP","11650","54704  >  5202 [PSH, ACK] Seq=46374 Ack=1 Win=42496 Len=11584 TSval=3125675411 TSecr=2758125971"
"175","7.347970650","10.0.0.7","10.0.0.2","TCP","66","5202  >  54704 [ACK] Seq=1 Ack=36238 Win=93696 Len=0 TSval=2758125973 TSecr=3125675346"
"176","7.347985159","10.0.0.2","10.0.0.7","TCP","21786","54704  >  5202 [PSH, ACK] Seq=57958 Ack=1 Win=42496 Len=21720 TSval=3125675413 TSecr=2758125973"
"177","7.349668861","10.0.0.7","10.0.0.2","TCP","66","5202  >  54716 [ACK] Seq=1 Ack=26102 Win=68096 Len=0 TSval=2758125974 TSecr=3125675347"
"178","7.349682663","10.0.0.2","10.0.0.7","TCP","10202","54716  >  5202 [PSH, ACK] Seq=36238 Ack=1 Win=42496 Len=10136 TSval=3125675414 TSecr=2758125974"
"179","7.349687763","10.0.0.2","10.0.0.7","TCP","11650","54716  >  5202 [PSH, ACK] Seq=46374 Ack=1 Win=42496 Len=11584 TSval=3125675414 TSecr=2758125974"
"180","7.351362152","10.0.0.7","10.0.0.2","TCP","66","5202  >  54716 [ACK] Seq=1 Ack=36238 Win=88064 Len=0 TSval=2758125976 TSecr=3125675348"
"181","7.351375722","10.0.0.2","10.0.0.7","TCP","21786","54716  >  5202 [PSH, ACK] Seq=57958 Ack=1 Win=42496 Len=21720 TSval=3125675416 TSecr=2758125976"
"182","7.353062054","10.0.0.7","10.0.0.2","TCP","66","5202  >  54718 [ACK] Seq=1 Ack=26102 Win=68096 Len=0 TSval=2758125978 TSecr=3125675350"
"183","7.353075292","10.0.0.2","10.0.0.7","TCP","10202","54718  >  5202 [PSH, ACK] Seq=36238 Ack=1 Win=42496 Len=10136 TSval=3125675418 TSecr=2758125978"
"184","7.353081331","10.0.0.2","10.0.0.7","TCP","11650","54718  >  5202 [PSH, ACK] Seq=46374 Ack=1 Win=42496 Len=11584 TSval=3125675418 TSecr=2758125978"
"185","7.354759349","10.0.0.7","10.0.0.2","TCP","66","5202  >  54718 [ACK] Seq=1 Ack=36238 Win=93696 Len=0 TSval=2758125979 TSecr=3125675351"
"186","7.354774685","10.0.0.2","10.0.0.7","TCP","21786","54718  >  5202 [PSH, ACK] Seq=57958 Ack=1 Win=42496 Len=21720 TSval=3125675419 TSecr=2758125979"
"187","7.359899309","10.0.0.7","10.0.0.2","TCP","66","5202  >  54726 [ACK] Seq=1 Ack=26102 Win=68096 Len=0 TSval=2758125984 TSecr=3125675354"
"188","7.359923959","10.0.0.2","10.0.0.7","TCP","10202","54726  >  5202 [PSH, ACK] Seq=36238 Ack=1 Win=42496 Len=10136 TSval=3125675425 TSecr=2758125984"
"189","7.359928831","10.0.0.2","10.0.0.7","TCP","11650","54726  >  5202 [PSH, ACK] Seq=46374 Ack=1 Win=42496 Len=11584 TSval=3125675425 TSecr=2758125984"
"190","7.361524032","10.0.0.7","10.0.0.2","TCP","66","5202  >  54726 [ACK] Seq=1 Ack=36238 Win=88064 Len=0 TSval=2758125986 TSecr=3125675356"
"191","7.361535531","10.0.0.2","10.0.0.7","TCP","21786","54726  >  5202 [PSH, ACK] Seq=57958 Ack=1 Win=42496 Len=21720 TSval=3125675426 TSecr=2758125986"
"192","7.370018713","10.0.0.7","10.0.0.2","TCP","66","5202  >  54742 [ACK] Seq=1 Ack=26102 Win=68096 Len=0 TSval=2758125995 TSecr=3125675362"
"193","7.370029657","10.0.0.2","10.0.0.7","TCP","10202","54742  >  5202 [PSH, ACK] Seq=36238 Ack=1 Win=42496 Len=10136 TSval=3125675435 TSecr=2758125995"
"194","7.370032176","10.0.0.2","10.0.0.7","TCP","11650","54742  >  5202 [PSH, ACK] Seq=46374 Ack=1 Win=42496 Len=11584 TSval=3125675435 TSecr=2758125995"
"195","7.371713023","10.0.0.7","10.0.0.2","TCP","66","5202  >  54750 [ACK] Seq=1 Ack=26102 Win=68096 Len=0 TSval=2758125996 TSecr=3125675363"
"196","7.371723401","10.0.0.2","10.0.0.7","TCP","10202","54750  >  5202 [PSH, ACK] Seq=36238 Ack=1 Win=42496 Len=10136 TSval=3125675436 TSecr=2758125996"
"197","7.371728100","10.0.0.2","10.0.0.7","TCP","11650","54750  >  5202 [PSH, ACK] Seq=46374 Ack=1 Win=42496 Len=11584 TSval=3125675436 TSecr=2758125996"
"198","7.373408793","10.0.0.7","10.0.0.2","TCP","66","5202  >  54742 [ACK] Seq=1 Ack=36238 Win=88064 Len=0 TSval=2758125998 TSecr=3125675364"
"199","7.373424282","10.0.0.2","10.0.0.7","TCP","21786","54742  >  5202 [PSH, ACK] Seq=57958 Ack=1 Win=42496 Len=21720 TSval=3125675438 TSecr=2758125998"
"200","7.375118601","10.0.0.7","10.0.0.2","TCP","66","5202  >  54750 [ACK] Seq=1 Ack=36238 Win=93696 Len=0 TSval=2758126000 TSecr=3125675365"
"201","7.375141837","10.0.0.2","10.0.0.7","TCP","21786","54750  >  5202 [PSH, ACK] Seq=57958 Ack=1 Win=42496 Len=21720 TSval=3125675440 TSecr=2758126000"
"202","7.404453880","10.0.0.7","10.0.0.2","TCP","66","5202  >  54658 [ACK] Seq=1 Ack=46374 Win=114176 Len=0 TSval=2758126029 TSecr=3125675387"
"203","7.406109010","10.0.0.7","10.0.0.2","TCP","66","5202  >  54658 [ACK] Seq=1 Ack=57958 Win=137216 Len=0 TSval=2758126031 TSecr=3125675387"
"204","7.406118818","10.0.0.2","10.0.0.7","TCP","7306","54658  >  5202 [PSH, ACK] Seq=79678 Ack=1 Win=42496 Len=7240 TSval=3125675471 TSecr=2758126031"
"205","7.406126996","10.0.0.2","10.0.0.7","TCP","27578","54658  >  5202 [PSH, ACK] Seq=86918 Ack=1 Win=42496 Len=27512 TSval=3125675471 TSecr=2758126031"
"206","7.411681516","10.0.0.7","10.0.0.2","TCP","66","5202  >  54662 [ACK] Seq=1 Ack=46374 Win=114176 Len=0 TSval=2758126036 TSecr=3125675391"
"207","7.413375153","10.0.0.7","10.0.0.2","TCP","66","5202  >  54662 [ACK] Seq=1 Ack=57958 Win=137216 Len=0 TSval=2758126038 TSecr=3125675391"
"208","7.413383989","10.0.0.2","10.0.0.7","TCP","7306","54662  >  5202 [PSH, ACK] Seq=79678 Ack=1 Win=42496 Len=7240 TSval=3125675478 TSecr=2758126038"
"209","7.413389945","10.0.0.2","10.0.0.7","TCP","27578","54662  >  5202 [PSH, ACK] Seq=86918 Ack=1 Win=42496 Len=27512 TSval=3125675478 TSecr=2758126038"
"210","7.415312373","10.0.0.7","10.0.0.2","TCP","66","5202  >  54662 [ACK] Seq=1 Ack=79678 Win=174080 Len=0 TSval=2758126040 TSecr=3125675392"
"211","7.415326461","10.0.0.2","10.0.0.7","TCP","46402","54662  >  5202 [PSH, ACK] Seq=114430 Ack=1 Win=42496 Len=46336 TSval=3125675480 TSecr=2758126040"
"212","7.418950739","10.0.0.7","10.0.0.2","TCP","66","5202  >  54658 [ACK] Seq=1 Ack=79678 Win=174080 Len=0 TSval=2758126044 TSecr=3125675394"
"213","7.418968475","10.0.0.2","10.0.0.7","TCP","46402","54658  >  5202 [PSH, ACK] Seq=114430 Ack=1 Win=42496 Len=46336 TSval=3125675484 TSecr=2758126044"
"214","7.426221147","10.0.0.7","10.0.0.2","TCP","66","5202  >  54674 [ACK] Seq=1 Ack=46374 Win=114176 Len=0 TSval=2758126051 TSecr=3125675397"
"215","7.427915686","10.0.0.7","10.0.0.2","TCP","66","5202  >  54674 [ACK] Seq=1 Ack=57958 Win=137216 Len=0 TSval=2758126053 TSecr=3125675397"
"216","7.427924129","10.0.0.2","10.0.0.7","TCP","7306","54674  >  5202 [PSH, ACK] Seq=79678 Ack=1 Win=42496 Len=7240 TSval=3125675493 TSecr=2758126053"
"217","7.427932324","10.0.0.2","10.0.0.7","TCP","27578","54674  >  5202 [PSH, ACK] Seq=86918 Ack=1 Win=42496 Len=27512 TSval=3125675493 TSecr=2758126053"
"218","7.429848752","10.0.0.7","10.0.0.2","TCP","66","5202  >  54674 [ACK] Seq=1 Ack=79678 Win=174080 Len=0 TSval=2758126054 TSecr=3125675399"
"219","7.429870482","10.0.0.2","10.0.0.7","TCP","46402","54674  >  5202 [PSH, ACK] Seq=114430 Ack=1 Win=42496 Len=46336 TSval=3125675494 TSecr=2758126054"
"220","7.437118406","10.0.0.7","10.0.0.2","TCP","66","5202  >  54690 [ACK] Seq=1 Ack=46374 Win=114176 Len=0 TSval=2758126062 TSecr=3125675402"
"221","7.438812086","10.0.0.7","10.0.0.2","TCP","66","5202  >  54690 [ACK] Seq=1 Ack=57958 Win=137216 Len=0 TSval=2758126063 TSecr=3125675402"
"222","7.438820282","10.0.0.2","10.0.0.7","TCP","7306","54690  >  5202 [PSH, ACK] Seq=79678 Ack=1 Win=42496 Len=7240 TSval=3125675503 TSecr=2758126063"
"223","7.438825524","10.0.0.2","10.0.0.7","TCP","27578","54690  >  5202 [PSH, ACK] Seq=86918 Ack=1 Win=42496 Len=27512 TSval=3125675503 TSecr=2758126063"
"224","7.444410035","10.0.0.7","10.0.0.2","TCP","66","5202  >  54690 [ACK] Seq=1 Ack=79678 Win=174080 Len=0 TSval=2758126069 TSecr=3125675406"
"225","7.444461637","10.0.0.2","10.0.0.7","TCP","46402","54690  >  5202 [PSH, ACK] Seq=114430 Ack=1 Win=42496 Len=46336 TSval=3125675509 TSecr=2758126069"
"226","7.455298133","10.0.0.7","10.0.0.2","TCP","66","5202  >  54704 [ACK] Seq=1 Ack=46374 Win=114176 Len=0 TSval=2758126080 TSecr=3125675411"
"227","7.456981027","10.0.0.7","10.0.0.2","TCP","66","5202  >  54704 [ACK] Seq=1 Ack=57958 Win=137216 Len=0 TSval=2758126082 TSecr=3125675411"
"228","7.456989299","10.0.0.2","10.0.0.7","TCP","7306","54704  >  5202 [PSH, ACK] Seq=79678 Ack=1 Win=42496 Len=7240 TSval=3125675522 TSecr=2758126082"
"229","7.456995392","10.0.0.2","10.0.0.7","TCP","27578","54704  >  5202 [PSH, ACK] Seq=86918 Ack=1 Win=42496 Len=27512 TSval=3125675522 TSecr=2758126082"
"230","7.458918070","10.0.0.7","10.0.0.2","TCP","66","5202  >  54704 [ACK] Seq=1 Ack=79678 Win=174080 Len=0 TSval=2758126084 TSecr=3125675413"
"231","7.458932340","10.0.0.2","10.0.0.7","TCP","46402","54704  >  5202 [PSH, ACK] Seq=114430 Ack=1 Win=42496 Len=46336 TSval=3125675524 TSecr=2758126084"
"232","7.462554713","10.0.0.7","10.0.0.2","TCP","66","5202  >  54716 [ACK] Seq=1 Ack=46374 Win=108544 Len=0 TSval=2758126087 TSecr=3125675414"
"233","7.464247116","10.0.0.7","10.0.0.2","TCP","66","5202  >  54716 [ACK] Seq=1 Ack=57958 Win=131584 Len=0 TSval=2758126089 TSecr=3125675414"
"234","7.464255125","10.0.0.2","10.0.0.7","TCP","7306","54716  >  5202 [PSH, ACK] Seq=79678 Ack=1 Win=42496 Len=7240 TSval=3125675529 TSecr=2758126089"
"235","7.464260963","10.0.0.2","10.0.0.7","TCP","24682","54716  >  5202 [PSH, ACK] Seq=86918 Ack=1 Win=42496 Len=24616 TSval=3125675529 TSecr=2758126089"
"236","7.466192885","10.0.0.7","10.0.0.2","TCP","66","5202  >  54716 [ACK] Seq=1 Ack=79678 Win=174080 Len=0 TSval=2758126091 TSecr=3125675416"
"237","7.466214354","10.0.0.2","10.0.0.7","TCP","18890","54716  >  5202 [PSH, ACK] Seq=111534 Ack=1 Win=42496 Len=18824 TSval=3125675531 TSecr=2758126091"
"238","7.469822617","10.0.0.7","10.0.0.2","TCP","66","5202  >  54718 [ACK] Seq=1 Ack=46374 Win=114176 Len=0 TSval=2758126094 TSecr=3125675418"
"239","7.471515561","10.0.0.7","10.0.0.2","TCP","66","5202  >  54718 [ACK] Seq=1 Ack=57958 Win=137216 Len=0 TSval=2758126096 TSecr=3125675418"
"240","7.471525506","10.0.0.2","10.0.0.7","TCP","7306","54718  >  5202 [PSH, ACK] Seq=79678 Ack=1 Win=42496 Len=7240 TSval=3125675536 TSecr=2758126096"
"241","7.471532477","10.0.0.2","10.0.0.7","TCP","27578","54718  >  5202 [PSH, ACK] Seq=86918 Ack=1 Win=42496 Len=27512 TSval=3125675536 TSecr=2758126096"
"242","7.473452877","10.0.0.7","10.0.0.2","TCP","66","5202  >  54718 [ACK] Seq=1 Ack=79678 Win=174080 Len=0 TSval=2758126098 TSecr=3125675419"
"243","7.473468863","10.0.0.2","10.0.0.7","TCP","46402","54718  >  5202 [PSH, ACK] Seq=114430 Ack=1 Win=42496 Len=46336 TSval=3125675538 TSecr=2758126098"
"244","7.484357711","10.0.0.7","10.0.0.2","TCP","66","5202  >  54726 [ACK] Seq=1 Ack=46374 Win=108544 Len=0 TSval=2758126109 TSecr=3125675425"
"245","7.486048347","10.0.0.7","10.0.0.2","TCP","66","5202  >  54726 [ACK] Seq=1 Ack=57958 Win=131584 Len=0 TSval=2758126111 TSecr=3125675425"
"246","7.486057333","10.0.0.2","10.0.0.7","TCP","7306","54726  >  5202 [PSH, ACK] Seq=79678 Ack=1 Win=42496 Len=7240 TSval=3125675551 TSecr=2758126111"
"247","7.486063940","10.0.0.2","10.0.0.7","TCP","24682","54726  >  5202 [PSH, ACK] Seq=86918 Ack=1 Win=42496 Len=24616 TSval=3125675551 TSecr=2758126111"
"248","7.487987697","10.0.0.7","10.0.0.2","TCP","66","5202  >  54726 [ACK] Seq=1 Ack=79678 Win=174080 Len=0 TSval=2758126113 TSecr=3125675426"
"249","7.488004685","10.0.0.2","10.0.0.7","TCP","33370","54726  >  5202 [PSH, ACK] Seq=111534 Ack=1 Win=42496 Len=33304 TSval=3125675553 TSecr=2758126113"
"250","7.506205993","10.0.0.7","10.0.0.2","TCP","66","5202  >  54742 [ACK] Seq=1 Ack=46374 Win=108544 Len=0 TSval=2758126131 TSecr=3125675435"
"251","7.507854635","10.0.0.7","10.0.0.2","TCP","66","5202  >  54742 [ACK] Seq=1 Ack=57958 Win=131584 Len=0 TSval=2758126132 TSecr=3125675435"
"252","7.507869444","10.0.0.2","10.0.0.7","TCP","7306","54742  >  5202 [PSH, ACK] Seq=79678 Ack=1 Win=42496 Len=7240 TSval=3125675572 TSecr=2758126132"
"253","7.507879448","10.0.0.2","10.0.0.7","TCP","24682","54742  >  5202 [PSH, ACK] Seq=86918 Ack=1 Win=42496 Len=24616 TSval=3125675572 TSecr=2758126132"
"254","7.509793534","10.0.0.7","10.0.0.2","TCP","66","5202  >  54750 [ACK] Seq=1 Ack=46374 Win=114176 Len=0 TSval=2758126134 TSecr=3125675436"
"255","7.511484621","10.0.0.7","10.0.0.2","TCP","66","5202  >  54750 [ACK] Seq=1 Ack=57958 Win=137216 Len=0 TSval=2758126136 TSecr=3125675436"
"256","7.511500661","10.0.0.2","10.0.0.7","TCP","7306","54750  >  5202 [PSH, ACK] Seq=79678 Ack=1 Win=42496 Len=7240 TSval=3125675576 TSecr=2758126136"
"257","7.511508015","10.0.0.2","10.0.0.7","TCP","27578","54750  >  5202 [PSH, ACK] Seq=86918 Ack=1 Win=42496 Len=27512 TSval=3125675576 TSecr=2758126136"
"258","7.513424758","10.0.0.7","10.0.0.2","TCP","66","5202  >  54742 [ACK] Seq=1 Ack=79678 Win=174080 Len=0 TSval=2758126138 TSecr=3125675438"
"259","7.513445186","10.0.0.2","10.0.0.7","TCP","33370","54742  >  5202 [PSH, ACK] Seq=111534 Ack=1 Win=42496 Len=33304 TSval=3125675578 TSecr=2758126138"
"260","7.517058048","10.0.0.7","10.0.0.2","TCP","66","5202  >  54750 [ACK] Seq=1 Ack=79678 Win=174080 Len=0 TSval=2758126142 TSecr=3125675440"
"261","7.517076871","10.0.0.2","10.0.0.7","TCP","36266","54750  >  5202 [PSH, ACK] Seq=114430 Ack=1 Win=42496 Len=36200 TSval=3125675582 TSecr=2758126142"
"262","7.569687981","10.0.0.7","10.0.0.2","TCP","66","5202  >  54658 [ACK] Seq=1 Ack=86918 Win=187392 Len=0 TSval=2758126194 TSecr=3125675471"
"263","7.570835682","10.0.0.7","10.0.0.2","TCP","66","5202  >  54658 [ACK] Seq=1 Ack=114430 Win=194560 Len=0 TSval=2758126195 TSecr=3125675471"
"264","7.570849584","10.0.0.2","10.0.0.7","TCP","13098","54658  >  5202 [PSH, ACK] Seq=160766 Ack=1 Win=42496 Len=13032 TSval=3125675635 TSecr=2758126195"
"265","7.570861978","10.0.0.2","10.0.0.7","TCP","43506","54658  >  5202 [PSH, ACK] Seq=173798 Ack=1 Win=42496 Len=43440 TSval=3125675635 TSecr=2758126195"
"266","7.581262478","10.0.0.7","10.0.0.2","TCP","66","5202  >  54662 [ACK] Seq=1 Ack=86918 Win=187392 Len=0 TSval=2758126206 TSecr=3125675478"
"267","7.582463349","10.0.0.7","10.0.0.2","TCP","66","5202  >  54662 [ACK] Seq=1 Ack=114430 Win=194560 Len=0 TSval=2758126207 TSecr=3125675478"
"268","7.582474161","10.0.0.2","10.0.0.7","TCP","13098","54662  >  5202 [PSH, ACK] Seq=160766 Ack=1 Win=42496 Len=13032 TSval=3125675647 TSecr=2758126207"
"269","7.582486488","10.0.0.2","10.0.0.7","TCP","43506","54662  >  5202 [PSH, ACK] Seq=173798 Ack=1 Win=42496 Len=43440 TSval=3125675647 TSecr=2758126207"
"270","7.587065305","10.0.0.7","10.0.0.2","TCP","66","5202  >  54662 [ACK] Seq=1 Ack=160766 Win=178176 Len=0 TSval=2758126212 TSecr=3125675480"
"271","7.587085689","10.0.0.2","10.0.0.7","TCP","65226","54662  >  5202 [PSH, ACK] Seq=217238 Ack=1 Win=42496 Len=65160 TSval=3125675652 TSecr=2758126212"
"272","7.594819427","10.0.0.7","10.0.0.2","TCP","66","5202  >  54658 [ACK] Seq=1 Ack=160766 Win=178176 Len=0 TSval=2758126219 TSecr=3125675484"
