"No.","Time","Source","Destination","Protocol","Length","Info"
"1","0.000000000","fe80::6cd1:43ff:fead:975a","ff02::2","ICMPv6","70","Router Solicitation from 6e:d1:43:ad:97:5a"
"2","0.000121684","fe80::a03e:74ff:fe26:ebfb","ff02::2","ICMPv6","70","Router Solicitation from a2:3e:74:26:eb:fb"
"3","0.000531526","fe80::a4e1:aaff:fe29:2a15","ff02::2","ICMPv6","70","Router Solicitation from a6:e1:aa:29:2a:15"
"4","0.000979696","fe80::e0a2:14ff:fe9f:8e34","ff02::2","ICMPv6","70","Router Solicitation from e2:a2:14:9f:8e:34"
"5","1.024288398","fe80::3c5b:8bff:fea6:dffb","ff02::2","ICMPv6","70","Router Solicitation from 3e:5b:8b:a6:df:fb"
"6","1.024335508","fe80::d0d8:28ff:fea5:3759","ff02::2","ICMPv6","70","Router Solicitation from d2:d8:28:a5:37:59"
"7","7.036855221","a6:e1:aa:29:2a:15","Broadcast","ARP","42","Who has 10.0.0.7? Tell 10.0.0.3"
"8","7.037001412","d2:d8:28:a5:37:59","Broadcast","ARP","42","Who has 10.0.0.7? Tell 10.0.0.1"
"9","7.037314159","a2:3e:74:26:eb:fb","Broadcast","ARP","42","Who has 10.0.0.7? Tell 10.0.0.4"
"10","7.037761348","e2:a2:14:9f:8e:34","a6:e1:aa:29:2a:15","ARP","42","10.0.0.7 is at e2:a2:14:9f:8e:34"
"11","7.037778606","10.0.0.3","10.0.0.7","TCP","74","45212  >  5202 [SYN] Seq=0 Win=42340 Len=0 MSS=1460 SACK_PERM TSval=3234868935 TSecr=0 WS=512"
"12","7.038453047","10.0.0.7","10.0.0.3","TCP","74","5202  >  45212 [SYN, ACK] Seq=0 Ack=1 Win=43440 Len=0 MSS=1460 SACK_PERM TSval=3471097572 TSecr=3234868935 WS=512"
"13","7.038485106","10.0.0.3","10.0.0.7","TCP","66","45212  >  5202 [ACK] Seq=1 Ack=1 Win=42496 Len=0 TSval=3234868936 TSecr=3471097572"
"14","7.038536389","10.0.0.3","10.0.0.7","TCP","103","45212  >  5202 [PSH, ACK] Seq=1 Ack=1 Win=42496 Len=37 TSval=3234868937 TSecr=3471097572"
"15","7.038589102","10.0.0.7","10.0.0.3","TCP","66","5202  >  45212 [ACK] Seq=1 Ack=38 Win=43520 Len=0 TSval=3471097573 TSecr=3234868937"
"16","7.038720813","10.0.0.7","10.0.0.3","TCP","67","5202  >  45212 [PSH, ACK] Seq=1 Ack=38 Win=43520 Len=1 TSval=3471097573 TSecr=3234868937"
"17","7.038743681","10.0.0.3","10.0.0.7","TCP","66","45212  >  5202 [ACK] Seq=38 Ack=2 Win=42496 Len=0 TSval=3234868937 TSecr=3471097573"
"18","7.038865007","10.0.0.3","10.0.0.7","TCP","70","45212  >  5202 [PSH, ACK] Seq=38 Ack=2 Win=42496 Len=4 TSval=3234868937 TSecr=3471097573"
"19","7.038900399","10.0.0.3","10.0.0.7","TCP","238","45212  >  5202 [PSH, ACK] Seq=42 Ack=2 Win=42496 Len=172 TSval=3234868937 TSecr=3471097573"
"20","7.038993743","10.0.0.7","10.0.0.3","TCP","66","5202  >  45212 [ACK] Seq=2 Ack=214 Win=43520 Len=0 TSval=3471097573 TSecr=3234868937"
"21","7.039076161","10.0.0.7","10.0.0.3","TCP","67","5202  >  45212 [PSH, ACK] Seq=2 Ack=214 Win=43520 Len=1 TSval=3471097573 TSecr=3234868937"
"22","7.039142520","10.0.0.3","10.0.0.7","TCP","74","45224  >  5202 [SYN] Seq=0 Win=42340 Len=0 MSS=1460 SACK_PERM TSval=3234868937 TSecr=0 WS=512"
"23","7.039188682","10.0.0.7","10.0.0.3","TCP","74","5202  >  45224 [SYN, ACK] Seq=0 Ack=1 Win=43440 Len=0 MSS=1460 SACK_PERM TSval=3471097573 TSecr=3234868937 WS=512"
"24","7.039199243","10.0.0.3","10.0.0.7","TCP","66","45224  >  5202 [ACK] Seq=1 Ack=1 Win=42496 Len=0 TSval=3234868937 TSecr=3471097573"
"25","7.039207804","10.0.0.3","10.0.0.7","TCP","103","45224  >  5202 [PSH, ACK] Seq=1 Ack=1 Win=42496 Len=37 TSval=3234868937 TSecr=3471097573"
"26","7.039227608","10.0.0.7","10.0.0.3","TCP","66","5202  >  45224 [ACK] Seq=1 Ack=38 Win=43520 Len=0 TSval=3471097573 TSecr=3234868937"
"27","7.040357171","10.0.0.3","10.0.0.7","TCP","74","45234  >  5202 [SYN] Seq=0 Win=42340 Len=0 MSS=1460 SACK_PERM TSval=3234868938 TSecr=0 WS=512"
"28","7.040388879","10.0.0.7","10.0.0.3","TCP","74","5202  >  45234 [SYN, ACK] Seq=0 Ack=1 Win=43440 Len=0 MSS=1460 SACK_PERM TSval=3471097574 TSecr=3234868938 WS=512"
"29","7.040402404","10.0.0.3","10.0.0.7","TCP","66","45234  >  5202 [ACK] Seq=1 Ack=1 Win=42496 Len=0 TSval=3234868938 TSecr=3471097574"
"30","7.040426508","10.0.0.3","10.0.0.7","TCP","103","45234  >  5202 [PSH, ACK] Seq=1 Ack=1 Win=42496 Len=37 TSval=3234868938 TSecr=3471097574"
"31","7.040439842","10.0.0.7","10.0.0.3","TCP","66","5202  >  45234 [ACK] Seq=1 Ack=38 Win=43520 Len=0 TSval=3471097574 TSecr=3234868938"
"32","7.041441385","10.0.0.3","10.0.0.7","TCP","74","45246  >  5202 [SYN] Seq=0 Win=42340 Len=0 MSS=1460 SACK_PERM TSval=3234868939 TSecr=0 WS=512"
"33","7.041461867","10.0.0.7","10.0.0.3","TCP","74","5202  >  45246 [SYN, ACK] Seq=0 Ack=1 Win=43440 Len=0 MSS=1460 SACK_PERM TSval=3471097575 TSecr=3234868939 WS=512"
"34","7.041469970","10.0.0.3","10.0.0.7","TCP","66","45246  >  5202 [ACK] Seq=1 Ack=1 Win=42496 Len=0 TSval=3234868939 TSecr=3471097575"
"35","7.041487203","10.0.0.3","10.0.0.7","TCP","103","45246  >  5202 [PSH, ACK] Seq=1 Ack=1 Win=42496 Len=37 TSval=3234868939 TSecr=3471097575"
"36","7.041528171","10.0.0.7","10.0.0.3","TCP","66","5202  >  45246 [ACK] Seq=1 Ack=38 Win=43520 Len=0 TSval=3471097575 TSecr=3234868939"
"37","7.042443401","10.0.0.3","10.0.0.7","TCP","74","45254  >  5202 [SYN] Seq=0 Win=42340 Len=0 MSS=1460 SACK_PERM TSval=3234868940 TSecr=0 WS=512"
"38","7.042462149","10.0.0.7","10.0.0.3","TCP","74","5202  >  45254 [SYN, ACK] Seq=0 Ack=1 Win=43440 Len=0 MSS=1460 SACK_PERM TSval=3471097576 TSecr=3234868940 WS=512"
"39","7.042470202","10.0.0.3","10.0.0.7","TCP","66","45254  >  5202 [ACK] Seq=1 Ack=1 Win=42496 Len=0 TSval=3234868940 TSecr=3471097576"
"40","7.042485698","10.0.0.3","10.0.0.7","TCP","103","45254  >  5202 [PSH, ACK] Seq=1 Ack=1 Win=42496 Len=37 TSval=3234868940 TSecr=3471097576"
"41","7.042497193","10.0.0.7","10.0.0.3","TCP","66","5202  >  45254 [ACK] Seq=1 Ack=38 Win=43520 Len=0 TSval=3471097576 TSecr=3234868940"
"42","7.043466497","10.0.0.3","10.0.0.7","TCP","74","45264  >  5202 [SYN] Seq=0 Win=42340 Len=0 MSS=1460 SACK_PERM TSval=3234868941 TSecr=0 WS=512"
"43","7.043485259","10.0.0.7","10.0.0.3","TCP","74","5202  >  45264 [SYN, ACK] Seq=0 Ack=1 Win=43440 Len=0 MSS=1460 SACK_PERM TSval=3471097577 TSecr=3234868941 WS=512"
"44","7.043493193","10.0.0.3","10.0.0.7","TCP","66","45264  >  5202 [ACK] Seq=1 Ack=1 Win=42496 Len=0 TSval=3234868941 TSecr=3471097577"
"45","7.043516664","10.0.0.3","10.0.0.7","TCP","103","45264  >  5202 [PSH, ACK] Seq=1 Ack=1 Win=42496 Len=37 TSval=3234868942 TSecr=3471097577"
"46","7.043528398","10.0.0.7","10.0.0.3","TCP","66","5202  >  45264 [ACK] Seq=1 Ack=38 Win=43520 Len=0 TSval=3471097578 TSecr=3234868942"
"47","7.043981476","10.0.0.3","10.0.0.7","TCP","74","45266  >  5202 [SYN] Seq=0 Win=42340 Len=0 MSS=1460 SACK_PERM TSval=3234868942 TSecr=0 WS=512"
"48","7.043987777","10.0.0.7","10.0.0.3","TCP","74","5202  >  45266 [SYN, ACK] Seq=0 Ack=1 Win=43440 Len=0 MSS=1460 SACK_PERM TSval=3471097578 TSecr=3234868942 WS=512"
"49","7.043990116","10.0.0.3","10.0.0.7","TCP","66","45266  >  5202 [ACK] Seq=1 Ack=1 Win=42496 Len=0 TSval=3234868942 TSecr=3471097578"
"50","7.043995751","10.0.0.3","10.0.0.7","TCP","103","45266  >  5202 [PSH, ACK] Seq=1 Ack=1 Win=42496 Len=37 TSval=3234868942 TSecr=3471097578"
"51","7.044003747","10.0.0.7","10.0.0.3","TCP","66","5202  >  45266 [ACK] Seq=1 Ack=38 Win=43520 Len=0 TSval=3471097578 TSecr=3234868942"
"52","7.044331083","10.0.0.3","10.0.0.7","TCP","74","45270  >  5202 [SYN] Seq=0 Win=42340 Len=0 MSS=1460 SACK_PERM TSval=3234868942 TSecr=0 WS=512"
"53","7.044337639","10.0.0.7","10.0.0.3","TCP","74","5202  >  45270 [SYN, ACK] Seq=0 Ack=1 Win=43440 Len=0 MSS=1460 SACK_PERM TSval=3471097578 TSecr=3234868942 WS=512"
"54","7.044339886","10.0.0.3","10.0.0.7","TCP","66","45270  >  5202 [ACK] Seq=1 Ack=1 Win=42496 Len=0 TSval=3234868942 TSecr=3471097578"
"55","7.044344942","10.0.0.3","10.0.0.7","TCP","103","45270  >  5202 [PSH, ACK] Seq=1 Ack=1 Win=42496 Len=37 TSval=3234868942 TSecr=3471097578"
"56","7.044348601","10.0.0.7","10.0.0.3","TCP","66","5202  >  45270 [ACK] Seq=1 Ack=38 Win=43520 Len=0 TSval=3471097578 TSecr=3234868942"
"57","7.044678672","10.0.0.3","10.0.0.7","TCP","74","45280  >  5202 [SYN] Seq=0 Win=42340 Len=0 MSS=1460 SACK_PERM TSval=3234868943 TSecr=0 WS=512"
"58","7.044685638","10.0.0.7","10.0.0.3","TCP","74","5202  >  45280 [SYN, ACK] Seq=0 Ack=1 Win=43440 Len=0 MSS=1460 SACK_PERM TSval=3471097579 TSecr=3234868943 WS=512"
"59","7.044687924","10.0.0.3","10.0.0.7","TCP","66","45280  >  5202 [ACK] Seq=1 Ack=1 Win=42496 Len=0 TSval=3234868943 TSecr=3471097579"
"60","7.044692841","10.0.0.3","10.0.0.7","TCP","103","45280  >  5202 [PSH, ACK] Seq=1 Ack=1 Win=42496 Len=37 TSval=3234868943 TSecr=3471097579"
"61","7.044696875","10.0.0.7","10.0.0.3","TCP","66","5202  >  45280 [ACK] Seq=1 Ack=38 Win=43520 Len=0 TSval=3471097579 TSecr=3234868943"
"62","7.045069100","10.0.0.3","10.0.0.7","TCP","74","45290  >  5202 [SYN] Seq=0 Win=42340 Len=0 MSS=1460 SACK_PERM TSval=3234868943 TSecr=0 WS=512"
"63","7.045081103","10.0.0.7","10.0.0.3","TCP","74","5202  >  45290 [SYN, ACK] Seq=0 Ack=1 Win=43440 Len=0 MSS=1460 SACK_PERM TSval=3471097579 TSecr=3234868943 WS=512"
"64","7.045085628","10.0.0.3","10.0.0.7","TCP","66","45290  >  5202 [ACK] Seq=1 Ack=1 Win=42496 Len=0 TSval=3234868943 TSecr=3471097579"
"65","7.045094761","10.0.0.3","10.0.0.7","TCP","103","45290  >  5202 [PSH, ACK] Seq=1 Ack=1 Win=42496 Len=37 TSval=3234868943 TSecr=3471097579"
"66","7.045100444","10.0.0.7","10.0.0.3","TCP","66","5202  >  45290 [ACK] Seq=1 Ack=38 Win=43520 Len=0 TSval=3471097579 TSecr=3234868943"
"67","7.045525918","10.0.0.3","10.0.0.7","TCP","74","45296  >  5202 [SYN] Seq=0 Win=42340 Len=0 MSS=1460 SACK_PERM TSval=3234868944 TSecr=0 WS=512"
"68","7.045533559","10.0.0.7","10.0.0.3","TCP","74","5202  >  45296 [SYN, ACK] Seq=0 Ack=1 Win=43440 Len=0 MSS=1460 SACK_PERM TSval=3471097580 TSecr=3234868944 WS=512"
"69","7.045536513","10.0.0.3","10.0.0.7","TCP","66","45296  >  5202 [ACK] Seq=1 Ack=1 Win=42496 Len=0 TSval=3234868944 TSecr=3471097580"
"70","7.045542014","10.0.0.3","10.0.0.7","TCP","103","45296  >  5202 [PSH, ACK] Seq=1 Ack=1 Win=42496 Len=37 TSval=3234868944 TSecr=3471097580"
"71","7.045545853","10.0.0.7","10.0.0.3","TCP","66","5202  >  45296 [ACK] Seq=1 Ack=38 Win=43520 Len=0 TSval=3471097580 TSecr=3234868944"
"72","7.046214324","10.0.0.7","10.0.0.3","TCP","67","5202  >  45212 [PSH, ACK] Seq=3 Ack=214 Win=43520 Len=1 TSval=3471097580 TSecr=3234868937"
"73","7.046240463","10.0.0.7","10.0.0.3","TCP","67","5202  >  45212 [PSH, ACK] Seq=4 Ack=214 Win=43520 Len=1 TSval=3471097580 TSecr=3234868937"
"74","7.046263564","10.0.0.3","10.0.0.7","TCP","66","45212  >  5202 [ACK] Seq=214 Ack=5 Win=42496 Len=0 TSval=3234868944 TSecr=3471097573"
"75","7.046390893","10.0.0.3","10.0.0.7","TCP","7306","45224  >  5202 [PSH, ACK] Seq=38 Ack=1 Win=42496 Len=7240 TSval=3234868944 TSecr=3471097573"
"76","7.046400796","10.0.0.7","10.0.0.3","TCP","66","5202  >  45224 [ACK] Seq=1 Ack=7278 Win=56832 Len=0 TSval=3471097580 TSecr=3234868944"
"77","7.046406938","10.0.0.3","10.0.0.7","TCP","7306","45224  >  5202 [PSH, ACK] Seq=7278 Ack=1 Win=42496 Len=7240 TSval=3234868944 TSecr=3471097573"
"78","7.046419615","10.0.0.3","10.0.0.7","TCP","7306","45234  >  5202 [PSH, ACK] Seq=38 Ack=1 Win=42496 Len=7240 TSval=3234868944 TSecr=3471097574"
"79","7.046426922","10.0.0.3","10.0.0.7","TCP","7306","45234  >  5202 [PSH, ACK] Seq=7278 Ack=1 Win=42496 Len=7240 TSval=3234868944 TSecr=3471097574"
"80","7.046449145","10.0.0.3","10.0.0.7","TCP","10202","45224  >  5202 [PSH, ACK] Seq=14518 Ack=1 Win=42496 Len=10136 TSval=3234868944 TSecr=3471097580"
"81","7.046493796","10.0.0.3","10.0.0.7","TCP","7306","45254  >  5202 [PSH, ACK] Seq=38 Ack=1 Win=42496 Len=7240 TSval=3234868944 TSecr=3471097576"
"82","7.046505605","10.0.0.3","10.0.0.7","TCP","7306","45246  >  5202 [PSH, ACK] Seq=38 Ack=1 Win=42496 Len=7240 TSval=3234868944 TSecr=3471097575"
"83","7.046513032","10.0.0.3","10.0.0.7","TCP","7306","45254  >  5202 [PSH, ACK] Seq=7278 Ack=1 Win=42496 Len=7240 TSval=3234868945 TSecr=3471097576"
"84","7.046519340","10.0.0.3","10.0.0.7","TCP","7306","45246  >  5202 [PSH, ACK] Seq=7278 Ack=1 Win=42496 Len=7240 TSval=3234868945 TSecr=3471097575"
"85","7.046542954","10.0.0.3","10.0.0.7","TCP","7306","45264  >  5202 [PSH, ACK] Seq=38 Ack=1 Win=42496 Len=7240 TSval=3234868945 TSecr=3471097578"
"86","7.046553048","10.0.0.3","10.0.0.7","TCP","7306","45264  >  5202 [PSH, ACK] Seq=7278 Ack=1 Win=42496 Len=7240 TSval=3234868945 TSecr=3471097578"
"87","7.046567737","10.0.0.3","10.0.0.7","TCP","7306","45266  >  5202 [PSH, ACK] Seq=38 Ack=1 Win=42496 Len=7240 TSval=3234868945 TSecr=3471097578"
"88","7.046575213","10.0.0.3","10.0.0.7","TCP","7306","45266  >  5202 [PSH, ACK] Seq=7278 Ack=1 Win=42496 Len=7240 TSval=3234868945 TSecr=3471097578"
"89","7.046619536","10.0.0.3","10.0.0.7","TCP","7306","45270  >  5202 [PSH, ACK] Seq=38 Ack=1 Win=42496 Len=7240 TSval=3234868945 TSecr=3471097578"
"90","7.046628603","10.0.0.3","10.0.0.7","TCP","7306","45270  >  5202 [PSH, ACK] Seq=7278 Ack=1 Win=42496 Len=7240 TSval=3234868945 TSecr=3471097578"
"91","7.046645683","10.0.0.3","10.0.0.7","TCP","7306","45280  >  5202 [PSH, ACK] Seq=38 Ack=1 Win=42496 Len=7240 TSval=3234868945 TSecr=3471097579"
"92","7.046657879","10.0.0.3","10.0.0.7","TCP","7306","45280  >  5202 [PSH, ACK] Seq=7278 Ack=1 Win=42496 Len=7240 TSval=3234868945 TSecr=3471097579"
"93","7.046658915","10.0.0.3","10.0.0.7","TCP","7306","45290  >  5202 [PSH, ACK] Seq=38 Ack=1 Win=42496 Len=7240 TSval=3234868945 TSecr=3471097579"
"94","7.046664292","10.0.0.3","10.0.0.7","TCP","7306","45296  >  5202 [PSH, ACK] Seq=38 Ack=1 Win=42496 Len=7240 TSval=3234868945 TSecr=3471097580"
"95","7.046668835","10.0.0.3","10.0.0.7","TCP","7306","45290  >  5202 [PSH, ACK] Seq=7278 Ack=1 Win=42496 Len=7240 TSval=3234868945 TSecr=3471097579"
"96","7.046669602","10.0.0.3","10.0.0.7","TCP","7306","45296  >  5202 [PSH, ACK] Seq=7278 Ack=1 Win=42496 Len=7240 TSval=3234868945 TSecr=3471097580"
"97","7.049509925","10.0.0.3","10.0.0.7","TCP","4410","45224  >  5202 [PSH, ACK] Seq=24654 Ack=1 Win=42496 Len=4344 TSval=3234868948 TSecr=3471097580"
"98","7.050510085","10.0.0.3","10.0.0.7","TCP","1514","45234  >  5202 [ACK] Seq=14518 Ack=1 Win=42496 Len=1448 TSval=3234868949 TSecr=3471097574"
"99","7.050511375","10.0.0.3","10.0.0.7","TCP","1514","45246  >  5202 [ACK] Seq=14518 Ack=1 Win=42496 Len=1448 TSval=3234868949 TSecr=3471097575"
"100","7.050511768","10.0.0.3","10.0.0.7","TCP","1514","45264  >  5202 [ACK] Seq=14518 Ack=1 Win=42496 Len=1448 TSval=3234868949 TSecr=3471097578"
"101","7.050515040","10.0.0.3","10.0.0.7","TCP","1514","45296  >  5202 [ACK] Seq=14518 Ack=1 Win=42496 Len=1448 TSval=3234868949 TSecr=3471097580"
"102","7.050516169","10.0.0.3","10.0.0.7","TCP","1514","45266  >  5202 [ACK] Seq=14518 Ack=1 Win=42496 Len=1448 TSval=3234868949 TSecr=3471097578"
"103","7.050516687","10.0.0.3","10.0.0.7","TCP","1514","45270  >  5202 [ACK] Seq=14518 Ack=1 Win=42496 Len=1448 TSval=3234868949 TSecr=3471097578"
"104","7.050517118","10.0.0.3","10.0.0.7","TCP","1514","45254  >  5202 [ACK] Seq=14518 Ack=1 Win=42496 Len=1448 TSval=3234868949 TSecr=3471097576"
"105","7.050561202","10.0.0.3","10.0.0.7","TCP","1514","45290  >  5202 [ACK] Seq=14518 Ack=1 Win=42496 Len=1448 TSval=3234868949 TSecr=3471097579"
"106","7.050624387","10.0.0.3","10.0.0.7","TCP","1514","45280  >  5202 [ACK] Seq=14518 Ack=1 Win=42496 Len=1448 TSval=3234868949 TSecr=3471097579"
"107","7.054635280","10.0.0.7","10.0.0.3","TCP","66","5202  >  45224 [ACK] Seq=1 Ack=14518 Win=70656 Len=0 TSval=3471097589 TSecr=3234868944"
"108","7.054645073","10.0.0.3","10.0.0.7","TCP","7306","45224  >  5202 [PSH, ACK] Seq=28998 Ack=1 Win=42496 Len=7240 TSval=3234868953 TSecr=3471097589"
"109","7.062524062","10.0.0.7","10.0.0.3","TCP","66","5202  >  45234 [ACK] Seq=1 Ack=7278 Win=56832 Len=0 TSval=3471097597 TSecr=3234868944"
"110","7.062542458","10.0.0.3","10.0.0.7","TCP","10202","45234  >  5202 [PSH, ACK] Seq=15966 Ack=1 Win=42496 Len=10136 TSval=3234868961 TSecr=3471097597"
"111","7.064932546","10.0.0.7","10.0.0.3","TCP","66","5202  >  45234 [ACK] Seq=1 Ack=14518 Win=70656 Len=0 TSval=3471097599 TSecr=3234868944"
"112","7.064955119","10.0.0.3","10.0.0.7","TCP","10202","45234  >  5202 [PSH, ACK] Seq=26102 Ack=1 Win=42496 Len=10136 TSval=3234868963 TSecr=3471097599"
"113","7.068084942","10.0.0.7","10.0.0.3","TCP","66","5202  >  45224 [ACK] Seq=1 Ack=24654 Win=68096 Len=0 TSval=3471097602 TSecr=3234868944"
"114","7.068098895","10.0.0.3","10.0.0.7","TCP","18890","45224  >  5202 [PSH, ACK] Seq=36238 Ack=1 Win=42496 Len=18824 TSval=3234868966 TSecr=3471097602"
"115","7.072325864","10.0.0.7","10.0.0.3","TCP","66","5202  >  45254 [ACK] Seq=1 Ack=7278 Win=56832 Len=0 TSval=3471097606 TSecr=3234868944"
"116","7.072340257","10.0.0.3","10.0.0.7","TCP","10202","45254  >  5202 [PSH, ACK] Seq=15966 Ack=1 Win=42496 Len=10136 TSval=3234868970 TSecr=3471097606"
"117","7.074622308","10.0.0.7","10.0.0.3","TCP","66","5202  >  45246 [ACK] Seq=1 Ack=7278 Win=56832 Len=0 TSval=3471097609 TSecr=3234868944"
"118","7.074632272","10.0.0.3","10.0.0.7","TCP","10202","45246  >  5202 [PSH, ACK] Seq=15966 Ack=1 Win=42496 Len=10136 TSval=3234868973 TSecr=3471097609"
"119","7.076674294","10.0.0.7","10.0.0.3","TCP","66","5202  >  45254 [ACK] Seq=1 Ack=14518 Win=70656 Len=0 TSval=3471097611 TSecr=3234868945"
"120","7.076692313","10.0.0.3","10.0.0.7","TCP","10202","45254  >  5202 [PSH, ACK] Seq=26102 Ack=1 Win=42496 Len=10136 TSval=3234868975 TSecr=3471097611"
"121","7.078977824","10.0.0.7","10.0.0.3","TCP","66","5202  >  45246 [ACK] Seq=1 Ack=14518 Win=70656 Len=0 TSval=3471097613 TSecr=3234868945"
"122","7.078991723","10.0.0.3","10.0.0.7","TCP","10202","45246  >  5202 [PSH, ACK] Seq=26102 Ack=1 Win=42496 Len=10136 TSval=3234868977 TSecr=3471097613"
"123","7.081766721","10.0.0.7","10.0.0.3","TCP","66","5202  >  45264 [ACK] Seq=1 Ack=7278 Win=56832 Len=0 TSval=3471097616 TSecr=3234868945"
"124","7.081777152","10.0.0.3","10.0.0.7","TCP","10202","45264  >  5202 [PSH, ACK] Seq=15966 Ack=1 Win=42496 Len=10136 TSval=3234868980 TSecr=3471097616"
"125","7.084060282","10.0.0.7","10.0.0.3","TCP","66","5202  >  45264 [ACK] Seq=1 Ack=14518 Win=70656 Len=0 TSval=3471097618 TSecr=3234868945"
"126","7.084070476","10.0.0.3","10.0.0.7","TCP","10202","45264  >  5202 [PSH, ACK] Seq=26102 Ack=1 Win=42496 Len=10136 TSval=3234868982 TSecr=3471097618"
"127","7.086362922","10.0.0.7","10.0.0.3","TCP","66","5202  >  45266 [ACK] Seq=1 Ack=7278 Win=56832 Len=0 TSval=3471097620 TSecr=3234868945"
"128","7.086369395","10.0.0.3","10.0.0.7","TCP","10202","45266  >  5202 [PSH, ACK] Seq=15966 Ack=1 Win=42496 Len=10136 TSval=3234868984 TSecr=3471097620"
"129","7.089026636","10.0.0.7","10.0.0.3","TCP","66","5202  >  45266 [ACK] Seq=1 Ack=14518 Win=70656 Len=0 TSval=3471097623 TSecr=3234868945"
"130","7.089034564","10.0.0.3","10.0.0.7","TCP","10202","45266  >  5202 [PSH, ACK] Seq=26102 Ack=1 Win=42496 Len=10136 TSval=3234868987 TSecr=3471097623"
"131","7.091448342","10.0.0.7","10.0.0.3","TCP","66","5202  >  45270 [ACK] Seq=1 Ack=7278 Win=56832 Len=0 TSval=3471097625 TSecr=3234868945"
"132","7.091454560","10.0.0.3","10.0.0.7","TCP","10202","45270  >  5202 [PSH, ACK] Seq=15966 Ack=1 Win=42496 Len=10136 TSval=3234868989 TSecr=3471097625"
"133","7.093261838","10.0.0.7","10.0.0.3","TCP","66","5202  >  45270 [ACK] Seq=1 Ack=14518 Win=70656 Len=0 TSval=3471097627 TSecr=3234868945"
"134","7.093268785","10.0.0.3","10.0.0.7","TCP","10202","45270  >  5202 [PSH, ACK] Seq=26102 Ack=1 Win=42496 Len=10136 TSval=3234868991 TSecr=3471097627"
"135","7.095201307","10.0.0.7","10.0.0.3","TCP","66","5202  >  45280 [ACK] Seq=1 Ack=7278 Win=56832 Len=0 TSval=3471097629 TSecr=3234868945"
"136","7.095206725","10.0.0.3","10.0.0.7","TCP","10202","45280  >  5202 [PSH, ACK] Seq=15966 Ack=1 Win=42496 Len=10136 TSval=3234868993 TSecr=3471097629"
"137","7.097621393","10.0.0.7","10.0.0.3","TCP","66","5202  >  45280 [ACK] Seq=1 Ack=14518 Win=70656 Len=0 TSval=3471097632 TSecr=3234868945"
"138","7.097627955","10.0.0.3","10.0.0.7","TCP","10202","45280  >  5202 [PSH, ACK] Seq=26102 Ack=1 Win=42496 Len=10136 TSval=3234868996 TSecr=3471097632"
"139","7.098229685","10.0.0.7","10.0.0.3","TCP","66","5202  >  45290 [ACK] Seq=1 Ack=7278 Win=56832 Len=0 TSval=3471097632 TSecr=3234868945"
"140","7.098234871","10.0.0.3","10.0.0.7","TCP","10202","45290  >  5202 [PSH, ACK] Seq=15966 Ack=1 Win=42496 Len=10136 TSval=3234868996 TSecr=3471097632"
"141","7.100651652","10.0.0.7","10.0.0.3","TCP","66","5202  >  45296 [ACK] Seq=1 Ack=7278 Win=56832 Len=0 TSval=3471097635 TSecr=3234868945"
"142","7.100656735","10.0.0.3","10.0.0.7","TCP","10202","45296  >  5202 [PSH, ACK] Seq=15966 Ack=1 Win=42496 Len=10136 TSval=3234868999 TSecr=3471097635"
"143","7.103073074","10.0.0.7","10.0.0.3","TCP","66","5202  >  45290 [ACK] Seq=1 Ack=14518 Win=70656 Len=0 TSval=3471097637 TSecr=3234868945"
"144","7.103079055","10.0.0.3","10.0.0.7","TCP","10202","45290  >  5202 [PSH, ACK] Seq=26102 Ack=1 Win=42496 Len=10136 TSval=3234869001 TSecr=3471097637"
"145","7.107795924","10.0.0.7","10.0.0.3","TCP","66","5202  >  45296 [ACK] Seq=1 Ack=14518 Win=70656 Len=0 TSval=3471097642 TSecr=3234868945"
"146","7.107801552","10.0.0.3","10.0.0.7","TCP","10202","45296  >  5202 [PSH, ACK] Seq=26102 Ack=1 Win=42496 Len=10136 TSval=3234869006 TSecr=3471097642"
"147","7.118098013","10.0.0.7","10.0.0.3","TCP","66","5202  >  45224 [ACK] Seq=1 Ack=28998 Win=79360 Len=0 TSval=3471097652 TSecr=3234868948"
"148","7.125123389","10.0.0.7","10.0.0.3","TCP","66","5202  >  45234 [ACK] Seq=1 Ack=15966 Win=73216 Len=0 TSval=3471097659 TSecr=3234868949"
"149","7.125243265","10.0.0.7","10.0.0.3","TCP","66","5202  >  45264 [ACK] Seq=1 Ack=15966 Win=73216 Len=0 TSval=3471097659 TSecr=3234868949"
"150","7.127302384","10.0.0.7","10.0.0.3","TCP","66","5202  >  45246 [ACK] Seq=1 Ack=15966 Win=73216 Len=0 TSval=3471097661 TSecr=3234868949"
"151","7.127422912","10.0.0.7","10.0.0.3","TCP","66","5202  >  45296 [ACK] Seq=1 Ack=15966 Win=73216 Len=0 TSval=3471097661 TSecr=3234868949"
"152","7.129361368","10.0.0.7","10.0.0.3","TCP","66","5202  >  45266 [ACK] Seq=1 Ack=15966 Win=73216 Len=0 TSval=3471097663 TSecr=3234868949"
"153","7.129481965","10.0.0.7","10.0.0.3","TCP","66","5202  >  45270 [ACK] Seq=1 Ack=15966 Win=73216 Len=0 TSval=3471097663 TSecr=3234868949"
"154","7.129603629","10.0.0.7","10.0.0.3","TCP","66","5202  >  45254 [ACK] Seq=1 Ack=15966 Win=73216 Len=0 TSval=3471097664 TSecr=3234868949"
"155","7.129723799","10.0.0.7","10.0.0.3","TCP","66","5202  >  45290 [ACK] Seq=1 Ack=15966 Win=73216 Len=0 TSval=3471097664 TSecr=3234868949"
"156","7.129844960","10.0.0.7","10.0.0.3","TCP","66","5202  >  45280 [ACK] Seq=1 Ack=15966 Win=73216 Len=0 TSval=3471097664 TSecr=3234868949"
"157","7.143416782","10.0.0.7","10.0.0.3","TCP","66","5202  >  45224 [ACK] Seq=1 Ack=36238 Win=93696 Len=0 TSval=3471097677 TSecr=3234868953"
"158","7.143422387","10.0.0.3","10.0.0.7","TCP","2962","45224  >  5202 [PSH, ACK] Seq=55062 Ack=1 Win=42496 Len=2896 TSval=3234869041 TSecr=3471097677"
"159","7.143426452","10.0.0.3","10.0.0.7","TCP","21786","45224  >  5202 [PSH, ACK] Seq=57958 Ack=1 Win=42496 Len=21720 TSval=3234869041 TSecr=3471097677"
"160","7.152523928","10.0.0.7","10.0.0.3","TCP","66","5202  >  45234 [ACK] Seq=1 Ack=26102 Win=68096 Len=0 TSval=3471097687 TSecr=3234868961"
"161","7.152540649","10.0.0.3","10.0.0.7","TCP","10202","45234  >  5202 [PSH, ACK] Seq=36238 Ack=1 Win=42496 Len=10136 TSval=3234869051 TSecr=3471097687"
"162","7.152549238","10.0.0.3","10.0.0.7","TCP","11650","45234  >  5202 [PSH, ACK] Seq=46374 Ack=1 Win=42496 Len=11584 TSval=3234869051 TSecr=3471097687"
"163","7.155731899","10.0.0.7","10.0.0.3","TCP","66","5202  >  45234 [ACK] Seq=1 Ack=36238 Win=93696 Len=0 TSval=3471097690 TSecr=3234868963"
"164","7.155747885","10.0.0.3","10.0.0.7","TCP","21786","45234  >  5202 [PSH, ACK] Seq=57958 Ack=1 Win=42496 Len=21720 TSval=3234869054 TSecr=3471097690"
"165","7.156639512","10.0.0.7","10.0.0.3","TCP","66","5202  >  45224 [ACK] Seq=1 Ack=55062 Win=131584 Len=0 TSval=3471097691 TSecr=3234868966"
"166","7.158239237","10.0.0.7","10.0.0.3","TCP","66","5202  >  45254 [ACK] Seq=1 Ack=26102 Win=68096 Len=0 TSval=3471097692 TSecr=3234868970"
"167","7.158260962","10.0.0.3","10.0.0.7","TCP","10202","45254  >  5202 [PSH, ACK] Seq=36238 Ack=1 Win=42496 Len=10136 TSval=3234869056 TSecr=3471097692"
"168","7.158265678","10.0.0.3","10.0.0.7","TCP","11650","45254  >  5202 [PSH, ACK] Seq=46374 Ack=1 Win=42496 Len=11584 TSval=3234869056 TSecr=3471097692"
"169","7.162017654","10.0.0.7","10.0.0.3","TCP","66","5202  >  45246 [ACK] Seq=1 Ack=26102 Win=68096 Len=0 TSval=3471097696 TSecr=3234868973"
"170","7.162038423","10.0.0.3","10.0.0.7","TCP","10202","45246  >  5202 [PSH, ACK] Seq=36238 Ack=1 Win=42496 Len=10136 TSval=3234869060 TSecr=3471097696"
"171","7.162043963","10.0.0.3","10.0.0.7","TCP","11650","45246  >  5202 [PSH, ACK] Seq=46374 Ack=1 Win=42496 Len=11584 TSval=3234869060 TSecr=3471097696"
"172","7.162836266","10.0.0.7","10.0.0.3","TCP","66","5202  >  45254 [ACK] Seq=1 Ack=36238 Win=93696 Len=0 TSval=3471097697 TSecr=3234868975"
"173","7.162870690","10.0.0.3","10.0.0.7","TCP","21786","45254  >  5202 [PSH, ACK] Seq=57958 Ack=1 Win=42496 Len=21720 TSval=3234869061 TSecr=3471097697"
"174","7.163671152","10.0.0.7","10.0.0.3","TCP","66","5202  >  45246 [ACK] Seq=1 Ack=36238 Win=93696 Len=0 TSval=3471097698 TSecr=3234868977"
"175","7.163687868","10.0.0.3","10.0.0.7","TCP","21786","45246  >  5202 [PSH, ACK] Seq=57958 Ack=1 Win=42496 Len=21720 TSval=3234869062 TSecr=3471097698"
"176","7.167438405","10.0.0.7","10.0.0.3","TCP","66","5202  >  45264 [ACK] Seq=1 Ack=26102 Win=68096 Len=0 TSval=3471097701 TSecr=3234868980"
"177","7.167451474","10.0.0.3","10.0.0.7","TCP","10202","45264  >  5202 [PSH, ACK] Seq=36238 Ack=1 Win=42496 Len=10136 TSval=3234869065 TSecr=3471097701"
"178","7.167454467","10.0.0.3","10.0.0.7","TCP","11650","45264  >  5202 [PSH, ACK] Seq=46374 Ack=1 Win=42496 Len=11584 TSval=3234869065 TSecr=3471097701"
"179","7.170644407","10.0.0.7","10.0.0.3","TCP","66","5202  >  45264 [ACK] Seq=1 Ack=36238 Win=68096 Len=0 TSval=3471097705 TSecr=3234868982"
"180","7.170660797","10.0.0.3","10.0.0.7","TCP","21786","45264  >  5202 [PSH, ACK] Seq=57958 Ack=1 Win=42496 Len=21720 TSval=3234869069 TSecr=3471097705"
"181","7.171491351","10.0.0.7","10.0.0.3","TCP","66","5202  >  45266 [ACK] Seq=1 Ack=26102 Win=68096 Len=0 TSval=3471097705 TSecr=3234868984"
"182","7.171505702","10.0.0.3","10.0.0.7","TCP","10202","45266  >  5202 [PSH, ACK] Seq=36238 Ack=1 Win=42496 Len=10136 TSval=3234869069 TSecr=3471097705"
"183","7.171508289","10.0.0.3","10.0.0.7","TCP","11650","45266  >  5202 [PSH, ACK] Seq=46374 Ack=1 Win=42496 Len=11584 TSval=3234869069 TSecr=3471097705"
"184","7.172333022","10.0.0.7","10.0.0.3","TCP","66","5202  >  45266 [ACK] Seq=1 Ack=36238 Win=58880 Len=0 TSval=3471097706 TSecr=3234868987"
"185","7.172348794","10.0.0.3","10.0.0.7","TCP","21786","45266  >  5202 [PSH, ACK] Seq=57958 Ack=1 Win=42496 Len=21720 TSval=3234869070 TSecr=3471097706"
"186","7.176094686","10.0.0.7","10.0.0.3","TCP","66","5202  >  45270 [ACK] Seq=1 Ack=26102 Win=68096 Len=0 TSval=3471097710 TSecr=3234868989"
"187","7.176108386","10.0.0.3","10.0.0.7","TCP","10202","45270  >  5202 [PSH, ACK] Seq=36238 Ack=1 Win=42496 Len=10136 TSval=3234869074 TSecr=3471097710"
"188","7.176116899","10.0.0.3","10.0.0.7","TCP","11650","45270  >  5202 [PSH, ACK] Seq=46374 Ack=1 Win=42496 Len=11584 TSval=3234869074 TSecr=3471097710"
"189","7.176937345","10.0.0.7","10.0.0.3","TCP","66","5202  >  45270 [ACK] Seq=1 Ack=36238 Win=58880 Len=0 TSval=3471097711 TSecr=3234868991"
"190","7.176952525","10.0.0.3","10.0.0.7","TCP","21786","45270  >  5202 [PSH, ACK] Seq=57958 Ack=1 Win=42496 Len=21720 TSval=3234869075 TSecr=3471097711"
"191","7.177788168","10.0.0.7","10.0.0.3","TCP","66","5202  >  45280 [ACK] Seq=1 Ack=26102 Win=68096 Len=0 TSval=3471097712 TSecr=3234868993"
"192","7.177798316","10.0.0.3","10.0.0.7","TCP","10202","45280  >  5202 [PSH, ACK] Seq=36238 Ack=1 Win=42496 Len=10136 TSval=3234869076 TSecr=3471097712"
"193","7.177800660","10.0.0.3","10.0.0.7","TCP","11650","45280  >  5202 [PSH, ACK] Seq=46374 Ack=1 Win=42496 Len=11584 TSval=3234869076 TSecr=3471097712"
"194","7.178634874","10.0.0.7","10.0.0.3","TCP","66","5202  >  45280 [ACK] Seq=1 Ack=36238 Win=93696 Len=0 TSval=3471097713 TSecr=3234868996"
"195","7.178649095","10.0.0.3","10.0.0.7","TCP","21786","45280  >  5202 [PSH, ACK] Seq=57958 Ack=1 Win=42496 Len=21720 TSval=3234869077 TSecr=3471097713"
"196","7.182392854","10.0.0.7","10.0.0.3","TCP","66","5202  >  45290 [ACK] Seq=1 Ack=26102 Win=68096 Len=0 TSval=3471097716 TSecr=3234868996"
"197","7.182403648","10.0.0.3","10.0.0.7","TCP","10202","45290  >  5202 [PSH, ACK] Seq=36238 Ack=1 Win=42496 Len=10136 TSval=3234869080 TSecr=3471097716"
"198","7.182406181","10.0.0.3","10.0.0.7","TCP","11650","45290  >  5202 [PSH, ACK] Seq=46374 Ack=1 Win=42496 Len=11584 TSval=3234869080 TSecr=3471097716"
"199","7.186145936","10.0.0.7","10.0.0.3","TCP","66","5202  >  45296 [ACK] Seq=1 Ack=26102 Win=68096 Len=0 TSval=3471097720 TSecr=3234868999"
"200","7.186156683","10.0.0.3","10.0.0.7","TCP","10202","45296  >  5202 [PSH, ACK] Seq=36238 Ack=1 Win=42496 Len=10136 TSval=3234869084 TSecr=3471097720"
"201","7.186161441","10.0.0.3","10.0.0.7","TCP","11650","45296  >  5202 [PSH, ACK] Seq=46374 Ack=1 Win=42496 Len=11584 TSval=3234869084 TSecr=3471097720"
"202","7.186991577","10.0.0.7","10.0.0.3","TCP","66","5202  >  45290 [ACK] Seq=1 Ack=36238 Win=93696 Len=0 TSval=3471097721 TSecr=3234869001"
"203","7.187005762","10.0.0.3","10.0.0.7","TCP","21786","45290  >  5202 [PSH, ACK] Seq=57958 Ack=1 Win=42496 Len=21720 TSval=3234869085 TSecr=3471097721"
"204","7.187834131","10.0.0.7","10.0.0.3","TCP","66","5202  >  45296 [ACK] Seq=1 Ack=36238 Win=93696 Len=0 TSval=3471097722 TSecr=3234869006"
"205","7.187844935","10.0.0.3","10.0.0.7","TCP","21786","45296  >  5202 [PSH, ACK] Seq=57958 Ack=1 Win=42496 Len=21720 TSval=3234869086 TSecr=3471097722"
"206","7.260690300","10.0.0.7","10.0.0.3","TCP","66","5202  >  45224 [ACK] Seq=1 Ack=57958 Win=137216 Len=0 TSval=3471097795 TSecr=3234869041"
"207","7.260700094","10.0.0.3","10.0.0.7","TCP","7306","45224  >  5202 [PSH, ACK] Seq=79678 Ack=1 Win=42496 Len=7240 TSval=3234869159 TSecr=3471097795"
"208","7.260703897","10.0.0.3","10.0.0.7","TCP","20338","45224  >  5202 [PSH, ACK] Seq=86918 Ack=1 Win=42496 Len=20272 TSval=3234869159 TSecr=3471097795"
"209","7.260929115","10.0.0.7","10.0.0.3","TCP","66","5202  >  45224 [ACK] Seq=1 Ack=79678 Win=152576 Len=0 TSval=3471097795 TSecr=3234869041"
"210","7.260939571","10.0.0.3","10.0.0.7","TCP","46402","45224  >  5202 [PSH, ACK] Seq=107190 Ack=1 Win=42496 Len=46336 TSval=3234869159 TSecr=3471097795"
"211","7.289399162","10.0.0.7","10.0.0.3","TCP","66","5202  >  45234 [ACK] Seq=1 Ack=46374 Win=114176 Len=0 TSval=3471097823 TSecr=3234869051"
"212","7.290239632","10.0.0.7","10.0.0.3","TCP","66","5202  >  45234 [ACK] Seq=1 Ack=57958 Win=137216 Len=0 TSval=3471097824 TSecr=3234869051"
"213","7.290246557","10.0.0.3","10.0.0.7","TCP","7306","45234  >  5202 [PSH, ACK] Seq=79678 Ack=1 Win=42496 Len=7240 TSval=3234869188 TSecr=3471097824"
"214","7.290252552","10.0.0.3","10.0.0.7","TCP","27578","45234  >  5202 [PSH, ACK] Seq=86918 Ack=1 Win=42496 Len=27512 TSval=3234869188 TSecr=3471097824"
"215","7.291209467","10.0.0.7","10.0.0.3","TCP","66","5202  >  45234 [ACK] Seq=1 Ack=79678 Win=174080 Len=0 TSval=3471097825 TSecr=3234869054"
"216","7.291218788","10.0.0.3","10.0.0.7","TCP","36266","45234  >  5202 [PSH, ACK] Seq=114430 Ack=1 Win=42496 Len=36200 TSval=3234869189 TSecr=3471097825"
"217","7.298483477","10.0.0.7","10.0.0.3","TCP","66","5202  >  45254 [ACK] Seq=1 Ack=46374 Win=114176 Len=0 TSval=3471097832 TSecr=3234869056"
"218","7.299322071","10.0.0.7","10.0.0.3","TCP","66","5202  >  45254 [ACK] Seq=1 Ack=57958 Win=137216 Len=0 TSval=3471097833 TSecr=3234869056"
"219","7.299331103","10.0.0.3","10.0.0.7","TCP","7306","45254  >  5202 [PSH, ACK] Seq=79678 Ack=1 Win=42496 Len=7240 TSval=3234869197 TSecr=3471097833"
"220","7.299335679","10.0.0.3","10.0.0.7","TCP","27578","45254  >  5202 [PSH, ACK] Seq=86918 Ack=1 Win=42496 Len=27512 TSval=3234869197 TSecr=3471097833"
"221","7.305746541","10.0.0.7","10.0.0.3","TCP","66","5202  >  45246 [ACK] Seq=1 Ack=46374 Win=114176 Len=0 TSval=3471097840 TSecr=3234869060"
"222","7.306590470","10.0.0.7","10.0.0.3","TCP","66","5202  >  45246 [ACK] Seq=1 Ack=57958 Win=137216 Len=0 TSval=3471097841 TSecr=3234869060"
"223","7.306599222","10.0.0.3","10.0.0.7","TCP","7306","45246  >  5202 [PSH, ACK] Seq=79678 Ack=1 Win=42496 Len=7240 TSval=3234869205 TSecr=3471097841"
"224","7.306606824","10.0.0.3","10.0.0.7","TCP","27578","45246  >  5202 [PSH, ACK] Seq=86918 Ack=1 Win=42496 Len=27512 TSval=3234869205 TSecr=3471097841"
"225","7.307563783","10.0.0.7","10.0.0.3","TCP","66","5202  >  45254 [ACK] Seq=1 Ack=79678 Win=174080 Len=0 TSval=3471097842 TSecr=3234869061"
"226","7.307573809","10.0.0.3","10.0.0.7","TCP","36266","45254  >  5202 [PSH, ACK] Seq=114430 Ack=1 Win=42496 Len=36200 TSval=3234869206 TSecr=3471097842"
"227","7.314829110","10.0.0.7","10.0.0.3","TCP","66","5202  >  45246 [ACK] Seq=1 Ack=79678 Win=174080 Len=0 TSval=3471097849 TSecr=3234869062"
"228","7.314838575","10.0.0.3","10.0.0.7","TCP","36266","45246  >  5202 [PSH, ACK] Seq=114430 Ack=1 Win=42496 Len=36200 TSval=3234869213 TSecr=3471097849"
"229","7.316645950","10.0.0.7","10.0.0.3","TCP","66","5202  >  45264 [ACK] Seq=1 Ack=46374 Win=68096 Len=0 TSval=3471097851 TSecr=3234869065"
"230","7.317491315","10.0.0.7","10.0.0.3","TCP","66","5202  >  45264 [ACK] Seq=1 Ack=57958 Win=57856 Len=0 TSval=3471097851 TSecr=3234869065"
"231","7.317503261","10.0.0.3","10.0.0.7","TCP","7306","45264  >  5202 [PSH, ACK] Seq=79678 Ack=1 Win=42496 Len=7240 TSval=3234869215 TSecr=3471097851"
"232","7.317508062","10.0.0.3","10.0.0.7","TCP","27578","45264  >  5202 [PSH, ACK] Seq=86918 Ack=1 Win=42496 Len=27512 TSval=3234869215 TSecr=3471097851"
"233","7.318517750","10.0.0.7","10.0.0.3","TCP","66","5202  >  45264 [ACK] Seq=1 Ack=79678 Win=73216 Len=0 TSval=3471097853 TSecr=3234869069"
"234","7.318549512","10.0.0.3","10.0.0.7","TCP","36266","45264  >  5202 [PSH, ACK] Seq=114430 Ack=1 Win=42496 Len=36200 TSval=3234869217 TSecr=3471097853"
"235","7.321369275","10.0.0.7","10.0.0.3","TCP","66","5202  >  45266 [ACK] Seq=1 Ack=46374 Win=93696 Len=0 TSval=3471097855 TSecr=3234869069"
"236","7.322216588","10.0.0.7","10.0.0.3","TCP","66","5202  >  45266 [ACK] Seq=1 Ack=57958 Win=116736 Len=0 TSval=3471097856 TSecr=3234869069"
"237","7.322225781","10.0.0.3","10.0.0.7","TCP","7306","45266  >  5202 [PSH, ACK] Seq=79678 Ack=1 Win=42496 Len=7240 TSval=3234869220 TSecr=3471097856"
"238","7.322233304","10.0.0.3","10.0.0.7","TCP","27578","45266  >  5202 [PSH, ACK] Seq=86918 Ack=1 Win=42496 Len=27512 TSval=3234869220 TSecr=3471097856"
"239","7.326222655","10.0.0.7","10.0.0.3","TCP","66","5202  >  45266 [ACK] Seq=1 Ack=79678 Win=160256 Len=0 TSval=3471097860 TSecr=3234869070"
"240","7.326231926","10.0.0.3","10.0.0.7","TCP","36266","45266  >  5202 [PSH, ACK] Seq=114430 Ack=1 Win=42496 Len=36200 TSval=3234869224 TSecr=3471097860"
"241","7.329681329","10.0.0.7","10.0.0.3","TCP","66","5202  >  45270 [ACK] Seq=1 Ack=46374 Win=93696 Len=0 TSval=3471097864 TSecr=3234869074"
"242","7.330526087","10.0.0.7","10.0.0.3","TCP","66","5202  >  45270 [ACK] Seq=1 Ack=57958 Win=116736 Len=0 TSval=3471097865 TSecr=3234869074"
"243","7.330534775","10.0.0.3","10.0.0.7","TCP","7306","45270  >  5202 [PSH, ACK] Seq=79678 Ack=1 Win=42496 Len=7240 TSval=3234869229 TSecr=3471097865"
"244","7.330541485","10.0.0.3","10.0.0.7","TCP","27578","45270  >  5202 [PSH, ACK] Seq=86918 Ack=1 Win=42496 Len=27512 TSval=3234869229 TSecr=3471097865"
"245","7.331494554","10.0.0.7","10.0.0.3","TCP","66","5202  >  45270 [ACK] Seq=1 Ack=79678 Win=160256 Len=0 TSval=3471097865 TSecr=3234869075"
"246","7.331505205","10.0.0.3","10.0.0.7","TCP","36266","45270  >  5202 [PSH, ACK] Seq=114430 Ack=1 Win=42496 Len=36200 TSval=3234869229 TSecr=3471097865"
"247","7.336367949","10.0.0.7","10.0.0.3","TCP","66","5202  >  45280 [ACK] Seq=1 Ack=46374 Win=114176 Len=0 TSval=3471097870 TSecr=3234869076"
"248","7.338292960","10.0.0.7","10.0.0.3","TCP","66","5202  >  45280 [ACK] Seq=1 Ack=57958 Win=137216 Len=0 TSval=3471097872 TSecr=3234869076"
"249","7.338308878","10.0.0.3","10.0.0.7","TCP","7306","45280  >  5202 [PSH, ACK] Seq=79678 Ack=1 Win=42496 Len=7240 TSval=3234869236 TSecr=3471097872"
"250","7.338314484","10.0.0.3","10.0.0.7","TCP","27578","45280  >  5202 [PSH, ACK] Seq=86918 Ack=1 Win=42496 Len=27512 TSval=3234869236 TSecr=3471097872"
"251","7.339260877","10.0.0.7","10.0.0.3","TCP","66","5202  >  45280 [ACK] Seq=1 Ack=79678 Win=174080 Len=0 TSval=3471097873 TSecr=3234869077"
"252","7.339276337","10.0.0.3","10.0.0.7","TCP","36266","45280  >  5202 [PSH, ACK] Seq=114430 Ack=1 Win=42496 Len=36200 TSval=3234869237 TSecr=3471097873"
"253","7.341318397","10.0.0.7","10.0.0.3","TCP","66","5202  >  45290 [ACK] Seq=1 Ack=46374 Win=114176 Len=0 TSval=3471097875 TSecr=3234869080"
"254","7.342166425","10.0.0.7","10.0.0.3","TCP","66","5202  >  45290 [ACK] Seq=1 Ack=57958 Win=137216 Len=0 TSval=3471097876 TSecr=3234869080"
"255","7.342175673","10.0.0.3","10.0.0.7","TCP","7306","45290  >  5202 [PSH, ACK] Seq=79678 Ack=1 Win=42496 Len=7240 TSval=3234869240 TSecr=3471097876"
"256","7.342184160","10.0.0.3","10.0.0.7","TCP","27578","45290  >  5202 [PSH, ACK] Seq=86918 Ack=1 Win=42496 Len=27512 TSval=3234869240 TSecr=3471097876"
"257","7.343135711","10.0.0.7","10.0.0.3","TCP","66","5202  >  45296 [ACK] Seq=1 Ack=46374 Win=114176 Len=0 TSval=3471097877 TSecr=3234869084"
"258","7.343980423","10.0.0.7","10.0.0.3","TCP","66","5202  >  45296 [ACK] Seq=1 Ack=57958 Win=137216 Len=0 TSval=3471097878 TSecr=3234869084"
"259","7.343986968","10.0.0.3","10.0.0.7","TCP","7306","45296  >  5202 [PSH, ACK] Seq=79678 Ack=1 Win=42496 Len=7240 TSval=3234869242 TSecr=3471097878"
"260","7.343991188","10.0.0.3","10.0.0.7","TCP","27578","45296  >  5202 [PSH, ACK] Seq=86918 Ack=1 Win=42496 Len=27512 TSval=3234869242 TSecr=3471097878"
"261","7.344949644","10.0.0.7","10.0.0.3","TCP","66","5202  >  45290 [ACK] Seq=1 Ack=79678 Win=174080 Len=0 TSval=3471097879 TSecr=3234869085"
"262","7.344958071","10.0.0.3","10.0.0.7","TCP","36266","45290  >  5202 [PSH, ACK] Seq=114430 Ack=1 Win=42496 Len=36200 TSval=3234869243 TSecr=3471097879"
"263","7.346770265","10.0.0.7","10.0.0.3","TCP","66","5202  >  45296 [ACK] Seq=1 Ack=79678 Win=174080 Len=0 TSval=3471097881 TSecr=3234869086"
"264","7.346781134","10.0.0.3","10.0.0.7","TCP","36266","45296  >  5202 [PSH, ACK] Seq=114430 Ack=1 Win=42496 Len=36200 TSval=3234869245 TSecr=3471097881"
"265","7.451149609","10.0.0.7","10.0.0.3","TCP","66","5202  >  45224 [ACK] Seq=1 Ack=86918 Win=165376 Len=0 TSval=3471097985 TSecr=3234869159"
"266","7.451746867","10.0.0.7","10.0.0.3","TCP","66","5202  >  45224 [ACK] Seq=1 Ack=107190 Win=147456 Len=0 TSval=3471097986 TSecr=3234869159"
"267","7.451757062","10.0.0.3","10.0.0.7","TCP","20338","45224  >  5202 [PSH, ACK] Seq=153526 Ack=1 Win=42496 Len=20272 TSval=3234869350 TSecr=3471097986"
"268","7.453442162","10.0.0.7","10.0.0.3","TCP","66","5202  >  45224 [ACK] Seq=1 Ack=153526 Win=106496 Len=0 TSval=3471097987 TSecr=3234869159"
"269","7.453450859","10.0.0.3","10.0.0.7","TCP","26130","45224  >  5202 [PSH, ACK] Seq=173798 Ack=1 Win=42496 Len=26064 TSval=3234869351 TSecr=3471097987"
"270","7.453457106","10.0.0.3","10.0.0.7","TCP","46402","45224  >  5202 [PSH, ACK] Seq=199862 Ack=1 Win=42496 Len=46336 TSval=3234869351 TSecr=3471097987"
"271","7.500265861","10.0.0.7","10.0.0.3","TCP","66","5202  >  45234 [ACK] Seq=1 Ack=86918 Win=187392 Len=0 TSval=3471098034 TSecr=3234869188"
"272","7.500865605","10.0.0.7","10.0.0.3","TCP","66","5202  >  45234 [ACK] Seq=1 Ack=114430 Win=162816 Len=0 TSval=3471098035 TSecr=3234869188"
"273","7.500876207","10.0.0.3","10.0.0.7","TCP","23234","45234  >  5202 [PSH, ACK] Seq=150630 Ack=1 Win=42496 Len=23168 TSval=3234869399 TSecr=3471098035"
