"No.","Time","Source","Destination","Protocol","Length","Info"
"1","0.000000000","9a:f8:0a:1a:58:6c","Broadcast","ARP","42","Who has 10.0.0.7? Tell 10.0.0.1"
"2","0.000002078","12:14:02:f9:2f:85","Broadcast","ARP","42","Who has 10.0.0.7? Tell 10.0.0.2"
"3","0.000531367","a6:7f:94:2f:f1:ba","12:14:02:f9:2f:85","ARP","42","10.0.0.7 is at a6:7f:94:2f:f1:ba"
"4","0.000535723","10.0.0.2","10.0.0.7","TCP","74","33654  >  5202 [SYN] Seq=0 Win=42340 Len=0 MSS=1460 SACK_PERM TSval=3126386012 TSecr=0 WS=512"
"5","0.000662817","10.0.0.7","10.0.0.2","TCP","74","5202  >  33654 [SYN, ACK] Seq=0 Ack=1 Win=43440 Len=0 MSS=1460 SACK_PERM TSval=2758836573 TSecr=3126386012 WS=512"
"6","0.000675175","10.0.0.2","10.0.0.7","TCP","66","33654  >  5202 [ACK] Seq=1 Ack=1 Win=42496 Len=0 TSval=3126386013 TSecr=2758836573"
"7","0.000701316","10.0.0.2","10.0.0.7","TCP","103","33654  >  5202 [PSH, ACK] Seq=1 Ack=1 Win=42496 Len=37 TSval=3126386013 TSecr=2758836573"
"8","0.000724795","10.0.0.7","10.0.0.2","TCP","66","5202  >  33654 [ACK] Seq=1 Ack=38 Win=43520 Len=0 TSval=2758836573 TSecr=3126386013"
"9","0.000781021","10.0.0.7","10.0.0.2","TCP","67","5202  >  33654 [PSH, ACK] Seq=1 Ack=38 Win=43520 Len=1 TSval=2758836573 TSecr=3126386013"
"10","0.000790066","10.0.0.2","10.0.0.7","TCP","66","33654  >  5202 [ACK] Seq=38 Ack=2 Win=42496 Len=0 TSval=3126386013 TSecr=2758836573"
"11","0.000815264","10.0.0.2","10.0.0.7","TCP","70","33654  >  5202 [PSH, ACK] Seq=38 Ack=2 Win=42496 Len=4 TSval=3126386013 TSecr=2758836573"
"12","0.000829004","10.0.0.2","10.0.0.7","TCP","238","33654  >  5202 [PSH, ACK] Seq=42 Ack=2 Win=42496 Len=172 TSval=3126386013 TSecr=2758836573"
"13","0.000906319","10.0.0.7","10.0.0.2","TCP","66","5202  >  33654 [ACK] Seq=2 Ack=214 Win=43520 Len=0 TSval=2758836573 TSecr=3126386013"
"14","0.000958590","10.0.0.7","10.0.0.2","TCP","67","5202  >  33654 [PSH, ACK] Seq=2 Ack=214 Win=43520 Len=1 TSval=2758836573 TSecr=3126386013"
"15","0.001001123","10.0.0.2","10.0.0.7","TCP","74","33658  >  5202 [SYN] Seq=0 Win=42340 Len=0 MSS=1460 SACK_PERM TSval=3126386013 TSecr=0 WS=512"
"16","0.001033434","10.0.0.7","10.0.0.2","TCP","74","5202  >  33658 [SYN, ACK] Seq=0 Ack=1 Win=43440 Len=0 MSS=1460 SACK_PERM TSval=2758836573 TSecr=3126386013 WS=512"
"17","0.001043753","10.0.0.2","10.0.0.7","TCP","66","33658  >  5202 [ACK] Seq=1 Ack=1 Win=42496 Len=0 TSval=3126386013 TSecr=2758836573"
"18","0.001063882","10.0.0.2","10.0.0.7","TCP","103","33658  >  5202 [PSH, ACK] Seq=1 Ack=1 Win=42496 Len=37 TSval=3126386013 TSecr=2758836573"
"19","0.001075676","10.0.0.7","10.0.0.2","TCP","66","5202  >  33658 [ACK] Seq=1 Ack=38 Win=43520 Len=0 TSval=2758836573 TSecr=3126386013"
"20","0.001897284","10.0.0.2","10.0.0.7","TCP","74","33664  >  5202 [SYN] Seq=0 Win=42340 Len=0 MSS=1460 SACK_PERM TSval=3126386014 TSecr=0 WS=512"
"21","0.001927945","10.0.0.7","10.0.0.2","TCP","74","5202  >  33664 [SYN, ACK] Seq=0 Ack=1 Win=43440 Len=0 MSS=1460 SACK_PERM TSval=2758836574 TSecr=3126386014 WS=512"
"22","0.001941955","10.0.0.2","10.0.0.7","TCP","66","33664  >  5202 [ACK] Seq=1 Ack=1 Win=42496 Len=0 TSval=3126386014 TSecr=2758836574"
"23","0.001969035","10.0.0.2","10.0.0.7","TCP","103","33664  >  5202 [PSH, ACK] Seq=1 Ack=1 Win=42496 Len=37 TSval=3126386014 TSecr=2758836574"
"24","0.001986460","10.0.0.7","10.0.0.2","TCP","66","5202  >  33664 [ACK] Seq=1 Ack=38 Win=43520 Len=0 TSval=2758836574 TSecr=3126386014"
"25","0.002941160","10.0.0.2","10.0.0.7","TCP","74","33666  >  5202 [SYN] Seq=0 Win=42340 Len=0 MSS=1460 SACK_PERM TSval=3126386015 TSecr=0 WS=512"
"26","0.002968704","10.0.0.7","10.0.0.2","TCP","74","5202  >  33666 [SYN, ACK] Seq=0 Ack=1 Win=43440 Len=0 MSS=1460 SACK_PERM TSval=2758836575 TSecr=3126386015 WS=512"
"27","0.002978400","10.0.0.2","10.0.0.7","TCP","66","33666  >  5202 [ACK] Seq=1 Ack=1 Win=42496 Len=0 TSval=3126386015 TSecr=2758836575"
"28","0.002997755","10.0.0.2","10.0.0.7","TCP","103","33666  >  5202 [PSH, ACK] Seq=1 Ack=1 Win=42496 Len=37 TSval=3126386015 TSecr=2758836575"
"29","0.003010753","10.0.0.7","10.0.0.2","TCP","66","5202  >  33666 [ACK] Seq=1 Ack=38 Win=43520 Len=0 TSval=2758836575 TSecr=3126386015"
"30","0.004249890","10.0.0.2","10.0.0.7","TCP","74","33668  >  5202 [SYN] Seq=0 Win=42340 Len=0 MSS=1460 SACK_PERM TSval=3126386016 TSecr=0 WS=512"
"31","0.004320848","10.0.0.7","10.0.0.2","TCP","74","5202  >  33668 [SYN, ACK] Seq=0 Ack=1 Win=43440 Len=0 MSS=1460 SACK_PERM TSval=2758836576 TSecr=3126386016 WS=512"
"32","0.004348712","10.0.0.2","10.0.0.7","TCP","66","33668  >  5202 [ACK] Seq=1 Ack=1 Win=42496 Len=0 TSval=3126386016 TSecr=2758836576"
"33","0.004525913","10.0.0.2","10.0.0.7","TCP","103","33668  >  5202 [PSH, ACK] Seq=1 Ack=1 Win=42496 Len=37 TSval=3126386016 TSecr=2758836576"
"34","0.004563078","10.0.0.7","10.0.0.2","TCP","66","5202  >  33668 [ACK] Seq=1 Ack=38 Win=43520 Len=0 TSval=2758836576 TSecr=3126386016"
"35","0.005904889","10.0.0.2","10.0.0.7","TCP","74","33682  >  5202 [SYN] Seq=0 Win=42340 Len=0 MSS=1460 SACK_PERM TSval=3126386018 TSecr=0 WS=512"
"36","0.005945906","10.0.0.7","10.0.0.2","TCP","74","5202  >  33682 [SYN, ACK] Seq=0 Ack=1 Win=43440 Len=0 MSS=1460 SACK_PERM TSval=2758836578 TSecr=3126386018 WS=512"
"37","0.005963936","10.0.0.2","10.0.0.7","TCP","66","33682  >  5202 [ACK] Seq=1 Ack=1 Win=42496 Len=0 TSval=3126386018 TSecr=2758836578"
"38","0.005996826","10.0.0.2","10.0.0.7","TCP","103","33682  >  5202 [PSH, ACK] Seq=1 Ack=1 Win=42496 Len=37 TSval=3126386018 TSecr=2758836578"
"39","0.006015638","10.0.0.7","10.0.0.2","TCP","66","5202  >  33682 [ACK] Seq=1 Ack=38 Win=43520 Len=0 TSval=2758836578 TSecr=3126386018"
"40","0.007140448","10.0.0.2","10.0.0.7","TCP","74","33698  >  5202 [SYN] Seq=0 Win=42340 Len=0 MSS=1460 SACK_PERM TSval=3126386019 TSecr=0 WS=512"
"41","0.007171800","10.0.0.7","10.0.0.2","TCP","74","5202  >  33698 [SYN, ACK] Seq=0 Ack=1 Win=43440 Len=0 MSS=1460 SACK_PERM TSval=2758836579 TSecr=3126386019 WS=512"
"42","0.007183324","10.0.0.2","10.0.0.7","TCP","66","33698  >  5202 [ACK] Seq=1 Ack=1 Win=42496 Len=0 TSval=3126386019 TSecr=2758836579"
"43","0.007207209","10.0.0.2","10.0.0.7","TCP","103","33698  >  5202 [PSH, ACK] Seq=1 Ack=1 Win=42496 Len=37 TSval=3126386019 TSecr=2758836579"
"44","0.007225686","10.0.0.7","10.0.0.2","TCP","66","5202  >  33698 [ACK] Seq=1 Ack=38 Win=43520 Len=0 TSval=2758836579 TSecr=3126386019"
"45","0.008296707","10.0.0.2","10.0.0.7","TCP","74","33714  >  5202 [SYN] Seq=0 Win=42340 Len=0 MSS=1460 SACK_PERM TSval=3126386020 TSecr=0 WS=512"
"46","0.008336731","10.0.0.7","10.0.0.2","TCP","74","5202  >  33714 [SYN, ACK] Seq=0 Ack=1 Win=43440 Len=0 MSS=1460 SACK_PERM TSval=2758836580 TSecr=3126386020 WS=512"
"47","0.008349966","10.0.0.2","10.0.0.7","TCP","66","33714  >  5202 [ACK] Seq=1 Ack=1 Win=42496 Len=0 TSval=3126386020 TSecr=2758836580"
"48","0.008372942","10.0.0.2","10.0.0.7","TCP","103","33714  >  5202 [PSH, ACK] Seq=1 Ack=1 Win=42496 Len=37 TSval=3126386020 TSecr=2758836580"
"49","0.008389614","10.0.0.7","10.0.0.2","TCP","66","5202  >  33714 [ACK] Seq=1 Ack=38 Win=43520 Len=0 TSval=2758836580 TSecr=3126386020"
"50","0.009447052","10.0.0.2","10.0.0.7","TCP","74","33724  >  5202 [SYN] Seq=0 Win=42340 Len=0 MSS=1460 SACK_PERM TSval=3126386021 TSecr=0 WS=512"
"51","0.009475944","10.0.0.7","10.0.0.2","TCP","74","5202  >  33724 [SYN, ACK] Seq=0 Ack=1 Win=43440 Len=0 MSS=1460 SACK_PERM TSval=2758836581 TSecr=3126386021 WS=512"
"52","0.009486017","10.0.0.2","10.0.0.7","TCP","66","33724  >  5202 [ACK] Seq=1 Ack=1 Win=42496 Len=0 TSval=3126386021 TSecr=2758836581"
"53","0.009505941","10.0.0.2","10.0.0.7","TCP","103","33724  >  5202 [PSH, ACK] Seq=1 Ack=1 Win=42496 Len=37 TSval=3126386021 TSecr=2758836581"
"54","0.009524219","10.0.0.7","10.0.0.2","TCP","66","5202  >  33724 [ACK] Seq=1 Ack=38 Win=43520 Len=0 TSval=2758836581 TSecr=3126386021"
"55","0.010439028","10.0.0.2","10.0.0.7","TCP","74","33738  >  5202 [SYN] Seq=0 Win=42340 Len=0 MSS=1460 SACK_PERM TSval=3126386022 TSecr=0 WS=512"
"56","0.010471140","10.0.0.7","10.0.0.2","TCP","74","5202  >  33738 [SYN, ACK] Seq=0 Ack=1 Win=43440 Len=0 MSS=1460 SACK_PERM TSval=2758836582 TSecr=3126386022 WS=512"
"57","0.010482624","10.0.0.2","10.0.0.7","TCP","66","33738  >  5202 [ACK] Seq=1 Ack=1 Win=42496 Len=0 TSval=3126386022 TSecr=2758836582"
"58","0.010504609","10.0.0.2","10.0.0.7","TCP","103","33738  >  5202 [PSH, ACK] Seq=1 Ack=1 Win=42496 Len=37 TSval=3126386022 TSecr=2758836582"
"59","0.010522203","10.0.0.7","10.0.0.2","TCP","66","5202  >  33738 [ACK] Seq=1 Ack=38 Win=43520 Len=0 TSval=2758836582 TSecr=3126386022"
"60","0.011599311","10.0.0.2","10.0.0.7","TCP","74","33748  >  5202 [SYN] Seq=0 Win=42340 Len=0 MSS=1460 SACK_PERM TSval=3126386023 TSecr=0 WS=512"
"61","0.011639212","10.0.0.7","10.0.0.2","TCP","74","5202  >  33748 [SYN, ACK] Seq=0 Ack=1 Win=43440 Len=0 MSS=1460 SACK_PERM TSval=2758836584 TSecr=3126386023 WS=512"
"62","0.011650357","10.0.0.2","10.0.0.7","TCP","66","33748  >  5202 [ACK] Seq=1 Ack=1 Win=42496 Len=0 TSval=3126386024 TSecr=2758836584"
"63","0.011674105","10.0.0.2","10.0.0.7","TCP","103","33748  >  5202 [PSH, ACK] Seq=1 Ack=1 Win=42496 Len=37 TSval=3126386024 TSecr=2758836584"
"64","0.011722673","10.0.0.7","10.0.0.2","TCP","66","5202  >  33748 [ACK] Seq=1 Ack=38 Win=43520 Len=0 TSval=2758836584 TSecr=3126386024"
"65","0.012822416","10.0.0.7","10.0.0.2","TCP","67","5202  >  33654 [PSH, ACK] Seq=3 Ack=214 Win=43520 Len=1 TSval=2758836585 TSecr=3126386013"
"66","0.012865546","10.0.0.7","10.0.0.2","TCP","67","5202  >  33654 [PSH, ACK] Seq=4 Ack=214 Win=43520 Len=1 TSval=2758836585 TSecr=3126386013"
"67","0.012883044","10.0.0.2","10.0.0.7","TCP","66","33654  >  5202 [ACK] Seq=214 Ack=4 Win=42496 Len=0 TSval=3126386025 TSecr=2758836573"
"68","0.013145388","10.0.0.2","10.0.0.7","TCP","7306","33658  >  5202 [PSH, ACK] Seq=38 Ack=1 Win=42496 Len=7240 TSval=3126386025 TSecr=2758836573"
"69","0.013155484","10.0.0.2","10.0.0.7","TCP","7306","33658  >  5202 [PSH, ACK] Seq=7278 Ack=1 Win=42496 Len=7240 TSval=3126386025 TSecr=2758836573"
"70","0.013158548","10.0.0.2","10.0.0.7","TCP","7306","33664  >  5202 [PSH, ACK] Seq=38 Ack=1 Win=42496 Len=7240 TSval=3126386025 TSecr=2758836574"
"71","0.013188279","10.0.0.2","10.0.0.7","TCP","7306","33664  >  5202 [PSH, ACK] Seq=7278 Ack=1 Win=42496 Len=7240 TSval=3126386025 TSecr=2758836574"
"72","0.013242356","10.0.0.2","10.0.0.7","TCP","7306","33666  >  5202 [PSH, ACK] Seq=38 Ack=1 Win=42496 Len=7240 TSval=3126386025 TSecr=2758836575"
"73","0.013269170","10.0.0.2","10.0.0.7","TCP","7306","33666  >  5202 [PSH, ACK] Seq=7278 Ack=1 Win=42496 Len=7240 TSval=3126386025 TSecr=2758836575"
"74","0.013311747","10.0.0.2","10.0.0.7","TCP","7306","33668  >  5202 [PSH, ACK] Seq=38 Ack=1 Win=42496 Len=7240 TSval=3126386025 TSecr=2758836576"
"75","0.013321764","10.0.0.2","10.0.0.7","TCP","7306","33668  >  5202 [PSH, ACK] Seq=7278 Ack=1 Win=42496 Len=7240 TSval=3126386025 TSecr=2758836576"
"76","0.013403637","10.0.0.2","10.0.0.7","TCP","7306","33682  >  5202 [PSH, ACK] Seq=38 Ack=1 Win=42496 Len=7240 TSval=3126386025 TSecr=2758836578"
"77","0.013431077","10.0.0.2","10.0.0.7","TCP","7306","33682  >  5202 [PSH, ACK] Seq=7278 Ack=1 Win=42496 Len=7240 TSval=3126386025 TSecr=2758836578"
"78","0.013463878","10.0.0.2","10.0.0.7","TCP","7306","33698  >  5202 [PSH, ACK] Seq=38 Ack=1 Win=42496 Len=7240 TSval=3126386025 TSecr=2758836579"
"79","0.013485311","10.0.0.2","10.0.0.7","TCP","7306","33698  >  5202 [PSH, ACK] Seq=7278 Ack=1 Win=42496 Len=7240 TSval=3126386025 TSecr=2758836579"
"80","0.013496323","10.0.0.2","10.0.0.7","TCP","7306","33714  >  5202 [PSH, ACK] Seq=38 Ack=1 Win=42496 Len=7240 TSval=3126386025 TSecr=2758836580"
"81","0.013506950","10.0.0.2","10.0.0.7","TCP","7306","33714  >  5202 [PSH, ACK] Seq=7278 Ack=1 Win=42496 Len=7240 TSval=3126386025 TSecr=2758836580"
"82","0.013687435","10.0.0.2","10.0.0.7","TCP","7306","33738  >  5202 [PSH, ACK] Seq=38 Ack=1 Win=42496 Len=7240 TSval=3126386026 TSecr=2758836582"
"83","0.013697853","10.0.0.2","10.0.0.7","TCP","7306","33738  >  5202 [PSH, ACK] Seq=7278 Ack=1 Win=42496 Len=7240 TSval=3126386026 TSecr=2758836582"
"84","0.013711483","10.0.0.2","10.0.0.7","TCP","7306","33724  >  5202 [PSH, ACK] Seq=38 Ack=1 Win=42496 Len=7240 TSval=3126386026 TSecr=2758836581"
"85","0.013733677","10.0.0.2","10.0.0.7","TCP","7306","33724  >  5202 [PSH, ACK] Seq=7278 Ack=1 Win=42496 Len=7240 TSval=3126386026 TSecr=2758836581"
"86","0.013747075","10.0.0.2","10.0.0.7","TCP","7306","33748  >  5202 [PSH, ACK] Seq=38 Ack=1 Win=42496 Len=7240 TSval=3126386026 TSecr=2758836584"
"87","0.013757735","10.0.0.2","10.0.0.7","TCP","7306","33748  >  5202 [PSH, ACK] Seq=7278 Ack=1 Win=42496 Len=7240 TSval=3126386026 TSecr=2758836584"
"88","0.016622026","10.0.0.2","10.0.0.7","TCP","1514","33682  >  5202 [ACK] Seq=14518 Ack=1 Win=42496 Len=1448 TSval=3126386029 TSecr=2758836578"
"89","0.016624464","10.0.0.2","10.0.0.7","TCP","1514","33698  >  5202 [ACK] Seq=14518 Ack=1 Win=42496 Len=1448 TSval=3126386029 TSecr=2758836579"
"90","0.016652610","10.0.0.2","10.0.0.7","TCP","1514","33664  >  5202 [ACK] Seq=14518 Ack=1 Win=42496 Len=1448 TSval=3126386029 TSecr=2758836574"
"91","0.016654574","10.0.0.2","10.0.0.7","TCP","1514","33714  >  5202 [ACK] Seq=14518 Ack=1 Win=42496 Len=1448 TSval=3126386029 TSecr=2758836580"
"92","0.016656613","10.0.0.2","10.0.0.7","TCP","1514","33666  >  5202 [ACK] Seq=14518 Ack=1 Win=42496 Len=1448 TSval=3126386029 TSecr=2758836575"
"93","0.016658704","10.0.0.2","10.0.0.7","TCP","1514","33668  >  5202 [ACK] Seq=14518 Ack=1 Win=42496 Len=1448 TSval=3126386029 TSecr=2758836576"
"94","0.016660876","10.0.0.2","10.0.0.7","TCP","1514","33658  >  5202 [ACK] Seq=14518 Ack=1 Win=42496 Len=1448 TSval=3126386029 TSecr=2758836573"
"95","0.016664881","10.0.0.7","10.0.0.2","TCP","67","[TCP Keep-Alive] 5202  >  33654 [PSH, ACK] Seq=4 Ack=214 Win=43520 Len=1 TSval=2758836589 TSecr=3126386013"
"96","0.016671910","10.0.0.2","10.0.0.7","TCP","78","33654  >  5202 [ACK] Seq=214 Ack=5 Win=42496 Len=0 TSval=3126386029 TSecr=2758836589 SLE=4 SRE=5"
"97","0.017614559","10.0.0.2","10.0.0.7","TCP","1514","33738  >  5202 [ACK] Seq=14518 Ack=1 Win=42496 Len=1448 TSval=3126386030 TSecr=2758836582"
"98","0.017617668","10.0.0.2","10.0.0.7","TCP","1514","33748  >  5202 [ACK] Seq=14518 Ack=1 Win=42496 Len=1448 TSval=3126386030 TSecr=2758836584"
"99","0.017618489","10.0.0.2","10.0.0.7","TCP","1514","33724  >  5202 [ACK] Seq=14518 Ack=1 Win=42496 Len=1448 TSval=3126386030 TSecr=2758836581"
"100","0.031110536","10.0.0.7","10.0.0.2","TCP","66","5202  >  33658 [ACK] Seq=1 Ack=7278 Win=56832 Len=0 TSval=2758836603 TSecr=3126386025"
"101","0.031126071","10.0.0.2","10.0.0.7","TCP","10202","33658  >  5202 [PSH, ACK] Seq=15966 Ack=1 Win=42496 Len=10136 TSval=3126386043 TSecr=2758836603"
"102","0.032319579","10.0.0.7","10.0.0.2","TCP","66","5202  >  33658 [ACK] Seq=1 Ack=14518 Win=70656 Len=0 TSval=2758836604 TSecr=3126386025"
"103","0.032329956","10.0.0.2","10.0.0.7","TCP","10202","33658  >  5202 [PSH, ACK] Seq=26102 Ack=1 Win=42496 Len=10136 TSval=3126386044 TSecr=2758836604"
"104","0.033549975","10.0.0.7","10.0.0.2","TCP","66","5202  >  33664 [ACK] Seq=1 Ack=7278 Win=56832 Len=0 TSval=2758836605 TSecr=3126386025"
"105","0.033575862","10.0.0.2","10.0.0.7","TCP","10202","33664  >  5202 [PSH, ACK] Seq=15966 Ack=1 Win=42496 Len=10136 TSval=3126386045 TSecr=2758836605"
"106","0.037166091","10.0.0.7","10.0.0.2","TCP","66","5202  >  33664 [ACK] Seq=1 Ack=14518 Win=70656 Len=0 TSval=2758836609 TSecr=3126386025"
"107","0.037177135","10.0.0.2","10.0.0.7","TCP","10202","33664  >  5202 [PSH, ACK] Seq=26102 Ack=1 Win=42496 Len=10136 TSval=3126386049 TSecr=2758836609"
"108","0.038376056","10.0.0.7","10.0.0.2","TCP","66","5202  >  33666 [ACK] Seq=1 Ack=7278 Win=56832 Len=0 TSval=2758836610 TSecr=3126386025"
"109","0.038384791","10.0.0.2","10.0.0.7","TCP","10202","33666  >  5202 [PSH, ACK] Seq=15966 Ack=1 Win=42496 Len=10136 TSval=3126386050 TSecr=2758836610"
"110","0.039586544","10.0.0.7","10.0.0.2","TCP","66","5202  >  33666 [ACK] Seq=1 Ack=14518 Win=70656 Len=0 TSval=2758836611 TSecr=3126386025"
"111","0.039596362","10.0.0.2","10.0.0.7","TCP","10202","33666  >  5202 [PSH, ACK] Seq=26102 Ack=1 Win=42496 Len=10136 TSval=3126386051 TSecr=2758836611"
"112","0.043218268","10.0.0.7","10.0.0.2","TCP","66","5202  >  33668 [ACK] Seq=1 Ack=7278 Win=56832 Len=0 TSval=2758836615 TSecr=3126386025"
"113","0.043227595","10.0.0.2","10.0.0.7","TCP","10202","33668  >  5202 [PSH, ACK] Seq=15966 Ack=1 Win=42496 Len=10136 TSval=3126386055 TSecr=2758836615"
"114","0.044427287","10.0.0.7","10.0.0.2","TCP","66","5202  >  33668 [ACK] Seq=1 Ack=14518 Win=70656 Len=0 TSval=2758836616 TSecr=3126386025"
"115","0.044433730","10.0.0.2","10.0.0.7","TCP","10202","33668  >  5202 [PSH, ACK] Seq=26102 Ack=1 Win=42496 Len=10136 TSval=3126386056 TSecr=2758836616"
"116","0.045647080","10.0.0.7","10.0.0.2","TCP","66","5202  >  33682 [ACK] Seq=1 Ack=7278 Win=56832 Len=0 TSval=2758836618 TSecr=3126386025"
"117","0.045658656","10.0.0.2","10.0.0.7","TCP","10202","33682  >  5202 [PSH, ACK] Seq=15966 Ack=1 Win=42496 Len=10136 TSval=3126386058 TSecr=2758836618"
"118","0.046849245","10.0.0.7","10.0.0.2","TCP","66","5202  >  33682 [ACK] Seq=1 Ack=14518 Win=64000 Len=0 TSval=2758836619 TSecr=3126386025"
"119","0.046857042","10.0.0.2","10.0.0.7","TCP","10202","33682  >  5202 [PSH, ACK] Seq=26102 Ack=1 Win=42496 Len=10136 TSval=3126386059 TSecr=2758836619"
"120","0.050484532","10.0.0.7","10.0.0.2","TCP","66","5202  >  33698 [ACK] Seq=1 Ack=7278 Win=56832 Len=0 TSval=2758836622 TSecr=3126386025"
"121","0.050489841","10.0.0.2","10.0.0.7","TCP","10202","33698  >  5202 [PSH, ACK] Seq=15966 Ack=1 Win=42496 Len=10136 TSval=3126386062 TSecr=2758836622"
"122","0.051691694","10.0.0.7","10.0.0.2","TCP","66","5202  >  33698 [ACK] Seq=1 Ack=14518 Win=64000 Len=0 TSval=2758836624 TSecr=3126386025"
"123","0.051698775","10.0.0.2","10.0.0.7","TCP","10202","33698  >  5202 [PSH, ACK] Seq=26102 Ack=1 Win=42496 Len=10136 TSval=3126386064 TSecr=2758836624"
"124","0.052906054","10.0.0.7","10.0.0.2","TCP","66","5202  >  33714 [ACK] Seq=1 Ack=7278 Win=56832 Len=0 TSval=2758836625 TSecr=3126386025"
"125","0.052911795","10.0.0.2","10.0.0.7","TCP","10202","33714  >  5202 [PSH, ACK] Seq=15966 Ack=1 Win=42496 Len=10136 TSval=3126386065 TSecr=2758836625"
"126","0.054120637","10.0.0.7","10.0.0.2","TCP","66","5202  >  33714 [ACK] Seq=1 Ack=14518 Win=70656 Len=0 TSval=2758836626 TSecr=3126386025"
"127","0.054127462","10.0.0.2","10.0.0.7","TCP","10202","33714  >  5202 [PSH, ACK] Seq=26102 Ack=1 Win=42496 Len=10136 TSval=3126386066 TSecr=2758836626"
"128","0.055328479","10.0.0.7","10.0.0.2","TCP","66","5202  >  33738 [ACK] Seq=1 Ack=7278 Win=56832 Len=0 TSval=2758836627 TSecr=3126386026"
"129","0.055333733","10.0.0.2","10.0.0.7","TCP","10202","33738  >  5202 [PSH, ACK] Seq=15966 Ack=1 Win=42496 Len=10136 TSval=3126386067 TSecr=2758836627"
"130","0.056539005","10.0.0.7","10.0.0.2","TCP","66","5202  >  33738 [ACK] Seq=1 Ack=14518 Win=70656 Len=0 TSval=2758836628 TSecr=3126386026"
"131","0.056546809","10.0.0.2","10.0.0.7","TCP","10202","33738  >  5202 [PSH, ACK] Seq=26102 Ack=1 Win=42496 Len=10136 TSval=3126386068 TSecr=2758836628"
"132","0.057751298","10.0.0.7","10.0.0.2","TCP","66","5202  >  33724 [ACK] Seq=1 Ack=7278 Win=56832 Len=0 TSval=2758836630 TSecr=3126386026"
"133","0.057756869","10.0.0.2","10.0.0.7","TCP","10202","33724  >  5202 [PSH, ACK] Seq=15966 Ack=1 Win=42496 Len=10136 TSval=3126386070 TSecr=2758836630"
"134","0.060663983","10.0.0.7","10.0.0.2","TCP","66","5202  >  33724 [ACK] Seq=1 Ack=14518 Win=70656 Len=0 TSval=2758836633 TSecr=3126386026"
"135","0.060674465","10.0.0.2","10.0.0.7","TCP","10202","33724  >  5202 [PSH, ACK] Seq=26102 Ack=1 Win=42496 Len=10136 TSval=3126386073 TSecr=2758836633"
"136","0.061877472","10.0.0.7","10.0.0.2","TCP","66","5202  >  33748 [ACK] Seq=1 Ack=7278 Win=56832 Len=0 TSval=2758836634 TSecr=3126386026"
"137","0.061885067","10.0.0.2","10.0.0.7","TCP","10202","33748  >  5202 [PSH, ACK] Seq=15966 Ack=1 Win=42496 Len=10136 TSval=3126386074 TSecr=2758836634"
"138","0.063090835","10.0.0.7","10.0.0.2","TCP","66","5202  >  33748 [ACK] Seq=1 Ack=14518 Win=70656 Len=0 TSval=2758836635 TSecr=3126386026"
"139","0.063103990","10.0.0.2","10.0.0.7","TCP","10202","33748  >  5202 [PSH, ACK] Seq=26102 Ack=1 Win=42496 Len=10136 TSval=3126386075 TSecr=2758836635"
"140","0.068168134","10.0.0.7","10.0.0.2","TCP","66","5202  >  33682 [ACK] Seq=1 Ack=15966 Win=67072 Len=0 TSval=2758836640 TSecr=3126386029"
"141","0.068650816","10.0.0.7","10.0.0.2","TCP","66","5202  >  33698 [ACK] Seq=1 Ack=15966 Win=67072 Len=0 TSval=2758836641 TSecr=3126386029"
"142","0.069627663","10.0.0.7","10.0.0.2","TCP","66","5202  >  33664 [ACK] Seq=1 Ack=15966 Win=73216 Len=0 TSval=2758836642 TSecr=3126386029"
"143","0.070105604","10.0.0.7","10.0.0.2","TCP","66","5202  >  33714 [ACK] Seq=1 Ack=15966 Win=73216 Len=0 TSval=2758836642 TSecr=3126386029"
"144","0.070346797","10.0.0.7","10.0.0.2","TCP","66","5202  >  33666 [ACK] Seq=1 Ack=15966 Win=73216 Len=0 TSval=2758836642 TSecr=3126386029"
"145","0.070588816","10.0.0.7","10.0.0.2","TCP","66","5202  >  33668 [ACK] Seq=1 Ack=15966 Win=73216 Len=0 TSval=2758836642 TSecr=3126386029"
"146","0.070831372","10.0.0.7","10.0.0.2","TCP","66","5202  >  33658 [ACK] Seq=1 Ack=15966 Win=73216 Len=0 TSval=2758836643 TSecr=3126386029"
"147","0.073270609","10.0.0.7","10.0.0.2","TCP","66","5202  >  33738 [ACK] Seq=1 Ack=15966 Win=73216 Len=0 TSval=2758836645 TSecr=3126386030"
"148","0.073753349","10.0.0.7","10.0.0.2","TCP","66","5202  >  33748 [ACK] Seq=1 Ack=15966 Win=73216 Len=0 TSval=2758836646 TSecr=3126386030"
"149","0.073993660","10.0.0.7","10.0.0.2","TCP","66","5202  >  33724 [ACK] Seq=1 Ack=15966 Win=73216 Len=0 TSval=2758836646 TSecr=3126386030"
"150","0.094346495","10.0.0.7","10.0.0.2","TCP","66","5202  >  33658 [ACK] Seq=1 Ack=26102 Win=68096 Len=0 TSval=2758836666 TSecr=3126386043"
"151","0.094359187","10.0.0.2","10.0.0.7","TCP","10202","33658  >  5202 [PSH, ACK] Seq=36238 Ack=1 Win=42496 Len=10136 TSval=3126386106 TSecr=2758836666"
"152","0.094365606","10.0.0.2","10.0.0.7","TCP","11650","33658  >  5202 [PSH, ACK] Seq=46374 Ack=1 Win=42496 Len=11584 TSval=3126386106 TSecr=2758836666"
"153","0.096034376","10.0.0.7","10.0.0.2","TCP","66","5202  >  33658 [ACK] Seq=1 Ack=36238 Win=58880 Len=0 TSval=2758836668 TSecr=3126386044"
"154","0.096040464","10.0.0.2","10.0.0.7","TCP","21786","33658  >  5202 [PSH, ACK] Seq=57958 Ack=1 Win=42496 Len=21720 TSval=3126386108 TSecr=2758836668"
"155","0.097733050","10.0.0.7","10.0.0.2","TCP","66","5202  >  33664 [ACK] Seq=1 Ack=26102 Win=68096 Len=0 TSval=2758836670 TSecr=3126386045"
"156","0.097739023","10.0.0.2","10.0.0.7","TCP","10202","33664  >  5202 [PSH, ACK] Seq=36238 Ack=1 Win=42496 Len=10136 TSval=3126386110 TSecr=2758836670"
"157","0.097740991","10.0.0.2","10.0.0.7","TCP","11650","33664  >  5202 [PSH, ACK] Seq=46374 Ack=1 Win=42496 Len=11584 TSval=3126386110 TSecr=2758836670"
"158","0.102820548","10.0.0.7","10.0.0.2","TCP","66","5202  >  33664 [ACK] Seq=1 Ack=36238 Win=93696 Len=0 TSval=2758836675 TSecr=3126386049"
"159","0.102831934","10.0.0.2","10.0.0.7","TCP","21786","33664  >  5202 [PSH, ACK] Seq=57958 Ack=1 Win=42496 Len=21720 TSval=3126386115 TSecr=2758836675"
"160","0.104521555","10.0.0.7","10.0.0.2","TCP","66","5202  >  33666 [ACK] Seq=1 Ack=26102 Win=68096 Len=0 TSval=2758836676 TSecr=3126386050"
"161","0.104529126","10.0.0.2","10.0.0.7","TCP","10202","33666  >  5202 [PSH, ACK] Seq=36238 Ack=1 Win=42496 Len=10136 TSval=3126386116 TSecr=2758836676"
"162","0.104531585","10.0.0.2","10.0.0.7","TCP","11650","33666  >  5202 [PSH, ACK] Seq=46374 Ack=1 Win=42496 Len=11584 TSval=3126386116 TSecr=2758836676"
"163","0.106210303","10.0.0.7","10.0.0.2","TCP","66","5202  >  33666 [ACK] Seq=1 Ack=36238 Win=93696 Len=0 TSval=2758836678 TSecr=3126386051"
"164","0.106216350","10.0.0.2","10.0.0.7","TCP","21786","33666  >  5202 [PSH, ACK] Seq=57958 Ack=1 Win=42496 Len=21720 TSval=3126386118 TSecr=2758836678"
"165","0.111299260","10.0.0.7","10.0.0.2","TCP","66","5202  >  33668 [ACK] Seq=1 Ack=26102 Win=68096 Len=0 TSval=2758836683 TSecr=3126386055"
"166","0.111305395","10.0.0.2","10.0.0.7","TCP","10202","33668  >  5202 [PSH, ACK] Seq=36238 Ack=1 Win=42496 Len=10136 TSval=3126386123 TSecr=2758836683"
"167","0.111307208","10.0.0.2","10.0.0.7","TCP","11650","33668  >  5202 [PSH, ACK] Seq=46374 Ack=1 Win=42496 Len=11584 TSval=3126386123 TSecr=2758836683"
"168","0.112990787","10.0.0.7","10.0.0.2","TCP","66","5202  >  33668 [ACK] Seq=1 Ack=36238 Win=58880 Len=0 TSval=2758836685 TSecr=3126386056"
"169","0.112996218","10.0.0.2","10.0.0.7","TCP","21786","33668  >  5202 [PSH, ACK] Seq=57958 Ack=1 Win=42496 Len=21720 TSval=3126386125 TSecr=2758836685"
"170","0.114690441","10.0.0.7","10.0.0.2","TCP","66","5202  >  33682 [ACK] Seq=1 Ack=26102 Win=68096 Len=0 TSval=2758836687 TSecr=3126386058"
"171","0.114696170","10.0.0.2","10.0.0.7","TCP","10202","33682  >  5202 [PSH, ACK] Seq=36238 Ack=1 Win=42496 Len=10136 TSval=3126386127 TSecr=2758836687"
"172","0.114698213","10.0.0.2","10.0.0.7","TCP","11650","33682  >  5202 [PSH, ACK] Seq=46374 Ack=1 Win=42496 Len=11584 TSval=3126386127 TSecr=2758836687"
"173","0.116384084","10.0.0.7","10.0.0.2","TCP","66","5202  >  33682 [ACK] Seq=1 Ack=36238 Win=88064 Len=0 TSval=2758836688 TSecr=3126386059"
"174","0.116390966","10.0.0.2","10.0.0.7","TCP","21786","33682  >  5202 [PSH, ACK] Seq=57958 Ack=1 Win=42496 Len=21720 TSval=3126386128 TSecr=2758836688"
"175","0.121475328","10.0.0.7","10.0.0.2","TCP","66","5202  >  33698 [ACK] Seq=1 Ack=26102 Win=68096 Len=0 TSval=2758836693 TSecr=3126386062"
"176","0.121482635","10.0.0.2","10.0.0.7","TCP","10202","33698  >  5202 [PSH, ACK] Seq=36238 Ack=1 Win=42496 Len=10136 TSval=3126386133 TSecr=2758836693"
"177","0.121485693","10.0.0.2","10.0.0.7","TCP","11650","33698  >  5202 [PSH, ACK] Seq=46374 Ack=1 Win=42496 Len=11584 TSval=3126386133 TSecr=2758836693"
"178","0.123200989","10.0.0.7","10.0.0.2","TCP","66","5202  >  33698 [ACK] Seq=1 Ack=36238 Win=88064 Len=0 TSval=2758836695 TSecr=3126386064"
"179","0.123211976","10.0.0.2","10.0.0.7","TCP","21786","33698  >  5202 [PSH, ACK] Seq=57958 Ack=1 Win=42496 Len=21720 TSval=3126386135 TSecr=2758836695"
"180","0.124873313","10.0.0.7","10.0.0.2","TCP","66","5202  >  33714 [ACK] Seq=1 Ack=26102 Win=68096 Len=0 TSval=2758836697 TSecr=3126386065"
"181","0.124880149","10.0.0.2","10.0.0.7","TCP","10202","33714  >  5202 [PSH, ACK] Seq=36238 Ack=1 Win=42496 Len=10136 TSval=3126386137 TSecr=2758836697"
"182","0.124881948","10.0.0.2","10.0.0.7","TCP","11650","33714  >  5202 [PSH, ACK] Seq=46374 Ack=1 Win=42496 Len=11584 TSval=3126386137 TSecr=2758836697"
"183","0.126567868","10.0.0.7","10.0.0.2","TCP","66","5202  >  33714 [ACK] Seq=1 Ack=36238 Win=93696 Len=0 TSval=2758836698 TSecr=3126386066"
"184","0.126575270","10.0.0.2","10.0.0.7","TCP","21786","33714  >  5202 [PSH, ACK] Seq=57958 Ack=1 Win=42496 Len=21720 TSval=3126386138 TSecr=2758836698"
"185","0.128291950","10.0.0.7","10.0.0.2","TCP","66","5202  >  33738 [ACK] Seq=1 Ack=26102 Win=68096 Len=0 TSval=2758836700 TSecr=3126386067"
"186","0.128304907","10.0.0.2","10.0.0.7","TCP","10202","33738  >  5202 [PSH, ACK] Seq=36238 Ack=1 Win=42496 Len=10136 TSval=3126386140 TSecr=2758836700"
"187","0.128310543","10.0.0.2","10.0.0.7","TCP","11650","33738  >  5202 [PSH, ACK] Seq=46374 Ack=1 Win=42496 Len=11584 TSval=3126386140 TSecr=2758836700"
"188","0.129976593","10.0.0.7","10.0.0.2","TCP","66","5202  >  33738 [ACK] Seq=1 Ack=36238 Win=93696 Len=0 TSval=2758836702 TSecr=3126386068"
"189","0.129988542","10.0.0.2","10.0.0.7","TCP","21786","33738  >  5202 [PSH, ACK] Seq=57958 Ack=1 Win=42496 Len=21720 TSval=3126386142 TSecr=2758836702"
"190","0.131657956","10.0.0.7","10.0.0.2","TCP","66","5202  >  33724 [ACK] Seq=1 Ack=26102 Win=68096 Len=0 TSval=2758836704 TSecr=3126386070"
"191","0.131664068","10.0.0.2","10.0.0.7","TCP","10202","33724  >  5202 [PSH, ACK] Seq=36238 Ack=1 Win=42496 Len=10136 TSval=3126386144 TSecr=2758836704"
"192","0.131665908","10.0.0.2","10.0.0.7","TCP","11650","33724  >  5202 [PSH, ACK] Seq=46374 Ack=1 Win=42496 Len=11584 TSval=3126386144 TSecr=2758836704"
"193","0.135792433","10.0.0.7","10.0.0.2","TCP","66","5202  >  33724 [ACK] Seq=1 Ack=36238 Win=93696 Len=0 TSval=2758836708 TSecr=3126386073"
"194","0.135812211","10.0.0.2","10.0.0.7","TCP","21786","33724  >  5202 [PSH, ACK] Seq=57958 Ack=1 Win=42496 Len=21720 TSval=3126386148 TSecr=2758836708"
"195","0.137474214","10.0.0.7","10.0.0.2","TCP","66","5202  >  33748 [ACK] Seq=1 Ack=26102 Win=68096 Len=0 TSval=2758836709 TSecr=3126386074"
"196","0.137483642","10.0.0.2","10.0.0.7","TCP","10202","33748  >  5202 [PSH, ACK] Seq=36238 Ack=1 Win=42496 Len=10136 TSval=3126386149 TSecr=2758836709"
"197","0.137485759","10.0.0.2","10.0.0.7","TCP","11650","33748  >  5202 [PSH, ACK] Seq=46374 Ack=1 Win=42496 Len=11584 TSval=3126386149 TSecr=2758836709"
"198","0.139174099","10.0.0.7","10.0.0.2","TCP","66","5202  >  33748 [ACK] Seq=1 Ack=36238 Win=93696 Len=0 TSval=2758836711 TSecr=3126386075"
"199","0.139188523","10.0.0.2","10.0.0.7","TCP","21786","33748  >  5202 [PSH, ACK] Seq=57958 Ack=1 Win=42496 Len=21720 TSval=3126386151 TSecr=2758836711"
"200","0.191745953","10.0.0.7","10.0.0.2","TCP","66","5202  >  33658 [ACK] Seq=1 Ack=46374 Win=93696 Len=0 TSval=2758836764 TSecr=3126386106"
"201","0.193427147","10.0.0.7","10.0.0.2","TCP","66","5202  >  33658 [ACK] Seq=1 Ack=57958 Win=116736 Len=0 TSval=2758836765 TSecr=3126386106"
"202","0.193433762","10.0.0.2","10.0.0.7","TCP","7306","33658  >  5202 [PSH, ACK] Seq=79678 Ack=1 Win=42496 Len=7240 TSval=3126386205 TSecr=2758836765"
"203","0.193438447","10.0.0.2","10.0.0.7","TCP","27578","33658  >  5202 [PSH, ACK] Seq=86918 Ack=1 Win=42496 Len=27512 TSval=3126386205 TSecr=2758836765"
"204","0.195370493","10.0.0.7","10.0.0.2","TCP","66","5202  >  33658 [ACK] Seq=1 Ack=79678 Win=160256 Len=0 TSval=2758836767 TSecr=3126386108"
"205","0.195378709","10.0.0.2","10.0.0.7","TCP","36266","33658  >  5202 [PSH, ACK] Seq=114430 Ack=1 Win=42496 Len=36200 TSval=3126386207 TSecr=2758836767"
"206","0.199000249","10.0.0.7","10.0.0.2","TCP","66","5202  >  33664 [ACK] Seq=1 Ack=46374 Win=114176 Len=0 TSval=2758836771 TSecr=3126386110"
"207","0.200695469","10.0.0.7","10.0.0.2","TCP","66","5202  >  33664 [ACK] Seq=1 Ack=57958 Win=137216 Len=0 TSval=2758836773 TSecr=3126386110"
"208","0.200701101","10.0.0.2","10.0.0.7","TCP","7306","33664  >  5202 [PSH, ACK] Seq=79678 Ack=1 Win=42496 Len=7240 TSval=3126386213 TSecr=2758836773"
"209","0.200706285","10.0.0.2","10.0.0.7","TCP","27578","33664  >  5202 [PSH, ACK] Seq=86918 Ack=1 Win=42496 Len=27512 TSval=3126386213 TSecr=2758836773"
"210","0.209901023","10.0.0.7","10.0.0.2","TCP","66","5202  >  33664 [ACK] Seq=1 Ack=79678 Win=174080 Len=0 TSval=2758836782 TSecr=3126386115"
"211","0.209920529","10.0.0.2","10.0.0.7","TCP","46402","33664  >  5202 [PSH, ACK] Seq=114430 Ack=1 Win=42496 Len=46336 TSval=3126386222 TSecr=2758836782"
"212","0.213536920","10.0.0.7","10.0.0.2","TCP","66","5202  >  33666 [ACK] Seq=1 Ack=46374 Win=114176 Len=0 TSval=2758836785 TSecr=3126386116"
"213","0.215229306","10.0.0.7","10.0.0.2","TCP","66","5202  >  33666 [ACK] Seq=1 Ack=57958 Win=137216 Len=0 TSval=2758836787 TSecr=3126386116"
"214","0.215234971","10.0.0.2","10.0.0.7","TCP","7306","33666  >  5202 [PSH, ACK] Seq=79678 Ack=1 Win=42496 Len=7240 TSval=3126386227 TSecr=2758836787"
"215","0.215238489","10.0.0.2","10.0.0.7","TCP","27578","33666  >  5202 [PSH, ACK] Seq=86918 Ack=1 Win=42496 Len=27512 TSval=3126386227 TSecr=2758836787"
"216","0.217166268","10.0.0.7","10.0.0.2","TCP","66","5202  >  33666 [ACK] Seq=1 Ack=79678 Win=174080 Len=0 TSval=2758836789 TSecr=3126386118"
"217","0.217174710","10.0.0.2","10.0.0.7","TCP","46402","33666  >  5202 [PSH, ACK] Seq=114430 Ack=1 Win=42496 Len=46336 TSval=3126386229 TSecr=2758836789"
"218","0.228086067","10.0.0.7","10.0.0.2","TCP","66","5202  >  33668 [ACK] Seq=1 Ack=46374 Win=93696 Len=0 TSval=2758836800 TSecr=3126386123"
"219","0.229769184","10.0.0.7","10.0.0.2","TCP","66","5202  >  33668 [ACK] Seq=1 Ack=57958 Win=116736 Len=0 TSval=2758836802 TSecr=3126386123"
"220","0.229779915","10.0.0.2","10.0.0.7","TCP","7306","33668  >  5202 [PSH, ACK] Seq=79678 Ack=1 Win=42496 Len=7240 TSval=3126386242 TSecr=2758836802"
"221","0.229790293","10.0.0.2","10.0.0.7","TCP","27578","33668  >  5202 [PSH, ACK] Seq=86918 Ack=1 Win=42496 Len=27512 TSval=3126386242 TSecr=2758836802"
"222","0.231707607","10.0.0.7","10.0.0.2","TCP","66","5202  >  33668 [ACK] Seq=1 Ack=79678 Win=160256 Len=0 TSval=2758836804 TSecr=3126386125"
"223","0.231718786","10.0.0.2","10.0.0.7","TCP","36266","33668  >  5202 [PSH, ACK] Seq=114430 Ack=1 Win=42496 Len=36200 TSval=3126386244 TSecr=2758836804"
"224","0.235366293","10.0.0.7","10.0.0.2","TCP","66","5202  >  33682 [ACK] Seq=1 Ack=46374 Win=108544 Len=0 TSval=2758836807 TSecr=3126386127"
"225","0.237059363","10.0.0.7","10.0.0.2","TCP","66","5202  >  33682 [ACK] Seq=1 Ack=57958 Win=131584 Len=0 TSval=2758836809 TSecr=3126386127"
"226","0.237076280","10.0.0.2","10.0.0.7","TCP","7306","33682  >  5202 [PSH, ACK] Seq=79678 Ack=1 Win=42496 Len=7240 TSval=3126386249 TSecr=2758836809"
"227","0.237088715","10.0.0.2","10.0.0.7","TCP","24682","33682  >  5202 [PSH, ACK] Seq=86918 Ack=1 Win=42496 Len=24616 TSval=3126386249 TSecr=2758836809"
"228","0.238968122","10.0.0.7","10.0.0.2","TCP","66","5202  >  33682 [ACK] Seq=1 Ack=79678 Win=174080 Len=0 TSval=2758836811 TSecr=3126386128"
"229","0.238986305","10.0.0.2","10.0.0.7","TCP","43506","33682  >  5202 [PSH, ACK] Seq=111534 Ack=1 Win=42496 Len=43440 TSval=3126386251 TSecr=2758836811"
"230","0.249871232","10.0.0.7","10.0.0.2","TCP","66","5202  >  33698 [ACK] Seq=1 Ack=46374 Win=108544 Len=0 TSval=2758836822 TSecr=3126386133"
"231","0.251564166","10.0.0.7","10.0.0.2","TCP","66","5202  >  33698 [ACK] Seq=1 Ack=57958 Win=131584 Len=0 TSval=2758836823 TSecr=3126386133"
"232","0.251569546","10.0.0.2","10.0.0.7","TCP","7306","33698  >  5202 [PSH, ACK] Seq=79678 Ack=1 Win=42496 Len=7240 TSval=3126386263 TSecr=2758836823"
"233","0.251572985","10.0.0.2","10.0.0.7","TCP","24682","33698  >  5202 [PSH, ACK] Seq=86918 Ack=1 Win=42496 Len=24616 TSval=3126386263 TSecr=2758836823"
"234","0.253504952","10.0.0.7","10.0.0.2","TCP","66","5202  >  33698 [ACK] Seq=1 Ack=79678 Win=174080 Len=0 TSval=2758836825 TSecr=3126386135"
"235","0.253529609","10.0.0.2","10.0.0.7","TCP","33370","33698  >  5202 [PSH, ACK] Seq=111534 Ack=1 Win=42496 Len=33304 TSval=3126386265 TSecr=2758836825"
"236","0.257141569","10.0.0.7","10.0.0.2","TCP","66","5202  >  33714 [ACK] Seq=1 Ack=46374 Win=114176 Len=0 TSval=2758836829 TSecr=3126386137"
"237","0.258832031","10.0.0.7","10.0.0.2","TCP","66","5202  >  33714 [ACK] Seq=1 Ack=57958 Win=137216 Len=0 TSval=2758836831 TSecr=3126386137"
"238","0.258839579","10.0.0.2","10.0.0.7","TCP","7306","33714  >  5202 [PSH, ACK] Seq=79678 Ack=1 Win=42496 Len=7240 TSval=3126386271 TSecr=2758836831"
"239","0.258852502","10.0.0.2","10.0.0.7","TCP","27578","33714  >  5202 [PSH, ACK] Seq=86918 Ack=1 Win=42496 Len=27512 TSval=3126386271 TSecr=2758836831"
"240","0.260772690","10.0.0.7","10.0.0.2","TCP","66","5202  >  33714 [ACK] Seq=1 Ack=79678 Win=174080 Len=0 TSval=2758836833 TSecr=3126386138"
"241","0.260788635","10.0.0.2","10.0.0.7","TCP","36266","33714  >  5202 [PSH, ACK] Seq=114430 Ack=1 Win=42496 Len=36200 TSval=3126386273 TSecr=2758836833"
"242","0.264411737","10.0.0.7","10.0.0.2","TCP","66","5202  >  33738 [ACK] Seq=1 Ack=46374 Win=114176 Len=0 TSval=2758836836 TSecr=3126386140"
"243","0.266100731","10.0.0.7","10.0.0.2","TCP","66","5202  >  33738 [ACK] Seq=1 Ack=57958 Win=137216 Len=0 TSval=2758836838 TSecr=3126386140"
"244","0.266107584","10.0.0.2","10.0.0.7","TCP","7306","33738  >  5202 [PSH, ACK] Seq=79678 Ack=1 Win=42496 Len=7240 TSval=3126386278 TSecr=2758836838"
"245","0.266112095","10.0.0.2","10.0.0.7","TCP","27578","33738  >  5202 [PSH, ACK] Seq=86918 Ack=1 Win=42496 Len=27512 TSval=3126386278 TSecr=2758836838"
"246","0.268038801","10.0.0.7","10.0.0.2","TCP","66","5202  >  33738 [ACK] Seq=1 Ack=79678 Win=174080 Len=0 TSval=2758836840 TSecr=3126386142"
"247","0.268053691","10.0.0.2","10.0.0.7","TCP","36266","33738  >  5202 [PSH, ACK] Seq=114430 Ack=1 Win=42496 Len=36200 TSval=3126386280 TSecr=2758836840"
"248","0.271677729","10.0.0.7","10.0.0.2","TCP","66","5202  >  33724 [ACK] Seq=1 Ack=46374 Win=114176 Len=0 TSval=2758836844 TSecr=3126386144"
"249","0.273371503","10.0.0.7","10.0.0.2","TCP","66","5202  >  33724 [ACK] Seq=1 Ack=57958 Win=137216 Len=0 TSval=2758836845 TSecr=3126386144"
"250","0.273378100","10.0.0.2","10.0.0.7","TCP","7306","33724  >  5202 [PSH, ACK] Seq=79678 Ack=1 Win=42496 Len=7240 TSval=3126386285 TSecr=2758836845"
"251","0.273385742","10.0.0.2","10.0.0.7","TCP","27578","33724  >  5202 [PSH, ACK] Seq=86918 Ack=1 Win=42496 Len=27512 TSval=3126386285 TSecr=2758836845"
"252","0.275304147","10.0.0.7","10.0.0.2","TCP","66","5202  >  33724 [ACK] Seq=1 Ack=79678 Win=163840 Len=0 TSval=2758836847 TSecr=3126386148"
"253","0.275312524","10.0.0.2","10.0.0.7","TCP","36266","33724  >  5202 [PSH, ACK] Seq=114430 Ack=1 Win=42496 Len=36200 TSval=3126386287 TSecr=2758836847"
"254","0.278940796","10.0.0.7","10.0.0.2","TCP","66","5202  >  33748 [ACK] Seq=1 Ack=46374 Win=114176 Len=0 TSval=2758836851 TSecr=3126386149"
"255","0.280636097","10.0.0.7","10.0.0.2","TCP","66","5202  >  33748 [ACK] Seq=1 Ack=57958 Win=137216 Len=0 TSval=2758836853 TSecr=3126386149"
"256","0.280642836","10.0.0.2","10.0.0.7","TCP","7306","33748  >  5202 [PSH, ACK] Seq=79678 Ack=1 Win=42496 Len=7240 TSval=3126386293 TSecr=2758836853"
"257","0.280647576","10.0.0.2","10.0.0.7","TCP","27578","33748  >  5202 [PSH, ACK] Seq=86918 Ack=1 Win=42496 Len=27512 TSval=3126386293 TSecr=2758836853"
"258","0.282570222","10.0.0.7","10.0.0.2","TCP","66","5202  >  33748 [ACK] Seq=1 Ack=79678 Win=163840 Len=0 TSval=2758836854 TSecr=3126386151"
"259","0.282579989","10.0.0.2","10.0.0.7","TCP","36266","33748  >  5202 [PSH, ACK] Seq=114430 Ack=1 Win=42496 Len=36200 TSval=3126386294 TSecr=2758836854"
"260","0.375596786","10.0.0.7","10.0.0.2","TCP","66","5202  >  33658 [ACK] Seq=1 Ack=86918 Win=174592 Len=0 TSval=2758836947 TSecr=3126386205"
"261","0.376809562","10.0.0.7","10.0.0.2","TCP","66","5202  >  33658 [ACK] Seq=1 Ack=114430 Win=229888 Len=0 TSval=2758836949 TSecr=3126386205"
"262","0.376825564","10.0.0.2","10.0.0.7","TCP","23234","33658  >  5202 [PSH, ACK] Seq=150630 Ack=1 Win=42496 Len=23168 TSval=3126386389 TSecr=2758836949"
"263","0.381408021","10.0.0.7","10.0.0.2","TCP","66","5202  >  33658 [ACK] Seq=1 Ack=150630 Win=302080 Len=0 TSval=2758836953 TSecr=3126386207"
"264","0.381414496","10.0.0.2","10.0.0.7","TCP","13098","33658  >  5202 [PSH, ACK] Seq=173798 Ack=1 Win=42496 Len=13032 TSval=3126386393 TSecr=2758836953"
"265","0.381420261","10.0.0.2","10.0.0.7","TCP","46402","33658  >  5202 [PSH, ACK] Seq=186830 Ack=1 Win=42496 Len=46336 TSval=3126386393 TSecr=2758836953"
"266","0.381430031","10.0.0.2","10.0.0.7","TCP","46402","33658  >  5202 [PSH, ACK] Seq=233166 Ack=1 Win=42496 Len=46336 TSval=3126386393 TSecr=2758836953"
"267","0.387470323","10.0.0.7","10.0.0.2","TCP","66","5202  >  33664 [ACK] Seq=1 Ack=86918 Win=187392 Len=0 TSval=2758836959 TSecr=3126386213"
"268","0.388672585","10.0.0.7","10.0.0.2","TCP","66","5202  >  33664 [ACK] Seq=1 Ack=114430 Win=194560 Len=0 TSval=2758836961 TSecr=3126386213"
"269","0.388681366","10.0.0.2","10.0.0.7","TCP","13098","33664  >  5202 [PSH, ACK] Seq=160766 Ack=1 Win=42496 Len=13032 TSval=3126386401 TSecr=2758836961"
"270","0.388687746","10.0.0.2","10.0.0.7","TCP","52194","33664  >  5202 [PSH, ACK] Seq=173798 Ack=1 Win=42496 Len=52128 TSval=3126386401 TSecr=2758836961"
"271","0.405156620","10.0.0.7","10.0.0.2","TCP","66","5202  >  33664 [ACK] Seq=1 Ack=160766 Win=178176 Len=0 TSval=2758836977 TSecr=3126386222"
