"No.","Time","Source","Destination","Protocol","Length","Info"
"1","0.000000000","fe80::7c1b:3ff:fe5e:2557","ff02::2","ICMPv6","70","Router Solicitation from 7e:1b:03:5e:25:57"
"2","1.024751646","fe80::2436:dfff:fe61:42e4","ff02::2","ICMPv6","70","Router Solicitation from 26:36:df:61:42:e4"
"3","1.537224133","fe80::b483:f3ff:fe17:efa3","ff02::2","ICMPv6","70","Router Solicitation from b6:83:f3:17:ef:a3"
"4","4.608512136","7e:1b:03:5e:25:57","Broadcast","ARP","42","Who has 10.0.0.7? Tell 10.0.0.3"
"5","4.609165482","32:db:da:d1:b0:d2","Broadcast","ARP","42","Who has 10.0.0.7? Tell 10.0.0.1"
"6","4.609662893","b6:83:f3:17:ef:a3","7e:1b:03:5e:25:57","ARP","42","10.0.0.7 is at b6:83:f3:17:ef:a3"
"7","4.609676322","10.0.0.3","10.0.0.7","TCP","74","35512  >  5202 [SYN] Seq=0 Win=42340 Len=0 MSS=1460 SACK_PERM TSval=3234469194 TSecr=0 WS=512"
"8","4.609695841","ba:72:9b:67:16:1f","Broadcast","ARP","42","Who has 10.0.0.7? Tell 10.0.0.4"
"9","4.610251452","10.0.0.7","10.0.0.3","TCP","74","5202  >  35512 [SYN, ACK] Seq=0 Ack=1 Win=43440 Len=0 MSS=1460 SACK_PERM TSval=3470697832 TSecr=3234469194 WS=512"
"10","4.610290469","10.0.0.3","10.0.0.7","TCP","66","35512  >  5202 [ACK] Seq=1 Ack=1 Win=42496 Len=0 TSval=3234469196 TSecr=3470697832"
"11","4.610324765","10.0.0.3","10.0.0.7","TCP","103","35512  >  5202 [PSH, ACK] Seq=1 Ack=1 Win=42496 Len=37 TSval=3234469196 TSecr=3470697832"
"12","4.610357972","10.0.0.7","10.0.0.3","TCP","66","5202  >  35512 [ACK] Seq=1 Ack=38 Win=43520 Len=0 TSval=3470697832 TSecr=3234469196"
"13","4.610461382","10.0.0.7","10.0.0.3","TCP","67","5202  >  35512 [PSH, ACK] Seq=1 Ack=38 Win=43520 Len=1 TSval=3470697832 TSecr=3234469196"
"14","4.610484927","10.0.0.3","10.0.0.7","TCP","66","35512  >  5202 [ACK] Seq=38 Ack=2 Win=42496 Len=0 TSval=3234469196 TSecr=3470697832"
"15","4.610548638","10.0.0.3","10.0.0.7","TCP","70","35512  >  5202 [PSH, ACK] Seq=38 Ack=2 Win=42496 Len=4 TSval=3234469196 TSecr=3470697832"
"16","4.610579089","10.0.0.3","10.0.0.7","TCP","232","35512  >  5202 [PSH, ACK] Seq=42 Ack=2 Win=42496 Len=166 TSval=3234469196 TSecr=3470697832"
"17","4.610639516","10.0.0.7","10.0.0.3","TCP","66","5202  >  35512 [ACK] Seq=2 Ack=208 Win=43520 Len=0 TSval=3470697832 TSecr=3234469196"
"18","4.610693420","10.0.0.7","10.0.0.3","TCP","67","5202  >  35512 [PSH, ACK] Seq=2 Ack=208 Win=43520 Len=1 TSval=3470697832 TSecr=3234469196"
"19","4.610774222","10.0.0.3","10.0.0.7","TCP","74","35524  >  5202 [SYN] Seq=0 Win=42340 Len=0 MSS=1460 SACK_PERM TSval=3234469196 TSecr=0 WS=512"
"20","4.610816648","10.0.0.7","10.0.0.3","TCP","74","5202  >  35524 [SYN, ACK] Seq=0 Ack=1 Win=43440 Len=0 MSS=1460 SACK_PERM TSval=3470697832 TSecr=3234469196 WS=512"
"21","4.610849718","10.0.0.3","10.0.0.7","TCP","66","35524  >  5202 [ACK] Seq=1 Ack=1 Win=42496 Len=0 TSval=3234469196 TSecr=3470697832"
"22","4.610893942","10.0.0.3","10.0.0.7","TCP","103","35524  >  5202 [PSH, ACK] Seq=1 Ack=1 Win=42496 Len=37 TSval=3234469197 TSecr=3470697832"
"23","4.610925152","10.0.0.7","10.0.0.3","TCP","66","5202  >  35524 [ACK] Seq=1 Ack=38 Win=43520 Len=0 TSval=3470697833 TSecr=3234469197"
"24","4.617768078","10.0.0.3","10.0.0.7","TCP","74","35532  >  5202 [SYN] Seq=0 Win=42340 Len=0 MSS=1460 SACK_PERM TSval=3234469203 TSecr=0 WS=512"
"25","4.617803962","10.0.0.7","10.0.0.3","TCP","74","5202  >  35532 [SYN, ACK] Seq=0 Ack=1 Win=43440 Len=0 MSS=1460 SACK_PERM TSval=3470697839 TSecr=3234469203 WS=512"
"26","4.617818911","10.0.0.3","10.0.0.7","TCP","66","35532  >  5202 [ACK] Seq=1 Ack=1 Win=42496 Len=0 TSval=3234469203 TSecr=3470697839"
"27","4.617904919","10.0.0.3","10.0.0.7","TCP","103","35532  >  5202 [PSH, ACK] Seq=1 Ack=1 Win=42496 Len=37 TSval=3234469204 TSecr=3470697839"
"28","4.617919809","10.0.0.7","10.0.0.3","TCP","66","5202  >  35532 [ACK] Seq=1 Ack=38 Win=43520 Len=0 TSval=3470697840 TSecr=3234469204"
"29","4.619033701","10.0.0.3","10.0.0.7","TCP","74","35546  >  5202 [SYN] Seq=0 Win=42340 Len=0 MSS=1460 SACK_PERM TSval=3234469205 TSecr=0 WS=512"
"30","4.619058660","10.0.0.7","10.0.0.3","TCP","74","5202  >  35546 [SYN, ACK] Seq=0 Ack=1 Win=43440 Len=0 MSS=1460 SACK_PERM TSval=3470697841 TSecr=3234469205 WS=512"
"31","4.619069383","10.0.0.3","10.0.0.7","TCP","66","35546  >  5202 [ACK] Seq=1 Ack=1 Win=42496 Len=0 TSval=3234469205 TSecr=3470697841"
"32","4.619091665","10.0.0.3","10.0.0.7","TCP","103","35546  >  5202 [PSH, ACK] Seq=1 Ack=1 Win=42496 Len=37 TSval=3234469205 TSecr=3470697841"
"33","4.619104340","10.0.0.7","10.0.0.3","TCP","66","5202  >  35546 [ACK] Seq=1 Ack=38 Win=43520 Len=0 TSval=3470697841 TSecr=3234469205"
"34","4.620137441","10.0.0.3","10.0.0.7","TCP","74","35550  >  5202 [SYN] Seq=0 Win=42340 Len=0 MSS=1460 SACK_PERM TSval=3234469206 TSecr=0 WS=512"
"35","4.620159413","10.0.0.7","10.0.0.3","TCP","74","5202  >  35550 [SYN, ACK] Seq=0 Ack=1 Win=43440 Len=0 MSS=1460 SACK_PERM TSval=3470697842 TSecr=3234469206 WS=512"
"36","4.620168901","10.0.0.3","10.0.0.7","TCP","66","35550  >  5202 [ACK] Seq=1 Ack=1 Win=42496 Len=0 TSval=3234469206 TSecr=3470697842"
"37","4.620186395","10.0.0.3","10.0.0.7","TCP","103","35550  >  5202 [PSH, ACK] Seq=1 Ack=1 Win=42496 Len=37 TSval=3234469206 TSecr=3470697842"
"38","4.620198757","10.0.0.7","10.0.0.3","TCP","66","5202  >  35550 [ACK] Seq=1 Ack=38 Win=43520 Len=0 TSval=3470697842 TSecr=3234469206"
"39","4.621158806","10.0.0.3","10.0.0.7","TCP","74","35554  >  5202 [SYN] Seq=0 Win=42340 Len=0 MSS=1460 SACK_PERM TSval=3234469207 TSecr=0 WS=512"
"40","4.621177133","10.0.0.7","10.0.0.3","TCP","74","5202  >  35554 [SYN, ACK] Seq=0 Ack=1 Win=43440 Len=0 MSS=1460 SACK_PERM TSval=3470697843 TSecr=3234469207 WS=512"
"41","4.621184980","10.0.0.3","10.0.0.7","TCP","66","35554  >  5202 [ACK] Seq=1 Ack=1 Win=42496 Len=0 TSval=3234469207 TSecr=3470697843"
"42","4.621200106","10.0.0.3","10.0.0.7","TCP","103","35554  >  5202 [PSH, ACK] Seq=1 Ack=1 Win=42496 Len=37 TSval=3234469207 TSecr=3470697843"
"43","4.621211267","10.0.0.7","10.0.0.3","TCP","66","5202  >  35554 [ACK] Seq=1 Ack=38 Win=43520 Len=0 TSval=3470697843 TSecr=3234469207"
"44","4.622171952","10.0.0.3","10.0.0.7","TCP","74","35556  >  5202 [SYN] Seq=0 Win=42340 Len=0 MSS=1460 SACK_PERM TSval=3234469208 TSecr=0 WS=512"
"45","4.622191723","10.0.0.7","10.0.0.3","TCP","74","5202  >  35556 [SYN, ACK] Seq=0 Ack=1 Win=43440 Len=0 MSS=1460 SACK_PERM TSval=3470697844 TSecr=3234469208 WS=512"
"46","4.622200849","10.0.0.3","10.0.0.7","TCP","66","35556  >  5202 [ACK] Seq=1 Ack=1 Win=42496 Len=0 TSval=3234469208 TSecr=3470697844"
"47","4.622218272","10.0.0.3","10.0.0.7","TCP","103","35556  >  5202 [PSH, ACK] Seq=1 Ack=1 Win=42496 Len=37 TSval=3234469208 TSecr=3470697844"
"48","4.622230395","10.0.0.7","10.0.0.3","TCP","66","5202  >  35556 [ACK] Seq=1 Ack=38 Win=43520 Len=0 TSval=3470697844 TSecr=3234469208"
"49","4.622804360","10.0.0.3","10.0.0.7","TCP","74","35562  >  5202 [SYN] Seq=0 Win=42340 Len=0 MSS=1460 SACK_PERM TSval=3234469208 TSecr=0 WS=512"
"50","4.622810499","10.0.0.7","10.0.0.3","TCP","74","5202  >  35562 [SYN, ACK] Seq=0 Ack=1 Win=43440 Len=0 MSS=1460 SACK_PERM TSval=3470697844 TSecr=3234469208 WS=512"
"51","4.622813059","10.0.0.3","10.0.0.7","TCP","66","35562  >  5202 [ACK] Seq=1 Ack=1 Win=42496 Len=0 TSval=3234469208 TSecr=3470697844"
"52","4.622818698","10.0.0.3","10.0.0.7","TCP","103","35562  >  5202 [PSH, ACK] Seq=1 Ack=1 Win=42496 Len=37 TSval=3234469208 TSecr=3470697844"
"53","4.622822909","10.0.0.7","10.0.0.3","TCP","66","5202  >  35562 [ACK] Seq=1 Ack=38 Win=43520 Len=0 TSval=3470697844 TSecr=3234469208"
"54","4.623151988","10.0.0.3","10.0.0.7","TCP","74","35568  >  5202 [SYN] Seq=0 Win=42340 Len=0 MSS=1460 SACK_PERM TSval=3234469209 TSecr=0 WS=512"
"55","4.623158737","10.0.0.7","10.0.0.3","TCP","74","5202  >  35568 [SYN, ACK] Seq=0 Ack=1 Win=43440 Len=0 MSS=1460 SACK_PERM TSval=3470697845 TSecr=3234469209 WS=512"
"56","4.623161375","10.0.0.3","10.0.0.7","TCP","66","35568  >  5202 [ACK] Seq=1 Ack=1 Win=42496 Len=0 TSval=3234469209 TSecr=3470697845"
"57","4.623167222","10.0.0.3","10.0.0.7","TCP","103","35568  >  5202 [PSH, ACK] Seq=1 Ack=1 Win=42496 Len=37 TSval=3234469209 TSecr=3470697845"
"58","4.623170866","10.0.0.7","10.0.0.3","TCP","66","5202  >  35568 [ACK] Seq=1 Ack=38 Win=43520 Len=0 TSval=3470697845 TSecr=3234469209"
"59","4.623491411","10.0.0.3","10.0.0.7","TCP","74","35582  >  5202 [SYN] Seq=0 Win=42340 Len=0 MSS=1460 SACK_PERM TSval=3234469209 TSecr=0 WS=512"
"60","4.623497387","10.0.0.7","10.0.0.3","TCP","74","5202  >  35582 [SYN, ACK] Seq=0 Ack=1 Win=43440 Len=0 MSS=1460 SACK_PERM TSval=3470697845 TSecr=3234469209 WS=512"
"61","4.623499877","10.0.0.3","10.0.0.7","TCP","66","35582  >  5202 [ACK] Seq=1 Ack=1 Win=42496 Len=0 TSval=3234469209 TSecr=3470697845"
"62","4.623504903","10.0.0.3","10.0.0.7","TCP","103","35582  >  5202 [PSH, ACK] Seq=1 Ack=1 Win=42496 Len=37 TSval=3234469209 TSecr=3470697845"
"63","4.623518735","10.0.0.7","10.0.0.3","TCP","66","5202  >  35582 [ACK] Seq=1 Ack=38 Win=43520 Len=0 TSval=3470697845 TSecr=3234469209"
"64","4.623821831","10.0.0.3","10.0.0.7","TCP","74","35596  >  5202 [SYN] Seq=0 Win=42340 Len=0 MSS=1460 SACK_PERM TSval=3234469209 TSecr=0 WS=512"
"65","4.623827356","10.0.0.7","10.0.0.3","TCP","74","5202  >  35596 [SYN, ACK] Seq=0 Ack=1 Win=43440 Len=0 MSS=1460 SACK_PERM TSval=3470697845 TSecr=3234469209 WS=512"
"66","4.623829647","10.0.0.3","10.0.0.7","TCP","66","35596  >  5202 [ACK] Seq=1 Ack=1 Win=42496 Len=0 TSval=3234469209 TSecr=3470697845"
"67","4.623844363","10.0.0.3","10.0.0.7","TCP","103","35596  >  5202 [PSH, ACK] Seq=1 Ack=1 Win=42496 Len=37 TSval=3234469210 TSecr=3470697845"
"68","4.623848427","10.0.0.7","10.0.0.3","TCP","66","5202  >  35596 [ACK] Seq=1 Ack=38 Win=43520 Len=0 TSval=3470697846 TSecr=3234469210"
"69","4.624176203","10.0.0.7","10.0.0.3","TCP","67","5202  >  35512 [PSH, ACK] Seq=3 Ack=208 Win=43520 Len=1 TSval=3470697846 TSecr=3234469196"
"70","4.624192399","10.0.0.7","10.0.0.3","TCP","67","5202  >  35512 [PSH, ACK] Seq=4 Ack=208 Win=43520 Len=1 TSval=3470697846 TSecr=3234469196"
"71","4.624262144","10.0.0.3","10.0.0.7","TCP","66","35512  >  5202 [ACK] Seq=208 Ack=5 Win=42496 Len=0 TSval=3234469210 TSecr=3470697832"
"72","4.624354700","10.0.0.3","10.0.0.7","TCP","7306","35524  >  5202 [PSH, ACK] Seq=38 Ack=1 Win=42496 Len=7240 TSval=3234469210 TSecr=3470697833"
"73","4.624384576","10.0.0.7","10.0.0.3","TCP","66","5202  >  35524 [ACK] Seq=1 Ack=7278 Win=56832 Len=0 TSval=3470697846 TSecr=3234469210"
"74","4.624399444","10.0.0.3","10.0.0.7","TCP","7306","35524  >  5202 [PSH, ACK] Seq=7278 Ack=1 Win=42496 Len=7240 TSval=3234469210 TSecr=3470697833"
"75","4.624401788","10.0.0.3","10.0.0.7","TCP","7306","35532  >  5202 [PSH, ACK] Seq=38 Ack=1 Win=42496 Len=7240 TSval=3234469210 TSecr=3470697840"
"76","4.624414346","10.0.0.3","10.0.0.7","TCP","7306","35532  >  5202 [PSH, ACK] Seq=7278 Ack=1 Win=42496 Len=7240 TSval=3234469210 TSecr=3470697840"
"77","4.624439384","10.0.0.3","10.0.0.7","TCP","7306","35550  >  5202 [PSH, ACK] Seq=38 Ack=1 Win=42496 Len=7240 TSval=3234469210 TSecr=3470697842"
"78","4.624450531","10.0.0.3","10.0.0.7","TCP","7306","35546  >  5202 [PSH, ACK] Seq=38 Ack=1 Win=42496 Len=7240 TSval=3234469210 TSecr=3470697841"
"79","4.624450550","10.0.0.3","10.0.0.7","TCP","7306","35550  >  5202 [PSH, ACK] Seq=7278 Ack=1 Win=42496 Len=7240 TSval=3234469210 TSecr=3470697842"
"80","4.624464041","10.0.0.3","10.0.0.7","TCP","7306","35546  >  5202 [PSH, ACK] Seq=7278 Ack=1 Win=42496 Len=7240 TSval=3234469210 TSecr=3470697841"
"81","4.624470221","10.0.0.3","10.0.0.7","TCP","10202","35524  >  5202 [PSH, ACK] Seq=14518 Ack=1 Win=42496 Len=10136 TSval=3234469210 TSecr=3470697846"
"82","4.624523448","10.0.0.3","10.0.0.7","TCP","7306","35554  >  5202 [PSH, ACK] Seq=38 Ack=1 Win=42496 Len=7240 TSval=3234469210 TSecr=3470697843"
"83","4.624529328","10.0.0.3","10.0.0.7","TCP","7306","35556  >  5202 [PSH, ACK] Seq=38 Ack=1 Win=42496 Len=7240 TSval=3234469210 TSecr=3470697844"
"84","4.624534443","10.0.0.3","10.0.0.7","TCP","7306","35562  >  5202 [PSH, ACK] Seq=38 Ack=1 Win=42496 Len=7240 TSval=3234469210 TSecr=3470697844"
"85","4.624536710","10.0.0.3","10.0.0.7","TCP","7306","35554  >  5202 [PSH, ACK] Seq=7278 Ack=1 Win=42496 Len=7240 TSval=3234469210 TSecr=3470697843"
"86","4.624536810","10.0.0.3","10.0.0.7","TCP","7306","35556  >  5202 [PSH, ACK] Seq=7278 Ack=1 Win=42496 Len=7240 TSval=3234469210 TSecr=3470697844"
"87","4.624541958","10.0.0.3","10.0.0.7","TCP","7306","35562  >  5202 [PSH, ACK] Seq=7278 Ack=1 Win=42496 Len=7240 TSval=3234469210 TSecr=3470697844"
"88","4.624563146","10.0.0.3","10.0.0.7","TCP","7306","35568  >  5202 [PSH, ACK] Seq=38 Ack=1 Win=42496 Len=7240 TSval=3234469210 TSecr=3470697845"
"89","4.624572195","10.0.0.3","10.0.0.7","TCP","7306","35568  >  5202 [PSH, ACK] Seq=7278 Ack=1 Win=42496 Len=7240 TSval=3234469210 TSecr=3470697845"
"90","4.624631774","10.0.0.3","10.0.0.7","TCP","7306","35596  >  5202 [PSH, ACK] Seq=38 Ack=1 Win=42496 Len=7240 TSval=3234469210 TSecr=3470697846"
"91","4.624636754","10.0.0.3","10.0.0.7","TCP","7306","35596  >  5202 [PSH, ACK] Seq=7278 Ack=1 Win=42496 Len=7240 TSval=3234469210 TSecr=3470697846"
"92","4.624660366","10.0.0.3","10.0.0.7","TCP","7306","35582  >  5202 [PSH, ACK] Seq=38 Ack=1 Win=42496 Len=7240 TSval=3234469210 TSecr=3470697845"
"93","4.624670212","10.0.0.3","10.0.0.7","TCP","7306","35582  >  5202 [PSH, ACK] Seq=7278 Ack=1 Win=42496 Len=7240 TSval=3234469210 TSecr=3470697845"
"94","4.627840350","10.0.0.3","10.0.0.7","TCP","1514","35556  >  5202 [ACK] Seq=14518 Ack=1 Win=42496 Len=1448 TSval=3234469214 TSecr=3470697844"
"95","4.627840926","10.0.0.3","10.0.0.7","TCP","1514","35546  >  5202 [ACK] Seq=14518 Ack=1 Win=42496 Len=1448 TSval=3234469214 TSecr=3470697841"
"96","4.627849874","10.0.0.3","10.0.0.7","TCP","1514","35596  >  5202 [ACK] Seq=14518 Ack=1 Win=42496 Len=1448 TSval=3234469214 TSecr=3470697846"
"97","4.627850607","10.0.0.3","10.0.0.7","TCP","1514","35562  >  5202 [ACK] Seq=14518 Ack=1 Win=42496 Len=1448 TSval=3234469214 TSecr=3470697844"
"98","4.627851256","10.0.0.3","10.0.0.7","TCP","1514","35550  >  5202 [ACK] Seq=14518 Ack=1 Win=42496 Len=1448 TSval=3234469214 TSecr=3470697842"
"99","4.627882282","10.0.0.3","10.0.0.7","TCP","1514","35568  >  5202 [ACK] Seq=14518 Ack=1 Win=42496 Len=1448 TSval=3234469214 TSecr=3470697845"
"100","4.627883717","10.0.0.3","10.0.0.7","TCP","1514","35532  >  5202 [ACK] Seq=14518 Ack=1 Win=42496 Len=1448 TSval=3234469214 TSecr=3470697840"
"101","4.627884353","10.0.0.3","10.0.0.7","TCP","1514","35582  >  5202 [ACK] Seq=14518 Ack=1 Win=42496 Len=1448 TSval=3234469214 TSecr=3470697845"
"102","4.627886670","10.0.0.3","10.0.0.7","TCP","1514","35554  >  5202 [ACK] Seq=14518 Ack=1 Win=42496 Len=1448 TSval=3234469214 TSecr=3470697843"
"103","4.628838802","10.0.0.3","10.0.0.7","TCP","4410","35524  >  5202 [PSH, ACK] Seq=24654 Ack=1 Win=42496 Len=4344 TSval=3234469215 TSecr=3470697846"
"104","4.637822855","10.0.0.7","10.0.0.3","TCP","66","5202  >  35524 [ACK] Seq=1 Ack=14518 Win=70656 Len=0 TSval=3470697859 TSecr=3234469210"
"105","4.637829920","10.0.0.3","10.0.0.7","TCP","7306","35524  >  5202 [PSH, ACK] Seq=28998 Ack=1 Win=42496 Len=7240 TSval=3234469223 TSecr=3470697859"
"106","4.640241568","10.0.0.7","10.0.0.3","TCP","66","5202  >  35532 [ACK] Seq=1 Ack=7278 Win=56832 Len=0 TSval=3470697862 TSecr=3234469210"
"107","4.640247633","10.0.0.3","10.0.0.7","TCP","10202","35532  >  5202 [PSH, ACK] Seq=15966 Ack=1 Win=42496 Len=10136 TSval=3234469226 TSecr=3470697862"
"108","4.642661528","10.0.0.7","10.0.0.3","TCP","66","5202  >  35532 [ACK] Seq=1 Ack=14518 Win=70656 Len=0 TSval=3470697864 TSecr=3234469210"
"109","4.642666790","10.0.0.3","10.0.0.7","TCP","10202","35532  >  5202 [PSH, ACK] Seq=26102 Ack=1 Win=42496 Len=10136 TSval=3234469228 TSecr=3470697864"
"110","4.646540095","10.0.0.7","10.0.0.3","TCP","66","5202  >  35550 [ACK] Seq=1 Ack=7278 Win=56832 Len=0 TSval=3470697868 TSecr=3234469210"
"111","4.646545696","10.0.0.3","10.0.0.7","TCP","10202","35550  >  5202 [PSH, ACK] Seq=15966 Ack=1 Win=42496 Len=10136 TSval=3234469232 TSecr=3470697868"
"112","4.648841849","10.0.0.7","10.0.0.3","TCP","66","5202  >  35550 [ACK] Seq=1 Ack=14518 Win=70656 Len=0 TSval=3470697871 TSecr=3234469210"
"113","4.648849178","10.0.0.3","10.0.0.7","TCP","10202","35550  >  5202 [PSH, ACK] Seq=26102 Ack=1 Win=42496 Len=10136 TSval=3234469235 TSecr=3470697871"
"114","4.651141884","10.0.0.7","10.0.0.3","TCP","66","5202  >  35546 [ACK] Seq=1 Ack=7278 Win=56832 Len=0 TSval=3470697873 TSecr=3234469210"
"115","4.651147960","10.0.0.3","10.0.0.7","TCP","10202","35546  >  5202 [PSH, ACK] Seq=15966 Ack=1 Win=42496 Len=10136 TSval=3234469237 TSecr=3470697873"
"116","4.654046352","10.0.0.7","10.0.0.3","TCP","66","5202  >  35546 [ACK] Seq=1 Ack=14518 Win=70656 Len=0 TSval=3470697876 TSecr=3234469210"
"117","4.654053045","10.0.0.3","10.0.0.7","TCP","10202","35546  >  5202 [PSH, ACK] Seq=26102 Ack=1 Win=42496 Len=10136 TSval=3234469240 TSecr=3470697876"
"118","4.656957944","10.0.0.7","10.0.0.3","TCP","66","5202  >  35524 [ACK] Seq=1 Ack=24654 Win=68096 Len=0 TSval=3470697879 TSecr=3234469210"
"119","4.656969105","10.0.0.3","10.0.0.7","TCP","18890","35524  >  5202 [PSH, ACK] Seq=36238 Ack=1 Win=42496 Len=18824 TSval=3234469243 TSecr=3470697879"
"120","4.660347332","10.0.0.7","10.0.0.3","TCP","66","5202  >  35554 [ACK] Seq=1 Ack=7278 Win=56832 Len=0 TSval=3470697882 TSecr=3234469210"
"121","4.660354318","10.0.0.3","10.0.0.7","TCP","10202","35554  >  5202 [PSH, ACK] Seq=15966 Ack=1 Win=42496 Len=10136 TSval=3234469246 TSecr=3470697882"
"122","4.662649164","10.0.0.7","10.0.0.3","TCP","66","5202  >  35556 [ACK] Seq=1 Ack=7278 Win=56832 Len=0 TSval=3470697884 TSecr=3234469210"
"123","4.662655355","10.0.0.3","10.0.0.7","TCP","10202","35556  >  5202 [PSH, ACK] Seq=15966 Ack=1 Win=42496 Len=10136 TSval=3234469248 TSecr=3470697884"
"124","4.664469897","10.0.0.7","10.0.0.3","TCP","66","5202  >  35562 [ACK] Seq=1 Ack=7278 Win=56832 Len=0 TSval=3470697886 TSecr=3234469210"
"125","4.664476857","10.0.0.3","10.0.0.7","TCP","10202","35562  >  5202 [PSH, ACK] Seq=15966 Ack=1 Win=42496 Len=10136 TSval=3234469250 TSecr=3470697886"
"126","4.666895563","10.0.0.7","10.0.0.3","TCP","66","5202  >  35554 [ACK] Seq=1 Ack=14518 Win=70656 Len=0 TSval=3470697889 TSecr=3234469210"
"127","4.666905910","10.0.0.3","10.0.0.7","TCP","10202","35554  >  5202 [PSH, ACK] Seq=26102 Ack=1 Win=42496 Len=10136 TSval=3234469253 TSecr=3470697889"
"128","4.668719842","10.0.0.7","10.0.0.3","TCP","66","5202  >  35556 [ACK] Seq=1 Ack=14518 Win=70656 Len=0 TSval=3470697890 TSecr=3234469210"
"129","4.668736697","10.0.0.3","10.0.0.7","TCP","10202","35556  >  5202 [PSH, ACK] Seq=26102 Ack=1 Win=42496 Len=10136 TSval=3234469254 TSecr=3470697890"
"130","4.670524678","10.0.0.7","10.0.0.3","TCP","66","5202  >  35562 [ACK] Seq=1 Ack=14518 Win=70656 Len=0 TSval=3470697892 TSecr=3234469210"
"131","4.670534658","10.0.0.3","10.0.0.7","TCP","10202","35562  >  5202 [PSH, ACK] Seq=26102 Ack=1 Win=42496 Len=10136 TSval=3234469256 TSecr=3470697892"
"132","4.672947453","10.0.0.7","10.0.0.3","TCP","66","5202  >  35568 [ACK] Seq=1 Ack=7278 Win=56832 Len=0 TSval=3470697895 TSecr=3234469210"
"133","4.672954341","10.0.0.3","10.0.0.7","TCP","10202","35568  >  5202 [PSH, ACK] Seq=15966 Ack=1 Win=42496 Len=10136 TSval=3234469259 TSecr=3470697895"
"134","4.675366254","10.0.0.7","10.0.0.3","TCP","66","5202  >  35568 [ACK] Seq=1 Ack=14518 Win=70656 Len=0 TSval=3470697897 TSecr=3234469210"
"135","4.675372642","10.0.0.3","10.0.0.7","TCP","10202","35568  >  5202 [PSH, ACK] Seq=26102 Ack=1 Win=42496 Len=10136 TSval=3234469261 TSecr=3470697897"
"136","4.677788847","10.0.0.7","10.0.0.3","TCP","66","5202  >  35596 [ACK] Seq=1 Ack=7278 Win=56832 Len=0 TSval=3470697899 TSecr=3234469210"
"137","4.677794478","10.0.0.3","10.0.0.7","TCP","10202","35596  >  5202 [PSH, ACK] Seq=15966 Ack=1 Win=42496 Len=10136 TSval=3234469263 TSecr=3470697899"
"138","4.680208722","10.0.0.7","10.0.0.3","TCP","66","5202  >  35596 [ACK] Seq=1 Ack=14518 Win=70656 Len=0 TSval=3470697902 TSecr=3234469210"
"139","4.680215388","10.0.0.3","10.0.0.7","TCP","10202","35596  >  5202 [PSH, ACK] Seq=26102 Ack=1 Win=42496 Len=10136 TSval=3234469266 TSecr=3470697902"
"140","4.682633174","10.0.0.7","10.0.0.3","TCP","66","5202  >  35582 [ACK] Seq=1 Ack=7278 Win=56832 Len=0 TSval=3470697904 TSecr=3234469210"
"141","4.682638682","10.0.0.3","10.0.0.7","TCP","10202","35582  >  5202 [PSH, ACK] Seq=15966 Ack=1 Win=42496 Len=10136 TSval=3234469268 TSecr=3470697904"
"142","4.685053238","10.0.0.7","10.0.0.3","TCP","66","5202  >  35582 [ACK] Seq=1 Ack=14518 Win=70656 Len=0 TSval=3470697907 TSecr=3234469210"
"143","4.685059595","10.0.0.3","10.0.0.7","TCP","10202","35582  >  5202 [PSH, ACK] Seq=26102 Ack=1 Win=42496 Len=10136 TSval=3234469271 TSecr=3470697907"
"144","4.687526910","10.0.0.7","10.0.0.3","TCP","66","5202  >  35556 [ACK] Seq=1 Ack=15966 Win=73216 Len=0 TSval=3470697909 TSecr=3234469214"
"145","4.687604068","10.0.0.7","10.0.0.3","TCP","66","5202  >  35546 [ACK] Seq=1 Ack=15966 Win=73216 Len=0 TSval=3470697909 TSecr=3234469214"
"146","4.689545856","10.0.0.7","10.0.0.3","TCP","66","5202  >  35596 [ACK] Seq=1 Ack=15966 Win=73216 Len=0 TSval=3470697911 TSecr=3234469214"
"147","4.689662895","10.0.0.7","10.0.0.3","TCP","66","5202  >  35562 [ACK] Seq=1 Ack=15966 Win=73216 Len=0 TSval=3470697911 TSecr=3234469214"
"148","4.689784110","10.0.0.7","10.0.0.3","TCP","66","5202  >  35550 [ACK] Seq=1 Ack=15966 Win=73216 Len=0 TSval=3470697911 TSecr=3234469214"
"149","4.689904655","10.0.0.7","10.0.0.3","TCP","66","5202  >  35568 [ACK] Seq=1 Ack=15966 Win=73216 Len=0 TSval=3470697912 TSecr=3234469214"
"150","4.690025961","10.0.0.7","10.0.0.3","TCP","66","5202  >  35532 [ACK] Seq=1 Ack=15966 Win=73216 Len=0 TSval=3470697912 TSecr=3234469214"
"151","4.690147131","10.0.0.7","10.0.0.3","TCP","66","5202  >  35582 [ACK] Seq=1 Ack=15966 Win=73216 Len=0 TSval=3470697912 TSecr=3234469214"
"152","4.692085510","10.0.0.7","10.0.0.3","TCP","66","5202  >  35554 [ACK] Seq=1 Ack=15966 Win=73216 Len=0 TSval=3470697914 TSecr=3234469214"
"153","4.692206685","10.0.0.7","10.0.0.3","TCP","66","5202  >  35524 [ACK] Seq=1 Ack=28998 Win=73216 Len=0 TSval=3470697914 TSecr=3234469215"
"154","4.694385666","10.0.0.7","10.0.0.3","TCP","66","5202  >  35524 [ACK] Seq=1 Ack=36238 Win=70656 Len=0 TSval=3470697916 TSecr=3234469223"
"155","4.694390092","10.0.0.3","10.0.0.7","TCP","2962","35524  >  5202 [PSH, ACK] Seq=55062 Ack=1 Win=42496 Len=2896 TSval=3234469280 TSecr=3470697916"
"156","4.694394125","10.0.0.3","10.0.0.7","TCP","21786","35524  >  5202 [PSH, ACK] Seq=57958 Ack=1 Win=42496 Len=21720 TSval=3234469280 TSecr=3470697916"
"157","4.696808338","10.0.0.7","10.0.0.3","TCP","66","5202  >  35532 [ACK] Seq=1 Ack=26102 Win=68096 Len=0 TSval=3470697918 TSecr=3234469226"
"158","4.696813700","10.0.0.3","10.0.0.7","TCP","10202","35532  >  5202 [PSH, ACK] Seq=36238 Ack=1 Win=42496 Len=10136 TSval=3234469282 TSecr=3470697918"
"159","4.696816061","10.0.0.3","10.0.0.7","TCP","11650","35532  >  5202 [PSH, ACK] Seq=46374 Ack=1 Win=42496 Len=11584 TSval=3234469282 TSecr=3470697918"
"160","4.701288900","10.0.0.7","10.0.0.3","TCP","66","5202  >  35532 [ACK] Seq=1 Ack=36238 Win=68096 Len=0 TSval=3470697923 TSecr=3234469228"
"161","4.701295929","10.0.0.3","10.0.0.7","TCP","21786","35532  >  5202 [PSH, ACK] Seq=57958 Ack=1 Win=42496 Len=21720 TSval=3234469287 TSecr=3470697923"
"162","4.703954655","10.0.0.7","10.0.0.3","TCP","66","5202  >  35550 [ACK] Seq=1 Ack=26102 Win=68096 Len=0 TSval=3470697926 TSecr=3234469232"
"163","4.703959781","10.0.0.3","10.0.0.7","TCP","10202","35550  >  5202 [PSH, ACK] Seq=36238 Ack=1 Win=42496 Len=10136 TSval=3234469290 TSecr=3470697926"
"164","4.703961798","10.0.0.3","10.0.0.7","TCP","11650","35550  >  5202 [PSH, ACK] Seq=46374 Ack=1 Win=42496 Len=11584 TSval=3234469290 TSecr=3470697926"
"165","4.708435929","10.0.0.7","10.0.0.3","TCP","66","5202  >  35550 [ACK] Seq=1 Ack=36238 Win=93696 Len=0 TSval=3470697930 TSecr=3234469235"
"166","4.708442332","10.0.0.3","10.0.0.7","TCP","21786","35550  >  5202 [PSH, ACK] Seq=57958 Ack=1 Win=42496 Len=21720 TSval=3234469294 TSecr=3470697930"
"167","4.711100927","10.0.0.7","10.0.0.3","TCP","66","5202  >  35546 [ACK] Seq=1 Ack=26102 Win=68096 Len=0 TSval=3470697933 TSecr=3234469237"
"168","4.711109237","10.0.0.3","10.0.0.7","TCP","10202","35546  >  5202 [PSH, ACK] Seq=36238 Ack=1 Win=42496 Len=10136 TSval=3234469297 TSecr=3470697933"
"169","4.711111912","10.0.0.3","10.0.0.7","TCP","11650","35546  >  5202 [PSH, ACK] Seq=46374 Ack=1 Win=42496 Len=11584 TSval=3234469297 TSecr=3470697933"
"170","4.715590473","10.0.0.7","10.0.0.3","TCP","66","5202  >  35546 [ACK] Seq=1 Ack=36238 Win=93696 Len=0 TSval=3470697937 TSecr=3234469240"
"171","4.715602508","10.0.0.3","10.0.0.7","TCP","21786","35546  >  5202 [PSH, ACK] Seq=57958 Ack=1 Win=42496 Len=21720 TSval=3234469301 TSecr=3470697937"
"172","4.716435669","10.0.0.7","10.0.0.3","TCP","66","5202  >  35524 [ACK] Seq=1 Ack=55062 Win=60416 Len=0 TSval=3470697938 TSecr=3234469243"
"173","4.716442698","10.0.0.3","10.0.0.7","TCP","27578","35524  >  5202 [PSH, ACK] Seq=79678 Ack=1 Win=42496 Len=27512 TSval=3234469302 TSecr=3470697938"
"174","4.718131085","10.0.0.7","10.0.0.3","TCP","66","5202  >  35554 [ACK] Seq=1 Ack=26102 Win=68096 Len=0 TSval=3470697940 TSecr=3234469246"
"175","4.718138033","10.0.0.3","10.0.0.7","TCP","10202","35554  >  5202 [PSH, ACK] Seq=36238 Ack=1 Win=42496 Len=10136 TSval=3234469304 TSecr=3470697940"
"176","4.718140959","10.0.0.3","10.0.0.7","TCP","11650","35554  >  5202 [PSH, ACK] Seq=46374 Ack=1 Win=42496 Len=11584 TSval=3234469304 TSecr=3470697940"
"177","4.718978776","10.0.0.7","10.0.0.3","TCP","66","5202  >  35556 [ACK] Seq=1 Ack=26102 Win=68096 Len=0 TSval=3470697941 TSecr=3234469248"
"178","4.718983905","10.0.0.3","10.0.0.7","TCP","10202","35556  >  5202 [PSH, ACK] Seq=36238 Ack=1 Win=42496 Len=10136 TSval=3234469305 TSecr=3470697941"
"179","4.718985546","10.0.0.3","10.0.0.7","TCP","11650","35556  >  5202 [PSH, ACK] Seq=46374 Ack=1 Win=42496 Len=11584 TSval=3234469305 TSecr=3470697941"
"180","4.719827438","10.0.0.7","10.0.0.3","TCP","66","5202  >  35562 [ACK] Seq=1 Ack=26102 Win=68096 Len=0 TSval=3470697941 TSecr=3234469250"
"181","4.719834934","10.0.0.3","10.0.0.7","TCP","10202","35562  >  5202 [PSH, ACK] Seq=36238 Ack=1 Win=42496 Len=10136 TSval=3234469305 TSecr=3470697941"
"182","4.719836838","10.0.0.3","10.0.0.7","TCP","11650","35562  >  5202 [PSH, ACK] Seq=46374 Ack=1 Win=42496 Len=11584 TSval=3234469305 TSecr=3470697941"
"183","4.720794913","10.0.0.7","10.0.0.3","TCP","66","5202  >  35554 [ACK] Seq=1 Ack=36238 Win=93696 Len=0 TSval=3470697942 TSecr=3234469253"
"184","4.720800967","10.0.0.3","10.0.0.7","TCP","21786","35554  >  5202 [PSH, ACK] Seq=57958 Ack=1 Win=42496 Len=21720 TSval=3234469306 TSecr=3470697942"
"185","4.722733288","10.0.0.7","10.0.0.3","TCP","66","5202  >  35556 [ACK] Seq=1 Ack=36238 Win=93696 Len=0 TSval=3470697944 TSecr=3234469254"
"186","4.722739224","10.0.0.3","10.0.0.7","TCP","21786","35556  >  5202 [PSH, ACK] Seq=57958 Ack=1 Win=42496 Len=21720 TSval=3234469308 TSecr=3470697944"
"187","4.723581549","10.0.0.7","10.0.0.3","TCP","66","5202  >  35562 [ACK] Seq=1 Ack=36238 Win=93696 Len=0 TSval=3470697945 TSecr=3234469256"
"188","4.723587454","10.0.0.3","10.0.0.7","TCP","21786","35562  >  5202 [PSH, ACK] Seq=57958 Ack=1 Win=42496 Len=21720 TSval=3234469309 TSecr=3470697945"
"189","4.727336688","10.0.0.7","10.0.0.3","TCP","66","5202  >  35568 [ACK] Seq=1 Ack=26102 Win=68096 Len=0 TSval=3470697949 TSecr=3234469259"
"190","4.727342526","10.0.0.3","10.0.0.7","TCP","10202","35568  >  5202 [PSH, ACK] Seq=36238 Ack=1 Win=42496 Len=10136 TSval=3234469313 TSecr=3470697949"
"191","4.727344461","10.0.0.3","10.0.0.7","TCP","11650","35568  >  5202 [PSH, ACK] Seq=46374 Ack=1 Win=42496 Len=11584 TSval=3234469313 TSecr=3470697949"
"192","4.730554606","10.0.0.7","10.0.0.3","TCP","66","5202  >  35568 [ACK] Seq=1 Ack=36238 Win=93696 Len=0 TSval=3470697952 TSecr=3234469261"
"193","4.731399989","10.0.0.7","10.0.0.3","TCP","66","5202  >  35596 [ACK] Seq=1 Ack=26102 Win=68096 Len=0 TSval=3470697953 TSecr=3234469263"
"194","4.731406640","10.0.0.3","10.0.0.7","TCP","10202","35596  >  5202 [PSH, ACK] Seq=36238 Ack=1 Win=42496 Len=10136 TSval=3234469317 TSecr=3470697953"
"195","4.731408874","10.0.0.3","10.0.0.7","TCP","11650","35596  >  5202 [PSH, ACK] Seq=46374 Ack=1 Win=42496 Len=11584 TSval=3234469317 TSecr=3470697953"
"196","4.732246234","10.0.0.7","10.0.0.3","TCP","66","5202  >  35596 [ACK] Seq=1 Ack=36238 Win=68096 Len=0 TSval=3470697954 TSecr=3234469266"
"197","4.732256787","10.0.0.3","10.0.0.7","TCP","21786","35596  >  5202 [PSH, ACK] Seq=57958 Ack=1 Win=42496 Len=21720 TSval=3234469318 TSecr=3470697954"
"198","4.736002537","10.0.0.7","10.0.0.3","TCP","66","5202  >  35582 [ACK] Seq=1 Ack=26102 Win=68096 Len=0 TSval=3470697958 TSecr=3234469268"
"199","4.736008800","10.0.0.3","10.0.0.7","TCP","10202","35582  >  5202 [PSH, ACK] Seq=36238 Ack=1 Win=42496 Len=10136 TSval=3234469322 TSecr=3470697958"
"200","4.736010690","10.0.0.3","10.0.0.7","TCP","11650","35582  >  5202 [PSH, ACK] Seq=46374 Ack=1 Win=42496 Len=11584 TSval=3234469322 TSecr=3470697958"
"201","4.736848173","10.0.0.7","10.0.0.3","TCP","66","5202  >  35582 [ACK] Seq=1 Ack=36238 Win=93696 Len=0 TSval=3470697959 TSecr=3234469271"
"202","4.736857761","10.0.0.3","10.0.0.7","TCP","21786","35582  >  5202 [PSH, ACK] Seq=57958 Ack=1 Win=42496 Len=21720 TSval=3234469323 TSecr=3470697959"
"203","4.745899681","10.0.0.7","10.0.0.3","TCP","66","5202  >  35524 [ACK] Seq=1 Ack=57958 Win=74240 Len=0 TSval=3470697968 TSecr=3234469280"
"204","4.746139308","10.0.0.7","10.0.0.3","TCP","66","5202  >  35524 [ACK] Seq=1 Ack=79678 Win=117760 Len=0 TSval=3470697968 TSecr=3234469280"
"205","4.746145657","10.0.0.3","10.0.0.7","TCP","8354","35524  >  5202 [PSH, ACK] Seq=107190 Ack=1 Win=42496 Len=8288 TSval=3234469332 TSecr=3470697968"
"206","4.746152478","10.0.0.3","10.0.0.7","TCP","36266","35524  >  5202 [PSH, ACK] Seq=115478 Ack=1 Win=42496 Len=36200 TSval=3234469332 TSecr=3470697968"
"207","4.747958242","10.0.0.7","10.0.0.3","TCP","66","5202  >  35532 [ACK] Seq=1 Ack=46374 Win=68096 Len=0 TSval=3470697970 TSecr=3234469282"
"208","4.750201698","10.0.0.7","10.0.0.3","TCP","66","5202  >  35532 [ACK] Seq=1 Ack=57958 Win=96768 Len=0 TSval=3470697972 TSecr=3234469282"
"209","4.750207762","10.0.0.3","10.0.0.7","TCP","7306","35532  >  5202 [PSH, ACK] Seq=79678 Ack=1 Win=42496 Len=7240 TSval=3234469336 TSecr=3470697972"
"210","4.750212297","10.0.0.3","10.0.0.7","TCP","27578","35532  >  5202 [PSH, ACK] Seq=86918 Ack=1 Win=42496 Len=27512 TSval=3234469336 TSecr=3470697972"
"211","4.751169575","10.0.0.7","10.0.0.3","TCP","66","5202  >  35532 [ACK] Seq=1 Ack=79678 Win=139776 Len=0 TSval=3470697973 TSecr=3234469287"
"212","4.751177354","10.0.0.3","10.0.0.7","TCP","36266","35532  >  5202 [PSH, ACK] Seq=114430 Ack=1 Win=42496 Len=36200 TSval=3234469337 TSecr=3470697973"
"213","4.755897840","10.0.0.7","10.0.0.3","TCP","66","5202  >  35550 [ACK] Seq=1 Ack=46374 Win=114176 Len=0 TSval=3470697978 TSecr=3234469290"
"214","4.756742785","10.0.0.7","10.0.0.3","TCP","66","5202  >  35550 [ACK] Seq=1 Ack=57958 Win=137216 Len=0 TSval=3470697978 TSecr=3234469290"
"215","4.756747834","10.0.0.3","10.0.0.7","TCP","7306","35550  >  5202 [PSH, ACK] Seq=79678 Ack=1 Win=42496 Len=7240 TSval=3234469342 TSecr=3470697978"
"216","4.756751462","10.0.0.3","10.0.0.7","TCP","27578","35550  >  5202 [PSH, ACK] Seq=86918 Ack=1 Win=42496 Len=27512 TSval=3234469342 TSecr=3470697978"
"217","4.760619482","10.0.0.7","10.0.0.3","TCP","66","5202  >  35550 [ACK] Seq=1 Ack=79678 Win=174080 Len=0 TSval=3470697982 TSecr=3234469294"
"218","4.760632772","10.0.0.3","10.0.0.7","TCP","46402","35550  >  5202 [PSH, ACK] Seq=114430 Ack=1 Win=42496 Len=46336 TSval=3234469346 TSecr=3470697982"
"219","4.762436896","10.0.0.7","10.0.0.3","TCP","66","5202  >  35546 [ACK] Seq=1 Ack=46374 Win=114176 Len=0 TSval=3470697984 TSecr=3234469297"
"220","4.766191265","10.0.0.7","10.0.0.3","TCP","66","5202  >  35546 [ACK] Seq=1 Ack=57958 Win=137216 Len=0 TSval=3470697988 TSecr=3234469297"
"221","4.766198747","10.0.0.3","10.0.0.7","TCP","7306","35546  >  5202 [PSH, ACK] Seq=79678 Ack=1 Win=42496 Len=7240 TSval=3234469352 TSecr=3470697988"
"222","4.766204181","10.0.0.3","10.0.0.7","TCP","27578","35546  >  5202 [PSH, ACK] Seq=86918 Ack=1 Win=42496 Len=27512 TSval=3234469352 TSecr=3470697988"
"223","4.767157409","10.0.0.7","10.0.0.3","TCP","66","5202  >  35546 [ACK] Seq=1 Ack=79678 Win=174080 Len=0 TSval=3470697989 TSecr=3234469301"
"224","4.767167609","10.0.0.3","10.0.0.7","TCP","46402","35546  >  5202 [PSH, ACK] Seq=114430 Ack=1 Win=42496 Len=46336 TSval=3234469353 TSecr=3470697989"
"225","4.768980623","10.0.0.7","10.0.0.3","TCP","66","5202  >  35524 [ACK] Seq=1 Ack=107190 Win=173056 Len=0 TSval=3470697991 TSecr=3234469302"
"226","4.768989592","10.0.0.3","10.0.0.7","TCP","36266","35524  >  5202 [PSH, ACK] Seq=151678 Ack=1 Win=42496 Len=36200 TSval=3234469355 TSecr=3470697991"
"227","4.772677741","10.0.0.7","10.0.0.3","TCP","66","5202  >  35554 [ACK] Seq=1 Ack=46374 Win=114176 Len=0 TSval=3470697994 TSecr=3234469304"
"228","4.773523485","10.0.0.7","10.0.0.3","TCP","66","5202  >  35554 [ACK] Seq=1 Ack=57958 Win=137216 Len=0 TSval=3470697995 TSecr=3234469304"
"229","4.773532758","10.0.0.3","10.0.0.7","TCP","7306","35554  >  5202 [PSH, ACK] Seq=79678 Ack=1 Win=42496 Len=7240 TSval=3234469359 TSecr=3470697995"
"230","4.773538814","10.0.0.3","10.0.0.7","TCP","27578","35554  >  5202 [PSH, ACK] Seq=86918 Ack=1 Win=42496 Len=27512 TSval=3234469359 TSecr=3470697995"
"231","4.774505844","10.0.0.7","10.0.0.3","TCP","66","5202  >  35556 [ACK] Seq=1 Ack=46374 Win=114176 Len=0 TSval=3470697996 TSecr=3234469305"
"232","4.830693798","10.0.0.7","10.0.0.3","TCP","66","5202  >  35556 [ACK] Seq=1 Ack=57958 Win=137216 Len=0 TSval=3470698052 TSecr=3234469305"
"233","4.830701194","10.0.0.3","10.0.0.7","TCP","7306","35556  >  5202 [PSH, ACK] Seq=79678 Ack=1 Win=42496 Len=7240 TSval=3234469416 TSecr=3470698052"
"234","4.830710486","10.0.0.3","10.0.0.7","TCP","27578","35556  >  5202 [PSH, ACK] Seq=86918 Ack=1 Win=42496 Len=27512 TSval=3234469416 TSecr=3470698052"
"235","4.831661559","10.0.0.7","10.0.0.3","TCP","66","5202  >  35562 [ACK] Seq=1 Ack=46374 Win=114176 Len=0 TSval=3470698053 TSecr=3234469305"
"236","4.832507991","10.0.0.7","10.0.0.3","TCP","66","5202  >  35562 [ACK] Seq=1 Ack=57958 Win=137216 Len=0 TSval=3470698054 TSecr=3234469305"
"237","4.832512792","10.0.0.3","10.0.0.7","TCP","7306","35562  >  5202 [PSH, ACK] Seq=79678 Ack=1 Win=42496 Len=7240 TSval=3234469418 TSecr=3470698054"
"238","4.832520901","10.0.0.3","10.0.0.7","TCP","27578","35562  >  5202 [PSH, ACK] Seq=86918 Ack=1 Win=42496 Len=27512 TSval=3234469418 TSecr=3470698054"
"239","4.838933799","10.0.0.7","10.0.0.3","TCP","66","5202  >  35554 [ACK] Seq=1 Ack=79678 Win=174080 Len=0 TSval=3470698061 TSecr=3234469306"
"240","4.846195673","10.0.0.7","10.0.0.3","TCP","66","5202  >  35556 [ACK] Seq=1 Ack=79678 Win=174080 Len=0 TSval=3470698068 TSecr=3234469308"
"241","4.853467905","10.0.0.7","10.0.0.3","TCP","66","5202  >  35562 [ACK] Seq=1 Ack=79678 Win=174080 Len=0 TSval=3470698075 TSecr=3234469309"
"242","4.859641091","10.0.0.7","10.0.0.3","TCP","66","5202  >  35568 [ACK] Seq=1 Ack=46374 Win=114176 Len=0 TSval=3470698081 TSecr=3234469313"
"243","4.859650822","10.0.0.3","10.0.0.7","TCP","8754","35568  >  5202 [PSH, ACK] Seq=57958 Ack=1 Win=42496 Len=8688 TSval=3234469445 TSecr=3470698081"
"244","4.859655434","10.0.0.3","10.0.0.7","TCP","13098","35568  >  5202 [PSH, ACK] Seq=66646 Ack=1 Win=42496 Len=13032 TSval=3234469445 TSecr=3470698081"
"245","4.859660078","10.0.0.3","10.0.0.7","TCP","27578","35568  >  5202 [PSH, ACK] Seq=79678 Ack=1 Win=42496 Len=27512 TSval=3234469445 TSecr=3470698081"
"246","4.860485457","10.0.0.7","10.0.0.3","TCP","66","5202  >  35568 [ACK] Seq=1 Ack=57958 Win=137216 Len=0 TSval=3470698082 TSecr=3234469313"
"247","4.861456514","10.0.0.7","10.0.0.3","TCP","66","5202  >  35596 [ACK] Seq=1 Ack=46374 Win=93696 Len=0 TSval=3470698083 TSecr=3234469317"
"248","4.862302950","10.0.0.7","10.0.0.3","TCP","66","5202  >  35596 [ACK] Seq=1 Ack=57958 Win=116736 Len=0 TSval=3470698084 TSecr=3234469317"
"249","4.862310858","10.0.0.3","10.0.0.7","TCP","7306","35596  >  5202 [PSH, ACK] Seq=79678 Ack=1 Win=42496 Len=7240 TSval=3234469448 TSecr=3470698084"
"250","4.862315515","10.0.0.3","10.0.0.7","TCP","27578","35596  >  5202 [PSH, ACK] Seq=86918 Ack=1 Win=42496 Len=27512 TSval=3234469448 TSecr=3470698084"
"251","4.868722910","10.0.0.7","10.0.0.3","TCP","66","5202  >  35596 [ACK] Seq=1 Ack=79678 Win=160256 Len=0 TSval=3470698090 TSecr=3234469318"
"252","4.868732532","10.0.0.3","10.0.0.7","TCP","36266","35596  >  5202 [PSH, ACK] Seq=114430 Ack=1 Win=42496 Len=36200 TSval=3234469454 TSecr=3470698090"
"253","4.870545353","10.0.0.7","10.0.0.3","TCP","66","5202  >  35582 [ACK] Seq=1 Ack=46374 Win=114176 Len=0 TSval=3470698092 TSecr=3234469322"
"254","4.876839884","10.0.0.7","10.0.0.3","TCP","66","5202  >  35582 [ACK] Seq=1 Ack=57958 Win=137216 Len=0 TSval=3470698099 TSecr=3234469322"
"255","4.876848293","10.0.0.3","10.0.0.7","TCP","7306","35582  >  5202 [PSH, ACK] Seq=79678 Ack=1 Win=42496 Len=7240 TSval=3234469463 TSecr=3470698099"
"256","4.876852587","10.0.0.3","10.0.0.7","TCP","27578","35582  >  5202 [PSH, ACK] Seq=86918 Ack=1 Win=42496 Len=27512 TSval=3234469463 TSecr=3470698099"
"257","4.877806160","10.0.0.7","10.0.0.3","TCP","66","5202  >  35582 [ACK] Seq=1 Ack=79678 Win=174080 Len=0 TSval=3470698099 TSecr=3234469323"
"258","4.877813868","10.0.0.3","10.0.0.7","TCP","36266","35582  >  5202 [PSH, ACK] Seq=114430 Ack=1 Win=42496 Len=36200 TSval=3234469463 TSecr=3470698099"
"259","4.885129267","10.0.0.7","10.0.0.3","TCP","66","5202  >  35524 [ACK] Seq=1 Ack=115478 Win=189440 Len=0 TSval=3470698107 TSecr=3234469332"
"260","4.885786479","10.0.0.7","10.0.0.3","TCP","66","5202  >  35524 [ACK] Seq=1 Ack=151678 Win=200704 Len=0 TSval=3470698107 TSecr=3234469332"
"261","4.885795149","10.0.0.3","10.0.0.7","TCP","36266","35524  >  5202 [PSH, ACK] Seq=187878 Ack=1 Win=42496 Len=36200 TSval=3234469471 TSecr=3470698107"
"262","4.888826127","10.0.0.7","10.0.0.3","TCP","66","5202  >  35532 [ACK] Seq=1 Ack=86918 Win=154624 Len=0 TSval=3470698110 TSecr=3234469336"
"263","4.889431713","10.0.0.7","10.0.0.3","TCP","66","5202  >  35532 [ACK] Seq=1 Ack=114430 Win=209408 Len=0 TSval=3470698111 TSecr=3234469336"
"264","4.889446102","10.0.0.3","10.0.0.7","TCP","23234","35532  >  5202 [PSH, ACK] Seq=150630 Ack=1 Win=42496 Len=23168 TSval=3234469475 TSecr=3470698111"
"265","4.893379549","10.0.0.7","10.0.0.3","TCP","66","5202  >  35532 [ACK] Seq=1 Ack=150630 Win=232960 Len=0 TSval=3470698115 TSecr=3234469337"
"266","4.893409765","10.0.0.3","10.0.0.7","TCP","13098","35532  >  5202 [PSH, ACK] Seq=173798 Ack=1 Win=42496 Len=13032 TSval=3234469479 TSecr=3470698115"
"267","4.893423752","10.0.0.3","10.0.0.7","TCP","36266","35532  >  5202 [PSH, ACK] Seq=186830 Ack=1 Win=42496 Len=36200 TSval=3234469479 TSecr=3470698115"
"268","4.899430452","10.0.0.7","10.0.0.3","TCP","66","5202  >  35550 [ACK] Seq=1 Ack=86918 Win=187392 Len=0 TSval=3470698121 TSecr=3234469342"
"269","4.901123829","10.0.0.7","10.0.0.3","TCP","66","5202  >  35550 [ACK] Seq=1 Ack=114430 Win=162816 Len=0 TSval=3470698123 TSecr=3234469342"
"270","4.901130553","10.0.0.3","10.0.0.7","TCP","13098","35550  >  5202 [PSH, ACK] Seq=160766 Ack=1 Win=42496 Len=13032 TSval=3234469487 TSecr=3470698123"
"271","4.901137482","10.0.0.3","10.0.0.7","TCP","43506","35550  >  5202 [PSH, ACK] Seq=173798 Ack=1 Win=42496 Len=43440 TSval=3234469487 TSecr=3470698123"
"272","4.903425832","10.0.0.7","10.0.0.3","TCP","66","5202  >  35550 [ACK] Seq=1 Ack=160766 Win=280064 Len=0 TSval=3470698125 TSecr=3234469346"
