"No.","Time","Source","Destination","Protocol","Length","Info"
"1","0.000000000","fe80::493f:17d2:bdb8:fde3","ff02::2","ICMPv6","62","Router Solicitation"
"2","0.515807706","fe80::38ab:5ff:fe9c:cce3","ff02::2","ICMPv6","70","Router Solicitation from 3a:ab:05:9c:cc:e3"
"3","1.028335543","fe80::1ca1:eeff:fed0:37de","ff02::2","ICMPv6","70","Router Solicitation from 1e:a1:ee:d0:37:de"
"4","1.028534109","fe80::68a5:40ff:fe1c:cad1","ff02::2","ICMPv6","70","Router Solicitation from 6a:a5:40:1c:ca:d1"
"5","1.541281385","fe80::18df:41ff:fe28:184c","ff02::2","ICMPv6","70","Router Solicitation from 1a:df:41:28:18:4c"
"6","2.052566003","fe80::ec63:80ff:fe39:bc80","ff02::2","ICMPv6","70","Router Solicitation from ee:63:80:39:bc:80"
"7","2.563440246","fe80::f44e:e0ff:fe2a:2b69","ff02::2","ICMPv6","70","Router Solicitation from f6:4e:e0:2a:2b:69"
"8","2.565330938","fe80::d852:9fff:fec5:3b5d","ff02::2","ICMPv6","70","Router Solicitation from da:52:9f:c5:3b:5d"
"9","2.710707607","fe80::493f:17d2:bdb8:fde3","ff02::fb","MDNS","107","Standard query 0x0000 PTR _ipps._tcp.local, ""QM"" question PTR _ipp._tcp.local, ""QM"" question"
"10","4.099071987","0.0.0.0","255.255.255.255","DHCP","334","DHCP Discover - Transaction ID 0x481287ed"
"11","8.781773968","f6:4e:e0:2a:2b:69","Broadcast","ARP","42","Who has 10.0.0.7? Tell 10.0.0.1"
"12","8.782289337","3a:ab:05:9c:cc:e3","Broadcast","ARP","42","Who has 10.0.0.7? Tell 10.0.0.2"
"13","8.783187051","6a:a5:40:1c:ca:d1","f6:4e:e0:2a:2b:69","ARP","42","10.0.0.7 is at 6a:a5:40:1c:ca:d1"
"14","8.783214343","10.0.0.1","10.0.0.7","TCP","74","40544  >  5201 [SYN] Seq=0 Win=42340 Len=0 MSS=1460 SACK_PERM TSval=2448097479 TSecr=0 WS=512"
"15","8.784160709","10.0.0.7","10.0.0.1","TCP","74","5201  >  40544 [SYN, ACK] Seq=0 Ack=1 Win=43440 Len=0 MSS=1460 SACK_PERM TSval=2176211804 TSecr=2448097479 WS=512"
"16","8.784210883","10.0.0.1","10.0.0.7","TCP","66","40544  >  5201 [ACK] Seq=1 Ack=1 Win=42496 Len=0 TSval=2448097481 TSecr=2176211804"
"17","8.784252356","10.0.0.1","10.0.0.7","iPerf3","103","40544  >  5201 Cookie: ""u63xxvtoqcqkesgm2taibxqy52tkdvje4zfu"""
"18","8.784288980","10.0.0.7","10.0.0.1","TCP","66","5201  >  40544 [ACK] Seq=1 Ack=38 Win=43520 Len=0 TSval=2176211805 TSecr=2448097482"
"19","8.784455830","10.0.0.7","10.0.0.1","iPerf3","67","5201  >  40544 PARAM_EXCHANGE(9)"
"20","8.784484157","10.0.0.1","10.0.0.7","TCP","66","40544  >  5201 [ACK] Seq=38 Ack=2 Win=42496 Len=0 TSval=2448097482 TSecr=2176211805"
"21","8.784632654","10.0.0.1","10.0.0.7","iPerf3","70","40544  >  5201 Next message is JSON of this length: 166"
"22","8.784715362","10.0.0.1","10.0.0.7","iPerf3/JSON","232","40544  >  5201 {""tcp"":true,""omit"":0,""time"":150,""num"":0,""blockcount"":0,""parallel"":10,""len"":131072,""bandwidth"":10000000,""pacing_timer"":1000,""congestion"":""bic"",""client_version"":""3.16""}, JSON"
"23","8.784816319","10.0.0.7","10.0.0.1","TCP","66","5201  >  40544 [ACK] Seq=2 Ack=208 Win=43520 Len=0 TSval=2176211805 TSecr=2448097482"
"24","8.784909532","10.0.0.7","10.0.0.1","iPerf3","67","5201  >  40544 CREATE_STREAMS(10)"
"25","8.784973464","10.0.0.1","10.0.0.7","TCP","74","40558  >  5201 [SYN] Seq=0 Win=42340 Len=0 MSS=1460 SACK_PERM TSval=2448097482 TSecr=0 WS=512"
"26","8.785005428","10.0.0.7","10.0.0.1","TCP","74","5201  >  40558 [SYN, ACK] Seq=0 Ack=1 Win=43440 Len=0 MSS=1460 SACK_PERM TSval=2176211805 TSecr=2448097482 WS=512"
"27","8.785017657","10.0.0.1","10.0.0.7","TCP","66","40558  >  5201 [ACK] Seq=1 Ack=1 Win=42496 Len=0 TSval=2448097482 TSecr=2176211805"
"28","8.785086991","10.0.0.1","10.0.0.7","iPerf3","103","40558  >  5201 Cookie: ""u63xxvtoqcqkesgm2taibxqy52tkdvje4zfu"""
"29","8.785103154","10.0.0.7","10.0.0.1","TCP","66","5201  >  40558 [ACK] Seq=1 Ack=38 Win=43520 Len=0 TSval=2176211805 TSecr=2448097482"
"30","8.786292933","10.0.0.1","10.0.0.7","TCP","74","40568  >  5201 [SYN] Seq=0 Win=42340 Len=0 MSS=1460 SACK_PERM TSval=2448097484 TSecr=0 WS=512"
"31","8.786320094","10.0.0.7","10.0.0.1","TCP","74","5201  >  40568 [SYN, ACK] Seq=0 Ack=1 Win=43440 Len=0 MSS=1460 SACK_PERM TSval=2176211807 TSecr=2448097484 WS=512"
"32","8.786329671","10.0.0.1","10.0.0.7","TCP","66","40568  >  5201 [ACK] Seq=1 Ack=1 Win=42496 Len=0 TSval=2448097484 TSecr=2176211807"
"33","8.786349308","10.0.0.1","10.0.0.7","iPerf3","103","40568  >  5201 Cookie: ""u63xxvtoqcqkesgm2taibxqy52tkdvje4zfu"""
"34","8.786364100","10.0.0.7","10.0.0.1","TCP","66","5201  >  40568 [ACK] Seq=1 Ack=38 Win=43520 Len=0 TSval=2176211807 TSecr=2448097484"
"35","8.787340328","10.0.0.1","10.0.0.7","TCP","74","40570  >  5201 [SYN] Seq=0 Win=42340 Len=0 MSS=1460 SACK_PERM TSval=2448097485 TSecr=0 WS=512"
"36","8.787363985","10.0.0.7","10.0.0.1","TCP","74","5201  >  40570 [SYN, ACK] Seq=0 Ack=1 Win=43440 Len=0 MSS=1460 SACK_PERM TSval=2176211808 TSecr=2448097485 WS=512"
"37","8.787372047","10.0.0.1","10.0.0.7","TCP","66","40570  >  5201 [ACK] Seq=1 Ack=1 Win=42496 Len=0 TSval=2448097485 TSecr=2176211808"
"38","8.787388991","10.0.0.1","10.0.0.7","iPerf3","103","40570  >  5201 Cookie: ""u63xxvtoqcqkesgm2taibxqy52tkdvje4zfu"""
"39","8.787403080","10.0.0.7","10.0.0.1","TCP","66","5201  >  40570 [ACK] Seq=1 Ack=38 Win=43520 Len=0 TSval=2176211808 TSecr=2448097485"
"40","8.788352897","10.0.0.1","10.0.0.7","TCP","74","40582  >  5201 [SYN] Seq=0 Win=42340 Len=0 MSS=1460 SACK_PERM TSval=2448097486 TSecr=0 WS=512"
"41","8.788374469","10.0.0.7","10.0.0.1","TCP","74","5201  >  40582 [SYN, ACK] Seq=0 Ack=1 Win=43440 Len=0 MSS=1460 SACK_PERM TSval=2176211809 TSecr=2448097486 WS=512"
"42","8.788382310","10.0.0.1","10.0.0.7","TCP","66","40582  >  5201 [ACK] Seq=1 Ack=1 Win=42496 Len=0 TSval=2448097486 TSecr=2176211809"
"43","8.788399186","10.0.0.1","10.0.0.7","iPerf3","103","40582  >  5201 Cookie: ""u63xxvtoqcqkesgm2taibxqy52tkdvje4zfu"""
"44","8.788412747","10.0.0.7","10.0.0.1","TCP","66","5201  >  40582 [ACK] Seq=1 Ack=38 Win=43520 Len=0 TSval=2176211809 TSecr=2448097486"
"45","8.789360527","10.0.0.1","10.0.0.7","TCP","74","40594  >  5201 [SYN] Seq=0 Win=42340 Len=0 MSS=1460 SACK_PERM TSval=2448097487 TSecr=0 WS=512"
"46","8.789382459","10.0.0.7","10.0.0.1","TCP","74","5201  >  40594 [SYN, ACK] Seq=0 Ack=1 Win=43440 Len=0 MSS=1460 SACK_PERM TSval=2176211810 TSecr=2448097487 WS=512"
"47","8.789390423","10.0.0.1","10.0.0.7","TCP","66","40594  >  5201 [ACK] Seq=1 Ack=1 Win=42496 Len=0 TSval=2448097487 TSecr=2176211810"
"48","8.789407821","10.0.0.1","10.0.0.7","iPerf3","103","40594  >  5201 Cookie: ""u63xxvtoqcqkesgm2taibxqy52tkdvje4zfu"""
"49","8.789421761","10.0.0.7","10.0.0.1","TCP","66","5201  >  40594 [ACK] Seq=1 Ack=38 Win=43520 Len=0 TSval=2176211810 TSecr=2448097487"
"50","8.790377339","10.0.0.1","10.0.0.7","TCP","74","40596  >  5201 [SYN] Seq=0 Win=42340 Len=0 MSS=1460 SACK_PERM TSval=2448097488 TSecr=0 WS=512"
"51","8.790398262","10.0.0.7","10.0.0.1","TCP","74","5201  >  40596 [SYN, ACK] Seq=0 Ack=1 Win=43440 Len=0 MSS=1460 SACK_PERM TSval=2176211811 TSecr=2448097488 WS=512"
"52","8.790405999","10.0.0.1","10.0.0.7","TCP","66","40596  >  5201 [ACK] Seq=1 Ack=1 Win=42496 Len=0 TSval=2448097488 TSecr=2176211811"
"53","8.790422839","10.0.0.1","10.0.0.7","iPerf3","103","40596  >  5201 Cookie: ""u63xxvtoqcqkesgm2taibxqy52tkdvje4zfu"""
"54","8.790441678","10.0.0.7","10.0.0.1","TCP","66","5201  >  40596 [ACK] Seq=1 Ack=38 Win=43520 Len=0 TSval=2176211811 TSecr=2448097488"
"55","8.791408586","10.0.0.1","10.0.0.7","TCP","74","40608  >  5201 [SYN] Seq=0 Win=42340 Len=0 MSS=1460 SACK_PERM TSval=2448097489 TSecr=0 WS=512"
"56","8.791429303","10.0.0.7","10.0.0.1","TCP","74","5201  >  40608 [SYN, ACK] Seq=0 Ack=1 Win=43440 Len=0 MSS=1460 SACK_PERM TSval=2176211812 TSecr=2448097489 WS=512"
"57","8.791437336","10.0.0.1","10.0.0.7","TCP","66","40608  >  5201 [ACK] Seq=1 Ack=1 Win=42496 Len=0 TSval=2448097489 TSecr=2176211812"
"58","8.791454014","10.0.0.1","10.0.0.7","iPerf3","103","40608  >  5201 Cookie: ""u63xxvtoqcqkesgm2taibxqy52tkdvje4zfu"""
"59","8.791469175","10.0.0.7","10.0.0.1","TCP","66","5201  >  40608 [ACK] Seq=1 Ack=38 Win=43520 Len=0 TSval=2176211812 TSecr=2448097489"
"60","8.792424047","10.0.0.1","10.0.0.7","TCP","74","40610  >  5201 [SYN] Seq=0 Win=42340 Len=0 MSS=1460 SACK_PERM TSval=2448097490 TSecr=0 WS=512"
"61","8.792445082","10.0.0.7","10.0.0.1","TCP","74","5201  >  40610 [SYN, ACK] Seq=0 Ack=1 Win=43440 Len=0 MSS=1460 SACK_PERM TSval=2176211813 TSecr=2448097490 WS=512"
"62","8.792452485","10.0.0.1","10.0.0.7","TCP","66","40610  >  5201 [ACK] Seq=1 Ack=1 Win=42496 Len=0 TSval=2448097490 TSecr=2176211813"
"63","8.792469872","10.0.0.1","10.0.0.7","iPerf3","103","40610  >  5201 Cookie: ""u63xxvtoqcqkesgm2taibxqy52tkdvje4zfu"""
"64","8.792487083","10.0.0.7","10.0.0.1","TCP","66","5201  >  40610 [ACK] Seq=1 Ack=38 Win=43520 Len=0 TSval=2176211813 TSecr=2448097490"
"65","8.793444050","10.0.0.1","10.0.0.7","TCP","74","40624  >  5201 [SYN] Seq=0 Win=42340 Len=0 MSS=1460 SACK_PERM TSval=2448097491 TSecr=0 WS=512"
"66","8.793465248","10.0.0.7","10.0.0.1","TCP","74","5201  >  40624 [SYN, ACK] Seq=0 Ack=1 Win=43440 Len=0 MSS=1460 SACK_PERM TSval=2176211814 TSecr=2448097491 WS=512"
"67","8.793472590","10.0.0.1","10.0.0.7","TCP","66","40624  >  5201 [ACK] Seq=1 Ack=1 Win=42496 Len=0 TSval=2448097491 TSecr=2176211814"
"68","8.793489452","10.0.0.1","10.0.0.7","iPerf3","103","40624  >  5201 Cookie: ""u63xxvtoqcqkesgm2taibxqy52tkdvje4zfu"""
"69","8.793504580","10.0.0.7","10.0.0.1","TCP","66","5201  >  40624 [ACK] Seq=1 Ack=38 Win=43520 Len=0 TSval=2176211814 TSecr=2448097491"
"70","8.794455262","10.0.0.1","10.0.0.7","TCP","74","40630  >  5201 [SYN] Seq=0 Win=42340 Len=0 MSS=1460 SACK_PERM TSval=2448097492 TSecr=0 WS=512"
"71","8.794475933","10.0.0.7","10.0.0.1","TCP","74","5201  >  40630 [SYN, ACK] Seq=0 Ack=1 Win=43440 Len=0 MSS=1460 SACK_PERM TSval=2176211815 TSecr=2448097492 WS=512"
"72","8.794483688","10.0.0.1","10.0.0.7","TCP","66","40630  >  5201 [ACK] Seq=1 Ack=1 Win=42496 Len=0 TSval=2448097492 TSecr=2176211815"
"73","8.794500886","10.0.0.1","10.0.0.7","iPerf3","103","40630  >  5201 Cookie: ""u63xxvtoqcqkesgm2taibxqy52tkdvje4zfu"""
"74","8.794515843","10.0.0.7","10.0.0.1","TCP","66","5201  >  40630 [ACK] Seq=1 Ack=38 Win=43520 Len=0 TSval=2176211815 TSecr=2448097492"
"75","8.795518498","10.0.0.7","10.0.0.1","iPerf3","67","5201  >  40544 TEST_START(1)"
"76","8.795550608","10.0.0.1","10.0.0.7","TCP","66","40544  >  5201 [ACK] Seq=208 Ack=4 Win=42496 Len=0 TSval=2448097493 TSecr=2176211805"
"77","8.795550597","10.0.0.7","10.0.0.1","iPerf3","67","5201  >  40544 TEST_RUNNING(2)"
"78","8.795730468","10.0.0.1","10.0.0.7","TCP","7306","40558  >  5201 [PSH, ACK] Seq=38 Ack=1 Win=42496 Len=7240 TSval=2448097493 TSecr=2176211805"
"79","8.795770885","10.0.0.7","10.0.0.1","TCP","66","5201  >  40558 [ACK] Seq=1 Ack=7278 Win=56832 Len=0 TSval=2176211816 TSecr=2448097493"
"80","8.795783353","10.0.0.1","10.0.0.7","TCP","7306","40558  >  5201 [PSH, ACK] Seq=7278 Ack=1 Win=42496 Len=7240 TSval=2448097493 TSecr=2176211805"
"81","8.795801394","10.0.0.1","10.0.0.7","TCP","7306","40568  >  5201 [PSH, ACK] Seq=38 Ack=1 Win=42496 Len=7240 TSval=2448097493 TSecr=2176211807"
"82","8.795821622","10.0.0.1","10.0.0.7","TCP","7306","40568  >  5201 [PSH, ACK] Seq=7278 Ack=1 Win=42496 Len=7240 TSval=2448097493 TSecr=2176211807"
"83","8.795852633","10.0.0.1","10.0.0.7","TCP","10202","40558  >  5201 [PSH, ACK] Seq=14518 Ack=1 Win=42496 Len=10136 TSval=2448097493 TSecr=2176211816"
"84","8.795893209","10.0.0.1","10.0.0.7","TCP","7306","40570  >  5201 [PSH, ACK] Seq=38 Ack=1 Win=42496 Len=7240 TSval=2448097493 TSecr=2176211808"
"85","8.795918979","10.0.0.1","10.0.0.7","TCP","7306","40570  >  5201 [PSH, ACK] Seq=7278 Ack=1 Win=42496 Len=7240 TSval=2448097493 TSecr=2176211808"
"86","8.796049699","10.0.0.1","10.0.0.7","TCP","7306","40582  >  5201 [PSH, ACK] Seq=38 Ack=1 Win=42496 Len=7240 TSval=2448097493 TSecr=2176211809"
"87","8.796074449","10.0.0.1","10.0.0.7","TCP","7306","40582  >  5201 [PSH, ACK] Seq=7278 Ack=1 Win=42496 Len=7240 TSval=2448097493 TSecr=2176211809"
"88","8.796203313","10.0.0.1","10.0.0.7","TCP","7306","40594  >  5201 [PSH, ACK] Seq=38 Ack=1 Win=42496 Len=7240 TSval=2448097493 TSecr=2176211810"
"89","8.796223510","10.0.0.1","10.0.0.7","TCP","7306","40594  >  5201 [PSH, ACK] Seq=7278 Ack=1 Win=42496 Len=7240 TSval=2448097494 TSecr=2176211810"
"90","8.796300920","10.0.0.1","10.0.0.7","TCP","7306","40596  >  5201 [PSH, ACK] Seq=38 Ack=1 Win=42496 Len=7240 TSval=2448097494 TSecr=2176211811"
"91","8.796310043","10.0.0.1","10.0.0.7","TCP","7306","40596  >  5201 [PSH, ACK] Seq=7278 Ack=1 Win=42496 Len=7240 TSval=2448097494 TSecr=2176211811"
"92","8.796423847","10.0.0.1","10.0.0.7","TCP","7306","40608  >  5201 [PSH, ACK] Seq=38 Ack=1 Win=42496 Len=7240 TSval=2448097494 TSecr=2176211812"
"93","8.796444255","10.0.0.1","10.0.0.7","TCP","7306","40608  >  5201 [PSH, ACK] Seq=7278 Ack=1 Win=42496 Len=7240 TSval=2448097494 TSecr=2176211812"
"94","8.796564105","10.0.0.1","10.0.0.7","TCP","7306","40610  >  5201 [PSH, ACK] Seq=38 Ack=1 Win=42496 Len=7240 TSval=2448097494 TSecr=2176211813"
"95","8.796574134","10.0.0.1","10.0.0.7","TCP","7306","40610  >  5201 [PSH, ACK] Seq=7278 Ack=1 Win=42496 Len=7240 TSval=2448097494 TSecr=2176211813"
"96","8.796616340","10.0.0.1","10.0.0.7","TCP","7306","40624  >  5201 [PSH, ACK] Seq=38 Ack=1 Win=42496 Len=7240 TSval=2448097494 TSecr=2176211814"
"97","8.796624656","10.0.0.1","10.0.0.7","TCP","7306","40624  >  5201 [PSH, ACK] Seq=7278 Ack=1 Win=42496 Len=7240 TSval=2448097494 TSecr=2176211814"
"98","8.796662623","10.0.0.1","10.0.0.7","TCP","7306","40630  >  5201 [PSH, ACK] Seq=38 Ack=1 Win=42496 Len=7240 TSval=2448097494 TSecr=2176211815"
"99","8.796674437","10.0.0.1","10.0.0.7","TCP","7306","40630  >  5201 [PSH, ACK] Seq=7278 Ack=1 Win=42496 Len=7240 TSval=2448097494 TSecr=2176211815"
"100","8.796724166","10.0.0.7","10.0.0.1","TCP","66","5201  >  40558 [ACK] Seq=1 Ack=14518 Win=70656 Len=0 TSval=2176211817 TSecr=2448097493"
"101","8.796739615","10.0.0.1","10.0.0.7","TCP","11650","40558  >  5201 [PSH, ACK] Seq=24654 Ack=1 Win=42496 Len=11584 TSval=2448097494 TSecr=2176211817"
"102","8.797924725","10.0.0.7","10.0.0.1","TCP","66","5201  >  40568 [ACK] Seq=1 Ack=7278 Win=56832 Len=0 TSval=2176211818 TSecr=2448097493"
"103","8.797949470","10.0.0.1","10.0.0.7","TCP","10202","40568  >  5201 [PSH, ACK] Seq=14518 Ack=1 Win=42496 Len=10136 TSval=2448097495 TSecr=2176211818"
"104","8.799149875","10.0.0.7","10.0.0.1","TCP","66","5201  >  40568 [ACK] Seq=1 Ack=14518 Win=70656 Len=0 TSval=2176211819 TSecr=2448097493"
"105","8.799160284","10.0.0.1","10.0.0.7","TCP","11650","40568  >  5201 [PSH, ACK] Seq=24654 Ack=1 Win=42496 Len=11584 TSval=2448097496 TSecr=2176211819"
"106","8.799219698","10.0.0.1","10.0.0.7","TCP","1514","40570  >  5201 [ACK] Seq=14518 Ack=1 Win=42496 Len=1448 TSval=2448097497 TSecr=2176211808"
"107","8.799239819","10.0.0.1","10.0.0.7","TCP","1514","40582  >  5201 [ACK] Seq=14518 Ack=1 Win=42496 Len=1448 TSval=2448097497 TSecr=2176211809"
"108","8.800216350","10.0.0.1","10.0.0.7","TCP","7306","40558  >  5201 [PSH, ACK] Seq=36238 Ack=1 Win=42496 Len=7240 TSval=2448097498 TSecr=2176211817"
"109","8.800219164","10.0.0.1","10.0.0.7","TCP","1514","40630  >  5201 [ACK] Seq=14518 Ack=1 Win=42496 Len=1448 TSval=2448097498 TSecr=2176211815"
"110","8.800226148","10.0.0.1","10.0.0.7","TCP","1514","40594  >  5201 [ACK] Seq=14518 Ack=1 Win=42496 Len=1448 TSval=2448097498 TSecr=2176211810"
"111","8.800247189","10.0.0.1","10.0.0.7","TCP","1514","40624  >  5201 [ACK] Seq=14518 Ack=1 Win=42496 Len=1448 TSval=2448097498 TSecr=2176211814"
"112","8.800249690","10.0.0.1","10.0.0.7","TCP","1514","40596  >  5201 [ACK] Seq=14518 Ack=1 Win=42496 Len=1448 TSval=2448097498 TSecr=2176211811"
"113","8.800269917","10.0.0.1","10.0.0.7","TCP","1514","40608  >  5201 [ACK] Seq=14518 Ack=1 Win=42496 Len=1448 TSval=2448097498 TSecr=2176211812"
"114","8.800358992","10.0.0.7","10.0.0.1","TCP","66","5201  >  40558 [ACK] Seq=1 Ack=24654 Win=68096 Len=0 TSval=2176211821 TSecr=2448097493"
"115","8.800368284","10.0.0.1","10.0.0.7","TCP","14546","40558  >  5201 [PSH, ACK] Seq=43478 Ack=1 Win=42496 Len=14480 TSval=2448097498 TSecr=2176211821"
"116","8.801208386","10.0.0.1","10.0.0.7","TCP","1514","40610  >  5201 [ACK] Seq=14518 Ack=1 Win=42496 Len=1448 TSval=2448097499 TSecr=2176211813"
"117","8.802052621","10.0.0.7","10.0.0.1","TCP","66","5201  >  40570 [ACK] Seq=1 Ack=7278 Win=56832 Len=0 TSval=2176211822 TSecr=2448097493"
"118","8.802063281","10.0.0.1","10.0.0.7","TCP","10202","40570  >  5201 [PSH, ACK] Seq=15966 Ack=1 Win=42496 Len=10136 TSval=2448097499 TSecr=2176211822"
"119","8.803262050","10.0.0.7","10.0.0.1","TCP","66","5201  >  40570 [ACK] Seq=1 Ack=14518 Win=70656 Len=0 TSval=2176211824 TSecr=2448097493"
"120","8.803271241","10.0.0.1","10.0.0.7","TCP","10202","40570  >  5201 [PSH, ACK] Seq=26102 Ack=1 Win=42496 Len=10136 TSval=2448097501 TSecr=2176211824"
"121","8.803341942","10.0.0.1","10.0.0.7","TCP","7306","40568  >  5201 [PSH, ACK] Seq=36238 Ack=1 Win=42496 Len=7240 TSval=2448097501 TSecr=2176211819"
"122","8.805686522","10.0.0.7","10.0.0.1","TCP","66","5201  >  40582 [ACK] Seq=1 Ack=7278 Win=56832 Len=0 TSval=2176211826 TSecr=2448097493"
"123","8.805697385","10.0.0.1","10.0.0.7","TCP","10202","40582  >  5201 [PSH, ACK] Seq=15966 Ack=1 Win=42496 Len=10136 TSval=2448097503 TSecr=2176211826"
"124","8.810530932","10.0.0.7","10.0.0.1","TCP","66","5201  >  40582 [ACK] Seq=1 Ack=14518 Win=70656 Len=0 TSval=2176211831 TSecr=2448097493"
"125","8.810540166","10.0.0.1","10.0.0.7","TCP","10202","40582  >  5201 [PSH, ACK] Seq=26102 Ack=1 Win=42496 Len=10136 TSval=2448097508 TSecr=2176211831"
"126","8.814163856","10.0.0.7","10.0.0.1","TCP","66","5201  >  40594 [ACK] Seq=1 Ack=7278 Win=56832 Len=0 TSval=2176211834 TSecr=2448097493"
"127","8.814173936","10.0.0.1","10.0.0.7","TCP","10202","40594  >  5201 [PSH, ACK] Seq=15966 Ack=1 Win=42496 Len=10136 TSval=2448097511 TSecr=2176211834"
"128","8.816598188","10.0.0.7","10.0.0.1","TCP","66","5201  >  40594 [ACK] Seq=1 Ack=14518 Win=70656 Len=0 TSval=2176211837 TSecr=2448097494"
"129","8.816622280","10.0.0.1","10.0.0.7","TCP","10202","40594  >  5201 [PSH, ACK] Seq=26102 Ack=1 Win=42496 Len=10136 TSval=2448097514 TSecr=2176211837"
"130","8.819019860","10.0.0.7","10.0.0.1","TCP","66","5201  >  40596 [ACK] Seq=1 Ack=7278 Win=56832 Len=0 TSval=2176211839 TSecr=2448097494"
"131","8.819041184","10.0.0.1","10.0.0.7","TCP","10202","40596  >  5201 [PSH, ACK] Seq=15966 Ack=1 Win=42496 Len=10136 TSval=2448097516 TSecr=2176211839"
"132","8.820235337","10.0.0.7","10.0.0.1","TCP","66","5201  >  40596 [ACK] Seq=1 Ack=14518 Win=70656 Len=0 TSval=2176211841 TSecr=2448097494"
"133","8.820248617","10.0.0.1","10.0.0.7","TCP","10202","40596  >  5201 [PSH, ACK] Seq=26102 Ack=1 Win=42496 Len=10136 TSval=2448097518 TSecr=2176211841"
"134","8.828725999","10.0.0.7","10.0.0.1","TCP","66","5201  >  40608 [ACK] Seq=1 Ack=7278 Win=56832 Len=0 TSval=2176211849 TSecr=2448097494"
"135","8.828751128","10.0.0.1","10.0.0.7","TCP","10202","40608  >  5201 [PSH, ACK] Seq=15966 Ack=1 Win=42496 Len=10136 TSval=2448097526 TSecr=2176211849"
"136","8.829918081","10.0.0.7","10.0.0.1","TCP","66","5201  >  40608 [ACK] Seq=1 Ack=14518 Win=64000 Len=0 TSval=2176211850 TSecr=2448097494"
"137","8.829940789","10.0.0.1","10.0.0.7","TCP","10202","40608  >  5201 [PSH, ACK] Seq=26102 Ack=1 Win=42496 Len=10136 TSval=2448097527 TSecr=2176211850"
"138","8.833558400","10.0.0.7","10.0.0.1","TCP","66","5201  >  40610 [ACK] Seq=1 Ack=7278 Win=56832 Len=0 TSval=2176211854 TSecr=2448097494"
"139","8.833573550","10.0.0.1","10.0.0.7","TCP","10202","40610  >  5201 [PSH, ACK] Seq=15966 Ack=1 Win=42496 Len=10136 TSval=2448097531 TSecr=2176211854"
"140","8.834759567","10.0.0.7","10.0.0.1","TCP","66","5201  >  40610 [ACK] Seq=1 Ack=14518 Win=64000 Len=0 TSval=2176211855 TSecr=2448097494"
"141","8.834778769","10.0.0.1","10.0.0.7","TCP","10202","40610  >  5201 [PSH, ACK] Seq=26102 Ack=1 Win=42496 Len=10136 TSval=2448097532 TSecr=2176211855"
"142","8.835980457","10.0.0.7","10.0.0.1","TCP","66","5201  >  40624 [ACK] Seq=1 Ack=7278 Win=56832 Len=0 TSval=2176211856 TSecr=2448097494"
"143","8.835994793","10.0.0.1","10.0.0.7","TCP","10202","40624  >  5201 [PSH, ACK] Seq=15966 Ack=1 Win=42496 Len=10136 TSval=2448097533 TSecr=2176211856"
"144","8.837183233","10.0.0.7","10.0.0.1","TCP","66","5201  >  40624 [ACK] Seq=1 Ack=14518 Win=64000 Len=0 TSval=2176211857 TSecr=2448097494"
"145","8.837211070","10.0.0.1","10.0.0.7","TCP","10202","40624  >  5201 [PSH, ACK] Seq=26102 Ack=1 Win=42496 Len=10136 TSval=2448097534 TSecr=2176211857"
"146","8.837220373","10.0.0.1","10.0.0.7","TCP","66","40544  >  5201 [ACK] Seq=208 Ack=5 Win=42496 Len=0 TSval=2448097535 TSecr=2176211816"
"147","8.843247917","10.0.0.7","10.0.0.1","TCP","66","5201  >  40630 [ACK] Seq=1 Ack=7278 Win=56832 Len=0 TSval=2176211864 TSecr=2448097494"
"148","8.843263409","10.0.0.1","10.0.0.7","TCP","10202","40630  >  5201 [PSH, ACK] Seq=15966 Ack=1 Win=42496 Len=10136 TSval=2448097541 TSecr=2176211864"
"149","8.844458601","10.0.0.7","10.0.0.1","TCP","66","5201  >  40630 [ACK] Seq=1 Ack=14518 Win=70656 Len=0 TSval=2176211865 TSecr=2448097494"
"150","8.844475691","10.0.0.1","10.0.0.7","TCP","10202","40630  >  5201 [PSH, ACK] Seq=26102 Ack=1 Win=42496 Len=10136 TSval=2448097542 TSecr=2176211865"
"151","8.845667266","10.0.0.7","10.0.0.1","TCP","66","5201  >  40558 [ACK] Seq=1 Ack=36238 Win=93696 Len=0 TSval=2176211866 TSecr=2448097494"
"152","8.845682645","10.0.0.1","10.0.0.7","TCP","21786","40558  >  5201 [PSH, ACK] Seq=57958 Ack=1 Win=42496 Len=21720 TSval=2448097543 TSecr=2176211866"
"153","8.847610307","10.0.0.7","10.0.0.1","TCP","66","5201  >  40568 [ACK] Seq=1 Ack=24654 Win=68096 Len=0 TSval=2176211868 TSecr=2448097495"
"154","8.847624261","10.0.0.1","10.0.0.7","TCP","14546","40568  >  5201 [PSH, ACK] Seq=43478 Ack=1 Win=42496 Len=14480 TSval=2448097545 TSecr=2176211868"
"155","8.849304801","10.0.0.7","10.0.0.1","TCP","66","5201  >  40568 [ACK] Seq=1 Ack=36238 Win=93696 Len=0 TSval=2176211870 TSecr=2448097496"
"156","8.849321853","10.0.0.1","10.0.0.7","TCP","21786","40568  >  5201 [PSH, ACK] Seq=57958 Ack=1 Win=42496 Len=21720 TSval=2448097547 TSecr=2176211870"
"157","8.851482464","10.0.0.7","10.0.0.1","TCP","66","5201  >  40570 [ACK] Seq=1 Ack=15966 Win=73216 Len=0 TSval=2176211872 TSecr=2448097497"
"158","8.851724325","10.0.0.7","10.0.0.1","TCP","66","5201  >  40582 [ACK] Seq=1 Ack=15966 Win=73216 Len=0 TSval=2176211872 TSecr=2448097497"
"159","8.852932619","10.0.0.7","10.0.0.1","TCP","66","5201  >  40558 [ACK] Seq=1 Ack=43478 Win=108032 Len=0 TSval=2176211873 TSecr=2448097498"
"160","8.852948193","10.0.0.1","10.0.0.7","TCP","21786","40558  >  5201 [PSH, ACK] Seq=79678 Ack=1 Win=42496 Len=21720 TSval=2448097550 TSecr=2176211873"
"161","8.854390892","10.0.0.7","10.0.0.1","TCP","66","5201  >  40630 [ACK] Seq=1 Ack=15966 Win=73216 Len=0 TSval=2176211875 TSecr=2448097498"
"162","8.854871173","10.0.0.7","10.0.0.1","TCP","66","5201  >  40594 [ACK] Seq=1 Ack=15966 Win=73216 Len=0 TSval=2176211875 TSecr=2448097498"
"163","8.855599502","10.0.0.7","10.0.0.1","TCP","66","5201  >  40624 [ACK] Seq=1 Ack=15966 Win=67072 Len=0 TSval=2176211876 TSecr=2448097498"
"164","8.855840512","10.0.0.7","10.0.0.1","TCP","66","5201  >  40596 [ACK] Seq=1 Ack=15966 Win=73216 Len=0 TSval=2176211876 TSecr=2448097498"
"165","8.856328492","10.0.0.7","10.0.0.1","TCP","66","5201  >  40608 [ACK] Seq=1 Ack=15966 Win=67072 Len=0 TSval=2176211877 TSecr=2448097498"
"166","8.856563883","10.0.0.7","10.0.0.1","TCP","66","5201  >  40558 [ACK] Seq=1 Ack=57958 Win=137216 Len=0 TSval=2176211877 TSecr=2448097498"
"167","8.858986914","10.0.0.7","10.0.0.1","TCP","66","5201  >  40610 [ACK] Seq=1 Ack=15966 Win=67072 Len=0 TSval=2176211879 TSecr=2448097499"
"168","8.859230474","10.0.0.7","10.0.0.1","TCP","66","5201  >  40570 [ACK] Seq=1 Ack=26102 Win=68096 Len=0 TSval=2176211880 TSecr=2448097499"
"169","8.859245980","10.0.0.1","10.0.0.7","TCP","10202","40570  >  5201 [PSH, ACK] Seq=36238 Ack=1 Win=42496 Len=10136 TSval=2448097557 TSecr=2176211880"
"170","8.859250248","10.0.0.1","10.0.0.7","TCP","11650","40570  >  5201 [PSH, ACK] Seq=46374 Ack=1 Win=42496 Len=11584 TSval=2448097557 TSecr=2176211880"
"171","8.860926154","10.0.0.7","10.0.0.1","TCP","66","5201  >  40570 [ACK] Seq=1 Ack=36238 Win=93696 Len=0 TSval=2176211881 TSecr=2448097501"
"172","8.860947911","10.0.0.1","10.0.0.7","TCP","21786","40570  >  5201 [PSH, ACK] Seq=57958 Ack=1 Win=42496 Len=21720 TSval=2448097558 TSecr=2176211881"
"173","8.862622838","10.0.0.7","10.0.0.1","TCP","66","5201  >  40568 [ACK] Seq=1 Ack=43478 Win=108032 Len=0 TSval=2176211883 TSecr=2448097501"
"174","8.862636692","10.0.0.1","10.0.0.7","TCP","21786","40568  >  5201 [PSH, ACK] Seq=79678 Ack=1 Win=42496 Len=21720 TSval=2448097560 TSecr=2176211883"
"175","8.865534090","10.0.0.7","10.0.0.1","TCP","66","5201  >  40582 [ACK] Seq=1 Ack=26102 Win=68096 Len=0 TSval=2176211886 TSecr=2448097503"
"176","8.865548356","10.0.0.1","10.0.0.7","TCP","10202","40582  >  5201 [PSH, ACK] Seq=36238 Ack=1 Win=42496 Len=10136 TSval=2448097563 TSecr=2176211886"
"177","8.865553788","10.0.0.1","10.0.0.7","TCP","11650","40582  >  5201 [PSH, ACK] Seq=46374 Ack=1 Win=42496 Len=11584 TSval=2448097563 TSecr=2176211886"
"178","8.872312977","10.0.0.7","10.0.0.1","TCP","66","5201  >  40582 [ACK] Seq=1 Ack=36238 Win=93696 Len=0 TSval=2176211893 TSecr=2448097508"
"179","8.872328332","10.0.0.1","10.0.0.7","TCP","21786","40582  >  5201 [PSH, ACK] Seq=57958 Ack=1 Win=42496 Len=21720 TSval=2448097570 TSecr=2176211893"
"180","8.877400762","10.0.0.7","10.0.0.1","TCP","66","5201  >  40594 [ACK] Seq=1 Ack=26102 Win=68096 Len=0 TSval=2176211898 TSecr=2448097511"
"181","8.877414872","10.0.0.1","10.0.0.7","TCP","10202","40594  >  5201 [PSH, ACK] Seq=36238 Ack=1 Win=42496 Len=10136 TSval=2448097575 TSecr=2176211898"
"182","8.877419244","10.0.0.1","10.0.0.7","TCP","11650","40594  >  5201 [PSH, ACK] Seq=46374 Ack=1 Win=42496 Len=11584 TSval=2448097575 TSecr=2176211898"
"183","8.880790290","10.0.0.7","10.0.0.1","TCP","66","5201  >  40594 [ACK] Seq=1 Ack=36238 Win=93696 Len=0 TSval=2176211901 TSecr=2448097514"
"184","8.880805593","10.0.0.1","10.0.0.7","TCP","21786","40594  >  5201 [PSH, ACK] Seq=57958 Ack=1 Win=42496 Len=21720 TSval=2448097578 TSecr=2176211901"
"185","8.884181649","10.0.0.7","10.0.0.1","TCP","66","5201  >  40596 [ACK] Seq=1 Ack=26102 Win=68096 Len=0 TSval=2176211904 TSecr=2448097516"
"186","8.884200781","10.0.0.1","10.0.0.7","TCP","10202","40596  >  5201 [PSH, ACK] Seq=36238 Ack=1 Win=42496 Len=10136 TSval=2448097581 TSecr=2176211904"
"187","8.884205444","10.0.0.1","10.0.0.7","TCP","11650","40596  >  5201 [PSH, ACK] Seq=46374 Ack=1 Win=42496 Len=11584 TSval=2448097581 TSecr=2176211904"
"188","8.885879707","10.0.0.7","10.0.0.1","TCP","66","5201  >  40596 [ACK] Seq=1 Ack=36238 Win=93696 Len=0 TSval=2176211906 TSecr=2448097518"
"189","8.885894020","10.0.0.1","10.0.0.7","TCP","21786","40596  >  5201 [PSH, ACK] Seq=57958 Ack=1 Win=42496 Len=21720 TSval=2448097583 TSecr=2176211906"
"190","8.897757716","10.0.0.7","10.0.0.1","TCP","66","5201  >  40608 [ACK] Seq=1 Ack=26102 Win=68096 Len=0 TSval=2176211918 TSecr=2448097526"
"191","8.897777273","10.0.0.1","10.0.0.7","TCP","10202","40608  >  5201 [PSH, ACK] Seq=36238 Ack=1 Win=42496 Len=10136 TSval=2448097595 TSecr=2176211918"
"192","8.897785645","10.0.0.1","10.0.0.7","TCP","11650","40608  >  5201 [PSH, ACK] Seq=46374 Ack=1 Win=42496 Len=11584 TSval=2448097595 TSecr=2176211918"
"193","8.899445730","10.0.0.7","10.0.0.1","TCP","66","5201  >  40608 [ACK] Seq=1 Ack=36238 Win=88064 Len=0 TSval=2176211920 TSecr=2448097527"
"194","8.899461992","10.0.0.1","10.0.0.7","TCP","21786","40608  >  5201 [PSH, ACK] Seq=57958 Ack=1 Win=42496 Len=21720 TSval=2448097597 TSecr=2176211920"
"195","8.904537870","10.0.0.7","10.0.0.1","TCP","66","5201  >  40610 [ACK] Seq=1 Ack=26102 Win=68096 Len=0 TSval=2176211925 TSecr=2448097531"
"196","8.904554520","10.0.0.1","10.0.0.7","TCP","10202","40610  >  5201 [PSH, ACK] Seq=36238 Ack=1 Win=42496 Len=10136 TSval=2448097602 TSecr=2176211925"
"197","8.904557855","10.0.0.1","10.0.0.7","TCP","11650","40610  >  5201 [PSH, ACK] Seq=46374 Ack=1 Win=42496 Len=11584 TSval=2448097602 TSecr=2176211925"
"198","8.906256912","10.0.0.7","10.0.0.1","TCP","66","5201  >  40610 [ACK] Seq=1 Ack=36238 Win=88064 Len=0 TSval=2176211927 TSecr=2448097532"
"199","8.906277244","10.0.0.1","10.0.0.7","TCP","21786","40610  >  5201 [PSH, ACK] Seq=57958 Ack=1 Win=42496 Len=21720 TSval=2448097604 TSecr=2176211927"
"200","8.907913632","10.0.0.7","10.0.0.1","TCP","66","5201  >  40624 [ACK] Seq=1 Ack=26102 Win=68096 Len=0 TSval=2176211928 TSecr=2448097533"
"201","8.907923428","10.0.0.1","10.0.0.7","TCP","10202","40624  >  5201 [PSH, ACK] Seq=36238 Ack=1 Win=42496 Len=10136 TSval=2448097605 TSecr=2176211928"
"202","8.907927544","10.0.0.1","10.0.0.7","TCP","11650","40624  >  5201 [PSH, ACK] Seq=46374 Ack=1 Win=42496 Len=11584 TSval=2448097605 TSecr=2176211928"
"203","8.909604123","10.0.0.7","10.0.0.1","TCP","66","5201  >  40624 [ACK] Seq=1 Ack=36238 Win=88064 Len=0 TSval=2176211930 TSecr=2448097534"
"204","8.909615554","10.0.0.1","10.0.0.7","TCP","21786","40624  >  5201 [PSH, ACK] Seq=57958 Ack=1 Win=42496 Len=21720 TSval=2448097607 TSecr=2176211930"
"205","8.918125937","10.0.0.7","10.0.0.1","TCP","66","5201  >  40630 [ACK] Seq=1 Ack=26102 Win=68096 Len=0 TSval=2176211938 TSecr=2448097541"
"206","8.918156096","10.0.0.1","10.0.0.7","TCP","10202","40630  >  5201 [PSH, ACK] Seq=36238 Ack=1 Win=42496 Len=10136 TSval=2448097615 TSecr=2176211938"
"207","8.918163685","10.0.0.1","10.0.0.7","TCP","11650","40630  >  5201 [PSH, ACK] Seq=46374 Ack=1 Win=42496 Len=11584 TSval=2448097615 TSecr=2176211938"
"208","8.919816624","10.0.0.7","10.0.0.1","TCP","66","5201  >  40630 [ACK] Seq=1 Ack=36238 Win=93696 Len=0 TSval=2176211940 TSecr=2448097542"
"209","8.919854350","10.0.0.1","10.0.0.7","TCP","21786","40630  >  5201 [PSH, ACK] Seq=57958 Ack=1 Win=42496 Len=21720 TSval=2448097617 TSecr=2176211940"
"210","8.921509591","10.0.0.7","10.0.0.1","TCP","66","5201  >  40558 [ACK] Seq=1 Ack=79678 Win=152576 Len=0 TSval=2176211942 TSecr=2448097543"
"211","8.921530789","10.0.0.1","10.0.0.7","TCP","5858","40558  >  5201 [PSH, ACK] Seq=101398 Ack=1 Win=42496 Len=5792 TSval=2448097619 TSecr=2176211942"
"212","8.921542489","10.0.0.1","10.0.0.7","TCP","46402","40558  >  5201 [PSH, ACK] Seq=107190 Ack=1 Win=42496 Len=46336 TSval=2448097619 TSecr=2176211942"
"213","8.925119587","10.0.0.7","10.0.0.1","TCP","66","5201  >  40568 [ACK] Seq=1 Ack=57958 Win=137216 Len=0 TSval=2176211945 TSecr=2448097545"
"214","8.927538012","10.0.0.7","10.0.0.1","TCP","66","5201  >  40568 [ACK] Seq=1 Ack=79678 Win=152576 Len=0 TSval=2176211948 TSecr=2448097547"
"215","8.927547088","10.0.0.1","10.0.0.7","TCP","1514","40568  >  5201 [ACK] Seq=101398 Ack=1 Win=42496 Len=1448 TSval=2448097625 TSecr=2176211948"
"216","8.931170708","10.0.0.7","10.0.0.1","TCP","66","5201  >  40558 [ACK] Seq=1 Ack=101398 Win=196096 Len=0 TSval=2176211951 TSecr=2448097550"
"217","8.934809061","10.0.0.7","10.0.0.1","TCP","66","5201  >  40570 [ACK] Seq=1 Ack=46374 Win=114176 Len=0 TSval=2176211955 TSecr=2448097557"
"218","8.936502081","10.0.0.7","10.0.0.1","TCP","66","5201  >  40570 [ACK] Seq=1 Ack=57958 Win=137216 Len=0 TSval=2176211957 TSecr=2448097557"
"219","8.936512006","10.0.0.1","10.0.0.7","TCP","7306","40570  >  5201 [PSH, ACK] Seq=79678 Ack=1 Win=42496 Len=7240 TSval=2448097634 TSecr=2176211957"
"220","8.936518594","10.0.0.1","10.0.0.7","TCP","27578","40570  >  5201 [PSH, ACK] Seq=86918 Ack=1 Win=42496 Len=27512 TSval=2448097634 TSecr=2176211957"
"221","8.938439999","10.0.0.7","10.0.0.1","TCP","66","5201  >  40570 [ACK] Seq=1 Ack=79678 Win=174080 Len=0 TSval=2176211959 TSecr=2448097558"
"222","8.938454630","10.0.0.1","10.0.0.7","TCP","46402","40570  >  5201 [PSH, ACK] Seq=114430 Ack=1 Win=42496 Len=46336 TSval=2448097636 TSecr=2176211959"
"223","8.942078574","10.0.0.7","10.0.0.1","TCP","66","5201  >  40568 [ACK] Seq=1 Ack=101398 Win=152576 Len=0 TSval=2176211962 TSecr=2448097560"
"224","8.942098009","10.0.0.1","10.0.0.7","TCP","11650","40568  >  5201 [PSH, ACK] Seq=102846 Ack=1 Win=42496 Len=11584 TSval=2448097639 TSecr=2176211962"
"225","8.942129384","10.0.0.1","10.0.0.7","TCP","53642","40568  >  5201 [PSH, ACK] Seq=114430 Ack=1 Win=42496 Len=53576 TSval=2448097639 TSecr=2176211962"
"226","8.942150204","10.0.0.1","10.0.0.7","TCP","49298","40568  >  5201 [PSH, ACK] Seq=168006 Ack=1 Win=42496 Len=49232 TSval=2448097639 TSecr=2176211962"
"227","8.949358290","10.0.0.7","10.0.0.1","TCP","66","5201  >  40582 [ACK] Seq=1 Ack=46374 Win=114176 Len=0 TSval=2176211970 TSecr=2448097563"
"228","8.951038413","10.0.0.7","10.0.0.1","TCP","66","5201  >  40582 [ACK] Seq=1 Ack=57958 Win=137216 Len=0 TSval=2176211971 TSecr=2448097563"
"229","8.951053806","10.0.0.1","10.0.0.7","TCP","7306","40582  >  5201 [PSH, ACK] Seq=79678 Ack=1 Win=42496 Len=7240 TSval=2448097648 TSecr=2176211971"
"230","8.951068442","10.0.0.1","10.0.0.7","TCP","27578","40582  >  5201 [PSH, ACK] Seq=86918 Ack=1 Win=42496 Len=27512 TSval=2448097648 TSecr=2176211971"
"231","8.963876624","10.0.0.7","10.0.0.1","TCP","66","5201  >  40582 [ACK] Seq=1 Ack=79678 Win=174080 Len=0 TSval=2176211984 TSecr=2448097570"
"232","8.963893298","10.0.0.1","10.0.0.7","TCP","46402","40582  >  5201 [PSH, ACK] Seq=114430 Ack=1 Win=42496 Len=46336 TSval=2448097661 TSecr=2176211984"
"233","8.974779160","10.0.0.7","10.0.0.1","TCP","66","5201  >  40594 [ACK] Seq=1 Ack=46374 Win=114176 Len=0 TSval=2176211995 TSecr=2448097575"
"234","8.976472591","10.0.0.7","10.0.0.1","TCP","66","5201  >  40594 [ACK] Seq=1 Ack=57958 Win=137216 Len=0 TSval=2176211997 TSecr=2448097575"
"235","8.976480709","10.0.0.1","10.0.0.7","TCP","7306","40594  >  5201 [PSH, ACK] Seq=79678 Ack=1 Win=42496 Len=7240 TSval=2448097674 TSecr=2176211997"
"236","8.976487990","10.0.0.1","10.0.0.7","TCP","27578","40594  >  5201 [PSH, ACK] Seq=86918 Ack=1 Win=42496 Len=27512 TSval=2448097674 TSecr=2176211997"
"237","8.982045573","10.0.0.7","10.0.0.1","TCP","66","5201  >  40594 [ACK] Seq=1 Ack=79678 Win=174080 Len=0 TSval=2176212002 TSecr=2448097578"
"238","8.982066007","10.0.0.1","10.0.0.7","TCP","46402","40594  >  5201 [PSH, ACK] Seq=114430 Ack=1 Win=42496 Len=46336 TSval=2448097679 TSecr=2176212002"
"239","8.989318589","10.0.0.7","10.0.0.1","TCP","66","5201  >  40596 [ACK] Seq=1 Ack=46374 Win=114176 Len=0 TSval=2176212010 TSecr=2448097581"
"240","8.991008811","10.0.0.7","10.0.0.1","TCP","66","5201  >  40596 [ACK] Seq=1 Ack=57958 Win=137216 Len=0 TSval=2176212011 TSecr=2448097581"
"241","8.991018060","10.0.0.1","10.0.0.7","TCP","7306","40596  >  5201 [PSH, ACK] Seq=79678 Ack=1 Win=42496 Len=7240 TSval=2448097688 TSecr=2176212011"
"242","8.991024054","10.0.0.1","10.0.0.7","TCP","27578","40596  >  5201 [PSH, ACK] Seq=86918 Ack=1 Win=42496 Len=27512 TSval=2448097688 TSecr=2176212011"
"243","8.992946054","10.0.0.7","10.0.0.1","TCP","66","5201  >  40596 [ACK] Seq=1 Ack=79678 Win=174080 Len=0 TSval=2176212013 TSecr=2448097583"
"244","8.992960463","10.0.0.1","10.0.0.7","TCP","46402","40596  >  5201 [PSH, ACK] Seq=114430 Ack=1 Win=42496 Len=46336 TSval=2448097690 TSecr=2176212013"
"245","9.018388214","10.0.0.7","10.0.0.1","TCP","66","5201  >  40608 [ACK] Seq=1 Ack=46374 Win=108544 Len=0 TSval=2176212039 TSecr=2448097595"
"246","9.020079085","10.0.0.7","10.0.0.1","TCP","66","5201  >  40608 [ACK] Seq=1 Ack=57958 Win=131584 Len=0 TSval=2176212040 TSecr=2448097595"
"247","9.020088129","10.0.0.1","10.0.0.7","TCP","7306","40608  >  5201 [PSH, ACK] Seq=79678 Ack=1 Win=42496 Len=7240 TSval=2448097717 TSecr=2176212040"
"248","9.020095230","10.0.0.1","10.0.0.7","TCP","24682","40608  >  5201 [PSH, ACK] Seq=86918 Ack=1 Win=42496 Len=24616 TSval=2448097717 TSecr=2176212040"
"249","9.022014980","10.0.0.7","10.0.0.1","TCP","66","5201  >  40608 [ACK] Seq=1 Ack=79678 Win=174080 Len=0 TSval=2176212042 TSecr=2448097597"
"250","9.022028814","10.0.0.1","10.0.0.7","TCP","43506","40608  >  5201 [PSH, ACK] Seq=111534 Ack=1 Win=42496 Len=43440 TSval=2448097719 TSecr=2176212042"
"251","9.032918427","10.0.0.7","10.0.0.1","TCP","66","5201  >  40610 [ACK] Seq=1 Ack=46374 Win=108544 Len=0 TSval=2176212053 TSecr=2448097602"
"252","9.034608534","10.0.0.7","10.0.0.1","TCP","66","5201  >  40610 [ACK] Seq=1 Ack=57958 Win=131584 Len=0 TSval=2176212055 TSecr=2448097602"
"253","9.034617188","10.0.0.1","10.0.0.7","TCP","7306","40610  >  5201 [PSH, ACK] Seq=79678 Ack=1 Win=42496 Len=7240 TSval=2448097732 TSecr=2176212055"
"254","9.034624556","10.0.0.1","10.0.0.7","TCP","24682","40610  >  5201 [PSH, ACK] Seq=86918 Ack=1 Win=42496 Len=24616 TSval=2448097732 TSecr=2176212055"
"255","9.036626837","10.0.0.7","10.0.0.1","TCP","66","5201  >  40610 [ACK] Seq=1 Ack=79678 Win=155136 Len=0 TSval=2176212057 TSecr=2448097604"
"256","9.036717529","10.0.0.1","10.0.0.7","TCP","33370","40610  >  5201 [PSH, ACK] Seq=111534 Ack=1 Win=42496 Len=33304 TSval=2448097734 TSecr=2176212057"
"257","9.040204182","10.0.0.7","10.0.0.1","TCP","66","5201  >  40624 [ACK] Seq=1 Ack=46374 Win=108544 Len=0 TSval=2176212060 TSecr=2448097605"
"258","9.041898905","10.0.0.7","10.0.0.1","TCP","66","5201  >  40624 [ACK] Seq=1 Ack=57958 Win=131584 Len=0 TSval=2176212062 TSecr=2448097605"
"259","9.041919006","10.0.0.1","10.0.0.7","TCP","7306","40624  >  5201 [PSH, ACK] Seq=79678 Ack=1 Win=42496 Len=7240 TSval=2448097739 TSecr=2176212062"
"260","9.041929653","10.0.0.1","10.0.0.7","TCP","24682","40624  >  5201 [PSH, ACK] Seq=86918 Ack=1 Win=42496 Len=24616 TSval=2448097739 TSecr=2176212062"
"261","9.043822124","10.0.0.7","10.0.0.1","TCP","66","5201  >  40624 [ACK] Seq=1 Ack=79678 Win=174080 Len=0 TSval=2176212064 TSecr=2448097607"
"262","9.043850003","10.0.0.1","10.0.0.7","TCP","33370","40624  >  5201 [PSH, ACK] Seq=111534 Ack=1 Win=42496 Len=33304 TSval=2448097741 TSecr=2176212064"
"263","9.061992686","10.0.0.7","10.0.0.1","TCP","66","5201  >  40630 [ACK] Seq=1 Ack=46374 Win=114176 Len=0 TSval=2176212082 TSecr=2448097615"
"264","9.063687136","10.0.0.7","10.0.0.1","TCP","66","5201  >  40630 [ACK] Seq=1 Ack=57958 Win=137216 Len=0 TSval=2176212084 TSecr=2448097615"
"265","9.063703716","10.0.0.1","10.0.0.7","TCP","7306","40630  >  5201 [PSH, ACK] Seq=79678 Ack=1 Win=42496 Len=7240 TSval=2448097761 TSecr=2176212084"
"266","9.063710966","10.0.0.1","10.0.0.7","TCP","27578","40630  >  5201 [PSH, ACK] Seq=86918 Ack=1 Win=42496 Len=27512 TSval=2448097761 TSecr=2176212084"
"267","9.065618795","10.0.0.7","10.0.0.1","TCP","66","5201  >  40630 [ACK] Seq=1 Ack=79678 Win=174080 Len=0 TSval=2176212086 TSecr=2448097617"
"268","9.065631844","10.0.0.1","10.0.0.7","TCP","36266","40630  >  5201 [PSH, ACK] Seq=114430 Ack=1 Win=42496 Len=36200 TSval=2448097763 TSecr=2176212086"
"269","9.069254226","10.0.0.7","10.0.0.1","TCP","66","5201  >  40558 [ACK] Seq=1 Ack=107190 Win=207360 Len=0 TSval=2176212090 TSecr=2448097619"
"270","9.069271911","10.0.0.1","10.0.0.7","TCP","18890","40558  >  5201 [PSH, ACK] Seq=153526 Ack=1 Win=42496 Len=18824 TSval=2448097767 TSecr=2176212090"
"271","9.069282632","10.0.0.1","10.0.0.7","TCP","56538","40558  >  5201 [PSH, ACK] Seq=172350 Ack=1 Win=42496 Len=56472 TSval=2448097767 TSecr=2176212090"
"272","9.070220269","10.0.0.7","10.0.0.1","TCP","66","5201  >  40558 [ACK] Seq=1 Ack=153526 Win=230912 Len=0 TSval=2176212091 TSecr=2448097619"
"273","9.077987361","10.0.0.7","10.0.0.1","TCP","66","5201  >  40568 [ACK] Seq=1 Ack=102846 Win=155136 Len=0 TSval=2176212098 TSecr=2448097625"
"274","9.078219662","10.0.0.7","10.0.0.1","TCP","66","5201  >  40570 [ACK] Seq=1 Ack=86918 Win=187392 Len=0 TSval=2176212099 TSecr=2448097634"
"275","9.079423600","10.0.0.7","10.0.0.1","TCP","66","5201  >  40570 [ACK] Seq=1 Ack=114430 Win=162816 Len=0 TSval=2176212100 TSecr=2448097634"
