"No.","Time","Source","Destination","Protocol","Length","Info"
"1","0.000000000","fe80::b05b:75ff:fef9:febb","ff02::2","ICMPv6","70","Router Solicitation from b2:5b:75:f9:fe:bb"
"2","0.000538574","fe80::6c1c:b2ff:fed8:259d","ff02::2","ICMPv6","70","Router Solicitation from 6e:1c:b2:d8:25:9d"
"3","0.000993120","fe80::60af:57ff:fe6f:e2aa","ff02::2","ICMPv6","70","Router Solicitation from 62:af:57:6f:e2:aa"
"4","1.025399682","fe80::384e:dbff:fec7:a511","ff02::2","ICMPv6","70","Router Solicitation from 3a:4e:db:c7:a5:11"
"5","1.025428288","fe80::6811:16ff:fe8a:3f4d","ff02::2","ICMPv6","70","Router Solicitation from 6a:11:16:8a:3f:4d"
"6","1.537514334","fe80::8c57:aaff:fe10:4b25","ff02::2","ICMPv6","70","Router Solicitation from 8e:57:aa:10:4b:25"
"7","2.048746764","fe80::ac76:4cff:fedc:e9ac","ff02::2","ICMPv6","70","Router Solicitation from ae:76:4c:dc:e9:ac"
"8","5.539703804","b2:5b:75:f9:fe:bb","Broadcast","ARP","42","Who has 10.0.0.7? Tell 10.0.0.3"
"9","5.540054558","6e:1c:b2:d8:25:9d","Broadcast","ARP","42","Who has 10.0.0.7? Tell 10.0.0.1"
"10","5.540523473","62:af:57:6f:e2:aa","b2:5b:75:f9:fe:bb","ARP","42","10.0.0.7 is at 62:af:57:6f:e2:aa"
"11","5.540536505","10.0.0.3","10.0.0.7","TCP","74","44138  >  5202 [SYN] Seq=0 Win=42340 Len=0 MSS=1460 SACK_PERM TSval=3233293549 TSecr=0 WS=512"
"12","5.540998317","10.0.0.7","10.0.0.3","TCP","74","5202  >  44138 [SYN, ACK] Seq=0 Ack=1 Win=43440 Len=0 MSS=1460 SACK_PERM TSval=3469522186 TSecr=3233293549 WS=512"
"13","5.541029435","10.0.0.3","10.0.0.7","TCP","66","44138  >  5202 [ACK] Seq=1 Ack=1 Win=42496 Len=0 TSval=3233293551 TSecr=3469522186"
"14","5.541118338","10.0.0.3","10.0.0.7","TCP","103","44138  >  5202 [PSH, ACK] Seq=1 Ack=1 Win=42496 Len=37 TSval=3233293551 TSecr=3469522186"
"15","5.541160509","10.0.0.7","10.0.0.3","TCP","66","5202  >  44138 [ACK] Seq=1 Ack=38 Win=43520 Len=0 TSval=3469522187 TSecr=3233293551"
"16","5.541230919","10.0.0.7","10.0.0.3","TCP","67","5202  >  44138 [PSH, ACK] Seq=1 Ack=38 Win=43520 Len=1 TSval=3469522187 TSecr=3233293551"
"17","5.541249004","10.0.0.3","10.0.0.7","TCP","66","44138  >  5202 [ACK] Seq=38 Ack=2 Win=42496 Len=0 TSval=3233293551 TSecr=3469522187"
"18","5.541281228","10.0.0.3","10.0.0.7","TCP","70","44138  >  5202 [PSH, ACK] Seq=38 Ack=2 Win=42496 Len=4 TSval=3233293551 TSecr=3469522187"
"19","5.541297143","10.0.0.3","10.0.0.7","TCP","232","44138  >  5202 [PSH, ACK] Seq=42 Ack=2 Win=42496 Len=166 TSval=3233293551 TSecr=3469522187"
"20","5.541327463","10.0.0.7","10.0.0.3","TCP","66","5202  >  44138 [ACK] Seq=2 Ack=208 Win=43520 Len=0 TSval=3469522187 TSecr=3233293551"
"21","5.541389746","10.0.0.7","10.0.0.3","TCP","67","5202  >  44138 [PSH, ACK] Seq=2 Ack=208 Win=43520 Len=1 TSval=3469522187 TSecr=3233293551"
"22","5.541435583","10.0.0.3","10.0.0.7","TCP","74","44150  >  5202 [SYN] Seq=0 Win=42340 Len=0 MSS=1460 SACK_PERM TSval=3233293551 TSecr=0 WS=512"
"23","5.541461947","10.0.0.7","10.0.0.3","TCP","74","5202  >  44150 [SYN, ACK] Seq=0 Ack=1 Win=43440 Len=0 MSS=1460 SACK_PERM TSval=3469522187 TSecr=3233293551 WS=512"
"24","5.541473525","10.0.0.3","10.0.0.7","TCP","66","44150  >  5202 [ACK] Seq=1 Ack=1 Win=42496 Len=0 TSval=3233293551 TSecr=3469522187"
"25","5.541494400","10.0.0.3","10.0.0.7","TCP","103","44150  >  5202 [PSH, ACK] Seq=1 Ack=1 Win=42496 Len=37 TSval=3233293551 TSecr=3469522187"
"26","5.541504751","10.0.0.7","10.0.0.3","TCP","66","5202  >  44150 [ACK] Seq=1 Ack=38 Win=43520 Len=0 TSval=3469522187 TSecr=3233293551"
"27","5.542593916","10.0.0.3","10.0.0.7","TCP","74","44160  >  5202 [SYN] Seq=0 Win=42340 Len=0 MSS=1460 SACK_PERM TSval=3233293552 TSecr=0 WS=512"
"28","5.542615110","10.0.0.7","10.0.0.3","TCP","74","5202  >  44160 [SYN, ACK] Seq=0 Ack=1 Win=43440 Len=0 MSS=1460 SACK_PERM TSval=3469522188 TSecr=3233293552 WS=512"
"29","5.542623458","10.0.0.3","10.0.0.7","TCP","66","44160  >  5202 [ACK] Seq=1 Ack=1 Win=42496 Len=0 TSval=3233293552 TSecr=3469522188"
"30","5.542639449","10.0.0.3","10.0.0.7","TCP","103","44160  >  5202 [PSH, ACK] Seq=1 Ack=1 Win=42496 Len=37 TSval=3233293552 TSecr=3469522188"
"31","5.542649908","10.0.0.7","10.0.0.3","TCP","66","5202  >  44160 [ACK] Seq=1 Ack=38 Win=43520 Len=0 TSval=3469522188 TSecr=3233293552"
"32","5.543506983","10.0.0.3","10.0.0.7","TCP","74","44176  >  5202 [SYN] Seq=0 Win=42340 Len=0 MSS=1460 SACK_PERM TSval=3233293553 TSecr=0 WS=512"
"33","5.543524086","10.0.0.7","10.0.0.3","TCP","74","5202  >  44176 [SYN, ACK] Seq=0 Ack=1 Win=43440 Len=0 MSS=1460 SACK_PERM TSval=3469522189 TSecr=3233293553 WS=512"
"34","5.543531893","10.0.0.3","10.0.0.7","TCP","66","44176  >  5202 [ACK] Seq=1 Ack=1 Win=42496 Len=0 TSval=3233293553 TSecr=3469522189"
"35","5.543546564","10.0.0.3","10.0.0.7","TCP","103","44176  >  5202 [PSH, ACK] Seq=1 Ack=1 Win=42496 Len=37 TSval=3233293553 TSecr=3469522189"
"36","5.543580469","10.0.0.7","10.0.0.3","TCP","66","5202  >  44176 [ACK] Seq=1 Ack=38 Win=43520 Len=0 TSval=3469522189 TSecr=3233293553"
"37","5.544367718","10.0.0.3","10.0.0.7","TCP","74","44180  >  5202 [SYN] Seq=0 Win=42340 Len=0 MSS=1460 SACK_PERM TSval=3233293554 TSecr=0 WS=512"
"38","5.544384090","10.0.0.7","10.0.0.3","TCP","74","5202  >  44180 [SYN, ACK] Seq=0 Ack=1 Win=43440 Len=0 MSS=1460 SACK_PERM TSval=3469522190 TSecr=3233293554 WS=512"
"39","5.544391084","10.0.0.3","10.0.0.7","TCP","66","44180  >  5202 [ACK] Seq=1 Ack=1 Win=42496 Len=0 TSval=3233293554 TSecr=3469522190"
"40","5.544408874","10.0.0.3","10.0.0.7","TCP","103","44180  >  5202 [PSH, ACK] Seq=1 Ack=1 Win=42496 Len=37 TSval=3233293554 TSecr=3469522190"
"41","5.544424486","10.0.0.7","10.0.0.3","TCP","66","5202  >  44180 [ACK] Seq=1 Ack=38 Win=43520 Len=0 TSval=3469522190 TSecr=3233293554"
"42","5.545287458","10.0.0.3","10.0.0.7","TCP","74","44186  >  5202 [SYN] Seq=0 Win=42340 Len=0 MSS=1460 SACK_PERM TSval=3233293555 TSecr=0 WS=512"
"43","5.545303903","10.0.0.7","10.0.0.3","TCP","74","5202  >  44186 [SYN, ACK] Seq=0 Ack=1 Win=43440 Len=0 MSS=1460 SACK_PERM TSval=3469522191 TSecr=3233293555 WS=512"
"44","5.545311276","10.0.0.3","10.0.0.7","TCP","66","44186  >  5202 [ACK] Seq=1 Ack=1 Win=42496 Len=0 TSval=3233293555 TSecr=3469522191"
"45","5.545326705","10.0.0.3","10.0.0.7","TCP","103","44186  >  5202 [PSH, ACK] Seq=1 Ack=1 Win=42496 Len=37 TSval=3233293555 TSecr=3469522191"
"46","5.545337340","10.0.0.7","10.0.0.3","TCP","66","5202  >  44186 [ACK] Seq=1 Ack=38 Win=43520 Len=0 TSval=3469522191 TSecr=3233293555"
"47","5.546577098","10.0.0.3","10.0.0.7","TCP","74","44198  >  5202 [SYN] Seq=0 Win=42340 Len=0 MSS=1460 SACK_PERM TSval=3233293556 TSecr=0 WS=512"
"48","5.546619736","10.0.0.7","10.0.0.3","TCP","74","5202  >  44198 [SYN, ACK] Seq=0 Ack=1 Win=43440 Len=0 MSS=1460 SACK_PERM TSval=3469522192 TSecr=3233293556 WS=512"
"49","5.546642657","10.0.0.3","10.0.0.7","TCP","66","44198  >  5202 [ACK] Seq=1 Ack=1 Win=42496 Len=0 TSval=3233293556 TSecr=3469522192"
"50","5.546681652","10.0.0.3","10.0.0.7","TCP","103","44198  >  5202 [PSH, ACK] Seq=1 Ack=1 Win=42496 Len=37 TSval=3233293556 TSecr=3469522192"
"51","5.546700618","10.0.0.7","10.0.0.3","TCP","66","5202  >  44198 [ACK] Seq=1 Ack=38 Win=43520 Len=0 TSval=3469522192 TSecr=3233293556"
"52","5.547293083","10.0.0.3","10.0.0.7","TCP","74","44206  >  5202 [SYN] Seq=0 Win=42340 Len=0 MSS=1460 SACK_PERM TSval=3233293557 TSecr=0 WS=512"
"53","5.547306335","10.0.0.7","10.0.0.3","TCP","74","5202  >  44206 [SYN, ACK] Seq=0 Ack=1 Win=43440 Len=0 MSS=1460 SACK_PERM TSval=3469522193 TSecr=3233293557 WS=512"
"54","5.547311906","10.0.0.3","10.0.0.7","TCP","66","44206  >  5202 [ACK] Seq=1 Ack=1 Win=42496 Len=0 TSval=3233293557 TSecr=3469522193"
"55","5.547320336","10.0.0.3","10.0.0.7","TCP","103","44206  >  5202 [PSH, ACK] Seq=1 Ack=1 Win=42496 Len=37 TSval=3233293557 TSecr=3469522193"
"56","5.547325079","10.0.0.7","10.0.0.3","TCP","66","5202  >  44206 [ACK] Seq=1 Ack=38 Win=43520 Len=0 TSval=3469522193 TSecr=3233293557"
"57","5.547657261","10.0.0.3","10.0.0.7","TCP","74","44210  >  5202 [SYN] Seq=0 Win=42340 Len=0 MSS=1460 SACK_PERM TSval=3233293557 TSecr=0 WS=512"
"58","5.547663552","10.0.0.7","10.0.0.3","TCP","74","5202  >  44210 [SYN, ACK] Seq=0 Ack=1 Win=43440 Len=0 MSS=1460 SACK_PERM TSval=3469522193 TSecr=3233293557 WS=512"
"59","5.547666215","10.0.0.3","10.0.0.7","TCP","66","44210  >  5202 [ACK] Seq=1 Ack=1 Win=42496 Len=0 TSval=3233293557 TSecr=3469522193"
"60","5.547671848","10.0.0.3","10.0.0.7","TCP","103","44210  >  5202 [PSH, ACK] Seq=1 Ack=1 Win=42496 Len=37 TSval=3233293557 TSecr=3469522193"
"61","5.547683624","10.0.0.7","10.0.0.3","TCP","66","5202  >  44210 [ACK] Seq=1 Ack=38 Win=43520 Len=0 TSval=3469522193 TSecr=3233293557"
"62","5.547987063","10.0.0.3","10.0.0.7","TCP","74","44226  >  5202 [SYN] Seq=0 Win=42340 Len=0 MSS=1460 SACK_PERM TSval=3233293558 TSecr=0 WS=512"
"63","5.547993183","10.0.0.7","10.0.0.3","TCP","74","5202  >  44226 [SYN, ACK] Seq=0 Ack=1 Win=43440 Len=0 MSS=1460 SACK_PERM TSval=3469522194 TSecr=3233293558 WS=512"
"64","5.547995478","10.0.0.3","10.0.0.7","TCP","66","44226  >  5202 [ACK] Seq=1 Ack=1 Win=42496 Len=0 TSval=3233293558 TSecr=3469522194"
"65","5.548000380","10.0.0.3","10.0.0.7","TCP","103","44226  >  5202 [PSH, ACK] Seq=1 Ack=1 Win=42496 Len=37 TSval=3233293558 TSecr=3469522194"
"66","5.548004331","10.0.0.7","10.0.0.3","TCP","66","5202  >  44226 [ACK] Seq=1 Ack=38 Win=43520 Len=0 TSval=3469522194 TSecr=3233293558"
"67","5.548321402","10.0.0.3","10.0.0.7","TCP","74","44242  >  5202 [SYN] Seq=0 Win=42340 Len=0 MSS=1460 SACK_PERM TSval=3233293558 TSecr=0 WS=512"
"68","5.548326597","10.0.0.7","10.0.0.3","TCP","74","5202  >  44242 [SYN, ACK] Seq=0 Ack=1 Win=43440 Len=0 MSS=1460 SACK_PERM TSval=3469522194 TSecr=3233293558 WS=512"
"69","5.548328707","10.0.0.3","10.0.0.7","TCP","66","44242  >  5202 [ACK] Seq=1 Ack=1 Win=42496 Len=0 TSval=3233293558 TSecr=3469522194"
"70","5.548333381","10.0.0.3","10.0.0.7","TCP","103","44242  >  5202 [PSH, ACK] Seq=1 Ack=1 Win=42496 Len=37 TSval=3233293558 TSecr=3469522194"
"71","5.548336850","10.0.0.7","10.0.0.3","TCP","66","5202  >  44242 [ACK] Seq=1 Ack=38 Win=43520 Len=0 TSval=3469522194 TSecr=3233293558"
"72","5.548657435","10.0.0.7","10.0.0.3","TCP","67","5202  >  44138 [PSH, ACK] Seq=3 Ack=208 Win=43520 Len=1 TSval=3469522194 TSecr=3233293551"
"73","5.548665564","10.0.0.7","10.0.0.3","TCP","67","5202  >  44138 [PSH, ACK] Seq=4 Ack=208 Win=43520 Len=1 TSval=3469522194 TSecr=3233293551"
"74","5.548667504","10.0.0.3","10.0.0.7","TCP","66","44138  >  5202 [ACK] Seq=208 Ack=4 Win=42496 Len=0 TSval=3233293558 TSecr=3469522187"
"75","5.548795152","10.0.0.3","10.0.0.7","TCP","7306","44150  >  5202 [PSH, ACK] Seq=38 Ack=1 Win=42496 Len=7240 TSval=3233293558 TSecr=3469522187"
"76","5.548795180","10.0.0.3","10.0.0.7","TCP","7306","44160  >  5202 [PSH, ACK] Seq=38 Ack=1 Win=42496 Len=7240 TSval=3233293558 TSecr=3469522188"
"77","5.548807678","10.0.0.3","10.0.0.7","TCP","7306","44150  >  5202 [PSH, ACK] Seq=7278 Ack=1 Win=42496 Len=7240 TSval=3233293558 TSecr=3469522187"
"78","5.548817358","10.0.0.7","10.0.0.3","TCP","66","5202  >  44160 [ACK] Seq=1 Ack=7278 Win=56832 Len=0 TSval=3469522194 TSecr=3233293558"
"79","5.548823579","10.0.0.3","10.0.0.7","TCP","7306","44176  >  5202 [PSH, ACK] Seq=38 Ack=1 Win=42496 Len=7240 TSval=3233293558 TSecr=3469522189"
"80","5.548828677","10.0.0.3","10.0.0.7","TCP","7306","44160  >  5202 [PSH, ACK] Seq=7278 Ack=1 Win=42496 Len=7240 TSval=3233293558 TSecr=3469522188"
"81","5.548836397","10.0.0.3","10.0.0.7","TCP","7306","44176  >  5202 [PSH, ACK] Seq=7278 Ack=1 Win=42496 Len=7240 TSval=3233293558 TSecr=3469522189"
"82","5.548891307","10.0.0.3","10.0.0.7","TCP","7306","44186  >  5202 [PSH, ACK] Seq=38 Ack=1 Win=42496 Len=7240 TSval=3233293559 TSecr=3469522191"
"83","5.548898257","10.0.0.3","10.0.0.7","TCP","10202","44160  >  5202 [PSH, ACK] Seq=14518 Ack=1 Win=42496 Len=10136 TSval=3233293559 TSecr=3469522194"
"84","5.548898107","10.0.0.3","10.0.0.7","TCP","7306","44180  >  5202 [PSH, ACK] Seq=38 Ack=1 Win=42496 Len=7240 TSval=3233293559 TSecr=3469522190"
"85","5.548904309","10.0.0.3","10.0.0.7","TCP","7306","44186  >  5202 [PSH, ACK] Seq=7278 Ack=1 Win=42496 Len=7240 TSval=3233293559 TSecr=3469522191"
"86","5.548910916","10.0.0.3","10.0.0.7","TCP","7306","44180  >  5202 [PSH, ACK] Seq=7278 Ack=1 Win=42496 Len=7240 TSval=3233293559 TSecr=3469522190"
"87","5.548926176","10.0.0.3","10.0.0.7","TCP","7306","44198  >  5202 [PSH, ACK] Seq=38 Ack=1 Win=42496 Len=7240 TSval=3233293559 TSecr=3469522192"
"88","5.548932213","10.0.0.3","10.0.0.7","TCP","7306","44198  >  5202 [PSH, ACK] Seq=7278 Ack=1 Win=42496 Len=7240 TSval=3233293559 TSecr=3469522192"
"89","5.548949942","10.0.0.3","10.0.0.7","TCP","7306","44206  >  5202 [PSH, ACK] Seq=38 Ack=1 Win=42496 Len=7240 TSval=3233293559 TSecr=3469522193"
"90","5.548951549","10.0.0.3","10.0.0.7","TCP","7306","44210  >  5202 [PSH, ACK] Seq=38 Ack=1 Win=42496 Len=7240 TSval=3233293559 TSecr=3469522193"
"91","5.548959572","10.0.0.3","10.0.0.7","TCP","7306","44206  >  5202 [PSH, ACK] Seq=7278 Ack=1 Win=42496 Len=7240 TSval=3233293559 TSecr=3469522193"
"92","5.548961769","10.0.0.3","10.0.0.7","TCP","7306","44210  >  5202 [PSH, ACK] Seq=7278 Ack=1 Win=42496 Len=7240 TSval=3233293559 TSecr=3469522193"
"93","5.549033835","10.0.0.3","10.0.0.7","TCP","7306","44242  >  5202 [PSH, ACK] Seq=38 Ack=1 Win=42496 Len=7240 TSval=3233293559 TSecr=3469522194"
"94","5.549037058","10.0.0.3","10.0.0.7","TCP","7306","44242  >  5202 [PSH, ACK] Seq=7278 Ack=1 Win=42496 Len=7240 TSval=3233293559 TSecr=3469522194"
"95","5.549040836","10.0.0.3","10.0.0.7","TCP","7306","44226  >  5202 [PSH, ACK] Seq=38 Ack=1 Win=42496 Len=7240 TSval=3233293559 TSecr=3469522194"
"96","5.549044701","10.0.0.3","10.0.0.7","TCP","7306","44226  >  5202 [PSH, ACK] Seq=7278 Ack=1 Win=42496 Len=7240 TSval=3233293559 TSecr=3469522194"
"97","5.549792404","10.0.0.7","10.0.0.3","TCP","66","5202  >  44150 [ACK] Seq=1 Ack=7278 Win=56832 Len=0 TSval=3469522195 TSecr=3233293558"
"98","5.549804050","10.0.0.3","10.0.0.7","TCP","10202","44150  >  5202 [PSH, ACK] Seq=14518 Ack=1 Win=42496 Len=10136 TSval=3233293559 TSecr=3469522195"
"99","5.550977140","10.0.0.7","10.0.0.3","TCP","66","5202  >  44150 [ACK] Seq=1 Ack=14518 Win=70656 Len=0 TSval=3469522197 TSecr=3233293558"
"100","5.550984455","10.0.0.3","10.0.0.7","TCP","11650","44150  >  5202 [PSH, ACK] Seq=24654 Ack=1 Win=42496 Len=11584 TSval=3233293561 TSecr=3469522197"
"101","5.551858903","10.0.0.3","10.0.0.7","TCP","1514","44176  >  5202 [ACK] Seq=14518 Ack=1 Win=42496 Len=1448 TSval=3233293562 TSecr=3469522189"
"102","5.552193097","10.0.0.7","10.0.0.3","TCP","66","5202  >  44176 [ACK] Seq=1 Ack=7278 Win=56832 Len=0 TSval=3469522198 TSecr=3233293558"
"103","5.552200801","10.0.0.3","10.0.0.7","TCP","10202","44176  >  5202 [PSH, ACK] Seq=15966 Ack=1 Win=42496 Len=10136 TSval=3233293562 TSecr=3469522198"
"104","5.552849942","10.0.0.3","10.0.0.7","TCP","1514","44198  >  5202 [ACK] Seq=14518 Ack=1 Win=42496 Len=1448 TSval=3233293563 TSecr=3469522192"
"105","5.552850802","10.0.0.3","10.0.0.7","TCP","1514","44226  >  5202 [ACK] Seq=14518 Ack=1 Win=42496 Len=1448 TSval=3233293563 TSecr=3469522194"
"106","5.552852658","10.0.0.3","10.0.0.7","TCP","1514","44206  >  5202 [ACK] Seq=14518 Ack=1 Win=42496 Len=1448 TSval=3233293563 TSecr=3469522193"
"107","5.552853131","10.0.0.3","10.0.0.7","TCP","4410","44160  >  5202 [PSH, ACK] Seq=24654 Ack=1 Win=42496 Len=4344 TSval=3233293563 TSecr=3469522194"
"108","5.552895291","10.0.0.3","10.0.0.7","TCP","1514","44186  >  5202 [ACK] Seq=14518 Ack=1 Win=42496 Len=1448 TSval=3233293563 TSecr=3469522191"
"109","5.552902408","10.0.0.3","10.0.0.7","TCP","1514","44242  >  5202 [ACK] Seq=14518 Ack=1 Win=42496 Len=1448 TSval=3233293563 TSecr=3469522194"
"110","5.552904977","10.0.0.3","10.0.0.7","TCP","1514","44180  >  5202 [ACK] Seq=14518 Ack=1 Win=42496 Len=1448 TSval=3233293563 TSecr=3469522190"
"111","5.553430825","10.0.0.7","10.0.0.3","TCP","66","5202  >  44160 [ACK] Seq=1 Ack=14518 Win=70656 Len=0 TSval=3469522199 TSecr=3233293558"
"112","5.553437424","10.0.0.3","10.0.0.7","TCP","7306","44160  >  5202 [PSH, ACK] Seq=28998 Ack=1 Win=42496 Len=7240 TSval=3233293563 TSecr=3469522199"
"113","5.553845533","10.0.0.3","10.0.0.7","TCP","1514","44210  >  5202 [ACK] Seq=14518 Ack=1 Win=42496 Len=1448 TSval=3233293564 TSecr=3469522193"
"114","5.554644476","10.0.0.7","10.0.0.3","TCP","66","5202  >  44176 [ACK] Seq=1 Ack=14518 Win=70656 Len=0 TSval=3469522200 TSecr=3233293558"
"115","5.554650159","10.0.0.3","10.0.0.7","TCP","10202","44176  >  5202 [PSH, ACK] Seq=26102 Ack=1 Win=42496 Len=10136 TSval=3233293564 TSecr=3469522200"
"116","5.555823259","10.0.0.7","10.0.0.3","TCP","66","5202  >  44186 [ACK] Seq=1 Ack=7278 Win=56832 Len=0 TSval=3469522201 TSecr=3233293559"
"117","5.555830936","10.0.0.3","10.0.0.7","TCP","10202","44186  >  5202 [PSH, ACK] Seq=15966 Ack=1 Win=42496 Len=10136 TSval=3233293565 TSecr=3469522201"
"118","5.555884051","10.0.0.3","10.0.0.7","TCP","7306","44150  >  5202 [PSH, ACK] Seq=36238 Ack=1 Win=42496 Len=7240 TSval=3233293566 TSecr=3469522197"
"119","5.557031049","10.0.0.7","10.0.0.3","TCP","66","5202  >  44160 [ACK] Seq=1 Ack=24654 Win=68096 Len=0 TSval=3469522203 TSecr=3233293559"
"120","5.557041123","10.0.0.3","10.0.0.7","TCP","18890","44160  >  5202 [PSH, ACK] Seq=36238 Ack=1 Win=42496 Len=18824 TSval=3233293567 TSecr=3469522203"
"121","5.557042395","10.0.0.3","10.0.0.7","TCP","2962","44160  >  5202 [PSH, ACK] Seq=55062 Ack=1 Win=42496 Len=2896 TSval=3233293567 TSecr=3469522203"
"122","5.558756092","10.0.0.7","10.0.0.3","TCP","66","5202  >  44180 [ACK] Seq=1 Ack=7278 Win=56832 Len=0 TSval=3469522204 TSecr=3233293559"
"123","5.558769650","10.0.0.3","10.0.0.7","TCP","10202","44180  >  5202 [PSH, ACK] Seq=15966 Ack=1 Win=42496 Len=10136 TSval=3233293568 TSecr=3469522204"
"124","5.559944603","10.0.0.7","10.0.0.3","TCP","66","5202  >  44186 [ACK] Seq=1 Ack=14518 Win=70656 Len=0 TSval=3469522206 TSecr=3233293559"
"125","5.559953045","10.0.0.3","10.0.0.7","TCP","10202","44186  >  5202 [PSH, ACK] Seq=26102 Ack=1 Win=42496 Len=10136 TSval=3233293570 TSecr=3469522206"
"126","5.561152140","10.0.0.7","10.0.0.3","TCP","66","5202  >  44180 [ACK] Seq=1 Ack=14518 Win=70656 Len=0 TSval=3469522207 TSecr=3233293559"
"127","5.561159961","10.0.0.3","10.0.0.7","TCP","10202","44180  >  5202 [PSH, ACK] Seq=26102 Ack=1 Win=42496 Len=10136 TSval=3233293571 TSecr=3469522207"
"128","5.562377945","10.0.0.7","10.0.0.3","TCP","66","5202  >  44198 [ACK] Seq=1 Ack=7278 Win=56832 Len=0 TSval=3469522208 TSecr=3233293559"
"129","5.562395722","10.0.0.3","10.0.0.7","TCP","10202","44198  >  5202 [PSH, ACK] Seq=15966 Ack=1 Win=42496 Len=10136 TSval=3233293572 TSecr=3469522208"
"130","5.563589294","10.0.0.7","10.0.0.3","TCP","66","5202  >  44198 [ACK] Seq=1 Ack=14518 Win=70656 Len=0 TSval=3469522209 TSecr=3233293559"
"131","5.563604688","10.0.0.3","10.0.0.7","TCP","10202","44198  >  5202 [PSH, ACK] Seq=26102 Ack=1 Win=42496 Len=10136 TSval=3233293573 TSecr=3469522209"
"132","5.564807419","10.0.0.7","10.0.0.3","TCP","66","5202  >  44206 [ACK] Seq=1 Ack=7278 Win=56832 Len=0 TSval=3469522210 TSecr=3233293559"
"133","5.564823447","10.0.0.3","10.0.0.7","TCP","10202","44206  >  5202 [PSH, ACK] Seq=15966 Ack=1 Win=42496 Len=10136 TSval=3233293574 TSecr=3469522210"
"134","5.566045878","10.0.0.7","10.0.0.3","TCP","66","5202  >  44210 [ACK] Seq=1 Ack=7278 Win=56832 Len=0 TSval=3469522212 TSecr=3233293559"
"135","5.566063525","10.0.0.3","10.0.0.7","TCP","10202","44210  >  5202 [PSH, ACK] Seq=15966 Ack=1 Win=42496 Len=10136 TSval=3233293576 TSecr=3469522212"
"136","5.567211642","10.0.0.7","10.0.0.3","TCP","66","5202  >  44206 [ACK] Seq=1 Ack=14518 Win=70656 Len=0 TSval=3469522213 TSecr=3233293559"
"137","5.567225061","10.0.0.3","10.0.0.7","TCP","10202","44206  >  5202 [PSH, ACK] Seq=26102 Ack=1 Win=42496 Len=10136 TSval=3233293577 TSecr=3469522213"
"138","5.568423890","10.0.0.7","10.0.0.3","TCP","66","5202  >  44210 [ACK] Seq=1 Ack=14518 Win=70656 Len=0 TSval=3469522214 TSecr=3233293559"
"139","5.568434543","10.0.0.3","10.0.0.7","TCP","10202","44210  >  5202 [PSH, ACK] Seq=26102 Ack=1 Win=42496 Len=10136 TSval=3233293578 TSecr=3469522214"
"140","5.569633508","10.0.0.7","10.0.0.3","TCP","66","5202  >  44242 [ACK] Seq=1 Ack=7278 Win=56832 Len=0 TSval=3469522215 TSecr=3233293559"
"141","5.569643951","10.0.0.3","10.0.0.7","TCP","10202","44242  >  5202 [PSH, ACK] Seq=15966 Ack=1 Win=42496 Len=10136 TSval=3233293579 TSecr=3469522215"
"142","5.570837705","10.0.0.7","10.0.0.3","TCP","66","5202  >  44242 [ACK] Seq=1 Ack=14518 Win=70656 Len=0 TSval=3469522216 TSecr=3233293559"
"143","5.570846910","10.0.0.3","10.0.0.7","TCP","10202","44242  >  5202 [PSH, ACK] Seq=26102 Ack=1 Win=42496 Len=10136 TSval=3233293581 TSecr=3469522216"
"144","5.572050156","10.0.0.7","10.0.0.3","TCP","66","5202  >  44226 [ACK] Seq=1 Ack=7278 Win=56832 Len=0 TSval=3469522218 TSecr=3233293559"
"145","5.572056281","10.0.0.3","10.0.0.7","TCP","10202","44226  >  5202 [PSH, ACK] Seq=15966 Ack=1 Win=42496 Len=10136 TSval=3233293582 TSecr=3469522218"
"146","5.573260415","10.0.0.7","10.0.0.3","TCP","66","5202  >  44226 [ACK] Seq=1 Ack=14518 Win=70656 Len=0 TSval=3469522219 TSecr=3233293559"
"147","5.573268828","10.0.0.3","10.0.0.7","TCP","10202","44226  >  5202 [PSH, ACK] Seq=26102 Ack=1 Win=42496 Len=10136 TSval=3233293583 TSecr=3469522219"
"148","5.574517003","10.0.0.7","10.0.0.3","TCP","66","5202  >  44150 [ACK] Seq=1 Ack=24654 Win=68096 Len=0 TSval=3469522220 TSecr=3233293559"
"149","5.574525609","10.0.0.3","10.0.0.7","TCP","14546","44150  >  5202 [PSH, ACK] Seq=43478 Ack=1 Win=42496 Len=14480 TSval=3233293584 TSecr=3469522220"
"150","5.576179643","10.0.0.7","10.0.0.3","TCP","66","5202  >  44150 [ACK] Seq=1 Ack=36238 Win=93696 Len=0 TSval=3469522222 TSecr=3233293561"
"151","5.576186377","10.0.0.3","10.0.0.7","TCP","21786","44150  >  5202 [PSH, ACK] Seq=57958 Ack=1 Win=42496 Len=21720 TSval=3233293586 TSecr=3469522222"
"152","5.578118624","10.0.0.7","10.0.0.3","TCP","66","5202  >  44176 [ACK] Seq=1 Ack=15966 Win=73216 Len=0 TSval=3469522224 TSecr=3233293562"
"153","5.578359188","10.0.0.7","10.0.0.3","TCP","66","5202  >  44176 [ACK] Seq=1 Ack=26102 Win=68096 Len=0 TSval=3469522224 TSecr=3233293562"
"154","5.578364936","10.0.0.3","10.0.0.7","TCP","10202","44176  >  5202 [PSH, ACK] Seq=36238 Ack=1 Win=42496 Len=10136 TSval=3233293588 TSecr=3469522224"
"155","5.578366862","10.0.0.3","10.0.0.7","TCP","11650","44176  >  5202 [PSH, ACK] Seq=46374 Ack=1 Win=42496 Len=11584 TSval=3233293588 TSecr=3469522224"
"156","5.580056508","10.0.0.7","10.0.0.3","TCP","66","5202  >  44198 [ACK] Seq=1 Ack=15966 Win=73216 Len=0 TSval=3469522226 TSecr=3233293563"
"157","5.580296488","10.0.0.7","10.0.0.3","TCP","66","5202  >  44226 [ACK] Seq=1 Ack=15966 Win=73216 Len=0 TSval=3469522226 TSecr=3233293563"
"158","5.580539271","10.0.0.7","10.0.0.3","TCP","66","5202  >  44206 [ACK] Seq=1 Ack=15966 Win=73216 Len=0 TSval=3469522226 TSecr=3233293563"
"159","5.580782174","10.0.0.7","10.0.0.3","TCP","66","5202  >  44160 [ACK] Seq=1 Ack=28998 Win=79360 Len=0 TSval=3469522226 TSecr=3233293563"
"160","5.581509171","10.0.0.7","10.0.0.3","TCP","66","5202  >  44186 [ACK] Seq=1 Ack=15966 Win=73216 Len=0 TSval=3469522227 TSecr=3233293563"
"161","5.581749574","10.0.0.7","10.0.0.3","TCP","66","5202  >  44242 [ACK] Seq=1 Ack=15966 Win=73216 Len=0 TSval=3469522227 TSecr=3233293563"
"162","5.581992873","10.0.0.7","10.0.0.3","TCP","66","5202  >  44180 [ACK] Seq=1 Ack=15966 Win=73216 Len=0 TSval=3469522228 TSecr=3233293563"
"163","5.582234298","10.0.0.7","10.0.0.3","TCP","66","5202  >  44160 [ACK] Seq=1 Ack=36238 Win=93696 Len=0 TSval=3469522228 TSecr=3233293563"
"164","5.582240499","10.0.0.3","10.0.0.7","TCP","14546","44160  >  5202 [PSH, ACK] Seq=57958 Ack=1 Win=42496 Len=14480 TSval=3233293592 TSecr=3469522228"
"165","5.583445716","10.0.0.7","10.0.0.3","TCP","66","5202  >  44210 [ACK] Seq=1 Ack=15966 Win=73216 Len=0 TSval=3469522229 TSecr=3233293564"
"166","5.583687436","10.0.0.7","10.0.0.3","TCP","66","5202  >  44176 [ACK] Seq=1 Ack=36238 Win=93696 Len=0 TSval=3469522229 TSecr=3233293564"
"167","5.583693993","10.0.0.3","10.0.0.7","TCP","21786","44176  >  5202 [PSH, ACK] Seq=57958 Ack=1 Win=42496 Len=21720 TSval=3233293593 TSecr=3469522229"
"168","5.585383707","10.0.0.7","10.0.0.3","TCP","66","5202  >  44186 [ACK] Seq=1 Ack=26102 Win=68096 Len=0 TSval=3469522231 TSecr=3233293565"
"169","5.585391168","10.0.0.3","10.0.0.7","TCP","10202","44186  >  5202 [PSH, ACK] Seq=36238 Ack=1 Win=42496 Len=10136 TSval=3233293595 TSecr=3469522231"
"170","5.585393975","10.0.0.3","10.0.0.7","TCP","11650","44186  >  5202 [PSH, ACK] Seq=46374 Ack=1 Win=42496 Len=11584 TSval=3233293595 TSecr=3469522231"
"171","5.587080082","10.0.0.7","10.0.0.3","TCP","66","5202  >  44150 [ACK] Seq=1 Ack=43478 Win=108032 Len=0 TSval=3469522233 TSecr=3233293566"
"172","5.587087283","10.0.0.3","10.0.0.7","TCP","21786","44150  >  5202 [PSH, ACK] Seq=79678 Ack=1 Win=42496 Len=21720 TSval=3233293597 TSecr=3469522233"
"173","5.588290450","10.0.0.7","10.0.0.3","TCP","66","5202  >  44160 [ACK] Seq=1 Ack=55062 Win=131584 Len=0 TSval=3469522234 TSecr=3233293567"
"174","5.589847471","10.0.0.3","10.0.0.7","TCP","66","44138  >  5202 [ACK] Seq=208 Ack=5 Win=42496 Len=0 TSval=3233293600 TSecr=3469522194"
"175","5.591440118","10.0.0.7","10.0.0.3","TCP","66","5202  >  44160 [ACK] Seq=1 Ack=57958 Win=137216 Len=0 TSval=3469522237 TSecr=3233293567"
"176","5.591446023","10.0.0.3","10.0.0.7","TCP","7306","44160  >  5202 [PSH, ACK] Seq=72438 Ack=1 Win=42496 Len=7240 TSval=3233293601 TSecr=3469522237"
"177","5.591450393","10.0.0.3","10.0.0.7","TCP","27578","44160  >  5202 [PSH, ACK] Seq=79678 Ack=1 Win=42496 Len=27512 TSval=3233293601 TSecr=3469522237"
"178","5.591923892","10.0.0.7","10.0.0.3","TCP","66","5202  >  44180 [ACK] Seq=1 Ack=26102 Win=68096 Len=0 TSval=3469522238 TSecr=3233293568"
"179","5.591929578","10.0.0.3","10.0.0.7","TCP","10202","44180  >  5202 [PSH, ACK] Seq=36238 Ack=1 Win=42496 Len=10136 TSval=3233293602 TSecr=3469522238"
"180","5.591931971","10.0.0.3","10.0.0.7","TCP","11650","44180  >  5202 [PSH, ACK] Seq=46374 Ack=1 Win=42496 Len=11584 TSval=3233293602 TSecr=3469522238"
"181","5.593619669","10.0.0.7","10.0.0.3","TCP","66","5202  >  44186 [ACK] Seq=1 Ack=36238 Win=93696 Len=0 TSval=3469522239 TSecr=3233293570"
"182","5.593625879","10.0.0.3","10.0.0.7","TCP","21786","44186  >  5202 [PSH, ACK] Seq=57958 Ack=1 Win=42496 Len=21720 TSval=3233293603 TSecr=3469522239"
"183","5.595315178","10.0.0.7","10.0.0.3","TCP","66","5202  >  44180 [ACK] Seq=1 Ack=36238 Win=93696 Len=0 TSval=3469522241 TSecr=3233293571"
"184","5.595322712","10.0.0.3","10.0.0.7","TCP","21786","44180  >  5202 [PSH, ACK] Seq=57958 Ack=1 Win=42496 Len=21720 TSval=3233293605 TSecr=3469522241"
"185","5.597010863","10.0.0.7","10.0.0.3","TCP","66","5202  >  44198 [ACK] Seq=1 Ack=26102 Win=68096 Len=0 TSval=3469522243 TSecr=3233293572"
"186","5.597016271","10.0.0.3","10.0.0.7","TCP","10202","44198  >  5202 [PSH, ACK] Seq=36238 Ack=1 Win=42496 Len=10136 TSval=3233293607 TSecr=3469522243"
"187","5.597018324","10.0.0.3","10.0.0.7","TCP","11650","44198  >  5202 [PSH, ACK] Seq=46374 Ack=1 Win=42496 Len=11584 TSval=3233293607 TSecr=3469522243"
"188","5.598706655","10.0.0.7","10.0.0.3","TCP","66","5202  >  44198 [ACK] Seq=1 Ack=36238 Win=93696 Len=0 TSval=3469522244 TSecr=3233293573"
"189","5.598713320","10.0.0.3","10.0.0.7","TCP","21786","44198  >  5202 [PSH, ACK] Seq=57958 Ack=1 Win=42496 Len=21720 TSval=3233293608 TSecr=3469522244"
"190","5.600402415","10.0.0.7","10.0.0.3","TCP","66","5202  >  44206 [ACK] Seq=1 Ack=26102 Win=68096 Len=0 TSval=3469522246 TSecr=3233293574"
"191","5.600408201","10.0.0.3","10.0.0.7","TCP","10202","44206  >  5202 [PSH, ACK] Seq=36238 Ack=1 Win=42496 Len=10136 TSval=3233293610 TSecr=3469522246"
"192","5.600410387","10.0.0.3","10.0.0.7","TCP","11650","44206  >  5202 [PSH, ACK] Seq=46374 Ack=1 Win=42496 Len=11584 TSval=3233293610 TSecr=3469522246"
"193","5.602097975","10.0.0.7","10.0.0.3","TCP","66","5202  >  44210 [ACK] Seq=1 Ack=26102 Win=68096 Len=0 TSval=3469522248 TSecr=3233293576"
"194","5.602103750","10.0.0.3","10.0.0.7","TCP","10202","44210  >  5202 [PSH, ACK] Seq=36238 Ack=1 Win=42496 Len=10136 TSval=3233293612 TSecr=3469522248"
"195","5.602105871","10.0.0.3","10.0.0.7","TCP","11650","44210  >  5202 [PSH, ACK] Seq=46374 Ack=1 Win=42496 Len=11584 TSval=3233293612 TSecr=3469522248"
"196","5.603793549","10.0.0.7","10.0.0.3","TCP","66","5202  >  44206 [ACK] Seq=1 Ack=36238 Win=93696 Len=0 TSval=3469522249 TSecr=3233293577"
"197","5.603801282","10.0.0.3","10.0.0.7","TCP","21786","44206  >  5202 [PSH, ACK] Seq=57958 Ack=1 Win=42496 Len=21720 TSval=3233293613 TSecr=3469522249"
"198","5.605489279","10.0.0.7","10.0.0.3","TCP","66","5202  >  44210 [ACK] Seq=1 Ack=36238 Win=93696 Len=0 TSval=3469522251 TSecr=3233293578"
"199","5.605497262","10.0.0.3","10.0.0.7","TCP","21786","44210  >  5202 [PSH, ACK] Seq=57958 Ack=1 Win=42496 Len=21720 TSval=3233293615 TSecr=3469522251"
"200","5.607185259","10.0.0.7","10.0.0.3","TCP","66","5202  >  44242 [ACK] Seq=1 Ack=26102 Win=68096 Len=0 TSval=3469522253 TSecr=3233293579"
"201","5.607191136","10.0.0.3","10.0.0.7","TCP","10202","44242  >  5202 [PSH, ACK] Seq=36238 Ack=1 Win=42496 Len=10136 TSval=3233293617 TSecr=3469522253"
"202","5.607193108","10.0.0.3","10.0.0.7","TCP","11650","44242  >  5202 [PSH, ACK] Seq=46374 Ack=1 Win=42496 Len=11584 TSval=3233293617 TSecr=3469522253"
"203","5.608880696","10.0.0.7","10.0.0.3","TCP","66","5202  >  44242 [ACK] Seq=1 Ack=36238 Win=93696 Len=0 TSval=3469522255 TSecr=3233293581"
"204","5.608887092","10.0.0.3","10.0.0.7","TCP","21786","44242  >  5202 [PSH, ACK] Seq=57958 Ack=1 Win=42496 Len=21720 TSval=3233293619 TSecr=3469522255"
"205","5.610576428","10.0.0.7","10.0.0.3","TCP","66","5202  >  44226 [ACK] Seq=1 Ack=26102 Win=68096 Len=0 TSval=3469522256 TSecr=3233293582"
"206","5.610581776","10.0.0.3","10.0.0.7","TCP","10202","44226  >  5202 [PSH, ACK] Seq=36238 Ack=1 Win=42496 Len=10136 TSval=3233293620 TSecr=3469522256"
"207","5.610583840","10.0.0.3","10.0.0.7","TCP","11650","44226  >  5202 [PSH, ACK] Seq=46374 Ack=1 Win=42496 Len=11584 TSval=3233293620 TSecr=3469522256"
"208","5.612271904","10.0.0.7","10.0.0.3","TCP","66","5202  >  44226 [ACK] Seq=1 Ack=36238 Win=93696 Len=0 TSval=3469522258 TSecr=3233293583"
"209","5.612278599","10.0.0.3","10.0.0.7","TCP","21786","44226  >  5202 [PSH, ACK] Seq=57958 Ack=1 Win=42496 Len=21720 TSval=3233293622 TSecr=3469522258"
"210","5.614018939","10.0.0.7","10.0.0.3","TCP","66","5202  >  44150 [ACK] Seq=1 Ack=57958 Win=137216 Len=0 TSval=3469522260 TSecr=3233293584"
"211","5.616448170","10.0.0.7","10.0.0.3","TCP","66","5202  >  44150 [ACK] Seq=1 Ack=79678 Win=152576 Len=0 TSval=3469522262 TSecr=3233293586"
"212","5.616453075","10.0.0.3","10.0.0.7","TCP","1514","44150  >  5202 [ACK] Seq=101398 Ack=1 Win=42496 Len=1448 TSval=3233293626 TSecr=3469522262"
"213","5.620069563","10.0.0.7","10.0.0.3","TCP","66","5202  >  44176 [ACK] Seq=1 Ack=46374 Win=114176 Len=0 TSval=3469522266 TSecr=3233293588"
"214","5.621759227","10.0.0.7","10.0.0.3","TCP","66","5202  >  44176 [ACK] Seq=1 Ack=57958 Win=137216 Len=0 TSval=3469522267 TSecr=3233293588"
"215","5.621765607","10.0.0.3","10.0.0.7","TCP","7306","44176  >  5202 [PSH, ACK] Seq=79678 Ack=1 Win=42496 Len=7240 TSval=3233293631 TSecr=3469522267"
"216","5.621770130","10.0.0.3","10.0.0.7","TCP","27578","44176  >  5202 [PSH, ACK] Seq=86918 Ack=1 Win=42496 Len=27512 TSval=3233293631 TSecr=3469522267"
"217","5.623696504","10.0.0.7","10.0.0.3","TCP","66","5202  >  44160 [ACK] Seq=1 Ack=72438 Win=158720 Len=0 TSval=3469522269 TSecr=3233293592"
"218","5.623702738","10.0.0.3","10.0.0.7","TCP","23234","44160  >  5202 [PSH, ACK] Seq=107190 Ack=1 Win=42496 Len=23168 TSval=3233293633 TSecr=3469522269"
"219","5.626129491","10.0.0.7","10.0.0.3","TCP","66","5202  >  44176 [ACK] Seq=1 Ack=79678 Win=174080 Len=0 TSval=3469522272 TSecr=3233293593"
"220","5.629763450","10.0.0.7","10.0.0.3","TCP","66","5202  >  44186 [ACK] Seq=1 Ack=46374 Win=114176 Len=0 TSval=3469522275 TSecr=3233293595"
"221","5.631458353","10.0.0.7","10.0.0.3","TCP","66","5202  >  44186 [ACK] Seq=1 Ack=57958 Win=137216 Len=0 TSval=3469522277 TSecr=3233293595"
"222","5.631463491","10.0.0.3","10.0.0.7","TCP","7306","44186  >  5202 [PSH, ACK] Seq=79678 Ack=1 Win=42496 Len=7240 TSval=3233293641 TSecr=3469522277"
"223","5.631467196","10.0.0.3","10.0.0.7","TCP","27578","44186  >  5202 [PSH, ACK] Seq=86918 Ack=1 Win=42496 Len=27512 TSval=3233293641 TSecr=3469522277"
"224","5.633396589","10.0.0.7","10.0.0.3","TCP","66","5202  >  44150 [ACK] Seq=1 Ack=101398 Win=152576 Len=0 TSval=3469522279 TSecr=3233293597"
"225","5.633402563","10.0.0.3","10.0.0.7","TCP","11650","44150  >  5202 [PSH, ACK] Seq=102846 Ack=1 Win=42496 Len=11584 TSval=3233293643 TSecr=3469522279"
"226","5.633405281","10.0.0.3","10.0.0.7","TCP","16746","44150  >  5202 [PSH, ACK] Seq=114430 Ack=1 Win=42496 Len=16680 TSval=3233293643 TSecr=3469522279"
"227","5.637040476","10.0.0.7","10.0.0.3","TCP","66","5202  >  44160 [ACK] Seq=1 Ack=79678 Win=173568 Len=0 TSval=3469522283 TSecr=3233293601"
"228","5.638251770","10.0.0.7","10.0.0.3","TCP","66","5202  >  44160 [ACK] Seq=1 Ack=107190 Win=228352 Len=0 TSval=3469522284 TSecr=3233293601"
"229","5.638255439","10.0.0.3","10.0.0.7","TCP","818","44160  >  5202 [PSH, ACK] Seq=130358 Ack=1 Win=42496 Len=752 TSval=3233293648 TSecr=3469522284"
"230","5.642854909","10.0.0.7","10.0.0.3","TCP","66","5202  >  44180 [ACK] Seq=1 Ack=46374 Win=114176 Len=0 TSval=3469522289 TSecr=3233293602"
"231","5.644549825","10.0.0.7","10.0.0.3","TCP","66","5202  >  44180 [ACK] Seq=1 Ack=57958 Win=137216 Len=0 TSval=3469522290 TSecr=3233293602"
"232","5.644555048","10.0.0.3","10.0.0.7","TCP","7306","44180  >  5202 [PSH, ACK] Seq=79678 Ack=1 Win=42496 Len=7240 TSval=3233293654 TSecr=3469522290"
"233","5.644560030","10.0.0.3","10.0.0.7","TCP","27578","44180  >  5202 [PSH, ACK] Seq=86918 Ack=1 Win=42496 Len=27512 TSval=3233293654 TSecr=3469522290"
"234","5.646487933","10.0.0.7","10.0.0.3","TCP","66","5202  >  44186 [ACK] Seq=1 Ack=79678 Win=174080 Len=0 TSval=3469522292 TSecr=3233293603"
"235","5.650121853","10.0.0.7","10.0.0.3","TCP","66","5202  >  44180 [ACK] Seq=1 Ack=79678 Win=174080 Len=0 TSval=3469522296 TSecr=3233293605"
"236","5.653756296","10.0.0.7","10.0.0.3","TCP","66","5202  >  44198 [ACK] Seq=1 Ack=46374 Win=114176 Len=0 TSval=3469522299 TSecr=3233293607"
"237","5.653786748","10.0.0.3","10.0.0.7","TCP","46402","44180  >  5202 [PSH, ACK] Seq=114430 Ack=1 Win=42496 Len=46336 TSval=3233293663 TSecr=3469522296"
"238","5.653788334","10.0.0.3","10.0.0.7","TCP","60882","44160  >  5202 [PSH, ACK] Seq=131110 Ack=1 Win=42496 Len=60816 TSval=3233293663 TSecr=3469522284"
"239","5.653812260","10.0.0.3","10.0.0.7","TCP","46402","44176  >  5202 [PSH, ACK] Seq=114430 Ack=1 Win=42496 Len=46336 TSval=3233293663 TSecr=3469522272"
"240","5.653814090","10.0.0.3","10.0.0.7","TCP","46402","44186  >  5202 [PSH, ACK] Seq=114430 Ack=1 Win=42496 Len=46336 TSval=3233293663 TSecr=3469522292"
"241","5.653851873","10.0.0.3","10.0.0.7","TCP","57986","44150  >  5202 [PSH, ACK] Seq=131110 Ack=1 Win=42496 Len=57920 TSval=3233293663 TSecr=3469522279"
"242","5.655622786","10.0.0.7","10.0.0.3","TCP","66","5202  >  44198 [ACK] Seq=1 Ack=57958 Win=137216 Len=0 TSval=3469522301 TSecr=3233293607"
"243","5.655629120","10.0.0.3","10.0.0.7","TCP","7306","44198  >  5202 [PSH, ACK] Seq=79678 Ack=1 Win=42496 Len=7240 TSval=3233293665 TSecr=3469522301"
"244","5.655634208","10.0.0.3","10.0.0.7","TCP","27578","44198  >  5202 [PSH, ACK] Seq=86918 Ack=1 Win=42496 Len=27512 TSval=3233293665 TSecr=3469522301"
"245","5.657388864","10.0.0.7","10.0.0.3","TCP","66","5202  >  44198 [ACK] Seq=1 Ack=79678 Win=174080 Len=0 TSval=3469522303 TSecr=3233293608"
"246","5.657398279","10.0.0.3","10.0.0.7","TCP","46402","44198  >  5202 [PSH, ACK] Seq=114430 Ack=1 Win=42496 Len=46336 TSval=3233293667 TSecr=3469522303"
"247","5.661023613","10.0.0.7","10.0.0.3","TCP","66","5202  >  44206 [ACK] Seq=1 Ack=46374 Win=114176 Len=0 TSval=3469522307 TSecr=3233293610"
"248","5.662718016","10.0.0.7","10.0.0.3","TCP","66","5202  >  44206 [ACK] Seq=1 Ack=57958 Win=137216 Len=0 TSval=3469522308 TSecr=3233293610"
"249","5.662723329","10.0.0.3","10.0.0.7","TCP","7306","44206  >  5202 [PSH, ACK] Seq=79678 Ack=1 Win=42496 Len=7240 TSval=3233293672 TSecr=3469522308"
"250","5.662728401","10.0.0.3","10.0.0.7","TCP","27578","44206  >  5202 [PSH, ACK] Seq=86918 Ack=1 Win=42496 Len=27512 TSval=3233293672 TSecr=3469522308"
"251","5.664656495","10.0.0.7","10.0.0.3","TCP","66","5202  >  44210 [ACK] Seq=1 Ack=46374 Win=114176 Len=0 TSval=3469522310 TSecr=3233293612"
"252","5.666351511","10.0.0.7","10.0.0.3","TCP","66","5202  >  44210 [ACK] Seq=1 Ack=57958 Win=137216 Len=0 TSval=3469522312 TSecr=3233293612"
"253","5.666357001","10.0.0.3","10.0.0.7","TCP","7306","44210  >  5202 [PSH, ACK] Seq=79678 Ack=1 Win=42496 Len=7240 TSval=3233293676 TSecr=3469522312"
"254","5.666361697","10.0.0.3","10.0.0.7","TCP","27578","44210  >  5202 [PSH, ACK] Seq=86918 Ack=1 Win=42496 Len=27512 TSval=3233293676 TSecr=3469522312"
"255","5.668289107","10.0.0.7","10.0.0.3","TCP","66","5202  >  44206 [ACK] Seq=1 Ack=79678 Win=174080 Len=0 TSval=3469522314 TSecr=3233293613"
"256","5.668297754","10.0.0.3","10.0.0.7","TCP","46402","44206  >  5202 [PSH, ACK] Seq=114430 Ack=1 Win=42496 Len=46336 TSval=3233293678 TSecr=3469522314"
"257","5.671923867","10.0.0.7","10.0.0.3","TCP","66","5202  >  44210 [ACK] Seq=1 Ack=79678 Win=174080 Len=0 TSval=3469522318 TSecr=3233293615"
"258","5.671936216","10.0.0.3","10.0.0.7","TCP","46402","44210  >  5202 [PSH, ACK] Seq=114430 Ack=1 Win=42496 Len=46336 TSval=3233293682 TSecr=3469522318"
"259","5.675566568","10.0.0.7","10.0.0.3","TCP","66","5202  >  44242 [ACK] Seq=1 Ack=46374 Win=114176 Len=0 TSval=3469522321 TSecr=3233293617"
"260","5.677255283","10.0.0.7","10.0.0.3","TCP","66","5202  >  44242 [ACK] Seq=1 Ack=57958 Win=137216 Len=0 TSval=3469522323 TSecr=3233293617"
"261","5.677261648","10.0.0.3","10.0.0.7","TCP","7306","44242  >  5202 [PSH, ACK] Seq=79678 Ack=1 Win=42496 Len=7240 TSval=3233293687 TSecr=3469522323"
"262","5.677265423","10.0.0.3","10.0.0.7","TCP","27578","44242  >  5202 [PSH, ACK] Seq=86918 Ack=1 Win=42496 Len=27512 TSval=3233293687 TSecr=3469522323"
"263","5.679198888","10.0.0.7","10.0.0.3","TCP","66","5202  >  44242 [ACK] Seq=1 Ack=79678 Win=174080 Len=0 TSval=3469522325 TSecr=3233293619"
"264","5.679211052","10.0.0.3","10.0.0.7","TCP","46402","44242  >  5202 [PSH, ACK] Seq=114430 Ack=1 Win=42496 Len=46336 TSval=3233293689 TSecr=3469522325"
"265","5.682831225","10.0.0.7","10.0.0.3","TCP","66","5202  >  44226 [ACK] Seq=1 Ack=46374 Win=114176 Len=0 TSval=3469522328 TSecr=3233293620"
"266","5.684525236","10.0.0.7","10.0.0.3","TCP","66","5202  >  44226 [ACK] Seq=1 Ack=57958 Win=137216 Len=0 TSval=3469522330 TSecr=3233293620"
"267","5.684532555","10.0.0.3","10.0.0.7","TCP","7306","44226  >  5202 [PSH, ACK] Seq=79678 Ack=1 Win=42496 Len=7240 TSval=3233293694 TSecr=3469522330"
"268","5.684536329","10.0.0.3","10.0.0.7","TCP","27578","44226  >  5202 [PSH, ACK] Seq=86918 Ack=1 Win=42496 Len=27512 TSval=3233293694 TSecr=3469522330"
"269","5.686459388","10.0.0.7","10.0.0.3","TCP","66","5202  >  44226 [ACK] Seq=1 Ack=79678 Win=163840 Len=0 TSval=3469522332 TSecr=3233293622"
"270","5.686470527","10.0.0.3","10.0.0.7","TCP","46402","44226  >  5202 [PSH, ACK] Seq=114430 Ack=1 Win=42496 Len=46336 TSval=3233293696 TSecr=3469522332"
"271","5.690359053","10.0.0.7","10.0.0.3","TCP","66","5202  >  44150 [ACK] Seq=1 Ack=102846 Win=155136 Len=0 TSval=3469522336 TSecr=3233293626"
"272","5.690388379","10.0.0.7","10.0.0.3","TCP","66","5202  >  44176 [ACK] Seq=1 Ack=86918 Win=187392 Len=0 TSval=3469522336 TSecr=3233293631"
"273","5.691579289","10.0.0.7","10.0.0.3","TCP","66","5202  >  44176 [ACK] Seq=1 Ack=114430 Win=194560 Len=0 TSval=3469522337 TSecr=3233293631"
