"No.","Time","Source","Destination","Protocol","Length","Info"
"1","0.000000000","fe80::fcdf:a0ff:fe11:b7d6","ff02::2","ICMPv6","70","Router Solicitation from fe:df:a0:11:b7:d6"
"2","0.000126422","fe80::14e3:8ff:fe06:5c1","ff02::2","ICMPv6","70","Router Solicitation from 16:e3:08:06:05:c1"
"3","0.001038627","fe80::eca6:f2ff:fe59:c53f","ff02::2","ICMPv6","70","Router Solicitation from ee:a6:f2:59:c5:3f"
"4","1.024507226","fe80::44b5:6eff:fefe:1144","ff02::2","ICMPv6","70","Router Solicitation from 46:b5:6e:fe:11:44"
"5","1.536141869","fe80::5c1e:d5ff:fea5:af24","ff02::2","ICMPv6","70","Router Solicitation from 5e:1e:d5:a5:af:24"
"6","1.536179927","fe80::54c1:d7ff:fedf:66d2","ff02::2","ICMPv6","70","Router Solicitation from 56:c1:d7:df:66:d2"
"7","1.536217324","fe80::9ca4:1ff:fe97:6318","ff02::2","ICMPv6","70","Router Solicitation from 9e:a4:01:97:63:18"
"8","1.616836450","fe80::493f:17d2:bdb8:fde3","ff02::2","ICMPv6","62","Router Solicitation"
"9","2.066988507","fe80::493f:17d2:bdb8:fde3","ff02::fb","MDNS","203","Standard query 0x0000 PTR _nfs._tcp.local, ""QM"" question PTR _ipp._tcp.local, ""QM"" question PTR _ipps._tcp.local, ""QM"" question PTR _ftp._tcp.local, ""QM"" question PTR _webdav._tcp.local, ""QM"" question PTR _webdavs._tcp.local, ""QM"" question PTR _sftp-ssh._tcp.local, ""QM"" question PTR _smb._tcp.local, ""QM"" question PTR _afpovertcp._tcp.local, ""QM"" question"
"10","2.956212152","0.0.0.0","255.255.255.255","DHCP","334","DHCP Discover - Transaction ID 0x95af9eb7"
"11","4.281333006","fe:df:a0:11:b7:d6","Broadcast","ARP","42","Who has 10.0.0.7? Tell 10.0.0.1"
"12","4.281751775","56:c1:d7:df:66:d2","Broadcast","ARP","42","Who has 10.0.0.7? Tell 10.0.0.3"
"13","4.282670175","46:b5:6e:fe:11:44","fe:df:a0:11:b7:d6","ARP","42","10.0.0.7 is at 46:b5:6e:fe:11:44"
"14","4.282680204","10.0.0.1","10.0.0.7","TCP","74","34892  >  5201 [SYN] Seq=0 Win=42340 Len=0 MSS=1460 SACK_PERM TSval=2450143030 TSecr=0 WS=512"
"15","4.283919874","10.0.0.7","10.0.0.1","TCP","74","5201  >  34892 [SYN, ACK] Seq=0 Ack=1 Win=43440 Len=0 MSS=1460 SACK_PERM TSval=2178257355 TSecr=2450143030 WS=512"
"16","4.283968389","10.0.0.1","10.0.0.7","TCP","66","34892  >  5201 [ACK] Seq=1 Ack=1 Win=42496 Len=0 TSval=2450143033 TSecr=2178257355"
"17","4.284046522","10.0.0.1","10.0.0.7","iPerf3","103","34892  >  5201 Cookie: ""ntz5fjhsmibtpqtgedvpnmwlqyejzjeo3s22"""
"18","4.284093405","10.0.0.7","10.0.0.1","TCP","66","5201  >  34892 [ACK] Seq=1 Ack=38 Win=43520 Len=0 TSval=2178257356 TSecr=2450143033"
"19","4.284123254","10.0.0.7","10.0.0.1","iPerf3","67","5201  >  34892 PARAM_EXCHANGE(9)"
"20","4.284138292","10.0.0.1","10.0.0.7","TCP","66","34892  >  5201 [ACK] Seq=38 Ack=2 Win=42496 Len=0 TSval=2450143033 TSecr=2178257356"
"21","4.284173462","10.0.0.1","10.0.0.7","iPerf3","70","34892  >  5201 Next message is JSON of this length: 172"
"22","4.284198026","10.0.0.1","10.0.0.7","iPerf3/JSON","238","34892  >  5201 {""tcp"":true,""omit"":0,""time"":150,""num"":0,""blockcount"":0,""parallel"":10,""len"":131072,""bandwidth"":10000000,""pacing_timer"":1000,""congestion"":""highspeed"",""client_version"":""3.16""}, JSON"
"23","4.284279165","10.0.0.7","10.0.0.1","TCP","66","5201  >  34892 [ACK] Seq=2 Ack=214 Win=43520 Len=0 TSval=2178257356 TSecr=2450143033"
"24","4.284363520","10.0.0.7","10.0.0.1","iPerf3","67","5201  >  34892 CREATE_STREAMS(10)"
"25","4.284436974","10.0.0.1","10.0.0.7","TCP","74","34908  >  5201 [SYN] Seq=0 Win=42340 Len=0 MSS=1460 SACK_PERM TSval=2450143033 TSecr=0 WS=512"
"26","4.284475470","10.0.0.7","10.0.0.1","TCP","74","5201  >  34908 [SYN, ACK] Seq=0 Ack=1 Win=43440 Len=0 MSS=1460 SACK_PERM TSval=2178257356 TSecr=2450143033 WS=512"
"27","4.284492821","10.0.0.1","10.0.0.7","TCP","66","34908  >  5201 [ACK] Seq=1 Ack=1 Win=42496 Len=0 TSval=2450143033 TSecr=2178257356"
"28","4.284526478","10.0.0.1","10.0.0.7","iPerf3","103","34908  >  5201 Cookie: ""ntz5fjhsmibtpqtgedvpnmwlqyejzjeo3s22"""
"29","4.284547227","10.0.0.7","10.0.0.1","TCP","66","5201  >  34908 [ACK] Seq=1 Ack=38 Win=43520 Len=0 TSval=2178257356 TSecr=2450143033"
"30","4.285970574","10.0.0.1","10.0.0.7","TCP","74","34914  >  5201 [SYN] Seq=0 Win=42340 Len=0 MSS=1460 SACK_PERM TSval=2450143035 TSecr=0 WS=512"
"31","4.286019727","10.0.0.7","10.0.0.1","TCP","74","5201  >  34914 [SYN, ACK] Seq=0 Ack=1 Win=43440 Len=0 MSS=1460 SACK_PERM TSval=2178257358 TSecr=2450143035 WS=512"
"32","4.286039360","10.0.0.1","10.0.0.7","TCP","66","34914  >  5201 [ACK] Seq=1 Ack=1 Win=42496 Len=0 TSval=2450143035 TSecr=2178257358"
"33","4.286076121","10.0.0.1","10.0.0.7","iPerf3","103","34914  >  5201 Cookie: ""ntz5fjhsmibtpqtgedvpnmwlqyejzjeo3s22"""
"34","4.286098995","10.0.0.7","10.0.0.1","TCP","66","5201  >  34914 [ACK] Seq=1 Ack=38 Win=43520 Len=0 TSval=2178257358 TSecr=2450143035"
"35","4.287496895","10.0.0.1","10.0.0.7","TCP","74","34924  >  5201 [SYN] Seq=0 Win=42340 Len=0 MSS=1460 SACK_PERM TSval=2450143036 TSecr=0 WS=512"
"36","4.287543640","10.0.0.7","10.0.0.1","TCP","74","5201  >  34924 [SYN, ACK] Seq=0 Ack=1 Win=43440 Len=0 MSS=1460 SACK_PERM TSval=2178257359 TSecr=2450143036 WS=512"
"37","4.287563884","10.0.0.1","10.0.0.7","TCP","66","34924  >  5201 [ACK] Seq=1 Ack=1 Win=42496 Len=0 TSval=2450143036 TSecr=2178257359"
"38","4.287598573","10.0.0.1","10.0.0.7","iPerf3","103","34924  >  5201 Cookie: ""ntz5fjhsmibtpqtgedvpnmwlqyejzjeo3s22"""
"39","4.287621250","10.0.0.7","10.0.0.1","TCP","66","5201  >  34924 [ACK] Seq=1 Ack=38 Win=43520 Len=0 TSval=2178257359 TSecr=2450143036"
"40","4.288964835","10.0.0.1","10.0.0.7","TCP","74","34926  >  5201 [SYN] Seq=0 Win=42340 Len=0 MSS=1460 SACK_PERM TSval=2450143038 TSecr=0 WS=512"
"41","4.289004315","10.0.0.7","10.0.0.1","TCP","74","5201  >  34926 [SYN, ACK] Seq=0 Ack=1 Win=43440 Len=0 MSS=1460 SACK_PERM TSval=2178257361 TSecr=2450143038 WS=512"
"42","4.289020051","10.0.0.1","10.0.0.7","TCP","66","34926  >  5201 [ACK] Seq=1 Ack=1 Win=42496 Len=0 TSval=2450143038 TSecr=2178257361"
"43","4.289051273","10.0.0.1","10.0.0.7","iPerf3","103","34926  >  5201 Cookie: ""ntz5fjhsmibtpqtgedvpnmwlqyejzjeo3s22"""
"44","4.289072324","10.0.0.7","10.0.0.1","TCP","66","5201  >  34926 [ACK] Seq=1 Ack=38 Win=43520 Len=0 TSval=2178257361 TSecr=2450143038"
"45","4.290306292","10.0.0.1","10.0.0.7","TCP","74","34928  >  5201 [SYN] Seq=0 Win=42340 Len=0 MSS=1460 SACK_PERM TSval=2450143039 TSecr=0 WS=512"
"46","4.290344321","10.0.0.7","10.0.0.1","TCP","74","5201  >  34928 [SYN, ACK] Seq=0 Ack=1 Win=43440 Len=0 MSS=1460 SACK_PERM TSval=2178257362 TSecr=2450143039 WS=512"
"47","4.290358987","10.0.0.1","10.0.0.7","TCP","66","34928  >  5201 [ACK] Seq=1 Ack=1 Win=42496 Len=0 TSval=2450143039 TSecr=2178257362"
"48","4.290386628","10.0.0.1","10.0.0.7","iPerf3","103","34928  >  5201 Cookie: ""ntz5fjhsmibtpqtgedvpnmwlqyejzjeo3s22"""
"49","4.290406539","10.0.0.7","10.0.0.1","TCP","66","5201  >  34928 [ACK] Seq=1 Ack=38 Win=43520 Len=0 TSval=2178257362 TSecr=2450143039"
"50","4.291605534","10.0.0.1","10.0.0.7","TCP","74","34936  >  5201 [SYN] Seq=0 Win=42340 Len=0 MSS=1460 SACK_PERM TSval=2450143040 TSecr=0 WS=512"
"51","4.291634268","10.0.0.7","10.0.0.1","TCP","74","5201  >  34936 [SYN, ACK] Seq=0 Ack=1 Win=43440 Len=0 MSS=1460 SACK_PERM TSval=2178257363 TSecr=2450143040 WS=512"
"52","4.291645499","10.0.0.1","10.0.0.7","TCP","66","34936  >  5201 [ACK] Seq=1 Ack=1 Win=42496 Len=0 TSval=2450143040 TSecr=2178257363"
"53","4.291668105","10.0.0.1","10.0.0.7","iPerf3","103","34936  >  5201 Cookie: ""ntz5fjhsmibtpqtgedvpnmwlqyejzjeo3s22"""
"54","4.291684450","10.0.0.7","10.0.0.1","TCP","66","5201  >  34936 [ACK] Seq=1 Ack=38 Win=43520 Len=0 TSval=2178257363 TSecr=2450143040"
"55","4.292634658","10.0.0.1","10.0.0.7","TCP","74","34950  >  5201 [SYN] Seq=0 Win=42340 Len=0 MSS=1460 SACK_PERM TSval=2450143041 TSecr=0 WS=512"
"56","4.292661560","10.0.0.7","10.0.0.1","TCP","74","5201  >  34950 [SYN, ACK] Seq=0 Ack=1 Win=43440 Len=0 MSS=1460 SACK_PERM TSval=2178257364 TSecr=2450143041 WS=512"
"57","4.292671533","10.0.0.1","10.0.0.7","TCP","66","34950  >  5201 [ACK] Seq=1 Ack=1 Win=42496 Len=0 TSval=2450143041 TSecr=2178257364"
"58","4.292685920","10.0.0.1","10.0.0.7","iPerf3","103","34950  >  5201 Cookie: ""ntz5fjhsmibtpqtgedvpnmwlqyejzjeo3s22"""
"59","4.292694861","10.0.0.7","10.0.0.1","TCP","66","5201  >  34950 [ACK] Seq=1 Ack=38 Win=43520 Len=0 TSval=2178257364 TSecr=2450143041"
"60","4.293391988","10.0.0.1","10.0.0.7","TCP","74","34958  >  5201 [SYN] Seq=0 Win=42340 Len=0 MSS=1460 SACK_PERM TSval=2450143042 TSecr=0 WS=512"
"61","4.293406332","10.0.0.7","10.0.0.1","TCP","74","5201  >  34958 [SYN, ACK] Seq=0 Ack=1 Win=43440 Len=0 MSS=1460 SACK_PERM TSval=2178257365 TSecr=2450143042 WS=512"
"62","4.293411308","10.0.0.1","10.0.0.7","TCP","66","34958  >  5201 [ACK] Seq=1 Ack=1 Win=42496 Len=0 TSval=2450143042 TSecr=2178257365"
"63","4.293421605","10.0.0.1","10.0.0.7","iPerf3","103","34958  >  5201 Cookie: ""ntz5fjhsmibtpqtgedvpnmwlqyejzjeo3s22"""
"64","4.293429940","10.0.0.7","10.0.0.1","TCP","66","5201  >  34958 [ACK] Seq=1 Ack=38 Win=43520 Len=0 TSval=2178257365 TSecr=2450143042"
"65","4.293995908","10.0.0.1","10.0.0.7","TCP","74","34962  >  5201 [SYN] Seq=0 Win=42340 Len=0 MSS=1460 SACK_PERM TSval=2450143043 TSecr=0 WS=512"
"66","4.307398521","10.0.0.7","10.0.0.1","TCP","74","5201  >  34962 [SYN, ACK] Seq=0 Ack=1 Win=43440 Len=0 MSS=1460 SACK_PERM TSval=2178257379 TSecr=2450143043 WS=512"
"67","4.307405771","10.0.0.1","10.0.0.7","TCP","66","34962  >  5201 [ACK] Seq=1 Ack=1 Win=42496 Len=0 TSval=2450143056 TSecr=2178257379"
"68","4.307518553","10.0.0.1","10.0.0.7","iPerf3","103","34962  >  5201 Cookie: ""ntz5fjhsmibtpqtgedvpnmwlqyejzjeo3s22"""
"69","4.307895153","10.0.0.1","10.0.0.7","TCP","74","34978  >  5201 [SYN] Seq=0 Win=42340 Len=0 MSS=1460 SACK_PERM TSval=2450143057 TSecr=0 WS=512"
"70","4.325805315","10.0.0.1","10.0.0.7","TCP","66","34892  >  5201 [ACK] Seq=214 Ack=3 Win=42496 Len=0 TSval=2450143075 TSecr=2178257356"
"71","4.345922769","10.0.0.7","10.0.0.1","TCP","66","5201  >  34962 [ACK] Seq=1 Ack=38 Win=43520 Len=0 TSval=2178257418 TSecr=2450143056"
"72","4.345943204","10.0.0.7","10.0.0.1","TCP","74","5201  >  34978 [SYN, ACK] Seq=0 Ack=1 Win=43440 Len=0 MSS=1460 SACK_PERM TSval=2178257418 TSecr=2450143057 WS=512"
"73","4.345948361","10.0.0.1","10.0.0.7","TCP","66","34978  >  5201 [ACK] Seq=1 Ack=1 Win=42496 Len=0 TSval=2450143095 TSecr=2178257418"
"74","4.345955501","10.0.0.1","10.0.0.7","iPerf3","103","34978  >  5201 Cookie: ""ntz5fjhsmibtpqtgedvpnmwlqyejzjeo3s22"""
"75","4.409944004","10.0.0.7","10.0.0.1","TCP","66","5201  >  34978 [ACK] Seq=1 Ack=38 Win=43520 Len=0 TSval=2178257482 TSecr=2450143095"
"76","4.410439230","10.0.0.7","10.0.0.1","iPerf3","67","5201  >  34892 TEST_START(1)"
"77","4.410448945","10.0.0.1","10.0.0.7","TCP","66","34892  >  5201 [ACK] Seq=214 Ack=4 Win=42496 Len=0 TSval=2450143159 TSecr=2178257482"
"78","4.410460122","10.0.0.7","10.0.0.1","iPerf3","67","5201  >  34892 TEST_RUNNING(2)"
"79","4.410462630","10.0.0.1","10.0.0.7","TCP","66","34892  >  5201 [ACK] Seq=214 Ack=5 Win=42496 Len=0 TSval=2450143159 TSecr=2178257482"
"80","4.410570299","10.0.0.1","10.0.0.7","TCP","7306","34914  >  5201 [PSH, ACK] Seq=38 Ack=1 Win=42496 Len=7240 TSval=2450143159 TSecr=2178257358"
"81","4.410582334","10.0.0.1","10.0.0.7","TCP","7306","34914  >  5201 [PSH, ACK] Seq=7278 Ack=1 Win=42496 Len=7240 TSval=2450143159 TSecr=2178257358"
"82","4.410603334","10.0.0.1","10.0.0.7","TCP","7306","34908  >  5201 [PSH, ACK] Seq=38 Ack=1 Win=42496 Len=7240 TSval=2450143159 TSecr=2178257356"
"83","4.410614592","10.0.0.1","10.0.0.7","TCP","7306","34908  >  5201 [PSH, ACK] Seq=7278 Ack=1 Win=42496 Len=7240 TSval=2450143159 TSecr=2178257356"
"84","4.410625251","10.0.0.1","10.0.0.7","TCP","7306","34924  >  5201 [PSH, ACK] Seq=38 Ack=1 Win=42496 Len=7240 TSval=2450143159 TSecr=2178257359"
"85","4.410634144","10.0.0.1","10.0.0.7","TCP","7306","34924  >  5201 [PSH, ACK] Seq=7278 Ack=1 Win=42496 Len=7240 TSval=2450143159 TSecr=2178257359"
"86","4.410683343","10.0.0.1","10.0.0.7","TCP","7306","34926  >  5201 [PSH, ACK] Seq=38 Ack=1 Win=42496 Len=7240 TSval=2450143159 TSecr=2178257361"
"87","4.410689681","10.0.0.1","10.0.0.7","TCP","7306","34926  >  5201 [PSH, ACK] Seq=7278 Ack=1 Win=42496 Len=7240 TSval=2450143159 TSecr=2178257361"
"88","4.410694486","10.0.0.1","10.0.0.7","TCP","7306","34928  >  5201 [PSH, ACK] Seq=38 Ack=1 Win=42496 Len=7240 TSval=2450143159 TSecr=2178257362"
"89","4.410704436","10.0.0.1","10.0.0.7","TCP","7306","34928  >  5201 [PSH, ACK] Seq=7278 Ack=1 Win=42496 Len=7240 TSval=2450143159 TSecr=2178257362"
"90","4.410716486","10.0.0.1","10.0.0.7","TCP","7306","34936  >  5201 [PSH, ACK] Seq=38 Ack=1 Win=42496 Len=7240 TSval=2450143159 TSecr=2178257363"
"91","4.410723788","10.0.0.1","10.0.0.7","TCP","7306","34936  >  5201 [PSH, ACK] Seq=7278 Ack=1 Win=42496 Len=7240 TSval=2450143159 TSecr=2178257363"
"92","4.410755047","10.0.0.1","10.0.0.7","TCP","7306","34950  >  5201 [PSH, ACK] Seq=38 Ack=1 Win=42496 Len=7240 TSval=2450143159 TSecr=2178257364"
"93","4.410756096","10.0.0.1","10.0.0.7","TCP","7306","34958  >  5201 [PSH, ACK] Seq=38 Ack=1 Win=42496 Len=7240 TSval=2450143159 TSecr=2178257365"
"94","4.410762027","10.0.0.1","10.0.0.7","TCP","7306","34950  >  5201 [PSH, ACK] Seq=7278 Ack=1 Win=42496 Len=7240 TSval=2450143159 TSecr=2178257364"
"95","4.410765188","10.0.0.1","10.0.0.7","TCP","7306","34958  >  5201 [PSH, ACK] Seq=7278 Ack=1 Win=42496 Len=7240 TSval=2450143159 TSecr=2178257365"
"96","4.410773911","10.0.0.1","10.0.0.7","TCP","2962","34978  >  5201 [PSH, ACK] Seq=38 Ack=1 Win=42496 Len=2896 TSval=2450143159 TSecr=2178257482"
"97","4.410780241","10.0.0.1","10.0.0.7","TCP","2962","34978  >  5201 [PSH, ACK] Seq=2934 Ack=1 Win=42496 Len=2896 TSval=2450143159 TSecr=2178257482"
"98","4.410830807","10.0.0.1","10.0.0.7","TCP","2962","34962  >  5201 [PSH, ACK] Seq=38 Ack=1 Win=42496 Len=2896 TSval=2450143159 TSecr=2178257418"
"99","4.410837794","10.0.0.1","10.0.0.7","TCP","2962","34962  >  5201 [PSH, ACK] Seq=2934 Ack=1 Win=42496 Len=2896 TSval=2450143160 TSecr=2178257418"
"100","4.413801745","10.0.0.1","10.0.0.7","TCP","1514","34950  >  5201 [ACK] Seq=14518 Ack=1 Win=42496 Len=1448 TSval=2450143163 TSecr=2178257364"
"101","4.413803331","10.0.0.1","10.0.0.7","TCP","1514","34936  >  5201 [ACK] Seq=14518 Ack=1 Win=42496 Len=1448 TSval=2450143163 TSecr=2178257363"
"102","4.413804484","10.0.0.1","10.0.0.7","TCP","1514","34914  >  5201 [ACK] Seq=14518 Ack=1 Win=42496 Len=1448 TSval=2450143163 TSecr=2178257358"
"103","4.413808133","10.0.0.1","10.0.0.7","TCP","1514","34958  >  5201 [ACK] Seq=14518 Ack=1 Win=42496 Len=1448 TSval=2450143163 TSecr=2178257365"
"104","4.413810421","10.0.0.1","10.0.0.7","TCP","1514","34924  >  5201 [ACK] Seq=14518 Ack=1 Win=42496 Len=1448 TSval=2450143163 TSecr=2178257359"
"105","4.413834875","10.0.0.1","10.0.0.7","TCP","1514","34928  >  5201 [ACK] Seq=14518 Ack=1 Win=42496 Len=1448 TSval=2450143163 TSecr=2178257362"
"106","4.414805106","10.0.0.1","10.0.0.7","TCP","1514","34926  >  5201 [ACK] Seq=14518 Ack=1 Win=42496 Len=1448 TSval=2450143164 TSecr=2178257361"
"107","4.414806888","10.0.0.1","10.0.0.7","TCP","1514","34908  >  5201 [ACK] Seq=14518 Ack=1 Win=42496 Len=1448 TSval=2450143164 TSecr=2178257356"
"108","4.435807221","10.0.0.7","10.0.0.1","TCP","67","[TCP Keep-Alive] 5201  >  34892 [PSH, ACK] Seq=4 Ack=214 Win=43520 Len=1 TSval=2178257508 TSecr=2450143075"
"109","4.435813246","10.0.0.1","10.0.0.7","TCP","78","[TCP Keep-Alive ACK] 34892  >  5201 [ACK] Seq=214 Ack=5 Win=42496 Len=0 TSval=2450143185 TSecr=2178257508 SLE=4 SRE=5"
"110","4.521532314","10.0.0.7","10.0.0.1","TCP","66","5201  >  34914 [ACK] Seq=1 Ack=7278 Win=56832 Len=0 TSval=2178257593 TSecr=2450143159"
"111","4.521546995","10.0.0.1","10.0.0.7","TCP","10202","34914  >  5201 [PSH, ACK] Seq=15966 Ack=1 Win=42496 Len=10136 TSval=2450143270 TSecr=2178257593"
"112","4.522731798","10.0.0.7","10.0.0.1","TCP","66","5201  >  34914 [ACK] Seq=1 Ack=14518 Win=70656 Len=0 TSval=2178257594 TSecr=2450143159"
"113","4.522737507","10.0.0.1","10.0.0.7","TCP","10202","34914  >  5201 [PSH, ACK] Seq=26102 Ack=1 Win=42496 Len=10136 TSval=2450143271 TSecr=2178257594"
"114","4.523943303","10.0.0.7","10.0.0.1","TCP","66","5201  >  34908 [ACK] Seq=1 Ack=7278 Win=56832 Len=0 TSval=2178257596 TSecr=2450143159"
"115","4.523948435","10.0.0.1","10.0.0.7","TCP","10202","34908  >  5201 [PSH, ACK] Seq=15966 Ack=1 Win=42496 Len=10136 TSval=2450143273 TSecr=2178257596"
"116","4.525152668","10.0.0.7","10.0.0.1","TCP","66","5201  >  34908 [ACK] Seq=1 Ack=14518 Win=70656 Len=0 TSval=2178257597 TSecr=2450143159"
"117","4.525158866","10.0.0.1","10.0.0.7","TCP","10202","34908  >  5201 [PSH, ACK] Seq=26102 Ack=1 Win=42496 Len=10136 TSval=2450143274 TSecr=2178257597"
"118","4.526366321","10.0.0.7","10.0.0.1","TCP","66","5201  >  34924 [ACK] Seq=1 Ack=7278 Win=56832 Len=0 TSval=2178257598 TSecr=2450143159"
"119","4.526371293","10.0.0.1","10.0.0.7","TCP","10202","34924  >  5201 [PSH, ACK] Seq=15966 Ack=1 Win=42496 Len=10136 TSval=2450143275 TSecr=2178257598"
"120","4.527576176","10.0.0.7","10.0.0.1","TCP","66","5201  >  34924 [ACK] Seq=1 Ack=14518 Win=70656 Len=0 TSval=2178257599 TSecr=2450143159"
"121","4.527581892","10.0.0.1","10.0.0.7","TCP","10202","34924  >  5201 [PSH, ACK] Seq=26102 Ack=1 Win=42496 Len=10136 TSval=2450143276 TSecr=2178257599"
"122","4.528789696","10.0.0.7","10.0.0.1","TCP","66","5201  >  34926 [ACK] Seq=1 Ack=7278 Win=56832 Len=0 TSval=2178257600 TSecr=2450143159"
"123","4.528794712","10.0.0.1","10.0.0.7","TCP","10202","34926  >  5201 [PSH, ACK] Seq=15966 Ack=1 Win=42496 Len=10136 TSval=2450143277 TSecr=2178257600"
"124","4.529998544","10.0.0.7","10.0.0.1","TCP","66","5201  >  34926 [ACK] Seq=1 Ack=14518 Win=70656 Len=0 TSval=2178257602 TSecr=2450143159"
"125","4.530002866","10.0.0.1","10.0.0.7","TCP","10202","34926  >  5201 [PSH, ACK] Seq=26102 Ack=1 Win=42496 Len=10136 TSval=2450143279 TSecr=2178257602"
"126","4.537026239","10.0.0.7","10.0.0.1","TCP","66","5201  >  34928 [ACK] Seq=1 Ack=7278 Win=56832 Len=0 TSval=2178257609 TSecr=2450143159"
"127","4.537032596","10.0.0.1","10.0.0.7","TCP","10202","34928  >  5201 [PSH, ACK] Seq=15966 Ack=1 Win=42496 Len=10136 TSval=2450143286 TSecr=2178257609"
"128","4.538234846","10.0.0.7","10.0.0.1","TCP","66","5201  >  34928 [ACK] Seq=1 Ack=14518 Win=70656 Len=0 TSval=2178257610 TSecr=2450143159"
"129","4.538240595","10.0.0.1","10.0.0.7","TCP","10202","34928  >  5201 [PSH, ACK] Seq=26102 Ack=1 Win=42496 Len=10136 TSval=2450143287 TSecr=2178257610"
"130","4.539447678","10.0.0.7","10.0.0.1","TCP","66","5201  >  34936 [ACK] Seq=1 Ack=7278 Win=56832 Len=0 TSval=2178257611 TSecr=2450143159"
"131","4.539453071","10.0.0.1","10.0.0.7","TCP","10202","34936  >  5201 [PSH, ACK] Seq=15966 Ack=1 Win=42496 Len=10136 TSval=2450143288 TSecr=2178257611"
"132","4.540656988","10.0.0.7","10.0.0.1","TCP","66","5201  >  34936 [ACK] Seq=1 Ack=14518 Win=70656 Len=0 TSval=2178257612 TSecr=2450143159"
"133","4.540662969","10.0.0.1","10.0.0.7","TCP","10202","34936  >  5201 [PSH, ACK] Seq=26102 Ack=1 Win=42496 Len=10136 TSval=2450143289 TSecr=2178257612"
"134","4.549624772","10.0.0.7","10.0.0.1","TCP","66","5201  >  34950 [ACK] Seq=1 Ack=7278 Win=56832 Len=0 TSval=2178257621 TSecr=2450143159"
"135","4.549632647","10.0.0.1","10.0.0.7","TCP","10202","34950  >  5201 [PSH, ACK] Seq=15966 Ack=1 Win=42496 Len=10136 TSval=2450143298 TSecr=2178257621"
"136","4.550834379","10.0.0.7","10.0.0.1","TCP","66","5201  >  34958 [ACK] Seq=1 Ack=7278 Win=56832 Len=0 TSval=2178257623 TSecr=2450143159"
"137","4.550841261","10.0.0.1","10.0.0.7","TCP","10202","34958  >  5201 [PSH, ACK] Seq=15966 Ack=1 Win=42496 Len=10136 TSval=2450143300 TSecr=2178257623"
"138","4.552048744","10.0.0.7","10.0.0.1","TCP","66","5201  >  34950 [ACK] Seq=1 Ack=14518 Win=70656 Len=0 TSval=2178257624 TSecr=2450143159"
"139","4.552058701","10.0.0.1","10.0.0.7","TCP","10202","34950  >  5201 [PSH, ACK] Seq=26102 Ack=1 Win=42496 Len=10136 TSval=2450143301 TSecr=2178257624"
"140","4.553263109","10.0.0.7","10.0.0.1","TCP","66","5201  >  34958 [ACK] Seq=1 Ack=14518 Win=70656 Len=0 TSval=2178257625 TSecr=2450143159"
"141","4.553275191","10.0.0.1","10.0.0.7","TCP","10202","34958  >  5201 [PSH, ACK] Seq=26102 Ack=1 Win=42496 Len=10136 TSval=2450143302 TSecr=2178257625"
"142","4.554475310","10.0.0.7","10.0.0.1","TCP","66","5201  >  34978 [ACK] Seq=1 Ack=2934 Win=48128 Len=0 TSval=2178257626 TSecr=2450143159"
"143","4.554483283","10.0.0.1","10.0.0.7","TCP","2962","34978  >  5201 [PSH, ACK] Seq=5830 Ack=1 Win=42496 Len=2896 TSval=2450143303 TSecr=2178257626"
"144","4.554950982","10.0.0.7","10.0.0.1","TCP","66","5201  >  34978 [ACK] Seq=1 Ack=5830 Win=54272 Len=0 TSval=2178257627 TSecr=2450143159"
"145","4.554955140","10.0.0.1","10.0.0.7","TCP","2962","34978  >  5201 [PSH, ACK] Seq=8726 Ack=1 Win=42496 Len=2896 TSval=2450143304 TSecr=2178257627"
"146","4.555435167","10.0.0.7","10.0.0.1","TCP","66","5201  >  34962 [ACK] Seq=1 Ack=2934 Win=48128 Len=0 TSval=2178257627 TSecr=2450143159"
"147","4.555443607","10.0.0.1","10.0.0.7","TCP","2962","34962  >  5201 [PSH, ACK] Seq=5830 Ack=1 Win=42496 Len=2896 TSval=2450143304 TSecr=2178257627"
"148","4.555917170","10.0.0.7","10.0.0.1","TCP","66","5201  >  34962 [ACK] Seq=1 Ack=5830 Win=54272 Len=0 TSval=2178257628 TSecr=2450143160"
"149","4.555921965","10.0.0.1","10.0.0.7","TCP","2962","34962  >  5201 [PSH, ACK] Seq=8726 Ack=1 Win=42496 Len=2896 TSval=2450143305 TSecr=2178257628"
"150","4.556402504","10.0.0.7","10.0.0.1","TCP","66","5201  >  34950 [ACK] Seq=1 Ack=15966 Win=73216 Len=0 TSval=2178257628 TSecr=2450143163"
"151","4.556649325","10.0.0.7","10.0.0.1","TCP","66","5201  >  34936 [ACK] Seq=1 Ack=15966 Win=73216 Len=0 TSval=2178257628 TSecr=2450143163"
"152","4.556888613","10.0.0.7","10.0.0.1","TCP","66","5201  >  34914 [ACK] Seq=1 Ack=15966 Win=73216 Len=0 TSval=2178257629 TSecr=2450143163"
"153","4.557129803","10.0.0.7","10.0.0.1","TCP","66","5201  >  34958 [ACK] Seq=1 Ack=15966 Win=73216 Len=0 TSval=2178257629 TSecr=2450143163"
"154","4.557373029","10.0.0.7","10.0.0.1","TCP","66","5201  >  34924 [ACK] Seq=1 Ack=15966 Win=73216 Len=0 TSval=2178257629 TSecr=2450143163"
"155","4.557618521","10.0.0.7","10.0.0.1","TCP","66","5201  >  34928 [ACK] Seq=1 Ack=15966 Win=73216 Len=0 TSval=2178257629 TSecr=2450143163"
"156","4.557857060","10.0.0.7","10.0.0.1","TCP","66","5201  >  34926 [ACK] Seq=1 Ack=15966 Win=73216 Len=0 TSval=2178257630 TSecr=2450143164"
"157","4.558101742","10.0.0.7","10.0.0.1","TCP","66","5201  >  34908 [ACK] Seq=1 Ack=15966 Win=73216 Len=0 TSval=2178257630 TSecr=2450143164"
"158","4.724200968","10.0.0.7","10.0.0.1","TCP","66","5201  >  34914 [ACK] Seq=1 Ack=26102 Win=68096 Len=0 TSval=2178257796 TSecr=2450143270"
"159","4.724210519","10.0.0.1","10.0.0.7","TCP","10202","34914  >  5201 [PSH, ACK] Seq=36238 Ack=1 Win=42496 Len=10136 TSval=2450143473 TSecr=2178257796"
"160","4.724214628","10.0.0.1","10.0.0.7","TCP","11650","34914  >  5201 [PSH, ACK] Seq=46374 Ack=1 Win=42496 Len=11584 TSval=2450143473 TSecr=2178257796"
"161","4.725887863","10.0.0.7","10.0.0.1","TCP","66","5201  >  34914 [ACK] Seq=1 Ack=36238 Win=93696 Len=0 TSval=2178257798 TSecr=2450143271"
"162","4.725895007","10.0.0.1","10.0.0.7","TCP","21786","34914  >  5201 [PSH, ACK] Seq=57958 Ack=1 Win=42496 Len=21720 TSval=2450143475 TSecr=2178257798"
"163","4.727584756","10.0.0.7","10.0.0.1","TCP","66","5201  >  34908 [ACK] Seq=1 Ack=26102 Win=68096 Len=0 TSval=2178257799 TSecr=2450143273"
"164","4.727589944","10.0.0.1","10.0.0.7","TCP","10202","34908  >  5201 [PSH, ACK] Seq=36238 Ack=1 Win=42496 Len=10136 TSval=2450143476 TSecr=2178257799"
"165","4.727593075","10.0.0.1","10.0.0.7","TCP","11650","34908  >  5201 [PSH, ACK] Seq=46374 Ack=1 Win=42496 Len=11584 TSval=2450143476 TSecr=2178257799"
"166","4.729285205","10.0.0.7","10.0.0.1","TCP","66","5201  >  34908 [ACK] Seq=1 Ack=36238 Win=93696 Len=0 TSval=2178257801 TSecr=2450143274"
"167","4.729293837","10.0.0.1","10.0.0.7","TCP","21786","34908  >  5201 [PSH, ACK] Seq=57958 Ack=1 Win=42496 Len=21720 TSval=2450143478 TSecr=2178257801"
"168","4.730985578","10.0.0.7","10.0.0.1","TCP","66","5201  >  34924 [ACK] Seq=1 Ack=26102 Win=68096 Len=0 TSval=2178257803 TSecr=2450143275"
"169","4.730994209","10.0.0.1","10.0.0.7","TCP","10202","34924  >  5201 [PSH, ACK] Seq=36238 Ack=1 Win=42496 Len=10136 TSval=2450143480 TSecr=2178257803"
"170","4.730997281","10.0.0.1","10.0.0.7","TCP","11650","34924  >  5201 [PSH, ACK] Seq=46374 Ack=1 Win=42496 Len=11584 TSval=2450143480 TSecr=2178257803"
"171","4.732671909","10.0.0.7","10.0.0.1","TCP","66","5201  >  34924 [ACK] Seq=1 Ack=36238 Win=93696 Len=0 TSval=2178257804 TSecr=2450143276"
"172","4.732680003","10.0.0.1","10.0.0.7","TCP","21786","34924  >  5201 [PSH, ACK] Seq=57958 Ack=1 Win=42496 Len=21720 TSval=2450143481 TSecr=2178257804"
"173","4.734367419","10.0.0.7","10.0.0.1","TCP","66","5201  >  34926 [ACK] Seq=1 Ack=26102 Win=68096 Len=0 TSval=2178257806 TSecr=2450143277"
"174","4.734372108","10.0.0.1","10.0.0.7","TCP","10202","34926  >  5201 [PSH, ACK] Seq=36238 Ack=1 Win=42496 Len=10136 TSval=2450143483 TSecr=2178257806"
"175","4.734376635","10.0.0.1","10.0.0.7","TCP","11650","34926  >  5201 [PSH, ACK] Seq=46374 Ack=1 Win=42496 Len=11584 TSval=2450143483 TSecr=2178257806"
"176","4.736062717","10.0.0.7","10.0.0.1","TCP","66","5201  >  34926 [ACK] Seq=1 Ack=36238 Win=93696 Len=0 TSval=2178257808 TSecr=2450143279"
"177","4.736068432","10.0.0.1","10.0.0.7","TCP","21786","34926  >  5201 [PSH, ACK] Seq=57958 Ack=1 Win=42496 Len=21720 TSval=2450143485 TSecr=2178257808"
"178","4.747206505","10.0.0.7","10.0.0.1","TCP","66","5201  >  34928 [ACK] Seq=1 Ack=26102 Win=68096 Len=0 TSval=2178257819 TSecr=2450143286"
"179","4.747212080","10.0.0.1","10.0.0.7","TCP","10202","34928  >  5201 [PSH, ACK] Seq=36238 Ack=1 Win=42496 Len=10136 TSval=2450143496 TSecr=2178257819"
"180","4.747216181","10.0.0.1","10.0.0.7","TCP","11650","34928  >  5201 [PSH, ACK] Seq=46374 Ack=1 Win=42496 Len=11584 TSval=2450143496 TSecr=2178257819"
"181","4.748967033","10.0.0.7","10.0.0.1","TCP","66","5201  >  34928 [ACK] Seq=1 Ack=36238 Win=93696 Len=0 TSval=2178257821 TSecr=2450143287"
"182","4.749004447","10.0.0.1","10.0.0.7","TCP","21786","34928  >  5201 [PSH, ACK] Seq=57958 Ack=1 Win=42496 Len=21720 TSval=2450143498 TSecr=2178257821"
"183","4.750602286","10.0.0.7","10.0.0.1","TCP","66","5201  >  34936 [ACK] Seq=1 Ack=26102 Win=68096 Len=0 TSval=2178257822 TSecr=2450143288"
"184","4.750609176","10.0.0.1","10.0.0.7","TCP","10202","34936  >  5201 [PSH, ACK] Seq=36238 Ack=1 Win=42496 Len=10136 TSval=2450143499 TSecr=2178257822"
"185","4.750611780","10.0.0.1","10.0.0.7","TCP","11650","34936  >  5201 [PSH, ACK] Seq=46374 Ack=1 Win=42496 Len=11584 TSval=2450143499 TSecr=2178257822"
"186","4.752292076","10.0.0.7","10.0.0.1","TCP","66","5201  >  34936 [ACK] Seq=1 Ack=36238 Win=93696 Len=0 TSval=2178257824 TSecr=2450143289"
"187","4.752298478","10.0.0.1","10.0.0.7","TCP","21786","34936  >  5201 [PSH, ACK] Seq=57958 Ack=1 Win=42496 Len=21720 TSval=2450143501 TSecr=2178257824"
"188","4.764971937","10.0.0.7","10.0.0.1","TCP","66","5201  >  34950 [ACK] Seq=1 Ack=26102 Win=68096 Len=0 TSval=2178257837 TSecr=2450143298"
"189","4.764987910","10.0.0.1","10.0.0.7","TCP","10202","34950  >  5201 [PSH, ACK] Seq=36238 Ack=1 Win=42496 Len=10136 TSval=2450143514 TSecr=2178257837"
"190","4.764991509","10.0.0.1","10.0.0.7","TCP","11650","34950  >  5201 [PSH, ACK] Seq=46374 Ack=1 Win=42496 Len=11584 TSval=2450143514 TSecr=2178257837"
"191","4.766587172","10.0.0.7","10.0.0.1","TCP","66","5201  >  34958 [ACK] Seq=1 Ack=26102 Win=68096 Len=0 TSval=2178257838 TSecr=2450143300"
"192","4.766591316","10.0.0.1","10.0.0.7","TCP","7306","34958  >  5201 [PSH, ACK] Seq=36238 Ack=1 Win=42496 Len=7240 TSval=2450143515 TSecr=2178257838"
"193","4.766593854","10.0.0.1","10.0.0.7","TCP","14546","34958  >  5201 [PSH, ACK] Seq=43478 Ack=1 Win=42496 Len=14480 TSval=2450143515 TSecr=2178257838"
"194","4.768280071","10.0.0.7","10.0.0.1","TCP","66","5201  >  34950 [ACK] Seq=1 Ack=36238 Win=93696 Len=0 TSval=2178257840 TSecr=2450143301"
"195","4.768288423","10.0.0.1","10.0.0.7","TCP","21786","34950  >  5201 [PSH, ACK] Seq=57958 Ack=1 Win=42496 Len=21720 TSval=2450143517 TSecr=2178257840"
"196","4.769977757","10.0.0.7","10.0.0.1","TCP","66","5201  >  34958 [ACK] Seq=1 Ack=36238 Win=93696 Len=0 TSval=2178257842 TSecr=2450143302"
"197","4.769985666","10.0.0.1","10.0.0.7","TCP","21786","34958  >  5201 [PSH, ACK] Seq=57958 Ack=1 Win=42496 Len=21720 TSval=2450143519 TSecr=2178257842"
"198","4.771672931","10.0.0.7","10.0.0.1","TCP","66","5201  >  34978 [ACK] Seq=1 Ack=8726 Win=59904 Len=0 TSval=2178257843 TSecr=2450143303"
"199","4.771676674","10.0.0.1","10.0.0.7","TCP","2962","34978  >  5201 [PSH, ACK] Seq=11622 Ack=1 Win=42496 Len=2896 TSval=2450143520 TSecr=2178257843"
"200","4.772155277","10.0.0.7","10.0.0.1","TCP","66","5201  >  34978 [ACK] Seq=1 Ack=11622 Win=64000 Len=0 TSval=2178257844 TSecr=2450143304"
"201","4.772157660","10.0.0.1","10.0.0.7","TCP","2962","34978  >  5201 [PSH, ACK] Seq=14518 Ack=1 Win=42496 Len=2896 TSval=2450143521 TSecr=2178257844"
"202","4.772641062","10.0.0.7","10.0.0.1","TCP","66","5201  >  34962 [ACK] Seq=1 Ack=8726 Win=59904 Len=0 TSval=2178257844 TSecr=2450143304"
"203","4.772644327","10.0.0.1","10.0.0.7","TCP","2962","34962  >  5201 [PSH, ACK] Seq=11622 Ack=1 Win=42496 Len=2896 TSval=2450143521 TSecr=2178257844"
"204","4.773124348","10.0.0.7","10.0.0.1","TCP","66","5201  >  34962 [ACK] Seq=1 Ack=11622 Win=64000 Len=0 TSval=2178257845 TSecr=2450143305"
"205","4.773126612","10.0.0.1","10.0.0.7","TCP","2962","34962  >  5201 [PSH, ACK] Seq=14518 Ack=1 Win=42496 Len=2896 TSval=2450143522 TSecr=2178257845"
"206","4.978448760","10.0.0.7","10.0.0.1","TCP","66","5201  >  34914 [ACK] Seq=1 Ack=46374 Win=114176 Len=0 TSval=2178258050 TSecr=2450143473"
"207","4.980133879","10.0.0.7","10.0.0.1","TCP","66","5201  >  34914 [ACK] Seq=1 Ack=57958 Win=137216 Len=0 TSval=2178258052 TSecr=2450143473"
"208","4.980144260","10.0.0.1","10.0.0.7","TCP","7306","34914  >  5201 [PSH, ACK] Seq=79678 Ack=1 Win=42496 Len=7240 TSval=2450143729 TSecr=2178258052"
"209","4.980149765","10.0.0.1","10.0.0.7","TCP","27578","34914  >  5201 [PSH, ACK] Seq=86918 Ack=1 Win=42496 Len=27512 TSval=2450143729 TSecr=2178258052"
"210","4.982071103","10.0.0.7","10.0.0.1","TCP","66","5201  >  34914 [ACK] Seq=1 Ack=79678 Win=174080 Len=0 TSval=2178258054 TSecr=2450143475"
"211","4.985705397","10.0.0.7","10.0.0.1","TCP","66","5201  >  34908 [ACK] Seq=1 Ack=46374 Win=114176 Len=0 TSval=2178258057 TSecr=2450143476"
"212","4.987400061","10.0.0.7","10.0.0.1","TCP","66","5201  >  34908 [ACK] Seq=1 Ack=57958 Win=137216 Len=0 TSval=2178258059 TSecr=2450143476"
"213","4.987407137","10.0.0.1","10.0.0.7","TCP","7306","34908  >  5201 [PSH, ACK] Seq=79678 Ack=1 Win=42496 Len=7240 TSval=2450143736 TSecr=2178258059"
"214","4.987414641","10.0.0.1","10.0.0.7","TCP","27578","34908  >  5201 [PSH, ACK] Seq=86918 Ack=1 Win=42496 Len=27512 TSval=2450143736 TSecr=2178258059"
"215","4.989338310","10.0.0.7","10.0.0.1","TCP","66","5201  >  34908 [ACK] Seq=1 Ack=79678 Win=174080 Len=0 TSval=2178258061 TSecr=2450143478"
"216","4.989352422","10.0.0.1","10.0.0.7","TCP","34818","34908  >  5201 [PSH, ACK] Seq=114430 Ack=1 Win=42496 Len=34752 TSval=2450143738 TSecr=2178258061"
"217","4.992976842","10.0.0.7","10.0.0.1","TCP","66","5201  >  34924 [ACK] Seq=1 Ack=46374 Win=114176 Len=0 TSval=2178258065 TSecr=2450143480"
"218","4.994667698","10.0.0.7","10.0.0.1","TCP","66","5201  >  34924 [ACK] Seq=1 Ack=57958 Win=137216 Len=0 TSval=2178258066 TSecr=2450143480"
"219","4.994676039","10.0.0.1","10.0.0.7","TCP","7306","34924  >  5201 [PSH, ACK] Seq=79678 Ack=1 Win=42496 Len=7240 TSval=2450143743 TSecr=2178258066"
"220","4.994680447","10.0.0.1","10.0.0.7","TCP","27578","34924  >  5201 [PSH, ACK] Seq=86918 Ack=1 Win=42496 Len=27512 TSval=2450143743 TSecr=2178258066"
"221","4.996605162","10.0.0.7","10.0.0.1","TCP","66","5201  >  34924 [ACK] Seq=1 Ack=79678 Win=174080 Len=0 TSval=2178258068 TSecr=2450143481"
"222","4.996616918","10.0.0.1","10.0.0.7","TCP","34818","34924  >  5201 [PSH, ACK] Seq=114430 Ack=1 Win=42496 Len=34752 TSval=2450143745 TSecr=2178258068"
"223","5.000240248","10.0.0.7","10.0.0.1","TCP","66","5201  >  34926 [ACK] Seq=1 Ack=46374 Win=114176 Len=0 TSval=2178258072 TSecr=2450143483"
"224","5.001995546","10.0.0.7","10.0.0.1","TCP","66","5201  >  34926 [ACK] Seq=1 Ack=57958 Win=137216 Len=0 TSval=2178258074 TSecr=2450143483"
"225","5.002024397","10.0.0.1","10.0.0.7","TCP","7306","34926  >  5201 [PSH, ACK] Seq=79678 Ack=1 Win=42496 Len=7240 TSval=2450143751 TSecr=2178258074"
"226","5.002038321","10.0.0.1","10.0.0.7","TCP","27578","34926  >  5201 [PSH, ACK] Seq=86918 Ack=1 Win=42496 Len=27512 TSval=2450143751 TSecr=2178258074"
"227","5.003902231","10.0.0.7","10.0.0.1","TCP","66","5201  >  34926 [ACK] Seq=1 Ack=79678 Win=174080 Len=0 TSval=2178258076 TSecr=2450143485"
"228","5.016484875","10.0.0.7","10.0.0.1","TCP","66","5201  >  34928 [ACK] Seq=1 Ack=46374 Win=114176 Len=0 TSval=2178258088 TSecr=2450143496"
"229","5.018163092","10.0.0.7","10.0.0.1","TCP","66","5201  >  34928 [ACK] Seq=1 Ack=57958 Win=137216 Len=0 TSval=2178258090 TSecr=2450143496"
"230","5.018170872","10.0.0.1","10.0.0.7","TCP","7306","34928  >  5201 [PSH, ACK] Seq=79678 Ack=1 Win=42496 Len=7240 TSval=2450143767 TSecr=2178258090"
"231","5.018177323","10.0.0.1","10.0.0.7","TCP","27578","34928  >  5201 [PSH, ACK] Seq=86918 Ack=1 Win=42496 Len=27512 TSval=2450143767 TSecr=2178258090"
"232","5.020102997","10.0.0.7","10.0.0.1","TCP","66","5201  >  34928 [ACK] Seq=1 Ack=79678 Win=174080 Len=0 TSval=2178258092 TSecr=2450143498"
"233","5.020112066","10.0.0.1","10.0.0.7","TCP","34818","34928  >  5201 [PSH, ACK] Seq=114430 Ack=1 Win=42496 Len=34752 TSval=2450143769 TSecr=2178258092"
"234","5.023736474","10.0.0.7","10.0.0.1","TCP","66","5201  >  34936 [ACK] Seq=1 Ack=46374 Win=114176 Len=0 TSval=2178258095 TSecr=2450143499"
"235","5.025429571","10.0.0.7","10.0.0.1","TCP","66","5201  >  34936 [ACK] Seq=1 Ack=57958 Win=137216 Len=0 TSval=2178258097 TSecr=2450143499"
"236","5.025435713","10.0.0.1","10.0.0.7","TCP","7306","34936  >  5201 [PSH, ACK] Seq=79678 Ack=1 Win=42496 Len=7240 TSval=2450143774 TSecr=2178258097"
"237","5.025440377","10.0.0.1","10.0.0.7","TCP","27578","34936  >  5201 [PSH, ACK] Seq=86918 Ack=1 Win=42496 Len=27512 TSval=2450143774 TSecr=2178258097"
"238","5.027368058","10.0.0.7","10.0.0.1","TCP","66","5201  >  34936 [ACK] Seq=1 Ack=79678 Win=174080 Len=0 TSval=2178258099 TSecr=2450143501"
"239","5.027378039","10.0.0.1","10.0.0.7","TCP","34818","34936  >  5201 [PSH, ACK] Seq=114430 Ack=1 Win=42496 Len=34752 TSval=2450143776 TSecr=2178258099"
"240","5.043845257","10.0.0.7","10.0.0.1","TCP","66","5201  >  34950 [ACK] Seq=1 Ack=46374 Win=114176 Len=0 TSval=2178258116 TSecr=2450143514"
"241","5.045535597","10.0.0.7","10.0.0.1","TCP","66","5201  >  34950 [ACK] Seq=1 Ack=57958 Win=137216 Len=0 TSval=2178258117 TSecr=2450143514"
"242","5.045541515","10.0.0.1","10.0.0.7","TCP","7306","34950  >  5201 [PSH, ACK] Seq=79678 Ack=1 Win=42496 Len=7240 TSval=2450143794 TSecr=2178258117"
"243","5.045547271","10.0.0.1","10.0.0.7","TCP","27578","34950  >  5201 [PSH, ACK] Seq=86918 Ack=1 Win=42496 Len=27512 TSval=2450143794 TSecr=2178258117"
"244","5.047478576","10.0.0.7","10.0.0.1","TCP","66","5201  >  34958 [ACK] Seq=1 Ack=43478 Win=108032 Len=0 TSval=2178258119 TSecr=2450143515"
"245","5.048686734","10.0.0.7","10.0.0.1","TCP","66","5201  >  34958 [ACK] Seq=1 Ack=57958 Win=137216 Len=0 TSval=2178258120 TSecr=2450143515"
"246","5.048696027","10.0.0.1","10.0.0.7","TCP","7306","34958  >  5201 [PSH, ACK] Seq=79678 Ack=1 Win=42496 Len=7240 TSval=2450143797 TSecr=2178258120"
"247","5.048700245","10.0.0.1","10.0.0.7","TCP","27578","34958  >  5201 [PSH, ACK] Seq=86918 Ack=1 Win=42496 Len=27512 TSval=2450143797 TSecr=2178258120"
"248","5.051110408","10.0.0.7","10.0.0.1","TCP","66","5201  >  34950 [ACK] Seq=1 Ack=79678 Win=174080 Len=0 TSval=2178258123 TSecr=2450143517"
"249","5.051120378","10.0.0.1","10.0.0.7","TCP","34818","34950  >  5201 [PSH, ACK] Seq=114430 Ack=1 Win=42496 Len=34752 TSval=2450143800 TSecr=2178258123"
"250","5.054743300","10.0.0.7","10.0.0.1","TCP","66","5201  >  34958 [ACK] Seq=1 Ack=79678 Win=174080 Len=0 TSval=2178258126 TSecr=2450143519"
"251","5.054756183","10.0.0.1","10.0.0.7","TCP","34818","34958  >  5201 [PSH, ACK] Seq=114430 Ack=1 Win=42496 Len=34752 TSval=2450143803 TSecr=2178258126"
"252","5.058375608","10.0.0.7","10.0.0.1","TCP","66","5201  >  34978 [ACK] Seq=1 Ack=14518 Win=64000 Len=0 TSval=2178258130 TSecr=2450143520"
"253","5.058379659","10.0.0.1","10.0.0.7","TCP","2962","34978  >  5201 [PSH, ACK] Seq=17414 Ack=1 Win=42496 Len=2896 TSval=2450143807 TSecr=2178258130"
"254","5.058858938","10.0.0.7","10.0.0.1","TCP","66","5201  >  34978 [ACK] Seq=1 Ack=17414 Win=64000 Len=0 TSval=2178258131 TSecr=2450143521"
"255","5.058861570","10.0.0.1","10.0.0.7","TCP","2962","34978  >  5201 [PSH, ACK] Seq=20310 Ack=1 Win=42496 Len=2896 TSval=2450143808 TSecr=2178258131"
"256","5.059344203","10.0.0.7","10.0.0.1","TCP","66","5201  >  34962 [ACK] Seq=1 Ack=14518 Win=64000 Len=0 TSval=2178258131 TSecr=2450143521"
"257","5.059347227","10.0.0.1","10.0.0.7","TCP","2962","34962  >  5201 [PSH, ACK] Seq=17414 Ack=1 Win=42496 Len=2896 TSval=2450143808 TSecr=2178258131"
"258","5.059827818","10.0.0.7","10.0.0.1","TCP","66","5201  >  34962 [ACK] Seq=1 Ack=17414 Win=64000 Len=0 TSval=2178258132 TSecr=2450143522"
"259","5.059829904","10.0.0.1","10.0.0.7","TCP","2962","34962  >  5201 [PSH, ACK] Seq=20310 Ack=1 Win=42496 Len=2896 TSval=2450143809 TSecr=2178258132"
"260","5.259700990","10.0.0.7","10.0.0.1","TCP","66","5201  >  34914 [ACK] Seq=1 Ack=86918 Win=187392 Len=0 TSval=2178258331 TSecr=2450143729"
"261","5.259713941","10.0.0.1","10.0.0.7","TCP","15994","34914  >  5201 [PSH, ACK] Seq=114430 Ack=1 Win=42496 Len=15928 TSval=2450144008 TSecr=2178258331"
"262","5.260902740","10.0.0.7","10.0.0.1","TCP","66","5201  >  34914 [ACK] Seq=1 Ack=114430 Win=194560 Len=0 TSval=2178258333 TSecr=2450143729"
"263","5.260912898","10.0.0.1","10.0.0.7","TCP","18890","34914  >  5201 [PSH, ACK] Seq=130358 Ack=1 Win=42496 Len=18824 TSval=2450144010 TSecr=2178258333"
"264","5.260923675","10.0.0.1","10.0.0.7","TCP","46402","34914  >  5201 [PSH, ACK] Seq=149182 Ack=1 Win=42496 Len=46336 TSval=2450144010 TSecr=2178258333"
"265","5.260934128","10.0.0.1","10.0.0.7","TCP","46402","34914  >  5201 [PSH, ACK] Seq=195518 Ack=1 Win=42496 Len=46336 TSval=2450144010 TSecr=2178258333"
"266","5.265515675","10.0.0.7","10.0.0.1","TCP","66","5201  >  34908 [ACK] Seq=1 Ack=86918 Win=187392 Len=0 TSval=2178258337 TSecr=2450143736"
"267","5.266716420","10.0.0.7","10.0.0.1","TCP","66","5201  >  34908 [ACK] Seq=1 Ack=114430 Win=194560 Len=0 TSval=2178258338 TSecr=2450143736"
"268","5.266727460","10.0.0.1","10.0.0.7","TCP","24682","34908  >  5201 [PSH, ACK] Seq=149182 Ack=1 Win=42496 Len=24616 TSval=2450144015 TSecr=2178258338"
"269","5.271323603","10.0.0.7","10.0.0.1","TCP","66","5201  >  34908 [ACK] Seq=1 Ack=149182 Win=188416 Len=0 TSval=2178258343 TSecr=2450143738"
"270","5.271334990","10.0.0.1","10.0.0.7","TCP","21786","34908  >  5201 [PSH, ACK] Seq=173798 Ack=1 Win=42496 Len=21720 TSval=2450144020 TSecr=2178258343"
"271","5.271342456","10.0.0.1","10.0.0.7","TCP","46402","34908  >  5201 [PSH, ACK] Seq=195518 Ack=1 Win=42496 Len=46336 TSval=2450144020 TSecr=2178258343"
"272","5.277149902","10.0.0.7","10.0.0.1","TCP","66","5201  >  34924 [ACK] Seq=1 Ack=86918 Win=187392 Len=0 TSval=2178258349 TSecr=2450143743"
"273","5.278343137","10.0.0.7","10.0.0.1","TCP","66","5201  >  34924 [ACK] Seq=1 Ack=114430 Win=194560 Len=0 TSval=2178258350 TSecr=2450143743"
"274","5.278356678","10.0.0.1","10.0.0.7","TCP","24682","34924  >  5201 [PSH, ACK] Seq=149182 Ack=1 Win=42496 Len=24616 TSval=2450144027 TSecr=2178258350"
