"No.","Time","Source","Destination","Protocol","Length","Info"
"1","0.000000000","fe80::493f:17d2:bdb8:fde3","ff02::2","ICMPv6","62","Router Solicitation"
"2","0.019877907","fe80::6c1c:b2ff:fed8:259d","ff02::2","ICMPv6","70","Router Solicitation from 6e:1c:b2:d8:25:9d"
"3","0.020713890","fe80::b05b:75ff:fef9:febb","ff02::2","ICMPv6","70","Router Solicitation from b2:5b:75:f9:fe:bb"
"4","0.021040808","fe80::60af:57ff:fe6f:e2aa","ff02::2","ICMPv6","70","Router Solicitation from 62:af:57:6f:e2:aa"
"5","1.045148859","fe80::384e:dbff:fec7:a511","ff02::2","ICMPv6","70","Router Solicitation from 3a:4e:db:c7:a5:11"
"6","1.045366013","fe80::6811:16ff:fe8a:3f4d","ff02::2","ICMPv6","70","Router Solicitation from 6a:11:16:8a:3f:4d"
"7","1.557634831","fe80::8c57:aaff:fe10:4b25","ff02::2","ICMPv6","70","Router Solicitation from 8e:57:aa:10:4b:25"
"8","2.068934476","fe80::ac76:4cff:fedc:e9ac","ff02::2","ICMPv6","70","Router Solicitation from ae:76:4c:dc:e9:ac"
"9","2.140663468","fe80::493f:17d2:bdb8:fde3","ff02::fb","MDNS","203","Standard query 0x0000 PTR _nfs._tcp.local, ""QM"" question PTR _ipp._tcp.local, ""QM"" question PTR _ipps._tcp.local, ""QM"" question PTR _ftp._tcp.local, ""QM"" question PTR _webdav._tcp.local, ""QM"" question PTR _webdavs._tcp.local, ""QM"" question PTR _sftp-ssh._tcp.local, ""QM"" question PTR _smb._tcp.local, ""QM"" question PTR _afpovertcp._tcp.local, ""QM"" question"
"10","3.302430419","0.0.0.0","255.255.255.255","DHCP","334","DHCP Discover - Transaction ID 0x9595472c"
"11","5.559425026","6e:1c:b2:d8:25:9d","Broadcast","ARP","42","Who has 10.0.0.7? Tell 10.0.0.1"
"12","5.560013533","b2:5b:75:f9:fe:bb","Broadcast","ARP","42","Who has 10.0.0.7? Tell 10.0.0.3"
"13","5.560424449","62:af:57:6f:e2:aa","6e:1c:b2:d8:25:9d","ARP","42","10.0.0.7 is at 62:af:57:6f:e2:aa"
"14","5.560435267","10.0.0.1","10.0.0.7","TCP","74","52814  >  5201 [SYN] Seq=0 Win=42340 Len=0 MSS=1460 SACK_PERM TSval=2449757728 TSecr=0 WS=512"
"15","5.560872650","10.0.0.7","10.0.0.1","TCP","74","5201  >  52814 [SYN, ACK] Seq=0 Ack=1 Win=43440 Len=0 MSS=1460 SACK_PERM TSval=2177872052 TSecr=2449757728 WS=512"
"16","5.560902580","10.0.0.1","10.0.0.7","TCP","66","52814  >  5201 [ACK] Seq=1 Ack=1 Win=42496 Len=0 TSval=2449757730 TSecr=2177872052"
"17","5.560937801","10.0.0.1","10.0.0.7","iPerf3","103","52814  >  5201 Cookie: ""fe465yrq64exbucu5zzdxqomtpxhdkq6b3dv"""
"18","5.560968550","10.0.0.7","10.0.0.1","TCP","66","5201  >  52814 [ACK] Seq=1 Ack=38 Win=43520 Len=0 TSval=2177872053 TSecr=2449757730"
"19","5.561017262","10.0.0.7","10.0.0.1","iPerf3","67","5201  >  52814 PARAM_EXCHANGE(9)"
"20","5.561034259","10.0.0.1","10.0.0.7","TCP","66","52814  >  5201 [ACK] Seq=38 Ack=2 Win=42496 Len=0 TSval=2449757730 TSecr=2177872053"
"21","5.561071616","10.0.0.1","10.0.0.7","iPerf3","70","52814  >  5201 Next message is JSON of this length: 166"
"22","5.561096028","10.0.0.1","10.0.0.7","iPerf3/JSON","232","52814  >  5201 {""tcp"":true,""omit"":0,""time"":150,""num"":0,""blockcount"":0,""parallel"":10,""len"":131072,""bandwidth"":10000000,""pacing_timer"":1000,""congestion"":""bic"",""client_version"":""3.16""}, JSON"
"23","5.561128104","10.0.0.7","10.0.0.1","TCP","66","5201  >  52814 [ACK] Seq=2 Ack=208 Win=43520 Len=0 TSval=2177872053 TSecr=2449757730"
"24","5.561198857","10.0.0.7","10.0.0.1","iPerf3","67","5201  >  52814 CREATE_STREAMS(10)"
"25","5.561258759","10.0.0.1","10.0.0.7","TCP","74","52818  >  5201 [SYN] Seq=0 Win=42340 Len=0 MSS=1460 SACK_PERM TSval=2449757730 TSecr=0 WS=512"
"26","5.561293794","10.0.0.7","10.0.0.1","TCP","74","5201  >  52818 [SYN, ACK] Seq=0 Ack=1 Win=43440 Len=0 MSS=1460 SACK_PERM TSval=2177872053 TSecr=2449757730 WS=512"
"27","5.561311123","10.0.0.1","10.0.0.7","TCP","66","52818  >  5201 [ACK] Seq=1 Ack=1 Win=42496 Len=0 TSval=2449757730 TSecr=2177872053"
"28","5.561344064","10.0.0.1","10.0.0.7","iPerf3","103","52818  >  5201 Cookie: ""fe465yrq64exbucu5zzdxqomtpxhdkq6b3dv"""
"29","5.561367572","10.0.0.7","10.0.0.1","TCP","66","5201  >  52818 [ACK] Seq=1 Ack=38 Win=43520 Len=0 TSval=2177872053 TSecr=2449757730"
"30","5.562664856","10.0.0.1","10.0.0.7","TCP","74","52834  >  5201 [SYN] Seq=0 Win=42340 Len=0 MSS=1460 SACK_PERM TSval=2449757731 TSecr=0 WS=512"
"31","5.562706963","10.0.0.7","10.0.0.1","TCP","74","5201  >  52834 [SYN, ACK] Seq=0 Ack=1 Win=43440 Len=0 MSS=1460 SACK_PERM TSval=2177872054 TSecr=2449757731 WS=512"
"32","5.562737774","10.0.0.1","10.0.0.7","TCP","66","52834  >  5201 [ACK] Seq=1 Ack=1 Win=42496 Len=0 TSval=2449757731 TSecr=2177872054"
"33","5.562771991","10.0.0.1","10.0.0.7","iPerf3","103","52834  >  5201 Cookie: ""fe465yrq64exbucu5zzdxqomtpxhdkq6b3dv"""
"34","5.562794158","10.0.0.7","10.0.0.1","TCP","66","5201  >  52834 [ACK] Seq=1 Ack=38 Win=43520 Len=0 TSval=2177872055 TSecr=2449757732"
"35","5.563985263","10.0.0.1","10.0.0.7","TCP","74","52836  >  5201 [SYN] Seq=0 Win=42340 Len=0 MSS=1460 SACK_PERM TSval=2449757733 TSecr=0 WS=512"
"36","5.564024238","10.0.0.7","10.0.0.1","TCP","74","5201  >  52836 [SYN, ACK] Seq=0 Ack=1 Win=43440 Len=0 MSS=1460 SACK_PERM TSval=2177872056 TSecr=2449757733 WS=512"
"37","5.564039599","10.0.0.1","10.0.0.7","TCP","66","52836  >  5201 [ACK] Seq=1 Ack=1 Win=42496 Len=0 TSval=2449757733 TSecr=2177872056"
"38","5.564069329","10.0.0.1","10.0.0.7","iPerf3","103","52836  >  5201 Cookie: ""fe465yrq64exbucu5zzdxqomtpxhdkq6b3dv"""
"39","5.564089334","10.0.0.7","10.0.0.1","TCP","66","5201  >  52836 [ACK] Seq=1 Ack=38 Win=43520 Len=0 TSval=2177872056 TSecr=2449757733"
"40","5.565304354","10.0.0.1","10.0.0.7","TCP","74","52850  >  5201 [SYN] Seq=0 Win=42340 Len=0 MSS=1460 SACK_PERM TSval=2449757734 TSecr=0 WS=512"
"41","5.565350365","10.0.0.7","10.0.0.1","TCP","74","5201  >  52850 [SYN, ACK] Seq=0 Ack=1 Win=43440 Len=0 MSS=1460 SACK_PERM TSval=2177872057 TSecr=2449757734 WS=512"
"42","5.565366686","10.0.0.1","10.0.0.7","TCP","66","52850  >  5201 [ACK] Seq=1 Ack=1 Win=42496 Len=0 TSval=2449757734 TSecr=2177872057"
"43","5.565397474","10.0.0.1","10.0.0.7","iPerf3","103","52850  >  5201 Cookie: ""fe465yrq64exbucu5zzdxqomtpxhdkq6b3dv"""
"44","5.565417955","10.0.0.7","10.0.0.1","TCP","66","5201  >  52850 [ACK] Seq=1 Ack=38 Win=43520 Len=0 TSval=2177872057 TSecr=2449757734"
"45","5.566656393","10.0.0.1","10.0.0.7","TCP","74","52860  >  5201 [SYN] Seq=0 Win=42340 Len=0 MSS=1460 SACK_PERM TSval=2449757735 TSecr=0 WS=512"
"46","5.566688823","10.0.0.7","10.0.0.1","TCP","74","5201  >  52860 [SYN, ACK] Seq=0 Ack=1 Win=43440 Len=0 MSS=1460 SACK_PERM TSval=2177872058 TSecr=2449757735 WS=512"
"47","5.566702128","10.0.0.1","10.0.0.7","TCP","66","52860  >  5201 [ACK] Seq=1 Ack=1 Win=42496 Len=0 TSval=2449757735 TSecr=2177872058"
"48","5.566778558","10.0.0.1","10.0.0.7","iPerf3","103","52860  >  5201 Cookie: ""fe465yrq64exbucu5zzdxqomtpxhdkq6b3dv"""
"49","5.566800636","10.0.0.7","10.0.0.1","TCP","66","5201  >  52860 [ACK] Seq=1 Ack=38 Win=43520 Len=0 TSval=2177872059 TSecr=2449757736"
"50","5.567364718","10.0.0.1","10.0.0.7","TCP","74","52868  >  5201 [SYN] Seq=0 Win=42340 Len=0 MSS=1460 SACK_PERM TSval=2449757736 TSecr=0 WS=512"
"51","5.567380400","10.0.0.7","10.0.0.1","TCP","74","5201  >  52868 [SYN, ACK] Seq=0 Ack=1 Win=43440 Len=0 MSS=1460 SACK_PERM TSval=2177872059 TSecr=2449757736 WS=512"
"52","5.567386728","10.0.0.1","10.0.0.7","TCP","66","52868  >  5201 [ACK] Seq=1 Ack=1 Win=42496 Len=0 TSval=2449757736 TSecr=2177872059"
"53","5.567399303","10.0.0.1","10.0.0.7","iPerf3","103","52868  >  5201 Cookie: ""fe465yrq64exbucu5zzdxqomtpxhdkq6b3dv"""
"54","5.567408387","10.0.0.7","10.0.0.1","TCP","66","5201  >  52868 [ACK] Seq=1 Ack=38 Win=43520 Len=0 TSval=2177872059 TSecr=2449757736"
"55","5.567939691","10.0.0.1","10.0.0.7","TCP","74","52880  >  5201 [SYN] Seq=0 Win=42340 Len=0 MSS=1460 SACK_PERM TSval=2449757737 TSecr=0 WS=512"
"56","5.567956008","10.0.0.7","10.0.0.1","TCP","74","5201  >  52880 [SYN, ACK] Seq=0 Ack=1 Win=43440 Len=0 MSS=1460 SACK_PERM TSval=2177872060 TSecr=2449757737 WS=512"
"57","5.567962305","10.0.0.1","10.0.0.7","TCP","66","52880  >  5201 [ACK] Seq=1 Ack=1 Win=42496 Len=0 TSval=2449757737 TSecr=2177872060"
"58","5.567974737","10.0.0.1","10.0.0.7","iPerf3","103","52880  >  5201 Cookie: ""fe465yrq64exbucu5zzdxqomtpxhdkq6b3dv"""
"59","5.567983312","10.0.0.7","10.0.0.1","TCP","66","5201  >  52880 [ACK] Seq=1 Ack=38 Win=43520 Len=0 TSval=2177872060 TSecr=2449757737"
"60","5.568507249","10.0.0.1","10.0.0.7","TCP","74","52894  >  5201 [SYN] Seq=0 Win=42340 Len=0 MSS=1460 SACK_PERM TSval=2449757737 TSecr=0 WS=512"
"61","5.568522392","10.0.0.7","10.0.0.1","TCP","74","5201  >  52894 [SYN, ACK] Seq=0 Ack=1 Win=43440 Len=0 MSS=1460 SACK_PERM TSval=2177872060 TSecr=2449757737 WS=512"
"62","5.568528659","10.0.0.1","10.0.0.7","TCP","66","52894  >  5201 [ACK] Seq=1 Ack=1 Win=42496 Len=0 TSval=2449757737 TSecr=2177872060"
"63","5.568541847","10.0.0.1","10.0.0.7","iPerf3","103","52894  >  5201 Cookie: ""fe465yrq64exbucu5zzdxqomtpxhdkq6b3dv"""
"64","5.568550456","10.0.0.7","10.0.0.1","TCP","66","5201  >  52894 [ACK] Seq=1 Ack=38 Win=43520 Len=0 TSval=2177872060 TSecr=2449757737"
"65","5.569356067","10.0.0.1","10.0.0.7","TCP","74","52904  >  5201 [SYN] Seq=0 Win=42340 Len=0 MSS=1460 SACK_PERM TSval=2449757738 TSecr=0 WS=512"
"66","5.594371704","10.0.0.7","10.0.0.1","TCP","74","5201  >  52904 [SYN, ACK] Seq=0 Ack=1 Win=43440 Len=0 MSS=1460 SACK_PERM TSval=2177872086 TSecr=2449757738 WS=512"
"67","5.594385497","10.0.0.1","10.0.0.7","TCP","66","52904  >  5201 [ACK] Seq=1 Ack=1 Win=42496 Len=0 TSval=2449757763 TSecr=2177872086"
"68","5.594405306","10.0.0.1","10.0.0.7","iPerf3","103","52904  >  5201 Cookie: ""fe465yrq64exbucu5zzdxqomtpxhdkq6b3dv"""
"69","5.594913741","10.0.0.1","10.0.0.7","TCP","74","52916  >  5201 [SYN] Seq=0 Win=42340 Len=0 MSS=1460 SACK_PERM TSval=2449757764 TSecr=0 WS=512"
"70","5.602731921","10.0.0.1","10.0.0.7","TCP","66","52814  >  5201 [ACK] Seq=208 Ack=3 Win=42496 Len=0 TSval=2449757772 TSecr=2177872053"
"71","5.636289161","10.0.0.7","10.0.0.1","TCP","66","5201  >  52904 [ACK] Seq=1 Ack=38 Win=43520 Len=0 TSval=2177872128 TSecr=2449757763"
"72","5.636313910","10.0.0.7","10.0.0.1","TCP","74","5201  >  52916 [SYN, ACK] Seq=0 Ack=1 Win=43440 Len=0 MSS=1460 SACK_PERM TSval=2177872128 TSecr=2449757764 WS=512"
"73","5.636320411","10.0.0.1","10.0.0.7","TCP","66","52916  >  5201 [ACK] Seq=1 Ack=1 Win=42496 Len=0 TSval=2449757805 TSecr=2177872128"
"74","5.636331446","10.0.0.1","10.0.0.7","iPerf3","103","52916  >  5201 Cookie: ""fe465yrq64exbucu5zzdxqomtpxhdkq6b3dv"""
"75","5.710245666","10.0.0.7","10.0.0.1","TCP","66","5201  >  52916 [ACK] Seq=1 Ack=38 Win=43520 Len=0 TSval=2177872202 TSecr=2449757805"
"76","5.710892052","10.0.0.7","10.0.0.1","iPerf3","67","5201  >  52814 TEST_START(1)"
"77","5.710907975","10.0.0.1","10.0.0.7","TCP","66","52814  >  5201 [ACK] Seq=208 Ack=4 Win=42496 Len=0 TSval=2449757880 TSecr=2177872203"
"78","5.710920448","10.0.0.7","10.0.0.1","iPerf3","67","5201  >  52814 TEST_RUNNING(2)"
"79","5.710923366","10.0.0.1","10.0.0.7","TCP","66","52814  >  5201 [ACK] Seq=208 Ack=5 Win=42496 Len=0 TSval=2449757880 TSecr=2177872203"
"80","5.711217703","10.0.0.1","10.0.0.7","TCP","7306","52818  >  5201 [PSH, ACK] Seq=38 Ack=1 Win=42496 Len=7240 TSval=2449757880 TSecr=2177872053"
"81","5.711232561","10.0.0.1","10.0.0.7","TCP","7306","52818  >  5201 [PSH, ACK] Seq=7278 Ack=1 Win=42496 Len=7240 TSval=2449757880 TSecr=2177872053"
"82","5.711287630","10.0.0.1","10.0.0.7","TCP","7306","52836  >  5201 [PSH, ACK] Seq=38 Ack=1 Win=42496 Len=7240 TSval=2449757880 TSecr=2177872056"
"83","5.711292700","10.0.0.1","10.0.0.7","TCP","7306","52836  >  5201 [PSH, ACK] Seq=7278 Ack=1 Win=42496 Len=7240 TSval=2449757880 TSecr=2177872056"
"84","5.711332996","10.0.0.1","10.0.0.7","TCP","7306","52834  >  5201 [PSH, ACK] Seq=38 Ack=1 Win=42496 Len=7240 TSval=2449757880 TSecr=2177872055"
"85","5.711337867","10.0.0.1","10.0.0.7","TCP","7306","52834  >  5201 [PSH, ACK] Seq=7278 Ack=1 Win=42496 Len=7240 TSval=2449757880 TSecr=2177872055"
"86","5.711376148","10.0.0.1","10.0.0.7","TCP","7306","52860  >  5201 [PSH, ACK] Seq=38 Ack=1 Win=42496 Len=7240 TSval=2449757880 TSecr=2177872059"
"87","5.711380225","10.0.0.1","10.0.0.7","TCP","7306","52860  >  5201 [PSH, ACK] Seq=7278 Ack=1 Win=42496 Len=7240 TSval=2449757880 TSecr=2177872059"
"88","5.711397750","10.0.0.1","10.0.0.7","TCP","7306","52868  >  5201 [PSH, ACK] Seq=38 Ack=1 Win=42496 Len=7240 TSval=2449757880 TSecr=2177872059"
"89","5.711405192","10.0.0.1","10.0.0.7","TCP","7306","52868  >  5201 [PSH, ACK] Seq=7278 Ack=1 Win=42496 Len=7240 TSval=2449757880 TSecr=2177872059"
"90","5.711440098","10.0.0.1","10.0.0.7","TCP","7306","52880  >  5201 [PSH, ACK] Seq=38 Ack=1 Win=42496 Len=7240 TSval=2449757880 TSecr=2177872060"
"91","5.711444080","10.0.0.1","10.0.0.7","TCP","7306","52880  >  5201 [PSH, ACK] Seq=7278 Ack=1 Win=42496 Len=7240 TSval=2449757880 TSecr=2177872060"
"92","5.711488883","10.0.0.1","10.0.0.7","TCP","2962","52916  >  5201 [PSH, ACK] Seq=38 Ack=1 Win=42496 Len=2896 TSval=2449757880 TSecr=2177872202"
"93","5.711492738","10.0.0.1","10.0.0.7","TCP","2962","52916  >  5201 [PSH, ACK] Seq=2934 Ack=1 Win=42496 Len=2896 TSval=2449757880 TSecr=2177872202"
"94","5.711745382","10.0.0.1","10.0.0.7","TCP","7306","52850  >  5201 [PSH, ACK] Seq=38 Ack=1 Win=42496 Len=7240 TSval=2449757881 TSecr=2177872057"
"95","5.711750814","10.0.0.1","10.0.0.7","TCP","7306","52850  >  5201 [PSH, ACK] Seq=7278 Ack=1 Win=42496 Len=7240 TSval=2449757881 TSecr=2177872057"
"96","5.711759705","10.0.0.1","10.0.0.7","TCP","2962","52904  >  5201 [PSH, ACK] Seq=38 Ack=1 Win=42496 Len=2896 TSval=2449757881 TSecr=2177872128"
"97","5.711770705","10.0.0.1","10.0.0.7","TCP","2962","52904  >  5201 [PSH, ACK] Seq=2934 Ack=1 Win=42496 Len=2896 TSval=2449757881 TSecr=2177872128"
"98","5.712355418","10.0.0.1","10.0.0.7","TCP","7306","52894  >  5201 [PSH, ACK] Seq=38 Ack=1 Win=42496 Len=7240 TSval=2449757881 TSecr=2177872060"
"99","5.712359420","10.0.0.1","10.0.0.7","TCP","7306","52894  >  5201 [PSH, ACK] Seq=7278 Ack=1 Win=42496 Len=7240 TSval=2449757881 TSecr=2177872060"
"100","5.714736522","10.0.0.1","10.0.0.7","TCP","1514","52880  >  5201 [ACK] Seq=14518 Ack=1 Win=42496 Len=1448 TSval=2449757884 TSecr=2177872060"
"101","5.714741575","10.0.0.1","10.0.0.7","TCP","1514","52868  >  5201 [ACK] Seq=14518 Ack=1 Win=42496 Len=1448 TSval=2449757884 TSecr=2177872059"
"102","5.714741895","10.0.0.1","10.0.0.7","TCP","1514","52860  >  5201 [ACK] Seq=14518 Ack=1 Win=42496 Len=1448 TSval=2449757884 TSecr=2177872059"
"103","5.714742859","10.0.0.1","10.0.0.7","TCP","1514","52834  >  5201 [ACK] Seq=14518 Ack=1 Win=42496 Len=1448 TSval=2449757884 TSecr=2177872055"
"104","5.714743556","10.0.0.1","10.0.0.7","TCP","1514","52836  >  5201 [ACK] Seq=14518 Ack=1 Win=42496 Len=1448 TSval=2449757884 TSecr=2177872056"
"105","5.714744269","10.0.0.1","10.0.0.7","TCP","1514","52818  >  5201 [ACK] Seq=14518 Ack=1 Win=42496 Len=1448 TSval=2449757884 TSecr=2177872053"
"106","5.715729690","10.0.0.1","10.0.0.7","TCP","1514","52894  >  5201 [ACK] Seq=14518 Ack=1 Win=42496 Len=1448 TSval=2449757885 TSecr=2177872060"
"107","5.715730403","10.0.0.1","10.0.0.7","TCP","1514","52850  >  5201 [ACK] Seq=14518 Ack=1 Win=42496 Len=1448 TSval=2449757885 TSecr=2177872057"
"108","5.735736112","10.0.0.7","10.0.0.1","TCP","67","[TCP Keep-Alive] 5201  >  52814 [PSH, ACK] Seq=4 Ack=208 Win=43520 Len=1 TSval=2177872228 TSecr=2449757772"
"109","5.735744978","10.0.0.1","10.0.0.7","TCP","78","[TCP Keep-Alive ACK] 52814  >  5201 [ACK] Seq=208 Ack=5 Win=42496 Len=0 TSval=2449757905 TSecr=2177872228 SLE=4 SRE=5"
"110","5.847410421","10.0.0.7","10.0.0.1","TCP","66","5201  >  52818 [ACK] Seq=1 Ack=7278 Win=56832 Len=0 TSval=2177872339 TSecr=2449757880"
"111","5.847433530","10.0.0.1","10.0.0.7","TCP","10202","52818  >  5201 [PSH, ACK] Seq=15966 Ack=1 Win=42496 Len=10136 TSval=2449758016 TSecr=2177872339"
"112","5.859508893","10.0.0.7","10.0.0.1","TCP","66","5201  >  52818 [ACK] Seq=1 Ack=14518 Win=70656 Len=0 TSval=2177872351 TSecr=2449757880"
"113","5.859517024","10.0.0.1","10.0.0.7","TCP","10202","52818  >  5201 [PSH, ACK] Seq=26102 Ack=1 Win=42496 Len=10136 TSval=2449758028 TSecr=2177872351"
"114","5.860719607","10.0.0.7","10.0.0.1","TCP","66","5201  >  52836 [ACK] Seq=1 Ack=7278 Win=56832 Len=0 TSval=2177872352 TSecr=2449757880"
"115","5.860731454","10.0.0.1","10.0.0.7","TCP","10202","52836  >  5201 [PSH, ACK] Seq=15966 Ack=1 Win=42496 Len=10136 TSval=2449758030 TSecr=2177872352"
"116","5.861931175","10.0.0.7","10.0.0.1","TCP","66","5201  >  52836 [ACK] Seq=1 Ack=14518 Win=70656 Len=0 TSval=2177872354 TSecr=2449757880"
"117","5.861938620","10.0.0.1","10.0.0.7","TCP","10202","52836  >  5201 [PSH, ACK] Seq=26102 Ack=1 Win=42496 Len=10136 TSval=2449758031 TSecr=2177872354"
"118","5.863144093","10.0.0.7","10.0.0.1","TCP","66","5201  >  52834 [ACK] Seq=1 Ack=7278 Win=56832 Len=0 TSval=2177872355 TSecr=2449757880"
"119","5.863152154","10.0.0.1","10.0.0.7","TCP","10202","52834  >  5201 [PSH, ACK] Seq=15966 Ack=1 Win=42496 Len=10136 TSval=2449758032 TSecr=2177872355"
"120","5.864352845","10.0.0.7","10.0.0.1","TCP","66","5201  >  52834 [ACK] Seq=1 Ack=14518 Win=70656 Len=0 TSval=2177872356 TSecr=2449757880"
"121","5.864360407","10.0.0.1","10.0.0.7","TCP","10202","52834  >  5201 [PSH, ACK] Seq=26102 Ack=1 Win=42496 Len=10136 TSval=2449758033 TSecr=2177872356"
"122","5.865564827","10.0.0.7","10.0.0.1","TCP","66","5201  >  52860 [ACK] Seq=1 Ack=7278 Win=56832 Len=0 TSval=2177872357 TSecr=2449757880"
"123","5.865571874","10.0.0.1","10.0.0.7","TCP","10202","52860  >  5201 [PSH, ACK] Seq=15966 Ack=1 Win=42496 Len=10136 TSval=2449758034 TSecr=2177872357"
"124","5.866773767","10.0.0.7","10.0.0.1","TCP","66","5201  >  52860 [ACK] Seq=1 Ack=14518 Win=70656 Len=0 TSval=2177872359 TSecr=2449757880"
"125","5.866780466","10.0.0.1","10.0.0.7","TCP","10202","52860  >  5201 [PSH, ACK] Seq=26102 Ack=1 Win=42496 Len=10136 TSval=2449758036 TSecr=2177872359"
"126","5.867987377","10.0.0.7","10.0.0.1","TCP","66","5201  >  52868 [ACK] Seq=1 Ack=7278 Win=56832 Len=0 TSval=2177872360 TSecr=2449757880"
"127","5.867995071","10.0.0.1","10.0.0.7","TCP","10202","52868  >  5201 [PSH, ACK] Seq=15966 Ack=1 Win=42496 Len=10136 TSval=2449758037 TSecr=2177872360"
"128","5.880099315","10.0.0.7","10.0.0.1","TCP","66","5201  >  52868 [ACK] Seq=1 Ack=14518 Win=70656 Len=0 TSval=2177872372 TSecr=2449757880"
"129","5.880106676","10.0.0.1","10.0.0.7","TCP","10202","52868  >  5201 [PSH, ACK] Seq=26102 Ack=1 Win=42496 Len=10136 TSval=2449758049 TSecr=2177872372"
"130","5.881310897","10.0.0.7","10.0.0.1","TCP","66","5201  >  52880 [ACK] Seq=1 Ack=7278 Win=56832 Len=0 TSval=2177872373 TSecr=2449757880"
"131","5.881318103","10.0.0.1","10.0.0.7","TCP","10202","52880  >  5201 [PSH, ACK] Seq=15966 Ack=1 Win=42496 Len=10136 TSval=2449758050 TSecr=2177872373"
"132","5.882519552","10.0.0.7","10.0.0.1","TCP","66","5201  >  52880 [ACK] Seq=1 Ack=14518 Win=70656 Len=0 TSval=2177872374 TSecr=2449757880"
"133","5.882527964","10.0.0.1","10.0.0.7","TCP","10202","52880  >  5201 [PSH, ACK] Seq=26102 Ack=1 Win=42496 Len=10136 TSval=2449758051 TSecr=2177872374"
"134","5.883753903","10.0.0.7","10.0.0.1","TCP","66","5201  >  52916 [ACK] Seq=1 Ack=2934 Win=48128 Len=0 TSval=2177872376 TSecr=2449757880"
"135","5.883765222","10.0.0.1","10.0.0.7","TCP","2962","52916  >  5201 [PSH, ACK] Seq=5830 Ack=1 Win=42496 Len=2896 TSval=2449758053 TSecr=2177872376"
"136","5.884223968","10.0.0.7","10.0.0.1","TCP","66","5201  >  52916 [ACK] Seq=1 Ack=5830 Win=54272 Len=0 TSval=2177872376 TSecr=2449757880"
"137","5.884231483","10.0.0.1","10.0.0.7","TCP","2962","52916  >  5201 [PSH, ACK] Seq=8726 Ack=1 Win=42496 Len=2896 TSval=2449758053 TSecr=2177872376"
"138","5.884715202","10.0.0.7","10.0.0.1","TCP","66","5201  >  52850 [ACK] Seq=1 Ack=7278 Win=56832 Len=0 TSval=2177872376 TSecr=2449757881"
"139","5.884733698","10.0.0.1","10.0.0.7","TCP","10202","52850  >  5201 [PSH, ACK] Seq=15966 Ack=1 Win=42496 Len=10136 TSval=2449758054 TSecr=2177872376"
"140","5.885925413","10.0.0.7","10.0.0.1","TCP","66","5201  >  52850 [ACK] Seq=1 Ack=14518 Win=70656 Len=0 TSval=2177872378 TSecr=2449757881"
"141","5.885937402","10.0.0.1","10.0.0.7","TCP","10202","52850  >  5201 [PSH, ACK] Seq=26102 Ack=1 Win=42496 Len=10136 TSval=2449758055 TSecr=2177872378"
"142","5.887136086","10.0.0.7","10.0.0.1","TCP","66","5201  >  52904 [ACK] Seq=1 Ack=2934 Win=48128 Len=0 TSval=2177872379 TSecr=2449757881"
"143","5.887146062","10.0.0.1","10.0.0.7","TCP","2962","52904  >  5201 [PSH, ACK] Seq=5830 Ack=1 Win=42496 Len=2896 TSval=2449758056 TSecr=2177872379"
"144","5.887614105","10.0.0.7","10.0.0.1","TCP","66","5201  >  52904 [ACK] Seq=1 Ack=5830 Win=54272 Len=0 TSval=2177872379 TSecr=2449757881"
"145","5.887621696","10.0.0.1","10.0.0.7","TCP","2962","52904  >  5201 [PSH, ACK] Seq=8726 Ack=1 Win=42496 Len=2896 TSval=2449758056 TSecr=2177872379"
"146","5.888100611","10.0.0.7","10.0.0.1","TCP","66","5201  >  52894 [ACK] Seq=1 Ack=7278 Win=56832 Len=0 TSval=2177872380 TSecr=2449757881"
"147","5.888111687","10.0.0.1","10.0.0.7","TCP","10202","52894  >  5201 [PSH, ACK] Seq=15966 Ack=1 Win=42496 Len=10136 TSval=2449758057 TSecr=2177872380"
"148","5.889311685","10.0.0.7","10.0.0.1","TCP","66","5201  >  52894 [ACK] Seq=1 Ack=14518 Win=70656 Len=0 TSval=2177872381 TSecr=2449757881"
"149","5.889322490","10.0.0.1","10.0.0.7","TCP","10202","52894  >  5201 [PSH, ACK] Seq=26102 Ack=1 Win=42496 Len=10136 TSval=2449758058 TSecr=2177872381"
"150","5.901429608","10.0.0.7","10.0.0.1","TCP","66","5201  >  52880 [ACK] Seq=1 Ack=15966 Win=73216 Len=0 TSval=2177872393 TSecr=2449757884"
"151","5.901656160","10.0.0.7","10.0.0.1","TCP","66","5201  >  52868 [ACK] Seq=1 Ack=15966 Win=73216 Len=0 TSval=2177872393 TSecr=2449757884"
"152","5.901898294","10.0.0.7","10.0.0.1","TCP","66","5201  >  52860 [ACK] Seq=1 Ack=15966 Win=73216 Len=0 TSval=2177872394 TSecr=2449757884"
"153","5.902140405","10.0.0.7","10.0.0.1","TCP","66","5201  >  52834 [ACK] Seq=1 Ack=15966 Win=73216 Len=0 TSval=2177872394 TSecr=2449757884"
"154","5.902383597","10.0.0.7","10.0.0.1","TCP","66","5201  >  52836 [ACK] Seq=1 Ack=15966 Win=73216 Len=0 TSval=2177872394 TSecr=2449757884"
"155","5.902624235","10.0.0.7","10.0.0.1","TCP","66","5201  >  52818 [ACK] Seq=1 Ack=15966 Win=73216 Len=0 TSval=2177872394 TSecr=2449757884"
"156","5.902867825","10.0.0.7","10.0.0.1","TCP","66","5201  >  52894 [ACK] Seq=1 Ack=15966 Win=73216 Len=0 TSval=2177872395 TSecr=2449757885"
"157","5.903108450","10.0.0.7","10.0.0.1","TCP","66","5201  >  52850 [ACK] Seq=1 Ack=15966 Win=73216 Len=0 TSval=2177872395 TSecr=2449757885"
"158","6.085462947","10.0.0.7","10.0.0.1","TCP","66","5201  >  52818 [ACK] Seq=1 Ack=26102 Win=68096 Len=0 TSval=2177872577 TSecr=2449758016"
"159","6.085476905","10.0.0.1","10.0.0.7","TCP","10202","52818  >  5201 [PSH, ACK] Seq=36238 Ack=1 Win=42496 Len=10136 TSval=2449758254 TSecr=2177872577"
"160","6.085481641","10.0.0.1","10.0.0.7","TCP","11650","52818  >  5201 [PSH, ACK] Seq=46374 Ack=1 Win=42496 Len=11584 TSval=2449758254 TSecr=2177872577"
"161","6.096360970","10.0.0.7","10.0.0.1","TCP","66","5201  >  52818 [ACK] Seq=1 Ack=36238 Win=93696 Len=0 TSval=2177872588 TSecr=2449758028"
"162","6.096373317","10.0.0.1","10.0.0.7","TCP","21786","52818  >  5201 [PSH, ACK] Seq=57958 Ack=1 Win=42496 Len=21720 TSval=2449758265 TSecr=2177872588"
"163","6.098057854","10.0.0.7","10.0.0.1","TCP","66","5201  >  52836 [ACK] Seq=1 Ack=26102 Win=68096 Len=0 TSval=2177872590 TSecr=2449758030"
"164","6.098066340","10.0.0.1","10.0.0.7","TCP","10202","52836  >  5201 [PSH, ACK] Seq=36238 Ack=1 Win=42496 Len=10136 TSval=2449758267 TSecr=2177872590"
"165","6.098069177","10.0.0.1","10.0.0.7","TCP","11650","52836  >  5201 [PSH, ACK] Seq=46374 Ack=1 Win=42496 Len=11584 TSval=2449758267 TSecr=2177872590"
"166","6.099748732","10.0.0.7","10.0.0.1","TCP","66","5201  >  52836 [ACK] Seq=1 Ack=36238 Win=58880 Len=0 TSval=2177872592 TSecr=2449758031"
"167","6.099758870","10.0.0.1","10.0.0.7","TCP","21786","52836  >  5201 [PSH, ACK] Seq=57958 Ack=1 Win=42496 Len=21720 TSval=2449758269 TSecr=2177872592"
"168","6.101446782","10.0.0.7","10.0.0.1","TCP","66","5201  >  52834 [ACK] Seq=1 Ack=26102 Win=68096 Len=0 TSval=2177872593 TSecr=2449758032"
"169","6.101454711","10.0.0.1","10.0.0.7","TCP","10202","52834  >  5201 [PSH, ACK] Seq=36238 Ack=1 Win=42496 Len=10136 TSval=2449758270 TSecr=2177872593"
"170","6.101457558","10.0.0.1","10.0.0.7","TCP","11650","52834  >  5201 [PSH, ACK] Seq=46374 Ack=1 Win=42496 Len=11584 TSval=2449758270 TSecr=2177872593"
"171","6.103139408","10.0.0.7","10.0.0.1","TCP","66","5201  >  52834 [ACK] Seq=1 Ack=36238 Win=68096 Len=0 TSval=2177872595 TSecr=2449758033"
"172","6.103148918","10.0.0.1","10.0.0.7","TCP","21786","52834  >  5201 [PSH, ACK] Seq=57958 Ack=1 Win=42496 Len=21720 TSval=2449758272 TSecr=2177872595"
"173","6.104837564","10.0.0.7","10.0.0.1","TCP","66","5201  >  52860 [ACK] Seq=1 Ack=26102 Win=68096 Len=0 TSval=2177872597 TSecr=2449758034"
"174","6.104845021","10.0.0.1","10.0.0.7","TCP","10202","52860  >  5201 [PSH, ACK] Seq=36238 Ack=1 Win=42496 Len=10136 TSval=2449758274 TSecr=2177872597"
"175","6.104848333","10.0.0.1","10.0.0.7","TCP","11650","52860  >  5201 [PSH, ACK] Seq=46374 Ack=1 Win=42496 Len=11584 TSval=2449758274 TSecr=2177872597"
"176","6.106529906","10.0.0.7","10.0.0.1","TCP","66","5201  >  52860 [ACK] Seq=1 Ack=36238 Win=68096 Len=0 TSval=2177872598 TSecr=2449758036"
"177","6.106538887","10.0.0.1","10.0.0.7","TCP","21786","52860  >  5201 [PSH, ACK] Seq=57958 Ack=1 Win=42496 Len=21720 TSval=2449758275 TSecr=2177872598"
"178","6.108228543","10.0.0.7","10.0.0.1","TCP","66","5201  >  52868 [ACK] Seq=1 Ack=26102 Win=68096 Len=0 TSval=2177872600 TSecr=2449758037"
"179","6.108236525","10.0.0.1","10.0.0.7","TCP","10202","52868  >  5201 [PSH, ACK] Seq=36238 Ack=1 Win=42496 Len=10136 TSval=2449758277 TSecr=2177872600"
"180","6.108243360","10.0.0.1","10.0.0.7","TCP","11650","52868  >  5201 [PSH, ACK] Seq=46374 Ack=1 Win=42496 Len=11584 TSval=2449758277 TSecr=2177872600"
"181","6.120845900","10.0.0.7","10.0.0.1","TCP","66","5201  >  52868 [ACK] Seq=1 Ack=36238 Win=93696 Len=0 TSval=2177872613 TSecr=2449758049"
"182","6.120868730","10.0.0.1","10.0.0.7","TCP","21786","52868  >  5201 [PSH, ACK] Seq=57958 Ack=1 Win=42496 Len=21720 TSval=2449758290 TSecr=2177872613"
"183","6.122529941","10.0.0.7","10.0.0.1","TCP","66","5201  >  52880 [ACK] Seq=1 Ack=26102 Win=68096 Len=0 TSval=2177872614 TSecr=2449758050"
"184","6.122539782","10.0.0.1","10.0.0.7","TCP","7306","52880  >  5201 [PSH, ACK] Seq=36238 Ack=1 Win=42496 Len=7240 TSval=2449758291 TSecr=2177872614"
"185","6.122543544","10.0.0.1","10.0.0.7","TCP","14546","52880  >  5201 [PSH, ACK] Seq=43478 Ack=1 Win=42496 Len=14480 TSval=2449758291 TSecr=2177872614"
"186","6.124219366","10.0.0.7","10.0.0.1","TCP","66","5201  >  52880 [ACK] Seq=1 Ack=36238 Win=93696 Len=0 TSval=2177872616 TSecr=2449758051"
"187","6.124234272","10.0.0.1","10.0.0.7","TCP","21786","52880  >  5201 [PSH, ACK] Seq=57958 Ack=1 Win=42496 Len=21720 TSval=2449758293 TSecr=2177872616"
"188","6.125921582","10.0.0.7","10.0.0.1","TCP","66","5201  >  52916 [ACK] Seq=1 Ack=8726 Win=59904 Len=0 TSval=2177872618 TSecr=2449758053"
"189","6.125933556","10.0.0.1","10.0.0.7","TCP","2962","52916  >  5201 [PSH, ACK] Seq=11622 Ack=1 Win=42496 Len=2896 TSval=2449758295 TSecr=2177872618"
"190","6.126546453","10.0.0.7","10.0.0.1","TCP","66","5201  >  52916 [ACK] Seq=1 Ack=11622 Win=61952 Len=0 TSval=2177872618 TSecr=2449758053"
"191","6.126552237","10.0.0.1","10.0.0.7","TCP","2962","52916  >  5201 [PSH, ACK] Seq=14518 Ack=1 Win=42496 Len=2896 TSval=2449758295 TSecr=2177872618"
"192","6.126881761","10.0.0.7","10.0.0.1","TCP","66","5201  >  52850 [ACK] Seq=1 Ack=26102 Win=68096 Len=0 TSval=2177872619 TSecr=2449758054"
"193","6.126889163","10.0.0.1","10.0.0.7","TCP","10202","52850  >  5201 [PSH, ACK] Seq=36238 Ack=1 Win=42496 Len=10136 TSval=2449758296 TSecr=2177872619"
"194","6.126892251","10.0.0.1","10.0.0.7","TCP","11650","52850  >  5201 [PSH, ACK] Seq=46374 Ack=1 Win=42496 Len=11584 TSval=2449758296 TSecr=2177872619"
"195","6.128576378","10.0.0.7","10.0.0.1","TCP","66","5201  >  52850 [ACK] Seq=1 Ack=36238 Win=93696 Len=0 TSval=2177872620 TSecr=2449758055"
"196","6.128586494","10.0.0.1","10.0.0.7","TCP","21786","52850  >  5201 [PSH, ACK] Seq=57958 Ack=1 Win=42496 Len=21720 TSval=2449758297 TSecr=2177872620"
"197","6.130273188","10.0.0.7","10.0.0.1","TCP","66","5201  >  52904 [ACK] Seq=1 Ack=8726 Win=59904 Len=0 TSval=2177872622 TSecr=2449758056"
"198","6.130278920","10.0.0.1","10.0.0.7","TCP","2962","52904  >  5201 [PSH, ACK] Seq=11622 Ack=1 Win=42496 Len=2896 TSval=2449758299 TSecr=2177872622"
"199","6.130754802","10.0.0.7","10.0.0.1","TCP","66","5201  >  52904 [ACK] Seq=1 Ack=11622 Win=64000 Len=0 TSval=2177872623 TSecr=2449758056"
"200","6.130759527","10.0.0.1","10.0.0.7","TCP","2962","52904  >  5201 [PSH, ACK] Seq=14518 Ack=1 Win=42496 Len=2896 TSval=2449758300 TSecr=2177872623"
"201","6.131242452","10.0.0.7","10.0.0.1","TCP","66","5201  >  52894 [ACK] Seq=1 Ack=26102 Win=68096 Len=0 TSval=2177872623 TSecr=2449758057"
"202","6.131249758","10.0.0.1","10.0.0.7","TCP","10202","52894  >  5201 [PSH, ACK] Seq=36238 Ack=1 Win=42496 Len=10136 TSval=2449758300 TSecr=2177872623"
"203","6.131252710","10.0.0.1","10.0.0.7","TCP","11650","52894  >  5201 [PSH, ACK] Seq=46374 Ack=1 Win=42496 Len=11584 TSval=2449758300 TSecr=2177872623"
"204","6.132933619","10.0.0.7","10.0.0.1","TCP","66","5201  >  52894 [ACK] Seq=1 Ack=36238 Win=58880 Len=0 TSval=2177872625 TSecr=2449758058"
"205","6.132942924","10.0.0.1","10.0.0.7","TCP","21786","52894  >  5201 [PSH, ACK] Seq=57958 Ack=1 Win=42496 Len=21720 TSval=2449758302 TSecr=2177872625"
"206","6.335603408","10.0.0.7","10.0.0.1","TCP","66","5201  >  52818 [ACK] Seq=1 Ack=46374 Win=114176 Len=0 TSval=2177872827 TSecr=2449758254"
"207","6.337289185","10.0.0.7","10.0.0.1","TCP","66","5201  >  52818 [ACK] Seq=1 Ack=57958 Win=137216 Len=0 TSval=2177872829 TSecr=2449758254"
"208","6.337301241","10.0.0.1","10.0.0.7","TCP","7306","52818  >  5201 [PSH, ACK] Seq=79678 Ack=1 Win=42496 Len=7240 TSval=2449758506 TSecr=2177872829"
"209","6.337309635","10.0.0.1","10.0.0.7","TCP","27578","52818  >  5201 [PSH, ACK] Seq=86918 Ack=1 Win=42496 Len=27512 TSval=2449758506 TSecr=2177872829"
"210","6.350131120","10.0.0.7","10.0.0.1","TCP","66","5201  >  52818 [ACK] Seq=1 Ack=79678 Win=174080 Len=0 TSval=2177872842 TSecr=2449758265"
"211","6.350142128","10.0.0.1","10.0.0.7","TCP","34818","52818  >  5201 [PSH, ACK] Seq=114430 Ack=1 Win=42496 Len=34752 TSval=2449758519 TSecr=2177872842"
"212","6.353772435","10.0.0.7","10.0.0.1","TCP","66","5201  >  52836 [ACK] Seq=1 Ack=46374 Win=93696 Len=0 TSval=2177872846 TSecr=2449758267"
"213","6.355475684","10.0.0.7","10.0.0.1","TCP","66","5201  >  52836 [ACK] Seq=1 Ack=57958 Win=116736 Len=0 TSval=2177872847 TSecr=2449758267"
"214","6.355483721","10.0.0.1","10.0.0.7","TCP","7306","52836  >  5201 [PSH, ACK] Seq=79678 Ack=1 Win=42496 Len=7240 TSval=2449758524 TSecr=2177872847"
"215","6.355491527","10.0.0.1","10.0.0.7","TCP","27578","52836  >  5201 [PSH, ACK] Seq=86918 Ack=1 Win=42496 Len=27512 TSval=2449758524 TSecr=2177872847"
"216","6.357401864","10.0.0.7","10.0.0.1","TCP","66","5201  >  52836 [ACK] Seq=1 Ack=79678 Win=160256 Len=0 TSval=2177872849 TSecr=2449758269"
"217","6.357419221","10.0.0.1","10.0.0.7","TCP","34818","52836  >  5201 [PSH, ACK] Seq=114430 Ack=1 Win=42496 Len=34752 TSval=2449758526 TSecr=2177872849"
"218","6.361031868","10.0.0.7","10.0.0.1","TCP","66","5201  >  52834 [ACK] Seq=1 Ack=46374 Win=68096 Len=0 TSval=2177872853 TSecr=2449758270"
"219","6.362728084","10.0.0.7","10.0.0.1","TCP","66","5201  >  52834 [ACK] Seq=1 Ack=57958 Win=57856 Len=0 TSval=2177872854 TSecr=2449758270"
"220","6.362735516","10.0.0.1","10.0.0.7","TCP","7306","52834  >  5201 [PSH, ACK] Seq=79678 Ack=1 Win=42496 Len=7240 TSval=2449758532 TSecr=2177872854"
"221","6.362739800","10.0.0.1","10.0.0.7","TCP","27578","52834  >  5201 [PSH, ACK] Seq=86918 Ack=1 Win=42496 Len=27512 TSval=2449758532 TSecr=2177872854"
"222","6.364664866","10.0.0.7","10.0.0.1","TCP","66","5201  >  52834 [ACK] Seq=1 Ack=79678 Win=116736 Len=0 TSval=2177872856 TSecr=2449758272"
"223","6.364689862","10.0.0.1","10.0.0.7","TCP","34818","52834  >  5201 [PSH, ACK] Seq=114430 Ack=1 Win=42496 Len=34752 TSval=2449758533 TSecr=2177872856"
"224","6.368308686","10.0.0.7","10.0.0.1","TCP","66","5201  >  52860 [ACK] Seq=1 Ack=46374 Win=68096 Len=0 TSval=2177872860 TSecr=2449758274"
"225","6.369992848","10.0.0.7","10.0.0.1","TCP","66","5201  >  52860 [ACK] Seq=1 Ack=57958 Win=96768 Len=0 TSval=2177872862 TSecr=2449758274"
"226","6.370003651","10.0.0.1","10.0.0.7","TCP","7306","52860  >  5201 [PSH, ACK] Seq=79678 Ack=1 Win=42496 Len=7240 TSval=2449758539 TSecr=2177872862"
"227","6.370012748","10.0.0.1","10.0.0.7","TCP","27578","52860  >  5201 [PSH, ACK] Seq=86918 Ack=1 Win=42496 Len=27512 TSval=2449758539 TSecr=2177872862"
"228","6.371927878","10.0.0.7","10.0.0.1","TCP","66","5201  >  52860 [ACK] Seq=1 Ack=79678 Win=139776 Len=0 TSval=2177872864 TSecr=2449758275"
"229","6.371945733","10.0.0.1","10.0.0.7","TCP","34818","52860  >  5201 [PSH, ACK] Seq=114430 Ack=1 Win=42496 Len=34752 TSval=2449758541 TSecr=2177872864"
"230","6.375564622","10.0.0.7","10.0.0.1","TCP","66","5201  >  52868 [ACK] Seq=1 Ack=46374 Win=114176 Len=0 TSval=2177872867 TSecr=2449758277"
"231","6.377259047","10.0.0.7","10.0.0.1","TCP","66","5201  >  52868 [ACK] Seq=1 Ack=57958 Win=137216 Len=0 TSval=2177872869 TSecr=2449758277"
"232","6.377267149","10.0.0.1","10.0.0.7","TCP","7306","52868  >  5201 [PSH, ACK] Seq=79678 Ack=1 Win=42496 Len=7240 TSval=2449758546 TSecr=2177872869"
"233","6.377274952","10.0.0.1","10.0.0.7","TCP","27578","52868  >  5201 [PSH, ACK] Seq=86918 Ack=1 Win=42496 Len=27512 TSval=2449758546 TSecr=2177872869"
"234","6.390182725","10.0.0.7","10.0.0.1","TCP","66","5201  >  52868 [ACK] Seq=1 Ack=79678 Win=174080 Len=0 TSval=2177872882 TSecr=2449758290"
"235","6.390196442","10.0.0.1","10.0.0.7","TCP","34818","52868  >  5201 [PSH, ACK] Seq=114430 Ack=1 Win=42496 Len=34752 TSval=2449758559 TSecr=2177872882"
"236","6.393738412","10.0.0.7","10.0.0.1","TCP","66","5201  >  52880 [ACK] Seq=1 Ack=43478 Win=108032 Len=0 TSval=2177872886 TSecr=2449758291"
"237","6.394941314","10.0.0.7","10.0.0.1","TCP","66","5201  >  52880 [ACK] Seq=1 Ack=57958 Win=137216 Len=0 TSval=2177872887 TSecr=2449758291"
"238","6.394948640","10.0.0.1","10.0.0.7","TCP","7306","52880  >  5201 [PSH, ACK] Seq=79678 Ack=1 Win=42496 Len=7240 TSval=2449758564 TSecr=2177872887"
"239","6.394955171","10.0.0.1","10.0.0.7","TCP","27578","52880  >  5201 [PSH, ACK] Seq=86918 Ack=1 Win=42496 Len=27512 TSval=2449758564 TSecr=2177872887"
"240","6.397364643","10.0.0.7","10.0.0.1","TCP","66","5201  >  52880 [ACK] Seq=1 Ack=79678 Win=174080 Len=0 TSval=2177872889 TSecr=2449758293"
"241","6.397375538","10.0.0.1","10.0.0.7","TCP","34818","52880  >  5201 [PSH, ACK] Seq=114430 Ack=1 Win=42496 Len=34752 TSval=2449758566 TSecr=2177872889"
"242","6.400999538","10.0.0.7","10.0.0.1","TCP","66","5201  >  52916 [ACK] Seq=1 Ack=14518 Win=64000 Len=0 TSval=2177872893 TSecr=2449758295"
"243","6.401005425","10.0.0.1","10.0.0.7","TCP","2962","52916  >  5201 [PSH, ACK] Seq=17414 Ack=1 Win=42496 Len=2896 TSval=2449758570 TSecr=2177872893"
"244","6.401482787","10.0.0.7","10.0.0.1","TCP","66","5201  >  52916 [ACK] Seq=1 Ack=17414 Win=64000 Len=0 TSval=2177872893 TSecr=2449758295"
"245","6.401487808","10.0.0.1","10.0.0.7","TCP","2962","52916  >  5201 [PSH, ACK] Seq=20310 Ack=1 Win=42496 Len=2896 TSval=2449758570 TSecr=2177872893"
"246","6.401967918","10.0.0.7","10.0.0.1","TCP","66","5201  >  52850 [ACK] Seq=1 Ack=46374 Win=114176 Len=0 TSval=2177872894 TSecr=2449758296"
"247","6.403662453","10.0.0.7","10.0.0.1","TCP","66","5201  >  52850 [ACK] Seq=1 Ack=57958 Win=137216 Len=0 TSval=2177872895 TSecr=2449758296"
"248","6.403669329","10.0.0.1","10.0.0.7","TCP","7306","52850  >  5201 [PSH, ACK] Seq=79678 Ack=1 Win=42496 Len=7240 TSval=2449758572 TSecr=2177872895"
"249","6.403675853","10.0.0.1","10.0.0.7","TCP","27578","52850  >  5201 [PSH, ACK] Seq=86918 Ack=1 Win=42496 Len=27512 TSval=2449758572 TSecr=2177872895"
"250","6.405600528","10.0.0.7","10.0.0.1","TCP","66","5201  >  52850 [ACK] Seq=1 Ack=79678 Win=174080 Len=0 TSval=2177872897 TSecr=2449758297"
"251","6.405610172","10.0.0.1","10.0.0.7","TCP","34818","52850  >  5201 [PSH, ACK] Seq=114430 Ack=1 Win=42496 Len=34752 TSval=2449758574 TSecr=2177872897"
"252","6.409239192","10.0.0.7","10.0.0.1","TCP","66","5201  >  52904 [ACK] Seq=1 Ack=14518 Win=64000 Len=0 TSval=2177872901 TSecr=2449758299"
"253","6.409246492","10.0.0.1","10.0.0.7","TCP","2962","52904  >  5201 [PSH, ACK] Seq=17414 Ack=1 Win=42496 Len=2896 TSval=2449758578 TSecr=2177872901"
"254","6.409717100","10.0.0.7","10.0.0.1","TCP","66","5201  >  52904 [ACK] Seq=1 Ack=17414 Win=64000 Len=0 TSval=2177872901 TSecr=2449758300"
"255","6.409723755","10.0.0.1","10.0.0.7","TCP","2962","52904  >  5201 [PSH, ACK] Seq=20310 Ack=1 Win=42496 Len=2896 TSval=2449758578 TSecr=2177872901"
"256","6.410204538","10.0.0.7","10.0.0.1","TCP","66","5201  >  52894 [ACK] Seq=1 Ack=46374 Win=93696 Len=0 TSval=2177872902 TSecr=2449758300"
"257","6.411899359","10.0.0.7","10.0.0.1","TCP","66","5201  >  52894 [ACK] Seq=1 Ack=57958 Win=116736 Len=0 TSval=2177872904 TSecr=2449758300"
"258","6.411906696","10.0.0.1","10.0.0.7","TCP","7306","52894  >  5201 [PSH, ACK] Seq=79678 Ack=1 Win=42496 Len=7240 TSval=2449758581 TSecr=2177872904"
"259","6.411911723","10.0.0.1","10.0.0.7","TCP","27578","52894  >  5201 [PSH, ACK] Seq=86918 Ack=1 Win=42496 Len=27512 TSval=2449758581 TSecr=2177872904"
"260","6.413835241","10.0.0.7","10.0.0.1","TCP","66","5201  >  52894 [ACK] Seq=1 Ack=79678 Win=160256 Len=0 TSval=2177872906 TSecr=2449758302"
"261","6.413848156","10.0.0.1","10.0.0.7","TCP","34818","52894  >  5201 [PSH, ACK] Seq=114430 Ack=1 Win=42496 Len=34752 TSval=2449758583 TSecr=2177872906"
"262","6.613698537","10.0.0.7","10.0.0.1","TCP","66","5201  >  52818 [ACK] Seq=1 Ack=86918 Win=187392 Len=0 TSval=2177873105 TSecr=2449758506"
"263","6.614895827","10.0.0.7","10.0.0.1","TCP","66","5201  >  52818 [ACK] Seq=1 Ack=114430 Win=194560 Len=0 TSval=2177873107 TSecr=2449758506"
"264","6.614908332","10.0.0.1","10.0.0.7","TCP","24682","52818  >  5201 [PSH, ACK] Seq=149182 Ack=1 Win=42496 Len=24616 TSval=2449758784 TSecr=2177873107"
"265","6.630435160","10.0.0.7","10.0.0.1","TCP","66","5201  >  52818 [ACK] Seq=1 Ack=149182 Win=188416 Len=0 TSval=2177873122 TSecr=2449758519"
"266","6.630464928","10.0.0.1","10.0.0.7","TCP","21786","52818  >  5201 [PSH, ACK] Seq=173798 Ack=1 Win=42496 Len=21720 TSval=2449758799 TSecr=2177873122"
"267","6.630482908","10.0.0.1","10.0.0.7","TCP","46402","52818  >  5201 [PSH, ACK] Seq=195518 Ack=1 Win=42496 Len=46336 TSval=2449758799 TSecr=2177873122"
"268","6.636225411","10.0.0.7","10.0.0.1","TCP","66","5201  >  52836 [ACK] Seq=1 Ack=86918 Win=174592 Len=0 TSval=2177873128 TSecr=2449758524"
"269","6.637427118","10.0.0.7","10.0.0.1","TCP","66","5201  >  52836 [ACK] Seq=1 Ack=114430 Win=229888 Len=0 TSval=2177873129 TSecr=2449758524"
"270","6.637436384","10.0.0.1","10.0.0.7","TCP","24682","52836  >  5201 [PSH, ACK] Seq=149182 Ack=1 Win=42496 Len=24616 TSval=2449758806 TSecr=2177873129"
"271","6.642030899","10.0.0.7","10.0.0.1","TCP","66","5201  >  52836 [ACK] Seq=1 Ack=149182 Win=299520 Len=0 TSval=2177873134 TSecr=2449758526"
"272","6.642039137","10.0.0.1","10.0.0.7","TCP","11650","52836  >  5201 [PSH, ACK] Seq=173798 Ack=1 Win=42496 Len=11584 TSval=2449758811 TSecr=2177873134"
"273","6.642045193","10.0.0.1","10.0.0.7","TCP","36266","52836  >  5201 [PSH, ACK] Seq=185382 Ack=1 Win=42496 Len=36200 TSval=2449758811 TSecr=2177873134"
"274","6.647842260","10.0.0.7","10.0.0.1","TCP","66","5201  >  52834 [ACK] Seq=1 Ack=86918 Win=131584 Len=0 TSval=2177873140 TSecr=2449758532"
