"No.","Time","Source","Destination","Protocol","Length","Info"
"1","0.000000000","fe80::493f:17d2:bdb8:fde3","ff02::2","ICMPv6","62","Router Solicitation"
"2","0.184510907","fe80::10b6:3bff:fe95:46b4","ff02::2","ICMPv6","70","Router Solicitation from 12:b6:3b:95:46:b4"
"3","0.184847148","fe80::b872:9bff:fe67:161f","ff02::2","ICMPv6","70","Router Solicitation from ba:72:9b:67:16:1f"
"4","1.720224420","fe80::30db:daff:fed1:b0d2","ff02::2","ICMPv6","70","Router Solicitation from 32:db:da:d1:b0:d2"
"5","3.083348974","fe80::493f:17d2:bdb8:fde3","ff02::fb","MDNS","203","Standard query 0x0000 PTR _nfs._tcp.local, ""QM"" question PTR _ipp._tcp.local, ""QM"" question PTR _ipps._tcp.local, ""QM"" question PTR _ftp._tcp.local, ""QM"" question PTR _webdav._tcp.local, ""QM"" question PTR _webdavs._tcp.local, ""QM"" question PTR _sftp-ssh._tcp.local, ""QM"" question PTR _smb._tcp.local, ""QM"" question PTR _afpovertcp._tcp.local, ""QM"" question"
"6","4.281273639","fe80::7c1b:3ff:fe5e:2557","ff02::2","ICMPv6","70","Router Solicitation from 7e:1b:03:5e:25:57"
"7","4.527079138","0.0.0.0","255.255.255.255","DHCP","334","DHCP Discover - Transaction ID 0x8cb62d40"
"8","5.305127500","fe80::2436:dfff:fe61:42e4","ff02::2","ICMPv6","70","Router Solicitation from 26:36:df:61:42:e4"
"9","5.817620254","fe80::b483:f3ff:fe17:efa3","ff02::2","ICMPv6","70","Router Solicitation from b6:83:f3:17:ef:a3"
"10","8.888959224","32:db:da:d1:b0:d2","Broadcast","ARP","42","Who has 10.0.0.7? Tell 10.0.0.1"
"11","8.889346208","7e:1b:03:5e:25:57","Broadcast","ARP","42","Who has 10.0.0.7? Tell 10.0.0.3"
"12","8.889974652","b6:83:f3:17:ef:a3","32:db:da:d1:b0:d2","ARP","42","10.0.0.7 is at b6:83:f3:17:ef:a3"
"13","8.889985019","10.0.0.1","10.0.0.7","TCP","74","51790  >  5201 [SYN] Seq=0 Win=42340 Len=0 MSS=1460 SACK_PERM TSval=2450933373 TSecr=0 WS=512"
"14","8.890107485","ba:72:9b:67:16:1f","Broadcast","ARP","42","Who has 10.0.0.7? Tell 10.0.0.4"
"15","8.890988286","10.0.0.7","10.0.0.1","TCP","74","5201  >  51790 [SYN, ACK] Seq=0 Ack=1 Win=43440 Len=0 MSS=1460 SACK_PERM TSval=2179047698 TSecr=2450933373 WS=512"
"16","8.891022959","10.0.0.1","10.0.0.7","TCP","66","51790  >  5201 [ACK] Seq=1 Ack=1 Win=42496 Len=0 TSval=2450933375 TSecr=2179047698"
"17","8.891071687","10.0.0.1","10.0.0.7","iPerf3","103","51790  >  5201 Cookie: ""4outziwlpbaaffnmlq2ny5x25tmtjv7orv5o"""
"18","8.891119119","10.0.0.7","10.0.0.1","TCP","66","5201  >  51790 [ACK] Seq=1 Ack=38 Win=43520 Len=0 TSval=2179047699 TSecr=2450933376"
"19","8.891151441","10.0.0.7","10.0.0.1","iPerf3","67","5201  >  51790 PARAM_EXCHANGE(9)"
"20","8.891163681","10.0.0.1","10.0.0.7","TCP","66","51790  >  5201 [ACK] Seq=38 Ack=2 Win=42496 Len=0 TSval=2450933376 TSecr=2179047699"
"21","8.891212083","10.0.0.1","10.0.0.7","iPerf3","70","51790  >  5201 Next message is JSON of this length: 166"
"22","8.891241431","10.0.0.1","10.0.0.7","iPerf3/JSON","232","51790  >  5201 {""tcp"":true,""omit"":0,""time"":150,""num"":0,""blockcount"":0,""parallel"":10,""len"":131072,""bandwidth"":10000000,""pacing_timer"":1000,""congestion"":""bic"",""client_version"":""3.16""}, JSON"
"23","8.891329138","10.0.0.7","10.0.0.1","TCP","66","5201  >  51790 [ACK] Seq=2 Ack=208 Win=43520 Len=0 TSval=2179047699 TSecr=2450933376"
"24","8.891416749","10.0.0.7","10.0.0.1","iPerf3","67","5201  >  51790 CREATE_STREAMS(10)"
"25","8.891489262","10.0.0.1","10.0.0.7","TCP","74","51798  >  5201 [SYN] Seq=0 Win=42340 Len=0 MSS=1460 SACK_PERM TSval=2450933376 TSecr=0 WS=512"
"26","8.891528582","10.0.0.7","10.0.0.1","TCP","74","5201  >  51798 [SYN, ACK] Seq=0 Ack=1 Win=43440 Len=0 MSS=1460 SACK_PERM TSval=2179047699 TSecr=2450933376 WS=512"
"27","8.891546207","10.0.0.1","10.0.0.7","TCP","66","51798  >  5201 [ACK] Seq=1 Ack=1 Win=42496 Len=0 TSval=2450933376 TSecr=2179047699"
"28","8.891582860","10.0.0.1","10.0.0.7","iPerf3","103","51798  >  5201 Cookie: ""4outziwlpbaaffnmlq2ny5x25tmtjv7orv5o"""
"29","8.891614909","10.0.0.7","10.0.0.1","TCP","66","5201  >  51798 [ACK] Seq=1 Ack=38 Win=43520 Len=0 TSval=2179047699 TSecr=2450933376"
"30","8.898879838","10.0.0.1","10.0.0.7","TCP","74","51806  >  5201 [SYN] Seq=0 Win=42340 Len=0 MSS=1460 SACK_PERM TSval=2450933383 TSecr=0 WS=512"
"31","8.898945831","10.0.0.7","10.0.0.1","TCP","74","5201  >  51806 [SYN, ACK] Seq=0 Ack=1 Win=43440 Len=0 MSS=1460 SACK_PERM TSval=2179047706 TSecr=2450933383 WS=512"
"32","8.898971283","10.0.0.1","10.0.0.7","TCP","66","51806  >  5201 [ACK] Seq=1 Ack=1 Win=42496 Len=0 TSval=2450933383 TSecr=2179047706"
"33","8.899015718","10.0.0.1","10.0.0.7","iPerf3","103","51806  >  5201 Cookie: ""4outziwlpbaaffnmlq2ny5x25tmtjv7orv5o"""
"34","8.899055415","10.0.0.7","10.0.0.1","TCP","66","5201  >  51806 [ACK] Seq=1 Ack=38 Win=43520 Len=0 TSval=2179047707 TSecr=2450933383"
"35","8.900533059","10.0.0.1","10.0.0.7","TCP","74","51812  >  5201 [SYN] Seq=0 Win=42340 Len=0 MSS=1460 SACK_PERM TSval=2450933385 TSecr=0 WS=512"
"36","8.900584702","10.0.0.7","10.0.0.1","TCP","74","5201  >  51812 [SYN, ACK] Seq=0 Ack=1 Win=43440 Len=0 MSS=1460 SACK_PERM TSval=2179047708 TSecr=2450933385 WS=512"
"37","8.900605132","10.0.0.1","10.0.0.7","TCP","66","51812  >  5201 [ACK] Seq=1 Ack=1 Win=42496 Len=0 TSval=2450933385 TSecr=2179047708"
"38","8.900647050","10.0.0.1","10.0.0.7","iPerf3","103","51812  >  5201 Cookie: ""4outziwlpbaaffnmlq2ny5x25tmtjv7orv5o"""
"39","8.900673274","10.0.0.7","10.0.0.1","TCP","66","5201  >  51812 [ACK] Seq=1 Ack=38 Win=43520 Len=0 TSval=2179047708 TSecr=2450933385"
"40","8.902061803","10.0.0.1","10.0.0.7","TCP","74","51820  >  5201 [SYN] Seq=0 Win=42340 Len=0 MSS=1460 SACK_PERM TSval=2450933387 TSecr=0 WS=512"
"41","8.902106901","10.0.0.7","10.0.0.1","TCP","74","5201  >  51820 [SYN, ACK] Seq=0 Ack=1 Win=43440 Len=0 MSS=1460 SACK_PERM TSval=2179047710 TSecr=2450933387 WS=512"
"42","8.902123512","10.0.0.1","10.0.0.7","TCP","66","51820  >  5201 [ACK] Seq=1 Ack=1 Win=42496 Len=0 TSval=2450933387 TSecr=2179047710"
"43","8.902158151","10.0.0.1","10.0.0.7","iPerf3","103","51820  >  5201 Cookie: ""4outziwlpbaaffnmlq2ny5x25tmtjv7orv5o"""
"44","8.902179996","10.0.0.7","10.0.0.1","TCP","66","5201  >  51820 [ACK] Seq=1 Ack=38 Win=43520 Len=0 TSval=2179047710 TSecr=2450933387"
"45","8.903097658","10.0.0.1","10.0.0.7","TCP","74","51834  >  5201 [SYN] Seq=0 Win=42340 Len=0 MSS=1460 SACK_PERM TSval=2450933388 TSecr=0 WS=512"
"46","8.903115104","10.0.0.7","10.0.0.1","TCP","74","5201  >  51834 [SYN, ACK] Seq=0 Ack=1 Win=43440 Len=0 MSS=1460 SACK_PERM TSval=2179047711 TSecr=2450933388 WS=512"
"47","8.903121365","10.0.0.1","10.0.0.7","TCP","66","51834  >  5201 [ACK] Seq=1 Ack=1 Win=42496 Len=0 TSval=2450933388 TSecr=2179047711"
"48","8.903134034","10.0.0.1","10.0.0.7","iPerf3","103","51834  >  5201 Cookie: ""4outziwlpbaaffnmlq2ny5x25tmtjv7orv5o"""
"49","8.903142213","10.0.0.7","10.0.0.1","TCP","66","5201  >  51834 [ACK] Seq=1 Ack=38 Win=43520 Len=0 TSval=2179047711 TSecr=2450933388"
"50","8.903676538","10.0.0.1","10.0.0.7","TCP","74","51836  >  5201 [SYN] Seq=0 Win=42340 Len=0 MSS=1460 SACK_PERM TSval=2450933388 TSecr=0 WS=512"
"51","8.903693952","10.0.0.7","10.0.0.1","TCP","74","5201  >  51836 [SYN, ACK] Seq=0 Ack=1 Win=43440 Len=0 MSS=1460 SACK_PERM TSval=2179047711 TSecr=2450933388 WS=512"
"52","8.903700147","10.0.0.1","10.0.0.7","TCP","66","51836  >  5201 [ACK] Seq=1 Ack=1 Win=42496 Len=0 TSval=2450933388 TSecr=2179047711"
"53","8.903713421","10.0.0.1","10.0.0.7","iPerf3","103","51836  >  5201 Cookie: ""4outziwlpbaaffnmlq2ny5x25tmtjv7orv5o"""
"54","8.903722102","10.0.0.7","10.0.0.1","TCP","66","5201  >  51836 [ACK] Seq=1 Ack=38 Win=43520 Len=0 TSval=2179047711 TSecr=2450933388"
"55","8.904262133","10.0.0.1","10.0.0.7","TCP","74","51848  >  5201 [SYN] Seq=0 Win=42340 Len=0 MSS=1460 SACK_PERM TSval=2450933389 TSecr=0 WS=512"
"56","8.904278232","10.0.0.7","10.0.0.1","TCP","74","5201  >  51848 [SYN, ACK] Seq=0 Ack=1 Win=43440 Len=0 MSS=1460 SACK_PERM TSval=2179047712 TSecr=2450933389 WS=512"
"57","8.904284348","10.0.0.1","10.0.0.7","TCP","66","51848  >  5201 [ACK] Seq=1 Ack=1 Win=42496 Len=0 TSval=2450933389 TSecr=2179047712"
"58","8.904296580","10.0.0.1","10.0.0.7","iPerf3","103","51848  >  5201 Cookie: ""4outziwlpbaaffnmlq2ny5x25tmtjv7orv5o"""
"59","8.904305249","10.0.0.7","10.0.0.1","TCP","66","5201  >  51848 [ACK] Seq=1 Ack=38 Win=43520 Len=0 TSval=2179047712 TSecr=2450933389"
"60","8.905069892","10.0.0.1","10.0.0.7","TCP","74","51852  >  5201 [SYN] Seq=0 Win=42340 Len=0 MSS=1460 SACK_PERM TSval=2450933390 TSecr=0 WS=512"
"61","8.932038084","10.0.0.1","10.0.0.7","TCP","66","51790  >  5201 [ACK] Seq=208 Ack=3 Win=42496 Len=0 TSval=2450933417 TSecr=2179047699"
"62","8.967692869","10.0.0.7","10.0.0.1","TCP","74","5201  >  51852 [SYN, ACK] Seq=0 Ack=1 Win=43440 Len=0 MSS=1460 SACK_PERM TSval=2179047775 TSecr=2450933390 WS=512"
"63","8.967706441","10.0.0.1","10.0.0.7","TCP","66","51852  >  5201 [ACK] Seq=1 Ack=1 Win=42496 Len=0 TSval=2450933452 TSecr=2179047775"
"64","8.971039265","10.0.0.1","10.0.0.7","iPerf3","103","51852  >  5201 Cookie: ""4outziwlpbaaffnmlq2ny5x25tmtjv7orv5o"""
"65","8.971565134","10.0.0.1","10.0.0.7","TCP","74","51854  >  5201 [SYN] Seq=0 Win=42340 Len=0 MSS=1460 SACK_PERM TSval=2450933456 TSecr=0 WS=512"
"66","9.020805255","10.0.0.7","10.0.0.1","TCP","66","5201  >  51852 [ACK] Seq=1 Ack=38 Win=43520 Len=0 TSval=2179047828 TSecr=2450933456"
"67","9.023732009","10.0.0.7","10.0.0.1","TCP","74","5201  >  51854 [SYN, ACK] Seq=0 Ack=1 Win=43440 Len=0 MSS=1460 SACK_PERM TSval=2179047831 TSecr=2450933456 WS=512"
"68","9.023745404","10.0.0.1","10.0.0.7","TCP","66","51854  >  5201 [ACK] Seq=1 Ack=1 Win=42496 Len=0 TSval=2450933508 TSecr=2179047831"
"69","9.023757827","10.0.0.1","10.0.0.7","iPerf3","103","51854  >  5201 Cookie: ""4outziwlpbaaffnmlq2ny5x25tmtjv7orv5o"""
"70","9.024255806","10.0.0.1","10.0.0.7","TCP","74","51870  >  5201 [SYN] Seq=0 Win=42340 Len=0 MSS=1460 SACK_PERM TSval=2450933509 TSecr=0 WS=512"
"71","9.165321690","10.0.0.7","10.0.0.1","TCP","66","5201  >  51854 [ACK] Seq=1 Ack=38 Win=43520 Len=0 TSval=2179047973 TSecr=2450933508"
"72","9.165323421","10.0.0.7","10.0.0.1","TCP","74","5201  >  51870 [SYN, ACK] Seq=0 Ack=1 Win=43440 Len=0 MSS=1460 SACK_PERM TSval=2179047973 TSecr=2450933509 WS=512"
"73","9.165342968","10.0.0.1","10.0.0.7","TCP","66","51870  >  5201 [ACK] Seq=1 Ack=1 Win=42496 Len=0 TSval=2450933650 TSecr=2179047973"
"74","9.165367315","10.0.0.1","10.0.0.7","iPerf3","103","51870  >  5201 Cookie: ""4outziwlpbaaffnmlq2ny5x25tmtjv7orv5o"""
"75","9.337909262","10.0.0.7","10.0.0.1","TCP","66","5201  >  51870 [ACK] Seq=1 Ack=38 Win=43520 Len=0 TSval=2179048145 TSecr=2450933650"
"76","9.338455871","10.0.0.7","10.0.0.1","iPerf3","67","5201  >  51790 TEST_START(1)"
"77","9.338463307","10.0.0.1","10.0.0.7","TCP","66","51790  >  5201 [ACK] Seq=208 Ack=4 Win=42496 Len=0 TSval=2450933823 TSecr=2179048146"
"78","9.338472957","10.0.0.7","10.0.0.1","iPerf3","67","5201  >  51790 TEST_RUNNING(2)"
"79","9.338475851","10.0.0.1","10.0.0.7","TCP","66","51790  >  5201 [ACK] Seq=208 Ack=5 Win=42496 Len=0 TSval=2450933823 TSecr=2179048146"
"80","9.339226223","10.0.0.1","10.0.0.7","TCP","7306","51848  >  5201 [PSH, ACK] Seq=38 Ack=1 Win=42496 Len=7240 TSval=2450933824 TSecr=2179047712"
"81","9.339241765","10.0.0.1","10.0.0.7","TCP","7306","51848  >  5201 [PSH, ACK] Seq=7278 Ack=1 Win=42496 Len=7240 TSval=2450933824 TSecr=2179047712"
"82","9.339263793","10.0.0.1","10.0.0.7","TCP","2962","51852  >  5201 [PSH, ACK] Seq=38 Ack=1 Win=42496 Len=2896 TSval=2450933824 TSecr=2179047828"
"83","9.339270077","10.0.0.1","10.0.0.7","TCP","2962","51852  >  5201 [PSH, ACK] Seq=2934 Ack=1 Win=42496 Len=2896 TSval=2450933824 TSecr=2179047828"
"84","9.340978901","10.0.0.1","10.0.0.7","TCP","7306","51798  >  5201 [PSH, ACK] Seq=38 Ack=1 Win=42496 Len=7240 TSval=2450933825 TSecr=2179047699"
"85","9.340985179","10.0.0.1","10.0.0.7","TCP","7306","51798  >  5201 [PSH, ACK] Seq=7278 Ack=1 Win=42496 Len=7240 TSval=2450933825 TSecr=2179047699"
"86","9.341022654","10.0.0.1","10.0.0.7","TCP","7306","51820  >  5201 [PSH, ACK] Seq=38 Ack=1 Win=42496 Len=7240 TSval=2450933825 TSecr=2179047710"
"87","9.341029461","10.0.0.1","10.0.0.7","TCP","7306","51820  >  5201 [PSH, ACK] Seq=7278 Ack=1 Win=42496 Len=7240 TSval=2450933826 TSecr=2179047710"
"88","9.341065060","10.0.0.1","10.0.0.7","TCP","7306","51836  >  5201 [PSH, ACK] Seq=38 Ack=1 Win=42496 Len=7240 TSval=2450933826 TSecr=2179047711"
"89","9.341068911","10.0.0.1","10.0.0.7","TCP","7306","51836  >  5201 [PSH, ACK] Seq=7278 Ack=1 Win=42496 Len=7240 TSval=2450933826 TSecr=2179047711"
"90","9.342094265","10.0.0.1","10.0.0.7","TCP","2962","51870  >  5201 [PSH, ACK] Seq=38 Ack=1 Win=42496 Len=2896 TSval=2450933827 TSecr=2179048145"
"91","9.342103434","10.0.0.1","10.0.0.7","TCP","2962","51870  >  5201 [PSH, ACK] Seq=2934 Ack=1 Win=42496 Len=2896 TSval=2450933827 TSecr=2179048145"
"92","9.343049626","10.0.0.1","10.0.0.7","TCP","7306","51806  >  5201 [PSH, ACK] Seq=38 Ack=1 Win=42496 Len=7240 TSval=2450933828 TSecr=2179047707"
"93","9.343055642","10.0.0.1","10.0.0.7","TCP","7306","51806  >  5201 [PSH, ACK] Seq=7278 Ack=1 Win=42496 Len=7240 TSval=2450933828 TSecr=2179047707"
"94","9.343088274","10.0.0.1","10.0.0.7","TCP","7306","51812  >  5201 [PSH, ACK] Seq=38 Ack=1 Win=42496 Len=7240 TSval=2450933828 TSecr=2179047708"
"95","9.343092099","10.0.0.1","10.0.0.7","TCP","7306","51812  >  5201 [PSH, ACK] Seq=7278 Ack=1 Win=42496 Len=7240 TSval=2450933828 TSecr=2179047708"
"96","9.343122978","10.0.0.1","10.0.0.7","TCP","7306","51834  >  5201 [PSH, ACK] Seq=38 Ack=1 Win=42496 Len=7240 TSval=2450933828 TSecr=2179047711"
"97","9.343126877","10.0.0.1","10.0.0.7","TCP","7306","51834  >  5201 [PSH, ACK] Seq=7278 Ack=1 Win=42496 Len=7240 TSval=2450933828 TSecr=2179047711"
"98","9.343158258","10.0.0.1","10.0.0.7","TCP","2962","51854  >  5201 [PSH, ACK] Seq=38 Ack=1 Win=42496 Len=2896 TSval=2450933828 TSecr=2179047973"
"99","9.343161601","10.0.0.1","10.0.0.7","TCP","2962","51854  >  5201 [PSH, ACK] Seq=2934 Ack=1 Win=42496 Len=2896 TSval=2450933828 TSecr=2179047973"
"100","9.344029197","10.0.0.1","10.0.0.7","TCP","1514","51848  >  5201 [ACK] Seq=14518 Ack=1 Win=42496 Len=1448 TSval=2450933829 TSecr=2179047712"
"101","9.344030112","10.0.0.1","10.0.0.7","TCP","1514","51798  >  5201 [ACK] Seq=14518 Ack=1 Win=42496 Len=1448 TSval=2450933829 TSecr=2179047699"
"102","9.345031614","10.0.0.1","10.0.0.7","TCP","1514","51836  >  5201 [ACK] Seq=14518 Ack=1 Win=42496 Len=1448 TSval=2450933830 TSecr=2179047711"
"103","9.345032455","10.0.0.1","10.0.0.7","TCP","1514","51820  >  5201 [ACK] Seq=14518 Ack=1 Win=42496 Len=1448 TSval=2450933830 TSecr=2179047710"
"104","9.347035654","10.0.0.1","10.0.0.7","TCP","1514","51834  >  5201 [ACK] Seq=14518 Ack=1 Win=42496 Len=1448 TSval=2450933832 TSecr=2179047711"
"105","9.347036784","10.0.0.1","10.0.0.7","TCP","1514","51812  >  5201 [ACK] Seq=14518 Ack=1 Win=42496 Len=1448 TSval=2450933832 TSecr=2179047708"
"106","9.347037657","10.0.0.1","10.0.0.7","TCP","1514","51806  >  5201 [ACK] Seq=14518 Ack=1 Win=42496 Len=1448 TSval=2450933832 TSecr=2179047707"
"107","9.369040942","10.0.0.7","10.0.0.1","TCP","67","[TCP Keep-Alive] 5201  >  51790 [PSH, ACK] Seq=4 Ack=208 Win=43520 Len=1 TSval=2179048177 TSecr=2450933417"
"108","9.369049995","10.0.0.1","10.0.0.7","TCP","78","[TCP Keep-Alive ACK] 51790  >  5201 [ACK] Seq=208 Ack=5 Win=42496 Len=0 TSval=2450933854 TSecr=2179048177 SLE=4 SRE=5"
"109","9.536210715","10.0.0.7","10.0.0.1","TCP","66","5201  >  51848 [ACK] Seq=1 Ack=7278 Win=56832 Len=0 TSval=2179048344 TSecr=2450933824"
"110","9.536226078","10.0.0.1","10.0.0.7","TCP","10202","51848  >  5201 [PSH, ACK] Seq=15966 Ack=1 Win=42496 Len=10136 TSval=2450934021 TSecr=2179048344"
"111","9.536802723","10.0.0.7","10.0.0.1","TCP","66","5201  >  51848 [ACK] Seq=1 Ack=14518 Win=70656 Len=0 TSval=2179048344 TSecr=2450933824"
"112","9.536810046","10.0.0.1","10.0.0.7","TCP","10202","51848  >  5201 [PSH, ACK] Seq=26102 Ack=1 Win=42496 Len=10136 TSval=2450934021 TSecr=2179048344"
"113","9.537410893","10.0.0.7","10.0.0.1","TCP","66","5201  >  51852 [ACK] Seq=1 Ack=2934 Win=48128 Len=0 TSval=2179048345 TSecr=2450933824"
"114","9.537415977","10.0.0.1","10.0.0.7","TCP","2962","51852  >  5201 [PSH, ACK] Seq=5830 Ack=1 Win=42496 Len=2896 TSval=2450934022 TSecr=2179048345"
"115","9.537650084","10.0.0.7","10.0.0.1","TCP","66","5201  >  51852 [ACK] Seq=1 Ack=5830 Win=54272 Len=0 TSval=2179048345 TSecr=2450933824"
"116","9.537653821","10.0.0.1","10.0.0.7","TCP","2962","51852  >  5201 [PSH, ACK] Seq=8726 Ack=1 Win=42496 Len=2896 TSval=2450934022 TSecr=2179048345"
"117","9.559293515","10.0.0.7","10.0.0.1","TCP","66","5201  >  51798 [ACK] Seq=1 Ack=7278 Win=56832 Len=0 TSval=2179048367 TSecr=2450933825"
"118","9.559302346","10.0.0.1","10.0.0.7","TCP","10202","51798  >  5201 [PSH, ACK] Seq=15966 Ack=1 Win=42496 Len=10136 TSval=2450934044 TSecr=2179048367"
"119","9.559891780","10.0.0.7","10.0.0.1","TCP","66","5201  >  51798 [ACK] Seq=1 Ack=14518 Win=64000 Len=0 TSval=2179048367 TSecr=2450933825"
"120","9.559898385","10.0.0.1","10.0.0.7","TCP","10202","51798  >  5201 [PSH, ACK] Seq=26102 Ack=1 Win=42496 Len=10136 TSval=2450934044 TSecr=2179048367"
"121","9.560501018","10.0.0.7","10.0.0.1","TCP","66","5201  >  51820 [ACK] Seq=1 Ack=7278 Win=56832 Len=0 TSval=2179048368 TSecr=2450933825"
"122","9.560509754","10.0.0.1","10.0.0.7","TCP","10202","51820  >  5201 [PSH, ACK] Seq=15966 Ack=1 Win=42496 Len=10136 TSval=2450934045 TSecr=2179048368"
"123","9.566556061","10.0.0.7","10.0.0.1","TCP","66","5201  >  51820 [ACK] Seq=1 Ack=14518 Win=70656 Len=0 TSval=2179048374 TSecr=2450933826"
"124","9.566563299","10.0.0.1","10.0.0.7","TCP","10202","51820  >  5201 [PSH, ACK] Seq=26102 Ack=1 Win=42496 Len=10136 TSval=2450934051 TSecr=2179048374"
"125","9.567162385","10.0.0.7","10.0.0.1","TCP","66","5201  >  51836 [ACK] Seq=1 Ack=7278 Win=56832 Len=0 TSval=2179048375 TSecr=2450933826"
"126","9.567168385","10.0.0.1","10.0.0.7","TCP","10202","51836  >  5201 [PSH, ACK] Seq=15966 Ack=1 Win=42496 Len=10136 TSval=2450934052 TSecr=2179048375"
"127","9.567765738","10.0.0.7","10.0.0.1","TCP","66","5201  >  51836 [ACK] Seq=1 Ack=14518 Win=70656 Len=0 TSval=2179048375 TSecr=2450933826"
"128","9.567771747","10.0.0.1","10.0.0.7","TCP","10202","51836  >  5201 [PSH, ACK] Seq=26102 Ack=1 Win=42496 Len=10136 TSval=2450934052 TSecr=2179048375"
"129","9.568373416","10.0.0.7","10.0.0.1","TCP","66","5201  >  51870 [ACK] Seq=1 Ack=2934 Win=48128 Len=0 TSval=2179048376 TSecr=2450933827"
"130","9.568378328","10.0.0.1","10.0.0.7","TCP","2962","51870  >  5201 [PSH, ACK] Seq=5830 Ack=1 Win=42496 Len=2896 TSval=2450934053 TSecr=2179048376"
"131","9.568613145","10.0.0.7","10.0.0.1","TCP","66","5201  >  51870 [ACK] Seq=1 Ack=5830 Win=54272 Len=0 TSval=2179048376 TSecr=2450933827"
"132","9.568616765","10.0.0.1","10.0.0.7","TCP","2962","51870  >  5201 [PSH, ACK] Seq=8726 Ack=1 Win=42496 Len=2896 TSval=2450934053 TSecr=2179048376"
"133","9.568857593","10.0.0.7","10.0.0.1","TCP","66","5201  >  51806 [ACK] Seq=1 Ack=7278 Win=56832 Len=0 TSval=2179048376 TSecr=2450933828"
"134","9.568863659","10.0.0.1","10.0.0.7","TCP","10202","51806  >  5201 [PSH, ACK] Seq=15966 Ack=1 Win=42496 Len=10136 TSval=2450934053 TSecr=2179048376"
"135","9.574919779","10.0.0.7","10.0.0.1","TCP","66","5201  >  51806 [ACK] Seq=1 Ack=14518 Win=64000 Len=0 TSval=2179048382 TSecr=2450933828"
"136","9.574932856","10.0.0.1","10.0.0.7","TCP","10202","51806  >  5201 [PSH, ACK] Seq=26102 Ack=1 Win=42496 Len=10136 TSval=2450934059 TSecr=2179048382"
"137","9.575519035","10.0.0.7","10.0.0.1","TCP","66","5201  >  51812 [ACK] Seq=1 Ack=7278 Win=56832 Len=0 TSval=2179048383 TSecr=2450933828"
"138","9.575526288","10.0.0.1","10.0.0.7","TCP","10202","51812  >  5201 [PSH, ACK] Seq=15966 Ack=1 Win=42496 Len=10136 TSval=2450934060 TSecr=2179048383"
"139","9.576122974","10.0.0.7","10.0.0.1","TCP","66","5201  >  51812 [ACK] Seq=1 Ack=14518 Win=70656 Len=0 TSval=2179048384 TSecr=2450933828"
"140","9.576128573","10.0.0.1","10.0.0.7","TCP","10202","51812  >  5201 [PSH, ACK] Seq=26102 Ack=1 Win=42496 Len=10136 TSval=2450934061 TSecr=2179048384"
"141","9.576729979","10.0.0.7","10.0.0.1","TCP","66","5201  >  51834 [ACK] Seq=1 Ack=7278 Win=56832 Len=0 TSval=2179048384 TSecr=2450933828"
"142","9.576736059","10.0.0.1","10.0.0.7","TCP","10202","51834  >  5201 [PSH, ACK] Seq=15966 Ack=1 Win=42496 Len=10136 TSval=2450934061 TSecr=2179048384"
"143","9.577334993","10.0.0.7","10.0.0.1","TCP","66","5201  >  51834 [ACK] Seq=1 Ack=14518 Win=70656 Len=0 TSval=2179048385 TSecr=2450933828"
"144","9.577341087","10.0.0.1","10.0.0.7","TCP","10202","51834  >  5201 [PSH, ACK] Seq=26102 Ack=1 Win=42496 Len=10136 TSval=2450934062 TSecr=2179048385"
"145","9.577940887","10.0.0.7","10.0.0.1","TCP","66","5201  >  51854 [ACK] Seq=1 Ack=2934 Win=48128 Len=0 TSval=2179048385 TSecr=2450933828"
"146","9.577945579","10.0.0.1","10.0.0.7","TCP","2962","51854  >  5201 [PSH, ACK] Seq=5830 Ack=1 Win=42496 Len=2896 TSval=2450934062 TSecr=2179048385"
"147","9.578180317","10.0.0.7","10.0.0.1","TCP","66","5201  >  51854 [ACK] Seq=1 Ack=5830 Win=54272 Len=0 TSval=2179048386 TSecr=2450933828"
"148","9.578184422","10.0.0.1","10.0.0.7","TCP","2962","51854  >  5201 [PSH, ACK] Seq=8726 Ack=1 Win=42496 Len=2896 TSval=2450934063 TSecr=2179048386"
"149","9.578424706","10.0.0.7","10.0.0.1","TCP","66","5201  >  51848 [ACK] Seq=1 Ack=15966 Win=73216 Len=0 TSval=2179048386 TSecr=2450933829"
"150","9.578546414","10.0.0.7","10.0.0.1","TCP","66","5201  >  51798 [ACK] Seq=1 Ack=15966 Win=67072 Len=0 TSval=2179048386 TSecr=2450933829"
"151","9.578666958","10.0.0.7","10.0.0.1","TCP","66","5201  >  51836 [ACK] Seq=1 Ack=15966 Win=73216 Len=0 TSval=2179048386 TSecr=2450933830"
"152","9.584240386","10.0.0.7","10.0.0.1","TCP","66","5201  >  51820 [ACK] Seq=1 Ack=15966 Win=73216 Len=0 TSval=2179048392 TSecr=2450933830"
"153","9.584358595","10.0.0.7","10.0.0.1","TCP","66","5201  >  51834 [ACK] Seq=1 Ack=15966 Win=73216 Len=0 TSval=2179048392 TSecr=2450933832"
"154","9.584480443","10.0.0.7","10.0.0.1","TCP","66","5201  >  51812 [ACK] Seq=1 Ack=15966 Win=73216 Len=0 TSval=2179048392 TSecr=2450933832"
"155","9.584602015","10.0.0.7","10.0.0.1","TCP","66","5201  >  51806 [ACK] Seq=1 Ack=15966 Win=67072 Len=0 TSval=2179048392 TSecr=2450933832"
"156","9.814015156","10.0.0.7","10.0.0.1","TCP","66","5201  >  51848 [ACK] Seq=1 Ack=26102 Win=68096 Len=0 TSval=2179048621 TSecr=2450934021"
"157","9.814025689","10.0.0.1","10.0.0.7","TCP","7306","51848  >  5201 [PSH, ACK] Seq=36238 Ack=1 Win=42496 Len=7240 TSval=2450934298 TSecr=2179048621"
"158","9.814030341","10.0.0.1","10.0.0.7","TCP","14546","51848  >  5201 [PSH, ACK] Seq=43478 Ack=1 Win=42496 Len=14480 TSval=2450934298 TSecr=2179048621"
"159","9.820318225","10.0.0.7","10.0.0.1","TCP","66","5201  >  51848 [ACK] Seq=1 Ack=36238 Win=93696 Len=0 TSval=2179048628 TSecr=2450934021"
"160","9.820333185","10.0.0.1","10.0.0.7","TCP","21786","51848  >  5201 [PSH, ACK] Seq=57958 Ack=1 Win=42496 Len=21720 TSval=2450934305 TSecr=2179048628"
"161","9.821156979","10.0.0.7","10.0.0.1","TCP","66","5201  >  51852 [ACK] Seq=1 Ack=8726 Win=59904 Len=0 TSval=2179048629 TSecr=2450934022"
"162","9.821162028","10.0.0.1","10.0.0.7","TCP","2962","51852  >  5201 [PSH, ACK] Seq=11622 Ack=1 Win=42496 Len=2896 TSval=2450934306 TSecr=2179048629"
"163","9.823698483","10.0.0.7","10.0.0.1","TCP","66","5201  >  51852 [ACK] Seq=1 Ack=11622 Win=64000 Len=0 TSval=2179048631 TSecr=2450934022"
"164","9.823703020","10.0.0.1","10.0.0.7","TCP","2962","51852  >  5201 [PSH, ACK] Seq=14518 Ack=1 Win=42496 Len=2896 TSval=2450934308 TSecr=2179048631"
"165","9.843445799","10.0.0.7","10.0.0.1","TCP","66","5201  >  51798 [ACK] Seq=1 Ack=26102 Win=68096 Len=0 TSval=2179048651 TSecr=2450934044"
"166","9.843452764","10.0.0.1","10.0.0.7","TCP","7306","51798  >  5201 [PSH, ACK] Seq=36238 Ack=1 Win=42496 Len=7240 TSval=2450934328 TSecr=2179048651"
"167","9.843456051","10.0.0.1","10.0.0.7","TCP","14546","51798  >  5201 [PSH, ACK] Seq=43478 Ack=1 Win=42496 Len=14480 TSval=2450934328 TSecr=2179048651"
"168","9.844288223","10.0.0.7","10.0.0.1","TCP","66","5201  >  51798 [ACK] Seq=1 Ack=36238 Win=88064 Len=0 TSval=2179048652 TSecr=2450934044"
"169","9.844297271","10.0.0.1","10.0.0.7","TCP","21786","51798  >  5201 [PSH, ACK] Seq=57958 Ack=1 Win=42496 Len=21720 TSval=2450934329 TSecr=2179048652"
"170","9.845146414","10.0.0.7","10.0.0.1","TCP","66","5201  >  51820 [ACK] Seq=1 Ack=26102 Win=68096 Len=0 TSval=2179048653 TSecr=2450934045"
"171","9.845154804","10.0.0.1","10.0.0.7","TCP","10202","51820  >  5201 [PSH, ACK] Seq=36238 Ack=1 Win=42496 Len=10136 TSval=2450934330 TSecr=2179048653"
"172","9.845157919","10.0.0.1","10.0.0.7","TCP","11650","51820  >  5201 [PSH, ACK] Seq=46374 Ack=1 Win=42496 Len=11584 TSval=2450934330 TSecr=2179048653"
"173","9.851444794","10.0.0.7","10.0.0.1","TCP","66","5201  >  51820 [ACK] Seq=1 Ack=36238 Win=93696 Len=0 TSval=2179048659 TSecr=2450934051"
"174","9.851459932","10.0.0.1","10.0.0.7","TCP","21786","51820  >  5201 [PSH, ACK] Seq=57958 Ack=1 Win=42496 Len=21720 TSval=2450934336 TSecr=2179048659"
"175","9.852285867","10.0.0.7","10.0.0.1","TCP","66","5201  >  51836 [ACK] Seq=1 Ack=26102 Win=68096 Len=0 TSval=2179048660 TSecr=2450934052"
"176","9.852292959","10.0.0.1","10.0.0.7","TCP","7306","51836  >  5201 [PSH, ACK] Seq=36238 Ack=1 Win=42496 Len=7240 TSval=2450934337 TSecr=2179048660"
"177","9.852296091","10.0.0.1","10.0.0.7","TCP","14546","51836  >  5201 [PSH, ACK] Seq=43478 Ack=1 Win=42496 Len=14480 TSval=2450934337 TSecr=2179048660"
"178","9.853131023","10.0.0.7","10.0.0.1","TCP","66","5201  >  51836 [ACK] Seq=1 Ack=36238 Win=93696 Len=0 TSval=2179048661 TSecr=2450934052"
"179","9.853138992","10.0.0.1","10.0.0.7","TCP","21786","51836  >  5201 [PSH, ACK] Seq=57958 Ack=1 Win=42496 Len=21720 TSval=2450934338 TSecr=2179048661"
"180","9.853981913","10.0.0.7","10.0.0.1","TCP","66","5201  >  51870 [ACK] Seq=1 Ack=8726 Win=59904 Len=0 TSval=2179048661 TSecr=2450934053"
"181","9.853986368","10.0.0.1","10.0.0.7","TCP","2962","51870  >  5201 [PSH, ACK] Seq=11622 Ack=1 Win=42496 Len=2896 TSval=2450934338 TSecr=2179048661"
"182","9.854219793","10.0.0.7","10.0.0.1","TCP","66","5201  >  51870 [ACK] Seq=1 Ack=11622 Win=61952 Len=0 TSval=2179048662 TSecr=2450934053"
"183","9.854223795","10.0.0.1","10.0.0.7","TCP","2962","51870  >  5201 [PSH, ACK] Seq=14518 Ack=1 Win=42496 Len=2896 TSval=2450934339 TSecr=2179048662"
"184","9.854463924","10.0.0.7","10.0.0.1","TCP","66","5201  >  51806 [ACK] Seq=1 Ack=26102 Win=68096 Len=0 TSval=2179048662 TSecr=2450934053"
"185","9.854469608","10.0.0.1","10.0.0.7","TCP","7306","51806  >  5201 [PSH, ACK] Seq=36238 Ack=1 Win=42496 Len=7240 TSval=2450934339 TSecr=2179048662"
"186","9.854472566","10.0.0.1","10.0.0.7","TCP","14546","51806  >  5201 [PSH, ACK] Seq=43478 Ack=1 Win=42496 Len=14480 TSval=2450934339 TSecr=2179048662"
"187","9.855310605","10.0.0.7","10.0.0.1","TCP","66","5201  >  51806 [ACK] Seq=1 Ack=36238 Win=68096 Len=0 TSval=2179048663 TSecr=2450934059"
"188","9.855320829","10.0.0.1","10.0.0.7","TCP","21786","51806  >  5201 [PSH, ACK] Seq=57958 Ack=1 Win=42496 Len=21720 TSval=2450934340 TSecr=2179048663"
"189","9.861615851","10.0.0.7","10.0.0.1","TCP","66","5201  >  51812 [ACK] Seq=1 Ack=26102 Win=68096 Len=0 TSval=2179048669 TSecr=2450934060"
"190","9.861623605","10.0.0.1","10.0.0.7","TCP","7306","51812  >  5201 [PSH, ACK] Seq=36238 Ack=1 Win=42496 Len=7240 TSval=2450934346 TSecr=2179048669"
"191","9.861626470","10.0.0.1","10.0.0.7","TCP","14546","51812  >  5201 [PSH, ACK] Seq=43478 Ack=1 Win=42496 Len=14480 TSval=2450934346 TSecr=2179048669"
"192","9.862455223","10.0.0.7","10.0.0.1","TCP","66","5201  >  51812 [ACK] Seq=1 Ack=36238 Win=58880 Len=0 TSval=2179048670 TSecr=2450934061"
"193","9.862467625","10.0.0.1","10.0.0.7","TCP","21786","51812  >  5201 [PSH, ACK] Seq=57958 Ack=1 Win=42496 Len=21720 TSval=2450934347 TSecr=2179048670"
"194","9.863309480","10.0.0.7","10.0.0.1","TCP","66","5201  >  51834 [ACK] Seq=1 Ack=26102 Win=68096 Len=0 TSval=2179048671 TSecr=2450934061"
"195","9.863317230","10.0.0.1","10.0.0.7","TCP","10202","51834  >  5201 [PSH, ACK] Seq=36238 Ack=1 Win=42496 Len=10136 TSval=2450934348 TSecr=2179048671"
"196","9.863319987","10.0.0.1","10.0.0.7","TCP","11650","51834  >  5201 [PSH, ACK] Seq=46374 Ack=1 Win=42496 Len=11584 TSval=2450934348 TSecr=2179048671"
"197","9.864151993","10.0.0.7","10.0.0.1","TCP","66","5201  >  51834 [ACK] Seq=1 Ack=36238 Win=93696 Len=0 TSval=2179048672 TSecr=2450934062"
"198","9.864160407","10.0.0.1","10.0.0.7","TCP","21786","51834  >  5201 [PSH, ACK] Seq=57958 Ack=1 Win=42496 Len=21720 TSval=2450934349 TSecr=2179048672"
"199","9.865003451","10.0.0.7","10.0.0.1","TCP","66","5201  >  51854 [ACK] Seq=1 Ack=8726 Win=59904 Len=0 TSval=2179048672 TSecr=2450934062"
"200","9.865008910","10.0.0.1","10.0.0.7","TCP","2962","51854  >  5201 [PSH, ACK] Seq=11622 Ack=1 Win=42496 Len=2896 TSval=2450934349 TSecr=2179048672"
"201","9.865242896","10.0.0.7","10.0.0.1","TCP","66","5201  >  51854 [ACK] Seq=1 Ack=11622 Win=64000 Len=0 TSval=2179048673 TSecr=2450934063"
"202","9.865247173","10.0.0.1","10.0.0.7","TCP","2962","51854  >  5201 [PSH, ACK] Seq=14518 Ack=1 Win=42496 Len=2896 TSval=2450934350 TSecr=2179048673"
"203","10.067162734","10.0.0.7","10.0.0.1","TCP","66","5201  >  51848 [ACK] Seq=1 Ack=43478 Win=108032 Len=0 TSval=2179048875 TSecr=2450934298"
"204","10.067759958","10.0.0.7","10.0.0.1","TCP","66","5201  >  51848 [ACK] Seq=1 Ack=57958 Win=137216 Len=0 TSval=2179048875 TSecr=2450934298"
"205","10.067769832","10.0.0.1","10.0.0.7","TCP","7306","51848  >  5201 [PSH, ACK] Seq=79678 Ack=1 Win=42496 Len=7240 TSval=2450934552 TSecr=2179048875"
"206","10.067776008","10.0.0.1","10.0.0.7","TCP","27578","51848  >  5201 [PSH, ACK] Seq=86918 Ack=1 Win=42496 Len=27512 TSval=2450934552 TSecr=2179048875"
"207","10.074431026","10.0.0.7","10.0.0.1","TCP","66","5201  >  51848 [ACK] Seq=1 Ack=79678 Win=174080 Len=0 TSval=2179048882 TSecr=2450934305"
"208","10.074445067","10.0.0.1","10.0.0.7","TCP","34818","51848  >  5201 [PSH, ACK] Seq=114430 Ack=1 Win=42496 Len=34752 TSval=2450934559 TSecr=2179048882"
"209","10.087142167","10.0.0.7","10.0.0.1","TCP","66","5201  >  51852 [ACK] Seq=1 Ack=14518 Win=64000 Len=0 TSval=2179048895 TSecr=2450934306"
"210","10.087148279","10.0.0.1","10.0.0.7","TCP","2962","51852  >  5201 [PSH, ACK] Seq=17414 Ack=1 Win=42496 Len=2896 TSval=2450934572 TSecr=2179048895"
"211","10.087381085","10.0.0.7","10.0.0.1","TCP","66","5201  >  51852 [ACK] Seq=1 Ack=17414 Win=61952 Len=0 TSval=2179048895 TSecr=2450934308"
"212","10.087385127","10.0.0.1","10.0.0.7","TCP","2962","51852  >  5201 [PSH, ACK] Seq=20310 Ack=1 Win=42496 Len=2896 TSval=2450934572 TSecr=2179048895"
"213","10.098527732","10.0.0.7","10.0.0.1","TCP","66","5201  >  51798 [ACK] Seq=1 Ack=43478 Win=102912 Len=0 TSval=2179048906 TSecr=2450934328"
"214","10.099128672","10.0.0.7","10.0.0.1","TCP","66","5201  >  51798 [ACK] Seq=1 Ack=57958 Win=131584 Len=0 TSval=2179048907 TSecr=2450934328"
"215","10.099134542","10.0.0.1","10.0.0.7","TCP","7306","51798  >  5201 [PSH, ACK] Seq=79678 Ack=1 Win=42496 Len=7240 TSval=2450934584 TSecr=2179048907"
"216","10.099138586","10.0.0.1","10.0.0.7","TCP","24682","51798  >  5201 [PSH, ACK] Seq=86918 Ack=1 Win=42496 Len=24616 TSval=2450934584 TSecr=2179048907"
"217","10.100339707","10.0.0.7","10.0.0.1","TCP","66","5201  >  51798 [ACK] Seq=1 Ack=79678 Win=155136 Len=0 TSval=2179048908 TSecr=2450934329"
"218","10.100350157","10.0.0.1","10.0.0.7","TCP","31922","51798  >  5201 [PSH, ACK] Seq=111534 Ack=1 Win=42496 Len=31856 TSval=2450934585 TSecr=2179048908"
"219","10.102160414","10.0.0.7","10.0.0.1","TCP","66","5201  >  51820 [ACK] Seq=1 Ack=46374 Win=114176 Len=0 TSval=2179048910 TSecr=2450934330"
"220","10.108460320","10.0.0.7","10.0.0.1","TCP","66","5201  >  51820 [ACK] Seq=1 Ack=57958 Win=137216 Len=0 TSval=2179048916 TSecr=2450934330"
"221","10.108470396","10.0.0.1","10.0.0.7","TCP","7306","51820  >  5201 [PSH, ACK] Seq=79678 Ack=1 Win=42496 Len=7240 TSval=2450934593 TSecr=2179048916"
"222","10.108476182","10.0.0.1","10.0.0.7","TCP","27578","51820  >  5201 [PSH, ACK] Seq=86918 Ack=1 Win=42496 Len=27512 TSval=2450934593 TSecr=2179048916"
"223","10.109427080","10.0.0.7","10.0.0.1","TCP","66","5201  >  51820 [ACK] Seq=1 Ack=79678 Win=174080 Len=0 TSval=2179048917 TSecr=2450934336"
"224","10.109440803","10.0.0.1","10.0.0.7","TCP","34818","51820  >  5201 [PSH, ACK] Seq=114430 Ack=1 Win=42496 Len=34752 TSval=2450934594 TSecr=2179048917"
"225","10.116707905","10.0.0.7","10.0.0.1","TCP","66","5201  >  51836 [ACK] Seq=1 Ack=43478 Win=108032 Len=0 TSval=2179048924 TSecr=2450934337"
"226","10.117297880","10.0.0.7","10.0.0.1","TCP","66","5201  >  51836 [ACK] Seq=1 Ack=57958 Win=137216 Len=0 TSval=2179048925 TSecr=2450934337"
"227","10.117306517","10.0.0.1","10.0.0.7","TCP","7306","51836  >  5201 [PSH, ACK] Seq=79678 Ack=1 Win=42496 Len=7240 TSval=2450934602 TSecr=2179048925"
"228","10.117311987","10.0.0.1","10.0.0.7","TCP","27578","51836  >  5201 [PSH, ACK] Seq=86918 Ack=1 Win=42496 Len=27512 TSval=2450934602 TSecr=2179048925"
"229","10.118508818","10.0.0.7","10.0.0.1","TCP","66","5201  >  51836 [ACK] Seq=1 Ack=79678 Win=155136 Len=0 TSval=2179048926 TSecr=2450934338"
"230","10.118518039","10.0.0.1","10.0.0.7","TCP","34818","51836  >  5201 [PSH, ACK] Seq=114430 Ack=1 Win=42496 Len=34752 TSval=2450934603 TSecr=2179048926"
"231","10.120328278","10.0.0.7","10.0.0.1","TCP","66","5201  >  51870 [ACK] Seq=1 Ack=14518 Win=64000 Len=0 TSval=2179048928 TSecr=2450934338"
"232","10.120333014","10.0.0.1","10.0.0.7","TCP","2962","51870  >  5201 [PSH, ACK] Seq=17414 Ack=1 Win=42496 Len=2896 TSval=2450934605 TSecr=2179048928"
"233","10.120566930","10.0.0.7","10.0.0.1","TCP","66","5201  >  51870 [ACK] Seq=1 Ack=17414 Win=61952 Len=0 TSval=2179048928 TSecr=2450934339"
"234","10.120570655","10.0.0.1","10.0.0.7","TCP","2962","51870  >  5201 [PSH, ACK] Seq=20310 Ack=1 Win=42496 Len=2896 TSval=2450934605 TSecr=2179048928"
"235","10.120811549","10.0.0.7","10.0.0.1","TCP","66","5201  >  51806 [ACK] Seq=1 Ack=43478 Win=70656 Len=0 TSval=2179048928 TSecr=2450934339"
"236","10.121415957","10.0.0.7","10.0.0.1","TCP","66","5201  >  51806 [ACK] Seq=1 Ack=57958 Win=99328 Len=0 TSval=2179048929 TSecr=2450934339"
"237","10.121421202","10.0.0.1","10.0.0.7","TCP","7306","51806  >  5201 [PSH, ACK] Seq=79678 Ack=1 Win=42496 Len=7240 TSval=2450934606 TSecr=2179048929"
"238","10.121425225","10.0.0.1","10.0.0.7","TCP","24682","51806  >  5201 [PSH, ACK] Seq=86918 Ack=1 Win=42496 Len=24616 TSval=2450934606 TSecr=2179048929"
"239","10.128078887","10.0.0.7","10.0.0.1","TCP","66","5201  >  51806 [ACK] Seq=1 Ack=79678 Win=142848 Len=0 TSval=2179048936 TSecr=2450934340"
"240","10.128089429","10.0.0.1","10.0.0.7","TCP","31922","51806  >  5201 [PSH, ACK] Seq=111534 Ack=1 Win=42496 Len=31856 TSval=2450934613 TSecr=2179048936"
"241","10.129897020","10.0.0.7","10.0.0.1","TCP","66","5201  >  51812 [ACK] Seq=1 Ack=43478 Win=88064 Len=0 TSval=2179048937 TSecr=2450934346"
"242","10.130500293","10.0.0.7","10.0.0.1","TCP","66","5201  >  51812 [ACK] Seq=1 Ack=57958 Win=116736 Len=0 TSval=2179048938 TSecr=2450934346"
"243","10.130505544","10.0.0.1","10.0.0.7","TCP","7306","51812  >  5201 [PSH, ACK] Seq=79678 Ack=1 Win=42496 Len=7240 TSval=2450934615 TSecr=2179048938"
"244","10.130510303","10.0.0.1","10.0.0.7","TCP","27578","51812  >  5201 [PSH, ACK] Seq=86918 Ack=1 Win=42496 Len=27512 TSval=2450934615 TSecr=2179048938"
"245","10.131714118","10.0.0.7","10.0.0.1","TCP","66","5201  >  51812 [ACK] Seq=1 Ack=79678 Win=160256 Len=0 TSval=2179048939 TSecr=2450934347"
"246","10.131727901","10.0.0.1","10.0.0.7","TCP","34818","51812  >  5201 [PSH, ACK] Seq=114430 Ack=1 Win=42496 Len=34752 TSval=2450934616 TSecr=2179048939"
"247","10.138991705","10.0.0.7","10.0.0.1","TCP","66","5201  >  51834 [ACK] Seq=1 Ack=46374 Win=114176 Len=0 TSval=2179048946 TSecr=2450934348"
"248","10.150736888","10.0.0.7","10.0.0.1","TCP","66","5201  >  51834 [ACK] Seq=1 Ack=57958 Win=137216 Len=0 TSval=2179048958 TSecr=2450934348"
"249","10.150749542","10.0.0.1","10.0.0.7","TCP","7306","51834  >  5201 [PSH, ACK] Seq=79678 Ack=1 Win=42496 Len=7240 TSval=2450934635 TSecr=2179048958"
"250","10.150763280","10.0.0.1","10.0.0.7","TCP","27578","51834  >  5201 [PSH, ACK] Seq=86918 Ack=1 Win=42496 Len=27512 TSval=2450934635 TSecr=2179048958"
"251","10.151700359","10.0.0.7","10.0.0.1","TCP","66","5201  >  51834 [ACK] Seq=1 Ack=79678 Win=174080 Len=0 TSval=2179048959 TSecr=2450934349"
"252","10.151711929","10.0.0.1","10.0.0.7","TCP","34818","51834  >  5201 [PSH, ACK] Seq=114430 Ack=1 Win=42496 Len=34752 TSval=2450934636 TSecr=2179048959"
"253","10.153515947","10.0.0.7","10.0.0.1","TCP","66","5201  >  51854 [ACK] Seq=1 Ack=14518 Win=64000 Len=0 TSval=2179048961 TSecr=2450934349"
"254","10.153520967","10.0.0.1","10.0.0.7","TCP","2962","51854  >  5201 [PSH, ACK] Seq=17414 Ack=1 Win=42496 Len=2896 TSval=2450934638 TSecr=2179048961"
"255","10.153755143","10.0.0.7","10.0.0.1","TCP","66","5201  >  51854 [ACK] Seq=1 Ack=17414 Win=64000 Len=0 TSval=2179048961 TSecr=2450934350"
"256","10.153758627","10.0.0.1","10.0.0.7","TCP","2962","51854  >  5201 [PSH, ACK] Seq=20310 Ack=1 Win=42496 Len=2896 TSval=2450934638 TSecr=2179048961"
"257","10.344772320","10.0.0.7","10.0.0.1","TCP","66","5201  >  51848 [ACK] Seq=1 Ack=86918 Win=187392 Len=0 TSval=2179049152 TSecr=2450934552"
"258","10.345367907","10.0.0.7","10.0.0.1","TCP","66","5201  >  51848 [ACK] Seq=1 Ack=114430 Win=242176 Len=0 TSval=2179049153 TSecr=2450934552"
"259","10.345380198","10.0.0.1","10.0.0.7","TCP","24682","51848  >  5201 [PSH, ACK] Seq=149182 Ack=1 Win=42496 Len=24616 TSval=2450934830 TSecr=2179049153"
"260","10.347674036","10.0.0.7","10.0.0.1","TCP","66","5201  >  51848 [ACK] Seq=1 Ack=149182 Win=311808 Len=0 TSval=2179049155 TSecr=2450934559"
"261","10.347685261","10.0.0.1","10.0.0.7","TCP","21786","51848  >  5201 [PSH, ACK] Seq=173798 Ack=1 Win=42496 Len=21720 TSval=2450934832 TSecr=2179049155"
"262","10.347694691","10.0.0.1","10.0.0.7","TCP","46402","51848  >  5201 [PSH, ACK] Seq=195518 Ack=1 Win=42496 Len=46336 TSval=2450934832 TSecr=2179049155"
"263","10.366932087","10.0.0.7","10.0.0.1","TCP","66","5201  >  51852 [ACK] Seq=1 Ack=20310 Win=64000 Len=0 TSval=2179049174 TSecr=2450934572"
"264","10.366940139","10.0.0.1","10.0.0.7","TCP","2962","51852  >  5201 [PSH, ACK] Seq=23206 Ack=1 Win=42496 Len=2896 TSval=2450934851 TSecr=2179049174"
"265","10.367168930","10.0.0.7","10.0.0.1","TCP","66","5201  >  51852 [ACK] Seq=1 Ack=23206 Win=64000 Len=0 TSval=2179049175 TSecr=2450934572"
"266","10.367172344","10.0.0.1","10.0.0.7","TCP","2962","51852  >  5201 [PSH, ACK] Seq=26102 Ack=1 Win=42496 Len=2896 TSval=2450934852 TSecr=2179049175"
"267","10.378321995","10.0.0.7","10.0.0.1","TCP","66","5201  >  51798 [ACK] Seq=1 Ack=86918 Win=169472 Len=0 TSval=2179049186 TSecr=2450934584"
"268","10.378334045","10.0.0.1","10.0.0.7","TCP","30474","51798  >  5201 [PSH, ACK] Seq=143390 Ack=1 Win=42496 Len=30408 TSval=2450934863 TSecr=2179049186"
"269","10.378917337","10.0.0.7","10.0.0.1","TCP","66","5201  >  51798 [ACK] Seq=1 Ack=111534 Win=218624 Len=0 TSval=2179049186 TSecr=2450934584"
"270","10.380976822","10.0.0.7","10.0.0.1","TCP","66","5201  >  51798 [ACK] Seq=1 Ack=143390 Win=282624 Len=0 TSval=2179049188 TSecr=2450934585"
"271","10.380984908","10.0.0.1","10.0.0.7","TCP","1514","51798  >  5201 [PSH, ACK] Seq=173798 Ack=1 Win=42496 Len=1448 TSval=2450934865 TSecr=2179049188"
"272","10.380991503","10.0.0.1","10.0.0.7","TCP","43506","51798  >  5201 [PSH, ACK] Seq=175246 Ack=1 Win=42496 Len=43440 TSval=2450934865 TSecr=2179049188"
"273","10.381001231","10.0.0.1","10.0.0.7","TCP","43506","51798  >  5201 [PSH, ACK] Seq=218686 Ack=1 Win=42496 Len=43440 TSval=2450934865 TSecr=2179049188"
