"No.","Time","Source","Destination","Protocol","Length","Info"
"20","2.818940821","127.0.0.1","127.0.0.1","TCP","74","49988  >  5001 [SYN] Seq=0 Win=65495 Len=0 MSS=65495 SACK_PERM TSval=1023801593 TSecr=0 WS=128"
"21","2.818964960","127.0.0.1","127.0.0.1","TCP","74","5001  >  49988 [SYN, ACK] Seq=0 Ack=1 Win=65483 Len=0 MSS=65495 SACK_PERM TSval=1023801593 TSecr=1023801593 WS=128"
"22","2.818981645","127.0.0.1","127.0.0.1","TCP","66","49988  >  5001 [ACK] Seq=1 Ack=1 Win=65536 Len=0 TSval=1023801593 TSecr=1023801593"
"23","2.819050501","127.0.0.1","127.0.0.1","TCP","106","49988  >  5001 [PSH, ACK] Seq=1 Ack=1 Win=65536 Len=40 TSval=1023801593 TSecr=1023801593"
"24","2.819056297","127.0.0.1","127.0.0.1","TCP","66","5001  >  49988 [ACK] Seq=1 Ack=41 Win=65536 Len=0 TSval=1023801593 TSecr=1023801593"
"25","3.819439904","127.0.0.1","127.0.0.1","TCP","106","49988  >  5001 [PSH, ACK] Seq=41 Ack=1 Win=65536 Len=40 TSval=1023802594 TSecr=1023801593"
"26","3.819472390","127.0.0.1","127.0.0.1","TCP","66","5001  >  49988 [ACK] Seq=1 Ack=81 Win=65536 Len=0 TSval=1023802594 TSecr=1023802594"
"29","4.819785666","127.0.0.1","127.0.0.1","TCP","106","49988  >  5001 [PSH, ACK] Seq=81 Ack=1 Win=65536 Len=40 TSval=1023803594 TSecr=1023802594"
"30","4.819813208","127.0.0.1","127.0.0.1","TCP","66","5001  >  49988 [ACK] Seq=1 Ack=121 Win=65536 Len=0 TSval=1023803594 TSecr=1023803594"
"33","5.820188860","127.0.0.1","127.0.0.1","TCP","106","49988  >  5001 [PSH, ACK] Seq=121 Ack=1 Win=65536 Len=40 TSval=1023804594 TSecr=1023803594"
"34","5.820226531","127.0.0.1","127.0.0.1","TCP","66","5001  >  49988 [ACK] Seq=1 Ack=161 Win=65536 Len=0 TSval=1023804594 TSecr=1023804594"
"35","6.820707803","127.0.0.1","127.0.0.1","TCP","106","49988  >  5001 [PSH, ACK] Seq=161 Ack=1 Win=65536 Len=40 TSval=1023805595 TSecr=1023804594"
"36","6.820747687","127.0.0.1","127.0.0.1","TCP","66","5001  >  49988 [ACK] Seq=1 Ack=201 Win=65536 Len=0 TSval=1023805595 TSecr=1023805595"
"37","7.821158607","127.0.0.1","127.0.0.1","TCP","106","49988  >  5001 [PSH, ACK] Seq=201 Ack=1 Win=65536 Len=40 TSval=1023806595 TSecr=1023805595"
"38","7.821199544","127.0.0.1","127.0.0.1","TCP","66","5001  >  49988 [ACK] Seq=1 Ack=241 Win=65536 Len=0 TSval=1023806595 TSecr=1023806595"
"39","8.821678281","127.0.0.1","127.0.0.1","TCP","106","49988  >  5001 [PSH, ACK] Seq=241 Ack=1 Win=65536 Len=40 TSval=1023807596 TSecr=1023806595"
"40","8.821715900","127.0.0.1","127.0.0.1","TCP","66","5001  >  49988 [ACK] Seq=1 Ack=281 Win=65536 Len=0 TSval=1023807596 TSecr=1023807596"
"41","9.822195204","127.0.0.1","127.0.0.1","TCP","106","49988  >  5001 [PSH, ACK] Seq=281 Ack=1 Win=65536 Len=40 TSval=1023808596 TSecr=1023807596"
"42","9.822232618","127.0.0.1","127.0.0.1","TCP","66","5001  >  49988 [ACK] Seq=1 Ack=321 Win=65536 Len=0 TSval=1023808596 TSecr=1023808596"
"43","10.822717213","127.0.0.1","127.0.0.1","TCP","106","49988  >  5001 [PSH, ACK] Seq=321 Ack=1 Win=65536 Len=40 TSval=1023809597 TSecr=1023808596"
"44","10.822754503","127.0.0.1","127.0.0.1","TCP","66","5001  >  49988 [ACK] Seq=1 Ack=361 Win=65536 Len=0 TSval=1023809597 TSecr=1023809597"
"45","11.823214029","127.0.0.1","127.0.0.1","TCP","106","49988  >  5001 [PSH, ACK] Seq=361 Ack=1 Win=65536 Len=40 TSval=1023810597 TSecr=1023809597"
"46","11.823320452","127.0.0.1","127.0.0.1","TCP","66","5001  >  49988 [ACK] Seq=1 Ack=401 Win=65536 Len=0 TSval=1023810598 TSecr=1023810597"
"47","12.823827093","127.0.0.1","127.0.0.1","TCP","106","49988  >  5001 [PSH, ACK] Seq=401 Ack=1 Win=65536 Len=40 TSval=1023811598 TSecr=1023810598"
"48","12.823865165","127.0.0.1","127.0.0.1","TCP","66","5001  >  49988 [ACK] Seq=1 Ack=441 Win=65536 Len=0 TSval=1023811598 TSecr=1023811598"
"49","13.824251734","127.0.0.1","127.0.0.1","TCP","106","49988  >  5001 [PSH, ACK] Seq=441 Ack=1 Win=65536 Len=40 TSval=1023812598 TSecr=1023811598"
"50","13.824300402","127.0.0.1","127.0.0.1","TCP","66","5001  >  49988 [ACK] Seq=1 Ack=481 Win=65536 Len=0 TSval=1023812598 TSecr=1023812598"
"51","14.824685045","127.0.0.1","127.0.0.1","TCP","106","49988  >  5001 [PSH, ACK] Seq=481 Ack=1 Win=65536 Len=40 TSval=1023813599 TSecr=1023812598"
"52","14.824705894","127.0.0.1","127.0.0.1","TCP","66","5001  >  49988 [ACK] Seq=1 Ack=521 Win=65536 Len=0 TSval=1023813599 TSecr=1023813599"
"53","15.825144859","127.0.0.1","127.0.0.1","TCP","106","49988  >  5001 [PSH, ACK] Seq=521 Ack=1 Win=65536 Len=40 TSval=1023814599 TSecr=1023813599"
"54","15.825189290","127.0.0.1","127.0.0.1","TCP","66","5001  >  49988 [ACK] Seq=1 Ack=561 Win=65536 Len=0 TSval=1023814599 TSecr=1023814599"
"55","16.825728249","127.0.0.1","127.0.0.1","TCP","106","49988  >  5001 [PSH, ACK] Seq=561 Ack=1 Win=65536 Len=40 TSval=1023815600 TSecr=1023814599"
"56","16.825769048","127.0.0.1","127.0.0.1","TCP","66","5001  >  49988 [ACK] Seq=1 Ack=601 Win=65536 Len=0 TSval=1023815600 TSecr=1023815600"
"57","17.826217536","127.0.0.1","127.0.0.1","TCP","106","49988  >  5001 [PSH, ACK] Seq=601 Ack=1 Win=65536 Len=40 TSval=1023816600 TSecr=1023815600"
"58","17.826254668","127.0.0.1","127.0.0.1","TCP","66","5001  >  49988 [ACK] Seq=1 Ack=641 Win=65536 Len=0 TSval=1023816600 TSecr=1023816600"
"59","18.826646256","127.0.0.1","127.0.0.1","TCP","106","49988  >  5001 [PSH, ACK] Seq=641 Ack=1 Win=65536 Len=40 TSval=1023817601 TSecr=1023816600"
"60","18.826672396","127.0.0.1","127.0.0.1","TCP","66","5001  >  49988 [ACK] Seq=1 Ack=681 Win=65536 Len=0 TSval=1023817601 TSecr=1023817601"
"61","19.827062477","127.0.0.1","127.0.0.1","TCP","106","49988  >  5001 [PSH, ACK] Seq=681 Ack=1 Win=65536 Len=40 TSval=1023818601 TSecr=1023817601"
"62","19.827095032","127.0.0.1","127.0.0.1","TCP","66","5001  >  49988 [ACK] Seq=1 Ack=721 Win=65536 Len=0 TSval=1023818601 TSecr=1023818601"
"63","20.827561551","127.0.0.1","127.0.0.1","TCP","106","49988  >  5001 [PSH, ACK] Seq=721 Ack=1 Win=65536 Len=40 TSval=1023819602 TSecr=1023818601"
"64","20.827600283","127.0.0.1","127.0.0.1","TCP","66","5001  >  49988 [ACK] Seq=1 Ack=761 Win=65536 Len=0 TSval=1023819602 TSecr=1023819602"
"65","21.828103422","127.0.0.1","127.0.0.1","TCP","106","49988  >  5001 [PSH, ACK] Seq=761 Ack=1 Win=65536 Len=40 TSval=1023820602 TSecr=1023819602"
"66","21.828141576","127.0.0.1","127.0.0.1","TCP","66","5001  >  49988 [ACK] Seq=1 Ack=801 Win=65536 Len=0 TSval=1023820602 TSecr=1023820602"
"67","22.828588784","127.0.0.1","127.0.0.1","TCP","106","49988  >  5001 [PSH, ACK] Seq=801 Ack=1 Win=65536 Len=40 TSval=1023821603 TSecr=1023820602"
"68","22.828627732","127.0.0.1","127.0.0.1","TCP","66","5001  >  49988 [ACK] Seq=1 Ack=841 Win=65536 Len=0 TSval=1023821603 TSecr=1023821603"
"69","23.828974600","127.0.0.1","127.0.0.1","TCP","106","49988  >  5001 [PSH, ACK] Seq=841 Ack=1 Win=65536 Len=40 TSval=1023822603 TSecr=1023821603"
"70","23.828997293","127.0.0.1","127.0.0.1","TCP","66","5001  >  49988 [ACK] Seq=1 Ack=881 Win=65536 Len=0 TSval=1023822603 TSecr=1023822603"
"71","24.829447232","127.0.0.1","127.0.0.1","TCP","106","49988  >  5001 [PSH, ACK] Seq=881 Ack=1 Win=65536 Len=40 TSval=1023823604 TSecr=1023822603"
"72","24.829487597","127.0.0.1","127.0.0.1","TCP","66","5001  >  49988 [ACK] Seq=1 Ack=921 Win=65536 Len=0 TSval=1023823604 TSecr=1023823604"
"73","25.829955450","127.0.0.1","127.0.0.1","TCP","106","49988  >  5001 [PSH, ACK] Seq=921 Ack=1 Win=65536 Len=40 TSval=1023824604 TSecr=1023823604"
"74","25.829992937","127.0.0.1","127.0.0.1","TCP","66","5001  >  49988 [ACK] Seq=1 Ack=961 Win=65536 Len=0 TSval=1023824604 TSecr=1023824604"
"75","26.830486648","127.0.0.1","127.0.0.1","TCP","106","49988  >  5001 [PSH, ACK] Seq=961 Ack=1 Win=65536 Len=40 TSval=1023825605 TSecr=1023824604"
"76","26.830527931","127.0.0.1","127.0.0.1","TCP","66","5001  >  49988 [ACK] Seq=1 Ack=1001 Win=65536 Len=0 TSval=1023825605 TSecr=1023825605"
"77","27.830975305","127.0.0.1","127.0.0.1","TCP","106","49988  >  5001 [PSH, ACK] Seq=1001 Ack=1 Win=65536 Len=40 TSval=1023826605 TSecr=1023825605"
"78","27.831015232","127.0.0.1","127.0.0.1","TCP","66","5001  >  49988 [ACK] Seq=1 Ack=1041 Win=65536 Len=0 TSval=1023826605 TSecr=1023826605"
"79","28.831416821","127.0.0.1","127.0.0.1","TCP","106","49988  >  5001 [PSH, ACK] Seq=1041 Ack=1 Win=65536 Len=40 TSval=1023827606 TSecr=1023826605"
"80","28.831439237","127.0.0.1","127.0.0.1","TCP","66","5001  >  49988 [ACK] Seq=1 Ack=1081 Win=65536 Len=0 TSval=1023827606 TSecr=1023827606"
"81","29.831993637","127.0.0.1","127.0.0.1","TCP","106","49988  >  5001 [PSH, ACK] Seq=1081 Ack=1 Win=65536 Len=40 TSval=1023828606 TSecr=1023827606"
"82","29.832041841","127.0.0.1","127.0.0.1","TCP","66","5001  >  49988 [ACK] Seq=1 Ack=1121 Win=65536 Len=0 TSval=1023828606 TSecr=1023828606"
"83","30.832616818","127.0.0.1","127.0.0.1","TCP","106","49988  >  5001 [PSH, ACK] Seq=1121 Ack=1 Win=65536 Len=40 TSval=1023829607 TSecr=1023828606"
"84","30.832661329","127.0.0.1","127.0.0.1","TCP","66","5001  >  49988 [ACK] Seq=1 Ack=1161 Win=65536 Len=0 TSval=1023829607 TSecr=1023829607"
"85","31.833202537","127.0.0.1","127.0.0.1","TCP","106","49988  >  5001 [PSH, ACK] Seq=1161 Ack=1 Win=65536 Len=40 TSval=1023830607 TSecr=1023829607"
"86","31.833243870","127.0.0.1","127.0.0.1","TCP","66","5001  >  49988 [ACK] Seq=1 Ack=1201 Win=65536 Len=0 TSval=1023830607 TSecr=1023830607"
"87","32.833816213","127.0.0.1","127.0.0.1","TCP","106","49988  >  5001 [PSH, ACK] Seq=1201 Ack=1 Win=65536 Len=40 TSval=1023831608 TSecr=1023830607"
"88","32.833845012","127.0.0.1","127.0.0.1","TCP","66","5001  >  49988 [ACK] Seq=1 Ack=1241 Win=65536 Len=0 TSval=1023831608 TSecr=1023831608"
"89","33.834246481","127.0.0.1","127.0.0.1","TCP","106","49988  >  5001 [PSH, ACK] Seq=1241 Ack=1 Win=65536 Len=40 TSval=1023832608 TSecr=1023831608"
"90","33.834277122","127.0.0.1","127.0.0.1","TCP","66","5001  >  49988 [ACK] Seq=1 Ack=1281 Win=65536 Len=0 TSval=1023832608 TSecr=1023832608"
"91","34.834766827","127.0.0.1","127.0.0.1","TCP","106","49988  >  5001 [PSH, ACK] Seq=1281 Ack=1 Win=65536 Len=40 TSval=1023833609 TSecr=1023832608"
"92","34.834809470","127.0.0.1","127.0.0.1","TCP","66","5001  >  49988 [ACK] Seq=1 Ack=1321 Win=65536 Len=0 TSval=1023833609 TSecr=1023833609"
"93","35.835411322","127.0.0.1","127.0.0.1","TCP","106","49988  >  5001 [PSH, ACK] Seq=1321 Ack=1 Win=65536 Len=40 TSval=1023834610 TSecr=1023833609"
"94","35.835454110","127.0.0.1","127.0.0.1","TCP","66","5001  >  49988 [ACK] Seq=1 Ack=1361 Win=65536 Len=0 TSval=1023834610 TSecr=1023834610"
"95","36.835998536","127.0.0.1","127.0.0.1","TCP","106","49988  >  5001 [PSH, ACK] Seq=1361 Ack=1 Win=65536 Len=40 TSval=1023835610 TSecr=1023834610"
"96","36.836043626","127.0.0.1","127.0.0.1","TCP","66","5001  >  49988 [ACK] Seq=1 Ack=1401 Win=65536 Len=0 TSval=1023835610 TSecr=1023835610"
"97","37.836568452","127.0.0.1","127.0.0.1","TCP","106","49988  >  5001 [PSH, ACK] Seq=1401 Ack=1 Win=65536 Len=40 TSval=1023836611 TSecr=1023835610"
"98","37.836606004","127.0.0.1","127.0.0.1","TCP","66","5001  >  49988 [ACK] Seq=1 Ack=1441 Win=65536 Len=0 TSval=1023836611 TSecr=1023836611"
"99","38.836842541","127.0.0.1","127.0.0.1","TCP","106","49988  >  5001 [PSH, ACK] Seq=1441 Ack=1 Win=65536 Len=40 TSval=1023837611 TSecr=1023836611"
"100","38.836865713","127.0.0.1","127.0.0.1","TCP","66","5001  >  49988 [ACK] Seq=1 Ack=1481 Win=65536 Len=0 TSval=1023837611 TSecr=1023837611"
"101","39.837302087","127.0.0.1","127.0.0.1","TCP","106","49988  >  5001 [PSH, ACK] Seq=1481 Ack=1 Win=65536 Len=40 TSval=1023838611 TSecr=1023837611"
"102","39.837336380","127.0.0.1","127.0.0.1","TCP","66","5001  >  49988 [ACK] Seq=1 Ack=1521 Win=65536 Len=0 TSval=1023838612 TSecr=1023838611"
"103","40.837838115","127.0.0.1","127.0.0.1","TCP","106","49988  >  5001 [PSH, ACK] Seq=1521 Ack=1 Win=65536 Len=40 TSval=1023839612 TSecr=1023838612"
"104","40.837880283","127.0.0.1","127.0.0.1","TCP","66","5001  >  49988 [ACK] Seq=1 Ack=1561 Win=65536 Len=0 TSval=1023839612 TSecr=1023839612"
"105","41.838483476","127.0.0.1","127.0.0.1","TCP","106","49988  >  5001 [PSH, ACK] Seq=1561 Ack=1 Win=65536 Len=40 TSval=1023840613 TSecr=1023839612"
"106","41.838519430","127.0.0.1","127.0.0.1","TCP","66","5001  >  49988 [ACK] Seq=1 Ack=1601 Win=65536 Len=0 TSval=1023840613 TSecr=1023840613"
"107","42.839036150","127.0.0.1","127.0.0.1","TCP","106","49988  >  5001 [PSH, ACK] Seq=1601 Ack=1 Win=65536 Len=40 TSval=1023841613 TSecr=1023840613"
"108","42.839078370","127.0.0.1","127.0.0.1","TCP","66","5001  >  49988 [ACK] Seq=1 Ack=1641 Win=65536 Len=0 TSval=1023841613 TSecr=1023841613"
"109","43.839380148","127.0.0.1","127.0.0.1","TCP","106","49988  >  5001 [PSH, ACK] Seq=1641 Ack=1 Win=65536 Len=40 TSval=1023842614 TSecr=1023841613"
"110","43.839401598","127.0.0.1","127.0.0.1","TCP","66","5001  >  49988 [ACK] Seq=1 Ack=1681 Win=65536 Len=0 TSval=1023842614 TSecr=1023842614"
"111","44.839842243","127.0.0.1","127.0.0.1","TCP","106","49988  >  5001 [PSH, ACK] Seq=1681 Ack=1 Win=65536 Len=40 TSval=1023843614 TSecr=1023842614"
"112","44.839871761","127.0.0.1","127.0.0.1","TCP","66","5001  >  49988 [ACK] Seq=1 Ack=1721 Win=65536 Len=0 TSval=1023843614 TSecr=1023843614"
"113","45.840493392","127.0.0.1","127.0.0.1","TCP","106","49988  >  5001 [PSH, ACK] Seq=1721 Ack=1 Win=65536 Len=40 TSval=1023844615 TSecr=1023843614"
"114","45.840540728","127.0.0.1","127.0.0.1","TCP","66","5001  >  49988 [ACK] Seq=1 Ack=1761 Win=65536 Len=0 TSval=1023844615 TSecr=1023844615"
"115","46.841053201","127.0.0.1","127.0.0.1","TCP","106","49988  >  5001 [PSH, ACK] Seq=1761 Ack=1 Win=65536 Len=40 TSval=1023845615 TSecr=1023844615"
"116","46.841096260","127.0.0.1","127.0.0.1","TCP","66","5001  >  49988 [ACK] Seq=1 Ack=1801 Win=65536 Len=0 TSval=1023845615 TSecr=1023845615"
"117","47.841707402","127.0.0.1","127.0.0.1","TCP","106","49988  >  5001 [PSH, ACK] Seq=1801 Ack=1 Win=65536 Len=40 TSval=1023846616 TSecr=1023845615"
"118","47.841758317","127.0.0.1","127.0.0.1","TCP","66","5001  >  49988 [ACK] Seq=1 Ack=1841 Win=65536 Len=0 TSval=1023846616 TSecr=1023846616"
"121","48.842058075","127.0.0.1","127.0.0.1","TCP","106","49988  >  5001 [PSH, ACK] Seq=1841 Ack=1 Win=65536 Len=40 TSval=1023847616 TSecr=1023846616"
"122","48.842079129","127.0.0.1","127.0.0.1","TCP","66","5001  >  49988 [ACK] Seq=1 Ack=1881 Win=65536 Len=0 TSval=1023847616 TSecr=1023847616"
"125","49.842367268","127.0.0.1","127.0.0.1","TCP","106","49988  >  5001 [PSH, ACK] Seq=1881 Ack=1 Win=65536 Len=40 TSval=1023848617 TSecr=1023847616"
"126","49.842389885","127.0.0.1","127.0.0.1","TCP","66","5001  >  49988 [ACK] Seq=1 Ack=1921 Win=65536 Len=0 TSval=1023848617 TSecr=1023848617"
"127","50.842888358","127.0.0.1","127.0.0.1","TCP","106","49988  >  5001 [PSH, ACK] Seq=1921 Ack=1 Win=65536 Len=40 TSval=1023849617 TSecr=1023848617"
"128","50.842936875","127.0.0.1","127.0.0.1","TCP","66","5001  >  49988 [ACK] Seq=1 Ack=1961 Win=65536 Len=0 TSval=1023849617 TSecr=1023849617"
"129","51.843566840","127.0.0.1","127.0.0.1","TCP","106","49988  >  5001 [PSH, ACK] Seq=1961 Ack=1 Win=65536 Len=40 TSval=1023850618 TSecr=1023849617"
"130","51.843612278","127.0.0.1","127.0.0.1","TCP","66","5001  >  49988 [ACK] Seq=1 Ack=2001 Win=65536 Len=0 TSval=1023850618 TSecr=1023850618"
"131","52.844097079","127.0.0.1","127.0.0.1","TCP","106","49988  >  5001 [PSH, ACK] Seq=2001 Ack=1 Win=65536 Len=40 TSval=1023851618 TSecr=1023850618"
"132","52.844135832","127.0.0.1","127.0.0.1","TCP","66","5001  >  49988 [ACK] Seq=1 Ack=2041 Win=65536 Len=0 TSval=1023851618 TSecr=1023851618"
"133","53.844417159","127.0.0.1","127.0.0.1","TCP","106","49988  >  5001 [PSH, ACK] Seq=2041 Ack=1 Win=65536 Len=40 TSval=1023852619 TSecr=1023851618"
"134","53.844440862","127.0.0.1","127.0.0.1","TCP","66","5001  >  49988 [ACK] Seq=1 Ack=2081 Win=65536 Len=0 TSval=1023852619 TSecr=1023852619"
"135","54.844956884","127.0.0.1","127.0.0.1","TCP","106","49988  >  5001 [PSH, ACK] Seq=2081 Ack=1 Win=65536 Len=40 TSval=1023853619 TSecr=1023852619"
"136","54.845001985","127.0.0.1","127.0.0.1","TCP","66","5001  >  49988 [ACK] Seq=1 Ack=2121 Win=65536 Len=0 TSval=1023853619 TSecr=1023853619"
"137","55.845526858","127.0.0.1","127.0.0.1","TCP","106","49988  >  5001 [PSH, ACK] Seq=2121 Ack=1 Win=65536 Len=40 TSval=1023854620 TSecr=1023853619"
"138","55.845568716","127.0.0.1","127.0.0.1","TCP","66","5001  >  49988 [ACK] Seq=1 Ack=2161 Win=65536 Len=0 TSval=1023854620 TSecr=1023854620"
"139","56.846085039","127.0.0.1","127.0.0.1","TCP","106","49988  >  5001 [PSH, ACK] Seq=2161 Ack=1 Win=65536 Len=40 TSval=1023855620 TSecr=1023854620"
"140","56.846126510","127.0.0.1","127.0.0.1","TCP","66","5001  >  49988 [ACK] Seq=1 Ack=2201 Win=65536 Len=0 TSval=1023855620 TSecr=1023855620"
"141","57.846580210","127.0.0.1","127.0.0.1","TCP","106","49988  >  5001 [PSH, ACK] Seq=2201 Ack=1 Win=65536 Len=40 TSval=1023856621 TSecr=1023855620"
"142","57.846613178","127.0.0.1","127.0.0.1","TCP","66","5001  >  49988 [ACK] Seq=1 Ack=2241 Win=65536 Len=0 TSval=1023856621 TSecr=1023856621"
"143","58.846877784","127.0.0.1","127.0.0.1","TCP","106","49988  >  5001 [PSH, ACK] Seq=2241 Ack=1 Win=65536 Len=40 TSval=1023857621 TSecr=1023856621"
"144","58.846901099","127.0.0.1","127.0.0.1","TCP","66","5001  >  49988 [ACK] Seq=1 Ack=2281 Win=65536 Len=0 TSval=1023857621 TSecr=1023857621"
"145","59.847483802","127.0.0.1","127.0.0.1","TCP","106","49988  >  5001 [PSH, ACK] Seq=2281 Ack=1 Win=65536 Len=40 TSval=1023858622 TSecr=1023857621"
"146","59.847526918","127.0.0.1","127.0.0.1","TCP","66","5001  >  49988 [ACK] Seq=1 Ack=2321 Win=65536 Len=0 TSval=1023858622 TSecr=1023858622"
"156","60.848042720","127.0.0.1","127.0.0.1","TCP","106","49988  >  5001 [PSH, ACK] Seq=2321 Ack=1 Win=65536 Len=40 TSval=1023859622 TSecr=1023858622"
"157","60.848085649","127.0.0.1","127.0.0.1","TCP","66","5001  >  49988 [ACK] Seq=1 Ack=2361 Win=65536 Len=0 TSval=1023859622 TSecr=1023859622"
"158","61.848655301","127.0.0.1","127.0.0.1","TCP","106","49988  >  5001 [PSH, ACK] Seq=2361 Ack=1 Win=65536 Len=40 TSval=1023860623 TSecr=1023859622"
"159","61.848700211","127.0.0.1","127.0.0.1","TCP","66","5001  >  49988 [ACK] Seq=1 Ack=2401 Win=65536 Len=0 TSval=1023860623 TSecr=1023860623"
"160","62.849301330","127.0.0.1","127.0.0.1","TCP","106","49988  >  5001 [PSH, ACK] Seq=2401 Ack=1 Win=65536 Len=40 TSval=1023861623 TSecr=1023860623"
"161","62.849344682","127.0.0.1","127.0.0.1","TCP","66","5001  >  49988 [ACK] Seq=1 Ack=2441 Win=65536 Len=0 TSval=1023861624 TSecr=1023861623"
"162","63.849692191","127.0.0.1","127.0.0.1","TCP","106","49988  >  5001 [PSH, ACK] Seq=2441 Ack=1 Win=65536 Len=40 TSval=1023862624 TSecr=1023861624"
"163","63.849712747","127.0.0.1","127.0.0.1","TCP","66","5001  >  49988 [ACK] Seq=1 Ack=2481 Win=65536 Len=0 TSval=1023862624 TSecr=1023862624"
"164","64.850222508","127.0.0.1","127.0.0.1","TCP","106","49988  >  5001 [PSH, ACK] Seq=2481 Ack=1 Win=65536 Len=40 TSval=1023863624 TSecr=1023862624"
"165","64.850291478","127.0.0.1","127.0.0.1","TCP","66","5001  >  49988 [ACK] Seq=1 Ack=2521 Win=65536 Len=0 TSval=1023863624 TSecr=1023863624"
"166","65.850796236","127.0.0.1","127.0.0.1","TCP","106","49988  >  5001 [PSH, ACK] Seq=2521 Ack=1 Win=65536 Len=40 TSval=1023864625 TSecr=1023863624"
"167","65.850832710","127.0.0.1","127.0.0.1","TCP","66","5001  >  49988 [ACK] Seq=1 Ack=2561 Win=65536 Len=0 TSval=1023864625 TSecr=1023864625"
"168","66.851376000","127.0.0.1","127.0.0.1","TCP","106","49988  >  5001 [PSH, ACK] Seq=2561 Ack=1 Win=65536 Len=40 TSval=1023865626 TSecr=1023864625"
"169","66.851434180","127.0.0.1","127.0.0.1","TCP","66","5001  >  49988 [ACK] Seq=1 Ack=2601 Win=65536 Len=0 TSval=1023865626 TSecr=1023865626"
"175","67.852012143","127.0.0.1","127.0.0.1","TCP","106","49988  >  5001 [PSH, ACK] Seq=2601 Ack=1 Win=65536 Len=40 TSval=1023866626 TSecr=1023865626"
"176","67.852057526","127.0.0.1","127.0.0.1","TCP","66","5001  >  49988 [ACK] Seq=1 Ack=2641 Win=65536 Len=0 TSval=1023866626 TSecr=1023866626"
"177","68.852536296","127.0.0.1","127.0.0.1","TCP","106","49988  >  5001 [PSH, ACK] Seq=2641 Ack=1 Win=65536 Len=40 TSval=1023867627 TSecr=1023866626"
"178","68.852560128","127.0.0.1","127.0.0.1","TCP","66","5001  >  49988 [ACK] Seq=1 Ack=2681 Win=65536 Len=0 TSval=1023867627 TSecr=1023867627"
"179","69.852997021","127.0.0.1","127.0.0.1","TCP","106","49988  >  5001 [PSH, ACK] Seq=2681 Ack=1 Win=65536 Len=40 TSval=1023868627 TSecr=1023867627"
"180","69.853037926","127.0.0.1","127.0.0.1","TCP","66","5001  >  49988 [ACK] Seq=1 Ack=2721 Win=65536 Len=0 TSval=1023868627 TSecr=1023868627"
"181","70.853499413","127.0.0.1","127.0.0.1","TCP","106","49988  >  5001 [PSH, ACK] Seq=2721 Ack=1 Win=65536 Len=40 TSval=1023869628 TSecr=1023868627"
"182","70.853531583","127.0.0.1","127.0.0.1","TCP","66","5001  >  49988 [ACK] Seq=1 Ack=2761 Win=65536 Len=0 TSval=1023869628 TSecr=1023869628"
"183","71.853967989","127.0.0.1","127.0.0.1","TCP","106","49988  >  5001 [PSH, ACK] Seq=2761 Ack=1 Win=65536 Len=40 TSval=1023870628 TSecr=1023869628"
"184","71.854009210","127.0.0.1","127.0.0.1","TCP","66","5001  >  49988 [ACK] Seq=1 Ack=2801 Win=65536 Len=0 TSval=1023870628 TSecr=1023870628"
"185","72.854449630","127.0.0.1","127.0.0.1","TCP","106","49988  >  5001 [PSH, ACK] Seq=2801 Ack=1 Win=65536 Len=40 TSval=1023871629 TSecr=1023870628"
"186","72.854487036","127.0.0.1","127.0.0.1","TCP","66","5001  >  49988 [ACK] Seq=1 Ack=2841 Win=65536 Len=0 TSval=1023871629 TSecr=1023871629"
"187","73.854713622","127.0.0.1","127.0.0.1","TCP","106","49988  >  5001 [PSH, ACK] Seq=2841 Ack=1 Win=65536 Len=40 TSval=1023872629 TSecr=1023871629"
"188","73.854732098","127.0.0.1","127.0.0.1","TCP","66","5001  >  49988 [ACK] Seq=1 Ack=2881 Win=65536 Len=0 TSval=1023872629 TSecr=1023872629"
"189","74.855129491","127.0.0.1","127.0.0.1","TCP","106","49988  >  5001 [PSH, ACK] Seq=2881 Ack=1 Win=65536 Len=40 TSval=1023873629 TSecr=1023872629"
"190","74.855172336","127.0.0.1","127.0.0.1","TCP","66","5001  >  49988 [ACK] Seq=1 Ack=2921 Win=65536 Len=0 TSval=1023873629 TSecr=1023873629"
"191","75.855660939","127.0.0.1","127.0.0.1","TCP","106","49988  >  5001 [PSH, ACK] Seq=2921 Ack=1 Win=65536 Len=40 TSval=1023874630 TSecr=1023873629"
"192","75.855693934","127.0.0.1","127.0.0.1","TCP","66","5001  >  49988 [ACK] Seq=1 Ack=2961 Win=65536 Len=0 TSval=1023874630 TSecr=1023874630"
"193","76.856122156","127.0.0.1","127.0.0.1","TCP","106","49988  >  5001 [PSH, ACK] Seq=2961 Ack=1 Win=65536 Len=40 TSval=1023875630 TSecr=1023874630"
"194","76.856160349","127.0.0.1","127.0.0.1","TCP","66","5001  >  49988 [ACK] Seq=1 Ack=3001 Win=65536 Len=0 TSval=1023875630 TSecr=1023875630"
"195","77.856607362","127.0.0.1","127.0.0.1","TCP","106","49988  >  5001 [PSH, ACK] Seq=3001 Ack=1 Win=65536 Len=40 TSval=1023876631 TSecr=1023875630"
"196","77.856645075","127.0.0.1","127.0.0.1","TCP","66","5001  >  49988 [ACK] Seq=1 Ack=3041 Win=65536 Len=0 TSval=1023876631 TSecr=1023876631"
"197","78.856904281","127.0.0.1","127.0.0.1","TCP","106","49988  >  5001 [PSH, ACK] Seq=3041 Ack=1 Win=65536 Len=40 TSval=1023877631 TSecr=1023876631"
"198","78.856926742","127.0.0.1","127.0.0.1","TCP","66","5001  >  49988 [ACK] Seq=1 Ack=3081 Win=65536 Len=0 TSval=1023877631 TSecr=1023877631"
"199","79.857312479","127.0.0.1","127.0.0.1","TCP","106","49988  >  5001 [PSH, ACK] Seq=3081 Ack=1 Win=65536 Len=40 TSval=1023878631 TSecr=1023877631"
"200","79.857354778","127.0.0.1","127.0.0.1","TCP","66","5001  >  49988 [ACK] Seq=1 Ack=3121 Win=65536 Len=0 TSval=1023878632 TSecr=1023878631"
"201","80.857647167","127.0.0.1","127.0.0.1","TCP","106","49988  >  5001 [PSH, ACK] Seq=3121 Ack=1 Win=65536 Len=40 TSval=1023879632 TSecr=1023878632"
"202","80.857675995","127.0.0.1","127.0.0.1","TCP","66","5001  >  49988 [ACK] Seq=1 Ack=3161 Win=65536 Len=0 TSval=1023879632 TSecr=1023879632"
"203","81.857965463","127.0.0.1","127.0.0.1","TCP","106","49988  >  5001 [PSH, ACK] Seq=3161 Ack=1 Win=65536 Len=40 TSval=1023880632 TSecr=1023879632"
"204","81.857997313","127.0.0.1","127.0.0.1","TCP","66","5001  >  49988 [ACK] Seq=1 Ack=3201 Win=65536 Len=0 TSval=1023880632 TSecr=1023880632"
"205","82.858492289","127.0.0.1","127.0.0.1","TCP","106","49988  >  5001 [PSH, ACK] Seq=3201 Ack=1 Win=65536 Len=40 TSval=1023881633 TSecr=1023880632"
"206","82.858529796","127.0.0.1","127.0.0.1","TCP","66","5001  >  49988 [ACK] Seq=1 Ack=3241 Win=65536 Len=0 TSval=1023881633 TSecr=1023881633"
"207","83.858788266","127.0.0.1","127.0.0.1","TCP","106","49988  >  5001 [PSH, ACK] Seq=3241 Ack=1 Win=65536 Len=40 TSval=1023882633 TSecr=1023881633"
"208","83.858807854","127.0.0.1","127.0.0.1","TCP","66","5001  >  49988 [ACK] Seq=1 Ack=3281 Win=65536 Len=0 TSval=1023882633 TSecr=1023882633"
"209","84.859222551","127.0.0.1","127.0.0.1","TCP","106","49988  >  5001 [PSH, ACK] Seq=3281 Ack=1 Win=65536 Len=40 TSval=1023883633 TSecr=1023882633"
"210","84.859264128","127.0.0.1","127.0.0.1","TCP","66","5001  >  49988 [ACK] Seq=1 Ack=3321 Win=65536 Len=0 TSval=1023883633 TSecr=1023883633"
"211","85.859809058","127.0.0.1","127.0.0.1","TCP","106","49988  >  5001 [PSH, ACK] Seq=3321 Ack=1 Win=65536 Len=40 TSval=1023884634 TSecr=1023883633"
"212","85.859846896","127.0.0.1","127.0.0.1","TCP","66","5001  >  49988 [ACK] Seq=1 Ack=3361 Win=65536 Len=0 TSval=1023884634 TSecr=1023884634"
"213","86.860319500","127.0.0.1","127.0.0.1","TCP","106","49988  >  5001 [PSH, ACK] Seq=3361 Ack=1 Win=65536 Len=40 TSval=1023885634 TSecr=1023884634"
"214","86.860361400","127.0.0.1","127.0.0.1","TCP","66","5001  >  49988 [ACK] Seq=1 Ack=3401 Win=65536 Len=0 TSval=1023885635 TSecr=1023885634"
"215","87.860702906","127.0.0.1","127.0.0.1","TCP","106","49988  >  5001 [PSH, ACK] Seq=3401 Ack=1 Win=65536 Len=40 TSval=1023886635 TSecr=1023885635"
"216","87.860741878","127.0.0.1","127.0.0.1","TCP","66","5001  >  49988 [ACK] Seq=1 Ack=3441 Win=65536 Len=0 TSval=1023886635 TSecr=1023886635"
"217","88.861012466","127.0.0.1","127.0.0.1","TCP","106","49988  >  5001 [PSH, ACK] Seq=3441 Ack=1 Win=65536 Len=40 TSval=1023887635 TSecr=1023886635"
"218","88.861033957","127.0.0.1","127.0.0.1","TCP","66","5001  >  49988 [ACK] Seq=1 Ack=3481 Win=65536 Len=0 TSval=1023887635 TSecr=1023887635"
"219","89.861495517","127.0.0.1","127.0.0.1","TCP","106","49988  >  5001 [PSH, ACK] Seq=3481 Ack=1 Win=65536 Len=40 TSval=1023888636 TSecr=1023887635"
"220","89.861537402","127.0.0.1","127.0.0.1","TCP","66","5001  >  49988 [ACK] Seq=1 Ack=3521 Win=65536 Len=0 TSval=1023888636 TSecr=1023888636"
"221","90.862029534","127.0.0.1","127.0.0.1","TCP","106","49988  >  5001 [PSH, ACK] Seq=3521 Ack=1 Win=65536 Len=40 TSval=1023889636 TSecr=1023888636"
"222","90.862059444","127.0.0.1","127.0.0.1","TCP","66","5001  >  49988 [ACK] Seq=1 Ack=3561 Win=65536 Len=0 TSval=1023889636 TSecr=1023889636"
"223","91.862571334","127.0.0.1","127.0.0.1","TCP","106","49988  >  5001 [PSH, ACK] Seq=3561 Ack=1 Win=65536 Len=40 TSval=1023890637 TSecr=1023889636"
"224","91.862611134","127.0.0.1","127.0.0.1","TCP","66","5001  >  49988 [ACK] Seq=1 Ack=3601 Win=65536 Len=0 TSval=1023890637 TSecr=1023890637"
"225","92.863106850","127.0.0.1","127.0.0.1","TCP","106","49988  >  5001 [PSH, ACK] Seq=3601 Ack=1 Win=65536 Len=40 TSval=1023891637 TSecr=1023890637"
"226","92.863146806","127.0.0.1","127.0.0.1","TCP","66","5001  >  49988 [ACK] Seq=1 Ack=3641 Win=65536 Len=0 TSval=1023891637 TSecr=1023891637"
"227","93.863353553","127.0.0.1","127.0.0.1","TCP","106","49988  >  5001 [PSH, ACK] Seq=3641 Ack=1 Win=65536 Len=40 TSval=1023892638 TSecr=1023891637"
"228","93.863376209","127.0.0.1","127.0.0.1","TCP","66","5001  >  49988 [ACK] Seq=1 Ack=3681 Win=65536 Len=0 TSval=1023892638 TSecr=1023892638"
"229","94.863807458","127.0.0.1","127.0.0.1","TCP","106","49988  >  5001 [PSH, ACK] Seq=3681 Ack=1 Win=65536 Len=40 TSval=1023893638 TSecr=1023892638"
"230","94.863850423","127.0.0.1","127.0.0.1","TCP","66","5001  >  49988 [ACK] Seq=1 Ack=3721 Win=65536 Len=0 TSval=1023893638 TSecr=1023893638"
"231","95.864388887","127.0.0.1","127.0.0.1","TCP","106","49988  >  5001 [PSH, ACK] Seq=3721 Ack=1 Win=65536 Len=40 TSval=1023894639 TSecr=1023893638"
"232","95.864485536","127.0.0.1","127.0.0.1","TCP","66","5001  >  49988 [ACK] Seq=1 Ack=3761 Win=65536 Len=0 TSval=1023894639 TSecr=1023894639"
"233","96.864855959","127.0.0.1","127.0.0.1","TCP","106","49988  >  5001 [PSH, ACK] Seq=3761 Ack=1 Win=65536 Len=40 TSval=1023895639 TSecr=1023894639"
"234","96.864880558","127.0.0.1","127.0.0.1","TCP","66","5001  >  49988 [ACK] Seq=1 Ack=3801 Win=65536 Len=0 TSval=1023895639 TSecr=1023895639"
"235","97.865346112","127.0.0.1","127.0.0.1","TCP","106","49988  >  5001 [PSH, ACK] Seq=3801 Ack=1 Win=65536 Len=40 TSval=1023896640 TSecr=1023895639"
"236","97.865373922","127.0.0.1","127.0.0.1","TCP","66","5001  >  49988 [ACK] Seq=1 Ack=3841 Win=65536 Len=0 TSval=1023896640 TSecr=1023896640"
"237","98.865762679","127.0.0.1","127.0.0.1","TCP","106","49988  >  5001 [PSH, ACK] Seq=3841 Ack=1 Win=65536 Len=40 TSval=1023897640 TSecr=1023896640"
"238","98.865781781","127.0.0.1","127.0.0.1","TCP","66","5001  >  49988 [ACK] Seq=1 Ack=3881 Win=65536 Len=0 TSval=1023897640 TSecr=1023897640"
"239","99.866154536","127.0.0.1","127.0.0.1","TCP","106","49988  >  5001 [PSH, ACK] Seq=3881 Ack=1 Win=65536 Len=40 TSval=1023898640 TSecr=1023897640"
"240","99.866183761","127.0.0.1","127.0.0.1","TCP","66","5001  >  49988 [ACK] Seq=1 Ack=3921 Win=65536 Len=0 TSval=1023898640 TSecr=1023898640"
"241","100.866612507","127.0.0.1","127.0.0.1","TCP","106","49988  >  5001 [PSH, ACK] Seq=3921 Ack=1 Win=65536 Len=40 TSval=1023899641 TSecr=1023898640"
"242","100.866640107","127.0.0.1","127.0.0.1","TCP","66","5001  >  49988 [ACK] Seq=1 Ack=3961 Win=65536 Len=0 TSval=1023899641 TSecr=1023899641"
"243","101.867095829","127.0.0.1","127.0.0.1","TCP","106","49988  >  5001 [PSH, ACK] Seq=3961 Ack=1 Win=65536 Len=40 TSval=1023900641 TSecr=1023899641"
"244","101.867125209","127.0.0.1","127.0.0.1","TCP","66","5001  >  49988 [ACK] Seq=1 Ack=4001 Win=65536 Len=0 TSval=1023900641 TSecr=1023900641"
"245","102.867588852","127.0.0.1","127.0.0.1","TCP","106","49988  >  5001 [PSH, ACK] Seq=4001 Ack=1 Win=65536 Len=40 TSval=1023901642 TSecr=1023900641"
"246","102.867622037","127.0.0.1","127.0.0.1","TCP","66","5001  >  49988 [ACK] Seq=1 Ack=4041 Win=65536 Len=0 TSval=1023901642 TSecr=1023901642"
"247","103.867938543","127.0.0.1","127.0.0.1","TCP","106","49988  >  5001 [PSH, ACK] Seq=4041 Ack=1 Win=65536 Len=40 TSval=1023902642 TSecr=1023901642"
"248","103.867959811","127.0.0.1","127.0.0.1","TCP","66","5001  >  49988 [ACK] Seq=1 Ack=4081 Win=65536 Len=0 TSval=1023902642 TSecr=1023902642"
"249","104.868377175","127.0.0.1","127.0.0.1","TCP","82","49988  >  5001 [PSH, ACK] Seq=4081 Ack=1 Win=65536 Len=16 TSval=1023903643 TSecr=1023902642"
"250","104.868406532","127.0.0.1","127.0.0.1","TCP","66","5001  >  49988 [ACK] Seq=1 Ack=4097 Win=65536 Len=0 TSval=1023903643 TSecr=1023903643"
"251","105.868921625","127.0.0.1","127.0.0.1","TCP","66","49988  >  5001 [FIN, ACK] Seq=4097 Ack=1 Win=65536 Len=0 TSval=1023904643 TSecr=1023903643"
"252","105.869430513","127.0.0.1","127.0.0.1","TCP","66","5001  >  49988 [FIN, ACK] Seq=1 Ack=4098 Win=65536 Len=0 TSval=1023904644 TSecr=1023904643"
"253","105.869488938","127.0.0.1","127.0.0.1","TCP","66","49988  >  5001 [ACK] Seq=4098 Ack=2 Win=65536 Len=0 TSval=1023904644 TSecr=1023904644"
