"No.","Time","Source","Destination","Protocol","Length","Info"
"11","3.293405997","127.0.0.1","127.0.0.1","TCP","74","51240  >  5001 [SYN] Seq=0 Win=65495 Len=0 MSS=65495 SACK_PERM TSval=1026250886 TSecr=0 WS=128"
"12","3.293430286","127.0.0.1","127.0.0.1","TCP","74","5001  >  51240 [SYN, ACK] Seq=0 Ack=1 Win=65483 Len=0 MSS=65495 SACK_PERM TSval=1026250886 TSecr=1026250886 WS=128"
"13","3.293451408","127.0.0.1","127.0.0.1","TCP","66","51240  >  5001 [ACK] Seq=1 Ack=1 Win=65536 Len=0 TSval=1026250886 TSecr=1026250886"
"14","3.293549838","127.0.0.1","127.0.0.1","TCP","106","51240  >  5001 [PSH, ACK] Seq=1 Ack=1 Win=65536 Len=40 TSval=1026250886 TSecr=1026250886"
"15","3.293557299","127.0.0.1","127.0.0.1","TCP","66","5001  >  51240 [ACK] Seq=1 Ack=41 Win=65536 Len=0 TSval=1026250886 TSecr=1026250886"
"24","4.293939692","127.0.0.1","127.0.0.1","TCP","106","51240  >  5001 [PSH, ACK] Seq=41 Ack=1 Win=65536 Len=40 TSval=1026251886 TSecr=1026250886"
"25","4.293989458","127.0.0.1","127.0.0.1","TCP","66","5001  >  51240 [ACK] Seq=1 Ack=81 Win=65536 Len=0 TSval=1026251887 TSecr=1026251886"
"34","5.294320007","127.0.0.1","127.0.0.1","TCP","106","51240  >  5001 [PSH, ACK] Seq=81 Ack=1 Win=65536 Len=40 TSval=1026252887 TSecr=1026251887"
"35","5.294349573","127.0.0.1","127.0.0.1","TCP","66","5001  >  51240 [ACK] Seq=1 Ack=121 Win=65536 Len=0 TSval=1026252887 TSecr=1026252887"
"37","6.294614046","127.0.0.1","127.0.0.1","TCP","106","51240  >  5001 [PSH, ACK] Seq=121 Ack=1 Win=65536 Len=40 TSval=1026253887 TSecr=1026252887"
"38","6.294636264","127.0.0.1","127.0.0.1","TCP","66","5001  >  51240 [ACK] Seq=1 Ack=161 Win=65536 Len=0 TSval=1026253887 TSecr=1026253887"
"39","7.294891070","127.0.0.1","127.0.0.1","TCP","106","51240  >  5001 [PSH, ACK] Seq=161 Ack=1 Win=65536 Len=40 TSval=1026254887 TSecr=1026253887"
"40","7.294916810","127.0.0.1","127.0.0.1","TCP","66","5001  >  51240 [ACK] Seq=1 Ack=201 Win=65536 Len=0 TSval=1026254887 TSecr=1026254887"
"45","8.295181791","127.0.0.1","127.0.0.1","TCP","106","51240  >  5001 [PSH, ACK] Seq=201 Ack=1 Win=65536 Len=40 TSval=1026255888 TSecr=1026254887"
"46","8.295207942","127.0.0.1","127.0.0.1","TCP","66","5001  >  51240 [ACK] Seq=1 Ack=241 Win=65536 Len=0 TSval=1026255888 TSecr=1026255888"
"47","9.295448649","127.0.0.1","127.0.0.1","TCP","106","51240  >  5001 [PSH, ACK] Seq=241 Ack=1 Win=65536 Len=40 TSval=1026256888 TSecr=1026255888"
"48","9.295477393","127.0.0.1","127.0.0.1","TCP","66","5001  >  51240 [ACK] Seq=1 Ack=281 Win=65536 Len=0 TSval=1026256888 TSecr=1026256888"
"49","10.295732481","127.0.0.1","127.0.0.1","TCP","106","51240  >  5001 [PSH, ACK] Seq=281 Ack=1 Win=65536 Len=40 TSval=1026257888 TSecr=1026256888"
"50","10.295753833","127.0.0.1","127.0.0.1","TCP","66","5001  >  51240 [ACK] Seq=1 Ack=321 Win=65536 Len=0 TSval=1026257888 TSecr=1026257888"
"51","11.296038418","127.0.0.1","127.0.0.1","TCP","106","51240  >  5001 [PSH, ACK] Seq=321 Ack=1 Win=65536 Len=40 TSval=1026258889 TSecr=1026257888"
"52","11.296063899","127.0.0.1","127.0.0.1","TCP","66","5001  >  51240 [ACK] Seq=1 Ack=361 Win=65536 Len=0 TSval=1026258889 TSecr=1026258889"
"53","12.296327006","127.0.0.1","127.0.0.1","TCP","106","51240  >  5001 [PSH, ACK] Seq=361 Ack=1 Win=65536 Len=40 TSval=1026259889 TSecr=1026258889"
"54","12.296350178","127.0.0.1","127.0.0.1","TCP","66","5001  >  51240 [ACK] Seq=1 Ack=401 Win=65536 Len=0 TSval=1026259889 TSecr=1026259889"
"55","13.296677451","127.0.0.1","127.0.0.1","TCP","106","51240  >  5001 [PSH, ACK] Seq=401 Ack=1 Win=65536 Len=40 TSval=1026260889 TSecr=1026259889"
"56","13.296701119","127.0.0.1","127.0.0.1","TCP","66","5001  >  51240 [ACK] Seq=1 Ack=441 Win=65536 Len=0 TSval=1026260889 TSecr=1026260889"
"62","14.296925826","127.0.0.1","127.0.0.1","TCP","106","51240  >  5001 [PSH, ACK] Seq=441 Ack=1 Win=65536 Len=40 TSval=1026261889 TSecr=1026260889"
"63","14.296965585","127.0.0.1","127.0.0.1","TCP","66","5001  >  51240 [ACK] Seq=1 Ack=481 Win=65536 Len=0 TSval=1026261889 TSecr=1026261889"
"64","15.297232183","127.0.0.1","127.0.0.1","TCP","106","51240  >  5001 [PSH, ACK] Seq=481 Ack=1 Win=65536 Len=40 TSval=1026262890 TSecr=1026261889"
"65","15.297261099","127.0.0.1","127.0.0.1","TCP","66","5001  >  51240 [ACK] Seq=1 Ack=521 Win=65536 Len=0 TSval=1026262890 TSecr=1026262890"
"66","16.297631657","127.0.0.1","127.0.0.1","TCP","106","51240  >  5001 [PSH, ACK] Seq=521 Ack=1 Win=65536 Len=40 TSval=1026263890 TSecr=1026262890"
"67","16.297655683","127.0.0.1","127.0.0.1","TCP","66","5001  >  51240 [ACK] Seq=1 Ack=561 Win=65536 Len=0 TSval=1026263890 TSecr=1026263890"
"68","17.297877832","127.0.0.1","127.0.0.1","TCP","106","51240  >  5001 [PSH, ACK] Seq=561 Ack=1 Win=65536 Len=40 TSval=1026264890 TSecr=1026263890"
"69","17.297910742","127.0.0.1","127.0.0.1","TCP","66","5001  >  51240 [ACK] Seq=1 Ack=601 Win=65536 Len=0 TSval=1026264890 TSecr=1026264890"
"70","18.298208384","127.0.0.1","127.0.0.1","TCP","106","51240  >  5001 [PSH, ACK] Seq=601 Ack=1 Win=65536 Len=40 TSval=1026265891 TSecr=1026264890"
"71","18.298235004","127.0.0.1","127.0.0.1","TCP","66","5001  >  51240 [ACK] Seq=1 Ack=641 Win=65536 Len=0 TSval=1026265891 TSecr=1026265891"
"72","19.298582199","127.0.0.1","127.0.0.1","TCP","106","51240  >  5001 [PSH, ACK] Seq=641 Ack=1 Win=65536 Len=40 TSval=1026266891 TSecr=1026265891"
"73","19.298605474","127.0.0.1","127.0.0.1","TCP","66","5001  >  51240 [ACK] Seq=1 Ack=681 Win=65536 Len=0 TSval=1026266891 TSecr=1026266891"
"74","20.298880673","127.0.0.1","127.0.0.1","TCP","106","51240  >  5001 [PSH, ACK] Seq=681 Ack=1 Win=65536 Len=40 TSval=1026267891 TSecr=1026266891"
"75","20.298919702","127.0.0.1","127.0.0.1","TCP","66","5001  >  51240 [ACK] Seq=1 Ack=721 Win=65536 Len=0 TSval=1026267891 TSecr=1026267891"
"76","21.299250745","127.0.0.1","127.0.0.1","TCP","106","51240  >  5001 [PSH, ACK] Seq=721 Ack=1 Win=65536 Len=40 TSval=1026268892 TSecr=1026267891"
"77","21.299277712","127.0.0.1","127.0.0.1","TCP","66","5001  >  51240 [ACK] Seq=1 Ack=761 Win=65536 Len=0 TSval=1026268892 TSecr=1026268892"
"78","22.299681920","127.0.0.1","127.0.0.1","TCP","106","51240  >  5001 [PSH, ACK] Seq=761 Ack=1 Win=65536 Len=40 TSval=1026269892 TSecr=1026268892"
"79","22.299712401","127.0.0.1","127.0.0.1","TCP","66","5001  >  51240 [ACK] Seq=1 Ack=801 Win=65536 Len=0 TSval=1026269892 TSecr=1026269892"
"80","23.300142392","127.0.0.1","127.0.0.1","TCP","106","51240  >  5001 [PSH, ACK] Seq=801 Ack=1 Win=65536 Len=40 TSval=1026270893 TSecr=1026269892"
"81","23.300169390","127.0.0.1","127.0.0.1","TCP","66","5001  >  51240 [ACK] Seq=1 Ack=841 Win=65536 Len=0 TSval=1026270893 TSecr=1026270893"
"82","24.300484601","127.0.0.1","127.0.0.1","TCP","106","51240  >  5001 [PSH, ACK] Seq=841 Ack=1 Win=65536 Len=40 TSval=1026271893 TSecr=1026270893"
"83","24.300507916","127.0.0.1","127.0.0.1","TCP","66","5001  >  51240 [ACK] Seq=1 Ack=881 Win=65536 Len=0 TSval=1026271893 TSecr=1026271893"
"84","25.300714455","127.0.0.1","127.0.0.1","TCP","106","51240  >  5001 [PSH, ACK] Seq=881 Ack=1 Win=65536 Len=40 TSval=1026272893 TSecr=1026271893"
"85","25.300740127","127.0.0.1","127.0.0.1","TCP","66","5001  >  51240 [ACK] Seq=1 Ack=921 Win=65536 Len=0 TSval=1026272893 TSecr=1026272893"
"86","26.301106642","127.0.0.1","127.0.0.1","TCP","106","51240  >  5001 [PSH, ACK] Seq=921 Ack=1 Win=65536 Len=40 TSval=1026273894 TSecr=1026272893"
"87","26.301133278","127.0.0.1","127.0.0.1","TCP","66","5001  >  51240 [ACK] Seq=1 Ack=961 Win=65536 Len=0 TSval=1026273894 TSecr=1026273894"
"88","27.301382144","127.0.0.1","127.0.0.1","TCP","106","51240  >  5001 [PSH, ACK] Seq=961 Ack=1 Win=65536 Len=40 TSval=1026274894 TSecr=1026273894"
"89","27.301417148","127.0.0.1","127.0.0.1","TCP","66","5001  >  51240 [ACK] Seq=1 Ack=1001 Win=65536 Len=0 TSval=1026274894 TSecr=1026274894"
"90","28.301878418","127.0.0.1","127.0.0.1","TCP","106","51240  >  5001 [PSH, ACK] Seq=1001 Ack=1 Win=65536 Len=40 TSval=1026275894 TSecr=1026274894"
"91","28.301907298","127.0.0.1","127.0.0.1","TCP","66","5001  >  51240 [ACK] Seq=1 Ack=1041 Win=65536 Len=0 TSval=1026275894 TSecr=1026275894"
"92","29.302258536","127.0.0.1","127.0.0.1","TCP","106","51240  >  5001 [PSH, ACK] Seq=1041 Ack=1 Win=65536 Len=40 TSval=1026276895 TSecr=1026275894"
"93","29.302280603","127.0.0.1","127.0.0.1","TCP","66","5001  >  51240 [ACK] Seq=1 Ack=1081 Win=65536 Len=0 TSval=1026276895 TSecr=1026276895"
"94","30.302655084","127.0.0.1","127.0.0.1","TCP","106","51240  >  5001 [PSH, ACK] Seq=1081 Ack=1 Win=65536 Len=40 TSval=1026277895 TSecr=1026276895"
"95","30.302693884","127.0.0.1","127.0.0.1","TCP","66","5001  >  51240 [ACK] Seq=1 Ack=1121 Win=65536 Len=0 TSval=1026277895 TSecr=1026277895"
"101","31.303032545","127.0.0.1","127.0.0.1","TCP","106","51240  >  5001 [PSH, ACK] Seq=1121 Ack=1 Win=65536 Len=40 TSval=1026278896 TSecr=1026277895"
"102","31.303052323","127.0.0.1","127.0.0.1","TCP","66","5001  >  51240 [ACK] Seq=1 Ack=1161 Win=65536 Len=0 TSval=1026278896 TSecr=1026278896"
"112","32.303508741","127.0.0.1","127.0.0.1","TCP","106","51240  >  5001 [PSH, ACK] Seq=1161 Ack=1 Win=65536 Len=40 TSval=1026279896 TSecr=1026278896"
"113","32.303544861","127.0.0.1","127.0.0.1","TCP","66","5001  >  51240 [ACK] Seq=1 Ack=1201 Win=65536 Len=0 TSval=1026279896 TSecr=1026279896"
"114","33.303820003","127.0.0.1","127.0.0.1","TCP","106","51240  >  5001 [PSH, ACK] Seq=1201 Ack=1 Win=65536 Len=40 TSval=1026280896 TSecr=1026279896"
"115","33.303849814","127.0.0.1","127.0.0.1","TCP","66","5001  >  51240 [ACK] Seq=1 Ack=1241 Win=65536 Len=0 TSval=1026280896 TSecr=1026280896"
"120","34.304191416","127.0.0.1","127.0.0.1","TCP","106","51240  >  5001 [PSH, ACK] Seq=1241 Ack=1 Win=65536 Len=40 TSval=1026281897 TSecr=1026280896"
"121","34.304217966","127.0.0.1","127.0.0.1","TCP","66","5001  >  51240 [ACK] Seq=1 Ack=1281 Win=65536 Len=0 TSval=1026281897 TSecr=1026281897"
"122","35.304580164","127.0.0.1","127.0.0.1","TCP","106","51240  >  5001 [PSH, ACK] Seq=1281 Ack=1 Win=65536 Len=40 TSval=1026282897 TSecr=1026281897"
"123","35.304614629","127.0.0.1","127.0.0.1","TCP","66","5001  >  51240 [ACK] Seq=1 Ack=1321 Win=65536 Len=0 TSval=1026282897 TSecr=1026282897"
"124","36.304917977","127.0.0.1","127.0.0.1","TCP","106","51240  >  5001 [PSH, ACK] Seq=1321 Ack=1 Win=65536 Len=40 TSval=1026283897 TSecr=1026282897"
"125","36.304963533","127.0.0.1","127.0.0.1","TCP","66","5001  >  51240 [ACK] Seq=1 Ack=1361 Win=65536 Len=0 TSval=1026283897 TSecr=1026283897"
"126","37.305185121","127.0.0.1","127.0.0.1","TCP","106","51240  >  5001 [PSH, ACK] Seq=1361 Ack=1 Win=65536 Len=40 TSval=1026284898 TSecr=1026283897"
"127","37.305205088","127.0.0.1","127.0.0.1","TCP","66","5001  >  51240 [ACK] Seq=1 Ack=1401 Win=65536 Len=0 TSval=1026284898 TSecr=1026284898"
"128","38.305474213","127.0.0.1","127.0.0.1","TCP","106","51240  >  5001 [PSH, ACK] Seq=1401 Ack=1 Win=65536 Len=40 TSval=1026285898 TSecr=1026284898"
"129","38.305501736","127.0.0.1","127.0.0.1","TCP","66","5001  >  51240 [ACK] Seq=1 Ack=1441 Win=65536 Len=0 TSval=1026285898 TSecr=1026285898"
"130","39.305747900","127.0.0.1","127.0.0.1","TCP","106","51240  >  5001 [PSH, ACK] Seq=1441 Ack=1 Win=65536 Len=40 TSval=1026286898 TSecr=1026285898"
"131","39.305772005","127.0.0.1","127.0.0.1","TCP","66","5001  >  51240 [ACK] Seq=1 Ack=1481 Win=65536 Len=0 TSval=1026286898 TSecr=1026286898"
"132","40.306243121","127.0.0.1","127.0.0.1","TCP","106","51240  >  5001 [PSH, ACK] Seq=1481 Ack=1 Win=65536 Len=40 TSval=1026287899 TSecr=1026286898"
"133","40.306276842","127.0.0.1","127.0.0.1","TCP","66","5001  >  51240 [ACK] Seq=1 Ack=1521 Win=65536 Len=0 TSval=1026287899 TSecr=1026287899"
"134","41.306796537","127.0.0.1","127.0.0.1","TCP","106","51240  >  5001 [PSH, ACK] Seq=1521 Ack=1 Win=65536 Len=40 TSval=1026288899 TSecr=1026287899"
"135","41.306834823","127.0.0.1","127.0.0.1","TCP","66","5001  >  51240 [ACK] Seq=1 Ack=1561 Win=65536 Len=0 TSval=1026288899 TSecr=1026288899"
"136","42.307257853","127.0.0.1","127.0.0.1","TCP","106","51240  >  5001 [PSH, ACK] Seq=1561 Ack=1 Win=65536 Len=40 TSval=1026289900 TSecr=1026288899"
"137","42.307282428","127.0.0.1","127.0.0.1","TCP","66","5001  >  51240 [ACK] Seq=1 Ack=1601 Win=65536 Len=0 TSval=1026289900 TSecr=1026289900"
"138","43.307768840","127.0.0.1","127.0.0.1","TCP","106","51240  >  5001 [PSH, ACK] Seq=1601 Ack=1 Win=65536 Len=40 TSval=1026290900 TSecr=1026289900"
"139","43.307804136","127.0.0.1","127.0.0.1","TCP","66","5001  >  51240 [ACK] Seq=1 Ack=1641 Win=65536 Len=0 TSval=1026290900 TSecr=1026290900"
"140","44.308206282","127.0.0.1","127.0.0.1","TCP","106","51240  >  5001 [PSH, ACK] Seq=1641 Ack=1 Win=65536 Len=40 TSval=1026291901 TSecr=1026290900"
"141","44.308229675","127.0.0.1","127.0.0.1","TCP","66","5001  >  51240 [ACK] Seq=1 Ack=1681 Win=65536 Len=0 TSval=1026291901 TSecr=1026291901"
"142","45.308590859","127.0.0.1","127.0.0.1","TCP","106","51240  >  5001 [PSH, ACK] Seq=1681 Ack=1 Win=65536 Len=40 TSval=1026292901 TSecr=1026291901"
"143","45.308624239","127.0.0.1","127.0.0.1","TCP","66","5001  >  51240 [ACK] Seq=1 Ack=1721 Win=65536 Len=0 TSval=1026292901 TSecr=1026292901"
"144","46.308964658","127.0.0.1","127.0.0.1","TCP","106","51240  >  5001 [PSH, ACK] Seq=1721 Ack=1 Win=65536 Len=40 TSval=1026293901 TSecr=1026292901"
"145","46.309004392","127.0.0.1","127.0.0.1","TCP","66","5001  >  51240 [ACK] Seq=1 Ack=1761 Win=65536 Len=0 TSval=1026293902 TSecr=1026293901"
"146","47.309531456","127.0.0.1","127.0.0.1","TCP","106","51240  >  5001 [PSH, ACK] Seq=1761 Ack=1 Win=65536 Len=40 TSval=1026294902 TSecr=1026293902"
"147","47.309562623","127.0.0.1","127.0.0.1","TCP","66","5001  >  51240 [ACK] Seq=1 Ack=1801 Win=65536 Len=0 TSval=1026294902 TSecr=1026294902"
"148","48.310165785","127.0.0.1","127.0.0.1","TCP","106","51240  >  5001 [PSH, ACK] Seq=1801 Ack=1 Win=65536 Len=40 TSval=1026295903 TSecr=1026294902"
"149","48.310213018","127.0.0.1","127.0.0.1","TCP","66","5001  >  51240 [ACK] Seq=1 Ack=1841 Win=65536 Len=0 TSval=1026295903 TSecr=1026295903"
"150","49.310499577","127.0.0.1","127.0.0.1","TCP","106","51240  >  5001 [PSH, ACK] Seq=1841 Ack=1 Win=65536 Len=40 TSval=1026296903 TSecr=1026295903"
"151","49.310520203","127.0.0.1","127.0.0.1","TCP","66","5001  >  51240 [ACK] Seq=1 Ack=1881 Win=65536 Len=0 TSval=1026296903 TSecr=1026296903"
"152","50.310766922","127.0.0.1","127.0.0.1","TCP","106","51240  >  5001 [PSH, ACK] Seq=1881 Ack=1 Win=65536 Len=40 TSval=1026297903 TSecr=1026296903"
"153","50.310792982","127.0.0.1","127.0.0.1","TCP","66","5001  >  51240 [ACK] Seq=1 Ack=1921 Win=65536 Len=0 TSval=1026297903 TSecr=1026297903"
"154","51.311295657","127.0.0.1","127.0.0.1","TCP","106","51240  >  5001 [PSH, ACK] Seq=1921 Ack=1 Win=65536 Len=40 TSval=1026298904 TSecr=1026297903"
"155","51.311329311","127.0.0.1","127.0.0.1","TCP","66","5001  >  51240 [ACK] Seq=1 Ack=1961 Win=65536 Len=0 TSval=1026298904 TSecr=1026298904"
"156","52.311893617","127.0.0.1","127.0.0.1","TCP","106","51240  >  5001 [PSH, ACK] Seq=1961 Ack=1 Win=65536 Len=40 TSval=1026299904 TSecr=1026298904"
"157","52.311944295","127.0.0.1","127.0.0.1","TCP","66","5001  >  51240 [ACK] Seq=1 Ack=2001 Win=65536 Len=0 TSval=1026299904 TSecr=1026299904"
"158","53.312534545","127.0.0.1","127.0.0.1","TCP","106","51240  >  5001 [PSH, ACK] Seq=2001 Ack=1 Win=65536 Len=40 TSval=1026300905 TSecr=1026299904"
"159","53.312577096","127.0.0.1","127.0.0.1","TCP","66","5001  >  51240 [ACK] Seq=1 Ack=2041 Win=65536 Len=0 TSval=1026300905 TSecr=1026300905"
"160","54.312883111","127.0.0.1","127.0.0.1","TCP","106","51240  >  5001 [PSH, ACK] Seq=2041 Ack=1 Win=65536 Len=40 TSval=1026301905 TSecr=1026300905"
"161","54.312908816","127.0.0.1","127.0.0.1","TCP","66","5001  >  51240 [ACK] Seq=1 Ack=2081 Win=65536 Len=0 TSval=1026301905 TSecr=1026301905"
"162","55.313264744","127.0.0.1","127.0.0.1","TCP","106","51240  >  5001 [PSH, ACK] Seq=2081 Ack=1 Win=65536 Len=40 TSval=1026302906 TSecr=1026301905"
"163","55.313292828","127.0.0.1","127.0.0.1","TCP","66","5001  >  51240 [ACK] Seq=1 Ack=2121 Win=65536 Len=0 TSval=1026302906 TSecr=1026302906"
"164","56.313673872","127.0.0.1","127.0.0.1","TCP","106","51240  >  5001 [PSH, ACK] Seq=2121 Ack=1 Win=65536 Len=40 TSval=1026303906 TSecr=1026302906"
"165","56.313719153","127.0.0.1","127.0.0.1","TCP","66","5001  >  51240 [ACK] Seq=1 Ack=2161 Win=65536 Len=0 TSval=1026303906 TSecr=1026303906"
"166","57.314147254","127.0.0.1","127.0.0.1","TCP","106","51240  >  5001 [PSH, ACK] Seq=2161 Ack=1 Win=65536 Len=40 TSval=1026304907 TSecr=1026303906"
"167","57.314187165","127.0.0.1","127.0.0.1","TCP","66","5001  >  51240 [ACK] Seq=1 Ack=2201 Win=65536 Len=0 TSval=1026304907 TSecr=1026304907"
"168","58.314700885","127.0.0.1","127.0.0.1","TCP","106","51240  >  5001 [PSH, ACK] Seq=2201 Ack=1 Win=65536 Len=40 TSval=1026305907 TSecr=1026304907"
"169","58.314745179","127.0.0.1","127.0.0.1","TCP","66","5001  >  51240 [ACK] Seq=1 Ack=2241 Win=65536 Len=0 TSval=1026305907 TSecr=1026305907"
"170","59.315024427","127.0.0.1","127.0.0.1","TCP","106","51240  >  5001 [PSH, ACK] Seq=2241 Ack=1 Win=65536 Len=40 TSval=1026306908 TSecr=1026305907"
"171","59.315050264","127.0.0.1","127.0.0.1","TCP","66","5001  >  51240 [ACK] Seq=1 Ack=2281 Win=65536 Len=0 TSval=1026306908 TSecr=1026306908"
"172","60.315503419","127.0.0.1","127.0.0.1","TCP","106","51240  >  5001 [PSH, ACK] Seq=2281 Ack=1 Win=65536 Len=40 TSval=1026307908 TSecr=1026306908"
"173","60.315545603","127.0.0.1","127.0.0.1","TCP","66","5001  >  51240 [ACK] Seq=1 Ack=2321 Win=65536 Len=0 TSval=1026307908 TSecr=1026307908"
"174","61.316180203","127.0.0.1","127.0.0.1","TCP","106","51240  >  5001 [PSH, ACK] Seq=2321 Ack=1 Win=65536 Len=40 TSval=1026308909 TSecr=1026307908"
"175","61.316225470","127.0.0.1","127.0.0.1","TCP","66","5001  >  51240 [ACK] Seq=1 Ack=2361 Win=65536 Len=0 TSval=1026308909 TSecr=1026308909"
"176","62.316790759","127.0.0.1","127.0.0.1","TCP","106","51240  >  5001 [PSH, ACK] Seq=2361 Ack=1 Win=65536 Len=40 TSval=1026309909 TSecr=1026308909"
"177","62.316836557","127.0.0.1","127.0.0.1","TCP","66","5001  >  51240 [ACK] Seq=1 Ack=2401 Win=65536 Len=0 TSval=1026309909 TSecr=1026309909"
"178","63.317358361","127.0.0.1","127.0.0.1","TCP","106","51240  >  5001 [PSH, ACK] Seq=2401 Ack=1 Win=65536 Len=40 TSval=1026310910 TSecr=1026309909"
"179","63.317404683","127.0.0.1","127.0.0.1","TCP","66","5001  >  51240 [ACK] Seq=1 Ack=2441 Win=65536 Len=0 TSval=1026310910 TSecr=1026310910"
"180","64.317709075","127.0.0.1","127.0.0.1","TCP","106","51240  >  5001 [PSH, ACK] Seq=2441 Ack=1 Win=65536 Len=40 TSval=1026311910 TSecr=1026310910"
"181","64.317733600","127.0.0.1","127.0.0.1","TCP","66","5001  >  51240 [ACK] Seq=1 Ack=2481 Win=65536 Len=0 TSval=1026311910 TSecr=1026311910"
"182","65.318192357","127.0.0.1","127.0.0.1","TCP","106","51240  >  5001 [PSH, ACK] Seq=2481 Ack=1 Win=65536 Len=40 TSval=1026312911 TSecr=1026311910"
"183","65.318235452","127.0.0.1","127.0.0.1","TCP","66","5001  >  51240 [ACK] Seq=1 Ack=2521 Win=65536 Len=0 TSval=1026312911 TSecr=1026312911"
"184","66.318748726","127.0.0.1","127.0.0.1","TCP","106","51240  >  5001 [PSH, ACK] Seq=2521 Ack=1 Win=65536 Len=40 TSval=1026313911 TSecr=1026312911"
"185","66.318790210","127.0.0.1","127.0.0.1","TCP","66","5001  >  51240 [ACK] Seq=1 Ack=2561 Win=65536 Len=0 TSval=1026313911 TSecr=1026313911"
"190","67.319203884","127.0.0.1","127.0.0.1","TCP","106","51240  >  5001 [PSH, ACK] Seq=2561 Ack=1 Win=65536 Len=40 TSval=1026314912 TSecr=1026313911"
"191","67.319227997","127.0.0.1","127.0.0.1","TCP","66","5001  >  51240 [ACK] Seq=1 Ack=2601 Win=65536 Len=0 TSval=1026314912 TSecr=1026314912"
"192","68.319623709","127.0.0.1","127.0.0.1","TCP","106","51240  >  5001 [PSH, ACK] Seq=2601 Ack=1 Win=65536 Len=40 TSval=1026315912 TSecr=1026314912"
"193","68.319650704","127.0.0.1","127.0.0.1","TCP","66","5001  >  51240 [ACK] Seq=1 Ack=2641 Win=65536 Len=0 TSval=1026315912 TSecr=1026315912"
"194","69.319915484","127.0.0.1","127.0.0.1","TCP","106","51240  >  5001 [PSH, ACK] Seq=2641 Ack=1 Win=65536 Len=40 TSval=1026316912 TSecr=1026315912"
"195","69.319937148","127.0.0.1","127.0.0.1","TCP","66","5001  >  51240 [ACK] Seq=1 Ack=2681 Win=65536 Len=0 TSval=1026316912 TSecr=1026316912"
"196","70.320467398","127.0.0.1","127.0.0.1","TCP","106","51240  >  5001 [PSH, ACK] Seq=2681 Ack=1 Win=65536 Len=40 TSval=1026317913 TSecr=1026316912"
"197","70.320516047","127.0.0.1","127.0.0.1","TCP","66","5001  >  51240 [ACK] Seq=1 Ack=2721 Win=65536 Len=0 TSval=1026317913 TSecr=1026317913"
"198","71.321178259","127.0.0.1","127.0.0.1","TCP","106","51240  >  5001 [PSH, ACK] Seq=2721 Ack=1 Win=65536 Len=40 TSval=1026318914 TSecr=1026317913"
"199","71.321223809","127.0.0.1","127.0.0.1","TCP","66","5001  >  51240 [ACK] Seq=1 Ack=2761 Win=65536 Len=0 TSval=1026318914 TSecr=1026318914"
"200","72.321717346","127.0.0.1","127.0.0.1","TCP","106","51240  >  5001 [PSH, ACK] Seq=2761 Ack=1 Win=65536 Len=40 TSval=1026319914 TSecr=1026318914"
"201","72.321750233","127.0.0.1","127.0.0.1","TCP","66","5001  >  51240 [ACK] Seq=1 Ack=2801 Win=65536 Len=0 TSval=1026319914 TSecr=1026319914"
"202","73.322273730","127.0.0.1","127.0.0.1","TCP","106","51240  >  5001 [PSH, ACK] Seq=2801 Ack=1 Win=65536 Len=40 TSval=1026320915 TSecr=1026319914"
"203","73.322319773","127.0.0.1","127.0.0.1","TCP","66","5001  >  51240 [ACK] Seq=1 Ack=2841 Win=65536 Len=0 TSval=1026320915 TSecr=1026320915"
"204","74.322629112","127.0.0.1","127.0.0.1","TCP","106","51240  >  5001 [PSH, ACK] Seq=2841 Ack=1 Win=65536 Len=40 TSval=1026321915 TSecr=1026320915"
"205","74.322653264","127.0.0.1","127.0.0.1","TCP","66","5001  >  51240 [ACK] Seq=1 Ack=2881 Win=65536 Len=0 TSval=1026321915 TSecr=1026321915"
"206","75.323135017","127.0.0.1","127.0.0.1","TCP","106","51240  >  5001 [PSH, ACK] Seq=2881 Ack=1 Win=65536 Len=40 TSval=1026322916 TSecr=1026321915"
"207","75.323173630","127.0.0.1","127.0.0.1","TCP","66","5001  >  51240 [ACK] Seq=1 Ack=2921 Win=65536 Len=0 TSval=1026322916 TSecr=1026322916"
"208","76.323685982","127.0.0.1","127.0.0.1","TCP","106","51240  >  5001 [PSH, ACK] Seq=2921 Ack=1 Win=65536 Len=40 TSval=1026323916 TSecr=1026322916"
"209","76.323718196","127.0.0.1","127.0.0.1","TCP","66","5001  >  51240 [ACK] Seq=1 Ack=2961 Win=65536 Len=0 TSval=1026323916 TSecr=1026323916"
"210","77.324217417","127.0.0.1","127.0.0.1","TCP","106","51240  >  5001 [PSH, ACK] Seq=2961 Ack=1 Win=65536 Len=40 TSval=1026324917 TSecr=1026323916"
"211","77.324263608","127.0.0.1","127.0.0.1","TCP","66","5001  >  51240 [ACK] Seq=1 Ack=3001 Win=65536 Len=0 TSval=1026324917 TSecr=1026324917"
"212","78.324810713","127.0.0.1","127.0.0.1","TCP","106","51240  >  5001 [PSH, ACK] Seq=3001 Ack=1 Win=65536 Len=40 TSval=1026325917 TSecr=1026324917"
"213","78.324847214","127.0.0.1","127.0.0.1","TCP","66","5001  >  51240 [ACK] Seq=1 Ack=3041 Win=65536 Len=0 TSval=1026325917 TSecr=1026325917"
"214","79.325157808","127.0.0.1","127.0.0.1","TCP","106","51240  >  5001 [PSH, ACK] Seq=3041 Ack=1 Win=65536 Len=40 TSval=1026326918 TSecr=1026325917"
"215","79.325178588","127.0.0.1","127.0.0.1","TCP","66","5001  >  51240 [ACK] Seq=1 Ack=3081 Win=65536 Len=0 TSval=1026326918 TSecr=1026326918"
"216","80.325389508","127.0.0.1","127.0.0.1","TCP","106","51240  >  5001 [PSH, ACK] Seq=3081 Ack=1 Win=65536 Len=40 TSval=1026327918 TSecr=1026326918"
"217","80.325415284","127.0.0.1","127.0.0.1","TCP","66","5001  >  51240 [ACK] Seq=1 Ack=3121 Win=65536 Len=0 TSval=1026327918 TSecr=1026327918"
"218","81.325855543","127.0.0.1","127.0.0.1","TCP","106","51240  >  5001 [PSH, ACK] Seq=3121 Ack=1 Win=65536 Len=40 TSval=1026328918 TSecr=1026327918"
"219","81.325903047","127.0.0.1","127.0.0.1","TCP","66","5001  >  51240 [ACK] Seq=1 Ack=3161 Win=65536 Len=0 TSval=1026328918 TSecr=1026328918"
"220","82.326678837","127.0.0.1","127.0.0.1","TCP","106","51240  >  5001 [PSH, ACK] Seq=3161 Ack=1 Win=65536 Len=40 TSval=1026329919 TSecr=1026328918"
"221","82.326726869","127.0.0.1","127.0.0.1","TCP","66","5001  >  51240 [ACK] Seq=1 Ack=3201 Win=65536 Len=0 TSval=1026329919 TSecr=1026329919"
"222","83.327191670","127.0.0.1","127.0.0.1","TCP","106","51240  >  5001 [PSH, ACK] Seq=3201 Ack=1 Win=65536 Len=40 TSval=1026330920 TSecr=1026329919"
"223","83.327214260","127.0.0.1","127.0.0.1","TCP","66","5001  >  51240 [ACK] Seq=1 Ack=3241 Win=65536 Len=0 TSval=1026330920 TSecr=1026330920"
"224","84.327513312","127.0.0.1","127.0.0.1","TCP","106","51240  >  5001 [PSH, ACK] Seq=3241 Ack=1 Win=65536 Len=40 TSval=1026331920 TSecr=1026330920"
"225","84.327533981","127.0.0.1","127.0.0.1","TCP","66","5001  >  51240 [ACK] Seq=1 Ack=3281 Win=65536 Len=0 TSval=1026331920 TSecr=1026331920"
"226","85.327815336","127.0.0.1","127.0.0.1","TCP","106","51240  >  5001 [PSH, ACK] Seq=3281 Ack=1 Win=65536 Len=40 TSval=1026332920 TSecr=1026331920"
"227","85.327853308","127.0.0.1","127.0.0.1","TCP","66","5001  >  51240 [ACK] Seq=1 Ack=3321 Win=65536 Len=0 TSval=1026332920 TSecr=1026332920"
"228","86.328386980","127.0.0.1","127.0.0.1","TCP","106","51240  >  5001 [PSH, ACK] Seq=3321 Ack=1 Win=65536 Len=40 TSval=1026333921 TSecr=1026332920"
"229","86.328414890","127.0.0.1","127.0.0.1","TCP","66","5001  >  51240 [ACK] Seq=1 Ack=3361 Win=65536 Len=0 TSval=1026333921 TSecr=1026333921"
"230","87.328915201","127.0.0.1","127.0.0.1","TCP","106","51240  >  5001 [PSH, ACK] Seq=3361 Ack=1 Win=65536 Len=40 TSval=1026334921 TSecr=1026333921"
"231","87.329004388","127.0.0.1","127.0.0.1","TCP","66","5001  >  51240 [ACK] Seq=1 Ack=3401 Win=65536 Len=0 TSval=1026334921 TSecr=1026334921"
"232","88.329482426","127.0.0.1","127.0.0.1","TCP","106","51240  >  5001 [PSH, ACK] Seq=3401 Ack=1 Win=65536 Len=40 TSval=1026335922 TSecr=1026334921"
"233","88.329517157","127.0.0.1","127.0.0.1","TCP","66","5001  >  51240 [ACK] Seq=1 Ack=3441 Win=65536 Len=0 TSval=1026335922 TSecr=1026335922"
"234","89.329859701","127.0.0.1","127.0.0.1","TCP","106","51240  >  5001 [PSH, ACK] Seq=3441 Ack=1 Win=65536 Len=40 TSval=1026336922 TSecr=1026335922"
"235","89.329885371","127.0.0.1","127.0.0.1","TCP","66","5001  >  51240 [ACK] Seq=1 Ack=3481 Win=65536 Len=0 TSval=1026336922 TSecr=1026336922"
"236","90.330240114","127.0.0.1","127.0.0.1","TCP","106","51240  >  5001 [PSH, ACK] Seq=3481 Ack=1 Win=65536 Len=40 TSval=1026337923 TSecr=1026336922"
"237","90.330265594","127.0.0.1","127.0.0.1","TCP","66","5001  >  51240 [ACK] Seq=1 Ack=3521 Win=65536 Len=0 TSval=1026337923 TSecr=1026337923"
"238","91.330681338","127.0.0.1","127.0.0.1","TCP","106","51240  >  5001 [PSH, ACK] Seq=3521 Ack=1 Win=65536 Len=40 TSval=1026338923 TSecr=1026337923"
"239","91.330730603","127.0.0.1","127.0.0.1","TCP","66","5001  >  51240 [ACK] Seq=1 Ack=3561 Win=65536 Len=0 TSval=1026338923 TSecr=1026338923"
"240","92.331143926","127.0.0.1","127.0.0.1","TCP","106","51240  >  5001 [PSH, ACK] Seq=3561 Ack=1 Win=65536 Len=40 TSval=1026339924 TSecr=1026338923"
"241","92.331169291","127.0.0.1","127.0.0.1","TCP","66","5001  >  51240 [ACK] Seq=1 Ack=3601 Win=65536 Len=0 TSval=1026339924 TSecr=1026339924"
"242","93.331410482","127.0.0.1","127.0.0.1","TCP","106","51240  >  5001 [PSH, ACK] Seq=3601 Ack=1 Win=65536 Len=40 TSval=1026340924 TSecr=1026339924"
"243","93.331431737","127.0.0.1","127.0.0.1","TCP","66","5001  >  51240 [ACK] Seq=1 Ack=3641 Win=65536 Len=0 TSval=1026340924 TSecr=1026340924"
"244","94.331700216","127.0.0.1","127.0.0.1","TCP","106","51240  >  5001 [PSH, ACK] Seq=3641 Ack=1 Win=65536 Len=40 TSval=1026341924 TSecr=1026340924"
"245","94.331721697","127.0.0.1","127.0.0.1","TCP","66","5001  >  51240 [ACK] Seq=1 Ack=3681 Win=65536 Len=0 TSval=1026341924 TSecr=1026341924"
"246","95.332249801","127.0.0.1","127.0.0.1","TCP","106","51240  >  5001 [PSH, ACK] Seq=3681 Ack=1 Win=65536 Len=40 TSval=1026342925 TSecr=1026341924"
"247","95.332292807","127.0.0.1","127.0.0.1","TCP","66","5001  >  51240 [ACK] Seq=1 Ack=3721 Win=65536 Len=0 TSval=1026342925 TSecr=1026342925"
"248","96.333060660","127.0.0.1","127.0.0.1","TCP","106","51240  >  5001 [PSH, ACK] Seq=3721 Ack=1 Win=65536 Len=40 TSval=1026343926 TSecr=1026342925"
"249","96.333153686","127.0.0.1","127.0.0.1","TCP","66","5001  >  51240 [ACK] Seq=1 Ack=3761 Win=65536 Len=0 TSval=1026343926 TSecr=1026343926"
"250","97.333769205","127.0.0.1","127.0.0.1","TCP","106","51240  >  5001 [PSH, ACK] Seq=3761 Ack=1 Win=65536 Len=40 TSval=1026344926 TSecr=1026343926"
"251","97.333820113","127.0.0.1","127.0.0.1","TCP","66","5001  >  51240 [ACK] Seq=1 Ack=3801 Win=65536 Len=0 TSval=1026344926 TSecr=1026344926"
"252","98.334484767","127.0.0.1","127.0.0.1","TCP","106","51240  >  5001 [PSH, ACK] Seq=3801 Ack=1 Win=65536 Len=40 TSval=1026345927 TSecr=1026344926"
"253","98.334540460","127.0.0.1","127.0.0.1","TCP","66","5001  >  51240 [ACK] Seq=1 Ack=3841 Win=65536 Len=0 TSval=1026345927 TSecr=1026345927"
"254","99.334933321","127.0.0.1","127.0.0.1","TCP","106","51240  >  5001 [PSH, ACK] Seq=3841 Ack=1 Win=65536 Len=40 TSval=1026346927 TSecr=1026345927"
"255","99.334963804","127.0.0.1","127.0.0.1","TCP","66","5001  >  51240 [ACK] Seq=1 Ack=3881 Win=65536 Len=0 TSval=1026346927 TSecr=1026346927"
"256","100.335468388","127.0.0.1","127.0.0.1","TCP","106","51240  >  5001 [PSH, ACK] Seq=3881 Ack=1 Win=65536 Len=40 TSval=1026347928 TSecr=1026346927"
"257","100.335514866","127.0.0.1","127.0.0.1","TCP","66","5001  >  51240 [ACK] Seq=1 Ack=3921 Win=65536 Len=0 TSval=1026347928 TSecr=1026347928"
"258","101.335980980","127.0.0.1","127.0.0.1","TCP","106","51240  >  5001 [PSH, ACK] Seq=3921 Ack=1 Win=65536 Len=40 TSval=1026348928 TSecr=1026347928"
"259","101.336008160","127.0.0.1","127.0.0.1","TCP","66","5001  >  51240 [ACK] Seq=1 Ack=3961 Win=65536 Len=0 TSval=1026348929 TSecr=1026348928"
"260","102.336459175","127.0.0.1","127.0.0.1","TCP","106","51240  >  5001 [PSH, ACK] Seq=3961 Ack=1 Win=65536 Len=40 TSval=1026349929 TSecr=1026348929"
"261","102.336501729","127.0.0.1","127.0.0.1","TCP","66","5001  >  51240 [ACK] Seq=1 Ack=4001 Win=65536 Len=0 TSval=1026349929 TSecr=1026349929"
"262","103.336991498","127.0.0.1","127.0.0.1","TCP","106","51240  >  5001 [PSH, ACK] Seq=4001 Ack=1 Win=65536 Len=40 TSval=1026350929 TSecr=1026349929"
"263","103.337035682","127.0.0.1","127.0.0.1","TCP","66","5001  >  51240 [ACK] Seq=1 Ack=4041 Win=65536 Len=0 TSval=1026350930 TSecr=1026350929"
"268","104.337428630","127.0.0.1","127.0.0.1","TCP","106","51240  >  5001 [PSH, ACK] Seq=4041 Ack=1 Win=65536 Len=40 TSval=1026351930 TSecr=1026350930"
"269","104.337450284","127.0.0.1","127.0.0.1","TCP","66","5001  >  51240 [ACK] Seq=1 Ack=4081 Win=65536 Len=0 TSval=1026351930 TSecr=1026351930"
"270","105.337998404","127.0.0.1","127.0.0.1","TCP","82","51240  >  5001 [PSH, ACK] Seq=4081 Ack=1 Win=65536 Len=16 TSval=1026352930 TSecr=1026351930"
"271","105.338048591","127.0.0.1","127.0.0.1","TCP","66","5001  >  51240 [ACK] Seq=1 Ack=4097 Win=65536 Len=0 TSval=1026352931 TSecr=1026352930"
"272","106.339004770","127.0.0.1","127.0.0.1","TCP","66","51240  >  5001 [FIN, ACK] Seq=4097 Ack=1 Win=65536 Len=0 TSval=1026353931 TSecr=1026352931"
"273","106.339536024","127.0.0.1","127.0.0.1","TCP","66","5001  >  51240 [FIN, ACK] Seq=1 Ack=4098 Win=65536 Len=0 TSval=1026353932 TSecr=1026353931"
"274","106.339614396","127.0.0.1","127.0.0.1","TCP","66","51240  >  5001 [ACK] Seq=4098 Ack=2 Win=65536 Len=0 TSval=1026353932 TSecr=1026353932"
