frame.time_epoch,frame.len,ip.src,ip.dst,tcp.srcport,tcp.dstport,tcp.len,_ws.col.info
1741712934.203742997,106,10.0.0.2,10.0.0.1,56628,5001,40,56628 → 5001 [PSH, ACK] Seq=1 Ack=1 Win=64256 Len=40 TSval=2606061396 TSecr=4166020316
1741712935.204156671,106,10.0.0.2,10.0.0.1,56628,5001,40,56628 → 5001 [PSH, ACK] Seq=41 Ack=1 Win=64256 Len=40 TSval=2606062397 TSecr=4166020316
1741712936.204687726,106,10.0.0.2,10.0.0.1,56628,5001,40,56628 → 5001 [PSH, ACK] Seq=81 Ack=1 Win=64256 Len=40 TSval=2606063397 TSecr=4166021317
1741712937.205258906,106,10.0.0.2,10.0.0.1,56628,5001,40,56628 → 5001 [PSH, ACK] Seq=121 Ack=1 Win=64256 Len=40 TSval=2606064398 TSecr=4166022317
1741712938.205831201,106,10.0.0.2,10.0.0.1,56628,5001,40,56628 → 5001 [PSH, ACK] Seq=161 Ack=1 Win=64256 Len=40 TSval=2606065398 TSecr=4166023318
1741712939.206423241,106,10.0.0.2,10.0.0.1,56628,5001,40,56628 → 5001 [PSH, ACK] Seq=201 Ack=1 Win=64256 Len=40 TSval=2606066399 TSecr=4166024318
1741712940.206982535,106,10.0.0.2,10.0.0.1,56628,5001,40,56628 → 5001 [PSH, ACK] Seq=241 Ack=1 Win=64256 Len=40 TSval=2606067399 TSecr=4166025319
1741712941.207577300,106,10.0.0.2,10.0.0.1,56628,5001,40,56628 → 5001 [PSH, ACK] Seq=281 Ack=1 Win=64256 Len=40 TSval=2606068400 TSecr=4166026320
1741712942.208148355,106,10.0.0.2,10.0.0.1,56628,5001,40,56628 → 5001 [PSH, ACK] Seq=321 Ack=1 Win=64256 Len=40 TSval=2606069401 TSecr=4166027320
1741712943.208701155,106,10.0.0.2,10.0.0.1,56628,5001,40,56628 → 5001 [PSH, ACK] Seq=361 Ack=1 Win=64256 Len=40 TSval=2606070401 TSecr=4166028321
1741712944.209172308,106,10.0.0.2,10.0.0.1,56628,5001,40,56628 → 5001 [PSH, ACK] Seq=401 Ack=1 Win=64256 Len=40 TSval=2606071402 TSecr=4166029321
1741712945.209596342,106,10.0.0.2,10.0.0.1,56628,5001,40,56628 → 5001 [PSH, ACK] Seq=441 Ack=1 Win=64256 Len=40 TSval=2606072402 TSecr=4166030322
1741712946.210062889,106,10.0.0.2,10.0.0.1,56628,5001,40,56628 → 5001 [PSH, ACK] Seq=481 Ack=1 Win=64256 Len=40 TSval=2606073403 TSecr=4166031322
1741712947.210359036,106,10.0.0.2,10.0.0.1,56628,5001,40,56628 → 5001 [PSH, ACK] Seq=521 Ack=1 Win=64256 Len=40 TSval=2606074403 TSecr=4166032323
1741712948.210646327,106,10.0.0.2,10.0.0.1,56628,5001,40,56628 → 5001 [PSH, ACK] Seq=561 Ack=1 Win=64256 Len=40 TSval=2606075403 TSecr=4166033323
1741712949.210968583,106,10.0.0.2,10.0.0.1,56628,5001,40,56628 → 5001 [PSH, ACK] Seq=601 Ack=1 Win=64256 Len=40 TSval=2606076403 TSecr=4166034323
1741712950.211272665,106,10.0.0.2,10.0.0.1,56628,5001,40,56628 → 5001 [PSH, ACK] Seq=641 Ack=1 Win=64256 Len=40 TSval=2606077404 TSecr=4166035324
1741712951.211566133,106,10.0.0.2,10.0.0.1,56628,5001,40,56628 → 5001 [PSH, ACK] Seq=681 Ack=1 Win=64256 Len=40 TSval=2606078404 TSecr=4166036324
1741712952.211865754,106,10.0.0.2,10.0.0.1,56628,5001,40,56628 → 5001 [PSH, ACK] Seq=721 Ack=1 Win=64256 Len=40 TSval=2606079404 TSecr=4166037324
1741712953.212207190,106,10.0.0.2,10.0.0.1,56628,5001,40,56628 → 5001 [PSH, ACK] Seq=761 Ack=1 Win=64256 Len=40 TSval=2606080405 TSecr=4166038324
1741712954.212554893,106,10.0.0.2,10.0.0.1,56628,5001,40,56628 → 5001 [PSH, ACK] Seq=801 Ack=1 Win=64256 Len=40 TSval=2606081405 TSecr=4166039325
1741712955.212813466,106,10.0.0.2,10.0.0.1,56628,5001,40,56628 → 5001 [PSH, ACK] Seq=841 Ack=1 Win=64256 Len=40 TSval=2606082405 TSecr=4166040325
1741712956.213403609,106,10.0.0.2,10.0.0.1,56628,5001,40,56628 → 5001 [PSH, ACK] Seq=881 Ack=1 Win=64256 Len=40 TSval=2606083406 TSecr=4166041325
1741712957.213809073,106,10.0.0.2,10.0.0.1,56628,5001,40,56628 → 5001 [PSH, ACK] Seq=921 Ack=1 Win=64256 Len=40 TSval=2606084406 TSecr=4166042326
1741712958.214024570,106,10.0.0.2,10.0.0.1,56628,5001,40,56628 → 5001 [PSH, ACK] Seq=961 Ack=1 Win=64256 Len=40 TSval=2606085407 TSecr=4166043326
1741712959.214362414,106,10.0.0.2,10.0.0.1,56628,5001,40,56628 → 5001 [PSH, ACK] Seq=1001 Ack=1 Win=64256 Len=40 TSval=2606086407 TSecr=4166044327
1741712960.214788281,106,10.0.0.2,10.0.0.1,56628,5001,40,56628 → 5001 [PSH, ACK] Seq=1041 Ack=1 Win=64256 Len=40 TSval=2606087407 TSecr=4166045327
1741712961.215286688,106,10.0.0.2,10.0.0.1,56628,5001,40,56628 → 5001 [PSH, ACK] Seq=1081 Ack=1 Win=64256 Len=40 TSval=2606088408 TSecr=4166046327
1741712962.215656703,106,10.0.0.2,10.0.0.1,56628,5001,40,56628 → 5001 [PSH, ACK] Seq=1121 Ack=1 Win=64256 Len=40 TSval=2606089408 TSecr=4166047328
1741712963.216046385,106,10.0.0.2,10.0.0.1,56628,5001,40,56628 → 5001 [PSH, ACK] Seq=1161 Ack=1 Win=64256 Len=40 TSval=2606090409 TSecr=4166048328
1741712964.216365520,106,10.0.0.2,10.0.0.1,56628,5001,40,56628 → 5001 [PSH, ACK] Seq=1201 Ack=1 Win=64256 Len=40 TSval=2606091409 TSecr=4166049329
1741712965.216744908,106,10.0.0.2,10.0.0.1,56628,5001,40,56628 → 5001 [PSH, ACK] Seq=1241 Ack=1 Win=64256 Len=40 TSval=2606092409 TSecr=4166050329
1741712966.217122235,106,10.0.0.2,10.0.0.1,56628,5001,40,56628 → 5001 [PSH, ACK] Seq=1281 Ack=1 Win=64256 Len=40 TSval=2606093410 TSecr=4166051329
1741712967.217475046,106,10.0.0.2,10.0.0.1,56628,5001,40,56628 → 5001 [PSH, ACK] Seq=1321 Ack=1 Win=64256 Len=40 TSval=2606094410 TSecr=4166052330
1741712968.218252354,106,10.0.0.2,10.0.0.1,56628,5001,40,56628 → 5001 [PSH, ACK] Seq=1361 Ack=1 Win=64256 Len=40 TSval=2606095411 TSecr=4166053330
1741712969.218788191,106,10.0.0.2,10.0.0.1,56628,5001,40,56628 → 5001 [PSH, ACK] Seq=1401 Ack=1 Win=64256 Len=40 TSval=2606096411 TSecr=4166054331
1741712970.219523351,106,10.0.0.2,10.0.0.1,56628,5001,40,56628 → 5001 [PSH, ACK] Seq=1441 Ack=1 Win=64256 Len=40 TSval=2606097412 TSecr=4166055331
1741712971.219997920,106,10.0.0.2,10.0.0.1,56628,5001,40,56628 → 5001 [PSH, ACK] Seq=1481 Ack=1 Win=64256 Len=40 TSval=2606098412 TSecr=4166056332
1741712972.220353038,106,10.0.0.2,10.0.0.1,56628,5001,40,56628 → 5001 [PSH, ACK] Seq=1521 Ack=1 Win=64256 Len=40 TSval=2606099413 TSecr=4166057333
1741712973.220741620,106,10.0.0.2,10.0.0.1,56628,5001,40,56628 → 5001 [PSH, ACK] Seq=1561 Ack=1 Win=64256 Len=40 TSval=2606100413 TSecr=4166058333
1741712974.221390126,106,10.0.0.2,10.0.0.1,56628,5001,40,56628 → 5001 [PSH, ACK] Seq=1601 Ack=1 Win=64256 Len=40 TSval=2606101414 TSecr=4166059333
1741712975.221864368,106,10.0.0.2,10.0.0.1,56628,5001,40,56628 → 5001 [PSH, ACK] Seq=1641 Ack=1 Win=64256 Len=40 TSval=2606102414 TSecr=4166060334
1741712976.222584338,106,10.0.0.2,10.0.0.1,56628,5001,40,56628 → 5001 [PSH, ACK] Seq=1681 Ack=1 Win=64256 Len=40 TSval=2606103415 TSecr=4166061334
1741712977.223170342,106,10.0.0.2,10.0.0.1,56628,5001,40,56628 → 5001 [PSH, ACK] Seq=1721 Ack=1 Win=64256 Len=40 TSval=2606104416 TSecr=4166062335
1741712978.223782547,106,10.0.0.2,10.0.0.1,56628,5001,40,56628 → 5001 [PSH, ACK] Seq=1761 Ack=1 Win=64256 Len=40 TSval=2606105416 TSecr=4166063336
1741712979.224480783,106,10.0.0.2,10.0.0.1,56628,5001,40,56628 → 5001 [PSH, ACK] Seq=1801 Ack=1 Win=64256 Len=40 TSval=2606106417 TSecr=4166064336
1741712980.225207286,106,10.0.0.2,10.0.0.1,56628,5001,40,56628 → 5001 [PSH, ACK] Seq=1841 Ack=1 Win=64256 Len=40 TSval=2606107418 TSecr=4166065337
1741712981.225815408,106,10.0.0.2,10.0.0.1,56628,5001,40,56628 → 5001 [PSH, ACK] Seq=1881 Ack=1 Win=64256 Len=40 TSval=2606108418 TSecr=4166066338
1741712982.226420649,106,10.0.0.2,10.0.0.1,56628,5001,40,56628 → 5001 [PSH, ACK] Seq=1921 Ack=1 Win=64256 Len=40 TSval=2606109419 TSecr=4166067338
1741712983.227111163,106,10.0.0.2,10.0.0.1,56628,5001,40,56628 → 5001 [PSH, ACK] Seq=1961 Ack=1 Win=64256 Len=40 TSval=2606110420 TSecr=4166068339
1741712984.227867132,106,10.0.0.2,10.0.0.1,56628,5001,40,56628 → 5001 [PSH, ACK] Seq=2001 Ack=1 Win=64256 Len=40 TSval=2606111420 TSecr=4166069340
1741712985.228565827,106,10.0.0.2,10.0.0.1,56628,5001,40,56628 → 5001 [PSH, ACK] Seq=2041 Ack=1 Win=64256 Len=40 TSval=2606112421 TSecr=4166070340
1741712986.229239829,106,10.0.0.2,10.0.0.1,56628,5001,40,56628 → 5001 [PSH, ACK] Seq=2081 Ack=1 Win=64256 Len=40 TSval=2606113422 TSecr=4166071341
1741712987.229791728,106,10.0.0.2,10.0.0.1,56628,5001,40,56628 → 5001 [PSH, ACK] Seq=2121 Ack=1 Win=64256 Len=40 TSval=2606114422 TSecr=4166072342
1741712988.230427507,106,10.0.0.2,10.0.0.1,56628,5001,40,56628 → 5001 [PSH, ACK] Seq=2161 Ack=1 Win=64256 Len=40 TSval=2606115423 TSecr=4166073342
1741712989.231112856,106,10.0.0.2,10.0.0.1,56628,5001,40,56628 → 5001 [PSH, ACK] Seq=2201 Ack=1 Win=64256 Len=40 TSval=2606116424 TSecr=4166074343
1741712990.231826114,106,10.0.0.2,10.0.0.1,56628,5001,40,56628 → 5001 [PSH, ACK] Seq=2241 Ack=1 Win=64256 Len=40 TSval=2606117424 TSecr=4166075344
1741712991.232418279,106,10.0.0.2,10.0.0.1,56628,5001,40,56628 → 5001 [PSH, ACK] Seq=2281 Ack=1 Win=64256 Len=40 TSval=2606118425 TSecr=4166076344
1741712992.232903416,106,10.0.0.2,10.0.0.1,56628,5001,40,56628 → 5001 [PSH, ACK] Seq=2321 Ack=1 Win=64256 Len=40 TSval=2606119425 TSecr=4166077345
1741712993.233539556,106,10.0.0.2,10.0.0.1,56628,5001,40,56628 → 5001 [PSH, ACK] Seq=2361 Ack=1 Win=64256 Len=40 TSval=2606120426 TSecr=4166078345
1741712994.234109578,106,10.0.0.2,10.0.0.1,56628,5001,40,56628 → 5001 [PSH, ACK] Seq=2401 Ack=1 Win=64256 Len=40 TSval=2606121427 TSecr=4166079346
1741712995.234582030,106,10.0.0.2,10.0.0.1,56628,5001,40,56628 → 5001 [PSH, ACK] Seq=2441 Ack=1 Win=64256 Len=40 TSval=2606122427 TSecr=4166080347
1741712996.235017433,106,10.0.0.2,10.0.0.1,56628,5001,40,56628 → 5001 [PSH, ACK] Seq=2481 Ack=1 Win=64256 Len=40 TSval=2606123427 TSecr=4166081347
1741712997.235637553,106,10.0.0.2,10.0.0.1,56628,5001,40,56628 → 5001 [PSH, ACK] Seq=2521 Ack=1 Win=64256 Len=40 TSval=2606124428 TSecr=4166082348
1741712998.236277820,106,10.0.0.2,10.0.0.1,56628,5001,40,56628 → 5001 [PSH, ACK] Seq=2561 Ack=1 Win=64256 Len=40 TSval=2606125429 TSecr=4166083348
1741712999.236996123,106,10.0.0.2,10.0.0.1,56628,5001,40,56628 → 5001 [PSH, ACK] Seq=2601 Ack=1 Win=64256 Len=40 TSval=2606126429 TSecr=4166084349
1741713000.237789005,106,10.0.0.2,10.0.0.1,56628,5001,40,56628 → 5001 [PSH, ACK] Seq=2641 Ack=1 Win=64256 Len=40 TSval=2606127430 TSecr=4166085350
1741713001.238453820,106,10.0.0.2,10.0.0.1,56628,5001,40,56628 → 5001 [PSH, ACK] Seq=2681 Ack=1 Win=64256 Len=40 TSval=2606128431 TSecr=4166086350
1741713002.238940941,106,10.0.0.2,10.0.0.1,56628,5001,40,56628 → 5001 [PSH, ACK] Seq=2721 Ack=1 Win=64256 Len=40 TSval=2606129431 TSecr=4166087351
1741713003.239463798,106,10.0.0.2,10.0.0.1,56628,5001,40,56628 → 5001 [PSH, ACK] Seq=2761 Ack=1 Win=64256 Len=40 TSval=2606130432 TSecr=4166088352
1741713004.240127848,106,10.0.0.2,10.0.0.1,56628,5001,40,56628 → 5001 [PSH, ACK] Seq=2801 Ack=1 Win=64256 Len=40 TSval=2606131433 TSecr=4166089352
1741713005.240733829,106,10.0.0.2,10.0.0.1,56628,5001,40,56628 → 5001 [PSH, ACK] Seq=2841 Ack=1 Win=64256 Len=40 TSval=2606132433 TSecr=4166090353
1741713006.241326165,106,10.0.0.2,10.0.0.1,56628,5001,40,56628 → 5001 [PSH, ACK] Seq=2881 Ack=1 Win=64256 Len=40 TSval=2606133434 TSecr=4166091353
1741713007.241972268,106,10.0.0.2,10.0.0.1,56628,5001,40,56628 → 5001 [PSH, ACK] Seq=2921 Ack=1 Win=64256 Len=40 TSval=2606134434 TSecr=4166092354
1741713008.242744633,106,10.0.0.2,10.0.0.1,56628,5001,40,56628 → 5001 [PSH, ACK] Seq=2961 Ack=1 Win=64256 Len=40 TSval=2606135435 TSecr=4166093355
1741713009.243380075,106,10.0.0.2,10.0.0.1,56628,5001,40,56628 → 5001 [PSH, ACK] Seq=3001 Ack=1 Win=64256 Len=40 TSval=2606136436 TSecr=4166094355
1741713010.244001693,106,10.0.0.2,10.0.0.1,56628,5001,40,56628 → 5001 [PSH, ACK] Seq=3041 Ack=1 Win=64256 Len=40 TSval=2606137436 TSecr=4166095356
1741713011.244660725,106,10.0.0.2,10.0.0.1,56628,5001,40,56628 → 5001 [PSH, ACK] Seq=3081 Ack=1 Win=64256 Len=40 TSval=2606138437 TSecr=4166096357
1741713012.245266541,106,10.0.0.2,10.0.0.1,56628,5001,40,56628 → 5001 [PSH, ACK] Seq=3121 Ack=1 Win=64256 Len=40 TSval=2606139438 TSecr=4166097357
1741713013.245857022,106,10.0.0.2,10.0.0.1,56628,5001,40,56628 → 5001 [PSH, ACK] Seq=3161 Ack=1 Win=64256 Len=40 TSval=2606140438 TSecr=4166098358
1741713014.246353855,106,10.0.0.2,10.0.0.1,56628,5001,40,56628 → 5001 [PSH, ACK] Seq=3201 Ack=1 Win=64256 Len=40 TSval=2606141439 TSecr=4166099358
1741713015.246991214,106,10.0.0.2,10.0.0.1,56628,5001,40,56628 → 5001 [PSH, ACK] Seq=3241 Ack=1 Win=64256 Len=40 TSval=2606142439 TSecr=4166100359
1741713016.247659837,106,10.0.0.2,10.0.0.1,56628,5001,40,56628 → 5001 [PSH, ACK] Seq=3281 Ack=1 Win=64256 Len=40 TSval=2606143440 TSecr=4166101360
1741713017.248478439,106,10.0.0.2,10.0.0.1,56628,5001,40,56628 → 5001 [PSH, ACK] Seq=3321 Ack=1 Win=64256 Len=40 TSval=2606144441 TSecr=4166102360
1741713018.249241864,106,10.0.0.2,10.0.0.1,56628,5001,40,56628 → 5001 [PSH, ACK] Seq=3361 Ack=1 Win=64256 Len=40 TSval=2606145442 TSecr=4166103361
1741713019.249879979,106,10.0.0.2,10.0.0.1,56628,5001,40,56628 → 5001 [PSH, ACK] Seq=3401 Ack=1 Win=64256 Len=40 TSval=2606146442 TSecr=4166104362
1741713020.250604922,106,10.0.0.2,10.0.0.1,56628,5001,40,56628 → 5001 [PSH, ACK] Seq=3441 Ack=1 Win=64256 Len=40 TSval=2606147443 TSecr=4166105362
1741713021.251211636,106,10.0.0.2,10.0.0.1,56628,5001,40,56628 → 5001 [PSH, ACK] Seq=3481 Ack=1 Win=64256 Len=40 TSval=2606148444 TSecr=4166106363
1741713022.251903930,106,10.0.0.2,10.0.0.1,56628,5001,40,56628 → 5001 [PSH, ACK] Seq=3521 Ack=1 Win=64256 Len=40 TSval=2606149444 TSecr=4166107364
1741713023.252561665,106,10.0.0.2,10.0.0.1,56628,5001,40,56628 → 5001 [PSH, ACK] Seq=3561 Ack=1 Win=64256 Len=40 TSval=2606150445 TSecr=4166108364
1741713024.253196219,106,10.0.0.2,10.0.0.1,56628,5001,40,56628 → 5001 [PSH, ACK] Seq=3601 Ack=1 Win=64256 Len=40 TSval=2606151446 TSecr=4166109365
1741713025.253715392,106,10.0.0.2,10.0.0.1,56628,5001,40,56628 → 5001 [PSH, ACK] Seq=3641 Ack=1 Win=64256 Len=40 TSval=2606152446 TSecr=4166110366
1741713026.254331305,106,10.0.0.2,10.0.0.1,56628,5001,40,56628 → 5001 [PSH, ACK] Seq=3681 Ack=1 Win=64256 Len=40 TSval=2606153447 TSecr=4166111366
1741713027.254972823,106,10.0.0.2,10.0.0.1,56628,5001,40,56628 → 5001 [PSH, ACK] Seq=3721 Ack=1 Win=64256 Len=40 TSval=2606154447 TSecr=4166112367
1741713028.255601243,106,10.0.0.2,10.0.0.1,56628,5001,40,56628 → 5001 [PSH, ACK] Seq=3761 Ack=1 Win=64256 Len=40 TSval=2606155448 TSecr=4166113368
1741713029.256234589,106,10.0.0.2,10.0.0.1,56628,5001,40,56628 → 5001 [PSH, ACK] Seq=3801 Ack=1 Win=64256 Len=40 TSval=2606156449 TSecr=4166114368
1741713030.256715422,106,10.0.0.2,10.0.0.1,56628,5001,40,56628 → 5001 [PSH, ACK] Seq=3841 Ack=1 Win=64256 Len=40 TSval=2606157449 TSecr=4166115369
1741713031.257288216,106,10.0.0.2,10.0.0.1,56628,5001,40,56628 → 5001 [PSH, ACK] Seq=3881 Ack=1 Win=64256 Len=40 TSval=2606158450 TSecr=4166116369
1741713032.257811838,106,10.0.0.2,10.0.0.1,56628,5001,40,56628 → 5001 [PSH, ACK] Seq=3921 Ack=1 Win=64256 Len=40 TSval=2606159450 TSecr=4166117370
1741713033.258373456,106,10.0.0.2,10.0.0.1,56628,5001,40,56628 → 5001 [PSH, ACK] Seq=3961 Ack=1 Win=64256 Len=40 TSval=2606160451 TSecr=4166118370
1741713034.258851719,106,10.0.0.2,10.0.0.1,56628,5001,40,56628 → 5001 [PSH, ACK] Seq=4001 Ack=1 Win=64256 Len=40 TSval=2606161451 TSecr=4166119371
1741713035.259305886,106,10.0.0.2,10.0.0.1,56628,5001,40,56628 → 5001 [PSH, ACK] Seq=4041 Ack=1 Win=64256 Len=40 TSval=2606162452 TSecr=4166120371
1741713036.260073516,82,10.0.0.2,10.0.0.1,56628,5001,16,56628 → 5001 [PSH, ACK] Seq=4081 Ack=1 Win=64256 Len=16 TSval=2606163453 TSecr=4166121372
