"No.","Time","Source","Destination","Protocol","Length","Info"
"1","0.000000000","127.0.0.1","127.0.0.1","TCP","74","44994  >  5001 [SYN] Seq=0 Win=65495 Len=0 MSS=65495 SACK_PERM TSval=1025747088 TSecr=0 WS=128"
"2","0.000026973","127.0.0.1","127.0.0.1","TCP","74","5001  >  44994 [SYN, ACK] Seq=0 Ack=1 Win=65483 Len=0 MSS=65495 SACK_PERM TSval=1025747088 TSecr=1025747088 WS=128"
"3","0.000048351","127.0.0.1","127.0.0.1","TCP","66","44994  >  5001 [ACK] Seq=1 Ack=1 Win=65536 Len=0 TSval=1025747088 TSecr=1025747088"
"4","0.000144317","127.0.0.1","127.0.0.1","TCP","106","44994  >  5001 [PSH, ACK] Seq=1 Ack=1 Win=65536 Len=40 TSval=1025747088 TSecr=1025747088"
"5","0.000152760","127.0.0.1","127.0.0.1","TCP","66","5001  >  44994 [ACK] Seq=1 Ack=41 Win=65536 Len=0 TSval=1025747088 TSecr=1025747088"
"6","1.000452783","127.0.0.1","127.0.0.1","TCP","106","44994  >  5001 [PSH, ACK] Seq=41 Ack=1 Win=65536 Len=40 TSval=1025748088 TSecr=1025747088"
"7","1.000487904","127.0.0.1","127.0.0.1","TCP","66","5001  >  44994 [ACK] Seq=1 Ack=81 Win=65536 Len=0 TSval=1025748088 TSecr=1025748088"
"11","2.000756838","127.0.0.1","127.0.0.1","TCP","106","44994  >  5001 [PSH, ACK] Seq=81 Ack=1 Win=65536 Len=40 TSval=1025749088 TSecr=1025748088"
"12","2.000793115","127.0.0.1","127.0.0.1","TCP","66","5001  >  44994 [ACK] Seq=1 Ack=121 Win=65536 Len=0 TSval=1025749088 TSecr=1025749088"
"14","3.001165991","127.0.0.1","127.0.0.1","TCP","106","44994  >  5001 [PSH, ACK] Seq=121 Ack=1 Win=65536 Len=40 TSval=1025750089 TSecr=1025749088"
"15","3.001199542","127.0.0.1","127.0.0.1","TCP","66","5001  >  44994 [ACK] Seq=1 Ack=161 Win=65536 Len=0 TSval=1025750089 TSecr=1025750089"
"18","4.001488383","127.0.0.1","127.0.0.1","TCP","106","44994  >  5001 [PSH, ACK] Seq=161 Ack=1 Win=65536 Len=40 TSval=1025751089 TSecr=1025750089"
"19","4.001526710","127.0.0.1","127.0.0.1","TCP","66","5001  >  44994 [ACK] Seq=1 Ack=201 Win=65536 Len=0 TSval=1025751089 TSecr=1025751089"
"36","5.002015004","127.0.0.1","127.0.0.1","TCP","106","44994  >  5001 [PSH, ACK] Seq=201 Ack=1 Win=65536 Len=40 TSval=1025752090 TSecr=1025751089"
"37","5.002111037","127.0.0.1","127.0.0.1","TCP","66","5001  >  44994 [ACK] Seq=1 Ack=241 Win=65536 Len=0 TSval=1025752090 TSecr=1025752090"
"38","6.002598500","127.0.0.1","127.0.0.1","TCP","106","44994  >  5001 [PSH, ACK] Seq=241 Ack=1 Win=65536 Len=40 TSval=1025753090 TSecr=1025752090"
"39","6.002643123","127.0.0.1","127.0.0.1","TCP","66","5001  >  44994 [ACK] Seq=1 Ack=281 Win=65536 Len=0 TSval=1025753090 TSecr=1025753090"
"40","7.003084164","127.0.0.1","127.0.0.1","TCP","106","44994  >  5001 [PSH, ACK] Seq=281 Ack=1 Win=65536 Len=40 TSval=1025754091 TSecr=1025753090"
"41","7.003116512","127.0.0.1","127.0.0.1","TCP","66","5001  >  44994 [ACK] Seq=1 Ack=321 Win=65536 Len=0 TSval=1025754091 TSecr=1025754091"
"42","8.003559493","127.0.0.1","127.0.0.1","TCP","106","44994  >  5001 [PSH, ACK] Seq=321 Ack=1 Win=65536 Len=40 TSval=1025755091 TSecr=1025754091"
"43","8.003591472","127.0.0.1","127.0.0.1","TCP","66","5001  >  44994 [ACK] Seq=1 Ack=361 Win=65536 Len=0 TSval=1025755091 TSecr=1025755091"
"44","9.004004528","127.0.0.1","127.0.0.1","TCP","106","44994  >  5001 [PSH, ACK] Seq=361 Ack=1 Win=65536 Len=40 TSval=1025756092 TSecr=1025755091"
"45","9.004033023","127.0.0.1","127.0.0.1","TCP","66","5001  >  44994 [ACK] Seq=1 Ack=401 Win=65536 Len=0 TSval=1025756092 TSecr=1025756092"
"46","10.004449224","127.0.0.1","127.0.0.1","TCP","106","44994  >  5001 [PSH, ACK] Seq=401 Ack=1 Win=65536 Len=40 TSval=1025757092 TSecr=1025756092"
"47","10.004487240","127.0.0.1","127.0.0.1","TCP","66","5001  >  44994 [ACK] Seq=1 Ack=441 Win=65536 Len=0 TSval=1025757092 TSecr=1025757092"
"48","11.004892519","127.0.0.1","127.0.0.1","TCP","106","44994  >  5001 [PSH, ACK] Seq=441 Ack=1 Win=65536 Len=40 TSval=1025758092 TSecr=1025757092"
"49","11.004962439","127.0.0.1","127.0.0.1","TCP","66","5001  >  44994 [ACK] Seq=1 Ack=481 Win=65536 Len=0 TSval=1025758093 TSecr=1025758092"
"50","12.005433413","127.0.0.1","127.0.0.1","TCP","106","44994  >  5001 [PSH, ACK] Seq=481 Ack=1 Win=65536 Len=40 TSval=1025759093 TSecr=1025758093"
"51","12.005477811","127.0.0.1","127.0.0.1","TCP","66","5001  >  44994 [ACK] Seq=1 Ack=521 Win=65536 Len=0 TSval=1025759093 TSecr=1025759093"
"52","13.005768983","127.0.0.1","127.0.0.1","TCP","106","44994  >  5001 [PSH, ACK] Seq=521 Ack=1 Win=65536 Len=40 TSval=1025760093 TSecr=1025759093"
"53","13.005803481","127.0.0.1","127.0.0.1","TCP","66","5001  >  44994 [ACK] Seq=1 Ack=561 Win=65536 Len=0 TSval=1025760093 TSecr=1025760093"
"54","14.006125586","127.0.0.1","127.0.0.1","TCP","106","44994  >  5001 [PSH, ACK] Seq=561 Ack=1 Win=65536 Len=40 TSval=1025761094 TSecr=1025760093"
"55","14.006161016","127.0.0.1","127.0.0.1","TCP","66","5001  >  44994 [ACK] Seq=1 Ack=601 Win=65536 Len=0 TSval=1025761094 TSecr=1025761094"
"56","15.006493738","127.0.0.1","127.0.0.1","TCP","106","44994  >  5001 [PSH, ACK] Seq=601 Ack=1 Win=65536 Len=40 TSval=1025762094 TSecr=1025761094"
"57","15.006535559","127.0.0.1","127.0.0.1","TCP","66","5001  >  44994 [ACK] Seq=1 Ack=641 Win=65536 Len=0 TSval=1025762094 TSecr=1025762094"
"58","16.006852015","127.0.0.1","127.0.0.1","TCP","106","44994  >  5001 [PSH, ACK] Seq=641 Ack=1 Win=65536 Len=40 TSval=1025763094 TSecr=1025762094"
"59","16.006899287","127.0.0.1","127.0.0.1","TCP","66","5001  >  44994 [ACK] Seq=1 Ack=681 Win=65536 Len=0 TSval=1025763094 TSecr=1025763094"
"60","17.007165556","127.0.0.1","127.0.0.1","TCP","106","44994  >  5001 [PSH, ACK] Seq=681 Ack=1 Win=65536 Len=40 TSval=1025764095 TSecr=1025763094"
"61","17.007197358","127.0.0.1","127.0.0.1","TCP","66","5001  >  44994 [ACK] Seq=1 Ack=721 Win=65536 Len=0 TSval=1025764095 TSecr=1025764095"
"66","18.007584821","127.0.0.1","127.0.0.1","TCP","106","44994  >  5001 [PSH, ACK] Seq=721 Ack=1 Win=65536 Len=40 TSval=1025765095 TSecr=1025764095"
"67","18.007639429","127.0.0.1","127.0.0.1","TCP","66","5001  >  44994 [ACK] Seq=1 Ack=761 Win=65536 Len=0 TSval=1025765095 TSecr=1025765095"
"68","19.007969361","127.0.0.1","127.0.0.1","TCP","106","44994  >  5001 [PSH, ACK] Seq=761 Ack=1 Win=65536 Len=40 TSval=1025766096 TSecr=1025765095"
"69","19.008001710","127.0.0.1","127.0.0.1","TCP","66","5001  >  44994 [ACK] Seq=1 Ack=801 Win=65536 Len=0 TSval=1025766096 TSecr=1025766096"
"70","20.008276088","127.0.0.1","127.0.0.1","TCP","106","44994  >  5001 [PSH, ACK] Seq=801 Ack=1 Win=65536 Len=40 TSval=1025767096 TSecr=1025766096"
"71","20.008312455","127.0.0.1","127.0.0.1","TCP","66","5001  >  44994 [ACK] Seq=1 Ack=841 Win=65536 Len=0 TSval=1025767096 TSecr=1025767096"
"72","21.008656303","127.0.0.1","127.0.0.1","TCP","106","44994  >  5001 [PSH, ACK] Seq=841 Ack=1 Win=65536 Len=40 TSval=1025768096 TSecr=1025767096"
"73","21.008697290","127.0.0.1","127.0.0.1","TCP","66","5001  >  44994 [ACK] Seq=1 Ack=881 Win=65536 Len=0 TSval=1025768096 TSecr=1025768096"
"74","22.009010039","127.0.0.1","127.0.0.1","TCP","106","44994  >  5001 [PSH, ACK] Seq=881 Ack=1 Win=65536 Len=40 TSval=1025769097 TSecr=1025768096"
"75","22.009045168","127.0.0.1","127.0.0.1","TCP","66","5001  >  44994 [ACK] Seq=1 Ack=921 Win=65536 Len=0 TSval=1025769097 TSecr=1025769097"
"76","23.009317849","127.0.0.1","127.0.0.1","TCP","106","44994  >  5001 [PSH, ACK] Seq=921 Ack=1 Win=65536 Len=40 TSval=1025770097 TSecr=1025769097"
"77","23.009352100","127.0.0.1","127.0.0.1","TCP","66","5001  >  44994 [ACK] Seq=1 Ack=961 Win=65536 Len=0 TSval=1025770097 TSecr=1025770097"
"78","24.009622615","127.0.0.1","127.0.0.1","TCP","106","44994  >  5001 [PSH, ACK] Seq=961 Ack=1 Win=65536 Len=40 TSval=1025771097 TSecr=1025770097"
"79","24.009670597","127.0.0.1","127.0.0.1","TCP","66","5001  >  44994 [ACK] Seq=1 Ack=1001 Win=65536 Len=0 TSval=1025771097 TSecr=1025771097"
"80","25.010004874","127.0.0.1","127.0.0.1","TCP","106","44994  >  5001 [PSH, ACK] Seq=1001 Ack=1 Win=65536 Len=40 TSval=1025772098 TSecr=1025771097"
"81","25.010041453","127.0.0.1","127.0.0.1","TCP","66","5001  >  44994 [ACK] Seq=1 Ack=1041 Win=65536 Len=0 TSval=1025772098 TSecr=1025772098"
"82","26.010363931","127.0.0.1","127.0.0.1","TCP","106","44994  >  5001 [PSH, ACK] Seq=1041 Ack=1 Win=65536 Len=40 TSval=1025773098 TSecr=1025772098"
"83","26.010439736","127.0.0.1","127.0.0.1","TCP","66","5001  >  44994 [ACK] Seq=1 Ack=1081 Win=65536 Len=0 TSval=1025773098 TSecr=1025773098"
"84","27.010742195","127.0.0.1","127.0.0.1","TCP","106","44994  >  5001 [PSH, ACK] Seq=1081 Ack=1 Win=65536 Len=40 TSval=1025774098 TSecr=1025773098"
"85","27.010781917","127.0.0.1","127.0.0.1","TCP","66","5001  >  44994 [ACK] Seq=1 Ack=1121 Win=65536 Len=0 TSval=1025774098 TSecr=1025774098"
"86","28.011138051","127.0.0.1","127.0.0.1","TCP","106","44994  >  5001 [PSH, ACK] Seq=1121 Ack=1 Win=65536 Len=40 TSval=1025775099 TSecr=1025774098"
"87","28.011166992","127.0.0.1","127.0.0.1","TCP","66","5001  >  44994 [ACK] Seq=1 Ack=1161 Win=65536 Len=0 TSval=1025775099 TSecr=1025775099"
"88","29.011517690","127.0.0.1","127.0.0.1","TCP","106","44994  >  5001 [PSH, ACK] Seq=1161 Ack=1 Win=65536 Len=40 TSval=1025776099 TSecr=1025775099"
"89","29.011555610","127.0.0.1","127.0.0.1","TCP","66","5001  >  44994 [ACK] Seq=1 Ack=1201 Win=65536 Len=0 TSval=1025776099 TSecr=1025776099"
"90","30.011814666","127.0.0.1","127.0.0.1","TCP","106","44994  >  5001 [PSH, ACK] Seq=1201 Ack=1 Win=65536 Len=40 TSval=1025777099 TSecr=1025776099"
"91","30.011850843","127.0.0.1","127.0.0.1","TCP","66","5001  >  44994 [ACK] Seq=1 Ack=1241 Win=65536 Len=0 TSval=1025777099 TSecr=1025777099"
"92","31.012226592","127.0.0.1","127.0.0.1","TCP","106","44994  >  5001 [PSH, ACK] Seq=1241 Ack=1 Win=65536 Len=40 TSval=1025778100 TSecr=1025777099"
"93","31.012273069","127.0.0.1","127.0.0.1","TCP","66","5001  >  44994 [ACK] Seq=1 Ack=1281 Win=65536 Len=0 TSval=1025778100 TSecr=1025778100"
"94","32.012577035","127.0.0.1","127.0.0.1","TCP","106","44994  >  5001 [PSH, ACK] Seq=1281 Ack=1 Win=65536 Len=40 TSval=1025779100 TSecr=1025778100"
"95","32.012623512","127.0.0.1","127.0.0.1","TCP","66","5001  >  44994 [ACK] Seq=1 Ack=1321 Win=65536 Len=0 TSval=1025779100 TSecr=1025779100"
"96","33.013173041","127.0.0.1","127.0.0.1","TCP","106","44994  >  5001 [PSH, ACK] Seq=1321 Ack=1 Win=65536 Len=40 TSval=1025780101 TSecr=1025779100"
"97","33.013208204","127.0.0.1","127.0.0.1","TCP","66","5001  >  44994 [ACK] Seq=1 Ack=1361 Win=65536 Len=0 TSval=1025780101 TSecr=1025780101"
"98","34.013560248","127.0.0.1","127.0.0.1","TCP","106","44994  >  5001 [PSH, ACK] Seq=1361 Ack=1 Win=65536 Len=40 TSval=1025781101 TSecr=1025780101"
"99","34.013594298","127.0.0.1","127.0.0.1","TCP","66","5001  >  44994 [ACK] Seq=1 Ack=1401 Win=65536 Len=0 TSval=1025781101 TSecr=1025781101"
"100","35.014020807","127.0.0.1","127.0.0.1","TCP","106","44994  >  5001 [PSH, ACK] Seq=1401 Ack=1 Win=65536 Len=40 TSval=1025782102 TSecr=1025781101"
"101","35.014060379","127.0.0.1","127.0.0.1","TCP","66","5001  >  44994 [ACK] Seq=1 Ack=1441 Win=65536 Len=0 TSval=1025782102 TSecr=1025782102"
"102","36.014424140","127.0.0.1","127.0.0.1","TCP","106","44994  >  5001 [PSH, ACK] Seq=1441 Ack=1 Win=65536 Len=40 TSval=1025783102 TSecr=1025782102"
"103","36.014464858","127.0.0.1","127.0.0.1","TCP","66","5001  >  44994 [ACK] Seq=1 Ack=1481 Win=65536 Len=0 TSval=1025783102 TSecr=1025783102"
"104","37.014725977","127.0.0.1","127.0.0.1","TCP","106","44994  >  5001 [PSH, ACK] Seq=1481 Ack=1 Win=65536 Len=40 TSval=1025784102 TSecr=1025783102"
"105","37.014759866","127.0.0.1","127.0.0.1","TCP","66","5001  >  44994 [ACK] Seq=1 Ack=1521 Win=65536 Len=0 TSval=1025784102 TSecr=1025784102"
"106","38.015021982","127.0.0.1","127.0.0.1","TCP","106","44994  >  5001 [PSH, ACK] Seq=1521 Ack=1 Win=65536 Len=40 TSval=1025785103 TSecr=1025784102"
"107","38.015053063","127.0.0.1","127.0.0.1","TCP","66","5001  >  44994 [ACK] Seq=1 Ack=1561 Win=65536 Len=0 TSval=1025785103 TSecr=1025785103"
"108","39.015441039","127.0.0.1","127.0.0.1","TCP","106","44994  >  5001 [PSH, ACK] Seq=1561 Ack=1 Win=65536 Len=40 TSval=1025786103 TSecr=1025785103"
"109","39.015487864","127.0.0.1","127.0.0.1","TCP","66","5001  >  44994 [ACK] Seq=1 Ack=1601 Win=65536 Len=0 TSval=1025786103 TSecr=1025786103"
"110","40.015786298","127.0.0.1","127.0.0.1","TCP","106","44994  >  5001 [PSH, ACK] Seq=1601 Ack=1 Win=65536 Len=40 TSval=1025787103 TSecr=1025786103"
"111","40.015818389","127.0.0.1","127.0.0.1","TCP","66","5001  >  44994 [ACK] Seq=1 Ack=1641 Win=65536 Len=0 TSval=1025787103 TSecr=1025787103"
"112","41.016080700","127.0.0.1","127.0.0.1","TCP","106","44994  >  5001 [PSH, ACK] Seq=1641 Ack=1 Win=65536 Len=40 TSval=1025788104 TSecr=1025787103"
"113","41.016114149","127.0.0.1","127.0.0.1","TCP","66","5001  >  44994 [ACK] Seq=1 Ack=1681 Win=65536 Len=0 TSval=1025788104 TSecr=1025788104"
"114","42.016420881","127.0.0.1","127.0.0.1","TCP","106","44994  >  5001 [PSH, ACK] Seq=1681 Ack=1 Win=65536 Len=40 TSval=1025789104 TSecr=1025788104"
"115","42.016457817","127.0.0.1","127.0.0.1","TCP","66","5001  >  44994 [ACK] Seq=1 Ack=1721 Win=65536 Len=0 TSval=1025789104 TSecr=1025789104"
"116","43.016802837","127.0.0.1","127.0.0.1","TCP","106","44994  >  5001 [PSH, ACK] Seq=1721 Ack=1 Win=65536 Len=40 TSval=1025790104 TSecr=1025789104"
"117","43.016897955","127.0.0.1","127.0.0.1","TCP","66","5001  >  44994 [ACK] Seq=1 Ack=1761 Win=65536 Len=0 TSval=1025790104 TSecr=1025790104"
"118","44.017343859","127.0.0.1","127.0.0.1","TCP","106","44994  >  5001 [PSH, ACK] Seq=1761 Ack=1 Win=65536 Len=40 TSval=1025791105 TSecr=1025790104"
"119","44.017382765","127.0.0.1","127.0.0.1","TCP","66","5001  >  44994 [ACK] Seq=1 Ack=1801 Win=65536 Len=0 TSval=1025791105 TSecr=1025791105"
"120","45.017717485","127.0.0.1","127.0.0.1","TCP","106","44994  >  5001 [PSH, ACK] Seq=1801 Ack=1 Win=65536 Len=40 TSval=1025792105 TSecr=1025791105"
"121","45.017768594","127.0.0.1","127.0.0.1","TCP","66","5001  >  44994 [ACK] Seq=1 Ack=1841 Win=65536 Len=0 TSval=1025792105 TSecr=1025792105"
"122","46.018197430","127.0.0.1","127.0.0.1","TCP","106","44994  >  5001 [PSH, ACK] Seq=1841 Ack=1 Win=65536 Len=40 TSval=1025793106 TSecr=1025792105"
"123","46.018236345","127.0.0.1","127.0.0.1","TCP","66","5001  >  44994 [ACK] Seq=1 Ack=1881 Win=65536 Len=0 TSval=1025793106 TSecr=1025793106"
"124","47.018506600","127.0.0.1","127.0.0.1","TCP","106","44994  >  5001 [PSH, ACK] Seq=1881 Ack=1 Win=65536 Len=40 TSval=1025794106 TSecr=1025793106"
"125","47.018544434","127.0.0.1","127.0.0.1","TCP","66","5001  >  44994 [ACK] Seq=1 Ack=1921 Win=65536 Len=0 TSval=1025794106 TSecr=1025794106"
"126","48.018873991","127.0.0.1","127.0.0.1","TCP","106","44994  >  5001 [PSH, ACK] Seq=1921 Ack=1 Win=65536 Len=40 TSval=1025795106 TSecr=1025794106"
"127","48.018931223","127.0.0.1","127.0.0.1","TCP","66","5001  >  44994 [ACK] Seq=1 Ack=1961 Win=65536 Len=0 TSval=1025795106 TSecr=1025795106"
"128","49.019433575","127.0.0.1","127.0.0.1","TCP","106","44994  >  5001 [PSH, ACK] Seq=1961 Ack=1 Win=65536 Len=40 TSval=1025796107 TSecr=1025795106"
"129","49.019470961","127.0.0.1","127.0.0.1","TCP","66","5001  >  44994 [ACK] Seq=1 Ack=2001 Win=65536 Len=0 TSval=1025796107 TSecr=1025796107"
"130","50.019833291","127.0.0.1","127.0.0.1","TCP","106","44994  >  5001 [PSH, ACK] Seq=2001 Ack=1 Win=65536 Len=40 TSval=1025797107 TSecr=1025796107"
"131","50.019867872","127.0.0.1","127.0.0.1","TCP","66","5001  >  44994 [ACK] Seq=1 Ack=2041 Win=65536 Len=0 TSval=1025797107 TSecr=1025797107"
"132","51.020248415","127.0.0.1","127.0.0.1","TCP","106","44994  >  5001 [PSH, ACK] Seq=2041 Ack=1 Win=65536 Len=40 TSval=1025798108 TSecr=1025797107"
"133","51.020294928","127.0.0.1","127.0.0.1","TCP","66","5001  >  44994 [ACK] Seq=1 Ack=2081 Win=65536 Len=0 TSval=1025798108 TSecr=1025798108"
"134","52.020608971","127.0.0.1","127.0.0.1","TCP","106","44994  >  5001 [PSH, ACK] Seq=2081 Ack=1 Win=65536 Len=40 TSval=1025799108 TSecr=1025798108"
"135","52.020642494","127.0.0.1","127.0.0.1","TCP","66","5001  >  44994 [ACK] Seq=1 Ack=2121 Win=65536 Len=0 TSval=1025799108 TSecr=1025799108"
"136","53.020924362","127.0.0.1","127.0.0.1","TCP","106","44994  >  5001 [PSH, ACK] Seq=2121 Ack=1 Win=65536 Len=40 TSval=1025800108 TSecr=1025799108"
"137","53.020960330","127.0.0.1","127.0.0.1","TCP","66","5001  >  44994 [ACK] Seq=1 Ack=2161 Win=65536 Len=0 TSval=1025800109 TSecr=1025800108"
"138","54.021231198","127.0.0.1","127.0.0.1","TCP","106","44994  >  5001 [PSH, ACK] Seq=2161 Ack=1 Win=65536 Len=40 TSval=1025801109 TSecr=1025800109"
"139","54.021263085","127.0.0.1","127.0.0.1","TCP","66","5001  >  44994 [ACK] Seq=1 Ack=2201 Win=65536 Len=0 TSval=1025801109 TSecr=1025801109"
"140","55.021621560","127.0.0.1","127.0.0.1","TCP","106","44994  >  5001 [PSH, ACK] Seq=2201 Ack=1 Win=65536 Len=40 TSval=1025802109 TSecr=1025801109"
"141","55.021659458","127.0.0.1","127.0.0.1","TCP","66","5001  >  44994 [ACK] Seq=1 Ack=2241 Win=65536 Len=0 TSval=1025802109 TSecr=1025802109"
"142","56.021940514","127.0.0.1","127.0.0.1","TCP","106","44994  >  5001 [PSH, ACK] Seq=2241 Ack=1 Win=65536 Len=40 TSval=1025803109 TSecr=1025802109"
"143","56.022012951","127.0.0.1","127.0.0.1","TCP","66","5001  >  44994 [ACK] Seq=1 Ack=2281 Win=65536 Len=0 TSval=1025803110 TSecr=1025803109"
"144","57.022411682","127.0.0.1","127.0.0.1","TCP","106","44994  >  5001 [PSH, ACK] Seq=2281 Ack=1 Win=65536 Len=40 TSval=1025804110 TSecr=1025803110"
"145","57.022442906","127.0.0.1","127.0.0.1","TCP","66","5001  >  44994 [ACK] Seq=1 Ack=2321 Win=65536 Len=0 TSval=1025804110 TSecr=1025804110"
"146","58.022748053","127.0.0.1","127.0.0.1","TCP","106","44994  >  5001 [PSH, ACK] Seq=2321 Ack=1 Win=65536 Len=40 TSval=1025805110 TSecr=1025804110"
"147","58.022785729","127.0.0.1","127.0.0.1","TCP","66","5001  >  44994 [ACK] Seq=1 Ack=2361 Win=65536 Len=0 TSval=1025805110 TSecr=1025805110"
"148","59.023246462","127.0.0.1","127.0.0.1","TCP","106","44994  >  5001 [PSH, ACK] Seq=2361 Ack=1 Win=65536 Len=40 TSval=1025806111 TSecr=1025805110"
"149","59.023290273","127.0.0.1","127.0.0.1","TCP","66","5001  >  44994 [ACK] Seq=1 Ack=2401 Win=65536 Len=0 TSval=1025806111 TSecr=1025806111"
"150","60.023623354","127.0.0.1","127.0.0.1","TCP","106","44994  >  5001 [PSH, ACK] Seq=2401 Ack=1 Win=65536 Len=40 TSval=1025807111 TSecr=1025806111"
"151","60.023662460","127.0.0.1","127.0.0.1","TCP","66","5001  >  44994 [ACK] Seq=1 Ack=2441 Win=65536 Len=0 TSval=1025807111 TSecr=1025807111"
"152","61.023954347","127.0.0.1","127.0.0.1","TCP","106","44994  >  5001 [PSH, ACK] Seq=2441 Ack=1 Win=65536 Len=40 TSval=1025808111 TSecr=1025807111"
"153","61.023989647","127.0.0.1","127.0.0.1","TCP","66","5001  >  44994 [ACK] Seq=1 Ack=2481 Win=65536 Len=0 TSval=1025808112 TSecr=1025808111"
"154","62.024267203","127.0.0.1","127.0.0.1","TCP","106","44994  >  5001 [PSH, ACK] Seq=2481 Ack=1 Win=65536 Len=40 TSval=1025809112 TSecr=1025808112"
"155","62.024307671","127.0.0.1","127.0.0.1","TCP","66","5001  >  44994 [ACK] Seq=1 Ack=2521 Win=65536 Len=0 TSval=1025809112 TSecr=1025809112"
"156","63.024601049","127.0.0.1","127.0.0.1","TCP","106","44994  >  5001 [PSH, ACK] Seq=2521 Ack=1 Win=65536 Len=40 TSval=1025810112 TSecr=1025809112"
"157","63.024639905","127.0.0.1","127.0.0.1","TCP","66","5001  >  44994 [ACK] Seq=1 Ack=2561 Win=65536 Len=0 TSval=1025810112 TSecr=1025810112"
"158","64.025137285","127.0.0.1","127.0.0.1","TCP","106","44994  >  5001 [PSH, ACK] Seq=2561 Ack=1 Win=65536 Len=40 TSval=1025811113 TSecr=1025810112"
"159","64.025177963","127.0.0.1","127.0.0.1","TCP","66","5001  >  44994 [ACK] Seq=1 Ack=2601 Win=65536 Len=0 TSval=1025811113 TSecr=1025811113"
"160","65.025499884","127.0.0.1","127.0.0.1","TCP","106","44994  >  5001 [PSH, ACK] Seq=2601 Ack=1 Win=65536 Len=40 TSval=1025812113 TSecr=1025811113"
"161","65.025534585","127.0.0.1","127.0.0.1","TCP","66","5001  >  44994 [ACK] Seq=1 Ack=2641 Win=65536 Len=0 TSval=1025812113 TSecr=1025812113"
"162","66.025801740","127.0.0.1","127.0.0.1","TCP","106","44994  >  5001 [PSH, ACK] Seq=2641 Ack=1 Win=65536 Len=40 TSval=1025813113 TSecr=1025812113"
"163","66.025833407","127.0.0.1","127.0.0.1","TCP","66","5001  >  44994 [ACK] Seq=1 Ack=2681 Win=65536 Len=0 TSval=1025813113 TSecr=1025813113"
"164","67.026120756","127.0.0.1","127.0.0.1","TCP","106","44994  >  5001 [PSH, ACK] Seq=2681 Ack=1 Win=65536 Len=40 TSval=1025814114 TSecr=1025813113"
"165","67.026152450","127.0.0.1","127.0.0.1","TCP","66","5001  >  44994 [ACK] Seq=1 Ack=2721 Win=65536 Len=0 TSval=1025814114 TSecr=1025814114"
"166","68.026445101","127.0.0.1","127.0.0.1","TCP","106","44994  >  5001 [PSH, ACK] Seq=2721 Ack=1 Win=65536 Len=40 TSval=1025815114 TSecr=1025814114"
"167","68.026480296","127.0.0.1","127.0.0.1","TCP","66","5001  >  44994 [ACK] Seq=1 Ack=2761 Win=65536 Len=0 TSval=1025815114 TSecr=1025815114"
"168","69.026740637","127.0.0.1","127.0.0.1","TCP","106","44994  >  5001 [PSH, ACK] Seq=2761 Ack=1 Win=65536 Len=40 TSval=1025816114 TSecr=1025815114"
"169","69.026775497","127.0.0.1","127.0.0.1","TCP","66","5001  >  44994 [ACK] Seq=1 Ack=2801 Win=65536 Len=0 TSval=1025816114 TSecr=1025816114"
"170","70.027049124","127.0.0.1","127.0.0.1","TCP","106","44994  >  5001 [PSH, ACK] Seq=2801 Ack=1 Win=65536 Len=40 TSval=1025817115 TSecr=1025816114"
"171","70.027086440","127.0.0.1","127.0.0.1","TCP","66","5001  >  44994 [ACK] Seq=1 Ack=2841 Win=65536 Len=0 TSval=1025817115 TSecr=1025817115"
"172","71.027352486","127.0.0.1","127.0.0.1","TCP","106","44994  >  5001 [PSH, ACK] Seq=2841 Ack=1 Win=65536 Len=40 TSval=1025818115 TSecr=1025817115"
"173","71.027388668","127.0.0.1","127.0.0.1","TCP","66","5001  >  44994 [ACK] Seq=1 Ack=2881 Win=65536 Len=0 TSval=1025818115 TSecr=1025818115"
"174","72.027698800","127.0.0.1","127.0.0.1","TCP","106","44994  >  5001 [PSH, ACK] Seq=2881 Ack=1 Win=65536 Len=40 TSval=1025819115 TSecr=1025818115"
"175","72.027748011","127.0.0.1","127.0.0.1","TCP","66","5001  >  44994 [ACK] Seq=1 Ack=2921 Win=65536 Len=0 TSval=1025819115 TSecr=1025819115"
"176","73.028170265","127.0.0.1","127.0.0.1","TCP","106","44994  >  5001 [PSH, ACK] Seq=2921 Ack=1 Win=65536 Len=40 TSval=1025820116 TSecr=1025819115"
"177","73.028203875","127.0.0.1","127.0.0.1","TCP","66","5001  >  44994 [ACK] Seq=1 Ack=2961 Win=65536 Len=0 TSval=1025820116 TSecr=1025820116"
"178","74.028487763","127.0.0.1","127.0.0.1","TCP","106","44994  >  5001 [PSH, ACK] Seq=2961 Ack=1 Win=65536 Len=40 TSval=1025821116 TSecr=1025820116"
"179","74.028533948","127.0.0.1","127.0.0.1","TCP","66","5001  >  44994 [ACK] Seq=1 Ack=3001 Win=65536 Len=0 TSval=1025821116 TSecr=1025821116"
"180","75.028869630","127.0.0.1","127.0.0.1","TCP","106","44994  >  5001 [PSH, ACK] Seq=3001 Ack=1 Win=65536 Len=40 TSval=1025822116 TSecr=1025821116"
"181","75.028919761","127.0.0.1","127.0.0.1","TCP","66","5001  >  44994 [ACK] Seq=1 Ack=3041 Win=65536 Len=0 TSval=1025822116 TSecr=1025822116"
"182","76.029193884","127.0.0.1","127.0.0.1","TCP","106","44994  >  5001 [PSH, ACK] Seq=3041 Ack=1 Win=65536 Len=40 TSval=1025823117 TSecr=1025822116"
"183","76.029229723","127.0.0.1","127.0.0.1","TCP","66","5001  >  44994 [ACK] Seq=1 Ack=3081 Win=65536 Len=0 TSval=1025823117 TSecr=1025823117"
"184","77.029489253","127.0.0.1","127.0.0.1","TCP","106","44994  >  5001 [PSH, ACK] Seq=3081 Ack=1 Win=65536 Len=40 TSval=1025824117 TSecr=1025823117"
"185","77.029521932","127.0.0.1","127.0.0.1","TCP","66","5001  >  44994 [ACK] Seq=1 Ack=3121 Win=65536 Len=0 TSval=1025824117 TSecr=1025824117"
"186","78.029811845","127.0.0.1","127.0.0.1","TCP","106","44994  >  5001 [PSH, ACK] Seq=3121 Ack=1 Win=65536 Len=40 TSval=1025825117 TSecr=1025824117"
"187","78.029852632","127.0.0.1","127.0.0.1","TCP","66","5001  >  44994 [ACK] Seq=1 Ack=3161 Win=65536 Len=0 TSval=1025825117 TSecr=1025825117"
"188","79.030241220","127.0.0.1","127.0.0.1","TCP","106","44994  >  5001 [PSH, ACK] Seq=3161 Ack=1 Win=65536 Len=40 TSval=1025826118 TSecr=1025825117"
"189","79.030290455","127.0.0.1","127.0.0.1","TCP","66","5001  >  44994 [ACK] Seq=1 Ack=3201 Win=65536 Len=0 TSval=1025826118 TSecr=1025826118"
"190","80.030854082","127.0.0.1","127.0.0.1","TCP","106","44994  >  5001 [PSH, ACK] Seq=3201 Ack=1 Win=65536 Len=40 TSval=1025827118 TSecr=1025826118"
"191","80.030881159","127.0.0.1","127.0.0.1","TCP","66","5001  >  44994 [ACK] Seq=1 Ack=3241 Win=65536 Len=0 TSval=1025827118 TSecr=1025827118"
"192","81.031181177","127.0.0.1","127.0.0.1","TCP","106","44994  >  5001 [PSH, ACK] Seq=3241 Ack=1 Win=65536 Len=40 TSval=1025828119 TSecr=1025827118"
"193","81.031224792","127.0.0.1","127.0.0.1","TCP","66","5001  >  44994 [ACK] Seq=1 Ack=3281 Win=65536 Len=0 TSval=1025828119 TSecr=1025828119"
"194","82.031686989","127.0.0.1","127.0.0.1","TCP","106","44994  >  5001 [PSH, ACK] Seq=3281 Ack=1 Win=65536 Len=40 TSval=1025829119 TSecr=1025828119"
"195","82.031724499","127.0.0.1","127.0.0.1","TCP","66","5001  >  44994 [ACK] Seq=1 Ack=3321 Win=65536 Len=0 TSval=1025829119 TSecr=1025829119"
"196","83.032054404","127.0.0.1","127.0.0.1","TCP","106","44994  >  5001 [PSH, ACK] Seq=3321 Ack=1 Win=65536 Len=40 TSval=1025830120 TSecr=1025829119"
"197","83.032088008","127.0.0.1","127.0.0.1","TCP","66","5001  >  44994 [ACK] Seq=1 Ack=3361 Win=65536 Len=0 TSval=1025830120 TSecr=1025830120"
"198","84.032442972","127.0.0.1","127.0.0.1","TCP","106","44994  >  5001 [PSH, ACK] Seq=3361 Ack=1 Win=65536 Len=40 TSval=1025831120 TSecr=1025830120"
"199","84.032483614","127.0.0.1","127.0.0.1","TCP","66","5001  >  44994 [ACK] Seq=1 Ack=3401 Win=65536 Len=0 TSval=1025831120 TSecr=1025831120"
"200","85.032825590","127.0.0.1","127.0.0.1","TCP","106","44994  >  5001 [PSH, ACK] Seq=3401 Ack=1 Win=65536 Len=40 TSval=1025832120 TSecr=1025831120"
"201","85.032866257","127.0.0.1","127.0.0.1","TCP","66","5001  >  44994 [ACK] Seq=1 Ack=3441 Win=65536 Len=0 TSval=1025832120 TSecr=1025832120"
"202","86.033174696","127.0.0.1","127.0.0.1","TCP","106","44994  >  5001 [PSH, ACK] Seq=3441 Ack=1 Win=65536 Len=40 TSval=1025833121 TSecr=1025832120"
"203","86.033230062","127.0.0.1","127.0.0.1","TCP","66","5001  >  44994 [ACK] Seq=1 Ack=3481 Win=65536 Len=0 TSval=1025833121 TSecr=1025833121"
"204","87.033598553","127.0.0.1","127.0.0.1","TCP","106","44994  >  5001 [PSH, ACK] Seq=3481 Ack=1 Win=65536 Len=40 TSval=1025834121 TSecr=1025833121"
"205","87.033630648","127.0.0.1","127.0.0.1","TCP","66","5001  >  44994 [ACK] Seq=1 Ack=3521 Win=65536 Len=0 TSval=1025834121 TSecr=1025834121"
"206","88.033962567","127.0.0.1","127.0.0.1","TCP","106","44994  >  5001 [PSH, ACK] Seq=3521 Ack=1 Win=65536 Len=40 TSval=1025835121 TSecr=1025834121"
"207","88.034045725","127.0.0.1","127.0.0.1","TCP","66","5001  >  44994 [ACK] Seq=1 Ack=3561 Win=65536 Len=0 TSval=1025835122 TSecr=1025835121"
"208","89.034453037","127.0.0.1","127.0.0.1","TCP","106","44994  >  5001 [PSH, ACK] Seq=3561 Ack=1 Win=65536 Len=40 TSval=1025836122 TSecr=1025835122"
"209","89.034494960","127.0.0.1","127.0.0.1","TCP","66","5001  >  44994 [ACK] Seq=1 Ack=3601 Win=65536 Len=0 TSval=1025836122 TSecr=1025836122"
"210","90.034785595","127.0.0.1","127.0.0.1","TCP","106","44994  >  5001 [PSH, ACK] Seq=3601 Ack=1 Win=65536 Len=40 TSval=1025837122 TSecr=1025836122"
"211","90.034815841","127.0.0.1","127.0.0.1","TCP","66","5001  >  44994 [ACK] Seq=1 Ack=3641 Win=65536 Len=0 TSval=1025837122 TSecr=1025837122"
"212","91.035194189","127.0.0.1","127.0.0.1","TCP","106","44994  >  5001 [PSH, ACK] Seq=3641 Ack=1 Win=65536 Len=40 TSval=1025838123 TSecr=1025837122"
"213","91.035250239","127.0.0.1","127.0.0.1","TCP","66","5001  >  44994 [ACK] Seq=1 Ack=3681 Win=65536 Len=0 TSval=1025838123 TSecr=1025838123"
"214","92.035599792","127.0.0.1","127.0.0.1","TCP","106","44994  >  5001 [PSH, ACK] Seq=3681 Ack=1 Win=65536 Len=40 TSval=1025839123 TSecr=1025838123"
"215","92.035641203","127.0.0.1","127.0.0.1","TCP","66","5001  >  44994 [ACK] Seq=1 Ack=3721 Win=65536 Len=0 TSval=1025839123 TSecr=1025839123"
"216","93.036034222","127.0.0.1","127.0.0.1","TCP","106","44994  >  5001 [PSH, ACK] Seq=3721 Ack=1 Win=65536 Len=40 TSval=1025840124 TSecr=1025839123"
"217","93.036068000","127.0.0.1","127.0.0.1","TCP","66","5001  >  44994 [ACK] Seq=1 Ack=3761 Win=65536 Len=0 TSval=1025840124 TSecr=1025840124"
"218","94.036410697","127.0.0.1","127.0.0.1","TCP","106","44994  >  5001 [PSH, ACK] Seq=3761 Ack=1 Win=65536 Len=40 TSval=1025841124 TSecr=1025840124"
"219","94.036450853","127.0.0.1","127.0.0.1","TCP","66","5001  >  44994 [ACK] Seq=1 Ack=3801 Win=65536 Len=0 TSval=1025841124 TSecr=1025841124"
"220","95.036743317","127.0.0.1","127.0.0.1","TCP","106","44994  >  5001 [PSH, ACK] Seq=3801 Ack=1 Win=65536 Len=40 TSval=1025842124 TSecr=1025841124"
"221","95.036780250","127.0.0.1","127.0.0.1","TCP","66","5001  >  44994 [ACK] Seq=1 Ack=3841 Win=65536 Len=0 TSval=1025842124 TSecr=1025842124"
"222","96.037223530","127.0.0.1","127.0.0.1","TCP","106","44994  >  5001 [PSH, ACK] Seq=3841 Ack=1 Win=65536 Len=40 TSval=1025843125 TSecr=1025842124"
"223","96.037271298","127.0.0.1","127.0.0.1","TCP","66","5001  >  44994 [ACK] Seq=1 Ack=3881 Win=65536 Len=0 TSval=1025843125 TSecr=1025843125"
"224","97.037645418","127.0.0.1","127.0.0.1","TCP","106","44994  >  5001 [PSH, ACK] Seq=3881 Ack=1 Win=65536 Len=40 TSval=1025844125 TSecr=1025843125"
"225","97.037683713","127.0.0.1","127.0.0.1","TCP","66","5001  >  44994 [ACK] Seq=1 Ack=3921 Win=65536 Len=0 TSval=1025844125 TSecr=1025844125"
"226","98.038130917","127.0.0.1","127.0.0.1","TCP","106","44994  >  5001 [PSH, ACK] Seq=3921 Ack=1 Win=65536 Len=40 TSval=1025845126 TSecr=1025844125"
"227","98.038175488","127.0.0.1","127.0.0.1","TCP","66","5001  >  44994 [ACK] Seq=1 Ack=3961 Win=65536 Len=0 TSval=1025845126 TSecr=1025845126"
"228","99.038470560","127.0.0.1","127.0.0.1","TCP","106","44994  >  5001 [PSH, ACK] Seq=3961 Ack=1 Win=65536 Len=40 TSval=1025846126 TSecr=1025845126"
"229","99.038516674","127.0.0.1","127.0.0.1","TCP","66","5001  >  44994 [ACK] Seq=1 Ack=4001 Win=65536 Len=0 TSval=1025846126 TSecr=1025846126"
"230","100.038785542","127.0.0.1","127.0.0.1","TCP","106","44994  >  5001 [PSH, ACK] Seq=4001 Ack=1 Win=65536 Len=40 TSval=1025847126 TSecr=1025846126"
"231","100.038824768","127.0.0.1","127.0.0.1","TCP","66","5001  >  44994 [ACK] Seq=1 Ack=4041 Win=65536 Len=0 TSval=1025847126 TSecr=1025847126"
"232","101.039208041","127.0.0.1","127.0.0.1","TCP","106","44994  >  5001 [PSH, ACK] Seq=4041 Ack=1 Win=65536 Len=40 TSval=1025848127 TSecr=1025847126"
"233","101.039242350","127.0.0.1","127.0.0.1","TCP","66","5001  >  44994 [ACK] Seq=1 Ack=4081 Win=65536 Len=0 TSval=1025848127 TSecr=1025848127"
"234","102.039609954","127.0.0.1","127.0.0.1","TCP","82","44994  >  5001 [PSH, ACK] Seq=4081 Ack=1 Win=65536 Len=16 TSval=1025849127 TSecr=1025848127"
"235","102.039654217","127.0.0.1","127.0.0.1","TCP","66","5001  >  44994 [ACK] Seq=1 Ack=4097 Win=65536 Len=0 TSval=1025849127 TSecr=1025849127"
"236","103.040157735","127.0.0.1","127.0.0.1","TCP","66","44994  >  5001 [FIN, ACK] Seq=4097 Ack=1 Win=65536 Len=0 TSval=1025850128 TSecr=1025849127"
"237","103.040567760","127.0.0.1","127.0.0.1","TCP","66","5001  >  44994 [FIN, ACK] Seq=1 Ack=4098 Win=65536 Len=0 TSval=1025850128 TSecr=1025850128"
"238","103.040630937","127.0.0.1","127.0.0.1","TCP","66","44994  >  5001 [ACK] Seq=4098 Ack=2 Win=65536 Len=0 TSval=1025850128 TSecr=1025850128"
